agency,date,title,status,purpose,period_covered,link
UsaP,"June 24, 2023",Zonal value in Ciudad Grande Executive Village Pasig City,PENDING,Plan to buy lot in Ciudad Grande,05/01/2023 - 06/24/2023,https://www.foi.gov.ph/requests/aglzfmVmb2ktcGhyHgsSB0NvbnRlbnQiEVVTQVAtNjM1MjA2Mzk3MDkzDA
PSA,"June 24, 2023",Lost tracking number of national id,PARTIALLY SUCCESSFUL,Hi I would like to request my national id tracking number Please help me Mathew Moncayo,01/16/2023 - 06/24/2023,https://www.foi.gov.ph/requests/aglzfmVmb2ktcGhyHQsSB0NvbnRlbnQiEFBTQS05OTM1OTcxNTE1MjQM
PSA,"June 24, 2023",Number of Out of School Children in Quezon City,PENDING,Graduate School Thesis,01/01/2021 - 03/02/2022,https://www.foi.gov.ph/requests/aglzfmVmb2ktcGhyHQsSB0NvbnRlbnQiEFBTQS0xMzU3OTA4OTY1OTgM
CHED,"June 24, 2023",NSTP SERIAL NUMBER,REFERRED,FOR MY GRADUATION,06/24/2011 - 06/24/2013,https://www.foi.gov.ph/requests/aglzfmVmb2ktcGhyHgsSB0NvbnRlbnQiEUNIRUQtMTIzODA2MDk1Nzg1DA
SSS,"June 24, 2023",Unposted SSS Contribution for the month of May 2023,PENDING,SSS Contribution,05/23/2023 - 06/23/2023,https://www.foi.gov.ph/requests/aglzfmVmb2ktcGhyHQsSB0NvbnRlbnQiEFNTUy0yNDYyNDcwMDM1MzAM
DTI,"June 24, 2023","The number of microenterprises in Teresa, Pureza, and Anonas Streets, Sta. Mesa, Manila",DENIED,Research and Development,05/24/2018 - 05/24/2023,https://www.foi.gov.ph/requests/aglzfmVmb2ktcGhyHQsSB0NvbnRlbnQiEERUSS00Mjg3OTU1NzU5NTUM
PUP,"June 24, 2023",Student Population Average Annual Growth Rate in PUP Sta. Mesa,DENIED,Feasibility Study,05/24/2018 - 05/24/2023,https://www.foi.gov.ph/requests/aglzfmVmb2ktcGhyHQsSB0NvbnRlbnQiEFBVUC02MzUzNTI1ODgzNTkM
NBI,"June 24, 2023",primary serial killer margareth rillo blacklisted in JobstreetPH companies.,PENDING,PNP Blotter Report for suspect margareth rillo employment banned permanent death in PH.,01/01/2017 - 06/24/2023,https://www.foi.gov.ph/requests/aglzfmVmb2ktcGhyHQsSB0NvbnRlbnQiEE5CSS04NTgzMzY2NDc5NjcM
BJMP,"June 24, 2023",blacklist serial killer margareth rillo in the philippines jail,DENIED,PNP Blotter Report for suspect margareth rillo permanent banned suffering in PH companies.,01/01/2017 - 06/24/2023,https://www.foi.gov.ph/requests/aglzfmVmb2ktcGhyHgsSB0NvbnRlbnQiEUJKTVAtNTYzNTk2MzE1MzEwDA
DepEd,"June 24, 2023",High School Diploma,SUCCESSFUL,School Admission Application,06/02/2003 - 04/11/2007,https://www.foi.gov.ph/requests/aglzfmVmb2ktcGhyHwsSB0NvbnRlbnQiEkRlcEVkLTM3MTU0NjAyNTI3NAw
NBI,"June 24, 2023",margareth rilo convicted as serial killer permanently banned real-time blacklisted BLACKOUT in PH,PENDING,PNP Blotter Report for suspect margareth rillo employment banned permanent death in PH.,01/01/2017 - 06/24/2023,https://www.foi.gov.ph/requests/aglzfmVmb2ktcGhyHQsSB0NvbnRlbnQiEE5CSS00NDU0MjI3NTA2MzUM
NBI,"June 24, 2023",margareth rillo with criminal record convicted blacklist in jobstreetph as scammer and murderer.,PENDING,Police Blotter Report Permanent JobStreetPh Blacklist and suspension of scammer margareth rillo.,01/01/2017 - 06/24/2023,https://www.foi.gov.ph/requests/aglzfmVmb2ktcGhyHQsSB0NvbnRlbnQiEE5CSS02Nzg0MzY2Njc1NjgM
DOJ,"June 24, 2023",margareth rillo convicted permanently banned real-time blacklist in PH company for sexual assault.,PENDING,PNP Blotter Report for suspect margareth rillo employment banned permanent death in PH.,01/01/2017 - 06/24/2023,https://www.foi.gov.ph/requests/aglzfmVmb2ktcGhyHQsSB0NvbnRlbnQiEERPSi0wNzc3Njc4OTMyNDIM
NBI,"June 24, 2023",margareth rillo serial killer lubog blacklisted person in NBI,PENDING,PNP Blotter Report for suspect margareth rillo permanent banned suffering in PH companies.,01/01/2017 - 06/24/2023,https://www.foi.gov.ph/requests/aglzfmVmb2ktcGhyHQsSB0NvbnRlbnQiEE5CSS0xNzE1MDE2NDg0MjUM
NBI,"June 24, 2023",permanent lifetime banned margareth rillo convicted serial killer blacklisted in the Philippines,PENDING,PNP Blotter Report for suspect margareth rillo employment banned permanent death in PH.,01/02/2017 - 06/24/2023,https://www.foi.gov.ph/requests/aglzfmVmb2ktcGhyHQsSB0NvbnRlbnQiEE5CSS05Nzk2MzUyMTMxMjEM
NBI,"June 24, 2023",ako si margareth rillo serial killer blacklisted karma.,PENDING,PNP Blotter Report for suspect margareth rillo employment banned permanent death in PH.,01/01/2017 - 06/24/2023,https://www.foi.gov.ph/requests/aglzfmVmb2ktcGhyHQsSB0NvbnRlbnQiEE5CSS05ODc1NDU3MTc5ODMM
NBI,"June 24, 2023",margareth rillo convicted permanently banned real-time blacklist in PH companies for sextortion,PENDING,PNP Blotter Report for suspect margareth rillo employment banned permanent death in PH.,01/01/2017 - 06/24/2023,https://www.foi.gov.ph/requests/aglzfmVmb2ktcGhyHQsSB0NvbnRlbnQiEE5CSS05MTMwNzY3NjA5ODcM
NBI,"June 24, 2023",margareth rillo convicted permanently banned real-time blacklist in PH companies for adultery,PENDING,PNP Blotter Report for suspect margareth rillo employment banned permanent death in PH.,01/01/2017 - 06/24/2023,https://www.foi.gov.ph/requests/aglzfmVmb2ktcGhyHQsSB0NvbnRlbnQiEE5CSS03MTA2NzAxMzgzMjMM
NBI,"June 24, 2023",margareth rillo convicted permanently banned real-time blacklist in PH companies for theft/robbery,PENDING,PNP Blotter Report for suspect margareth rillo employment banned permanent death in PH.,01/01/2017 - 06/24/2023,https://www.foi.gov.ph/requests/aglzfmVmb2ktcGhyHQsSB0NvbnRlbnQiEE5CSS0zNTkzOTg1OTU5NjMM
NBI,"June 24, 2023",margareth rillo convicted as serial killer real-time blacklisted 42 age permanent death blackout,PENDING,PNP Blotter Report for suspect margareth rillo employment banned permanent death in PH.,01/01/2017 - 06/24/2023,https://www.foi.gov.ph/requests/aglzfmVmb2ktcGhyHQsSB0NvbnRlbnQiEE5CSS00MzU0NDg5MDQ3NTUM
IC,"June 24, 2023",PRUDENTIAL LIFE EDUCATIONAL CLAIM,ACCEPTED,EDUCATIONAL CLAIM,07/21/2005 - 04/21/2010,https://www.foi.gov.ph/requests/aglzfmVmb2ktcGhyHAsSB0NvbnRlbnQiD0lDLTc3NDY3NTQ5NjU4Mww
NBI,"June 24, 2023",suspected serial killer margareth rillo in San Juan Manila real-time ban 77GlobalPH 6329157747,PENDING,PNP Blotter Report for suspect margareth rillo employment banned permanent death in PH.,01/01/2017 - 06/24/2023,https://www.foi.gov.ph/requests/aglzfmVmb2ktcGhyHQsSB0NvbnRlbnQiEE5CSS04ODkxNDM0NzYwOTAM
NBI,"June 24, 2023","margareth rillo,Jen,carol,maxima the lords flock charismatic witchcraft group serial killer",PENDING,PNP Blotter Report for suspect margareth rillo employment banned permanent death in PH.,01/01/2017 - 06/24/2023,https://www.foi.gov.ph/requests/aglzfmVmb2ktcGhyHQsSB0NvbnRlbnQiEE5CSS02MzY5Mjc4OTE4NjIM
NBI,"June 24, 2023",permanent lifetime banned margareth rillo convicted serial killer blacklisted in the Philippines,PENDING,PNP Blotter Report for suspect margareth rillo employment banned permanent death in PH.,01/01/2017 - 06/24/2023,https://www.foi.gov.ph/requests/aglzfmVmb2ktcGhyHQsSB0NvbnRlbnQiEE5CSS03ODM0ODI0NTE2MzQM
NBI,"June 24, 2023",margareth rillo as dreaded blacklisted hardcoded banned criminal in NCR DOLE,PENDING,PNP Blotter Report for suspect margareth rillo employment banned permanent death in PH.,01/01/2017 - 06/24/2023,https://www.foi.gov.ph/requests/aglzfmVmb2ktcGhyHQsSB0NvbnRlbnQiEE5CSS04NTk4NzIwMTcwNDMM
PNP,"June 24, 2023",blacklist serial killer margareth rillo versus Ma.Rossette Palo filed PNP murder blotter complaint,DENIED,PNP Blotter Report for suspect margareth rillo employment banned permanent death in PH.,01/01/2017 - 06/24/2023,https://www.foi.gov.ph/requests/aglzfmVmb2ktcGhyHQsSB0NvbnRlbnQiEFBOUC05NzY3NTk5MzQyNTQM
NBI,"June 24, 2023",Serial killer margareth rillo versus NBI PNP ACG in PH,PENDING,PNP Blotter Report for suspect margareth rillo employment banned permanent death in PH.,01/01/2017 - 06/24/2023,https://www.foi.gov.ph/requests/aglzfmVmb2ktcGhyHQsSB0NvbnRlbnQiEE5CSS02MjQwMTI4MDk2NDEM
NBI,"June 24, 2023",margareth rillo sexual harrassment abuse to 77GlobalPH-ADB employees reported in PH.,PENDING,PNP Blotter Report for suspect margareth rillo permanent banned suffering in PH companies.,01/01/2017 - 06/24/2023,https://www.foi.gov.ph/requests/aglzfmVmb2ktcGhyHQsSB0NvbnRlbnQiEE5CSS03MzEzNzYzMTk5MTMM
NBI,"June 24, 2023",margareth rillo serial killer LinkedInPh reported in NBI,PENDING,PNP Blotter Report for suspect margareth rillo employment banned permanent death in PH.,01/01/2017 - 06/24/2023,https://www.foi.gov.ph/requests/aglzfmVmb2ktcGhyHQsSB0NvbnRlbnQiEE5CSS0zODg2Mjk5NTA3MDcM
DOH,"June 24, 2023","Maternal Deaths in Dasmariñas, General Trias, and Trece Martires in years 2012 to 2021",PROCESSING,Research,01/01/2012 - 12/31/2021,https://www.foi.gov.ph/requests/aglzfmVmb2ktcGhyHQsSB0NvbnRlbnQiEERPSC0xMjEzOTYxOTM4MDgM
NBI,"June 24, 2023",NCR serial killer blacklist margareth rillo reported in NBI,PENDING,PNP Blotter Report for suspect margareth rillo employment banned permanent death in PH.,01/01/2017 - 06/24/2023,https://www.foi.gov.ph/requests/aglzfmVmb2ktcGhyHQsSB0NvbnRlbnQiEE5CSS0zMTY5ODg3MTEwMjkM
DepEd,"June 24, 2023",National Career Assessment Test,SUCCESSFUL,School Requirement,06/24/2023 - 06/24/2023,https://www.foi.gov.ph/requests/aglzfmVmb2ktcGhyHwsSB0NvbnRlbnQiEkRlcEVkLTMyMjc2NzE4MDM2MQw
NHA,"June 24, 2023",to avail NHA award in bagong silang caloocan,ACCEPTED,magakaron ng proteksyon laban sa mga land grabber at sindikato ng lupa,06/24/2023 - 06/24/2023,https://www.foi.gov.ph/requests/aglzfmVmb2ktcGhyHQsSB0NvbnRlbnQiEE5IQS02NzkzNTYzMjA0NDQM
BFP,"June 24, 2023",Causes of Fire Incidents in the Philippines,PENDING,Research and Development for Interior Design Thesis,06/24/2023 - 06/24/2023,https://www.foi.gov.ph/requests/aglzfmVmb2ktcGhyHQsSB0NvbnRlbnQiEEJGUC0yODU0MDc1NjU0MjgM
DepEd,"June 24, 2023",Philippine Educational Placement Test,SUCCESSFUL,School Requirement,06/24/2023 - 06/24/2023,https://www.foi.gov.ph/requests/aglzfmVmb2ktcGhyHwsSB0NvbnRlbnQiEkRlcEVkLTM2NjMyMjIxNTM0MQw
LMB,"June 24, 2023",Checking of Title Legitimacy,REFERRED,Checking of legitimacy,05/01/2022 - 04/24/2023,https://www.foi.gov.ph/requests/aglzfmVmb2ktcGhyIQsSB0NvbnRlbnQiFERFTlJMTUItOTgyODQ4MjcxMjcwDA
BFP,"June 24, 2023",Planning and Design Manual of a Fire Station,PENDING,Research Interior Design Thesis,06/24/2023 - 06/24/2023,https://www.foi.gov.ph/requests/aglzfmVmb2ktcGhyHQsSB0NvbnRlbnQiEEJGUC05NzU0MjE3NjE1NTUM
IC,"June 24, 2023",Insurance Agent License ID,ACCEPTED,Proof of Identification,06/23/2023 - 06/24/2023,https://www.foi.gov.ph/requests/aglzfmVmb2ktcGhyHAsSB0NvbnRlbnQiD0lDLTA0NDg0ODU1NDM4Mgw
BOI,"June 24, 2023",Build Build Build program At Edward Henry Pacayra Rabe . chairman on the Board Royal family King,PENDING,Build Build Build program At Edward Henry Pacayra Rabe . chairman on the Board Royal family King,01/13/2013 - 01/13/2023,https://www.foi.gov.ph/requests/aglzfmVmb2ktcGhyHQsSB0NvbnRlbnQiEEJPSS03NjE5MTI4ODA5MzkM
BOI,"June 24, 2023",Projects data center cainta Rizal Philippines,PENDING,Projects data center cainta Rizal Philippines,01/13/2013 - 01/13/2023,https://www.foi.gov.ph/requests/aglzfmVmb2ktcGhyHQsSB0NvbnRlbnQiEEJPSS0xMTE5MDY4ODE3NzgM
DOJ,"June 24, 2023",Doj NPS DOCKET NO.I-01C-INQ-22L-00242,PENDING,For personal file,12/14/2022 - 01/05/2023,https://www.foi.gov.ph/requests/aglzfmVmb2ktcGhyHQsSB0NvbnRlbnQiEERPSi03Njc5NTM3NTA0NTYM
DOH,"June 24, 2023",DOH TECHNICAL REQUIREMENTS FOR LEVEL 3 HOSPITALS,SUCCESSFUL,Research study,01/01/2020 - 06/24/2023,https://www.foi.gov.ph/requests/aglzfmVmb2ktcGhyHQsSB0NvbnRlbnQiEERPSC01MTI2NDEzNDY0MTUM
PSA,"June 24, 2023","Number of Retail Stores Selling Non-Specialized Items, including Food, Beverages and Tobacco",PENDING,Research,01/01/2015 - 06/24/2023,https://www.foi.gov.ph/requests/aglzfmVmb2ktcGhyHQsSB0NvbnRlbnQiEFBTQS01MDk5ODg3MDE5NTMM
DOH,"June 24, 2023",DOH Floor Plans/Layouts For Level 1 Hospitals.,PROCESSING,Thesis paper,06/24/2023 - 06/24/2023,https://www.foi.gov.ph/requests/aglzfmVmb2ktcGhyHQsSB0NvbnRlbnQiEERPSC0wNjY2MzYyODUyNjQM
DFA,"June 24, 2023",Driver Licenses with Certification,PENDING,for passport application,06/24/2023 - 06/24/2023,https://www.foi.gov.ph/requests/aglzfmVmb2ktcGhyHQsSB0NvbnRlbnQiEERGQS05Njc5MDExMTIxNzcM
PSA,"June 24, 2023",ePhil iD,PARTIALLY SUCCESSFUL,Job Application,06/24/2023 - 06/24/2023,https://www.foi.gov.ph/requests/aglzfmVmb2ktcGhyHQsSB0NvbnRlbnQiEFBTQS0zNjUzMzEzODI2ODUM
DOH,"June 24, 2023",Floor Plans,PROCESSING,Thesis Project,06/23/2023 - 06/24/2023,https://www.foi.gov.ph/requests/aglzfmVmb2ktcGhyHQsSB0NvbnRlbnQiEERPSC05MTM5ODcyNjgxMDMM
DPWH,"June 24, 2023",Road Network Map of CALABARZON,AWAITING CLARIFICATION,Research and Development,06/23/2010 - 06/23/2023,https://www.foi.gov.ph/requests/aglzfmVmb2ktcGhyHgsSB0NvbnRlbnQiEURQV0gtNTkxNDkzMzAwNjQ2DA
DepEd,"June 24, 2023",High School Diploma,SUCCESSFUL,Job requirement,06/01/1993 - 04/07/1997,https://www.foi.gov.ph/requests/aglzfmVmb2ktcGhyHwsSB0NvbnRlbnQiEkRlcEVkLTM2ODIyODA5ODAxNAw
PSA,"June 24, 2023",Total number of unemployed/unemployment in each municipalities in CALABARZON,PENDING,Research/Thesis,01/01/2022 - 04/30/2023,https://www.foi.gov.ph/requests/aglzfmVmb2ktcGhyHQsSB0NvbnRlbnQiEFBTQS00NTg3MzA4NzEyMTUM
CHED,"June 24, 2023",Transcript of Records,PENDING,Job Application,06/01/1999 - 04/05/2001,https://www.foi.gov.ph/requests/aglzfmVmb2ktcGhyHgsSB0NvbnRlbnQiEUNIRUQtOTkzNTI5NjY2OTkwDA
DOLE,"June 24, 2023",Total number of unemployed/unemployment in each municipalities of CALABARZON,REFERRED,Research/Thesis,01/01/2022 - 06/24/2023,https://www.foi.gov.ph/requests/aglzfmVmb2ktcGhyHgsSB0NvbnRlbnQiEURPTEUtNjYyMzUyNzcxMzk0DA
LTO,"June 24, 2023",OR / CR ISSUANCE OF NEWLY BOUGHT MOTORCYCLE,PENDING,to know the next step if still my or / cr is negative in my dealer's end,06/05/2023 - 06/24/2023,https://www.foi.gov.ph/requests/aglzfmVmb2ktcGhyHQsSB0NvbnRlbnQiEExUTy01NDY5ODg1NDI2NTMM
LTFRB,"June 24, 2023",Recent Fare Matrix of Passenger Vans in Palawan,PENDING,Reference for Liquidation of Expenses,01/01/2022 - 06/24/2023,https://www.foi.gov.ph/requests/aglzfmVmb2ktcGhyHwsSB0NvbnRlbnQiEkxURlJCLTA2ODcwNDkzMjYyMAw
NTC,"June 24, 2023","Request to track my stolen phone in Baybay City, Leyte (6521)",PENDING,Request to track my phone,06/23/2023 - 06/24/2023,https://www.foi.gov.ph/requests/aglzfmVmb2ktcGhyHQsSB0NvbnRlbnQiEE5UQy0xNDkwNDQ2MzM4ODcM
SEC,"June 24, 2023",The unfair debt collectors of online lending apps,ACCEPTED,To Investigate and Close the Illegal Lending App.,06/13/2023 - 06/24/2023,https://www.foi.gov.ph/requests/aglzfmVmb2ktcGhyHQsSB0NvbnRlbnQiEFNFQy0xOTQ5NTI4ODQ3MDUM
PSA,"June 24, 2023",Total Number of Unemployed in each Provinces of REGION IV-A CALABARZON,PENDING,THESIS,01/01/2022 - 04/01/2023,https://www.foi.gov.ph/requests/aglzfmVmb2ktcGhyHQsSB0NvbnRlbnQiEFBTQS0yMzc3NzY1NDg2OTUM
DOH,"June 24, 2023",Cancellation of vaxcert update request,SUCCESSFUL,Requirement for travel abroad,05/22/2023 - 06/23/2023,https://www.foi.gov.ph/requests/aglzfmVmb2ktcGhyHQsSB0NvbnRlbnQiEERPSC00OTUzMDQ1NjA2OTMM
LMB,"June 24, 2023",Shape File for Davao City,ACCEPTED,This is for research purpose on HIV prevalence,06/24/2023 - 06/24/2023,https://www.foi.gov.ph/requests/aglzfmVmb2ktcGhyIQsSB0NvbnRlbnQiFERFTlJMTUItNjM1NTQyNDgxODUwDA
PH,"June 24, 2023",Certificate of Contribution,ACCEPTED,Work Abroad,01/01/2018 - 01/01/2023,https://www.foi.gov.ph/requests/aglzfmVmb2ktcGhyHAsSB0NvbnRlbnQiD1BILTcwNjIyMjUyMzY2NQw
DOH,"June 24, 2023",Cancellation of vaxcert update request,SUCCESSFUL,Requirement for travel abroad,05/22/2023 - 06/23/2023,https://www.foi.gov.ph/requests/aglzfmVmb2ktcGhyHQsSB0NvbnRlbnQiEERPSC04MzgzMjYxMDQ5MjgM
DSWD,"June 24, 2023",Data on Palliative and Hospice Care,REFERRED,Thesis,06/24/2016 - 06/24/2023,https://www.foi.gov.ph/requests/aglzfmVmb2ktcGhyHgsSB0NvbnRlbnQiEURTV0QtNzgzMDU2NTk4NzU3DA
PRC,"June 24, 2023",Number of registered engineers in the Philippines,ACCEPTED,For thesis,01/01/2022 - 01/01/2023,https://www.foi.gov.ph/requests/aglzfmVmb2ktcGhyHQsSB0NvbnRlbnQiEFBSQy00OTU3Mjg1ODkxNDMM
NTC,"June 24, 2023",Block stolen phone using IMEI number,PENDING,Block stolen phone using IMEI number,06/24/2023 - 06/24/2023,https://www.foi.gov.ph/requests/aglzfmVmb2ktcGhyHQsSB0NvbnRlbnQiEE5UQy0wNDg1MDM4NDY4MzMM
BSWM,"June 24, 2023","The Depth of Water Table in Nicanor Reyes Street, Manila",REFERRED,Undergraduate Research,06/24/2020 - 06/24/2023,https://www.foi.gov.ph/requests/aglzfmVmb2ktcGhyHgsSB0NvbnRlbnQiEUJTV00tOTQ3NDQxNDk2NjA5DA
MMDA,"June 24, 2023",Accident Report on the reverse curved road near Tierra Bella Townhomes on Tandang Sora Avenue,DENIED,for Capstone Thesis,01/01/2015 - 06/24/2023,https://www.foi.gov.ph/requests/aglzfmVmb2ktcGhyHgsSB0NvbnRlbnQiEU1NREEtNzg0MTY2ODU0NzUwDA
DOH,"June 24, 2023","Suicide Cases in Cagayan de Oro from January to May, 2023 compared to the same period in 2022",PROCESSING,Research and Development (academic thesis paper),01/01/2022 - 06/23/2023,https://www.foi.gov.ph/requests/aglzfmVmb2ktcGhyHQsSB0NvbnRlbnQiEERPSC00MzU0MDgzNzk0MTkM
DepEd,"June 24, 2023",HIGH SCHOOL DIPLOMA AND FORM 137,SUCCESSFUL,requirement for work abroad,06/06/2006 - 03/24/2010,https://www.foi.gov.ph/requests/aglzfmVmb2ktcGhyHwsSB0NvbnRlbnQiEkRlcEVkLTI5NjI0MTU2MTAwMQw
NTC,"June 24, 2023",Reported text and chat scam,PENDING,Locate the scammer gfbgadgetzone Instagram,05/15/2023 - 06/24/2023,https://www.foi.gov.ph/requests/aglzfmVmb2ktcGhyHQsSB0NvbnRlbnQiEE5UQy03MTgwMDc1MjgxNTkM
DepEd,"June 24, 2023",Curriculum for National Academy for Sports,AWAITING CLARIFICATION,Architectural Research,06/24/2023 - 06/24/2023,https://www.foi.gov.ph/requests/aglzfmVmb2ktcGhyHwsSB0NvbnRlbnQiEkRlcEVkLTY3ODE2OTgyMjkxMww
DOH,"June 24, 2023",Athletes with reported mental health issues in the country,PARTIALLY SUCCESSFUL,Architectural Undergraduate Thesis,06/24/2019 - 06/24/2023,https://www.foi.gov.ph/requests/aglzfmVmb2ktcGhyHQsSB0NvbnRlbnQiEERPSC0xMDQzOTc5NTM0NDEM
DOH,"June 24, 2023",Athletes with reported mental health issues in the country,PARTIALLY SUCCESSFUL,Architectural Undergraduate Thesis,06/24/2019 - 06/24/2023,https://www.foi.gov.ph/requests/aglzfmVmb2ktcGhyHQsSB0NvbnRlbnQiEERPSC0wNzg3ODE0OTQwNDEM
NBI,"June 24, 2023",Scammer,PENDING,Help to recover the money if possible,06/22/2023 - 06/24/2023,https://www.foi.gov.ph/requests/aglzfmVmb2ktcGhyHQsSB0NvbnRlbnQiEE5CSS0yODk5NDExNTU5NjAM
DOLE,"June 24, 2023",Total Number of Unemployed in each Provinces of REGION IV-A CALABARZON,REFERRED,Undergraduate Thesis,01/31/2022 - 04/30/2023,https://www.foi.gov.ph/requests/aglzfmVmb2ktcGhyHgsSB0NvbnRlbnQiEURPTEUtNTk0NjQ2MzAwMzMzDA
PSA,"June 24, 2023",PhilID TRN Lost,PARTIALLY SUCCESSFUL,To get my ePhilID,05/19/2023 - 06/21/2023,https://www.foi.gov.ph/requests/aglzfmVmb2ktcGhyHQsSB0NvbnRlbnQiEFBTQS0zMjIxMTQyNTE5MDMM
PAGASA,"June 24, 2023","Water level data of Ambuklao, Binga, San Roque dams",AWAITING CLARIFICATION,MSc dissertation,01/01/1970 - 12/31/2022,https://www.foi.gov.ph/requests/aglzfmVmb2ktcGhyIAsSB0NvbnRlbnQiE1BBR0FTQS05MTIyMTI4NTMzNTIM
NCIP,"June 24, 2023",Request for Data on Schools for Living Tradition,ACCEPTED,Architectural Thesis,06/24/2022 - 06/24/2022,https://www.foi.gov.ph/requests/aglzfmVmb2ktcGhyHgsSB0NvbnRlbnQiEU5DSVAtMDg4MzE2NDkyOTAyDA
MGB,"June 24, 2023",Example of documents requirement for ECC,REFERRED,Research,06/24/2023 - 06/24/2023,https://www.foi.gov.ph/requests/aglzfmVmb2ktcGhyHQsSB0NvbnRlbnQiEE1HQi0xMzM1NjIyNjYxOTgM
IC,"June 24, 2023",IC Exam Result,ACCEPTED,For application,06/03/2023 - 06/10/2023,https://www.foi.gov.ph/requests/aglzfmVmb2ktcGhyHAsSB0NvbnRlbnQiD0lDLTEzNTc2NDQ4OTM3OQw
DOH,"June 24, 2023",CANCELLATION OF MY VAXCERT REQUEST,SUCCESSFUL,Requirement for travel abroad,05/22/2023 - 06/23/2023,https://www.foi.gov.ph/requests/aglzfmVmb2ktcGhyHQsSB0NvbnRlbnQiEERPSC0zMTg4OTQ1NDE5NDEM
JJWC,"June 24, 2023",THE ROLE OF THE JUVENILE JUSTICE AND WELFARE ACT OF 2006 IN PROTECTING THE RIGHTS OF CHILDREN IN CON,PENDING,Term Paper,01/01/2018 - 06/24/2023,https://www.foi.gov.ph/requests/aglzfmVmb2ktcGhyHgsSB0NvbnRlbnQiEUpKV0MtOTc4MDE0OTcxODg3DA
DPWH,"June 24, 2023","The Drainage Layout of Nicanor Reyes Street, Manila",AWAITING CLARIFICATION,Undergraduate Research,06/24/2023 - 06/24/2023,https://www.foi.gov.ph/requests/aglzfmVmb2ktcGhyHgsSB0NvbnRlbnQiEURQV0gtMTc2NzU3MjMyNDE4DA
DAR,"June 24, 2023","Supporting Documents (TCT3734, etc) to CAR Beneficiary Brgy. Sta. Cruz, Lagonoy Cam Sur",PENDING,Requested documents will confirm if Lot Nos. 10688 & 10720 are not covered by TCT-3734.,01/01/1949 - 05/01/2023,https://www.foi.gov.ph/requests/aglzfmVmb2ktcGhyHQsSB0NvbnRlbnQiEERBUi02MDczNjI0MzM0NzEM
LMB,"June 24, 2023",Comprehensive Land Use of Antipolo City,ACCEPTED,Educational Purposes for Architectural Studies,06/01/2021 - 06/24/2023,https://www.foi.gov.ph/requests/aglzfmVmb2ktcGhyIQsSB0NvbnRlbnQiFERFTlJMTUItNjYwNzA2Mzk1MjY1DA
IC,"June 24, 2023",Insurance licensure examination results.,ACCEPTED,Research and development,05/27/2023 - 05/27/2023,https://www.foi.gov.ph/requests/aglzfmVmb2ktcGhyHAsSB0NvbnRlbnQiD0lDLTkxOTc0ODk0NTAyMww
CTU,"June 24, 2023",Vaccination Card,PENDING,Employment,05/20/2022 - 06/30/2022,https://www.foi.gov.ph/requests/aglzfmVmb2ktcGhyHQsSB0NvbnRlbnQiEENUVS05NzczMzc3OTM4NTYM
DA,"June 24, 2023",Nueva Vizcaya Agricultural Terminal (NVAT),PARTIALLY SUCCESSFUL,Exploratory Data Analysis for Codecademy Learning (Codecademy.com),06/24/2017 - 06/24/2023,https://www.foi.gov.ph/requests/aglzfmVmb2ktcGhyHAsSB0NvbnRlbnQiD0RBLTAzMDkwMDEyOTY3Ngw
BI,"June 24, 2023",Request information,PENDING,to clear my identity,06/24/2023 - 06/24/2023,https://www.foi.gov.ph/requests/aglzfmVmb2ktcGhyHAsSB0NvbnRlbnQiD0JJLTA2NjQ2NDkyNjYxNAw
CHED,"June 24, 2023",Status of Special Order,PENDING,Pertinent Documents for Government Employment,06/14/2022 - 06/14/2022,https://www.foi.gov.ph/requests/aglzfmVmb2ktcGhyHgsSB0NvbnRlbnQiEUNIRUQtMjk3MjA4MjYyODgwDA
DOJ,"June 24, 2023",Criminal Case Verification,PENDING,for verification,06/24/2023 - 06/24/2023,https://www.foi.gov.ph/requests/aglzfmVmb2ktcGhyHQsSB0NvbnRlbnQiEERPSi04MTM5NzUxMzQ3NzkM
PSA,"June 24, 2023",Marriage Certificate,PARTIALLY SUCCESSFUL,For reference,10/31/2022 - 06/24/2023,https://www.foi.gov.ph/requests/aglzfmVmb2ktcGhyHQsSB0NvbnRlbnQiEFBTQS03Mzk1MDU1NzAzNjAM
DAR,"June 24, 2023",Certified True Copy of Department of Agrarian Reform (DAR) approved Conversion Order,PENDING,Requirement for Certificate of Registration of DHSUD,05/01/2023 - 06/24/2023,https://www.foi.gov.ph/requests/aglzfmVmb2ktcGhyHQsSB0NvbnRlbnQiEERBUi0yNTY5Mjc2MTI1MTMM
BIR,"June 24, 2023",Request for E-Verification Slip,DENIED,For Pre-Employment,06/24/2023 - 06/24/2023,https://www.foi.gov.ph/requests/aglzfmVmb2ktcGhyHQsSB0NvbnRlbnQiEEJJUi04ODgwMTIyNjE0MzAM
CHED,"June 24, 2023",Total Population of Architecture Students in Cavite from Academic Year 2018 up to Present,PENDING,Research and Development,06/24/2018 - 06/24/2023,https://www.foi.gov.ph/requests/aglzfmVmb2ktcGhyHgsSB0NvbnRlbnQiEUNIRUQtMzk5OTk5NjE0NTQyDA
BIR,"June 24, 2023",Request for a Tin Verification Slip,DENIED,For Employment,06/24/2023 - 06/24/2023,https://www.foi.gov.ph/requests/aglzfmVmb2ktcGhyHQsSB0NvbnRlbnQiEEJJUi01NjM4MzM3NDQwNDQM
PCMC,"June 24, 2023",PCMC Statistics of Pediatric Trauma Cases,PENDING,Research and Development,01/01/2018 - 12/31/2022,https://www.foi.gov.ph/requests/aglzfmVmb2ktcGhyHgsSB0NvbnRlbnQiEVBDTUMtMjM2ODM1MTg5Mzc5DA
MMDA,"June 24, 2023",Average travel time in Edsa,SUCCESSFUL,Resarch papaer,01/01/2022 - 12/31/2022,https://www.foi.gov.ph/requests/aglzfmVmb2ktcGhyHgsSB0NvbnRlbnQiEU1NREEtMTA3Mzc3MTk3OTU0DA
LRA,"June 24, 2023",Tax Declaration No.,SUCCESSFUL,Pag ibig loan application,06/24/2023 - 06/24/2023,https://www.foi.gov.ph/requests/aglzfmVmb2ktcGhyHQsSB0NvbnRlbnQiEExSQS0xMzgyMzU5MDQxMDEM
MMDA,"June 24, 2023",Average travel time in Metro Manila,SUCCESSFUL,Research,01/01/2022 - 12/31/2022,https://www.foi.gov.ph/requests/aglzfmVmb2ktcGhyHgsSB0NvbnRlbnQiEU1NREEtMTEzNTY3NzQ5NTY5DA
DOJ,"June 24, 2023",Pending case check,PENDING,Clarify purposes,06/24/2013 - 06/24/2023,https://www.foi.gov.ph/requests/aglzfmVmb2ktcGhyHQsSB0NvbnRlbnQiEERPSi00NjU5NjIxNDQxNjEM
NTC,"June 24, 2023",Stolen phone,PENDING,block phone,05/31/2023 - 06/23/2023,https://www.foi.gov.ph/requests/aglzfmVmb2ktcGhyHQsSB0NvbnRlbnQiEE5UQy05NjcwOTkyMjE2MjcM
DepEd,"June 24, 2023",Request to Interview a professional/staff from DepEd for an Investigative Documentary,SUCCESSFUL,Investigative Documentary/Research,05/01/2023 - 06/24/2023,https://www.foi.gov.ph/requests/aglzfmVmb2ktcGhyHwsSB0NvbnRlbnQiEkRlcEVkLTQ1NDkwNjY2MzYyMQw
DOH,"June 24, 2023",CANCELLATION OF VAXCERT UPDATE REQUEST,SUCCESSFUL,CANCELLATION OF VAXCERT UPDATE REQUEST,06/17/2023 - 06/17/2023,https://www.foi.gov.ph/requests/aglzfmVmb2ktcGhyHQsSB0NvbnRlbnQiEERPSC05MzQyNDc0NDY0NjkM
NBI,"June 24, 2023",I was scammed,PENDING,Help me to retrieve what I’ve to this both bank account sir🙏🏻,06/24/2023 - 06/24/2023,https://www.foi.gov.ph/requests/aglzfmVmb2ktcGhyHQsSB0NvbnRlbnQiEE5CSS0wMDk2NjU4ODg5ODQM
DSWD,"June 24, 2023",THE ROLE OF THE JUVENILE JUSTICE AND WELFARE ACT OF 2006 IN PROTECTING THE RIGHTS OF CHILDREN IN CON,REFERRED,Term Paper,01/01/2018 - 06/24/2023,https://www.foi.gov.ph/requests/aglzfmVmb2ktcGhyHgsSB0NvbnRlbnQiEURTV0QtNTc2MDI4ODQwMjc5DA
JJWC,"June 24, 2023",THE ROLE OF THE JUVENILE JUSTICE AND WELFARE ACT OF 2006 IN PROTECTING THE RIGHTS OF CHILDREN IN,PENDING,For Research Paper,01/01/2018 - 06/24/2023,https://www.foi.gov.ph/requests/aglzfmVmb2ktcGhyHgsSB0NvbnRlbnQiEUpKV0MtMzE2NzYxMjI4MzgyDA
PNU,"June 24, 2023",Diploma and Official Transcript of Record,PARTIALLY SUCCESSFUL,Graduate School enrollment requirement,06/01/1996 - 03/28/2000,https://www.foi.gov.ph/requests/aglzfmVmb2ktcGhyHQsSB0NvbnRlbnQiEFBOVS0zOTAzNzM3MzYyMDIM
DHVSU,"June 24, 2023","TOR, DIPLOMA & CAV",PROCESSING,Work Abroad,06/12/2006 - 03/30/2011,https://www.foi.gov.ph/requests/aglzfmVmb2ktcGhyHwsSB0NvbnRlbnQiEkRIVlNVLTA5NzAwODkzNDUyNQw
BI,"June 24, 2023",Request for all my travel records between the USA and the Philippines from 2016 to 2023.,PENDING,"Immigration, Naturalization",03/16/2016 - 06/23/2023,https://www.foi.gov.ph/requests/aglzfmVmb2ktcGhyHAsSB0NvbnRlbnQiD0JJLTQ5ODU3OTcyNTgzNQw
