agency,date,title,status,purpose,period_covered,link
DepEd,"November 08, 2022",Principals and their contact details for Tagaytay City Schools,AWAITING CLARIFICATION,For research purposes,01/01/2022 - 11/08/2022,https://www.foi.gov.ph/requests/aglzfmVmb2ktcGhyHwsSB0NvbnRlbnQiEkRlcEVkLTMyMzQ3MTE5NDUzMgw
DOJ,"November 08, 2022",Department Justice Case Documents,PENDING,Employment Background Check,11/08/2012 - 11/08/2022,https://www.foi.gov.ph/requests/aglzfmVmb2ktcGhyHQsSB0NvbnRlbnQiEERPSi02MzQ4MjE1MDE4NjEM
DOLE,"November 08, 2022",Number of light industry workers in batangas,REFERRED,thesis research,11/08/2018 - 11/08/2022,https://www.foi.gov.ph/requests/aglzfmVmb2ktcGhyHgsSB0NvbnRlbnQiEURPTEUtNTg0ODk3ODA2MjIwDA
DA,"November 08, 2022",Number of farmers in batangas,SUCCESSFUL,Architectural thesis development,11/08/2018 - 11/08/2022,https://www.foi.gov.ph/requests/aglzfmVmb2ktcGhyHAsSB0NvbnRlbnQiD0RBLTQzNTM3NzU0MDM4Ngw
PPSC,"November 08, 2022",Statistical Data of Trainees,PENDING,Architectural Design Thesis,11/08/2015 - 11/08/2022,https://www.foi.gov.ph/requests/aglzfmVmb2ktcGhyHgsSB0NvbnRlbnQiEVBQU0MtODY1MzIzMDU2MzM1DA
PSA,"November 08, 2022",Statistical Data of Criminology Students,PENDING,Architectural Design Thesis,11/08/2015 - 11/08/2022,https://www.foi.gov.ph/requests/aglzfmVmb2ktcGhyHQsSB0NvbnRlbnQiEFBTQS02NjExMjkyNjc4NjYM
NTC,"November 08, 2022",collection of Scam text messages in the Philippines,PENDING,Undergraduate research/ thesis,01/01/2022 - 11/08/2022,https://www.foi.gov.ph/requests/aglzfmVmb2ktcGhyHQsSB0NvbnRlbnQiEE5UQy05NjM1ODAxNTkwMzQM
PSA,"November 08, 2022","The total population of young professional residing in City of San Jose Del Monte, Bulacan",PENDING,Research and Development,01/01/2020 - 01/01/2022,https://www.foi.gov.ph/requests/aglzfmVmb2ktcGhyHQsSB0NvbnRlbnQiEFBTQS04MDU0MzMwMjUzNDAM
NBI,"November 08, 2022",TECK MINING (INVESTMENT SCAM),DENIED,To return my money and let other people know this kind of scam.,09/22/2022 - 11/08/2022,https://www.foi.gov.ph/requests/aglzfmVmb2ktcGhyHQsSB0NvbnRlbnQiEE5CSS0wOTY4ODgzODgwNTAM
DepEd,"November 08, 2022",Tor and Diploma,SUCCESSFUL,Apply work abroad,05/13/2012 - 11/08/2022,https://www.foi.gov.ph/requests/aglzfmVmb2ktcGhyHwsSB0NvbnRlbnQiEkRlcEVkLTU5NTQwMzE3MDA1MAw
CLWD,"November 08, 2022",Water bill,PENDING,For online payment,10/04/2022 - 11/03/2022,https://www.foi.gov.ph/requests/aglzfmVmb2ktcGhyHgsSB0NvbnRlbnQiEUNMV0QtNDg5MjMzMTUwNjc0DA
BatSU,"November 08, 2022","Production, Import, Export, Consumption Data of Ethylene Glycol in the Philippines",REFERRED,For market study of ethylene glycol for our plant design in BS ChE at Batangas State University,10/31/2022 - 11/08/2022,https://www.foi.gov.ph/requests/aglzfmVmb2ktcGhyHwsSB0NvbnRlbnQiEkJBVFNVLTMzMjQ4NDA3NjQ0NAw
DepEd,"November 08, 2022",Highschool Diploma and Form 137,SUCCESSFUL,It is for my Canadian college apication requirement,06/15/2004 - 03/25/2005,https://www.foi.gov.ph/requests/aglzfmVmb2ktcGhyHwsSB0NvbnRlbnQiEkRlcEVkLTUwOTE1MTU3NTg0Mww
NBI,"November 08, 2022",Identity Theft,DENIED,To catch the real culprit of my identity theft and scamming scheme,10/01/2022 - 11/08/2022,https://www.foi.gov.ph/requests/aglzfmVmb2ktcGhyHQsSB0NvbnRlbnQiEE5CSS04NTUzMDQ4NjE2NTQM
BLGF,"November 08, 2022",Local Treasury Operations Manual,ACCEPTED,as Reference,11/08/2022 - 11/08/2022,https://www.foi.gov.ph/requests/aglzfmVmb2ktcGhyHgsSB0NvbnRlbnQiEUJMR0YtNTM1MzY2ODI0ODIyDA
DOH,"November 08, 2022","Data for Brgy. Ibabang Dupay, Lucena City, Quezon",DENIED,For Research and Development,01/01/2021 - 10/31/2022,https://www.foi.gov.ph/requests/aglzfmVmb2ktcGhyHQsSB0NvbnRlbnQiEERPSC0xMjY1MTIxOTAxMTYM
DOH,"November 08, 2022","FDA: Regulation, Technical Specifications, and Registration of Alcohol Breath Analyzer (ABA)",DENIED,Second opinion and confirmation of initial opinion from the FDA.,01/01/2013 - 11/08/2022,https://www.foi.gov.ph/requests/aglzfmVmb2ktcGhyHQsSB0NvbnRlbnQiEERPSC04MzI2OTczMzMwMjIM
NAP,"November 08, 2022",Deed of Extrajudicial Settlement with Sale,PENDING,for legal reference,01/01/1996 - 12/29/1996,https://www.foi.gov.ph/requests/aglzfmVmb2ktcGhyHQsSB0NvbnRlbnQiEE5BUC01MDAyNzMyMjYxMjMM
IC,"November 08, 2022",Insurance Commission Exam Result,ACCEPTED,Insurance Commission Exam Result,10/22/2022 - 11/02/2022,https://www.foi.gov.ph/requests/aglzfmVmb2ktcGhyHAsSB0NvbnRlbnQiD0lDLTg0ODQ4NDM4MDI4Nww
PAGASA,"November 08, 2022",Weather Sensors,AWAITING CLARIFICATION,Research and Development,01/01/2010 - 11/05/2022,https://www.foi.gov.ph/requests/aglzfmVmb2ktcGhyIAsSB0NvbnRlbnQiE1BBR0FTQS04NDAwNTM4NDMxNTEM
NatMu,"November 08, 2022",FRANCISCO BALAGTAS LITERARY WORKS,PENDING,Architectural Research,11/08/2022 - 11/08/2022,https://www.foi.gov.ph/requests/aglzfmVmb2ktcGhyHwsSB0NvbnRlbnQiEk5hdE11LTUzMDAxNzA0NTUyOAw
LTFRB,"November 08, 2022",Data on Transport Fares,PENDING,Research and forecasting purposes,01/01/2018 - 11/08/2022,https://www.foi.gov.ph/requests/aglzfmVmb2ktcGhyHwsSB0NvbnRlbnQiEkxURlJCLTY2ODI2MTMxMjk1Mgw
DOH,"November 08, 2022",UPDATE VAX CERT,SUCCESSFUL,Requirements to travel abroad,10/30/2022 - 11/08/2022,https://www.foi.gov.ph/requests/aglzfmVmb2ktcGhyHQsSB0NvbnRlbnQiEERPSC04MTI2MzQwNzQwODMM
PSA,"November 08, 2022",Change of the address,PARTIALLY SUCCESSFUL,Work and School purposes,11/08/2022 - 11/08/2022,https://www.foi.gov.ph/requests/aglzfmVmb2ktcGhyHQsSB0NvbnRlbnQiEFBTQS02OTAwMDMwODMwMTIM
DTI,"November 08, 2022",Skill Gaps in Bulacan,REFERRED,Architectural Thesis,11/08/2022 - 11/08/2022,https://www.foi.gov.ph/requests/aglzfmVmb2ktcGhyHQsSB0NvbnRlbnQiEERUSS01NTA0MDY1OTUxNzkM
DICT,"November 08, 2022",DICT PEMEDES Accreditation Requirements,PENDING,for business,10/03/2022 - 11/08/2022,https://www.foi.gov.ph/requests/aglzfmVmb2ktcGhyHgsSB0NvbnRlbnQiEURJQ1QtMjIxNTc1NjE5OTUwDA
DOH,"November 08, 2022",O 2016-0035: Guidelines on the Provision of Quality Antenatal Care in All Birthing Centers,SUCCESSFUL,Reference,01/01/2019 - 10/31/2022,https://www.foi.gov.ph/requests/aglzfmVmb2ktcGhyHQsSB0NvbnRlbnQiEERPSC0wMjM4NTQxNTQ4ODYM
DOH,"November 08, 2022",Top Ten Leading Cause of Mortality in Region 3 (FY 2015-2021),PROCESSING,Thesis,01/01/2015 - 11/08/2022,https://www.foi.gov.ph/requests/aglzfmVmb2ktcGhyHQsSB0NvbnRlbnQiEERPSC03NzczNzIzMDU4NzkM
NBI,"November 08, 2022",Concepcion Hebel and Chloe Villaverde scammers,DENIED,Nais ko pong maparusahan ang mga ganitong Tao. Walang awa sa kapwa. Mapag Samantala.Makulong po sila,11/04/2022 - 11/07/2022,https://www.foi.gov.ph/requests/aglzfmVmb2ktcGhyHQsSB0NvbnRlbnQiEE5CSS0yNTg2Nzc3Njk3NjYM
PSC,"November 08, 2022",Population of differently abled athletes,PENDING,Research / Thesis,11/08/2022 - 11/08/2022,https://www.foi.gov.ph/requests/aglzfmVmb2ktcGhyHQsSB0NvbnRlbnQiEFBTQy04NjEyNzgwODEzMDEM
PAGASA,"November 08, 2022",Request Regarding Rainfall Sensors/Weather Stations in Leyte,AWAITING CLARIFICATION,Research and Development,01/01/2012 - 11/07/2022,https://www.foi.gov.ph/requests/aglzfmVmb2ktcGhyIAsSB0NvbnRlbnQiE1BBR0FTQS04MTg3MDA1OTgwNTkM
MGB,"November 08, 2022",Ground subsidence of the Manila Bay Freeport Zone (Bay City) from 2016-2022,ACCEPTED,Undergraduate Research,01/01/2016 - 11/08/2022,https://www.foi.gov.ph/requests/aglzfmVmb2ktcGhyHQsSB0NvbnRlbnQiEE1HQi0wNTY5MDgxMTUyOTIM
SSS,"November 08, 2022",Password Reset,PENDING,To pay my SSS contribution and loans online.,10/15/2022 - 11/07/2022,https://www.foi.gov.ph/requests/aglzfmVmb2ktcGhyHQsSB0NvbnRlbnQiEFNTUy0xNzQyNTY2ODE2OTIM
NBI,"November 08, 2022",Paragon.dept,DENIED,I would like to get my money back,11/04/2022 - 11/05/2022,https://www.foi.gov.ph/requests/aglzfmVmb2ktcGhyHQsSB0NvbnRlbnQiEE5CSS00NTYzMzQ3NDE2ODYM
SSS,"November 08, 2022",VAXCERT STILL IN PROGRESS,PENDING,I need to get my Vaxcertificate,11/08/2022 - 11/08/2022,https://www.foi.gov.ph/requests/aglzfmVmb2ktcGhyHQsSB0NvbnRlbnQiEFNTUy03MzYyMTg2MDM1MTEM
CDA,"November 08, 2022",Masterlist of all Cooperatives in the Philippines,PENDING,Research,01/01/2022 - 11/08/2022,https://www.foi.gov.ph/requests/aglzfmVmb2ktcGhyHQsSB0NvbnRlbnQiEENEQS0xMTg2MzkwNTQzOTYM
DPWH,"November 08, 2022",Construction Materials Price Data,AWAITING CLARIFICATION,For evaluation of our government Ongoing and Future Projects,01/01/2022 - 09/30/2022,https://www.foi.gov.ph/requests/aglzfmVmb2ktcGhyHgsSB0NvbnRlbnQiEURQV0gtMTEzNjYwNTQ3Nzk0DA
PSA,"November 08, 2022",Average Retirement Age For Nurses Employed in the Philippines Every Year From 2016-2021,PENDING,College Research,01/01/2016 - 12/31/2021,https://www.foi.gov.ph/requests/aglzfmVmb2ktcGhyHQsSB0NvbnRlbnQiEFBTQS0yNzQ2MDE4NTM2MjUM
DTI,"November 08, 2022",List of PCAB Contractor for yeah 2022,REFERRED,School Research,01/01/2022 - 11/07/2022,https://www.foi.gov.ph/requests/aglzfmVmb2ktcGhyHQsSB0NvbnRlbnQiEERUSS05NTU4ODkwNjkxNTYM
DOH,"November 08, 2022",Lost Vaccine Cards (Primary Doses) and Proof of Vaccine (Primary Doses),SUCCESSFUL,Travel,03/01/2021 - 11/08/2022,https://www.foi.gov.ph/requests/aglzfmVmb2ktcGhyHQsSB0NvbnRlbnQiEERPSC0yODc5NjcxNjcxNzUM
PNP,"November 08, 2022",Harassment/Death Threats,ACCEPTED,Locate and stop harassment,11/01/2022 - 11/07/2022,https://www.foi.gov.ph/requests/aglzfmVmb2ktcGhyHQsSB0NvbnRlbnQiEFBOUC00Nzc0NDEzMzk4OTkM
SSS,"November 08, 2022",Nory Rivera San Esteban,PENDING,Recover may account,01/22/2002 - 09/25/2022,https://www.foi.gov.ph/requests/aglzfmVmb2ktcGhyHQsSB0NvbnRlbnQiEFNTUy0wMzUyMjY5MzE3NjYM
DOE,"November 08, 2022",Philippine Solar & Wind Energy Service Contract Maps 2022,ACCEPTED,Due Diligence,11/08/2022 - 11/08/2022,https://www.foi.gov.ph/requests/aglzfmVmb2ktcGhyHQsSB0NvbnRlbnQiEERPRS05NzQ1MDIyNDI3MDMM
DENR,"November 08, 2022",lead and cadmium levels in the wells of Marinduque,DENIED,Research,11/05/1986 - 11/05/2022,https://www.foi.gov.ph/requests/aglzfmVmb2ktcGhyHgsSB0NvbnRlbnQiEURFTlItMTQ3NjA2MTY5MjQ2DA
DFA,"November 08, 2022",Passport,DENIED,Passport Appointment,11/08/2022 - 11/08/2022,https://www.foi.gov.ph/requests/aglzfmVmb2ktcGhyHQsSB0NvbnRlbnQiEERGQS01NTgxODk0NTc5NTEM
DFA,"November 08, 2022",Passport,DENIED,Passport Fee,11/08/2022 - 11/08/2022,https://www.foi.gov.ph/requests/aglzfmVmb2ktcGhyHQsSB0NvbnRlbnQiEERGQS0xMTYzMDc3NjI3ODkM
PSA,"November 08, 2022",The status of my annotated marriage certificate,PENDING,For the fulfillment of my documents,08/09/2022 - 11/08/2022,https://www.foi.gov.ph/requests/aglzfmVmb2ktcGhyHQsSB0NvbnRlbnQiEFBTQS02NDAzMTE0NDQ2NDQM
DOH,"November 08, 2022",Lost Vaccination Card,SUCCESSFUL,Lost Vaccination Card,08/01/2021 - 09/30/2021,https://www.foi.gov.ph/requests/aglzfmVmb2ktcGhyHQsSB0NvbnRlbnQiEERPSC02MDM1Mzg4MzI0MjUM
PNP,"November 08, 2022",WOWPERA Spamming Text Messages with Suspicious Links,ACCEPTED,Requesting for them to delete all the data I have in their system and to further investigate this co,08/21/2022 - 11/07/2022,https://www.foi.gov.ph/requests/aglzfmVmb2ktcGhyHQsSB0NvbnRlbnQiEFBOUC0wNTgyMjY5ODgyNTIM
PSA,"November 08, 2022",The number of teenage pregnancy-related data in Western Visayas,PENDING,For undergraduate research project that aims to look into the implementation of RA 10354.,05/15/2020 - 09/01/2022,https://www.foi.gov.ph/requests/aglzfmVmb2ktcGhyHQsSB0NvbnRlbnQiEFBTQS01Mzc5MTcxMzExNjIM
PNP,"November 08, 2022",Shieres Faronal,ACCEPTED,Blackmail,11/08/2021 - 11/08/2022,https://www.foi.gov.ph/requests/aglzfmVmb2ktcGhyHQsSB0NvbnRlbnQiEFBOUC0wMzM5MjY1MzYyMzAM
DepEd,"November 08, 2022",Transcript of Records,SUCCESSFUL,For Employment,06/03/1996 - 03/27/1997,https://www.foi.gov.ph/requests/aglzfmVmb2ktcGhyHwsSB0NvbnRlbnQiEkRlcEVkLTQ4Njc2OTgzMzc4Mgw
DOH,"November 08, 2022",Request of vaxcert (no record 2nd dose and booster) and correction,SUCCESSFUL,Requirements of my application,08/03/2021 - 02/05/2022,https://www.foi.gov.ph/requests/aglzfmVmb2ktcGhyHQsSB0NvbnRlbnQiEERPSC0wMjU2MjE2NzcxNzcM
MMDA,"November 08, 2022",Metro Manila Accident Recording and Analysis System,PARTIALLY SUCCESSFUL,Academic Research,01/01/2005 - 12/31/2021,https://www.foi.gov.ph/requests/aglzfmVmb2ktcGhyHgsSB0NvbnRlbnQiEU1NREEtNjQzODMwOTMzNzc0DA
LMB,"November 08, 2022","BLLM 1 CAD 364-D Palauig and BLBM 1 Barrio of Bato, Mun. of Palauig.",PENDING,Research,11/07/2022 - 11/08/2022,https://www.foi.gov.ph/requests/aglzfmVmb2ktcGhyIQsSB0NvbnRlbnQiFERFTlJMTUItMTMyMTA1NjEyMTA1DA
PSA,"November 08, 2022",Current population of Cebu Province,SUCCESSFUL,research,01/01/2022 - 11/07/2022,https://www.foi.gov.ph/requests/aglzfmVmb2ktcGhyHQsSB0NvbnRlbnQiEFBTQS0yMDM4OTkwNzYyMDUM
PSA,"November 08, 2022",Number of Elected LGU Officials,PENDING,"Research, requirements under Gender Statistics subject",01/01/2016 - 10/31/2022,https://www.foi.gov.ph/requests/aglzfmVmb2ktcGhyHQsSB0NvbnRlbnQiEFBTQS0xNDY1MjkyNTU5NTIM
PNP,"November 08, 2022",Annual Number of Illegal Wildlife Trade reported cases across the Philippines,ACCEPTED,Research,01/01/2010 - 12/31/2019,https://www.foi.gov.ph/requests/aglzfmVmb2ktcGhyHQsSB0NvbnRlbnQiEFBOUC0yODYzNjM5NzM2MzIM
BMB,"November 08, 2022",Annual Number of Illegal Wildlife Trade reported cases across the Philippines,ACCEPTED,Research,01/01/2010 - 12/31/2019,https://www.foi.gov.ph/requests/aglzfmVmb2ktcGhyIQsSB0NvbnRlbnQiFERFTlJCTUItNzk4NTY2NjY2MjE2DA
ParSU,"November 08, 2022",Flood Hazard Map,PENDING,Reference,01/01/2000 - 11/07/2022,https://www.foi.gov.ph/requests/aglzfmVmb2ktcGhyHwsSB0NvbnRlbnQiElBBUlNVLTY0NDMzODAwOTM4MAw
DENR,"November 08, 2022",Annual Number of Illegal Wildlife Trade reported cases across the Philippines,REFERRED,Research,01/01/2010 - 12/31/2019,https://www.foi.gov.ph/requests/aglzfmVmb2ktcGhyHgsSB0NvbnRlbnQiEURFTlItOTEzMjQxNjE3OTY3DA
NPC,"November 08, 2022",FunPeso online Lending,PENDING,To banned and access there Loan pending treatment .against data privacy act,11/07/2022 - 11/07/2022,https://www.foi.gov.ph/requests/aglzfmVmb2ktcGhyHQsSB0NvbnRlbnQiEE5QQy0zOTQ1OTA4OTE0OTEM
DENR,"November 08, 2022",Emission Standards,REFERRED,Research,01/01/2016 - 11/08/2022,https://www.foi.gov.ph/requests/aglzfmVmb2ktcGhyHgsSB0NvbnRlbnQiEURFTlItMTE2MTgyNjk5Nzk1DA
DepEd,"November 08, 2022",Total Number of Senior High School enrollees,AWAITING CLARIFICATION,Research,06/05/2017 - 09/05/2022,https://www.foi.gov.ph/requests/aglzfmVmb2ktcGhyHwsSB0NvbnRlbnQiEkRlcEVkLTM2MjYwNjU5NDU4OAw
DOH,"November 08, 2022",Number of MentalHealth Concern,PROCESSING,Architectural Thesis Research Development,01/01/2018 - 11/08/2022,https://www.foi.gov.ph/requests/aglzfmVmb2ktcGhyHQsSB0NvbnRlbnQiEERPSC01NTU4NjkzODk4MTgM
DepEd,"November 08, 2022",Request for Highschool Diploma,SUCCESSFUL,Job Requirements and Tesda Scholarship Requirement,11/07/2005 - 03/25/2007,https://www.foi.gov.ph/requests/aglzfmVmb2ktcGhyHwsSB0NvbnRlbnQiEkRlcEVkLTA5ODIxNzk1NDg3Nww
NBI,"November 08, 2022",Pautang peso and pera lending,DENIED,I want them to sacrifice i want them to go to the jail because of scaming many people,11/07/2022 - 11/07/2022,https://www.foi.gov.ph/requests/aglzfmVmb2ktcGhyHQsSB0NvbnRlbnQiEE5CSS0xOTcyNjgwNzU4ODYM
PSA,"November 08, 2022","Number of Population and Registered Voters in Novaliches, QC",PENDING,School Assignment,11/08/2022 - 11/08/2022,https://www.foi.gov.ph/requests/aglzfmVmb2ktcGhyHQsSB0NvbnRlbnQiEFBTQS04NjQ1ODY5NTQ5MTgM
NHA,"November 08, 2022",Evaluation on Available Unit still no response and not available.,ACCEPTED,Housing Relocation at Sto. Tomas batangas,10/01/2022 - 11/08/2022,https://www.foi.gov.ph/requests/aglzfmVmb2ktcGhyHQsSB0NvbnRlbnQiEE5IQS0yNjY0ODU2Mjc5MTcM
GAB,"November 08, 2022",Licensed Esports Coaches in the Philippines,PENDING,Architectural Thesis,11/08/2022 - 11/08/2022,https://www.foi.gov.ph/requests/aglzfmVmb2ktcGhyHQsSB0NvbnRlbnQiEEdBQi02MTgxOTcwNTYzODAM
FOIPMO,"November 08, 2022",Reply to Mr. Ryan Salvador FOI receiving officer,PENDING,Regarding on Fuel Subsidy that I'd request last August 2022 from LTFRB,11/01/2022 - 11/08/2022,https://www.foi.gov.ph/requests/aglzfmVmb2ktcGhyIAsSB0NvbnRlbnQiE0ZPSVBNTy01MjcxNzE5MzMwMDUM
DTI,"November 08, 2022","The number of registered bus manufacturing companies in the National Capital Region, and Philippines",REFERRED,Feasibility Study,01/01/2016 - 11/08/2022,https://www.foi.gov.ph/requests/aglzfmVmb2ktcGhyHQsSB0NvbnRlbnQiEERUSS0xMDU4MzE1OTk1MTMM
DTI,"November 08, 2022",Geographical Spread of MSMEs (MSME Statistics Index),REFERRED,Research and Development,01/01/1990 - 12/12/2021,https://www.foi.gov.ph/requests/aglzfmVmb2ktcGhyHQsSB0NvbnRlbnQiEERUSS0zOTQwMzU5MDM0MDcM
NTC,"November 08, 2022",STOLLEN PHONE,PARTIALLY SUCCESSFUL,Retrieve of stolen phone,11/07/2022 - 11/07/2022,https://www.foi.gov.ph/requests/aglzfmVmb2ktcGhyHQsSB0NvbnRlbnQiEE5UQy0xMTQ4MjU2MjcxMTYM
DBM,"November 08, 2022","Internal Revenue Allotment (IRA) (Now NTA) of all the barangays in Santa Cruz, Davao del Sur (Re XI)",PENDING,Undergraduate Research,01/01/2021 - 12/31/2021,https://www.foi.gov.ph/requests/aglzfmVmb2ktcGhyHQsSB0NvbnRlbnQiEERCTS00NjQ1NTA5NjI5MDkM
UsaP,"November 08, 2022",List of Pasig City Police Stations with Address,REFERRED,For applying police clearance (first time job seeker),11/08/2022 - 11/08/2022,https://www.foi.gov.ph/requests/aglzfmVmb2ktcGhyHgsSB0NvbnRlbnQiEVVTQVAtMzExNjcwODI5MzI3DA
BOI,"November 07, 2022",List for Documents for Research,PENDING,Research,01/01/2000 - 11/07/2022,https://www.foi.gov.ph/requests/aglzfmVmb2ktcGhyHQsSB0NvbnRlbnQiEEJPSS00MDQ2MTEzNDg3MjIM
DOH,"November 07, 2022",Weekly Surveillance Reports on Dengue 2016 to 2022,SUCCESSFUL,Research paper and statistical study,01/01/2016 - 10/31/2022,https://www.foi.gov.ph/requests/aglzfmVmb2ktcGhyHQsSB0NvbnRlbnQiEERPSC00MjUxMjQzNzQ1NjcM
IC,"November 07, 2022",Insurance Commission Exam Result,ACCEPTED,For work documentation purpose,04/05/2022 - 04/05/2022,https://www.foi.gov.ph/requests/aglzfmVmb2ktcGhyHAsSB0NvbnRlbnQiD0lDLTg0NTkwMzg1MzQzMAw
CHED,"November 07, 2022",The number of enrollees and graduates related to fashion from 2017-2021,ACCEPTED,Research and development,01/01/2016 - 12/30/2021,https://www.foi.gov.ph/requests/aglzfmVmb2ktcGhyHgsSB0NvbnRlbnQiEUNIRUQtMTA0OTEzMjEyNjIyDA
CHED,"November 07, 2022",The number of enrollees and graduates related to animation from 2017-2021,DENIED,Research and development,01/01/2016 - 12/30/2021,https://www.foi.gov.ph/requests/aglzfmVmb2ktcGhyHgsSB0NvbnRlbnQiEUNIRUQtMTYxODU4NjEyNzI2DA
CHED,"November 07, 2022",The number of enrollees and graduates related to Game development from 2017-2022,ACCEPTED,Research and development,01/01/2016 - 12/30/2021,https://www.foi.gov.ph/requests/aglzfmVmb2ktcGhyHgsSB0NvbnRlbnQiEUNIRUQtMzI3MzE0NjEzMjQzDA
DOH,"November 07, 2022",Rehabilitation and Wellness Center in Batangas,PROCESSING,Research and Thesis,01/01/2012 - 11/07/2022,https://www.foi.gov.ph/requests/aglzfmVmb2ktcGhyHQsSB0NvbnRlbnQiEERPSC02MjQwODkzNDI5MDUM
PDEA,"November 07, 2022",Most wanted drug personalities and traffickers as of 2022,PENDING,Research and analysis,01/01/2022 - 11/07/2022,https://www.foi.gov.ph/requests/aglzfmVmb2ktcGhyHgsSB0NvbnRlbnQiEVBERUEtOTM2MjQ3OTk4Njg4DA
DOH,"November 07, 2022",Tao sa laguna na pumasok sa rehabilitation dahil sa sobrang paggamit ng alcohol,AWAITING CLARIFICATION,Undergraduate Research,01/01/2010 - 08/13/2022,https://www.foi.gov.ph/requests/aglzfmVmb2ktcGhyHQsSB0NvbnRlbnQiEERPSC01MTAzODY4MjAyMTkM
PSA,"November 07, 2022",Philippine GDP growth and peso value,PENDING,Masters Requirement,01/01/2013 - 11/07/2022,https://www.foi.gov.ph/requests/aglzfmVmb2ktcGhyHQsSB0NvbnRlbnQiEFBTQS02NzkyODc1MTYyNjkM
DPWH,"November 08, 2022",Construction Materials Price Data,AWAITING CLARIFICATION,For evaluation of our government Ongoing and Future Projects,01/01/2022 - 09/30/2022,https://www.foi.gov.ph/requests/aglzfmVmb2ktcGhyHgsSB0NvbnRlbnQiEURQV0gtMTEzNjYwNTQ3Nzk0DA
PSA,"November 08, 2022",Average Retirement Age For Nurses Employed in the Philippines Every Year From 2016-2021,PENDING,College Research,01/01/2016 - 12/31/2021,https://www.foi.gov.ph/requests/aglzfmVmb2ktcGhyHQsSB0NvbnRlbnQiEFBTQS0yNzQ2MDE4NTM2MjUM
DTI,"November 08, 2022",List of PCAB Contractor for yeah 2022,REFERRED,School Research,01/01/2022 - 11/07/2022,https://www.foi.gov.ph/requests/aglzfmVmb2ktcGhyHQsSB0NvbnRlbnQiEERUSS05NTU4ODkwNjkxNTYM
DOH,"November 08, 2022",Lost Vaccine Cards (Primary Doses) and Proof of Vaccine (Primary Doses),SUCCESSFUL,Travel,03/01/2021 - 11/08/2022,https://www.foi.gov.ph/requests/aglzfmVmb2ktcGhyHQsSB0NvbnRlbnQiEERPSC0yODc5NjcxNjcxNzUM
PNP,"November 08, 2022",Harassment/Death Threats,ACCEPTED,Locate and stop harassment,11/01/2022 - 11/07/2022,https://www.foi.gov.ph/requests/aglzfmVmb2ktcGhyHQsSB0NvbnRlbnQiEFBOUC00Nzc0NDEzMzk4OTkM
SSS,"November 08, 2022",Nory Rivera San Esteban,PENDING,Recover may account,01/22/2002 - 09/25/2022,https://www.foi.gov.ph/requests/aglzfmVmb2ktcGhyHQsSB0NvbnRlbnQiEFNTUy0wMzUyMjY5MzE3NjYM
DOE,"November 08, 2022",Philippine Solar & Wind Energy Service Contract Maps 2022,ACCEPTED,Due Diligence,11/08/2022 - 11/08/2022,https://www.foi.gov.ph/requests/aglzfmVmb2ktcGhyHQsSB0NvbnRlbnQiEERPRS05NzQ1MDIyNDI3MDMM
DENR,"November 08, 2022",lead and cadmium levels in the wells of Marinduque,DENIED,Research,11/05/1986 - 11/05/2022,https://www.foi.gov.ph/requests/aglzfmVmb2ktcGhyHgsSB0NvbnRlbnQiEURFTlItMTQ3NjA2MTY5MjQ2DA
DFA,"November 08, 2022",Passport,DENIED,Passport Appointment,11/08/2022 - 11/08/2022,https://www.foi.gov.ph/requests/aglzfmVmb2ktcGhyHQsSB0NvbnRlbnQiEERGQS01NTgxODk0NTc5NTEM
DFA,"November 08, 2022",Passport,DENIED,Passport Fee,11/08/2022 - 11/08/2022,https://www.foi.gov.ph/requests/aglzfmVmb2ktcGhyHQsSB0NvbnRlbnQiEERGQS0xMTYzMDc3NjI3ODkM
PSA,"November 08, 2022",The status of my annotated marriage certificate,PENDING,For the fulfillment of my documents,08/09/2022 - 11/08/2022,https://www.foi.gov.ph/requests/aglzfmVmb2ktcGhyHQsSB0NvbnRlbnQiEFBTQS02NDAzMTE0NDQ2NDQM
DOH,"November 08, 2022",Lost Vaccination Card,SUCCESSFUL,Lost Vaccination Card,08/01/2021 - 09/30/2021,https://www.foi.gov.ph/requests/aglzfmVmb2ktcGhyHQsSB0NvbnRlbnQiEERPSC02MDM1Mzg4MzI0MjUM
PNP,"November 08, 2022",WOWPERA Spamming Text Messages with Suspicious Links,ACCEPTED,Requesting for them to delete all the data I have in their system and to further investigate this co,08/21/2022 - 11/07/2022,https://www.foi.gov.ph/requests/aglzfmVmb2ktcGhyHQsSB0NvbnRlbnQiEFBOUC0wNTgyMjY5ODgyNTIM
PSA,"November 08, 2022",The number of teenage pregnancy-related data in Western Visayas,PENDING,For undergraduate research project that aims to look into the implementation of RA 10354.,05/15/2020 - 09/01/2022,https://www.foi.gov.ph/requests/aglzfmVmb2ktcGhyHQsSB0NvbnRlbnQiEFBTQS01Mzc5MTcxMzExNjIM
PNP,"November 08, 2022",Shieres Faronal,ACCEPTED,Blackmail,11/08/2021 - 11/08/2022,https://www.foi.gov.ph/requests/aglzfmVmb2ktcGhyHQsSB0NvbnRlbnQiEFBOUC0wMzM5MjY1MzYyMzAM
DepEd,"November 08, 2022",Transcript of Records,SUCCESSFUL,For Employment,06/03/1996 - 03/27/1997,https://www.foi.gov.ph/requests/aglzfmVmb2ktcGhyHwsSB0NvbnRlbnQiEkRlcEVkLTQ4Njc2OTgzMzc4Mgw
DOH,"November 08, 2022",Request of vaxcert (no record 2nd dose and booster) and correction,SUCCESSFUL,Requirements of my application,08/03/2021 - 02/05/2022,https://www.foi.gov.ph/requests/aglzfmVmb2ktcGhyHQsSB0NvbnRlbnQiEERPSC0wMjU2MjE2NzcxNzcM
MMDA,"November 08, 2022",Metro Manila Accident Recording and Analysis System,PARTIALLY SUCCESSFUL,Academic Research,01/01/2005 - 12/31/2021,https://www.foi.gov.ph/requests/aglzfmVmb2ktcGhyHgsSB0NvbnRlbnQiEU1NREEtNjQzODMwOTMzNzc0DA
LMB,"November 08, 2022","BLLM 1 CAD 364-D Palauig and BLBM 1 Barrio of Bato, Mun. of Palauig.",PENDING,Research,11/07/2022 - 11/08/2022,https://www.foi.gov.ph/requests/aglzfmVmb2ktcGhyIQsSB0NvbnRlbnQiFERFTlJMTUItMTMyMTA1NjEyMTA1DA
PSA,"November 08, 2022",Current population of Cebu Province,SUCCESSFUL,research,01/01/2022 - 11/07/2022,https://www.foi.gov.ph/requests/aglzfmVmb2ktcGhyHQsSB0NvbnRlbnQiEFBTQS0yMDM4OTkwNzYyMDUM
PSA,"November 08, 2022",Number of Elected LGU Officials,PENDING,"Research, requirements under Gender Statistics subject",01/01/2016 - 10/31/2022,https://www.foi.gov.ph/requests/aglzfmVmb2ktcGhyHQsSB0NvbnRlbnQiEFBTQS0xNDY1MjkyNTU5NTIM
PNP,"November 08, 2022",Annual Number of Illegal Wildlife Trade reported cases across the Philippines,ACCEPTED,Research,01/01/2010 - 12/31/2019,https://www.foi.gov.ph/requests/aglzfmVmb2ktcGhyHQsSB0NvbnRlbnQiEFBOUC0yODYzNjM5NzM2MzIM
BMB,"November 08, 2022",Annual Number of Illegal Wildlife Trade reported cases across the Philippines,ACCEPTED,Research,01/01/2010 - 12/31/2019,https://www.foi.gov.ph/requests/aglzfmVmb2ktcGhyIQsSB0NvbnRlbnQiFERFTlJCTUItNzk4NTY2NjY2MjE2DA
ParSU,"November 08, 2022",Flood Hazard Map,PENDING,Reference,01/01/2000 - 11/07/2022,https://www.foi.gov.ph/requests/aglzfmVmb2ktcGhyHwsSB0NvbnRlbnQiElBBUlNVLTY0NDMzODAwOTM4MAw
DENR,"November 08, 2022",Annual Number of Illegal Wildlife Trade reported cases across the Philippines,REFERRED,Research,01/01/2010 - 12/31/2019,https://www.foi.gov.ph/requests/aglzfmVmb2ktcGhyHgsSB0NvbnRlbnQiEURFTlItOTEzMjQxNjE3OTY3DA
NPC,"November 08, 2022",FunPeso online Lending,PENDING,To banned and access there Loan pending treatment .against data privacy act,11/07/2022 - 11/07/2022,https://www.foi.gov.ph/requests/aglzfmVmb2ktcGhyHQsSB0NvbnRlbnQiEE5QQy0zOTQ1OTA4OTE0OTEM
DENR,"November 08, 2022",Emission Standards,REFERRED,Research,01/01/2016 - 11/08/2022,https://www.foi.gov.ph/requests/aglzfmVmb2ktcGhyHgsSB0NvbnRlbnQiEURFTlItMTE2MTgyNjk5Nzk1DA
DepEd,"November 08, 2022",Total Number of Senior High School enrollees,AWAITING CLARIFICATION,Research,06/05/2017 - 09/05/2022,https://www.foi.gov.ph/requests/aglzfmVmb2ktcGhyHwsSB0NvbnRlbnQiEkRlcEVkLTM2MjYwNjU5NDU4OAw
DOH,"November 08, 2022",Number of MentalHealth Concern,PROCESSING,Architectural Thesis Research Development,01/01/2018 - 11/08/2022,https://www.foi.gov.ph/requests/aglzfmVmb2ktcGhyHQsSB0NvbnRlbnQiEERPSC01NTU4NjkzODk4MTgM
DepEd,"November 08, 2022",Request for Highschool Diploma,SUCCESSFUL,Job Requirements and Tesda Scholarship Requirement,11/07/2005 - 03/25/2007,https://www.foi.gov.ph/requests/aglzfmVmb2ktcGhyHwsSB0NvbnRlbnQiEkRlcEVkLTA5ODIxNzk1NDg3Nww
