agency,date,title,status,purpose,period_covered,link
DOH,"March 05, 2023",PHYSIOTHERAPY CLINIC DESIGN GUIDELINES,PARTIALLY SUCCESSFUL,RESEARCH STUDY,10/28/2022 - 10/28/2022,https://www.foi.gov.ph/requests/aglzfmVmb2ktcGhyHQsSB0NvbnRlbnQiEERPSC0xNTY0NzM2OTY2MzcM
BIR,"March 05, 2023",Income Tax Return,DENIED,Requirement on Car Loan Application,03/01/2022 - 03/01/2023,https://www.foi.gov.ph/requests/aglzfmVmb2ktcGhyHQsSB0NvbnRlbnQiEEJJUi02MDI1MTkyNzc1ODUM
NBI,"March 05, 2023",Scammed through an online selling of concert tickets,PENDING,"If I will not get my money back, I want the scammer to be put in jail.",02/04/2023 - 02/18/2023,https://www.foi.gov.ph/requests/aglzfmVmb2ktcGhyHQsSB0NvbnRlbnQiEE5CSS00NDgyNzc5NTg0MzcM
NBI,"March 05, 2023",Scammed through online tickets,PENDING,"To be able to get my money back, or if not, to see the scammer be in jain",03/04/2023 - 03/04/2023,https://www.foi.gov.ph/requests/aglzfmVmb2ktcGhyHQsSB0NvbnRlbnQiEE5CSS0yMTMxNzM4NzQzNzcM
IC,"March 05, 2023","Prudentialife Plans, Inc. Claim",ACCEPTED,For my children tuition fees.,07/03/2007 - 07/03/2022,https://www.foi.gov.ph/requests/aglzfmVmb2ktcGhyHAsSB0NvbnRlbnQiD0lDLTY4MjgwNjE3MzQ3MAw
SEC,"March 05, 2023",List of Registered Companies in the Energy Sector,SUCCESSFUL,Research,01/01/2017 - 03/05/2023,https://www.foi.gov.ph/requests/aglzfmVmb2ktcGhyHQsSB0NvbnRlbnQiEFNFQy0yMTY0NzY4MzE0ODMM
PSA,"March 05, 2023",Foreign Trade Statistics of the Philippines,PENDING,Research,03/05/2023 - 03/05/2023,https://www.foi.gov.ph/requests/aglzfmVmb2ktcGhyHQsSB0NvbnRlbnQiEFBTQS00NzQ0MDU3MzU0NTYM
MMDA,"March 05, 2023","Request for Dataset of Daily Flood levels at Science Garden, Sangley Point, Point Area, and NAIA",REFERRED,Undergraduate Thesis,01/01/2000 - 12/31/2021,https://www.foi.gov.ph/requests/aglzfmVmb2ktcGhyHgsSB0NvbnRlbnQiEU1NREEtMjkxNDEyNzgzMzI1DA
PSC,"March 05, 2023",Hello.....I'm Royal family Justice at Lurd empperaon puoi King Edward henry Rabe,PENDING,Hello..... I'm Royal family Justice at Lurd empperaon puoi King Edward henry Rabe,10/04/1980 - 10/04/2020,https://www.foi.gov.ph/requests/aglzfmVmb2ktcGhyHQsSB0NvbnRlbnQiEFBTQy0xNzg0MTU1NjY1MjAM
IC,"March 05, 2023",Certificate as an IC Exam Passer,ACCEPTED,Work Application,09/20/2019 - 10/31/2019,https://www.foi.gov.ph/requests/aglzfmVmb2ktcGhyHAsSB0NvbnRlbnQiD0lDLTM2ODY5OTczMzc5NQw
LTO,"March 05, 2023",Number of registered cars in the Philippines,SUCCESSFUL,Undergraduate Thesis (research),01/01/1980 - 03/05/2023,https://www.foi.gov.ph/requests/aglzfmVmb2ktcGhyHQsSB0NvbnRlbnQiEExUTy03MjA5ODk2MDY5NDQM
BIR,"March 05, 2023",Income Tax Return,DENIED,Scholarship Requirement,03/05/2022 - 03/05/2023,https://www.foi.gov.ph/requests/aglzfmVmb2ktcGhyHQsSB0NvbnRlbnQiEEJJUi03NzU2MjY3ODUxNTUM
CHED,"March 05, 2023",6 Year Graduation Rate from public higher education institution(HEIs) in the Philippines,ACCEPTED,For undergraduate Thesis,03/05/2023 - 03/05/2023,https://www.foi.gov.ph/requests/aglzfmVmb2ktcGhyHgsSB0NvbnRlbnQiEUNIRUQtMjI3NTAwOTcxNzA0DA
DepEd,"March 05, 2023",Form 137,SUCCESSFUL,To use a requirement at Canada for tue college admission.,01/01/2004 - 01/01/2005,https://www.foi.gov.ph/requests/aglzfmVmb2ktcGhyHwsSB0NvbnRlbnQiEkRlcEVkLTE4NzcxNzU4NDg4NAw
DepEd,"March 05, 2023",Transcript of Records & Diploma (highschool),SUCCESSFUL,To attend university in the United States,08/01/2002 - 04/07/2006,https://www.foi.gov.ph/requests/aglzfmVmb2ktcGhyHwsSB0NvbnRlbnQiEkRlcEVkLTk1NjU3MDUwNjMyOQw
CHED,"March 05, 2023",For interview CHED,DENIED,Thesis Paper about Proposed Veterinary School Complex,02/20/2023 - 03/03/2023,https://www.foi.gov.ph/requests/aglzfmVmb2ktcGhyHgsSB0NvbnRlbnQiEUNIRUQtOTcyNTY3MjIxOTAyDA
SSS,"March 05, 2023",Umid Card,PENDING,To get a UMID ID,03/05/2023 - 03/05/2023,https://www.foi.gov.ph/requests/aglzfmVmb2ktcGhyHQsSB0NvbnRlbnQiEFNTUy03MDg5NTUxMTU3MDYM
DOH,"March 05, 2023",Vax Certificate,SUCCESSFUL,School Requirements here in Canada,03/05/2023 - 03/05/2023,https://www.foi.gov.ph/requests/aglzfmVmb2ktcGhyHQsSB0NvbnRlbnQiEERPSC05MjQ3NDkwODE3MzQM
DPWH,"March 05, 2023",Latest Construction Material Pricelist for NCR and Region IV-A(CALABARZON),ACCEPTED,Research Project (Capstone Project for Civil Engineering),01/01/2023 - 03/05/2023,https://www.foi.gov.ph/requests/aglzfmVmb2ktcGhyHgsSB0NvbnRlbnQiEURQV0gtODY0NDE4MTIzNzQyDA
NTC,"March 05, 2023",Take my money back from my fake online job,PENDING,Investigation Unit,02/03/2023 - 03/04/2023,https://www.foi.gov.ph/requests/aglzfmVmb2ktcGhyHQsSB0NvbnRlbnQiEE5UQy0zOTQzMjc4MDIwODMM
DOH,"March 05, 2023",Number of Dementia cases in Taguig City,PARTIALLY SUCCESSFUL,Thesis about the coping mechanisms of families handling dementia.,03/05/2023 - 03/05/2023,https://www.foi.gov.ph/requests/aglzfmVmb2ktcGhyHQsSB0NvbnRlbnQiEERPSC0zNDg4NzQ4NDIyNjAM
PNP,"March 05, 2023",Number of Road Traffic Accident in Maharlika Highway Cabanatuan City Nueva Ecija,DENIED,Undergraduate Thesis,03/02/2015 - 03/02/2023,https://www.foi.gov.ph/requests/aglzfmVmb2ktcGhyHQsSB0NvbnRlbnQiEFBOUC04MDU3MDgyNzIyMTYM
OVP,"March 05, 2023",Livelihood financial assistant,PENDING,Tulong pinansyal pangkabuhayan,03/05/2020 - 03/05/2023,https://www.foi.gov.ph/requests/aglzfmVmb2ktcGhyHQsSB0NvbnRlbnQiEE9WUC02NjYxMzU5MDkwNjEM
GSIS,"March 05, 2023",Inquiry of the status of submitted Covid-19 claims application,PENDING,Inquiry on the status of the Covid-19 benefits application for frontliner.,10/13/2022 - 12/30/2022,https://www.foi.gov.ph/requests/aglzfmVmb2ktcGhyHgsSB0NvbnRlbnQiEUdTSVMtMjI1NTM2NjgxMDk4DA
IC,"March 05, 2023","Prudentialife Plans, Inc. Claim",ACCEPTED,For my children tuition fees.,07/03/2007 - 07/03/2022,https://www.foi.gov.ph/requests/aglzfmVmb2ktcGhyHAsSB0NvbnRlbnQiD0lDLTY4MjgwNjE3MzQ3MAw
SEC,"March 05, 2023",List of Registered Companies in the Energy Sector,SUCCESSFUL,Research,01/01/2017 - 03/05/2023,https://www.foi.gov.ph/requests/aglzfmVmb2ktcGhyHQsSB0NvbnRlbnQiEFNFQy0yMTY0NzY4MzE0ODMM
PSA,"March 05, 2023",Foreign Trade Statistics of the Philippines,PENDING,Research,03/05/2023 - 03/05/2023,https://www.foi.gov.ph/requests/aglzfmVmb2ktcGhyHQsSB0NvbnRlbnQiEFBTQS00NzQ0MDU3MzU0NTYM
MMDA,"March 05, 2023","Request for Dataset of Daily Flood levels at Science Garden, Sangley Point, Point Area, and NAIA",REFERRED,Undergraduate Thesis,01/01/2000 - 12/31/2021,https://www.foi.gov.ph/requests/aglzfmVmb2ktcGhyHgsSB0NvbnRlbnQiEU1NREEtMjkxNDEyNzgzMzI1DA
PSC,"March 05, 2023",Hello.....I'm Royal family Justice at Lurd empperaon puoi King Edward henry Rabe,PENDING,Hello..... I'm Royal family Justice at Lurd empperaon puoi King Edward henry Rabe,10/04/1980 - 10/04/2020,https://www.foi.gov.ph/requests/aglzfmVmb2ktcGhyHQsSB0NvbnRlbnQiEFBTQy0xNzg0MTU1NjY1MjAM
IC,"March 05, 2023",Certificate as an IC Exam Passer,ACCEPTED,Work Application,09/20/2019 - 10/31/2019,https://www.foi.gov.ph/requests/aglzfmVmb2ktcGhyHAsSB0NvbnRlbnQiD0lDLTM2ODY5OTczMzc5NQw
LTO,"March 05, 2023",Number of registered cars in the Philippines,SUCCESSFUL,Undergraduate Thesis (research),01/01/1980 - 03/05/2023,https://www.foi.gov.ph/requests/aglzfmVmb2ktcGhyHQsSB0NvbnRlbnQiEExUTy03MjA5ODk2MDY5NDQM
BIR,"March 05, 2023",Income Tax Return,DENIED,Scholarship Requirement,03/05/2022 - 03/05/2023,https://www.foi.gov.ph/requests/aglzfmVmb2ktcGhyHQsSB0NvbnRlbnQiEEJJUi03NzU2MjY3ODUxNTUM
CHED,"March 05, 2023",6 Year Graduation Rate from public higher education institution(HEIs) in the Philippines,ACCEPTED,For undergraduate Thesis,03/05/2023 - 03/05/2023,https://www.foi.gov.ph/requests/aglzfmVmb2ktcGhyHgsSB0NvbnRlbnQiEUNIRUQtMjI3NTAwOTcxNzA0DA
DepEd,"March 05, 2023",Form 137,SUCCESSFUL,To use a requirement at Canada for tue college admission.,01/01/2004 - 01/01/2005,https://www.foi.gov.ph/requests/aglzfmVmb2ktcGhyHwsSB0NvbnRlbnQiEkRlcEVkLTE4NzcxNzU4NDg4NAw
DepEd,"March 05, 2023",Transcript of Records & Diploma (highschool),SUCCESSFUL,To attend university in the United States,08/01/2002 - 04/07/2006,https://www.foi.gov.ph/requests/aglzfmVmb2ktcGhyHwsSB0NvbnRlbnQiEkRlcEVkLTk1NjU3MDUwNjMyOQw
CHED,"March 05, 2023",For interview CHED,DENIED,Thesis Paper about Proposed Veterinary School Complex,02/20/2023 - 03/03/2023,https://www.foi.gov.ph/requests/aglzfmVmb2ktcGhyHgsSB0NvbnRlbnQiEUNIRUQtOTcyNTY3MjIxOTAyDA
SSS,"March 05, 2023",Umid Card,PENDING,To get a UMID ID,03/05/2023 - 03/05/2023,https://www.foi.gov.ph/requests/aglzfmVmb2ktcGhyHQsSB0NvbnRlbnQiEFNTUy03MDg5NTUxMTU3MDYM
DOH,"March 05, 2023",Vax Certificate,SUCCESSFUL,School Requirements here in Canada,03/05/2023 - 03/05/2023,https://www.foi.gov.ph/requests/aglzfmVmb2ktcGhyHQsSB0NvbnRlbnQiEERPSC05MjQ3NDkwODE3MzQM
DPWH,"March 05, 2023",Latest Construction Material Pricelist for NCR and Region IV-A(CALABARZON),ACCEPTED,Research Project (Capstone Project for Civil Engineering),01/01/2023 - 03/05/2023,https://www.foi.gov.ph/requests/aglzfmVmb2ktcGhyHgsSB0NvbnRlbnQiEURQV0gtODY0NDE4MTIzNzQyDA
NTC,"March 05, 2023",Take my money back from my fake online job,PENDING,Investigation Unit,02/03/2023 - 03/04/2023,https://www.foi.gov.ph/requests/aglzfmVmb2ktcGhyHQsSB0NvbnRlbnQiEE5UQy0zOTQzMjc4MDIwODMM
DOH,"March 05, 2023",Number of Dementia cases in Taguig City,PARTIALLY SUCCESSFUL,Thesis about the coping mechanisms of families handling dementia.,03/05/2023 - 03/05/2023,https://www.foi.gov.ph/requests/aglzfmVmb2ktcGhyHQsSB0NvbnRlbnQiEERPSC0zNDg4NzQ4NDIyNjAM
PNP,"March 05, 2023",Number of Road Traffic Accident in Maharlika Highway Cabanatuan City Nueva Ecija,DENIED,Undergraduate Thesis,03/02/2015 - 03/02/2023,https://www.foi.gov.ph/requests/aglzfmVmb2ktcGhyHQsSB0NvbnRlbnQiEFBOUC04MDU3MDgyNzIyMTYM
OVP,"March 05, 2023",Livelihood financial assistant,PENDING,Tulong pinansyal pangkabuhayan,03/05/2020 - 03/05/2023,https://www.foi.gov.ph/requests/aglzfmVmb2ktcGhyHQsSB0NvbnRlbnQiEE9WUC02NjYxMzU5MDkwNjEM
GSIS,"March 05, 2023",Inquiry of the status of submitted Covid-19 claims application,PENDING,Inquiry on the status of the Covid-19 benefits application for frontliner.,10/13/2022 - 12/30/2022,https://www.foi.gov.ph/requests/aglzfmVmb2ktcGhyHgsSB0NvbnRlbnQiEUdTSVMtMjI1NTM2NjgxMDk4DA
DOH,"March 05, 2023","Status of online application at DOH, Covid-19 benefit/claim for frontliner",AWAITING CLARIFICATION,"Follow up status of online application, Covid-19 benefits/claims at the Department of Health",10/13/2022 - 11/30/2022,https://www.foi.gov.ph/requests/aglzfmVmb2ktcGhyHQsSB0NvbnRlbnQiEERPSC03NzQxMTI2Mzk5OTkM
PSA,"March 05, 2023",TRN of PhilSys ID,PENDING,for ePhilID transaction,09/01/2022 - 10/31/2022,https://www.foi.gov.ph/requests/aglzfmVmb2ktcGhyHQsSB0NvbnRlbnQiEFBTQS03NTE4NjQ2MTY0NTIM
NHA,"March 05, 2023",LIBRENG PABAHAY,PENDING,para sa mhihirap,03/01/2023 - 03/05/2023,https://www.foi.gov.ph/requests/aglzfmVmb2ktcGhyHQsSB0NvbnRlbnQiEE5IQS0zNTEzODY2MzM3MDkM
BTr,"March 05, 2023",PHP BVAL RATES,PENDING,Research,12/26/2022 - 12/31/2022,https://www.foi.gov.ph/requests/aglzfmVmb2ktcGhyHQsSB0NvbnRlbnQiEEJUci01NDM1NDc4OTU2MzgM
SEC,"March 05, 2023",Harassment from Online Lending App,ACCEPTED,Complaint,03/04/2023 - 03/04/2023,https://www.foi.gov.ph/requests/aglzfmVmb2ktcGhyHQsSB0NvbnRlbnQiEFNFQy02OTM3NDA2NDEzOTMM
SSS,"March 05, 2023",Update of Member Record Status from Temporary to Permanent,PENDING,Update of Member Record Status from Temporary to Permanent,02/23/2023 - 03/05/2023,https://www.foi.gov.ph/requests/aglzfmVmb2ktcGhyHQsSB0NvbnRlbnQiEFNTUy05NjYyMTY4NjQ4MTMM
DOH,"March 05, 2023",Vaxx Cert,SUCCESSFUL,use for international,12/01/2021 - 01/18/2022,https://www.foi.gov.ph/requests/aglzfmVmb2ktcGhyHQsSB0NvbnRlbnQiEERPSC04ODk2NjU4MDQzMTgM
NBI,"March 05, 2023",Get my money back from my fake online job,PENDING,Investigation Unit,02/03/2023 - 03/04/2023,https://www.foi.gov.ph/requests/aglzfmVmb2ktcGhyHQsSB0NvbnRlbnQiEE5CSS0zMDE5OTAwMzE1OTgM
DepEd,"March 05, 2023",MY GRADE 10 REPORT CARD,SUCCESSFUL,For my college admission in PUP,10/05/2020 - 07/23/2022,https://www.foi.gov.ph/requests/aglzfmVmb2ktcGhyHwsSB0NvbnRlbnQiEkRlcEVkLTQ4ODY5NDUxMDQxMQw
DTI,"March 05, 2023",plastic consumption or sachet consumption in the FMCG industry,REFERRED,Research,01/01/2016 - 03/05/2023,https://www.foi.gov.ph/requests/aglzfmVmb2ktcGhyHQsSB0NvbnRlbnQiEERUSS05NTkxOTYxNjc5MzkM
FNRI,"March 05, 2023",National and provincial food bundles from FNRI,REFERRED,I will be using the dataset for my Master's degree final project.,03/05/2013 - 03/05/2023,https://www.foi.gov.ph/requests/aglzfmVmb2ktcGhyHgsSB0NvbnRlbnQiEUZOUkktOTQ5MTg4NjA0NjA0DA
PSA,"March 05, 2023",PANGASINAN POPULATION DATA 2020,PENDING,Study on the proposed Pangasinan Expressway.,01/01/2015 - 03/05/2023,https://www.foi.gov.ph/requests/aglzfmVmb2ktcGhyHQsSB0NvbnRlbnQiEFBTQS0wNzE2OTExNDgyMzgM
NSWMC,"March 05, 2023",Report on PARMS members’ plastic generation capacities,PENDING,Research,01/01/2019 - 03/05/2023,https://www.foi.gov.ph/requests/aglzfmVmb2ktcGhyHwsSB0NvbnRlbnQiEk5TV01DLTM4MTIwNjYxMzg2NQw
DOLE,"March 05, 2023",The total number of population of office workers,PENDING,Corporate Business Plan - Graduate School,01/01/2021 - 03/04/2023,https://www.foi.gov.ph/requests/aglzfmVmb2ktcGhyHgsSB0NvbnRlbnQiEURPTEUtNTc5ODY5MTI4NDEzDA
NTC,"March 04, 2023",Tracking my stolen phone,PENDING,To retrieve my phone back,03/04/2023 - 03/04/2023,https://www.foi.gov.ph/requests/aglzfmVmb2ktcGhyHQsSB0NvbnRlbnQiEE5UQy04NDk1NTA0MzQ3ODUM
NTC,"March 04, 2023",Locate or Block The Phone using IMEI,PENDING,The Theft Cannot use the Phone Anymore. Thank you.,03/01/2023 - 03/02/2023,https://www.foi.gov.ph/requests/aglzfmVmb2ktcGhyHQsSB0NvbnRlbnQiEE5UQy0xNTU2MTc0ODg3ODkM
DPWH,"March 04, 2023",Request for Geotechnical Evaluation Report,ACCEPTED,Design Project,03/04/2023 - 03/04/2023,https://www.foi.gov.ph/requests/aglzfmVmb2ktcGhyHgsSB0NvbnRlbnQiEURQV0gtODQ1NzYyMjQxMzI5DA
DPWH,"March 04, 2023",MARKET GUIDELINES AND STANDARDS,DENIED,Research Study,03/04/2023 - 03/04/2023,https://www.foi.gov.ph/requests/aglzfmVmb2ktcGhyHgsSB0NvbnRlbnQiEURQV0gtMDQ4NTI3MjM4Mzg2DA
BIR,"March 04, 2023",The total number of stores in CALABARZON.,PENDING,Feasibility Study,03/04/2023 - 03/04/2023,https://www.foi.gov.ph/requests/aglzfmVmb2ktcGhyHQsSB0NvbnRlbnQiEEJJUi04OTg4NTk4Mzg1OTIM
NTC,"March 04, 2023",Stolen Phone during a Fiesta (Crowd),PENDING,Track lost phone via IMEI,03/04/2023 - 03/04/2023,https://www.foi.gov.ph/requests/aglzfmVmb2ktcGhyHQsSB0NvbnRlbnQiEE5UQy0wOTc1MTg5NjUwMTEM
DPWH,"March 04, 2023","DPWH Design, Guidelines, Criteria and Standards of Bridge Design",SUCCESSFUL,For Academic Purposes.,03/04/2023 - 03/04/2023,https://www.foi.gov.ph/requests/aglzfmVmb2ktcGhyHgsSB0NvbnRlbnQiEURQV0gtNjI4NzMyMTQ3NDk5DA
DSWD,"March 04, 2023",Number of PWD in Laguna,REFERRED,Thesis,03/04/2023 - 03/04/2023,https://www.foi.gov.ph/requests/aglzfmVmb2ktcGhyHgsSB0NvbnRlbnQiEURTV0QtNjgxMjc0NDUxNTc0DA
NCIP,"March 04, 2023",NCIP certificate for height waiver,DENIED,For applying BuCor/BJMP/BFP,03/04/2023 - 03/04/2023,https://www.foi.gov.ph/requests/aglzfmVmb2ktcGhyHgsSB0NvbnRlbnQiEU5DSVAtMTE4NTMxMzIyNjA3DA
PSA,"March 04, 2023",Statistics Data for Research Paper,PENDING,Research Paper,01/01/2021 - 01/01/2022,https://www.foi.gov.ph/requests/aglzfmVmb2ktcGhyHQsSB0NvbnRlbnQiEFBTQS01MzIwNjk2NjE5ODgM
NTC,"March 04, 2023",Track lost phone using IMEI,PENDING,Track lost phone using IMEI,03/01/2023 - 03/04/2023,https://www.foi.gov.ph/requests/aglzfmVmb2ktcGhyHQsSB0NvbnRlbnQiEE5UQy0yMTE2MzIyNDM0NzIM
PSA,"March 04, 2023",national ID,PENDING,for valid ID,03/04/2023 - 03/04/2023,https://www.foi.gov.ph/requests/aglzfmVmb2ktcGhyHQsSB0NvbnRlbnQiEFBTQS03MzI3OTk3MTAzMDEM
UsaP,"March 04, 2023",Number of Population/Consumers in Pasig City,ACCEPTED,Research Study,01/01/2022 - 03/04/2023,https://www.foi.gov.ph/requests/aglzfmVmb2ktcGhyHgsSB0NvbnRlbnQiEVVTQVAtNTgzNjg4ODE5ODcyDA
PNP,"March 04, 2023",I was scammed.,ACCEPTED,Refund my payment on gcash,02/02/2023 - 02/03/2023,https://www.foi.gov.ph/requests/aglzfmVmb2ktcGhyHQsSB0NvbnRlbnQiEFBOUC03MjM0OTc3MzE2MDgM
DepEd,"March 04, 2023",Report Card,SUCCESSFUL,College Requirement,06/01/2001 - 04/30/2005,https://www.foi.gov.ph/requests/aglzfmVmb2ktcGhyHwsSB0NvbnRlbnQiEkRlcEVkLTc0NTEyMzkwMTczMAw
DOF,"March 04, 2023",PHP Exchange Rate & Foreign Reserve Currency,DENIED,Senior High School Research,01/01/1972 - 12/31/2022,https://www.foi.gov.ph/requests/aglzfmVmb2ktcGhyHQsSB0NvbnRlbnQiEERPRi03ODgyNDE2MTM4MzIM
NBI,"March 04, 2023",Facebook Account Hacked,PENDING,To delete or remove the facebook account and to protect the personal information involved,03/04/2023 - 03/04/2023,https://www.foi.gov.ph/requests/aglzfmVmb2ktcGhyHQsSB0NvbnRlbnQiEE5CSS02NDk0MDcxNDAxNDMM
JJWC,"March 04, 2023",JJWC GAD Accomplishment Report,PENDING,Research and development,01/01/2021 - 12/31/2021,https://www.foi.gov.ph/requests/aglzfmVmb2ktcGhyHgsSB0NvbnRlbnQiEUpKV0MtOTQxOTQwNTcyNzEyDA
DOH,"March 04, 2023",Updating my vaccination,SUCCESSFUL,I urgently need my vaccination certificate,01/11/2022 - 02/02/2022,https://www.foi.gov.ph/requests/aglzfmVmb2ktcGhyHQsSB0NvbnRlbnQiEERPSC0yOTM0NTQwMjgwNTIM
PSA,"March 04, 2023",Number of nurses working in NCR hospitals,PENDING,Thesis,01/01/2021 - 12/31/2021,https://www.foi.gov.ph/requests/aglzfmVmb2ktcGhyHQsSB0NvbnRlbnQiEFBTQS0yNDY1MzAwMTU2MzQM
DepEd,"March 04, 2023","NAT results for south district in region 10, tangub city",AWAITING CLARIFICATION,tesis writing in Masters,01/01/2022 - 01/01/2022,https://www.foi.gov.ph/requests/aglzfmVmb2ktcGhyHwsSB0NvbnRlbnQiEkRlcEVkLTQzMDcwOTM0MDgwMQw
BIR,"March 04, 2023",Request for Non-Filing of Income Tax Return for Unemployed,PENDING,For schoalarship application,01/01/2022 - 01/01/2023,https://www.foi.gov.ph/requests/aglzfmVmb2ktcGhyHQsSB0NvbnRlbnQiEEJJUi0xMjMwNDU0ODkzNDIM
NCDA,"March 04, 2023",The Statistics of Visually Impaired Individuals in Cebu City,SUCCESSFUL,Thesis,12/30/2018 - 01/30/2023,https://www.foi.gov.ph/requests/aglzfmVmb2ktcGhyHgsSB0NvbnRlbnQiEU5DREEtOTM0MTYwODAyODA0DA
DepEd,"March 04, 2023",Project proposal under Basic Education Facilities Fund,AWAITING CLARIFICATION,Thesis,05/01/2018 - 03/04/2023,https://www.foi.gov.ph/requests/aglzfmVmb2ktcGhyHwsSB0NvbnRlbnQiEkRlcEVkLTAzNTI2NjU4NDgyMQw
DOH,"March 04, 2023",Philippine National Quality Strategy for Health: A Five-Year Plan (2019-2023),ACCEPTED,For Masters in Hospital Administration Assignment,01/01/2019 - 01/01/2023,https://www.foi.gov.ph/requests/aglzfmVmb2ktcGhyHQsSB0NvbnRlbnQiEERPSC00MzQ5ODMwOTUzNDEM
UPLB,"March 04, 2023",Hello..... I'm Royal family Justice at Lurd empperaon puoi King Edward henry Rabe,PENDING,Hello..... I'm Royal family Justice at Lurd empperaon puoi King Edward henry Rabe,10/04/1980 - 10/04/2020,https://www.foi.gov.ph/requests/aglzfmVmb2ktcGhyHgsSB0NvbnRlbnQiEVVQTEItNDQ5NzYwMTE5MTYwDA
DPWH,"March 04, 2023","DPWH Design, Guidelines, Criteria and Standards of Bridge Design",SUCCESSFUL,For Academic Purposes.,03/04/2023 - 03/04/2023,https://www.foi.gov.ph/requests/aglzfmVmb2ktcGhyHgsSB0NvbnRlbnQiEURQV0gtNjI4NzMyMTQ3NDk5DA
DSWD,"March 04, 2023",Number of PWD in Laguna,REFERRED,Thesis,03/04/2023 - 03/04/2023,https://www.foi.gov.ph/requests/aglzfmVmb2ktcGhyHgsSB0NvbnRlbnQiEURTV0QtNjgxMjc0NDUxNTc0DA
NCIP,"March 04, 2023",NCIP certificate for height waiver,DENIED,For applying BuCor/BJMP/BFP,03/04/2023 - 03/04/2023,https://www.foi.gov.ph/requests/aglzfmVmb2ktcGhyHgsSB0NvbnRlbnQiEU5DSVAtMTE4NTMxMzIyNjA3DA
PSA,"March 04, 2023",Statistics Data for Research Paper,PENDING,Research Paper,01/01/2021 - 01/01/2022,https://www.foi.gov.ph/requests/aglzfmVmb2ktcGhyHQsSB0NvbnRlbnQiEFBTQS01MzIwNjk2NjE5ODgM
NTC,"March 04, 2023",Track lost phone using IMEI,PENDING,Track lost phone using IMEI,03/01/2023 - 03/04/2023,https://www.foi.gov.ph/requests/aglzfmVmb2ktcGhyHQsSB0NvbnRlbnQiEE5UQy0yMTE2MzIyNDM0NzIM
PSA,"March 04, 2023",national ID,PENDING,for valid ID,03/04/2023 - 03/04/2023,https://www.foi.gov.ph/requests/aglzfmVmb2ktcGhyHQsSB0NvbnRlbnQiEFBTQS03MzI3OTk3MTAzMDEM
UsaP,"March 04, 2023",Number of Population/Consumers in Pasig City,ACCEPTED,Research Study,01/01/2022 - 03/04/2023,https://www.foi.gov.ph/requests/aglzfmVmb2ktcGhyHgsSB0NvbnRlbnQiEVVTQVAtNTgzNjg4ODE5ODcyDA
PNP,"March 04, 2023",I was scammed.,ACCEPTED,Refund my payment on gcash,02/02/2023 - 02/03/2023,https://www.foi.gov.ph/requests/aglzfmVmb2ktcGhyHQsSB0NvbnRlbnQiEFBOUC03MjM0OTc3MzE2MDgM
DepEd,"March 04, 2023",Report Card,SUCCESSFUL,College Requirement,06/01/2001 - 04/30/2005,https://www.foi.gov.ph/requests/aglzfmVmb2ktcGhyHwsSB0NvbnRlbnQiEkRlcEVkLTc0NTEyMzkwMTczMAw
DOF,"March 04, 2023",PHP Exchange Rate & Foreign Reserve Currency,DENIED,Senior High School Research,01/01/1972 - 12/31/2022,https://www.foi.gov.ph/requests/aglzfmVmb2ktcGhyHQsSB0NvbnRlbnQiEERPRi03ODgyNDE2MTM4MzIM
NBI,"March 04, 2023",Facebook Account Hacked,PENDING,To delete or remove the facebook account and to protect the personal information involved,03/04/2023 - 03/04/2023,https://www.foi.gov.ph/requests/aglzfmVmb2ktcGhyHQsSB0NvbnRlbnQiEE5CSS02NDk0MDcxNDAxNDMM
JJWC,"March 04, 2023",JJWC GAD Accomplishment Report,PENDING,Research and development,01/01/2021 - 12/31/2021,https://www.foi.gov.ph/requests/aglzfmVmb2ktcGhyHgsSB0NvbnRlbnQiEUpKV0MtOTQxOTQwNTcyNzEyDA
DOH,"March 04, 2023",Updating my vaccination,SUCCESSFUL,I urgently need my vaccination certificate,01/11/2022 - 02/02/2022,https://www.foi.gov.ph/requests/aglzfmVmb2ktcGhyHQsSB0NvbnRlbnQiEERPSC0yOTM0NTQwMjgwNTIM
PSA,"March 04, 2023",Number of nurses working in NCR hospitals,PENDING,Thesis,01/01/2021 - 12/31/2021,https://www.foi.gov.ph/requests/aglzfmVmb2ktcGhyHQsSB0NvbnRlbnQiEFBTQS0yNDY1MzAwMTU2MzQM
DepEd,"March 04, 2023","NAT results for south district in region 10, tangub city",AWAITING CLARIFICATION,tesis writing in Masters,01/01/2022 - 01/01/2022,https://www.foi.gov.ph/requests/aglzfmVmb2ktcGhyHwsSB0NvbnRlbnQiEkRlcEVkLTQzMDcwOTM0MDgwMQw
BIR,"March 04, 2023",Request for Non-Filing of Income Tax Return for Unemployed,PENDING,For schoalarship application,01/01/2022 - 01/01/2023,https://www.foi.gov.ph/requests/aglzfmVmb2ktcGhyHQsSB0NvbnRlbnQiEEJJUi0xMjMwNDU0ODkzNDIM
NCDA,"March 04, 2023",The Statistics of Visually Impaired Individuals in Cebu City,SUCCESSFUL,Thesis,12/30/2018 - 01/30/2023,https://www.foi.gov.ph/requests/aglzfmVmb2ktcGhyHgsSB0NvbnRlbnQiEU5DREEtOTM0MTYwODAyODA0DA
DepEd,"March 04, 2023",Project proposal under Basic Education Facilities Fund,AWAITING CLARIFICATION,Thesis,05/01/2018 - 03/04/2023,https://www.foi.gov.ph/requests/aglzfmVmb2ktcGhyHwsSB0NvbnRlbnQiEkRlcEVkLTAzNTI2NjU4NDgyMQw
DOH,"March 04, 2023",Philippine National Quality Strategy for Health: A Five-Year Plan (2019-2023),ACCEPTED,For Masters in Hospital Administration Assignment,01/01/2019 - 01/01/2023,https://www.foi.gov.ph/requests/aglzfmVmb2ktcGhyHQsSB0NvbnRlbnQiEERPSC00MzQ5ODMwOTUzNDEM
UPLB,"March 04, 2023",Hello..... I'm Royal family Justice at Lurd empperaon puoi King Edward henry Rabe,PENDING,Hello..... I'm Royal family Justice at Lurd empperaon puoi King Edward henry Rabe,10/04/1980 - 10/04/2020,https://www.foi.gov.ph/requests/aglzfmVmb2ktcGhyHgsSB0NvbnRlbnQiEVVQTEItNDQ5NzYwMTE5MTYwDA
DOJ,"March 04, 2023",PENDING CRIMINAL CASE,PENDING,CLARIFICATION AND TO VERIFY IT FROM COURT,03/04/2017 - 03/04/2023,https://www.foi.gov.ph/requests/aglzfmVmb2ktcGhyHQsSB0NvbnRlbnQiEERPSi04MDQyMTQ3OTM0NzcM
PNP,"March 04, 2023",Age waiver,SUCCESSFUL,For PNP applicants,03/04/2023 - 03/04/2023,https://www.foi.gov.ph/requests/aglzfmVmb2ktcGhyHQsSB0NvbnRlbnQiEFBOUC05Mzk1NDc3ODUyNjYM
NBI,"March 04, 2023",Online Loan Application,PENDING,To save all Pilipinos from harassment. To save them from illegal company,02/25/2023 - 03/04/2023,https://www.foi.gov.ph/requests/aglzfmVmb2ktcGhyHQsSB0NvbnRlbnQiEE5CSS0yODQ4ODE3NjM4NTQM
PNP,"March 04, 2023",The number of reported cases of hazing in the Philippines from 1995 to 2023,ACCEPTED,Research and Journalism,01/01/1995 - 03/02/2023,https://www.foi.gov.ph/requests/aglzfmVmb2ktcGhyHQsSB0NvbnRlbnQiEFBOUC0xMDc2NTc4NTU0MDgM
DOLE,"March 04, 2023",E certificate for sss un employment benefits,PENDING,Unemployment benefits,08/27/2016 - 12/30/2022,https://www.foi.gov.ph/requests/aglzfmVmb2ktcGhyHgsSB0NvbnRlbnQiEURPTEUtMzExNDY0MDk5ODExDA
IA,"March 04, 2023",The listed cultural and heritage attractions in Intramuros,SUCCESSFUL,"Undergraduate Thesis, University of the Philippines",03/04/2013 - 03/04/2023,https://www.foi.gov.ph/requests/aglzfmVmb2ktcGhyHAsSB0NvbnRlbnQiD0lBLTI5NTEzNDQ2MjcyOAw
BIR,"March 04, 2023",BIR 2316,PENDING,Proof of tax payments,01/01/2010 - 12/31/2017,https://www.foi.gov.ph/requests/aglzfmVmb2ktcGhyHQsSB0NvbnRlbnQiEEJJUi02MTg5MTk4OTIxOTQM
PNP,"March 04, 2023",for age waiver,SUCCESSFUL,FOR PNP APPLICANT,03/04/2023 - 03/04/2023,https://www.foi.gov.ph/requests/aglzfmVmb2ktcGhyHQsSB0NvbnRlbnQiEFBOUC05MDI2MTg1MzY0OTUM
PNP,"March 04, 2023",Data on Children-At-Risk in the Province of Albay,PROCESSING,Undergraduate thesis,01/01/2017 - 12/31/2022,https://www.foi.gov.ph/requests/aglzfmVmb2ktcGhyHQsSB0NvbnRlbnQiEFBOUC0wMzAyMTk0MTIyNzMM
NTC,"March 04, 2023",To block permanently all unknown numbers that message and call my Registered simcard,PENDING,Block all the unknow numbers that send me text messages and calls for scam,02/01/2023 - 03/04/2023,https://www.foi.gov.ph/requests/aglzfmVmb2ktcGhyHQsSB0NvbnRlbnQiEE5UQy0yNDMxMTAzMzY1ODUM
SSS,"March 04, 2023",SSS online account,PENDING,Request to reset my sss online account,03/04/2020 - 03/04/2023,https://www.foi.gov.ph/requests/aglzfmVmb2ktcGhyHQsSB0NvbnRlbnQiEFNTUy00MjM0MTQ4OTI4MjcM
DOE,"March 04, 2023",Industry average financial ratio request,ACCEPTED,This information will be used for my Strategic Management Paper. I’m currently taking up an MBA.,01/01/2022 - 12/31/2022,https://www.foi.gov.ph/requests/aglzfmVmb2ktcGhyHQsSB0NvbnRlbnQiEERPRS04MzAwMzAxNTMwNjIM
BIR,"March 04, 2023",BIR 2316,PENDING,For Loan,01/01/2022 - 02/28/2023,https://www.foi.gov.ph/requests/aglzfmVmb2ktcGhyHQsSB0NvbnRlbnQiEEJJUi0yOTQyMzY5MTA4MTUM
