agency,date,title,status,purpose,period_covered,link
NTC,"May 17, 2023",Location of phone number 09169276396 because that number is a scammer,PENDING,To trace the location of the number who scammed me.,05/16/2023 - 05/17/2023,https://www.foi.gov.ph/requests/aglzfmVmb2ktcGhyHQsSB0NvbnRlbnQiEE5UQy0xNzkyMjA5MzcwMDIM
PSA,"May 17, 2023","Distribution of Population by Sex and Marital Status, Province of Cotabato 2020",PARTIALLY SUCCESSFUL,For Ecological Profile,05/01/2020 - 05/17/2023,https://www.foi.gov.ph/requests/aglzfmVmb2ktcGhyHQsSB0NvbnRlbnQiEFBTQS0zNzYwMzAzOTE0NDUM
PSA,"May 17, 2023",The Number of registered coffee shops in the Philippines and in Cavite,ACCEPTED,Research and Development,01/01/2022 - 04/30/2023,https://www.foi.gov.ph/requests/aglzfmVmb2ktcGhyHQsSB0NvbnRlbnQiEFBTQS01NjIxMTQ3NzgyOTAM
DTI,"May 17, 2023",SMEs Establishments in Antipolo City,DENIED,Thesis,05/17/2023 - 05/17/2023,https://www.foi.gov.ph/requests/aglzfmVmb2ktcGhyHQsSB0NvbnRlbnQiEERUSS0xNjg5Mjk0MzY2MzUM
PSA,"May 17, 2023",List or Names of SME Establishments in Antipolo City,PARTIALLY SUCCESSFUL,Thesis,05/17/2018 - 05/17/2023,https://www.foi.gov.ph/requests/aglzfmVmb2ktcGhyHQsSB0NvbnRlbnQiEFBTQS05ODYzNjg2OTY5NzUM
BI,"May 17, 2023",Loss passport,PENDING,Report my loss passport and request for travel history,05/13/2023 - 05/15/2023,https://www.foi.gov.ph/requests/aglzfmVmb2ktcGhyHAsSB0NvbnRlbnQiD0JJLTM4MjU5MDMxMDczNAw
NIA,"May 17, 2023","Region 1, 2 and CAR river maximum and minimum flow, depth, volume, sedimentation for two decades.",PENDING,Research and Development,01/01/2002 - 12/31/2022,https://www.foi.gov.ph/requests/aglzfmVmb2ktcGhyHQsSB0NvbnRlbnQiEE5JQS0yMjM5MDU0MjIzNjYM
NTC,"May 17, 2023",Stolen phone,PENDING,To block my phone who got stolen by theft,05/13/2023 - 05/13/2023,https://www.foi.gov.ph/requests/aglzfmVmb2ktcGhyHQsSB0NvbnRlbnQiEE5UQy05MjM0ODA1ODM3MzIM
LTO,"May 17, 2023",LTO 2023 Annual Report (1st Quarter),DENIED,Business planning,01/01/2023 - 03/31/2023,https://www.foi.gov.ph/requests/aglzfmVmb2ktcGhyHQsSB0NvbnRlbnQiEExUTy02OTk0NDgyNDc1MjgM
SEC,"May 17, 2023",Text harassment and embarrassment,SUCCESSFUL,Complaining and Slander,05/15/2023 - 05/15/2023,https://www.foi.gov.ph/requests/aglzfmVmb2ktcGhyHQsSB0NvbnRlbnQiEFNFQy0yMjI3Mzc0NDI2MTMM
FDCP,"May 17, 2023",Updated Number of FDCP National Registry Applicants (Davao Region Only),PENDING,Research,01/01/2022 - 01/01/2023,https://www.foi.gov.ph/requests/aglzfmVmb2ktcGhyHgsSB0NvbnRlbnQiEUZEQ1AtMzY0MzgzNDU3MTE5DA
BSWM,"May 17, 2023",Soil type map of Greater Luzon,AWAITING CLARIFICATION,Master's thesis,01/01/1980 - 12/31/2019,https://www.foi.gov.ph/requests/aglzfmVmb2ktcGhyHgsSB0NvbnRlbnQiEUJTV00tMjI2NDUyNzI2MDc1DA
PSA,"May 17, 2023",School Age Children Age 5-11,PENDING,For monitoring of the participation of school children aged 5-11 and to help out of school children,07/01/2018 - 07/01/2022,https://www.foi.gov.ph/requests/aglzfmVmb2ktcGhyHQsSB0NvbnRlbnQiEFBTQS03NDMxNTg5NzI4NTMM
LMB,"May 17, 2023","Comprehensive Land Use Plan of Trento, Agusan del Sur",ACCEPTED,Writing of report,01/01/2010 - 12/31/2020,https://www.foi.gov.ph/requests/aglzfmVmb2ktcGhyIQsSB0NvbnRlbnQiFERFTlJMTUItMjg0NDc2MzgxNDE4DA
DSWD,"May 17, 2023",Nursing home and assisted living facility data,ACCEPTED,THESIS RESEARCH,05/17/2023 - 05/17/2023,https://www.foi.gov.ph/requests/aglzfmVmb2ktcGhyHgsSB0NvbnRlbnQiEURTV0QtMTUyNDgyMjM0ODM4DA
DOLE,"May 17, 2023",Request for Certificate of No Employment as a student,PENDING,needed for visa processing,04/01/2023 - 05/17/2023,https://www.foi.gov.ph/requests/aglzfmVmb2ktcGhyHgsSB0NvbnRlbnQiEURPTEUtNDcyNzU5MjUyMjY4DA
DILG,"May 17, 2023",Manila's financial statement for the first quarter of 2023,PENDING,For journalism article (news analysis),01/01/2023 - 03/31/2023,https://www.foi.gov.ph/requests/aglzfmVmb2ktcGhyHgsSB0NvbnRlbnQiEURJTEctNTc3OTA3ODAzMTEyDA
PSA,"May 17, 2023",Marriage Record,PARTIALLY SUCCESSFUL,For Marriage,01/01/1997 - 01/01/2000,https://www.foi.gov.ph/requests/aglzfmVmb2ktcGhyHQsSB0NvbnRlbnQiEFBTQS00MDA1NjczMDY0MTEM
DOH,"May 17, 2023",Gina Gonio,SUCCESSFUL,For domestic helper at saudi,05/05/2023 - 05/05/2023,https://www.foi.gov.ph/requests/aglzfmVmb2ktcGhyHQsSB0NvbnRlbnQiEERPSC03Nzk3ODUwMTAzMDMM
PSA,"May 17, 2023",The number of banana consumption per barangay in Tondo Manila,SUCCESSFUL,Feasibility Study,01/31/2017 - 12/31/2021,https://www.foi.gov.ph/requests/aglzfmVmb2ktcGhyHQsSB0NvbnRlbnQiEFBTQS04MjEwMzQ4MzkyNjkM
IC,"May 17, 2023",INSURANCE COMMISSION-FINANCIAL ADVISOR LICENSE ID/Certification,ACCEPTED,For identification to clients and employment purposes,07/22/2021 - 05/17/2023,https://www.foi.gov.ph/requests/aglzfmVmb2ktcGhyHAsSB0NvbnRlbnQiD0lDLTM0NDQzODMzMDE3Mgw
MMDA,"May 17, 2023",cctv footage,AWAITING CLARIFICATION,para makita lang po ung pusa namin,05/17/2023 - 05/17/2023,https://www.foi.gov.ph/requests/aglzfmVmb2ktcGhyHgsSB0NvbnRlbnQiEU1NREEtNzE2NTgwNDMxNjczDA
PSA,"May 17, 2023",Philippine National ID Claim Stub Copy,PARTIALLY SUCCESSFUL,To claim my Phil National ID,05/17/2023 - 05/17/2023,https://www.foi.gov.ph/requests/aglzfmVmb2ktcGhyHQsSB0NvbnRlbnQiEFBTQS0yMDAxOTU1MTU2MDQM
DOH,"May 17, 2023","Detailed layout plan and floor plan for the existing building of the House of Hope Foundation, Inc",DENIED,Architectural Thesis Project,05/03/2023 - 05/17/2023,https://www.foi.gov.ph/requests/aglzfmVmb2ktcGhyHQsSB0NvbnRlbnQiEERPSC00Mzc4NDc0ODI4NTkM
OWWA,"May 17, 2023",change name of claimant of AKAP Assistance,SUCCESSFUL,AKAP Assistance,04/27/2023 - 05/17/2023,https://www.foi.gov.ph/requests/aglzfmVmb2ktcGhyHgsSB0NvbnRlbnQiEU9XV0EtNjY1NDYwNjQ4MDc1DA
DOH,"May 17, 2023","Detailed layout plan and floor plan for the existing building of the House of Hope Foundation, Inc",DENIED,Architectural Thesis Project,05/03/2023 - 05/17/2023,https://www.foi.gov.ph/requests/aglzfmVmb2ktcGhyHQsSB0NvbnRlbnQiEERPSC03MTI5MTQxMjgxMzcM
NHA,"May 17, 2023","Detailed layout plan and floor plan for the existing building of the House of Hope Foundation, Inc.",SUCCESSFUL,Architectural Thesis,05/03/2023 - 05/17/2023,https://www.foi.gov.ph/requests/aglzfmVmb2ktcGhyHQsSB0NvbnRlbnQiEE5IQS0yMDQyNjE0NjUxMDQM
DOE,"May 17, 2023",List of oil depots stating their owners in Mindanao and Visayas,PENDING,Marketing,01/01/2000 - 05/17/2023,https://www.foi.gov.ph/requests/aglzfmVmb2ktcGhyHQsSB0NvbnRlbnQiEERPRS04NTk1NTEzNzY2NjEM
SEC,"May 17, 2023",Copy for a the existing Layout and Floorplan for The House of Hope Foundation Incorporation in Regio,ACCEPTED,Architectural Thesis,05/03/2023 - 05/17/2023,https://www.foi.gov.ph/requests/aglzfmVmb2ktcGhyHQsSB0NvbnRlbnQiEFNFQy0xNjM1MDIzMzk1NjgM
BLGF,"May 17, 2023",Quezon City Budget proposal,DENIED,School purposes,01/01/2022 - 03/31/2023,https://www.foi.gov.ph/requests/aglzfmVmb2ktcGhyHgsSB0NvbnRlbnQiEUJMR0YtODQ0MDkxMDMwNzE1DA
DENR,"May 17, 2023",Status of Surface Water Quality in Tarlac,REFERRED,Research and development for Plan 299,01/01/2022 - 04/30/2023,https://www.foi.gov.ph/requests/aglzfmVmb2ktcGhyHgsSB0NvbnRlbnQiEURFTlItMDYyMzM0MzYzNDYzDA
ERC,"May 17, 2023",Effective Rates per Distribution Utility,ACCEPTED,news report,01/01/2022 - 05/17/2023,https://www.foi.gov.ph/requests/aglzfmVmb2ktcGhyHQsSB0NvbnRlbnQiEEVSQy05Njg1MDIwMDM5OTEM
PHIVOLCS,"May 17, 2023",Shapefile of active faults in the Philippines,DENIED,Undergraduate Thesis,05/17/2018 - 05/17/2023,https://www.foi.gov.ph/requests/aglzfmVmb2ktcGhyIgsSB0NvbnRlbnQiFVBISVZPTENTLTc5NzQ5MzAzODQzNgw
PSA,"May 17, 2023",PhlysysTracking reference number,PARTIALLY SUCCESSFUL,For my national ID,11/09/2022 - 11/09/2022,https://www.foi.gov.ph/requests/aglzfmVmb2ktcGhyHQsSB0NvbnRlbnQiEFBTQS01MjE0MjEyMjk0OTMM
DOF,"May 17, 2023",Manila's Financial Statement for the First Quarter of 2023,DENIED,journalism article (news analysis),01/01/2023 - 03/31/2023,https://www.foi.gov.ph/requests/aglzfmVmb2ktcGhyHQsSB0NvbnRlbnQiEERPRi02NDgzNTY4NTc1NDUM
DA,"May 17, 2023",Composition of Committee on Anti- Red Tape (CART),SUCCESSFUL,Updating of Database for CART,05/17/2023 - 05/17/2023,https://www.foi.gov.ph/requests/aglzfmVmb2ktcGhyHAsSB0NvbnRlbnQiD0RBLTQ0MTYyOTAwMjczNww
DBM,"May 17, 2023",Composition of Committee on Anti-Red Tape Authority (CART),DENIED,Updating of Database for CART,05/17/2023 - 05/17/2023,https://www.foi.gov.ph/requests/aglzfmVmb2ktcGhyHQsSB0NvbnRlbnQiEERCTS00OTk2NTU3NTY4MzkM
SEC,"May 17, 2023",Collateral Loans/Lending in the Philippines,SUCCESSFUL,Research,01/01/2018 - 04/30/2023,https://www.foi.gov.ph/requests/aglzfmVmb2ktcGhyHQsSB0NvbnRlbnQiEFNFQy0zMjA5MjQ0NTcwMDIM
DOH,"May 17, 2023",VaxCert No Record Found,SUCCESSFUL,Vaccination Certificate Follow-up,11/10/2021 - 05/17/2023,https://www.foi.gov.ph/requests/aglzfmVmb2ktcGhyHQsSB0NvbnRlbnQiEERPSC04MTE0NjMyNzAxMzIM
NTC,"May 17, 2023",Trace the number,SUCCESSFUL,Upang maibalik ang nawalang pera,04/02/2023 - 05/17/2023,https://www.foi.gov.ph/requests/aglzfmVmb2ktcGhyHQsSB0NvbnRlbnQiEE5UQy05NDc1OTAzODU2NzcM
MTRCB,"May 17, 2023","Films, TV Shows, for Children",PENDING,Research,01/01/2018 - 04/30/2023,https://www.foi.gov.ph/requests/aglzfmVmb2ktcGhyHwsSB0NvbnRlbnQiEk1UUkNCLTU4MDk1NjI1MDE0MQw
MLWD,"May 17, 2023","Water Supply and Distribution Layout in Padre Garcia, Batangas",DENIED,Research and Development,05/17/2023 - 05/17/2023,https://www.foi.gov.ph/requests/aglzfmVmb2ktcGhyHgsSB0NvbnRlbnQiEU1MV0QtNDY5Njg0MTYyOTM4DA
NTC,"May 17, 2023",Block Device And Sim,PARTIALLY SUCCESSFUL,To avoid robbers use my device as well as my number associated in it.,05/15/2023 - 05/17/2023,https://www.foi.gov.ph/requests/aglzfmVmb2ktcGhyHQsSB0NvbnRlbnQiEE5UQy04OTcyNDYyMDM3NTEM
DOH,"May 17, 2023",Covid booster vaccine,SUCCESSFUL,For abroad,04/20/2023 - 04/28/2023,https://www.foi.gov.ph/requests/aglzfmVmb2ktcGhyHQsSB0NvbnRlbnQiEERPSC04NjEyMjExNjgwOTYM
BIR,"May 17, 2023",1701Q for the year 2022,ACCEPTED,Tourist visa application,01/01/2022 - 12/31/2022,https://www.foi.gov.ph/requests/aglzfmVmb2ktcGhyHQsSB0NvbnRlbnQiEEJJUi0xNTI3NjM4MjY3MzIM
DA,"May 17, 2023","Shapefile of Production of Crops, Poultry, and Livestock in San Leonardo, Nueva Ecija",SUCCESSFUL,School Project,01/01/2019 - 12/31/2020,https://www.foi.gov.ph/requests/aglzfmVmb2ktcGhyHAsSB0NvbnRlbnQiD0RBLTc3NDE5MjMyNzc2MAw
DTI,"May 17, 2023","The list of DTI-registered MSMEs in Brgy. San Antonio, Paranaque City",ACCEPTED,Research and Development,01/01/2022 - 12/31/2022,https://www.foi.gov.ph/requests/aglzfmVmb2ktcGhyHQsSB0NvbnRlbnQiEERUSS01NTY5MTQwMjM1NTcM
NBI,"May 17, 2023","SCAM ON THE FB PAGE NAME: Gamewerks Gadget PH, OWNER NAME: LITO B. PASCUL",PENDING,Public Announcement,05/14/2023 - 05/17/2023,https://www.foi.gov.ph/requests/aglzfmVmb2ktcGhyHQsSB0NvbnRlbnQiEE5CSS0yMzUwNDM5NjUxNzcM
CHED,"May 17, 2023",REQUEST FOR NSTP SERIAL NUMBER,PENDING,Personal Document File,03/01/2012 - 03/30/2016,https://www.foi.gov.ph/requests/aglzfmVmb2ktcGhyHgsSB0NvbnRlbnQiEUNIRUQtMjA2ODMxOTQ1NzUzDA
FDCP,"May 17, 2023",Film Training Institutes,PENDING,Architectural Thesis,04/29/2020 - 04/29/2023,https://www.foi.gov.ph/requests/aglzfmVmb2ktcGhyHgsSB0NvbnRlbnQiEUZEQ1AtNzY3NDMyMjE1MjA3DA
BSWM,"May 17, 2023","Shapefile of Production of Crops, Poultry, and Livestock in San Leonardo, Nueva Ecija",REFERRED,School Project,01/01/2019 - 12/31/2020,https://www.foi.gov.ph/requests/aglzfmVmb2ktcGhyHgsSB0NvbnRlbnQiEUJTV00tMjU5NzMxNzI1MTEwDA
PSA,"May 17, 2023",Latest Statistic of informal business in the Philippines,PENDING,Research,01/01/2020 - 01/01/2022,https://www.foi.gov.ph/requests/aglzfmVmb2ktcGhyHQsSB0NvbnRlbnQiEFBTQS02OTE5OTc5OTEyMzUM
NTC,"May 17, 2023",BLACKMAIL,SUCCESSFUL,URGENT 😭,05/16/2023 - 05/17/2023,https://www.foi.gov.ph/requests/aglzfmVmb2ktcGhyHQsSB0NvbnRlbnQiEE5UQy05NjM5NDU0ODM2MTAM
PSA,"May 17, 2023",Ivan Cerbo Child,PARTIALLY SUCCESSFUL,Educational purpose,09/01/2021 - 05/16/2023,https://www.foi.gov.ph/requests/aglzfmVmb2ktcGhyHQsSB0NvbnRlbnQiEFBTQS05NjkxMDU3MDY0NjYM
BIR,"May 17, 2023",The latest Income Tax Return of parents and Bir form 2316 for fixed income ew,SUCCESSFUL,SCHOLAR,12/01/2022 - 04/10/2023,https://www.foi.gov.ph/requests/aglzfmVmb2ktcGhyHQsSB0NvbnRlbnQiEEJJUi0xMTkzOTE1NDY4MTEM
DepEd,"May 17, 2023",Request Original Copy of Highschool Diploma,SUCCESSFUL,For License to Exercise Scty. Professional (LESP) and legal purposes,03/22/2000 - 03/22/2002,https://www.foi.gov.ph/requests/aglzfmVmb2ktcGhyHwsSB0NvbnRlbnQiEkRlcEVkLTYzNDc2MTE0NjA4Nww
LTO,"May 17, 2023",Total of registered vehicle 2Wheels and 4 Wheels in Central Luzon and Nort Luzon,SUCCESSFUL,For research pusposes,01/01/2020 - 04/30/2023,https://www.foi.gov.ph/requests/aglzfmVmb2ktcGhyHQsSB0NvbnRlbnQiEExUTy03NzAwMTU4OTU2NzQM
DBM,"May 17, 2023",Manila's financial statement for the first quarter of 2023,REFERRED,For journalism article (news analysis),01/01/2023 - 03/31/2023,https://www.foi.gov.ph/requests/aglzfmVmb2ktcGhyHQsSB0NvbnRlbnQiEERCTS03MDQwNzkzNDI4NTYM
NTC,"May 17, 2023",Block Sim Card,PARTIALLY SUCCESSFUL,To stop this No. from scamming,05/17/2023 - 05/17/2023,https://www.foi.gov.ph/requests/aglzfmVmb2ktcGhyHQsSB0NvbnRlbnQiEE5UQy05OTg3MDEzMzY1MzIM
OWWA,"May 17, 2023",The number of OFWs in Looc Calamba City,SUCCESSFUL,For Thesis,01/20/2016 - 01/20/2016,https://www.foi.gov.ph/requests/aglzfmVmb2ktcGhyHgsSB0NvbnRlbnQiEU9XV0EtNjUwNjMxODg0NDkzDA
DOH,"May 17, 2023",Philippine Mental Health Statistics - NCMH,PROCESSING,Capstone Design Project -Thesis,05/17/2023 - 05/17/2023,https://www.foi.gov.ph/requests/aglzfmVmb2ktcGhyHQsSB0NvbnRlbnQiEERPSC05NzQ1NDg3MTI4NTIM
MMDA,"May 17, 2023",Integrated Solid Waste Disposal Facility,ACCEPTED,Architectural Thesis,05/17/2023 - 05/17/2023,https://www.foi.gov.ph/requests/aglzfmVmb2ktcGhyHgsSB0NvbnRlbnQiEU1NREEtOTc5MDI4MDY5NTg1DA
MMDA,"May 17, 2023",Number of Daily commuters,REFERRED,Feasibility Study,05/17/2023 - 05/17/2023,https://www.foi.gov.ph/requests/aglzfmVmb2ktcGhyHgsSB0NvbnRlbnQiEU1NREEtMDk2MTkxODI2NTkwDA
DepEd,"May 17, 2023",NSAT result,AWAITING CLARIFICATION,Requirement to attend College School,06/01/1993 - 06/19/1994,https://www.foi.gov.ph/requests/aglzfmVmb2ktcGhyHwsSB0NvbnRlbnQiEkRlcEVkLTE4Njc2MjIwMTM2Mgw
DA,"May 17, 2023",Annual Number of Vegetable Farms in Batangas Probince,SUCCESSFUL,Feasibility Study,05/17/2013 - 05/17/2023,https://www.foi.gov.ph/requests/aglzfmVmb2ktcGhyHAsSB0NvbnRlbnQiD0RBLTc0MDE4NDUzMTQwMww
MinDA,"May 17, 2023",Agreement on hydrogen energy investments in Zamboanga Sibugay,PENDING,"Energy research, public policy",05/05/2023 - 05/05/2023,https://www.foi.gov.ph/requests/aglzfmVmb2ktcGhyHwsSB0NvbnRlbnQiEk1pbkRBLTUxMDYwNzM2ODA0Ngw
DSWD,"May 17, 2023","Reported number of cases of the victim of violence against men, women and children",REFERRED,Architectural thesis,01/01/2020 - 12/31/2022,https://www.foi.gov.ph/requests/aglzfmVmb2ktcGhyHgsSB0NvbnRlbnQiEURTV0QtNTc4NzcyNzQ3NDk5DA
NTC,"May 17, 2023",BLOCK SIM CARD,PARTIALLY SUCCESSFUL,Block sim card,05/01/2023 - 05/17/2023,https://www.foi.gov.ph/requests/aglzfmVmb2ktcGhyHQsSB0NvbnRlbnQiEE5UQy01MDk5MDA0MDEzMjgM
PSA,"May 17, 2023",Population of Baguio City and Estimated Coffee Drinkers,PENDING,For thesis reference of data and information,01/01/2018 - 12/31/2022,https://www.foi.gov.ph/requests/aglzfmVmb2ktcGhyHQsSB0NvbnRlbnQiEFBTQS0zODk0MDMyOTE0MjEM
DOH,"May 17, 2023","OCA and HEA from March 2022-December 31, 2022",SUCCESSFUL,For follow up of delayed OCA and HEA,03/01/2022 - 12/31/2022,https://www.foi.gov.ph/requests/aglzfmVmb2ktcGhyHQsSB0NvbnRlbnQiEERPSC01MDQ5OTY4NzEzNzQM
DILG,"May 17, 2023",The technological specifics of the hydrogen power plant to be built in Zamboanga Sibugay,PENDING,Energy research,01/01/2023 - 04/19/2023,https://www.foi.gov.ph/requests/aglzfmVmb2ktcGhyHgsSB0NvbnRlbnQiEURJTEctOTMwMjc4NTE2NDY2DA
DENR EMB,"May 17, 2023",ENVIRONMENTAL IMPACT STATEMENT OF BATANGAS CITY GRAND TERMINAL,PENDING,Research Development (Academic Purposes),05/16/2023 - 05/17/2023,https://www.foi.gov.ph/requests/aglzfmVmb2ktcGhyIQsSB0NvbnRlbnQiFERFTlJFTUItOTMxNjY1MzIwMDQ5DA
DBM,"May 17, 2023",Internal Revenue Allotment for Specified LGU units,SUCCESSFUL,Research and Assessment,01/20/2022 - 05/17/2023,https://www.foi.gov.ph/requests/aglzfmVmb2ktcGhyHQsSB0NvbnRlbnQiEERCTS0yNTYzMTg2MDY2OTYM
GSIS,"May 17, 2023","Kindly requesting for list of foreclosed property at San Mateo, Rizal",SUCCESSFUL,Purchase of Property,05/17/2023 - 05/17/2023,https://www.foi.gov.ph/requests/aglzfmVmb2ktcGhyHgsSB0NvbnRlbnQiEUdTSVMtNTI1MjQwMzU2MDIzDA
DOH,"May 17, 2023",. Total Number of patients/reported cases with Mental Disorder (all disorders) including anxiety and,PROCESSING,Architectural Thesis,05/03/2023 - 05/17/2023,https://www.foi.gov.ph/requests/aglzfmVmb2ktcGhyHQsSB0NvbnRlbnQiEERPSC01MDc2NjA0NjM5NTkM
HDMF,"May 17, 2023",Land utilization and productivity for all. Is this part of government?,PENDING,Information and legality,05/17/2023 - 05/17/2023,https://www.foi.gov.ph/requests/aglzfmVmb2ktcGhyHgsSB0NvbnRlbnQiEUhETUYtMTM3NzYxMDM4MjI5DA
BI,"May 17, 2023",Hold departure order,PENDING,I wish to travel,12/17/2022 - 05/17/2023,https://www.foi.gov.ph/requests/aglzfmVmb2ktcGhyHAsSB0NvbnRlbnQiD0JJLTE2NDk5OTExMTc1MAw
DOH,"May 17, 2023","OCA and HEA from March 2022-December 31, 2022",SUCCESSFUL,Follow up for OCA and HEA,03/01/2022 - 12/31/2022,https://www.foi.gov.ph/requests/aglzfmVmb2ktcGhyHQsSB0NvbnRlbnQiEERPSC02OTU3MTA5MDQ3MDQM
ITDI,"May 17, 2023",Weighing scale calibration standard,SUCCESSFUL,to establish accuracy calibration standard of weighing scale,01/20/2022 - 05/16/2023,https://www.foi.gov.ph/requests/aglzfmVmb2ktcGhyHgsSB0NvbnRlbnQiEUlUREktMzY0MTk2MjczNjEzDA
NYC,"May 17, 2023",Out of School Youth,SUCCESSFUL,Research,01/01/2014 - 12/31/2022,https://www.foi.gov.ph/requests/aglzfmVmb2ktcGhyHQsSB0NvbnRlbnQiEE5ZQy0xNTM4NTQ0ODA0MjcM
DepEd,"May 17, 2023",Out of School Youth,AWAITING CLARIFICATION,Research,01/01/2013 - 12/31/2022,https://www.foi.gov.ph/requests/aglzfmVmb2ktcGhyHwsSB0NvbnRlbnQiEkRlcEVkLTAxNjMzNzExNzE0MQw
PSA,"May 17, 2023",Out of School Youth,PENDING,Research,01/01/2014 - 12/31/2022,https://www.foi.gov.ph/requests/aglzfmVmb2ktcGhyHQsSB0NvbnRlbnQiEFBTQS04ODAxNDQwODAzMzkM
DOH,"May 17, 2023",Update Vaccination Certificate,SUCCESSFUL,Travel to Singapore,08/18/2022 - 08/18/2022,https://www.foi.gov.ph/requests/aglzfmVmb2ktcGhyHQsSB0NvbnRlbnQiEERPSC0zMDgyNDIxNzMzNjEM
NBI,"May 17, 2023",Estafa or Criminal Case Verification,PENDING,To clear my name if necessary,07/01/2022 - 05/17/2023,https://www.foi.gov.ph/requests/aglzfmVmb2ktcGhyHQsSB0NvbnRlbnQiEE5CSS0xNzQ1MTc1ODE3NzUM
DOH,"May 17, 2023",vaccination certificate,SUCCESSFUL,vaccination certificate update request cancellation,05/17/2023 - 05/17/2023,https://www.foi.gov.ph/requests/aglzfmVmb2ktcGhyHQsSB0NvbnRlbnQiEERPSC05MzU5MzI5NTYwMTAM
NTC,"May 17, 2023",Updated list of Telecommunications Corporations (Franchise Holders) under NTC,PENDING,Research,01/01/1980 - 05/17/2023,https://www.foi.gov.ph/requests/aglzfmVmb2ktcGhyHQsSB0NvbnRlbnQiEE5UQy00NDI4MTA3Nzc0NjMM
CDA,"May 17, 2023",Five Years Asset Size and Value from 2017 to 2022 of Registered Cooperatives in the Philippines,ACCEPTED,Research and Development,01/01/2017 - 12/31/2022,https://www.foi.gov.ph/requests/aglzfmVmb2ktcGhyHQsSB0NvbnRlbnQiEENEQS0yMDE3NTA2MTU4NTEM
NTC,"May 17, 2023",UNLAWFUL PURCHASE OF CELLULAR PHONE,PARTIALLY SUCCESSFUL,Disable cellphone purchased through a stolen credit card,05/12/2023 - 05/17/2023,https://www.foi.gov.ph/requests/aglzfmVmb2ktcGhyHQsSB0NvbnRlbnQiEE5UQy04NzQ4NzA4MzEzMTEM
DOH,"May 17, 2023",Master List of All Hospitals,PARTIALLY SUCCESSFUL,Research and development,01/01/2022 - 12/31/2022,https://www.foi.gov.ph/requests/aglzfmVmb2ktcGhyHQsSB0NvbnRlbnQiEERPSC04MjE2NjA4NjM2NzYM
BIR,"May 17, 2023",Requirements to support 0% VAT entitlement,SUCCESSFUL,research purposes,05/17/2023 - 05/17/2023,https://www.foi.gov.ph/requests/aglzfmVmb2ktcGhyHQsSB0NvbnRlbnQiEEJJUi0xMjU3Mzc5OTI0NDAM
NTC,"May 17, 2023",WRONG CASHED IN NUMBER FOR GCASH VIA 7/11 KIOSK MACHINE,DENIED,para mabawi ang funds/ money na cash in na ko sa wrong number,05/16/2023 - 05/17/2023,https://www.foi.gov.ph/requests/aglzfmVmb2ktcGhyHQsSB0NvbnRlbnQiEE5UQy0zMTM5MTAzNDQ1MDgM
BSWM,"May 17, 2023",Soil Type Agricultural Suitability and Soil Characteristics,PROCESSING,Updating of Comprehensive Land Use Plan,01/01/2016 - 05/17/2023,https://www.foi.gov.ph/requests/aglzfmVmb2ktcGhyHgsSB0NvbnRlbnQiEUJTV00tMzkwOTExMjEyNTk5DA
DOH,"May 17, 2023",The case number of diseases of children in Bicol Region and number of Pediatrician in Bicol Region,PROCESSING,Architectural Thesis: A proposed Bicol Pediatric Hospital,01/01/2018 - 01/01/2022,https://www.foi.gov.ph/requests/aglzfmVmb2ktcGhyHQsSB0NvbnRlbnQiEERPSC0zNzQzODQ1NjcyMjQM
PSA,"May 17, 2023",Children's Population and number of cases of children's diseases in Bicol,SUCCESSFUL,Architectural Thesis: Bicol Pediatric Hospital,01/01/2018 - 01/01/2023,https://www.foi.gov.ph/requests/aglzfmVmb2ktcGhyHQsSB0NvbnRlbnQiEFBTQS0xMTIwODQ3MzM5MjcM
NBI,"May 17, 2023",Complaint against OLA,PENDING,To take necessary action on these OLA and to stop operating,05/17/2023 - 05/17/2023,https://www.foi.gov.ph/requests/aglzfmVmb2ktcGhyHQsSB0NvbnRlbnQiEE5CSS04Njc2MjI2OTE4MDQM
NEDA,"May 17, 2023",Pampanga Megalopolis Plan,DENIED,Academic purposes,05/17/2017 - 05/17/2023,https://www.foi.gov.ph/requests/aglzfmVmb2ktcGhyHgsSB0NvbnRlbnQiEU5FREEtODMxNDI1Mzk2MDAxDA
PNP,"May 17, 2023",Electoral Violence sex-disaggregated data (men and women) from 2013 elections to 2023 elections,ACCEPTED,Master's Thesis Research,01/01/2013 - 05/17/2023,https://www.foi.gov.ph/requests/aglzfmVmb2ktcGhyHQsSB0NvbnRlbnQiEFBOUC00NzE3MzEyNjIxMDUM
PSA,"May 17, 2023",Population by age and gender per barangay,PARTIALLY SUCCESSFUL,research,12/31/2020 - 12/31/2020,https://www.foi.gov.ph/requests/aglzfmVmb2ktcGhyHQsSB0NvbnRlbnQiEFBTQS01MTgwNjM4MjM3MDUM
DOH,"May 17, 2023",Additional Data for College Thesis,PROCESSING,College Thesis,01/30/2020 - 03/29/2023,https://www.foi.gov.ph/requests/aglzfmVmb2ktcGhyHQsSB0NvbnRlbnQiEERPSC00NTUwNTUxMjYyMzYM
DILG,"May 17, 2023",DILG Memorandum Circular 2000-117,PENDING,Research and records,08/30/2000 - 09/23/2000,https://www.foi.gov.ph/requests/aglzfmVmb2ktcGhyHgsSB0NvbnRlbnQiEURJTEctNzQyMTI2NzE3MzMxDA
DA,"May 17, 2023","Shapefile of Production of Crops, Poultry, and Livestock in San Leonardo, Nueva Ecija",REFERRED,School Project,01/01/2019 - 12/31/2020,https://www.foi.gov.ph/requests/aglzfmVmb2ktcGhyHAsSB0NvbnRlbnQiD0RBLTc0Nzg5NDQ0Nzg4MQw
BSWM,"May 17, 2023",STW and SPIS that uses georesisitivity in site location in Camarines Sur,PROCESSING,Thesis regarding STW and SPIS which uses georesistivity method in site locating,05/16/2023 - 05/16/2023,https://www.foi.gov.ph/requests/aglzfmVmb2ktcGhyHgsSB0NvbnRlbnQiEUJTV00tNzU3MjQzNDYyMjY5DA
DOH,"May 17, 2023",Number of cases of Diabetes Mellitus Type 2 in Cebu City from 2020-2023,PROCESSING,Research,01/01/2020 - 05/17/2023,https://www.foi.gov.ph/requests/aglzfmVmb2ktcGhyHQsSB0NvbnRlbnQiEERPSC0yMjIzNzkyNDcwMzQM
DOH,"May 17, 2023",The total number of cases of diabetes mellitus type 2 from 2022-2023 in Cebu City,PROCESSING,Research,01/01/2022 - 05/17/2023,https://www.foi.gov.ph/requests/aglzfmVmb2ktcGhyHQsSB0NvbnRlbnQiEERPSC03MjA5NDc3Mzg3NDMM
NTC,"May 17, 2023",BLACKMAIL,PARTIALLY SUCCESSFUL,URGENT 😭,05/16/2023 - 05/17/2023,https://www.foi.gov.ph/requests/aglzfmVmb2ktcGhyHQsSB0NvbnRlbnQiEE5UQy02Nzg0MzAyNzA2NjgM
LTO,"May 17, 2023",Conductor's License Serial Number,DENIED,Driver's License Renewal,05/17/2023 - 05/17/2023,https://www.foi.gov.ph/requests/aglzfmVmb2ktcGhyHQsSB0NvbnRlbnQiEExUTy0xMjEyNjY5MTE2ODcM
BI,"May 17, 2023",DFA APOSTILLE BUREAU OF IMMIGRATION WITH TRAVEL HISTORY,PENDING,QUATAR POLICE CLEARANCE,04/02/2016 - 02/29/2020,https://www.foi.gov.ph/requests/aglzfmVmb2ktcGhyHAsSB0NvbnRlbnQiD0JJLTk0ODIwOTU2OTA5OQw
CHED,"May 17, 2023",Form 137,PENDING,For birth certificate correction requirements and for employment,06/16/2008 - 04/01/2011,https://www.foi.gov.ph/requests/aglzfmVmb2ktcGhyHgsSB0NvbnRlbnQiEUNIRUQtNzk3NzgyNjAzNjE3DA
DENR EMB,"May 17, 2023",INQUIRY REGARDING CONSTRUCTION AND DEMOLITON CONCRETE WASTE,PENDING,Research and Development,05/16/2023 - 05/16/2023,https://www.foi.gov.ph/requests/aglzfmVmb2ktcGhyIQsSB0NvbnRlbnQiFERFTlJFTUItNTQwMjYzNzg3MDc3DA
CHED,"May 17, 2023",Transcript of Record,PENDING,For birth certificate correction and for employment,06/16/2014 - 04/14/2018,https://www.foi.gov.ph/requests/aglzfmVmb2ktcGhyHgsSB0NvbnRlbnQiEUNIRUQtMjgzMTU5Njg4NzA3DA
BIR,"May 17, 2023",Income Tax Return,DENIED,application for graduate studies scholarship.,05/01/2022 - 05/17/2023,https://www.foi.gov.ph/requests/aglzfmVmb2ktcGhyHQsSB0NvbnRlbnQiEEJJUi0yMjM2MDYyOTUyMTgM
NBI,"May 17, 2023",Criminal Case Verification (Estafa),PENDING,To take necessary action if needed,07/01/2022 - 07/01/2022,https://www.foi.gov.ph/requests/aglzfmVmb2ktcGhyHQsSB0NvbnRlbnQiEE5CSS05MjA0MDQ1MzE3NDYM
NTC,"May 17, 2023",BLACKMAIL,PARTIALLY SUCCESSFUL,URGENT 😭,05/16/2023 - 05/17/2023,https://www.foi.gov.ph/requests/aglzfmVmb2ktcGhyHQsSB0NvbnRlbnQiEE5UQy01NDc0NjY2MzEzODEM
DOH,"May 17, 2023",Number of vaccinated and unvaccinated covid cases for 2023,PROCESSING,For transparency purposes,03/15/2021 - 05/17/2023,https://www.foi.gov.ph/requests/aglzfmVmb2ktcGhyHQsSB0NvbnRlbnQiEERPSC00NTI3MTQ1MDAwODAM
CLSU,"May 17, 2023","DATA ON PRODUCTION OF CROPS, POULTRY, LIVESTOCK AND FISHERIES IN GUIMBA, NUEVA ECIJA",SUCCESSFUL,Research,01/01/2022 - 01/01/2023,https://www.foi.gov.ph/requests/aglzfmVmb2ktcGhyHgsSB0NvbnRlbnQiEUNMU1UtMDUwMDM2MjQwMjI1DA
DOH,"May 17, 2023",Lost Vaccination Card,SUCCESSFUL,Travel Purpose,05/17/2023 - 05/17/2023,https://www.foi.gov.ph/requests/aglzfmVmb2ktcGhyHQsSB0NvbnRlbnQiEERPSC03NjAyOTI0MDU4MTYM
DepEd,"May 17, 2023",Scholastic Record,DENIED,Application of University,05/15/2023 - 05/15/2023,https://www.foi.gov.ph/requests/aglzfmVmb2ktcGhyHwsSB0NvbnRlbnQiEkRlcEVkLTkwNDQ2ODY3MTMxMgw
