agency,date,title,status,purpose,period_covered,link
NTC,"May 15, 2023",To search for loss/stolen cellphone using IMEI.,PARTIALLY SUCCESSFUL,Locate and Recover,05/15/2023 - 05/15/2023,https://www.foi.gov.ph/requests/aglzfmVmb2ktcGhyHQsSB0NvbnRlbnQiEE5UQy0zNjE4MzQ4OTAyMzUM
PNP,"May 15, 2023",Number of rape cases in Quezon Police Station Nueva Vizcaya Police Provincial Office,SUCCESSFUL,Research,01/01/2023 - 05/01/2023,https://www.foi.gov.ph/requests/aglzfmVmb2ktcGhyHQsSB0NvbnRlbnQiEFBOUC0zMDEwMzA0ODkxMzIM
DTI,"May 15, 2023",Latest Statistic of informal business in the Philippines,REFERRED,Research,01/01/2020 - 01/01/2022,https://www.foi.gov.ph/requests/aglzfmVmb2ktcGhyHQsSB0NvbnRlbnQiEERUSS02ODUyNjMwMjMyNTgM
PSA,"May 15, 2023",Total Population/Number of MSMEs operating in Mandaluyong City,SUCCESSFUL,Thesis Paper,01/01/2021 - 12/31/2022,https://www.foi.gov.ph/requests/aglzfmVmb2ktcGhyHQsSB0NvbnRlbnQiEFBTQS01MjU0NTIxMDY3NDMM
BIR,"May 15, 2023",Barangay Zonal Values,SUCCESSFUL,Research and development,01/01/2022 - 12/31/2022,https://www.foi.gov.ph/requests/aglzfmVmb2ktcGhyHQsSB0NvbnRlbnQiEEJJUi03ODg5NDA5NjE2MDgM
SEC,"May 15, 2023",ZONE -MALL.COM CO.LTD,ACCEPTED,To make sure if this safe for entering a business,12/01/2019 - 05/13/2023,https://www.foi.gov.ph/requests/aglzfmVmb2ktcGhyHQsSB0NvbnRlbnQiEFNFQy05NDIwMDA4NDM4ODUM
PNP,"May 15, 2023","Performance of Brgy Mandaragat, Puerto Princesa City in Crime Prevention",PROCESSING,Research Project (Thesis),01/01/2019 - 12/31/2022,https://www.foi.gov.ph/requests/aglzfmVmb2ktcGhyHQsSB0NvbnRlbnQiEFBOUC0wNjEyNTA4MzI5MjUM
PSA,"May 15, 2023",Language Prevalence per Municity,PENDING,Research and development,01/01/2020 - 12/31/2022,https://www.foi.gov.ph/requests/aglzfmVmb2ktcGhyHQsSB0NvbnRlbnQiEFBTQS0wMDMwMzQzODgyNTYM
DOH,"May 15, 2023",PREVALENCE OF SOIL TRANSMITTED HELMINTHS AMONG CHILDREN,PROCESSING,RESEARCH,01/20/2022 - 05/15/2023,https://www.foi.gov.ph/requests/aglzfmVmb2ktcGhyHQsSB0NvbnRlbnQiEERPSC03MjEzNzA3OTcwNjEM
PNP,"May 15, 2023","Number of Vehicular Accident in Quezon, Isabela",SUCCESSFUL,For Research Purposes,01/01/2023 - 05/15/2023,https://www.foi.gov.ph/requests/aglzfmVmb2ktcGhyHQsSB0NvbnRlbnQiEFBOUC0yODc4OTkzNjIyMjAM
PNP,"May 15, 2023","Total number of arrested person with a case of Illegal Gambling at Alicia, Isabela",SUCCESSFUL,For Research,01/01/2023 - 05/15/2023,https://www.foi.gov.ph/requests/aglzfmVmb2ktcGhyHQsSB0NvbnRlbnQiEFBOUC05NTY5NjU2Njg2MDMM
PNP,"May 15, 2023","Data of Vehicular Incident of Jones Police Station, Isabela PPO, PRO2",SUCCESSFUL,For my research,01/01/2023 - 05/15/2023,https://www.foi.gov.ph/requests/aglzfmVmb2ktcGhyHQsSB0NvbnRlbnQiEFBOUC02MjEyNDczMjc1ODgM
PSA,"May 15, 2023",Barangay Poverty Profile,PENDING,Research and development,01/01/2020 - 12/31/2022,https://www.foi.gov.ph/requests/aglzfmVmb2ktcGhyHQsSB0NvbnRlbnQiEFBTQS02NjM4Mjk4NjU2NzMM
NBI,"May 15, 2023",Information about pending criminal charges,PENDING,Research,05/14/2020 - 05/14/2023,https://www.foi.gov.ph/requests/aglzfmVmb2ktcGhyHQsSB0NvbnRlbnQiEE5CSS00NzI1MTc1ODM4OTQM
DOH,"May 15, 2023",List of Health facilities under NCR eligible to OCA,SUCCESSFUL,to confirm eligibility to receive OCA,01/01/2022 - 05/01/2023,https://www.foi.gov.ph/requests/aglzfmVmb2ktcGhyHQsSB0NvbnRlbnQiEERPSC05NTI5MzIxMDg5MDcM
SEC,"May 15, 2023",Complaint against harassment,ACCEPTED,I want to report this harassment messages,05/14/2023 - 05/15/2023,https://www.foi.gov.ph/requests/aglzfmVmb2ktcGhyHQsSB0NvbnRlbnQiEFNFQy00NjUxMzE2MDQ3NDEM
OSG,"May 15, 2023",Certificate of finality of annulment,SUCCESSFUL,Update of certificate of marriage,09/30/2021 - 05/15/2023,https://www.foi.gov.ph/requests/aglzfmVmb2ktcGhyHQsSB0NvbnRlbnQiEE9TRy00ODQ1NDM4MDM0MDIM
NEDA,"May 15, 2023",Breakdown of the Estimated Cost of Charter Change,PENDING,Research,01/01/2023 - 05/15/2023,https://www.foi.gov.ph/requests/aglzfmVmb2ktcGhyHgsSB0NvbnRlbnQiEU5FREEtNTg3MTQwNjU5NzY0DA
PSA,"May 15, 2023",Statistics of filipino's android version,PENDING,Research and Development,06/12/2021 - 03/30/2023,https://www.foi.gov.ph/requests/aglzfmVmb2ktcGhyHQsSB0NvbnRlbnQiEFBTQS03Mjk0NTAzNjgwNzcM
DOH,"May 15, 2023",Content Analysis on Air Pollution to Infant Mortality in the Philippines,DENIED,Fulfillment for research subject,01/01/2010 - 05/15/2023,https://www.foi.gov.ph/requests/aglzfmVmb2ktcGhyHQsSB0NvbnRlbnQiEERPSC03ODU3MzU1MTYzNjEM
DOH,"May 15, 2023",Cancellation of VaxCert Request,SUCCESSFUL,Travel Abroad to visit my mother,05/15/2023 - 05/15/2023,https://www.foi.gov.ph/requests/aglzfmVmb2ktcGhyHQsSB0NvbnRlbnQiEERPSC05NTc3NDQ0OTY4ODcM
NAYON,"May 15, 2023","Project to be constructed in Nayong Pilipino Foundation Property in Entertainment City, Parañaque",PROCESSING,Architectural Thesis Project,05/15/2023 - 05/15/2023,https://www.foi.gov.ph/requests/aglzfmVmb2ktcGhyHwsSB0NvbnRlbnQiEk5BWU9OLTI0NTE4Mjc2OTAzOQw
MGB,"May 15, 2023",Regional Geology of Davao Oriental,DENIED,Research and Additional Information and Reference for Technical Paper,01/01/2000 - 05/13/2023,https://www.foi.gov.ph/requests/aglzfmVmb2ktcGhyHQsSB0NvbnRlbnQiEE1HQi0yMDY3MjcwMjkyNzYM
DENR,"May 15, 2023","Soil Map, Geohazard Map, Flood Map, Topographic Map of Malaybalay, Bukidnon",REFERRED,Architectural Thesis,05/15/2023 - 05/15/2023,https://www.foi.gov.ph/requests/aglzfmVmb2ktcGhyHgsSB0NvbnRlbnQiEURFTlItNjcyNTczNjgxNzU1DA
DOH,"May 15, 2023",Vaccine Card Lost,SUCCESSFUL,Visa,05/11/2021 - 05/11/2023,https://www.foi.gov.ph/requests/aglzfmVmb2ktcGhyHQsSB0NvbnRlbnQiEERPSC0xMDY3NzI0MjIzNDEM
DOTr,"May 15, 2023",Framework on the Evaluation of Cycling Lanes in Metro Manila,ACCEPTED,Research Paper,05/15/2020 - 05/15/2023,https://www.foi.gov.ph/requests/aglzfmVmb2ktcGhyHgsSB0NvbnRlbnQiEURPVHItNzQ5MTA2NDg0NTMxDA
DOH,"May 15, 2023",Fees and Charges Data Request,PARTIALLY SUCCESSFUL,Fees and Charges Data Request,05/11/2020 - 05/11/2023,https://www.foi.gov.ph/requests/aglzfmVmb2ktcGhyHQsSB0NvbnRlbnQiEERPSC02MTM3MDc3NjczMzEM
CHED,"May 15, 2023","Request for Transcript of Records, S.O. Number and Diploma",ACCEPTED,Requirement for BFP Application,08/03/2020 - 08/10/2022,https://www.foi.gov.ph/requests/aglzfmVmb2ktcGhyHgsSB0NvbnRlbnQiEUNIRUQtMDczNzAzMDgyNzc5DA
PNP,"May 15, 2023",ako si margareth rillo serial killer blacklisted sa 77Global PH at JobstreetPH reported in PNP.,DENIED,PNP Blotter Report for suspect margareth rillo employment banned permanent death in PH.,01/01/2017 - 05/15/2023,https://www.foi.gov.ph/requests/aglzfmVmb2ktcGhyHQsSB0NvbnRlbnQiEFBOUC01MTIyMDA2MTAzMTAM
AFP,"May 15, 2023",Pensioner Living Status Update,SUCCESSFUL,To update living status,05/15/2023 - 05/15/2023,https://www.foi.gov.ph/requests/aglzfmVmb2ktcGhyHQsSB0NvbnRlbnQiEEFGUC03OTI3MTg4MzI1NTYM
BAI,"May 15, 2023",Rabbit Production of the Philippines,PENDING,Research and academic requirement,01/01/2000 - 12/31/2023,https://www.foi.gov.ph/requests/aglzfmVmb2ktcGhyHQsSB0NvbnRlbnQiEEJBSS0wNTA5MzY3MzQ3NDYM
SEC,"May 15, 2023",Annual Audited Financial Statement,SUCCESSFUL,Research and Academic Purposes,01/01/2017 - 12/31/2022,https://www.foi.gov.ph/requests/aglzfmVmb2ktcGhyHQsSB0NvbnRlbnQiEFNFQy03OTgwNTcyNDgxMTMM
PNP,"May 15, 2023",suspect margareth rillo convicted permanent banned or blacklist deceased reported in PNP.,DENIED,PNP Blotter Report for suspect margareth rillo employment banned permanent death in PH.,01/01/2017 - 05/15/2023,https://www.foi.gov.ph/requests/aglzfmVmb2ktcGhyHQsSB0NvbnRlbnQiEFBOUC0xOTIwOTQ0NzI2NTQM
BSWM,"May 15, 2023",Irrigation and Rainfed areas in Cavite,PROCESSING,Thesis,05/13/2023 - 05/13/2023,https://www.foi.gov.ph/requests/aglzfmVmb2ktcGhyHgsSB0NvbnRlbnQiEUJTV00tMTg0NDA5MjkyNzc4DA
NBI,"May 15, 2023","margareth rillo,Jen,carol,maxima the lords flock charismatic witchcraft group serial killer real.",PENDING,Ako si margareth rillo. Patuloy na nirereklamo sa NBI at PNP sa mga kasalanang kriminal.,01/01/2017 - 05/15/2023,https://www.foi.gov.ph/requests/aglzfmVmb2ktcGhyHQsSB0NvbnRlbnQiEE5CSS0zODQ0MDA3NDA2MzkM
PNP,"May 15, 2023",suspect margareth rillo convicted permanent banned or blacklist deceased reported in PNP.,DENIED,PNP Blotter Report for suspect margareth rillo employment banned permanent death in PH.,01/01/2017 - 05/15/2023,https://www.foi.gov.ph/requests/aglzfmVmb2ktcGhyHQsSB0NvbnRlbnQiEFBOUC0zMjU1ODI0NTM3NTcM
PhilRice,"May 15, 2023",Rice Evapotranspiration rate in region 2,ACCEPTED,For undergraduate thesis.,10/01/2020 - 11/30/2021,https://www.foi.gov.ph/requests/aglzfmVmb2ktcGhyIgsSB0NvbnRlbnQiFVBoaWxSaWNlLTMwMjUyODcwMDA1Ngw
NBI,"May 15, 2023",ako si margareth rillo serial killer blacklisted karma.,PENDING,PNP Blotter Report for suspect margareth rillo employment banned permanent death in PH.,01/01/2017 - 05/15/2023,https://www.foi.gov.ph/requests/aglzfmVmb2ktcGhyHQsSB0NvbnRlbnQiEE5CSS02NDMzNDM3NjYxNDIM
DPWH,"May 15, 2023",Average Traffic Index and Average Monthly Traffic Volume of Halsema Highway from year 2014-2023,AWAITING CLARIFICATION,Academical Research,05/14/2014 - 05/14/2023,https://www.foi.gov.ph/requests/aglzfmVmb2ktcGhyHgsSB0NvbnRlbnQiEURQV0gtMTEwMDY1MTMyMTc5DA
LMB,"May 15, 2023",LATITUDE/LONGITUDE and NORTHING/EASTING of MAHAPLAG BLLM NO. 1 CAD 897-D,ACCEPTED,TO PLOT PARCEL FOR ZONING CLEARANCE,05/15/2023 - 05/15/2023,https://www.foi.gov.ph/requests/aglzfmVmb2ktcGhyIQsSB0NvbnRlbnQiFERFTlJMTUItMDUzNzA5MzQxMzA5DA
NBI,"May 15, 2023",prime suspect serial killer margareth rillo murder in Jobstreet PH companies.,PENDING,PNP Blotter Report for suspect margareth rillo employment banned permanent death in PH.,01/01/2017 - 05/15/2023,https://www.foi.gov.ph/requests/aglzfmVmb2ktcGhyHQsSB0NvbnRlbnQiEE5CSS02MDI0MDE2NDM1MjYM
DENR,"May 15, 2023","Recent Wastewater Quality Result at Barangay San Mateo, Norzagaray, Bulacan",REFERRED,Capstone Design Project,01/01/2023 - 05/14/2023,https://www.foi.gov.ph/requests/aglzfmVmb2ktcGhyHgsSB0NvbnRlbnQiEURFTlItMDUxMzAyODk5MjU2DA
BIR,"May 15, 2023",REVENUE ISSUANCES,SUCCESSFUL,To study revenue regulations for proper tax filing.,01/01/1998 - 05/15/2023,https://www.foi.gov.ph/requests/aglzfmVmb2ktcGhyHQsSB0NvbnRlbnQiEEJJUi05Njk4NzQ5Mzk3OTQM
CHED,"May 15, 2023",CMO 20 s. 2013,SUCCESSFUL,For our reference and guidance,01/01/2013 - 05/15/2023,https://www.foi.gov.ph/requests/aglzfmVmb2ktcGhyHgsSB0NvbnRlbnQiEUNIRUQtNzc5MDU2Njc3OTc4DA
PSA,"May 15, 2023","Population Projection,2015 to latest available based on2010Census by Region/Province/Municipality",PARTIALLY SUCCESSFUL,Academic purposes- Research,12/31/2010 - 05/15/2023,https://www.foi.gov.ph/requests/aglzfmVmb2ktcGhyHQsSB0NvbnRlbnQiEFBTQS0xNjE5MTg5MTE4NTIM
UsaP,"May 15, 2023",The top 10 leading causes of mortality in Pasig City,ACCEPTED,Academic Research,01/01/2022 - 01/01/2023,https://www.foi.gov.ph/requests/aglzfmVmb2ktcGhyHgsSB0NvbnRlbnQiEVVTQVAtNjAzNjQ1NzA4OTkyDA
BSWM,"May 15, 2023",Updated Map of the Crops in Cavite,PROCESSING,Thesis,05/12/2023 - 05/12/2023,https://www.foi.gov.ph/requests/aglzfmVmb2ktcGhyHgsSB0NvbnRlbnQiEUJTV00tOTk5MjUxMDMzMTUxDA
LTO,"May 15, 2023",List of total sales of cars in Philippines,DENIED,Market Research,05/15/2023 - 05/15/2023,https://www.foi.gov.ph/requests/aglzfmVmb2ktcGhyHQsSB0NvbnRlbnQiEExUTy02NDI3NzU2NjEwMDEM
PNP,"May 15, 2023",Crime Statistics of Mansalay for CY 2023 from January 2023 to May 2023,PROCESSING,For my thesis study,01/30/2023 - 05/22/2023,https://www.foi.gov.ph/requests/aglzfmVmb2ktcGhyHQsSB0NvbnRlbnQiEFBOUC01Mjg0MjgxMTY2OTIM
PSA,"May 15, 2023",Population of solo parent/ single parent and working parents per region,PENDING,Research and studies,01/01/2022 - 01/01/2023,https://www.foi.gov.ph/requests/aglzfmVmb2ktcGhyHQsSB0NvbnRlbnQiEFBTQS05NDA4NzY1NTY2MTYM
PhilFIDA,"May 15, 2023",complete process and machines needed to finish piña fabric from leaves to terxtile,ACCEPTED,for academe research purposes,05/15/2023 - 05/15/2023,https://www.foi.gov.ph/requests/aglzfmVmb2ktcGhyIgsSB0NvbnRlbnQiFVBoaWxGSURBLTgxODY5NTkyNjQ4OQw
DOH,"May 15, 2023",vaccination record not found,SUCCESSFUL,for travel abroad,04/04/2023 - 05/15/2023,https://www.foi.gov.ph/requests/aglzfmVmb2ktcGhyHQsSB0NvbnRlbnQiEERPSC04MDk1ODM4MTQ0ODEM
NTC,"May 15, 2023",Block this person’s sim,PARTIALLY SUCCESSFUL,Block online scammer,05/14/2023 - 05/14/2023,https://www.foi.gov.ph/requests/aglzfmVmb2ktcGhyHQsSB0NvbnRlbnQiEE5UQy02Mzc5NzEzODMzMjcM
DOJ,"May 15, 2023",LETTER OF REQUEST FOR PAROLE,PENDING,Personal,05/15/2023 - 05/15/2023,https://www.foi.gov.ph/requests/aglzfmVmb2ktcGhyHQsSB0NvbnRlbnQiEERPSi0xMTk5NjM1Mjc5NDIM
PaPA,"May 15, 2023",LETTER OF REQUEST FOR PAROLE ALREADY SENT,DENIED,Personal,05/10/2023 - 05/10/2023,https://www.foi.gov.ph/requests/aglzfmVmb2ktcGhyHgsSB0NvbnRlbnQiEVBhUEEtNjQwMDMwNTI3NDk3DA
ERC,"May 15, 2023",Historical data on Monthly Electricity price/rate in the Philippines,ACCEPTED,Thesis Data,01/01/1990 - 12/31/2021,https://www.foi.gov.ph/requests/aglzfmVmb2ktcGhyHQsSB0NvbnRlbnQiEEVSQy05OTcyNjg0NzkyMjEM
BUCOR,"May 15, 2023",Bucor Central Document section for PDL,PENDING,For Follow up his Released,05/15/2023 - 05/15/2023,https://www.foi.gov.ph/requests/aglzfmVmb2ktcGhyHwsSB0NvbnRlbnQiEkJVQ09SLTk3MzcwNzM5MDY1Nww
PSA,"May 15, 2023",Batangas Agricultural Data,PENDING,Research,01/01/2020 - 05/15/2023,https://www.foi.gov.ph/requests/aglzfmVmb2ktcGhyHQsSB0NvbnRlbnQiEFBTQS0xMDQ2NTk2ODY5NDgM
DA,"May 15, 2023",Batangas Agricultural Data,SUCCESSFUL,Research,01/01/2020 - 05/15/2023,https://www.foi.gov.ph/requests/aglzfmVmb2ktcGhyHAsSB0NvbnRlbnQiD0RBLTk2ODgzNDc3MTYwMgw
NTC,"May 15, 2023",LOST PHONE,PARTIALLY SUCCESSFUL,"Until when could I block my phone?I already received a response,but the NTC form attached is error.",04/19/2023 - 05/14/2023,https://www.foi.gov.ph/requests/aglzfmVmb2ktcGhyHQsSB0NvbnRlbnQiEE5UQy01Njg2MTYyMzMwNzMM
LTO,"May 14, 2023",Request for Driver's Certification and Certificate of No Apprehension,DENIED,To secure a driver’s license in Canada,05/14/2023 - 05/14/2023,https://www.foi.gov.ph/requests/aglzfmVmb2ktcGhyHQsSB0NvbnRlbnQiEExUTy05OTU3NjYyNDI5MzMM
DOLE,"May 14, 2023",SSS Unemployment Benefit:,PENDING,to temporarily finance me with my daily need until i find work for my family.,04/10/2021 - 11/12/2022,https://www.foi.gov.ph/requests/aglzfmVmb2ktcGhyHgsSB0NvbnRlbnQiEURPTEUtOTg1MDg4MTAxMjc2DA
DOH,"May 14, 2023",Philippine Renal Disease Annual report,PROCESSING,For research paper,01/01/2022 - 12/31/2022,https://www.foi.gov.ph/requests/aglzfmVmb2ktcGhyHQsSB0NvbnRlbnQiEERPSC0yMjQzNTIwODcwNDEM
UsaP,"May 14, 2023",Solid Waste Management Plan,SUCCESSFUL,Research,05/14/2013 - 05/14/2023,https://www.foi.gov.ph/requests/aglzfmVmb2ktcGhyHgsSB0NvbnRlbnQiEVVTQVAtNjQ2MTQ2MTUyMjY1DA
SEC,"May 14, 2023",The unfair debt collectors of online lending apps,ACCEPTED,To stop & closed those online lending apps that has been harassing their clients thru text and call,05/08/2023 - 05/14/2023,https://www.foi.gov.ph/requests/aglzfmVmb2ktcGhyHQsSB0NvbnRlbnQiEFNFQy05MzAwMjgzODA2NjkM
SEC,"May 14, 2023",The unfair debt collectors of online lending apps,SUCCESSFUL,To know if those online lending apps are illegal,05/10/2023 - 05/14/2023,https://www.foi.gov.ph/requests/aglzfmVmb2ktcGhyHQsSB0NvbnRlbnQiEFNFQy01MzA4MjAwMDkxMjUM
NBI,"May 14, 2023",Scammed by a facebook seller,PENDING,"Recover funds from the scam, investigate and identify scammers to avoid further victims",05/14/2023 - 05/14/2023,https://www.foi.gov.ph/requests/aglzfmVmb2ktcGhyHQsSB0NvbnRlbnQiEE5CSS02NTQ4MTIzMDc2NjgM
NTC,"May 14, 2023",fin09164169103d my phone what was stolen.,PARTIALLY SUCCESSFUL,i want to locate who stole my phone and want my phone back.,05/13/2023 - 05/14/2023,https://www.foi.gov.ph/requests/aglzfmVmb2ktcGhyHQsSB0NvbnRlbnQiEE5UQy02NjAyMDIyMjY0NjAM
NBI,"May 14, 2023",Online Scammer / Use of Personal Data,PENDING,Cybercrime and possible fraud by using personal data,05/14/2023 - 05/14/2023,https://www.foi.gov.ph/requests/aglzfmVmb2ktcGhyHQsSB0NvbnRlbnQiEE5CSS0xMjE4MjExMjE4NDMM
SEC,"May 14, 2023",SEC CRMD Case no (adj) 23-23 43,ACCEPTED,Inquiry only,03/01/2023 - 05/09/2023,https://www.foi.gov.ph/requests/aglzfmVmb2ktcGhyHQsSB0NvbnRlbnQiEFNFQy0wMDQxMjA0OTkwMDcM
NTC,"May 14, 2023",Online scammer,PARTIALLY SUCCESSFUL,Police warrant of arrest,05/02/2023 - 05/03/2023,https://www.foi.gov.ph/requests/aglzfmVmb2ktcGhyHQsSB0NvbnRlbnQiEE5UQy01NjkzMTg4Njg0OTAM
DOH,"May 14, 2023",Acute Myocardial Infarction,PROCESSING,Case Presentation about Acute Myocardial Infarction,01/01/2022 - 01/01/2022,https://www.foi.gov.ph/requests/aglzfmVmb2ktcGhyHQsSB0NvbnRlbnQiEERPSC0zNDU3ODg5MDA5MDkM
NBI,"May 14, 2023",Online money scamming,PENDING,Reporting money scamming moves,04/14/2023 - 05/14/2023,https://www.foi.gov.ph/requests/aglzfmVmb2ktcGhyHQsSB0NvbnRlbnQiEE5CSS04MTU2NjkxNzI2ODUM
SSS,"May 14, 2023",SSS Change of Email,PENDING,Loan,05/14/2023 - 05/14/2023,https://www.foi.gov.ph/requests/aglzfmVmb2ktcGhyHQsSB0NvbnRlbnQiEFNTUy0xMDE0ODM4Nzg3MDYM
DOH,"May 14, 2023",VACCINATION RECORD NOT FOUND,SUCCESSFUL,International Travel,09/02/2021 - 11/12/2021,https://www.foi.gov.ph/requests/aglzfmVmb2ktcGhyHQsSB0NvbnRlbnQiEERPSC05MzQzNjU4NjkyMzgM
DPWH,"May 14, 2023",Status of Metro Cebu Expressway Segment 3A,ACCEPTED,Information and Data Gathering for reference in case similar situation arises in the future.,01/01/2023 - 05/14/2023,https://www.foi.gov.ph/requests/aglzfmVmb2ktcGhyHgsSB0NvbnRlbnQiEURQV0gtMTA4NzM3MjU0MDU1DA
PNP,"May 14, 2023","The number of road crash on Maharlika Highway (AH26) between Pulilan, and Baliuag in Bulacan",AWAITING CLARIFICATION,Undergraduate Thesis Research,01/01/2020 - 05/14/2023,https://www.foi.gov.ph/requests/aglzfmVmb2ktcGhyHQsSB0NvbnRlbnQiEFBOUC02ODA2ODI3NTQxNjkM
DENR,"May 14, 2023",status of land,DENIED,for verification,04/01/2023 - 05/14/2023,https://www.foi.gov.ph/requests/aglzfmVmb2ktcGhyHgsSB0NvbnRlbnQiEURFTlItMzY3Njg0NzE2NTYwDA
NTC,"May 14, 2023",STOLEN PHONE,PARTIALLY SUCCESSFUL,investagtion or to block my stolen phone,05/14/2023 - 05/14/2023,https://www.foi.gov.ph/requests/aglzfmVmb2ktcGhyHQsSB0NvbnRlbnQiEE5UQy0zNTM0NDk4MTIwOTUM
PAGASA,"May 14, 2023","Weather Forecast at Baler ,Aurora (August 22,2022 to May 8,2023)",AWAITING CLARIFICATION,On-going Infrastructure Projects,08/22/2022 - 03/08/2023,https://www.foi.gov.ph/requests/aglzfmVmb2ktcGhyIAsSB0NvbnRlbnQiE1BBR0FTQS01NTg5MDAzNTc4MzQM
DOT,"May 14, 2023",percent of museum goers on schools in Dagupan City (2012-2019),DENIED,Thesis,01/01/2012 - 04/26/2023,https://www.foi.gov.ph/requests/aglzfmVmb2ktcGhyHQsSB0NvbnRlbnQiEERPVC0yMDAwNjg0NTcyODkM
NTC,"May 14, 2023",Block Lost Phone,PARTIALLY SUCCESSFUL,Block Stolen Please,05/14/2023 - 05/14/2023,https://www.foi.gov.ph/requests/aglzfmVmb2ktcGhyHQsSB0NvbnRlbnQiEE5UQy01NDIwMzk5NDY1MjkM
DILG,"May 14, 2023","List of The Mayors of Torrijos, Marinduque",PENDING,Research,05/14/1521 - 05/14/2023,https://www.foi.gov.ph/requests/aglzfmVmb2ktcGhyHgsSB0NvbnRlbnQiEURJTEctNTk4MzY5ODY1MjgzDA
NTC,"May 14, 2023",stolen phone,PARTIALLY SUCCESSFUL,Block my phone using Imei also the sim card to avoid scam and fake identification,05/12/2023 - 05/14/2023,https://www.foi.gov.ph/requests/aglzfmVmb2ktcGhyHQsSB0NvbnRlbnQiEE5UQy0zMjcyNzgwMjc4MDQM
DILG,"May 14, 2023","List of Mayors of Milagros, Masbate",PENDING,Research,05/14/1521 - 05/14/2023,https://www.foi.gov.ph/requests/aglzfmVmb2ktcGhyHgsSB0NvbnRlbnQiEURJTEctNjQ4MjAzNjgzMzcwDA
DILG,"May 14, 2023",Listahan ng mga Pinuno ng Bayan ng Biñan,PENDING,Research,05/14/1521 - 05/14/2023,https://www.foi.gov.ph/requests/aglzfmVmb2ktcGhyHgsSB0NvbnRlbnQiEURJTEctODc4MDI5NTIzMTk5DA
PNP,"May 14, 2023",The number of road crash in Baliuag and Pulilan in Bulacan,AWAITING CLARIFICATION,For Research purposes,01/01/2020 - 05/14/2023,https://www.foi.gov.ph/requests/aglzfmVmb2ktcGhyHQsSB0NvbnRlbnQiEFBOUC0xMjczMjQ3Njk5NjUM
PDEA,"May 14, 2023",Statistic on Convicts and Detainees on Drug-Related Offenses,REFERRED,Research & Development,01/01/2022 - 12/31/2022,https://www.foi.gov.ph/requests/aglzfmVmb2ktcGhyHgsSB0NvbnRlbnQiEVBERUEtMzI2Mzc4NzI2ODkyDA
NEDA,"May 14, 2023",Value of Infrastructure Flagship Projects,PARTIALLY SUCCESSFUL,Research,07/01/2022 - 05/14/2023,https://www.foi.gov.ph/requests/aglzfmVmb2ktcGhyHgsSB0NvbnRlbnQiEU5FREEtMTc0MzkwNTg1MjM0DA
IC,"May 14, 2023","Request Certificate of IC Offsite license Exam September 17, 2022",ACCEPTED,For my reference and employment purposes.,09/17/2022 - 09/17/2022,https://www.foi.gov.ph/requests/aglzfmVmb2ktcGhyHAsSB0NvbnRlbnQiD0lDLTQ1OTMxMTY1NjMwNgw
SEC,"May 14, 2023",Annual Audited Financial Statement,SUCCESSFUL,Research /Academic Purposes,01/01/2017 - 01/01/2022,https://www.foi.gov.ph/requests/aglzfmVmb2ktcGhyHQsSB0NvbnRlbnQiEFNFQy01NDc5NDg4NTMwNDEM
PDEA,"May 14, 2023","The number of reported drug cases per category of illegal drugs. e.g. shabu, marijuana, etc.",PENDING,Research paper,01/01/2020 - 12/31/2022,https://www.foi.gov.ph/requests/aglzfmVmb2ktcGhyHgsSB0NvbnRlbnQiEVBERUEtMDkyOTQ5MzQ2OTA3DA
NTC,"May 14, 2023",Lost Phone,PARTIALLY SUCCESSFUL,Block my phone using imei also the sim card.,05/14/2023 - 05/14/2023,https://www.foi.gov.ph/requests/aglzfmVmb2ktcGhyHQsSB0NvbnRlbnQiEE5UQy0wMzIyOTE3NjQyNjEM
CHED,"May 14, 2023",The number of students enrolled under College of Business and Administration within University Belt,ACCEPTED,Research,05/14/2023 - 05/14/2023,https://www.foi.gov.ph/requests/aglzfmVmb2ktcGhyHgsSB0NvbnRlbnQiEUNIRUQtMTQ0NDA2MTg1ODQ0DA
DOLE,"May 14, 2023",Total Population/Number of MSMEs operating in Mandaluyong City,ACCEPTED,Thesis Paper,01/01/2021 - 12/31/2022,https://www.foi.gov.ph/requests/aglzfmVmb2ktcGhyHgsSB0NvbnRlbnQiEURPTEUtODY0NzU3Mjc0NTU3DA
DTI,"May 14, 2023",Total Population/Number of MSMEs operating in Mandaluyong City,REFERRED,Thesis Paper,01/01/2021 - 12/31/2022,https://www.foi.gov.ph/requests/aglzfmVmb2ktcGhyHQsSB0NvbnRlbnQiEERUSS04NDQxMTQ1MjQyMTYM
PSA,"May 14, 2023",Total Population/Number of MSMEs operating in Mandaluyong City,SUCCESSFUL,Thesis Paper,01/01/2021 - 12/31/2022,https://www.foi.gov.ph/requests/aglzfmVmb2ktcGhyHQsSB0NvbnRlbnQiEFBTQS00MTI0OTk5ODgzOTQM
PSA,"May 14, 2023",Aviation Courses Statistics,PENDING,Research purposes. For my master thesis. Thank you.,01/01/2018 - 12/31/2022,https://www.foi.gov.ph/requests/aglzfmVmb2ktcGhyHQsSB0NvbnRlbnQiEFBTQS0xMDYwMDk5ODY2MDUM
NBI,"May 14, 2023",Scamer,PENDING,Trace this no.09128449872 kung sino ang pangalan at taga saan,05/14/2023 - 05/14/2023,https://www.foi.gov.ph/requests/aglzfmVmb2ktcGhyHQsSB0NvbnRlbnQiEE5CSS0wMTczNzA5MzA1NDcM
NBI,"May 14, 2023",Online scam,PENDING,Report online scammers,05/06/2023 - 05/14/2023,https://www.foi.gov.ph/requests/aglzfmVmb2ktcGhyHQsSB0NvbnRlbnQiEE5CSS02MDM4ODI1NTg4NTUM
DOH,"May 14, 2023",Vax. Certificate,SUCCESSFUL,For travel,11/11/2021 - 03/21/2023,https://www.foi.gov.ph/requests/aglzfmVmb2ktcGhyHQsSB0NvbnRlbnQiEERPSC0wMjIxODAyMTM5NTUM
NTC,"May 14, 2023",Tracing and blocking of stolen iPhone,PARTIALLY SUCCESSFUL,To track and find my lost iphone with cash,05/12/2023 - 05/13/2023,https://www.foi.gov.ph/requests/aglzfmVmb2ktcGhyHQsSB0NvbnRlbnQiEE5UQy0yNDg1MTU4ODk5NDgM
BSWM,"May 14, 2023","Barangay Lucao, Dagupan City Pangasinan soil type",SUCCESSFUL,architectural thesis,01/01/2012 - 04/26/2023,https://www.foi.gov.ph/requests/aglzfmVmb2ktcGhyHgsSB0NvbnRlbnQiEUJTV00tOTg3MDE3NjcyOTI2DA
SEC,"May 14, 2023",Kusogpera harassment,SUCCESSFUL,Matigil na ang pang haharassed nila at mabigyan katarungan ang mga taong ipinapahiya nila,05/14/2023 - 05/14/2023,https://www.foi.gov.ph/requests/aglzfmVmb2ktcGhyHQsSB0NvbnRlbnQiEFNFQy00NjczNDY1MjYwMDQM
DOT,"May 14, 2023",Tourism Policies,AWAITING CLARIFICATION,Thesis,05/14/2023 - 05/14/2023,https://www.foi.gov.ph/requests/aglzfmVmb2ktcGhyHQsSB0NvbnRlbnQiEERPVC0wMTk5NTAyMTE0MjIM
BLGF,"May 14, 2023",Overall generated revenue in Tourism,DENIED,Thesis,01/01/2015 - 05/14/2023,https://www.foi.gov.ph/requests/aglzfmVmb2ktcGhyHgsSB0NvbnRlbnQiEUJMR0YtNjI4NDM4NDg1MDEzDA
PUP,"May 14, 2023",Tution fee of ofw for PUP open university,PENDING,Information,04/01/2023 - 05/14/2023,https://www.foi.gov.ph/requests/aglzfmVmb2ktcGhyHQsSB0NvbnRlbnQiEFBVUC01NzIzODAwOTM2MTYM
NTC,"May 14, 2023",Stolen Phone,PARTIALLY SUCCESSFUL,Important Documents and Personal Belongings & Identification,05/10/2023 - 05/14/2023,https://www.foi.gov.ph/requests/aglzfmVmb2ktcGhyHQsSB0NvbnRlbnQiEE5UQy0zNTg3MTE3Nzg4NTkM
BIR,"May 14, 2023",Income Tax Return 2022,AWAITING CLARIFICATION,ITR for January 2022 - December 2022 purpose- document is needed for house and lot application,01/01/2022 - 12/31/2022,https://www.foi.gov.ph/requests/aglzfmVmb2ktcGhyHQsSB0NvbnRlbnQiEEJJUi0wMjY2NTEyMTcyNzQM
PNP,"May 14, 2023",organizeshop vip scam 15k,DENIED,mabalik ung 15k ko gcash ni organizeshop.vip,05/14/2023 - 05/14/2023,https://www.foi.gov.ph/requests/aglzfmVmb2ktcGhyHQsSB0NvbnRlbnQiEFBOUC00NjkzOTkxNDU4MTgM
DOH,"May 14, 2023",Audited Financial Statement,DENIED,Academic Purposes,01/01/2017 - 05/14/2023,https://www.foi.gov.ph/requests/aglzfmVmb2ktcGhyHQsSB0NvbnRlbnQiEERPSC01MjAxOTgxMDc1MTYM
PCSO,"May 14, 2023",Financial Assistance,SUCCESSFUL,Financial Support,04/30/2023 - 05/14/2023,https://www.foi.gov.ph/requests/aglzfmVmb2ktcGhyHgsSB0NvbnRlbnQiEVBDU08tNzkzMzEwNDIzOTI1DA
BSWM,"May 14, 2023","Geotechnical Analysis Report on Molino, Bacoor City, Cavite",REFERRED,One of the requirement in our group project.,05/14/2023 - 05/14/2023,https://www.foi.gov.ph/requests/aglzfmVmb2ktcGhyHgsSB0NvbnRlbnQiEUJTV00tNjc2NDI2ODU2MTMxDA
PAGASA,"May 14, 2023",Recorded Wind Speed during Typhoon Odette,AWAITING CLARIFICATION,thesis,12/16/2021 - 12/17/2021,https://www.foi.gov.ph/requests/aglzfmVmb2ktcGhyIAsSB0NvbnRlbnQiE1BBR0FTQS00OTEyNjI1OTAzODgM
NAP,"May 14, 2023",Birth certificate,DENIED,Extra judicial settlement,06/26/1927 - 06/26/1927,https://www.foi.gov.ph/requests/aglzfmVmb2ktcGhyHQsSB0NvbnRlbnQiEE5BUC0zMDg3MzE5MDcyMDQM
SSS,"May 14, 2023",Request To Update Email in My.SSS,PENDING,SSS SO HARD TO REACH OUT! Cant reply to their provided email. Keep saying that my email cant be send,05/01/2023 - 05/14/2023,https://www.foi.gov.ph/requests/aglzfmVmb2ktcGhyHQsSB0NvbnRlbnQiEFNTUy0wNzI1NTYxOTgwNTAM
