agency,date,title,status,purpose,period_covered,link
PhilFIDA,"May 22, 2023",Available Fabrication of Pineapple Leaf Fiber Net in Region 10,PENDING,Undergraduate Thesis,05/21/2023 - 05/21/2023,https://www.foi.gov.ph/requests/aglzfmVmb2ktcGhyIgsSB0NvbnRlbnQiFVBoaWxGSURBLTczODA4ODc3MDY0NQw
BPI,"May 22, 2023",Insect farming,PENDING,Undergraduate research,05/20/2023 - 05/20/2023,https://www.foi.gov.ph/requests/aglzfmVmb2ktcGhyHQsSB0NvbnRlbnQiEEJQSS0yMTg2OTEyNjEyMDgM
DDB,"May 22, 2023","Drug Users in San Mateo, Rizal",PENDING,Architectural Thesis,05/20/2023 - 05/20/2023,https://www.foi.gov.ph/requests/aglzfmVmb2ktcGhyHQsSB0NvbnRlbnQiEEREQi0yOTY4NzIyNTU2MzUM
NTC,"May 22, 2023",updated list of Value-added Services of Internet Access,PENDING,for my record,08/01/2022 - 05/22/2023,https://www.foi.gov.ph/requests/aglzfmVmb2ktcGhyHQsSB0NvbnRlbnQiEE5UQy03MzAyNzUyODQ0MTEM
DOH,"May 22, 2023",Statistics of Individuals with Autism,PENDING,Architectural Thesis,05/22/2023 - 05/22/2023,https://www.foi.gov.ph/requests/aglzfmVmb2ktcGhyHQsSB0NvbnRlbnQiEERPSC0yMjM2NDg3OTQwODkM
PhilRice,"May 22, 2023",Raster File of Rice Planting Date of Region 1 and Abra,PENDING,"Transplanting planning (tobacco growing, private sector)",01/01/2021 - 05/22/2023,https://www.foi.gov.ph/requests/aglzfmVmb2ktcGhyIgsSB0NvbnRlbnQiFVBoaWxSaWNlLTk1NDk2MzUyODM0Nww
IC,"May 22, 2023",Data on Deaths Insurance policies given,PENDING,research,03/15/2021 - 03/15/2023,https://www.foi.gov.ph/requests/aglzfmVmb2ktcGhyHAsSB0NvbnRlbnQiD0lDLTM3NDQwNDk5NTQwMQw
DSWD,"May 22, 2023",COVID POSITIVE,PENDING,Financial assistance,05/12/2023 - 05/19/2023,https://www.foi.gov.ph/requests/aglzfmVmb2ktcGhyHgsSB0NvbnRlbnQiEURTV0QtMzM4MDkwOTYzNzcwDA
CHED,"May 22, 2023","Research, education",PENDING,Research and education,05/19/2023 - 05/19/2023,https://www.foi.gov.ph/requests/aglzfmVmb2ktcGhyHgsSB0NvbnRlbnQiEUNIRUQtNzYxNzI4NjMwOTQ1DA
DOH,"May 22, 2023",VACCINATION card,SUCCESSFUL,Papasa kopo sana sa work ko dito sa chowking oliveros antipolo city,02/10/2022 - 05/22/2023,https://www.foi.gov.ph/requests/aglzfmVmb2ktcGhyHQsSB0NvbnRlbnQiEERPSC0yOTI2ODQ5NTMzODQM
PhilFIDA,"May 22, 2023",Available Fabrication of Pineapple Leaf Fiber Net in Region 10,PENDING,Undergraduate Thesis,05/21/2023 - 05/21/2023,https://www.foi.gov.ph/requests/aglzfmVmb2ktcGhyIgsSB0NvbnRlbnQiFVBoaWxGSURBLTUyMzU1Mzg1MTEzMww
PMS,"May 22, 2023",Official International Travel of Former and Incumbent Presidents,PENDING,Research,02/25/1986 - 05/19/2023,https://www.foi.gov.ph/requests/aglzfmVmb2ktcGhyHQsSB0NvbnRlbnQiEFBNUy0yMDUwODMwOTM4NTAM
CHED,"May 22, 2023",Male and Female nursing students in 2021-2022,PENDING,Research,06/01/2021 - 12/31/2022,https://www.foi.gov.ph/requests/aglzfmVmb2ktcGhyHgsSB0NvbnRlbnQiEUNIRUQtMjEwMjIzNDIxODgxDA
KWF,"May 22, 2023",Impresyon ni Antonio Luna,PENDING,Para sa pananaliksik,05/22/2023 - 05/22/2023,https://www.foi.gov.ph/requests/aglzfmVmb2ktcGhyHQsSB0NvbnRlbnQiEEtXRi04MTkzNjE1OTgzMzQM
NBI,"May 22, 2023",Online scam: Fake Seller Rica Mae Caruyan Mando and Erwin Suba Lopez,PENDING,To put them in jail and refund our money.,05/21/2023 - 05/22/2023,https://www.foi.gov.ph/requests/aglzfmVmb2ktcGhyHQsSB0NvbnRlbnQiEE5CSS00MzQ4NTU4MjE2ODEM
BIR,"May 22, 2023",BIR 2316 COPY REQUEST,PENDING,Employment Requirements,01/01/2022 - 07/23/2022,https://www.foi.gov.ph/requests/aglzfmVmb2ktcGhyHQsSB0NvbnRlbnQiEEJJUi0yNzgwMjU3OTQyNjAM
NBI,"May 22, 2023",URGENT! REQUEST TO FILE FOR A MISSING PERSON,PENDING,To file for a missing person report,05/21/2023 - 05/22/2023,https://www.foi.gov.ph/requests/aglzfmVmb2ktcGhyHQsSB0NvbnRlbnQiEE5CSS05MDk0MTI1MjU0MzQM
NBI,"May 22, 2023",margareth rillo sexual harrassment to 77GlobalPH-ADB enployees reported in PH.,PENDING,PNP Blotter Report for suspect margareth rillo permanent banned suffering in PH companies.,01/01/2017 - 05/22/2023,https://www.foi.gov.ph/requests/aglzfmVmb2ktcGhyHQsSB0NvbnRlbnQiEE5CSS04MTM0MTczNTQ5MjkM
IA,"May 22, 2023",Gen. Luna Gap 2 chamber dimension,PENDING,Research,01/01/1522 - 01/01/2022,https://www.foi.gov.ph/requests/aglzfmVmb2ktcGhyHAsSB0NvbnRlbnQiD0lBLTg2Mjc5ODU5Mzc3OAw
NBI,"May 22, 2023",Scammed by Carousell seller lophan1111_,PENDING,For return of scammed amount (P8126) or retrieval of bought item,05/20/2023 - 05/20/2023,https://www.foi.gov.ph/requests/aglzfmVmb2ktcGhyHQsSB0NvbnRlbnQiEE5CSS0zOTA4MTMwODE1MTcM
DENR,"May 22, 2023",Waste to Energy,PENDING,Architectural Thesis,05/22/2023 - 05/22/2023,https://www.foi.gov.ph/requests/aglzfmVmb2ktcGhyHgsSB0NvbnRlbnQiEURFTlItNjUyODkzNzU1NjI5DA
NTC,"May 22, 2023",Stolen phone,PENDING,To banned phone,05/15/2023 - 05/16/2023,https://www.foi.gov.ph/requests/aglzfmVmb2ktcGhyHQsSB0NvbnRlbnQiEE5UQy0zOTkyMTc2NzkyNDgM
DENR,"May 22, 2023",Verified Survey Return (VSR),PENDING,For reference and confirmation,10/11/2011 - 01/17/2012,https://www.foi.gov.ph/requests/aglzfmVmb2ktcGhyHgsSB0NvbnRlbnQiEURFTlItOTMyMDQ3MDMxNDY0DA
PNP,"May 21, 2023",Crime rate and statistic of Northern Samar,PENDING,For my presentation,01/01/2023 - 05/20/2023,https://www.foi.gov.ph/requests/aglzfmVmb2ktcGhyHQsSB0NvbnRlbnQiEFBOUC00Mzk0NTMyNTU4MDIM
NCCA,"May 21, 2023",Design manual or guidelines for building cultural centers,PENDING,Architectural Thesis,05/21/2023 - 05/21/2023,https://www.foi.gov.ph/requests/aglzfmVmb2ktcGhyHgsSB0NvbnRlbnQiEU5DQ0EtNDgxMDAzMzA4MDQ5DA
IA,"May 21, 2023",Intramuros Tiendas del Parian stalls,PENDING,Research,01/01/1522 - 01/01/2022,https://www.foi.gov.ph/requests/aglzfmVmb2ktcGhyHAsSB0NvbnRlbnQiD0lBLTEzODMwOTI2ODM3Mgw
NAMRIA,"May 21, 2023",Thematic Maps,PENDING,Research and Development,01/01/2010 - 12/31/2022,https://www.foi.gov.ph/requests/aglzfmVmb2ktcGhyJAsSB0NvbnRlbnQiF0RFTlJOQU1SSUEtMjQ4MjMyMTQzMjEzDA
NSWMC,"May 21, 2023",Waste Segregation Programs in Dasmarinas Cavite,PENDING,Data for Research/Thesis,01/01/2018 - 05/21/2023,https://www.foi.gov.ph/requests/aglzfmVmb2ktcGhyHwsSB0NvbnRlbnQiEk5TV01DLTU3NDUxNDc3OTA2Mww
NTC,"May 21, 2023",track/trace my lost phone,PENDING,track/trace my lost phone,05/19/2023 - 05/21/2023,https://www.foi.gov.ph/requests/aglzfmVmb2ktcGhyHQsSB0NvbnRlbnQiEE5UQy0yOTA5NzMzMjU5MjMM
DENR,"May 21, 2023",Waste Segregation Programs in Dasmarinas Cavite,PENDING,Data for Research or Thesis,01/01/2018 - 05/21/2023,https://www.foi.gov.ph/requests/aglzfmVmb2ktcGhyHgsSB0NvbnRlbnQiEURFTlItNTM1NDQ5NTkxNTc1DA
NAP,"May 21, 2023",Confradia De San Jose documents,DENIED,College subject requirement,01/01/1840 - 12/31/1841,https://www.foi.gov.ph/requests/aglzfmVmb2ktcGhyHQsSB0NvbnRlbnQiEE5BUC0wNzk5ODA4MjgxMTMM
NBI,"May 21, 2023","Online Scammed po. Transfer from shopee to shopee and gcash to shopee 19,500 pesos",PENDING,cyber crime and online scam,05/16/2023 - 05/21/2023,https://www.foi.gov.ph/requests/aglzfmVmb2ktcGhyHQsSB0NvbnRlbnQiEE5CSS0wNDYzNzExNzgyOTIM
DOLE,"May 21, 2023",In demand jobs in the Philippines from 2018 - 2022,PENDING,For the proposal of new program offerings of one HEI,01/01/2018 - 12/30/2022,https://www.foi.gov.ph/requests/aglzfmVmb2ktcGhyHgsSB0NvbnRlbnQiEURPTEUtNzQ4MzUwNDU1MDI0DA
DOF,"May 21, 2023",Data on Deaths Insurance policies given,REFERRED,research,03/15/2021 - 03/15/2023,https://www.foi.gov.ph/requests/aglzfmVmb2ktcGhyHQsSB0NvbnRlbnQiEERPRi02MjM4OTI0Njg5NzkM
DOH,"May 21, 2023",Study of Virgin Coconut Oil for covid virus,PENDING,research,04/01/2021 - 04/02/2023,https://www.foi.gov.ph/requests/aglzfmVmb2ktcGhyHQsSB0NvbnRlbnQiEERPSC05NDUyNzkzMDc0ODAM
DOT,"May 21, 2023","Tourism Development Plan of Calatagan, Batangas",PENDING,"Tourism Development Plan that we are creating for Little Boracay, situated in Calatagan",06/01/2016 - 06/01/2022,https://www.foi.gov.ph/requests/aglzfmVmb2ktcGhyHQsSB0NvbnRlbnQiEERPVC04Mzk3MjExOTE2NjMM
NLP,"May 21, 2023",Percentage of information materials by language of the collection of NLP,ACCEPTED,Research,05/22/2022 - 05/21/2023,https://www.foi.gov.ph/requests/aglzfmVmb2ktcGhyHQsSB0NvbnRlbnQiEE5MUC02MTc2NzQ1OTYzMzcM
DOH,"May 21, 2023",Request Expedite Vaccine Certificate for Travel,PENDING,Travel Abroad,05/20/2023 - 05/21/2023,https://www.foi.gov.ph/requests/aglzfmVmb2ktcGhyHQsSB0NvbnRlbnQiEERPSC0wODE0OTQwMTc5NjkM
CAB,"May 21, 2023",Total number of flight delays in 2021 per month with stated reasons,ACCEPTED,For research use,01/01/2021 - 12/31/2021,https://www.foi.gov.ph/requests/aglzfmVmb2ktcGhyHQsSB0NvbnRlbnQiEENBQi0xOTczMjYzNzcxNDQM
OWWA,"May 21, 2023",OFW cash loan/ Housing Loan,PENDING,OFW cash loan/ Housing Loan,05/21/2023 - 05/21/2023,https://www.foi.gov.ph/requests/aglzfmVmb2ktcGhyHgsSB0NvbnRlbnQiEU9XV0EtMjg5MjI5NDQ4Nzg2DA
FNRI,"May 21, 2023",Status of study on VCO as treatment for Covid-19,PENDING,Research,05/21/2020 - 05/21/2023,https://www.foi.gov.ph/requests/aglzfmVmb2ktcGhyHgsSB0NvbnRlbnQiEUZOUkktMTU2NDUzNTQyNTk2DA
PAGASA,"May 21, 2023",Daily Meteorological Conditions in Dasmariñas City,ACCEPTED,Research Requirement,04/19/2023 - 05/19/2023,https://www.foi.gov.ph/requests/aglzfmVmb2ktcGhyIAsSB0NvbnRlbnQiE1BBR0FTQS03NjIxNjgwNjAxNzUM
NBI,"May 21, 2023",Scammed by Organize-shop.vip,PENDING,To get back my money and to help others who have also been scammed,05/21/2023 - 05/21/2023,https://www.foi.gov.ph/requests/aglzfmVmb2ktcGhyHQsSB0NvbnRlbnQiEE5CSS03MjA5MzIyNTQ5MDgM
LMB,"May 21, 2023",Paete laguna Cad 404,PENDING,This will be used to locate the lands that our great grandmother left us.,01/01/1995 - 05/21/2023,https://www.foi.gov.ph/requests/aglzfmVmb2ktcGhyIQsSB0NvbnRlbnQiFERFTlJMTUItMjIzNDA4MDE2MTAzDA
DPWH,"May 21, 2023",Data on the Affected Families of the NLEX-SLEX Connector Project in Manila,PENDING,Research,05/21/2023 - 05/21/2023,https://www.foi.gov.ph/requests/aglzfmVmb2ktcGhyHgsSB0NvbnRlbnQiEURQV0gtMDQ1MTkxNjQ2Njk1DA
PNP,"May 21, 2023",Crime Rates Statistics 2010-2020 National Capital Region,PENDING,Research and analysis,01/01/2010 - 12/31/2020,https://www.foi.gov.ph/requests/aglzfmVmb2ktcGhyHQsSB0NvbnRlbnQiEFBOUC0yNDgxNjA2OTEwMzQM
DOH,"May 21, 2023",Data about Mental Health Cases in NCR,PENDING,Research and Academic Purposes,01/01/2000 - 05/21/2023,https://www.foi.gov.ph/requests/aglzfmVmb2ktcGhyHQsSB0NvbnRlbnQiEERPSC0yNjAxOTE0NjcxODkM
RSU,"May 21, 2023",TOR REQUEST,PENDING,for Work Requirements,05/21/2023 - 05/21/2023,https://www.foi.gov.ph/requests/aglzfmVmb2ktcGhyHQsSB0NvbnRlbnQiEFJTVS0yNjA2MDI3OTgzMDkM
PNP,"May 21, 2023",Crime Rate Statistics 2010-2020 Philippines and National Capital Region,PENDING,Research and thesis,01/01/2010 - 12/31/2020,https://www.foi.gov.ph/requests/aglzfmVmb2ktcGhyHQsSB0NvbnRlbnQiEFBOUC00MTEyNjc2Njk5NzQM
MIAA,"May 21, 2023",Passenger Service fee and Landing fee of MIAA,PENDING,Research information for my study,01/20/2020 - 05/19/2023,https://www.foi.gov.ph/requests/aglzfmVmb2ktcGhyHgsSB0NvbnRlbnQiEU1JQUEtODM0NjY2MzU0NTg2DA
DepEd,"May 21, 2023",ALS DIPLOMA/CERTIFICATE,SUCCESSFUL,Overseas Employment Application,01/01/2007 - 02/28/2007,https://www.foi.gov.ph/requests/aglzfmVmb2ktcGhyHwsSB0NvbnRlbnQiEkRlcEVkLTc2OTQ5MDQ4NTQ2NQw
PITAHC,"May 21, 2023",Documents and Researches of Ethnomedicinal Practices in Bataan,PENDING,Architectural Research,01/01/2016 - 05/21/2023,https://www.foi.gov.ph/requests/aglzfmVmb2ktcGhyIAsSB0NvbnRlbnQiE1BJVEFIQy02MzU1NzcyMTkwODMM
NTC,"May 21, 2023",Harassment from PesoPlus,PENDING,To give the company a lesson,05/21/2023 - 05/21/2023,https://www.foi.gov.ph/requests/aglzfmVmb2ktcGhyHQsSB0NvbnRlbnQiEE5UQy03MDcxNTIwNDIwNDQM
DOH,"May 21, 2023",Vaxcert updating; add middle name,SUCCESSFUL,For international travel,06/30/2021 - 07/21/2021,https://www.foi.gov.ph/requests/aglzfmVmb2ktcGhyHQsSB0NvbnRlbnQiEERPSC0xNjA2MTY2MTMwMDAM
OWWA,"May 21, 2023",Certification of Distressed OFW,PENDING,Certified documents to prove my brother is a distress OFW and is in need of help.,12/28/2012 - 05/21/2023,https://www.foi.gov.ph/requests/aglzfmVmb2ktcGhyHgsSB0NvbnRlbnQiEU9XV0EtMjkxNzk3MDI0NzU3DA
PAO,"May 21, 2023",Full refund of my equity due to delay of turnover,PENDING,Full Refund of Equity,03/31/2020 - 02/28/2021,https://www.foi.gov.ph/requests/aglzfmVmb2ktcGhyHQsSB0NvbnRlbnQiEFBBTy03NDgzOTM5NTIzODcM
LRTA,"May 21, 2023",Number of Rideship for LRT 1 and MRT 3 for 2023,PENDING,Undergraduate Thesis Proposal,01/01/2023 - 04/30/2023,https://www.foi.gov.ph/requests/aglzfmVmb2ktcGhyHgsSB0NvbnRlbnQiEUxSVEEtMTA3NDIzNjY3Nzg0DA
DOH,"May 21, 2023",Vax Cert update Cancellation,SUCCESSFUL,Travel Abroad,06/28/2021 - 07/19/2021,https://www.foi.gov.ph/requests/aglzfmVmb2ktcGhyHQsSB0NvbnRlbnQiEERPSC00NDk0OTg0NDI5NDgM
DepEd,"May 21, 2023",Copy of Academic Records from grades 11 to 12.,SUCCESSFUL,college admission,08/05/2021 - 05/21/2023,https://www.foi.gov.ph/requests/aglzfmVmb2ktcGhyHwsSB0NvbnRlbnQiEkRlcEVkLTc4OTkyNjQ4NjA4MAw
DepEd,"May 21, 2023",Copy of Secondary Diploma,SUCCESSFUL,Employment,06/04/2001 - 03/26/2002,https://www.foi.gov.ph/requests/aglzfmVmb2ktcGhyHwsSB0NvbnRlbnQiEkRlcEVkLTkzODI5MjM3NTM3OAw
NTC,"May 21, 2023",Text Harrassment from Scammers,PENDING,To report and find these scammers,05/20/2023 - 05/21/2023,https://www.foi.gov.ph/requests/aglzfmVmb2ktcGhyHQsSB0NvbnRlbnQiEE5UQy0zMTAxMDk1NDc3MDgM
NTC,"May 21, 2023",Text Scam about Dragonpay/Dragon Loan,PENDING,To trace and locate this scammers,05/21/2023 - 05/21/2023,https://www.foi.gov.ph/requests/aglzfmVmb2ktcGhyHQsSB0NvbnRlbnQiEE5UQy05MTIwNTMyODg4ODEM
DOST,"May 21, 2023",Status of study on VCO as treatment for Covid-19,REFERRED,Research,05/21/2020 - 05/21/2023,https://www.foi.gov.ph/requests/aglzfmVmb2ktcGhyHgsSB0NvbnRlbnQiEURPU1QtMzA4OTk3NDkwNzM1DA
PRC,"May 21, 2023",Number of Board Passers of Heath Care Professions from 2018 to 2022,ACCEPTED,Basis for new program offerings of one school,01/01/2018 - 12/31/2022,https://www.foi.gov.ph/requests/aglzfmVmb2ktcGhyHQsSB0NvbnRlbnQiEFBSQy0zNDI3ODAwMzA3MTUM
LTFRB,"May 21, 2023",Data on Angkas bookings,PENDING,Research,01/01/2023 - 05/21/2023,https://www.foi.gov.ph/requests/aglzfmVmb2ktcGhyHwsSB0NvbnRlbnQiEkxURlJCLTc0MzE1NTA2MzA0MAw
PNP,"May 21, 2023",National police clearance,PENDING,Refund my gcash payment,05/19/2023 - 05/19/2023,https://www.foi.gov.ph/requests/aglzfmVmb2ktcGhyHQsSB0NvbnRlbnQiEFBOUC0zMzExMDMzOTM3MzEM
NTC,"May 21, 2023",Block IMEI of stolen phone,PENDING,to make lost phone useless and prevent stolen data,05/14/2023 - 05/14/2023,https://www.foi.gov.ph/requests/aglzfmVmb2ktcGhyHQsSB0NvbnRlbnQiEE5UQy01MjkzMDI1NDMyMzMM
DFA,"May 21, 2023",Marriage contract with red ribbon and saudi embassy stamp,DENIED,family visit visa application vfs requirementd,06/03/2014 - 07/15/2018,https://www.foi.gov.ph/requests/aglzfmVmb2ktcGhyHQsSB0NvbnRlbnQiEERGQS01MTk1OTUyNTE0NjYM
IC,"May 21, 2023",The Number of Insurance Companies and HMOs that Cater Mental Health Services,PENDING,Juris Doctor Thesis,01/01/2013 - 05/21/2023,https://www.foi.gov.ph/requests/aglzfmVmb2ktcGhyHAsSB0NvbnRlbnQiD0lDLTg5NDA5ODQwMjI1Nww
PSA,"May 21, 2023",Request Change of Delivery Address for National ID,PENDING,Change of Delivery Address for National ID,05/21/2023 - 05/21/2023,https://www.foi.gov.ph/requests/aglzfmVmb2ktcGhyHQsSB0NvbnRlbnQiEFBTQS04MjQyMzA4MzE2NjcM
LTO,"May 21, 2023",GETTING NON PRO LICENSE USING TESDA CERTIFICATE,PENDING,CLARIFICATION WHY LTO KAWIT DIDN'T ACKNOWLEDGE MY DRIVING NC2 CERTIFICATE,05/17/2023 - 05/21/2023,https://www.foi.gov.ph/requests/aglzfmVmb2ktcGhyHQsSB0NvbnRlbnQiEExUTy02MTY2Mjg0MjY0NjUM
DOH,"May 21, 2023",The Number of Private and Public Hospitals that Cater Mental Health Services,PENDING,Juris Doctor Thesis,01/01/2013 - 05/21/2023,https://www.foi.gov.ph/requests/aglzfmVmb2ktcGhyHQsSB0NvbnRlbnQiEERPSC0zMzg3NDAwMjYzNDgM
PSA,"May 21, 2023",Raw data of Teenage Pregnancy in NCR,PENDING,Class Project in Statistics,04/01/2023 - 05/01/2023,https://www.foi.gov.ph/requests/aglzfmVmb2ktcGhyHQsSB0NvbnRlbnQiEFBTQS0yOTgyMzkyODI0MTIM
DOH,"May 21, 2023",Lost Covid-19 Vaccination Card,SUCCESSFUL,Fractional D & C operation,05/01/2021 - 12/31/2022,https://www.foi.gov.ph/requests/aglzfmVmb2ktcGhyHQsSB0NvbnRlbnQiEERPSC04NDkzNjg4MzQ1MjgM
PSA,"May 21, 2023",National ID,PENDING,Request for Transaction Reference number,06/01/2020 - 04/01/2023,https://www.foi.gov.ph/requests/aglzfmVmb2ktcGhyHQsSB0NvbnRlbnQiEFBTQS0xOTA3ODE1MTUyOTYM
NTC,"May 21, 2023",Complaint against Converge ICT,PENDING,Formal Complaint,04/01/2023 - 05/21/2023,https://www.foi.gov.ph/requests/aglzfmVmb2ktcGhyHQsSB0NvbnRlbnQiEE5UQy05OTYwNTA0ODU4MDEM
DOST,"May 21, 2023",Daily Meteorological Conditions in Dasmariñas City,REFERRED,Research Requirement,04/19/2023 - 05/19/2023,https://www.foi.gov.ph/requests/aglzfmVmb2ktcGhyHgsSB0NvbnRlbnQiEURPU1QtNjM5MDg5NTYzNjI2DA
NTC,"May 21, 2023",Gcash scam,PENDING,Scam po,05/21/2023 - 05/21/2023,https://www.foi.gov.ph/requests/aglzfmVmb2ktcGhyHQsSB0NvbnRlbnQiEE5UQy0wNjE1NzUxMzY0NTEM
NTC,"May 21, 2023",Scam,PENDING,Scam po,05/21/2023 - 05/21/2023,https://www.foi.gov.ph/requests/aglzfmVmb2ktcGhyHQsSB0NvbnRlbnQiEE5UQy01NTY4NzQzMjA4NjQM
DTI,"May 21, 2023","Number of DTI-registered Cafes or Coffee Shops in Sampaloc, Manila (2023)",PENDING,Research,01/01/2023 - 05/21/2023,https://www.foi.gov.ph/requests/aglzfmVmb2ktcGhyHQsSB0NvbnRlbnQiEERUSS04MjIxNzYzMzE3NTMM
NTC,"May 21, 2023",Block Lost Phone,PENDING,To save and protect sensitive and important information on the phone.,05/21/2023 - 05/21/2023,https://www.foi.gov.ph/requests/aglzfmVmb2ktcGhyHQsSB0NvbnRlbnQiEE5UQy02NzQ4NTAzNzM2NDAM
PAO,"May 21, 2023",Paninirang Puri,PENDING,To end bullying,03/22/2023 - 05/21/2023,https://www.foi.gov.ph/requests/aglzfmVmb2ktcGhyHQsSB0NvbnRlbnQiEFBBTy02MTYwMzM0MjYyMTIM
DepEd,"May 21, 2023",Requesting of ALS Certificate/diploma,SUCCESSFUL,Tesda enrollment,06/06/2015 - 01/29/2016,https://www.foi.gov.ph/requests/aglzfmVmb2ktcGhyHwsSB0NvbnRlbnQiEkRlcEVkLTk4MTIyOTM4MzU4MQw
BOC,"May 21, 2023",scamming activity,SUCCESSFUL,suspicious activity,05/21/2023 - 05/21/2023,https://www.foi.gov.ph/requests/aglzfmVmb2ktcGhyHQsSB0NvbnRlbnQiEEJPQy04MDAwNzE0NjYwMTIM
DTI,"May 21, 2023",The list of small businesses in Tacloban City,PENDING,Research and Development,01/20/1990 - 05/21/2023,https://www.foi.gov.ph/requests/aglzfmVmb2ktcGhyHQsSB0NvbnRlbnQiEERUSS0xMzcyMDM0MjY2NTMM
SEC,"May 21, 2023",UNFAIR DEBT COLLECTION,ACCEPTED,REVOCATION OF LICENSES / STOPPAGE OF OPERATION,04/01/2023 - 05/21/2023,https://www.foi.gov.ph/requests/aglzfmVmb2ktcGhyHQsSB0NvbnRlbnQiEFNFQy0zMzQwMDkwMDM4OTEM
NPC,"May 21, 2023",MALICIOUSLY DISCLOSING MY DATA,PENDING,WHATEVER LEGAL ACTION THAT MAY SERVE BEST,04/01/2023 - 05/21/2023,https://www.foi.gov.ph/requests/aglzfmVmb2ktcGhyHQsSB0NvbnRlbnQiEE5QQy00MTM4NTc1OTUxNzgM
NTC,"May 21, 2023",Block a stolen phone,PENDING,Para hindi na magamit.,05/08/2023 - 05/21/2023,https://www.foi.gov.ph/requests/aglzfmVmb2ktcGhyHQsSB0NvbnRlbnQiEE5UQy0wNzUxODc0MTM1NzYM
DOH,"May 21, 2023",VaxCert,SUCCESSFUL,For employment purposes.,11/22/2021 - 04/12/2022,https://www.foi.gov.ph/requests/aglzfmVmb2ktcGhyHQsSB0NvbnRlbnQiEERPSC01NjQzMDU4OTU3NTYM
DOH,"May 21, 2023",LATEST EDITION NURSING SERVICE ADMINISTRATION MANUAL,ACCEPTED,FOR REFERENCE IN THE NURSING OFFICE,05/21/2023 - 05/21/2023,https://www.foi.gov.ph/requests/aglzfmVmb2ktcGhyHQsSB0NvbnRlbnQiEERPSC0yMjI2MTY3ODU4NzUM
DOJ,"May 21, 2023",criminal case verification,PENDING,Verify if I have an ongoing criminal case.,05/21/2016 - 05/21/2023,https://www.foi.gov.ph/requests/aglzfmVmb2ktcGhyHQsSB0NvbnRlbnQiEERPSi0xNDI3MDUzMjI2NDAM
PNP,"May 21, 2023",crime rate in northern samar per graph,PENDING,For my presentation in schooling,01/01/2023 - 01/01/2023,https://www.foi.gov.ph/requests/aglzfmVmb2ktcGhyHQsSB0NvbnRlbnQiEFBOUC02NTY2MTE1NTYyMTEM
PSA,"May 21, 2023",Lost National ID,PENDING,National ID,05/21/2023 - 05/21/2023,https://www.foi.gov.ph/requests/aglzfmVmb2ktcGhyHQsSB0NvbnRlbnQiEFBTQS0xMTA0MTA1NDg1ODAM
DepEd,"May 21, 2023",Transcript of Records & Diploma (highschool),SUCCESSFUL,Academic Transcript of Records (Highschool) to fulfill application requirements to study in Canada,03/30/1997 - 03/30/2000,https://www.foi.gov.ph/requests/aglzfmVmb2ktcGhyHwsSB0NvbnRlbnQiEkRlcEVkLTI1NDUxNjMxODM2Mgw
UsaP,"May 21, 2023",The number of residents in Sampaguita Street and Acacia Street in Pinagbuhatan Pasig City,PENDING,For research purposes,04/02/2015 - 04/02/2023,https://www.foi.gov.ph/requests/aglzfmVmb2ktcGhyHgsSB0NvbnRlbnQiEVVTQVAtNTE2ODA4NDY1NzgyDA
CHED,"May 21, 2023","The number of Grade 12 students who did not proceed to college in Imus, Cavite, between 2020 and 202",PENDING,Undergraduate thesis,09/01/2020 - 12/30/2022,https://www.foi.gov.ph/requests/aglzfmVmb2ktcGhyHgsSB0NvbnRlbnQiEUNIRUQtMzM1ODgyODAzNTg2DA
PSA,"May 21, 2023","Number of Grade 12 students who did not proceed to college in Imus, Cavite, between 2020 and 2022",PENDING,undergraduate thesis,09/01/2020 - 12/30/2022,https://www.foi.gov.ph/requests/aglzfmVmb2ktcGhyHQsSB0NvbnRlbnQiEFBTQS03NTQ4OTAwNzMwNDAM
BIR,"May 21, 2023",Request of Copy of ITR (BIR 2316),PENDING,For Employment Use,01/01/2022 - 05/04/2023,https://www.foi.gov.ph/requests/aglzfmVmb2ktcGhyHQsSB0NvbnRlbnQiEEJJUi02NTA1MzI2NTkxOTAM
DOH,"May 21, 2023",My Vaccine Certificate Need to be Updated,SUCCESSFUL,Employment Purposes,11/13/2021 - 02/24/2022,https://www.foi.gov.ph/requests/aglzfmVmb2ktcGhyHQsSB0NvbnRlbnQiEERPSC0yNzI5NzA4NjE2MzUM
NBI,"May 21, 2023",margareth rillo suspect for murder convicted with penalty blacklisted in LinkedIn PH and JobStreetPH,PENDING,PNP Blotter Report for suspect margareth rillo permanent banned suffering in PH companies.,01/01/2017 - 05/21/2023,https://www.foi.gov.ph/requests/aglzfmVmb2ktcGhyHQsSB0NvbnRlbnQiEE5CSS01NjcxMzQwNzAxNDQM
NBI,"May 21, 2023",margareth rilo convicted as serial killer permanently banned real-time blacklisted BLACKOUT in PH.,PENDING,PNP Blotter Report for suspect margareth rillo employment banned permanent death in PH.,01/01/2017 - 05/21/2023,https://www.foi.gov.ph/requests/aglzfmVmb2ktcGhyHQsSB0NvbnRlbnQiEE5CSS01NjAyMTQwODEyODYM
NBI,"May 21, 2023",blacklist serial killer margareth rillo in the philippines jail,PENDING,PNP Blotter Report for suspect margareth rillo employment banned permanent death in PH.,01/01/2017 - 05/21/2023,https://www.foi.gov.ph/requests/aglzfmVmb2ktcGhyHQsSB0NvbnRlbnQiEE5CSS04MDIxNDkxNDA3MjEM
NBI,"May 21, 2023",margareth rillo convicted permanently banned real-time blacklist in PH companies for sextortion,PENDING,PNP Blotter Report for suspect margareth rillo permanent banned suffering in PH companies.,01/01/2017 - 05/21/2023,https://www.foi.gov.ph/requests/aglzfmVmb2ktcGhyHQsSB0NvbnRlbnQiEE5CSS0xOTEwOTY0MTMxODQM
NBI,"May 21, 2023",margareth rillo convicted permanently banned real-time blacklist in PH companies for sexual assault,PENDING,PNP Blotter Report for suspect margareth rillo permanent banned suffering in PH companies.,01/01/2017 - 05/21/2023,https://www.foi.gov.ph/requests/aglzfmVmb2ktcGhyHQsSB0NvbnRlbnQiEE5CSS0wOTI1NzM2NTQ2MTMM
NTC,"May 21, 2023",BLOCK MY PHONE,PENDING,PHONE WAS STOLEN,05/20/2023 - 05/21/2023,https://www.foi.gov.ph/requests/aglzfmVmb2ktcGhyHQsSB0NvbnRlbnQiEE5UQy01MDYwNTIyNTYxNzMM
NBI,"May 21, 2023",margareth rillo sexual harrassment to 77GlobalPH-ADB enployees reported in PH.,PENDING,PNP Blotter Report for suspect margareth rillo permanent banned suffering in PH companies.,01/01/2017 - 05/21/2023,https://www.foi.gov.ph/requests/aglzfmVmb2ktcGhyHQsSB0NvbnRlbnQiEE5CSS03MTgwMDk3MTQ0NzkM
PNP,"May 21, 2023",suspect margareth rillo convicted permanent banned or blacklist deceased reported in PNP.,PENDING,PNP Blotter Report for suspect margareth rillo employment banned permanent death in PH.,01/01/2017 - 05/21/2023,https://www.foi.gov.ph/requests/aglzfmVmb2ktcGhyHQsSB0NvbnRlbnQiEFBOUC0yNDk1MzUzNTE0OTMM
NBI,"May 21, 2023",margareth rillo convicted as serial killer real-time blacklisted 42 age permanent death blackout,PENDING,PNP Blotter Report for suspect margareth rillo employment banned permanent death in PH.,01/01/2017 - 05/21/2023,https://www.foi.gov.ph/requests/aglzfmVmb2ktcGhyHQsSB0NvbnRlbnQiEE5CSS0yODYxNzE1NzM2MzEM
PNP,"May 21, 2023",PNP Blotter Report for suspect margareth rillo employment banned permanent death in PH.,PENDING,PNP Blotter Report for suspect margareth rillo employment banned permanent death in PH.,01/01/2017 - 05/21/2023,https://www.foi.gov.ph/requests/aglzfmVmb2ktcGhyHQsSB0NvbnRlbnQiEFBOUC04OTU3ODcxNzc3NzIM
NBI,"May 21, 2023",primary serial killer margareth rillo blacklisted in JobstreetPH companies.,PENDING,PNP Blotter Report for suspect margareth rillo employment banned permanent death in PH.,01/01/2017 - 05/21/2023,https://www.foi.gov.ph/requests/aglzfmVmb2ktcGhyHQsSB0NvbnRlbnQiEE5CSS02OTc0NTU5ODc0OTMM
NBI,"May 21, 2023",margareth rillo sexual harrassment to 77GlobalPH-ADB enployees reported in PH.,PENDING,PNP Blotter Report for suspect margareth rillo permanent banned suffering in PH companies.,01/01/2017 - 05/21/2023,https://www.foi.gov.ph/requests/aglzfmVmb2ktcGhyHQsSB0NvbnRlbnQiEE5CSS02NzY0NzA4NzY2NDcM
DOJ,"May 21, 2023",dreaded blacklist criminal demoniac margareth rillo,PENDING,PNP Blotter Report for suspect margareth rillo employment banned permanent death in PH.,01/01/2017 - 05/21/2023,https://www.foi.gov.ph/requests/aglzfmVmb2ktcGhyHQsSB0NvbnRlbnQiEERPSi0zODg4NDk1MzI5MjIM
DHVSU,"May 21, 2023","10 YR Solid Waste Management Plan of Minalin & STo. Tomas, Pampanga",PENDING,Case Study and Development,01/01/2010 - 05/21/2023,https://www.foi.gov.ph/requests/aglzfmVmb2ktcGhyHwsSB0NvbnRlbnQiEkRIVlNVLTM2NjQwMTU3NTkyMww
DOJ,"May 21, 2023",Releasing case close permanent Richard G. Habijan,PENDING,For Releasing case Close,12/07/2012 - 12/07/2012,https://www.foi.gov.ph/requests/aglzfmVmb2ktcGhyHQsSB0NvbnRlbnQiEERPSi0wNjU2NTA1NDM3ODQM
NBI,"May 21, 2023",Scammer Alert,PENDING,I want you to trace them and help me get my money back. Thank you,05/19/2023 - 05/21/2023,https://www.foi.gov.ph/requests/aglzfmVmb2ktcGhyHQsSB0NvbnRlbnQiEE5CSS01OTEyNDc0OTE3MTQM
DOJ,"May 21, 2023",Pending file /criminal case,PENDING,Closure and peace of mind,03/11/2023 - 05/15/2023,https://www.foi.gov.ph/requests/aglzfmVmb2ktcGhyHQsSB0NvbnRlbnQiEERPSi02NjM4MzAxNTIzNjIM
