agency,date,title,status,purpose,period_covered,link
NBI,"June 09, 2022",09068195669 Under the name of Piza Roda Fpales,PENDING,"Mahanap at maibalik niya ang pera ko kinuha niya sa gcash account nang asawa ko worth 30,000",06/09/2022 - 06/09/2022,https://www.foi.gov.ph/requests/aglzfmVmb2ktcGhyHQsSB0NvbnRlbnQiEE5CSS0zNTE0MjAxMTc1NDkM
DSWD,"June 09, 2022",FINANCIAL/MEDICAL ASSISTANCE,DENIED,Dialysis patient. For maintenance medicine.,06/09/2022 - 06/09/2022,https://www.foi.gov.ph/requests/aglzfmVmb2ktcGhyHgsSB0NvbnRlbnQiEURTV0QtMTA1NTMxMjc3Njg0DA
LMB,"June 09, 2022",Land Dispute Settlement,ACCEPTED,Land Dispute Settlement Request,06/09/2022 - 06/09/2022,https://www.foi.gov.ph/requests/aglzfmVmb2ktcGhyIQsSB0NvbnRlbnQiFERFTlJMTUItMjI3OTAzMDY5ODcyDA
PNU,"June 09, 2022",Transcript of Record,PARTIALLY SUCCESSFUL,Working abroad.,06/09/2011 - 04/15/2015,https://www.foi.gov.ph/requests/aglzfmVmb2ktcGhyHQsSB0NvbnRlbnQiEFBOVS0wNjczNjk1NDI0NTMM
DOH,"June 09, 2022",VAX CERT ERROR NEED ASAP FOR FLIGHT,SUCCESSFUL,"Need Vax Cert for Flight on June 11,2021",06/08/2022 - 06/09/2022,https://www.foi.gov.ph/requests/aglzfmVmb2ktcGhyHQsSB0NvbnRlbnQiEERPSC04MTI0ODAyODkwNjUM
BIR,"June 09, 2022",Statistics of BIR Registered Restaurants in the Philippines,DENIED,Research and development,01/01/2021 - 06/01/2022,https://www.foi.gov.ph/requests/aglzfmVmb2ktcGhyHQsSB0NvbnRlbnQiEEJJUi04MzczNzYwMDU5MDgM
PRA,"June 09, 2022","PROPOSED RECLAMATION PROJECT IN HAGONOY, BULACAN",ACCEPTED,Investigative Research,02/01/2022 - 02/28/2022,https://www.foi.gov.ph/requests/aglzfmVmb2ktcGhyHQsSB0NvbnRlbnQiEFBSQS04NTQzNzQ1ODk5NDkM
DOH,"June 09, 2022",No vaccination found for my vax cert,SUCCESSFUL,VAXCERT RECORD,06/01/2021 - 08/31/2021,https://www.foi.gov.ph/requests/aglzfmVmb2ktcGhyHQsSB0NvbnRlbnQiEERPSC0zNDM3MDIyNjMyNjQM
BJMP,"June 09, 2022",Implemented Gender and Development Programs inside the jail within ILOILO CITY,ACCEPTED,Research,01/01/2015 - 01/01/2022,https://www.foi.gov.ph/requests/aglzfmVmb2ktcGhyHgsSB0NvbnRlbnQiEUJKTVAtMjM3MzA4MTg1NjUwDA
DOH,"June 09, 2022",Total population of Batangas City; Number of BHW in Batangas City,PROCESSING,Research,06/09/2022 - 06/09/2022,https://www.foi.gov.ph/requests/aglzfmVmb2ktcGhyHQsSB0NvbnRlbnQiEERPSC0xNzY5Mjc2NTcyNzYM
PEZA,"June 09, 2022",Request for Information,PENDING,Data for Research Purposes,12/31/2020 - 06/09/2022,https://www.foi.gov.ph/requests/aglzfmVmb2ktcGhyHgsSB0NvbnRlbnQiEVBFWkEtODU4NzIzMzc2NDU5DA
LTO,"June 09, 2022",No. of registered vehicles in Metro Manila,PENDING,JICA Study,01/01/2006 - 12/31/2009,https://www.foi.gov.ph/requests/aglzfmVmb2ktcGhyHQsSB0NvbnRlbnQiEExUTy0wOTg5NTY1OTc4MTYM
UsaP,"June 09, 2022",Master List of Buildings in Pasig City,ACCEPTED,Research,06/09/2022 - 06/09/2022,https://www.foi.gov.ph/requests/aglzfmVmb2ktcGhyHgsSB0NvbnRlbnQiEVVTQVAtNTA1OTg5NjAxNzYzDA
UsaP,"June 09, 2022",Master List of Villages/Subdivisions in Pasig City,ACCEPTED,Research,06/09/2022 - 06/09/2022,https://www.foi.gov.ph/requests/aglzfmVmb2ktcGhyHgsSB0NvbnRlbnQiEVVTQVAtMTA0OTU2MzgwMTE1DA
FPA,"June 09, 2022",Volume of Fertilizers and Pesticides Consumed,AWAITING CLARIFICATION,Data Collection for the Provincial Product Accounts,01/01/2019 - 12/31/2021,https://www.foi.gov.ph/requests/aglzfmVmb2ktcGhyHQsSB0NvbnRlbnQiEEZQQS03MDUwNzI5MDAyODYM
DA,"June 09, 2022",Historical and Projected Supply and Demand of Organic Fertilizer,DENIED,for our feasibility study,06/09/2022 - 06/09/2022,https://www.foi.gov.ph/requests/aglzfmVmb2ktcGhyHAsSB0NvbnRlbnQiD0RBLTQ5ODY5ODU4MTM5Nww
ATI,"June 09, 2022",Historical and Projected Supply and Demand of Organic Fertilizer,SUCCESSFUL,for our feasibility study,06/09/2022 - 06/09/2022,https://www.foi.gov.ph/requests/aglzfmVmb2ktcGhyHQsSB0NvbnRlbnQiEEFUSS0zNTcwOTM4ODIwMzQM
BSU,"June 09, 2022",Historical and Projected Supply and Demand of Organic Fertilizer,PENDING,For our feasibility study,06/09/2022 - 06/09/2022,https://www.foi.gov.ph/requests/aglzfmVmb2ktcGhyHQsSB0NvbnRlbnQiEEJTVS02OTY5MDE0NTMxNDkM
BSU,"June 09, 2022",Organic Liquid Fertilizer from Chicken Manure,PENDING,for our feasibility study,06/09/2022 - 06/09/2022,https://www.foi.gov.ph/requests/aglzfmVmb2ktcGhyHQsSB0NvbnRlbnQiEEJTVS01MDM5MDEzODgxMDYM
LRTA,"June 09, 2022",Number of passengers in and out of Edsa station,DENIED,Research and development,01/01/2022 - 05/01/2022,https://www.foi.gov.ph/requests/aglzfmVmb2ktcGhyHgsSB0NvbnRlbnQiEUxSVEEtMjQzMzkzMDEyMTc5DA
DPWH,"June 09, 2022",PROJECT COST OF PATAG SILAY -CALATRAVA NATIONAL HIGHWAY,AWAITING CLARIFICATION,Research and Personal information,01/01/2020 - 12/31/2021,https://www.foi.gov.ph/requests/aglzfmVmb2ktcGhyHgsSB0NvbnRlbnQiEURQV0gtNDAwNTM2MDMyMjY2DA
PAGASA,"June 09, 2022",Updated Seasonal Rainfall map,AWAITING CLARIFICATION,For PDPFP Updating,06/09/2022 - 06/09/2022,https://www.foi.gov.ph/requests/aglzfmVmb2ktcGhyIAsSB0NvbnRlbnQiE1BBR0FTQS0xNzg5NzA4MTczODEM
POEA,"June 09, 2022",Result of EPS-TOPIK registration,PENDING,"Transparency of number of registrants, and fairness to others like me who wants to register.",06/08/2022 - 06/09/2022,https://www.foi.gov.ph/requests/aglzfmVmb2ktcGhyHgsSB0NvbnRlbnQiEVBPRUEtMDY2ODM3Njk2MzYxDA
CHED,"June 09, 2022",Inquiry on Pacific Intercontinental College's MAEd in English Education program,ACCEPTED,for verification,06/09/2022 - 06/09/2022,https://www.foi.gov.ph/requests/aglzfmVmb2ktcGhyHgsSB0NvbnRlbnQiEUNIRUQtMzMxNjI5MzE1MjgxDA
NAMRIA,"June 09, 2022",Updated Hazard Map,REFERRED,For PDPFP Updating,06/08/2022 - 06/08/2022,https://www.foi.gov.ph/requests/aglzfmVmb2ktcGhyJAsSB0NvbnRlbnQiF0RFTlJOQU1SSUEtMjcxNzM2MTM3MTIzDA
DOJ,"June 09, 2022",Opinion dated 05 March 2013 (LML-L-5C13),SUCCESSFUL,Research and understanding,03/05/2013 - 04/01/2013,https://www.foi.gov.ph/requests/aglzfmVmb2ktcGhyHQsSB0NvbnRlbnQiEERPSi04NDgzMzAyNTkyMDYM
DOH,"June 09, 2022",Vaccine Certificate,SUCCESSFUL,Travel,05/01/2022 - 06/09/2022,https://www.foi.gov.ph/requests/aglzfmVmb2ktcGhyHQsSB0NvbnRlbnQiEERPSC00NTI2MjAxMjkyMTgM
DOH,"June 09, 2022",COVID VACCINATION CERTIFICATE,SUCCESSFUL,WORK ABROAD,08/17/2021 - 06/09/2022,https://www.foi.gov.ph/requests/aglzfmVmb2ktcGhyHQsSB0NvbnRlbnQiEERPSC03OTkxNTMzOTI5NjQM
DSWD,"June 09, 2022",Number of Social Welfare Programs Implemented by City/Municipality and Province in the Philippines,PROCESSING,Master's Thesis,01/01/2003 - 12/31/2009,https://www.foi.gov.ph/requests/aglzfmVmb2ktcGhyHgsSB0NvbnRlbnQiEURTV0QtNzUyNTU2MDk2MjQ2DA
DOT,"June 09, 2022",The number of travelers from Tarlac going to domestic tourist spots,AWAITING CLARIFICATION,Feasibility Study,01/01/2020 - 12/31/2021,https://www.foi.gov.ph/requests/aglzfmVmb2ktcGhyHQsSB0NvbnRlbnQiEERPVC0zODQ5MTkxNzY0NDQM
DOH,"June 09, 2022",Number of Health Care Centers in the Philippines by City/Municipality and by Province,PARTIALLY SUCCESSFUL,Master's Thesis,01/01/2003 - 12/31/2009,https://www.foi.gov.ph/requests/aglzfmVmb2ktcGhyHQsSB0NvbnRlbnQiEERPSC0yMjE2NjI1NTUxMTEM
PNP,"June 09, 2022","Crime Rate in the Philippines by City/Municipality and by Province (2003, 2006, and 2009)",DENIED,Master's Thesis,01/01/2003 - 12/31/2009,https://www.foi.gov.ph/requests/aglzfmVmb2ktcGhyHQsSB0NvbnRlbnQiEFBOUC0xMzk0ODMzMDAxODUM
NBI,"June 09, 2022",LOAN APP HARASSMENT,PENDING,Harassment call or text of Online Lending App.,06/01/2022 - 06/09/2022,https://www.foi.gov.ph/requests/aglzfmVmb2ktcGhyHQsSB0NvbnRlbnQiEE5CSS0yMjYyMTIxMDM1MTIM
DOH,"June 09, 2022",Vaxcert,SUCCESSFUL,For Employment Abroad,07/10/2021 - 02/03/2022,https://www.foi.gov.ph/requests/aglzfmVmb2ktcGhyHQsSB0NvbnRlbnQiEERPSC0xNjkxMDAxNjQ1MTQM
NTC,"June 09, 2022",List of DTTB Stations in the CAR as of June 2022,ACCEPTED,Research,12/31/2020 - 06/09/2022,https://www.foi.gov.ph/requests/aglzfmVmb2ktcGhyHQsSB0NvbnRlbnQiEE5UQy04MjExMzk3MTExNDIM
DOH,"June 09, 2022",Epidemiology of Ectopic Pregnancy in the Philippines,DENIED,Case Study,01/01/2012 - 06/09/2022,https://www.foi.gov.ph/requests/aglzfmVmb2ktcGhyHQsSB0NvbnRlbnQiEERPSC05MDg4MTE2NzE5MjYM
DOJ,"June 09, 2022",Deed of Donation,SUCCESSFUL,pagpapatitulo ng lupa,01/01/1999 - 03/31/1999,https://www.foi.gov.ph/requests/aglzfmVmb2ktcGhyHQsSB0NvbnRlbnQiEERPSi01MjE3NjEzODc5MTAM
PSRTI,"June 09, 2022",The number of single father in Cavite,DENIED,For research purposes,06/09/2019 - 06/09/2022,https://www.foi.gov.ph/requests/aglzfmVmb2ktcGhyHwsSB0NvbnRlbnQiElBTUlRJLTk3NDcwOTE4ODU5MQw
DOH,"June 09, 2022",Vaccine Certificate,SUCCESSFUL,Travel Abroad,06/09/2022 - 06/09/2022,https://www.foi.gov.ph/requests/aglzfmVmb2ktcGhyHQsSB0NvbnRlbnQiEERPSC00NjM1NjA5Nzg4MjcM
DOH,"June 09, 2022",Vax Certificate,SUCCESSFUL,Copy of their vax certificate,03/22/2022 - 06/09/2022,https://www.foi.gov.ph/requests/aglzfmVmb2ktcGhyHQsSB0NvbnRlbnQiEERPSC00MTA3MjYzMjk0MzQM
SSS,"June 09, 2022",Static information,PENDING,For Local Employment,06/09/2010 - 06/09/2022,https://www.foi.gov.ph/requests/aglzfmVmb2ktcGhyHQsSB0NvbnRlbnQiEFNTUy01MzE5MjUxOTkzNDYM
NBI,"June 09, 2022",REFUND MY PAYMENT FOR NBI CLEARANCE,PENDING,refund my payment for NBI clearance,06/09/2022 - 06/09/2022,https://www.foi.gov.ph/requests/aglzfmVmb2ktcGhyHQsSB0NvbnRlbnQiEE5CSS00MTI1MTkyNjU2MjkM
DOH,"June 09, 2022","Reported cases and seroprevalence of dengue, Zika and Japanese encephalitis virus in the Philippines",PROCESSING,Research,01/01/2015 - 06/09/2022,https://www.foi.gov.ph/requests/aglzfmVmb2ktcGhyHQsSB0NvbnRlbnQiEERPSC03NzgzNzEwMDg1MDUM
PRA,"June 09, 2022",Number of Land Reclamation Cases from 2016-2021,ACCEPTED,Research,01/01/2016 - 12/31/2021,https://www.foi.gov.ph/requests/aglzfmVmb2ktcGhyHQsSB0NvbnRlbnQiEFBSQS05NDE0MTI2MzkyNTMM
MGB,"June 09, 2022",Updated Hazard Map,PENDING,For PDPFP Updating,06/08/2022 - 06/08/2022,https://www.foi.gov.ph/requests/aglzfmVmb2ktcGhyHQsSB0NvbnRlbnQiEE1HQi0xMTgxODA5NTUzMzUM
NICA,"June 09, 2022",Extent of information exchange,PENDING,Academic Research,01/01/1989 - 12/31/2021,https://www.foi.gov.ph/requests/aglzfmVmb2ktcGhyHgsSB0NvbnRlbnQiEU5JQ0EtOTc1NDE2MjM0ODEzDA
SSS,"June 09, 2022",SSS Salary Loan not yet credited- Transaction Number: SLMW2032022060257625,PENDING,Loan,06/02/2022 - 06/09/2022,https://www.foi.gov.ph/requests/aglzfmVmb2ktcGhyHQsSB0NvbnRlbnQiEFNTUy0xMjAzOTIyMTExMjMM
SSS,"June 09, 2022",SSS Salary Loan not yet credited- Transaction Number: SLMW2032022060257625,PENDING,Loan,06/02/2022 - 06/09/2022,https://www.foi.gov.ph/requests/aglzfmVmb2ktcGhyHQsSB0NvbnRlbnQiEFNTUy0xMjM4NjI2Mzc0MDkM
FTI,"June 09, 2022",List of Food Terminal Proposals for 2022-2024,PENDING,Thesis and Research Development,12/01/2020 - 06/09/2022,https://www.foi.gov.ph/requests/aglzfmVmb2ktcGhyHQsSB0NvbnRlbnQiEEZUSS05MTk1MTcxMTEzMTEM
DOLE,"June 09, 2022",Ecc cash assistance,PARTIALLY SUCCESSFUL,follow up Ecc cash assistance,07/14/2021 - 07/28/2021,https://www.foi.gov.ph/requests/aglzfmVmb2ktcGhyHgsSB0NvbnRlbnQiEURPTEUtNzk1OTgwODQ5Njc3DA
NBI,"June 09, 2022",09068195669 Under the name of Piza Roda Fpales,PENDING,"Mahanap at maibalik niya ang pera ko kinuha niya sa gcash account nang asawa ko worth 30,000",06/09/2022 - 06/09/2022,https://www.foi.gov.ph/requests/aglzfmVmb2ktcGhyHQsSB0NvbnRlbnQiEE5CSS0zNTE0MjAxMTc1NDkM
DSWD,"June 09, 2022",FINANCIAL/MEDICAL ASSISTANCE,DENIED,Dialysis patient. For maintenance medicine.,06/09/2022 - 06/09/2022,https://www.foi.gov.ph/requests/aglzfmVmb2ktcGhyHgsSB0NvbnRlbnQiEURTV0QtMTA1NTMxMjc3Njg0DA
LMB,"June 09, 2022",Land Dispute Settlement,ACCEPTED,Land Dispute Settlement Request,06/09/2022 - 06/09/2022,https://www.foi.gov.ph/requests/aglzfmVmb2ktcGhyIQsSB0NvbnRlbnQiFERFTlJMTUItMjI3OTAzMDY5ODcyDA
PNU,"June 09, 2022",Transcript of Record,PARTIALLY SUCCESSFUL,Working abroad.,06/09/2011 - 04/15/2015,https://www.foi.gov.ph/requests/aglzfmVmb2ktcGhyHQsSB0NvbnRlbnQiEFBOVS0wNjczNjk1NDI0NTMM
DOH,"June 09, 2022",VAX CERT ERROR NEED ASAP FOR FLIGHT,SUCCESSFUL,"Need Vax Cert for Flight on June 11,2021",06/08/2022 - 06/09/2022,https://www.foi.gov.ph/requests/aglzfmVmb2ktcGhyHQsSB0NvbnRlbnQiEERPSC04MTI0ODAyODkwNjUM
BIR,"June 09, 2022",Statistics of BIR Registered Restaurants in the Philippines,DENIED,Research and development,01/01/2021 - 06/01/2022,https://www.foi.gov.ph/requests/aglzfmVmb2ktcGhyHQsSB0NvbnRlbnQiEEJJUi04MzczNzYwMDU5MDgM
PRA,"June 09, 2022","PROPOSED RECLAMATION PROJECT IN HAGONOY, BULACAN",ACCEPTED,Investigative Research,02/01/2022 - 02/28/2022,https://www.foi.gov.ph/requests/aglzfmVmb2ktcGhyHQsSB0NvbnRlbnQiEFBSQS04NTQzNzQ1ODk5NDkM
DOH,"June 09, 2022",No vaccination found for my vax cert,SUCCESSFUL,VAXCERT RECORD,06/01/2021 - 08/31/2021,https://www.foi.gov.ph/requests/aglzfmVmb2ktcGhyHQsSB0NvbnRlbnQiEERPSC0zNDM3MDIyNjMyNjQM
BJMP,"June 09, 2022",Implemented Gender and Development Programs inside the jail within ILOILO CITY,ACCEPTED,Research,01/01/2015 - 01/01/2022,https://www.foi.gov.ph/requests/aglzfmVmb2ktcGhyHgsSB0NvbnRlbnQiEUJKTVAtMjM3MzA4MTg1NjUwDA
DOH,"June 09, 2022",Total population of Batangas City; Number of BHW in Batangas City,PROCESSING,Research,06/09/2022 - 06/09/2022,https://www.foi.gov.ph/requests/aglzfmVmb2ktcGhyHQsSB0NvbnRlbnQiEERPSC0xNzY5Mjc2NTcyNzYM
PEZA,"June 09, 2022",Request for Information,PENDING,Data for Research Purposes,12/31/2020 - 06/09/2022,https://www.foi.gov.ph/requests/aglzfmVmb2ktcGhyHgsSB0NvbnRlbnQiEVBFWkEtODU4NzIzMzc2NDU5DA
LTO,"June 09, 2022",No. of registered vehicles in Metro Manila,PENDING,JICA Study,01/01/2006 - 12/31/2009,https://www.foi.gov.ph/requests/aglzfmVmb2ktcGhyHQsSB0NvbnRlbnQiEExUTy0wOTg5NTY1OTc4MTYM
UsaP,"June 09, 2022",Master List of Buildings in Pasig City,ACCEPTED,Research,06/09/2022 - 06/09/2022,https://www.foi.gov.ph/requests/aglzfmVmb2ktcGhyHgsSB0NvbnRlbnQiEVVTQVAtNTA1OTg5NjAxNzYzDA
UsaP,"June 09, 2022",Master List of Villages/Subdivisions in Pasig City,ACCEPTED,Research,06/09/2022 - 06/09/2022,https://www.foi.gov.ph/requests/aglzfmVmb2ktcGhyHgsSB0NvbnRlbnQiEVVTQVAtMTA0OTU2MzgwMTE1DA
FPA,"June 09, 2022",Volume of Fertilizers and Pesticides Consumed,AWAITING CLARIFICATION,Data Collection for the Provincial Product Accounts,01/01/2019 - 12/31/2021,https://www.foi.gov.ph/requests/aglzfmVmb2ktcGhyHQsSB0NvbnRlbnQiEEZQQS03MDUwNzI5MDAyODYM
DA,"June 09, 2022",Historical and Projected Supply and Demand of Organic Fertilizer,DENIED,for our feasibility study,06/09/2022 - 06/09/2022,https://www.foi.gov.ph/requests/aglzfmVmb2ktcGhyHAsSB0NvbnRlbnQiD0RBLTQ5ODY5ODU4MTM5Nww
ATI,"June 09, 2022",Historical and Projected Supply and Demand of Organic Fertilizer,SUCCESSFUL,for our feasibility study,06/09/2022 - 06/09/2022,https://www.foi.gov.ph/requests/aglzfmVmb2ktcGhyHQsSB0NvbnRlbnQiEEFUSS0zNTcwOTM4ODIwMzQM
BSU,"June 09, 2022",Historical and Projected Supply and Demand of Organic Fertilizer,PENDING,For our feasibility study,06/09/2022 - 06/09/2022,https://www.foi.gov.ph/requests/aglzfmVmb2ktcGhyHQsSB0NvbnRlbnQiEEJTVS02OTY5MDE0NTMxNDkM
BSU,"June 09, 2022",Organic Liquid Fertilizer from Chicken Manure,PENDING,for our feasibility study,06/09/2022 - 06/09/2022,https://www.foi.gov.ph/requests/aglzfmVmb2ktcGhyHQsSB0NvbnRlbnQiEEJTVS01MDM5MDEzODgxMDYM
LRTA,"June 09, 2022",Number of passengers in and out of Edsa station,DENIED,Research and development,01/01/2022 - 05/01/2022,https://www.foi.gov.ph/requests/aglzfmVmb2ktcGhyHgsSB0NvbnRlbnQiEUxSVEEtMjQzMzkzMDEyMTc5DA
DPWH,"June 09, 2022",PROJECT COST OF PATAG SILAY -CALATRAVA NATIONAL HIGHWAY,AWAITING CLARIFICATION,Research and Personal information,01/01/2020 - 12/31/2021,https://www.foi.gov.ph/requests/aglzfmVmb2ktcGhyHgsSB0NvbnRlbnQiEURQV0gtNDAwNTM2MDMyMjY2DA
PAGASA,"June 09, 2022",Updated Seasonal Rainfall map,AWAITING CLARIFICATION,For PDPFP Updating,06/09/2022 - 06/09/2022,https://www.foi.gov.ph/requests/aglzfmVmb2ktcGhyIAsSB0NvbnRlbnQiE1BBR0FTQS0xNzg5NzA4MTczODEM
POEA,"June 09, 2022",Result of EPS-TOPIK registration,PENDING,"Transparency of number of registrants, and fairness to others like me who wants to register.",06/08/2022 - 06/09/2022,https://www.foi.gov.ph/requests/aglzfmVmb2ktcGhyHgsSB0NvbnRlbnQiEVBPRUEtMDY2ODM3Njk2MzYxDA
CHED,"June 09, 2022",Inquiry on Pacific Intercontinental College's MAEd in English Education program,ACCEPTED,for verification,06/09/2022 - 06/09/2022,https://www.foi.gov.ph/requests/aglzfmVmb2ktcGhyHgsSB0NvbnRlbnQiEUNIRUQtMzMxNjI5MzE1MjgxDA
NAMRIA,"June 09, 2022",Updated Hazard Map,REFERRED,For PDPFP Updating,06/08/2022 - 06/08/2022,https://www.foi.gov.ph/requests/aglzfmVmb2ktcGhyJAsSB0NvbnRlbnQiF0RFTlJOQU1SSUEtMjcxNzM2MTM3MTIzDA
DOJ,"June 09, 2022",Opinion dated 05 March 2013 (LML-L-5C13),SUCCESSFUL,Research and understanding,03/05/2013 - 04/01/2013,https://www.foi.gov.ph/requests/aglzfmVmb2ktcGhyHQsSB0NvbnRlbnQiEERPSi04NDgzMzAyNTkyMDYM
DOH,"June 09, 2022",Vaccine Certificate,SUCCESSFUL,Travel,05/01/2022 - 06/09/2022,https://www.foi.gov.ph/requests/aglzfmVmb2ktcGhyHQsSB0NvbnRlbnQiEERPSC00NTI2MjAxMjkyMTgM
DOH,"June 09, 2022",Booster Shot,SUCCESSFUL,Registration of Booster Shot,01/22/2022 - 01/22/2022,https://www.foi.gov.ph/requests/aglzfmVmb2ktcGhyHQsSB0NvbnRlbnQiEERPSC02MzExOTkzMjc3MjAM
LTO,"June 09, 2022",request for license serial number,PENDING,for renewal of driver license,05/03/2022 - 05/18/2022,https://www.foi.gov.ph/requests/aglzfmVmb2ktcGhyHQsSB0NvbnRlbnQiEExUTy03NTc0MTA1NzExNTkM
DOH,"June 09, 2022",Record updating for Vaxcert OFW Seaman,SUCCESSFUL,Record updating for Vaxcert OFW Seaman,05/18/2022 - 06/09/2022,https://www.foi.gov.ph/requests/aglzfmVmb2ktcGhyHQsSB0NvbnRlbnQiEERPSC02OTkwMzk1MzE2NjIM
JJWC,"June 09, 2022",Statistics of CICL and Car in the Philippines,REFERRED,Architectural Thesis,06/09/2017 - 06/09/2022,https://www.foi.gov.ph/requests/aglzfmVmb2ktcGhyHgsSB0NvbnRlbnQiEUpKV0MtOTY0NDE1NDAyNTExDA
BIR,"June 09, 2022",Income Tax Return,PARTIALLY SUCCESSFUL,One of the bank requirements,05/01/2022 - 06/09/2022,https://www.foi.gov.ph/requests/aglzfmVmb2ktcGhyHQsSB0NvbnRlbnQiEEJJUi00NjIxNzU2ODM0MTEM
OCD,"June 09, 2022","Comprehensive Land Use Plan (CLUP) of Lipa City, Batangas",PENDING,ARCHITECTURAL THESIS,01/01/2000 - 01/01/2020,https://www.foi.gov.ph/requests/aglzfmVmb2ktcGhyHQsSB0NvbnRlbnQiEE9DRC0zMjU5OTU4MjM4MTQM
CDC,"June 09, 2022",UPDATED LIST OF LOCATORS,DENIED,LOCATORS SATURATION,06/09/2022 - 06/09/2022,https://www.foi.gov.ph/requests/aglzfmVmb2ktcGhyHQsSB0NvbnRlbnQiEENEQy0zODA4NTc0NDY3MTQM
DTI,"June 09, 2022",Size of the Creative Economy of the Philippines (per Region),REFERRED,Thesis/Dissertation,01/01/2000 - 06/09/2022,https://www.foi.gov.ph/requests/aglzfmVmb2ktcGhyHQsSB0NvbnRlbnQiEERUSS01MTI2NTA5NjczOTcM
BSWM,"June 09, 2022",Infiltration and Soil Drainage Data in Cordova,PROCESSING,For Cordova Ecological Profile,06/09/2022 - 06/09/2022,https://www.foi.gov.ph/requests/aglzfmVmb2ktcGhyHgsSB0NvbnRlbnQiEUJTV00tMDg2MDIxODA0ODY3DA
CHED,"June 09, 2022",Transcript of record and Diploma,ACCEPTED,Job application,06/01/2004 - 03/31/2006,https://www.foi.gov.ph/requests/aglzfmVmb2ktcGhyHgsSB0NvbnRlbnQiEUNIRUQtNzkzNDY2MzU5ODc4DA
NPC,"June 09, 2022",Death Threats and Harrassments,PENDING,The purpose of my report request is for them to stop harrassing and threatening me.,05/30/2022 - 06/09/2022,https://www.foi.gov.ph/requests/aglzfmVmb2ktcGhyHQsSB0NvbnRlbnQiEE5QQy0wMTE1MTYwNjQzMjYM
BFP,"June 09, 2022",Laboratories/Testing Centers for Fire Testing of Building Materials,PENDING,Research and Development,05/01/2022 - 06/09/2022,https://www.foi.gov.ph/requests/aglzfmVmb2ktcGhyHQsSB0NvbnRlbnQiEEJGUC0xOTI4NDE5NDQ1NDAM
CHED,"June 09, 2022",Transcript of Record,ACCEPTED,Requesting for Transcript of Record,03/30/2004 - 03/31/2006,https://www.foi.gov.ph/requests/aglzfmVmb2ktcGhyHgsSB0NvbnRlbnQiEUNIRUQtODk3MDA1MTY1NjQzDA
DTI,"June 09, 2022","Average Return on Assets (ROA) Ratio of each industry in the Philippines as of December 31, 2021",REFERRED,Research Study,01/01/2021 - 12/31/2021,https://www.foi.gov.ph/requests/aglzfmVmb2ktcGhyHQsSB0NvbnRlbnQiEERUSS05OTAwMTg0MTAyNzQM
DOLE,"June 09, 2022",Turnover rate of nurses in public and private hospitals in Philippines,REFERRED,Undergraduate Thesis,01/01/2020 - 06/01/2022,https://www.foi.gov.ph/requests/aglzfmVmb2ktcGhyHgsSB0NvbnRlbnQiEURPTEUtOTgzNTE5NDM1MzA1DA
PCSO,"June 09, 2022",Financial Assistance for Glaucoma Surgery Operation,SUCCESSFUL,Financial Assistance Request,06/09/2022 - 06/09/2022,https://www.foi.gov.ph/requests/aglzfmVmb2ktcGhyHgsSB0NvbnRlbnQiEVBDU08tMDgzMDg2NzYxMDEwDA
PIA,"June 09, 2022",List of Manpower Agencies in Province of Laguna,DENIED,Looking for Service provider for our growing company to provide manpower in our firm,03/27/1995 - 02/27/2020,https://www.foi.gov.ph/requests/aglzfmVmb2ktcGhyHQsSB0NvbnRlbnQiEFBJQS01NjgwODc0MDQ3OTAM
DOH,"June 09, 2022",Trastuzumab Request of Mari Jina David Andaya,SUCCESSFUL,Medicine to address my HER2NEU+ nature of my Invasive Ductal Carcinoma,06/09/2022 - 06/09/2022,https://www.foi.gov.ph/requests/aglzfmVmb2ktcGhyHQsSB0NvbnRlbnQiEERPSC0xMzQzNDExMzc4MjYM
PNP,"June 09, 2022",List of reported IHL violations committed by the CTGs in CAR,SUCCESSFUL,Documentation and monitoring,01/01/2010 - 12/31/2021,https://www.foi.gov.ph/requests/aglzfmVmb2ktcGhyHQsSB0NvbnRlbnQiEFBOUC02MjI2ODY1MTgwODcM
DPWH,"June 09, 2022","Sinkhole, Liquefaction, and Landslide in Masbate, Aug 2020",AWAITING CLARIFICATION,Research,06/09/2022 - 06/09/2022,https://www.foi.gov.ph/requests/aglzfmVmb2ktcGhyHgsSB0NvbnRlbnQiEURQV0gtMzg1NDA4NDM2MjkxDA
PNP,"June 09, 2022",Reported shooting incident in Pilar Abra,SUCCESSFUL,Documentation and monitoring,03/29/2022 - 03/29/2022,https://www.foi.gov.ph/requests/aglzfmVmb2ktcGhyHQsSB0NvbnRlbnQiEFBOUC01MTY0NDU4NjQ4OTcM
PUP,"June 09, 2022",Current Number of College Students Enrolled in Second Semester AY 2021-2022 in PUP Sta. Mesa Campus,SUCCESSFUL,Research/Thesis,03/28/2022 - 05/31/2022,https://www.foi.gov.ph/requests/aglzfmVmb2ktcGhyHQsSB0NvbnRlbnQiEFBVUC04NDAwNjEzNzQxNDgM
SSS,"June 09, 2022",SSS salary loan was approved but not yet credited to my account transaction #: SLMW2292022060333787,PENDING,SSS salary loan was approved but not yet credited to my account.,06/04/2022 - 06/09/2022,https://www.foi.gov.ph/requests/aglzfmVmb2ktcGhyHQsSB0NvbnRlbnQiEFNTUy0wNDY1NzUxMjAyMDAM
BPI,"June 09, 2022","Cost of Production for Crops, Coconut and Sugarcane for 2019-2021",DENIED,Provincial Product Accounts,01/01/2019 - 12/31/2021,https://www.foi.gov.ph/requests/aglzfmVmb2ktcGhyHQsSB0NvbnRlbnQiEEJQSS02NDc5ODE5MTU3ODkM
SSS,"June 09, 2022",SSS Verification Slip,PENDING,Employment Requirements,01/01/2016 - 05/30/2022,https://www.foi.gov.ph/requests/aglzfmVmb2ktcGhyHQsSB0NvbnRlbnQiEFNTUy0xMDczOTcxNDA0NTIM
TSU,"June 09, 2022",The number of travelers from Tarlac going to domestic tourist spots,REFERRED,Feasibility Study,01/01/2020 - 12/31/2021,https://www.foi.gov.ph/requests/aglzfmVmb2ktcGhyHQsSB0NvbnRlbnQiEFRTVS02NTAwNzA0MjM5OTAM
BIR,"June 09, 2022",Tin verification slip,DENIED,Employment Requirements,01/01/2016 - 05/30/2022,https://www.foi.gov.ph/requests/aglzfmVmb2ktcGhyHQsSB0NvbnRlbnQiEEJJUi00ODI2NzE4ODM3NzcM
PSA,"June 09, 2022",Number of restaurants per City in the Philippines,PARTIALLY SUCCESSFUL,Research and Development,01/01/2020 - 06/09/2022,https://www.foi.gov.ph/requests/aglzfmVmb2ktcGhyHQsSB0NvbnRlbnQiEFBTQS02Nzc2MzgzNTQ3ODEM
DOH,"June 09, 2022",Vaxcert incorrect middle name,SUCCESSFUL,Personal/Work,10/07/2021 - 04/20/2022,https://www.foi.gov.ph/requests/aglzfmVmb2ktcGhyHQsSB0NvbnRlbnQiEERPSC01OTMxNzY1MDIyOTcM
MWSS,"June 09, 2022",Sanitary Line Map and Storm Drainage Map of Intramuros,DENIED,For the consolidation of sanitary lines and storm drainage lines of Intramuros.,06/08/2022 - 06/09/2022,https://www.foi.gov.ph/requests/aglzfmVmb2ktcGhyHgsSB0NvbnRlbnQiEU1XU1MtMzUyNTUzNDg5NTE2DA
DPWH,"June 09, 2022",Sanitary Line Map and Storm Drainage Map of Intramuros,DENIED,For the consolidation of sanitary and storm drainage line layouts of Intramuros,06/08/2022 - 06/09/2022,https://www.foi.gov.ph/requests/aglzfmVmb2ktcGhyHgsSB0NvbnRlbnQiEURQV0gtMTI1MTAyNzY3Njk3DA
DOH,"June 09, 2022",Vaxcert incorrect middle name,SUCCESSFUL,Personal/Work,10/07/2021 - 04/20/2022,https://www.foi.gov.ph/requests/aglzfmVmb2ktcGhyHQsSB0NvbnRlbnQiEERPSC01NzMyOTI2NDI3OTMM
DOJ,"June 09, 2022",Department Order No. 640 dated 28 September 2018,SUCCESSFUL,Reference,01/01/2018 - 12/31/2018,https://www.foi.gov.ph/requests/aglzfmVmb2ktcGhyHQsSB0NvbnRlbnQiEERPSi0zMjE4NzIyMzM5MzAM
DOH,"June 09, 2022",List of Corporatized Hospitals in the Philippines,PROCESSING,Research and Development,01/01/2000 - 06/09/2022,https://www.foi.gov.ph/requests/aglzfmVmb2ktcGhyHQsSB0NvbnRlbnQiEERPSC0wOTA4Mzg1NTg1ODIM
DepEd,"June 09, 2022",Transcript of Record,REFERRED,Requesting for Transcript of Record,03/30/2004 - 03/31/2006,https://www.foi.gov.ph/requests/aglzfmVmb2ktcGhyHwsSB0NvbnRlbnQiEkRlcEVkLTUzMDA4NjkyODQyMAw
DepEd,"June 09, 2022",CERTIFICATE OF GOOD MORAL,SUCCESSFUL,WORK REQUIREMENT,06/20/2010 - 06/09/2022,https://www.foi.gov.ph/requests/aglzfmVmb2ktcGhyHwsSB0NvbnRlbnQiEkRlcEVkLTc5MDM0MjAyMTM3Nww
NBI,"June 09, 2022",Assistance on what case to file and where to file,PENDING,To refund the Money paid for Services not completed (Construction),01/01/2021 - 06/09/2022,https://www.foi.gov.ph/requests/aglzfmVmb2ktcGhyHQsSB0NvbnRlbnQiEE5CSS0wNzc5ODExMDgyMjAM
NAPOCOR,"June 09, 2022",Data for Balicasag DPP and Pamilacan DPP,PENDING,Thesis/Research Purposes,01/01/2015 - 01/01/2022,https://www.foi.gov.ph/requests/aglzfmVmb2ktcGhyIQsSB0NvbnRlbnQiFE5BUE9DT1ItODc1NjIyNTgxOTIxDA
DOF,"June 09, 2022",Payment Plan for the City of Manila's loans for infrastructure projects during Mayor Isko's Term,DENIED,Research and development,11/01/2019 - 06/09/2022,https://www.foi.gov.ph/requests/aglzfmVmb2ktcGhyHQsSB0NvbnRlbnQiEERPRi0zNjUwOTg0MjcwODcM
DepEd,"June 09, 2022",Transcript of record and Diploma,REFERRED,Job application,06/01/2004 - 03/31/2006,https://www.foi.gov.ph/requests/aglzfmVmb2ktcGhyHwsSB0NvbnRlbnQiEkRlcEVkLTM3OTEzMzM1NjMwOAw
PSA,"June 09, 2022",The economic aspect of CARAGA Region XIII,PARTIALLY SUCCESSFUL,Company's Market Research,01/01/2019 - 06/09/2022,https://www.foi.gov.ph/requests/aglzfmVmb2ktcGhyHQsSB0NvbnRlbnQiEFBTQS0yNTU4NTI4NjMxMzkM
