agency,date,title,status,purpose,period_covered,link
DOE,"September 24, 2022",Philippine Heart Equipment,REFERRED,Architectural Thesis,01/01/2015 - 01/01/2022,https://www.foi.gov.ph/requests/aglzfmVmb2ktcGhyHQsSB0NvbnRlbnQiEERPRS05NDIwNDg4MzI5NjAM
DOH,"September 24, 2022",PHILIPPPINE HEART CENTER MEDICAL EQUIPMENT,PROCESSING,Architectural Thesis,01/01/2015 - 01/01/2022,https://www.foi.gov.ph/requests/aglzfmVmb2ktcGhyHQsSB0NvbnRlbnQiEERPSC01MzE5NzYxMTA3NTkM
BIR,"September 24, 2022",TIN ID OR VERIFIED 2316,DENIED,New Employer,11/22/2012 - 09/24/2022,https://www.foi.gov.ph/requests/aglzfmVmb2ktcGhyHQsSB0NvbnRlbnQiEEJJUi04NDkwOTUxMTgyMDIM
PNAC,"September 24, 2022",Data Analytics of HIV/AIDS cases in Philippines,PENDING,Undergraduate Thesis,01/01/2015 - 01/01/2020,https://www.foi.gov.ph/requests/aglzfmVmb2ktcGhyHgsSB0NvbnRlbnQiEVBOQUMtMDM0NDI4MDE0OTY0DA
DOH,"September 24, 2022",Analysis of Tuberculosis in the Philippines,PROCESSING,Undergraduate Thesis,01/01/2015 - 01/01/2020,https://www.foi.gov.ph/requests/aglzfmVmb2ktcGhyHQsSB0NvbnRlbnQiEERPSC00MTkyODYzMjkxODcM
DepEd,"September 24, 2022",STUDENT LEARNER REFERENCE NUMBER,SUCCESSFUL,Scholarship Application,06/03/2019 - 09/24/2022,https://www.foi.gov.ph/requests/aglzfmVmb2ktcGhyHwsSB0NvbnRlbnQiEkRlcEVkLTc0ODAxODUxMTExMQw
BIR,"September 24, 2022",I want to request for my Income Tax Return Copy for this year,SUCCESSFUL,For Loan application requirements,01/01/2022 - 09/24/2022,https://www.foi.gov.ph/requests/aglzfmVmb2ktcGhyHQsSB0NvbnRlbnQiEEJJUi01OTk2NTU5MTYwNzkM
DOH,"September 24, 2022",Morbidity and Mortality of Cardiovascular Disease per City/Municipality of Bulacan,PROCESSING,Capstone design project,09/24/2022 - 09/24/2022,https://www.foi.gov.ph/requests/aglzfmVmb2ktcGhyHQsSB0NvbnRlbnQiEERPSC00MjYwNzM4MTg0MzYM
DAR,"September 24, 2022",Agricultural land that is converted in BATAAN,ACCEPTED,Research for my Thesis,09/24/2022 - 09/24/2022,https://www.foi.gov.ph/requests/aglzfmVmb2ktcGhyHQsSB0NvbnRlbnQiEERBUi05ODIxNTkyMTMwOTMM
BIR,"September 24, 2022",TIN Verification Slip,DENIED,Work Requirements,01/01/2022 - 09/23/2022,https://www.foi.gov.ph/requests/aglzfmVmb2ktcGhyHQsSB0NvbnRlbnQiEEJJUi0yMDQ1MTgxNDE4MDUM
SEC,"September 24, 2022",Serious threat and Harrassment of OLA,SUCCESSFUL,"Revocation of License and Closure of this online lending ( suncash, opeso, support, okpeso)",09/17/2022 - 09/24/2022,https://www.foi.gov.ph/requests/aglzfmVmb2ktcGhyHQsSB0NvbnRlbnQiEFNFQy03NTYzNDk3MDk3MzEM
CIC,"September 24, 2022",Credit rating,PENDING,Credit checking,01/01/2014 - 09/01/2022,https://www.foi.gov.ph/requests/aglzfmVmb2ktcGhyHQsSB0NvbnRlbnQiEENJQy04OTI0MzU5NDg0NjMM
DOH,"September 24, 2022",Depression and Anxiety statistics,PARTIALLY SUCCESSFUL,Thesis,09/24/2022 - 09/24/2022,https://www.foi.gov.ph/requests/aglzfmVmb2ktcGhyHQsSB0NvbnRlbnQiEERPSC0zNTc3Mzg0OTE4OTIM
NBI,"September 24, 2022",Serious threat and Harrassment,DENIED,"Revocation of license and Closure of this Online Lending ( Suncash, Wish Cash, Support Lending, Okpe",09/17/2022 - 09/24/2022,https://www.foi.gov.ph/requests/aglzfmVmb2ktcGhyHQsSB0NvbnRlbnQiEE5CSS0wNzc1Mjg3MDE2ODkM
DOE,"September 24, 2022",The Petroleum Product Imports in the Philippines 2010-2022,SUCCESSFUL,Research and Development,01/01/2010 - 09/24/2022,https://www.foi.gov.ph/requests/aglzfmVmb2ktcGhyHQsSB0NvbnRlbnQiEERPRS03OTc0MTcyODQwMDMM
DSWD,"September 24, 2022",Cases of Street Children in NCR,SUCCESSFUL,Undergraduate Thesis,09/23/2022 - 09/24/2022,https://www.foi.gov.ph/requests/aglzfmVmb2ktcGhyHgsSB0NvbnRlbnQiEURTV0QtMDk5Nzg4NzQ5MDEyDA
BIR,"September 24, 2022",ITR Copy,AWAITING CLARIFICATION,Requirements,01/01/2021 - 09/24/2022,https://www.foi.gov.ph/requests/aglzfmVmb2ktcGhyHQsSB0NvbnRlbnQiEEJJUi03MDQ3MjE5MDAzOTQM
DOH,"September 24, 2022",SPECIALTY HOSPITAL FLOORPLANS,PROCESSING,RESEARCH DEVELOPMENT,09/24/2022 - 09/24/2022,https://www.foi.gov.ph/requests/aglzfmVmb2ktcGhyHQsSB0NvbnRlbnQiEERPSC01ODk1MDU3MTA5MzEM
DOH,"September 24, 2022",Mortality and Patients of Common Disease 2017-2022,PARTIALLY SUCCESSFUL,Thesis,01/20/2017 - 09/24/2022,https://www.foi.gov.ph/requests/aglzfmVmb2ktcGhyHQsSB0NvbnRlbnQiEERPSC02ODc0NTU2MjQxNDIM
PSA,"September 24, 2022",List of Homeless Shelters in the Philippines,PENDING,Undergraduate Thesis,09/24/2015 - 09/24/2022,https://www.foi.gov.ph/requests/aglzfmVmb2ktcGhyHQsSB0NvbnRlbnQiEFBTQS02MzQ1NjUyOTk3NTkM
PRC,"September 24, 2022",Number of registered foresters by municipality and province in the Philippines,ACCEPTED,To conduct an assessment of the contribution of foresters to the economy.,09/24/2022 - 09/24/2022,https://www.foi.gov.ph/requests/aglzfmVmb2ktcGhyHQsSB0NvbnRlbnQiEFBSQy04MzQxNzU5NzgwMDYM
MGB,"September 24, 2022",Albay Landslide points and shapefile,ACCEPTED,Thesis,01/01/2000 - 12/31/2021,https://www.foi.gov.ph/requests/aglzfmVmb2ktcGhyHQsSB0NvbnRlbnQiEE1HQi0wNDgwNjEyNTg4NjUM
NatMu,"September 24, 2022",Site Criteria for Museum in the Philippines,SUCCESSFUL,Architectural Thesis,09/24/2017 - 09/24/2022,https://www.foi.gov.ph/requests/aglzfmVmb2ktcGhyHwsSB0NvbnRlbnQiEk5hdE11LTY0MDgyMjcyNDIxMgw
DOH,"September 24, 2022",ZCMC Documents,SUCCESSFUL,USAID Reach Health Quarterly Data Collection,09/24/2022 - 09/24/2022,https://www.foi.gov.ph/requests/aglzfmVmb2ktcGhyHQsSB0NvbnRlbnQiEERPSC0xNDU2NDY0OTQ0NDgM
SRA,"September 24, 2022",Space Requirement for Agricultural Research Center,ACCEPTED,Thesis and Research,09/24/2015 - 09/24/2022,https://www.foi.gov.ph/requests/aglzfmVmb2ktcGhyHQsSB0NvbnRlbnQiEFNSQS01NDA4MDgxODMzNjgM
BSWM,"September 24, 2022",Soil Types of Zamboanga City,SUCCESSFUL,Research,01/01/2015 - 09/24/2022,https://www.foi.gov.ph/requests/aglzfmVmb2ktcGhyHgsSB0NvbnRlbnQiEUJTV00tNjExNzg0MTU1OTYxDA
BSWM,"September 24, 2022",Soil Types of Zamboanga City,SUCCESSFUL,Research,01/01/2015 - 09/24/2022,https://www.foi.gov.ph/requests/aglzfmVmb2ktcGhyHgsSB0NvbnRlbnQiEUJTV00tNTM4NDE2Mjg4NjkzDA
LRA,"September 24, 2022",EPEB number,PENDING,Verification of ownership or land title im planning to buy,12/01/1989 - 01/13/1990,https://www.foi.gov.ph/requests/aglzfmVmb2ktcGhyHQsSB0NvbnRlbnQiEExSQS0wNjUzMjI0MzE4NjUM
PSA,"September 24, 2022",Children Data in Calabarzon,PENDING,Academic Research,09/24/2010 - 09/24/2022,https://www.foi.gov.ph/requests/aglzfmVmb2ktcGhyHQsSB0NvbnRlbnQiEFBTQS03NzA2ODI4NDQ2OTQM
SSS,"September 24, 2022",My SSS user Id and password,PENDING,To reset my USer ID and password in my SSS online registration,09/24/2022 - 09/24/2022,https://www.foi.gov.ph/requests/aglzfmVmb2ktcGhyHQsSB0NvbnRlbnQiEFNTUy0xMTE3MDEwODY0NjMM
DOH,"September 24, 2022",Space Requirements for a Heart Specialty Hospital,SUCCESSFUL,Architectural Thesis,01/01/2022 - 08/01/2022,https://www.foi.gov.ph/requests/aglzfmVmb2ktcGhyHQsSB0NvbnRlbnQiEERPSC0yOTgxNTM4MzczNTIM
NBI,"September 24, 2022","Immediate action on the cp numbers who give harrasment, threat and text scam to me and my contacts",DENIED,"To stop sending harrasment, text scam, and threats on my cp number and my contacts.",08/05/2022 - 09/24/2022,https://www.foi.gov.ph/requests/aglzfmVmb2ktcGhyHQsSB0NvbnRlbnQiEE5CSS00NzY1ODAyMDU3NjIM
DOH,"September 24, 2022",Statistics of Sports-Injury Related Cases per Province/Region,PARTIALLY SUCCESSFUL,Architectural Thesis,01/01/2020 - 09/24/2022,https://www.foi.gov.ph/requests/aglzfmVmb2ktcGhyHQsSB0NvbnRlbnQiEERPSC0yOTM5MTMyOTIzOTYM
LMB,"September 24, 2022",CLUP for Cebu City,ACCEPTED,Undergraduate Thesis Study,01/01/2020 - 09/24/2022,https://www.foi.gov.ph/requests/aglzfmVmb2ktcGhyIQsSB0NvbnRlbnQiFERFTlJMTUItNDE0OTUzNDM2ODkzDA
CGA,"September 24, 2022",Rainfall-induced landslide hazard map in Antipolo,PENDING,Thesis Purposes,01/01/2020 - 09/24/2022,https://www.foi.gov.ph/requests/aglzfmVmb2ktcGhyHQsSB0NvbnRlbnQiEENHQS0wNjc2NjU0MzU1NDkM
DENR,"September 24, 2022",Rainfall-induced landslide hazard map in Antipolo,REFERRED,Thesis Purposes,01/01/2020 - 09/24/2022,https://www.foi.gov.ph/requests/aglzfmVmb2ktcGhyHgsSB0NvbnRlbnQiEURFTlItMDg2ODU0MzIyNjMxDA
NPC,"September 24, 2022",Data Privacy Invasion of Pesoq,PENDING,Report to investigate PesoQ Online Lending App,09/24/2022 - 09/24/2022,https://www.foi.gov.ph/requests/aglzfmVmb2ktcGhyHQsSB0NvbnRlbnQiEE5QQy05MjYxMTI2Mzk1NDkM
PNP,"September 24, 2022",REFUND MY NBI/POLICE CLEARANCE,SUCCESSFUL,REFUND GCASH PAYMENT,09/24/2022 - 09/24/2022,https://www.foi.gov.ph/requests/aglzfmVmb2ktcGhyHQsSB0NvbnRlbnQiEFBOUC03OTkxNjc5MTU4MjEM
LMB,"September 24, 2022","BLLM No. 3 Pls-922, Mapandan",ACCEPTED,Real estate verification,06/10/1990 - 06/10/2022,https://www.foi.gov.ph/requests/aglzfmVmb2ktcGhyIQsSB0NvbnRlbnQiFERFTlJMTUItMTU3ODkxNjU3MDI1DA
DOT,"September 24, 2022",Visitors Profile in Marinduque,DENIED,research,08/01/2022 - 09/24/2022,https://www.foi.gov.ph/requests/aglzfmVmb2ktcGhyHQsSB0NvbnRlbnQiEERPVC0yMTgwNzgxMjA4MTgM
DOT,"September 24, 2022",Visitors's profile,AWAITING CLARIFICATION,Research and destination plan,05/01/2022 - 08/01/2022,https://www.foi.gov.ph/requests/aglzfmVmb2ktcGhyHQsSB0NvbnRlbnQiEERPVC05NTc0Nzk1MTE5MTQM
DTI,"September 24, 2022",Number of Registered refilling stations in Region IX,DENIED,For Feasibility Study,01/01/2021 - 09/01/2022,https://www.foi.gov.ph/requests/aglzfmVmb2ktcGhyHQsSB0NvbnRlbnQiEERUSS01NDk2NTQ3MDk0NzMM
DOH,"September 24, 2022",Vaxcert Missing Dose,SUCCESSFUL,Travel local and abroad,07/05/2021 - 07/27/2022,https://www.foi.gov.ph/requests/aglzfmVmb2ktcGhyHQsSB0NvbnRlbnQiEERPSC0xNDc5ODg1NTQwMjcM
BUKSU,"September 24, 2022",NSTP Serial Number,PENDING,Graduation Requirement,06/05/2012 - 05/23/2013,https://www.foi.gov.ph/requests/aglzfmVmb2ktcGhyHwsSB0NvbnRlbnQiEkJVS1NVLTIxOTg3OTI2OTUxNAw
DOTr,"September 24, 2022",Number of Traffic Violations commited in the Philippines,REFERRED,Educational purposes and Research for Data Analytics Subject.,01/01/2018 - 01/01/2022,https://www.foi.gov.ph/requests/aglzfmVmb2ktcGhyHgsSB0NvbnRlbnQiEURPVHItMzM3Nzc3MTQxNTE0DA
DOH,"September 24, 2022",Request to change surname in vaccine certificate,SUCCESSFUL,Travel Purpose,09/24/2022 - 09/24/2022,https://www.foi.gov.ph/requests/aglzfmVmb2ktcGhyHQsSB0NvbnRlbnQiEERPSC0yNDI3NDU0ODY2MDgM
DOH,"September 24, 2022",number of Independent Pharmacists in Rizal Province,SUCCESSFUL,Research and Development,01/01/2021 - 09/01/2022,https://www.foi.gov.ph/requests/aglzfmVmb2ktcGhyHQsSB0NvbnRlbnQiEERPSC03MDA3NTk2MjI0MjYM
DepEd,"September 24, 2022",TRANSCRIPT OF RECORD AND DIPLOMA,SUCCESSFUL,MAKATI HIGHSCHOOL PIO DELPILAR ANNEX,04/01/2000 - 05/31/2000,https://www.foi.gov.ph/requests/aglzfmVmb2ktcGhyHwsSB0NvbnRlbnQiEkRlcEVkLTA5Mzc4MzgzMTc4NAw
DOH,"September 24, 2022",The number of reported rabies cases in the Philippines by region,SUCCESSFUL,Undergraduate Thesis,01/01/2010 - 12/30/2020,https://www.foi.gov.ph/requests/aglzfmVmb2ktcGhyHQsSB0NvbnRlbnQiEERPSC03MDYyMzI4NjQ5OTUM
DPWH,"September 24, 2022","BRS-DPWH Daily Water Level and Discharge Data of Pinacanauan River, Isabela",AWAITING CLARIFICATION,Feasibility Studies,01/01/2000 - 12/31/2020,https://www.foi.gov.ph/requests/aglzfmVmb2ktcGhyHgsSB0NvbnRlbnQiEURQV0gtNzczMjUxNDEyMjQ1DA
NORSU,"September 24, 2022",The number of depression cases in the Philippines,PENDING,Research,09/24/2016 - 09/24/2022,https://www.foi.gov.ph/requests/aglzfmVmb2ktcGhyHwsSB0NvbnRlbnQiEk5PUlNVLTU3MDUyNzI0NzkyMQw
PSA,"September 24, 2022",The number of elderly people catered by home for the aged,PENDING,research in regards to a combined space for the elderly and young orphans,09/24/2022 - 09/24/2022,https://www.foi.gov.ph/requests/aglzfmVmb2ktcGhyHQsSB0NvbnRlbnQiEFBTQS03OTEwNTQ4NTI4MjMM
PDEA,"September 24, 2022",Statistics of Drug Cases,SUCCESSFUL,Thesis,09/24/2022 - 09/24/2022,https://www.foi.gov.ph/requests/aglzfmVmb2ktcGhyHgsSB0NvbnRlbnQiEVBERUEtNjgyNzI5MzE0NDU4DA
DDB,"September 24, 2022",Statistics of Drug Cases,SUCCESSFUL,Thesis,09/24/2022 - 09/24/2022,https://www.foi.gov.ph/requests/aglzfmVmb2ktcGhyHQsSB0NvbnRlbnQiEEREQi03NzM3NjUwNzczNzUM
DOH,"September 24, 2022",Statistics of Drug Cases,PROCESSING,Thesis,09/24/2022 - 09/24/2022,https://www.foi.gov.ph/requests/aglzfmVmb2ktcGhyHQsSB0NvbnRlbnQiEERPSC00MDA2OTIzNDIzNTcM
LMB,"September 24, 2022",Agricultural land that is converted in BATAAN,ACCEPTED,Research for my Thesis,09/24/2022 - 09/24/2022,https://www.foi.gov.ph/requests/aglzfmVmb2ktcGhyIQsSB0NvbnRlbnQiFERFTlJMTUItMDM4NzY2Njg0MDQ4DA
PSA,"September 24, 2022",The number of abandoned Children in Cebu,PENDING,Research proposal for a combined space for the elderly and young orphans,09/24/2022 - 09/24/2022,https://www.foi.gov.ph/requests/aglzfmVmb2ktcGhyHQsSB0NvbnRlbnQiEFBTQS0zODg2MTcxMjA2NTQM
NHA,"September 24, 2022",The List of Existing Socialized Housing,SUCCESSFUL,Case Study,09/24/2022 - 09/24/2022,https://www.foi.gov.ph/requests/aglzfmVmb2ktcGhyHQsSB0NvbnRlbnQiEE5IQS03MzQ0MTA0MDE5NTcM
DSWD,"September 24, 2022",Child Abuses Cases,AWAITING CLARIFICATION,Thesis,09/24/2022 - 09/24/2022,https://www.foi.gov.ph/requests/aglzfmVmb2ktcGhyHgsSB0NvbnRlbnQiEURTV0QtNzM4MzA3NzUwMjUwDA
PNAC,"September 24, 2022",Analysis of HIV/AIDS cases in the Philippines by region,PENDING,Undergraduate Thesis,01/01/2015 - 01/01/2020,https://www.foi.gov.ph/requests/aglzfmVmb2ktcGhyHgsSB0NvbnRlbnQiEVBOQUMtMTM0ODU4OTYwNTMxDA
PSA,"September 24, 2022",Number of Establishments in Los Banos Laguna,PENDING,Undergraduate Thesis,09/24/2012 - 09/24/2022,https://www.foi.gov.ph/requests/aglzfmVmb2ktcGhyHQsSB0NvbnRlbnQiEFBTQS0yODk5NjkxNDc1NTQM
DA,"September 24, 2022",Requesting a carabao for farming,SUCCESSFUL,Para po sa pagsasaka,09/10/2022 - 09/24/2022,https://www.foi.gov.ph/requests/aglzfmVmb2ktcGhyHAsSB0NvbnRlbnQiD0RBLTY1NzI4NTE4MTI3Mgw
DPWH,"September 24, 2022","Existing Data of the Drainage System of Labangan National Road in San Jose, Occidental Mindoro",AWAITING CLARIFICATION,Research Paper,01/01/2013 - 12/31/2021,https://www.foi.gov.ph/requests/aglzfmVmb2ktcGhyHgsSB0NvbnRlbnQiEURQV0gtOTU4Nzc5NjY3Njc3DA
DDB,"September 24, 2022",Statistics/ Rate and Population,SUCCESSFUL,Architectural Research Thesis,09/24/2022 - 09/24/2022,https://www.foi.gov.ph/requests/aglzfmVmb2ktcGhyHQsSB0NvbnRlbnQiEEREQi04ODk0ODQwOTIxNDMM
PDEA,"September 24, 2022",Percentage/population of substance abuse,SUCCESSFUL,Research purposes,09/24/2022 - 09/24/2022,https://www.foi.gov.ph/requests/aglzfmVmb2ktcGhyHgsSB0NvbnRlbnQiEVBERUEtMzEzODA2NjE3MDU1DA
CHED,"September 24, 2022",The number of student graduates in the Province of Sorsogon with Degree in B.S. Biology and Nursing,DENIED,Architectural Thesis data,09/23/2022 - 09/23/2022,https://www.foi.gov.ph/requests/aglzfmVmb2ktcGhyHgsSB0NvbnRlbnQiEUNIRUQtNjQwNTUzNDY4MzgwDA
NNC,"September 24, 2022",Analysis of Malnutrition in the Philippines,SUCCESSFUL,Undergraduate Thesis,01/01/2015 - 01/01/2020,https://www.foi.gov.ph/requests/aglzfmVmb2ktcGhyHQsSB0NvbnRlbnQiEE5OQy0yNDc4MDEwNzMwMDgM
DepEd,"September 24, 2022",ALS DIPLOMA,SUCCESSFUL,For my application abroad,06/02/2003 - 04/16/2004,https://www.foi.gov.ph/requests/aglzfmVmb2ktcGhyHwsSB0NvbnRlbnQiEkRlcEVkLTY3MDQzMDkzMDQ1NAw
DOH,"September 24, 2022",Wrong lot/batch number in vaxcert,SUCCESSFUL,Vaxcert wrong lot/batch number,09/24/2022 - 09/24/2022,https://www.foi.gov.ph/requests/aglzfmVmb2ktcGhyHQsSB0NvbnRlbnQiEERPSC05NTU5ODY3NTI2MDMM
DSWD,"September 24, 2022",Educational Assistance for kids of Solo Parent,DENIED,To be a beneficiary of educational assistance,09/24/2022 - 09/24/2022,https://www.foi.gov.ph/requests/aglzfmVmb2ktcGhyHgsSB0NvbnRlbnQiEURTV0QtNTM0ODc4MTczNDIzDA
NTC,"September 24, 2022",Complaint against Smart Communications,DENIED,Harassment from Smart Communications Legal Team,06/01/2022 - 09/24/2022,https://www.foi.gov.ph/requests/aglzfmVmb2ktcGhyHQsSB0NvbnRlbnQiEE5UQy03NTY2MTc5Nzc4MDQM
PNP,"September 24, 2022",Percentage/population of substance abuse,ACCEPTED,Research purposes,09/24/2022 - 09/24/2022,https://www.foi.gov.ph/requests/aglzfmVmb2ktcGhyHQsSB0NvbnRlbnQiEFBOUC04NTIxOTkzODM3MDgM
DOH,"September 24, 2022",Percentage/population of substance abuse,REFERRED,Research purposes,09/24/2022 - 09/24/2022,https://www.foi.gov.ph/requests/aglzfmVmb2ktcGhyHQsSB0NvbnRlbnQiEERPSC03MDk0NzgzNjQ5NjQM
PSA,"September 24, 2022",Number of senior citizen residents in Quezon City,PENDING,Research (Masters degree level),09/23/2022 - 09/24/2022,https://www.foi.gov.ph/requests/aglzfmVmb2ktcGhyHQsSB0NvbnRlbnQiEFBTQS0wNDMyMTc1MTU5ODAM
PAGASA,"September 24, 2022","Monthly Rainfall Data for CY 2020, 2021, and 2022 in Bislig City, Surigao del Sur",AWAITING CLARIFICATION,Plantation Operation Plan,01/01/2020 - 09/24/2022,https://www.foi.gov.ph/requests/aglzfmVmb2ktcGhyIAsSB0NvbnRlbnQiE1BBR0FTQS05NzgyMTkyNTk0MTQM
PSA,"September 24, 2022",Number of residents and senior citizen residents per barangay in District IV Quezon Citt,PENDING,Doing a masters degree thesis involving this data,09/23/2022 - 09/24/2022,https://www.foi.gov.ph/requests/aglzfmVmb2ktcGhyHQsSB0NvbnRlbnQiEFBTQS0yMzYxNzgzNjY1MjUM
BFAR,"September 24, 2022",Fishpond Lease Agreement Map of Bislig City,ACCEPTED,Research,01/01/2000 - 09/24/2022,https://www.foi.gov.ph/requests/aglzfmVmb2ktcGhyHgsSB0NvbnRlbnQiEUJGQVItNzI4MDA3NzI1Njg4DA
PRC,"September 24, 2022",PRC Renewal,ACCEPTED,Renewal of PRC license,09/24/2022 - 09/24/2022,https://www.foi.gov.ph/requests/aglzfmVmb2ktcGhyHQsSB0NvbnRlbnQiEFBSQy04ODQ0OTkwMzAyMzMM
DOT,"September 24, 2022",Demographic Data of Bataan Province,DENIED,Research for my Thesis,09/24/2022 - 09/24/2022,https://www.foi.gov.ph/requests/aglzfmVmb2ktcGhyHQsSB0NvbnRlbnQiEERPVC0zMTY3NzgxNjc0MjIM
PSA,"September 24, 2022",Population of Balanga Bataan,PENDING,Research for my Thesis,09/24/2022 - 09/24/2022,https://www.foi.gov.ph/requests/aglzfmVmb2ktcGhyHQsSB0NvbnRlbnQiEFBTQS01NzI1MjM5ODgyNDYM
DOH,"September 24, 2022",NO VACCINATION RECORD,SUCCESSFUL,Travel,03/23/2022 - 03/23/2022,https://www.foi.gov.ph/requests/aglzfmVmb2ktcGhyHQsSB0NvbnRlbnQiEERPSC04NzUwNzYxNDY2MDgM
DSWD,"September 24, 2022",The Number of abandoned Elderlies in home for the aged in Cebu,PROCESSING,Thesis project,01/01/2010 - 09/24/2022,https://www.foi.gov.ph/requests/aglzfmVmb2ktcGhyHgsSB0NvbnRlbnQiEURTV0QtMDM2NDg4NzQ1ODc2DA
PSA,"September 24, 2022",Research for my Thesis proposal,PENDING,Research for my Thesis Proposal,09/24/2022 - 09/24/2022,https://www.foi.gov.ph/requests/aglzfmVmb2ktcGhyHQsSB0NvbnRlbnQiEFBTQS04MTAxOTkxNTc5NDYM
SSS,"September 24, 2022",delayed sss salary loan disbursement,PENDING,follow up,09/16/2022 - 09/24/2022,https://www.foi.gov.ph/requests/aglzfmVmb2ktcGhyHQsSB0NvbnRlbnQiEFNTUy04NDMyMTAyOTg4MjYM
DOE,"September 24, 2022",global oil and supply and oil and gas import performance in barrel,ACCEPTED,thesis purposes,01/01/1991 - 12/31/2021,https://www.foi.gov.ph/requests/aglzfmVmb2ktcGhyHQsSB0NvbnRlbnQiEERPRS00NTY2NDEzODUwNjMM
PSA,"September 24, 2022",Total Population of Manila citizens aged 18 years and above,PENDING,Research and Development,01/01/2022 - 09/24/2022,https://www.foi.gov.ph/requests/aglzfmVmb2ktcGhyHQsSB0NvbnRlbnQiEFBTQS03MjMwMTk2NTUxMDUM
DSWD,"September 24, 2022",The number of elderlies abandoned by the families in home for the aged in Cebu,DENIED,Thesis project,01/01/2020 - 09/24/2022,https://www.foi.gov.ph/requests/aglzfmVmb2ktcGhyHgsSB0NvbnRlbnQiEURTV0QtOTkxODUwMjIyNTU2DA
NEA,"September 24, 2022",Effective rates kpwh in SOCOTECO 1,SUCCESSFUL,Research and development,06/01/2022 - 09/24/2022,https://www.foi.gov.ph/requests/aglzfmVmb2ktcGhyHQsSB0NvbnRlbnQiEE5FQS05MDMxMTExNzgwMTIM
BIR,"September 24, 2022",ITR Copy Request,SUCCESSFUL,For Loan purposes,09/23/2022 - 09/23/2022,https://www.foi.gov.ph/requests/aglzfmVmb2ktcGhyHQsSB0NvbnRlbnQiEEJJUi0xMTY0NzMwOTA1NjQM
DOT,"September 24, 2022",Agritourism framework / strategic plan,SUCCESSFUL,Research and thesis writing,01/01/2020 - 01/01/2022,https://www.foi.gov.ph/requests/aglzfmVmb2ktcGhyHQsSB0NvbnRlbnQiEERPVC01MTI3NDE2MTcxMDMM
DOT,"September 24, 2022",Visitors's profile,AWAITING CLARIFICATION,Research and destination plan,05/01/2022 - 08/01/2022,https://www.foi.gov.ph/requests/aglzfmVmb2ktcGhyHQsSB0NvbnRlbnQiEERPVC05NTc0Nzk1MTE5MTQM
DTI,"September 24, 2022",Number of Registered refilling stations in Region IX,DENIED,For Feasibility Study,01/01/2021 - 09/01/2022,https://www.foi.gov.ph/requests/aglzfmVmb2ktcGhyHQsSB0NvbnRlbnQiEERUSS01NDk2NTQ3MDk0NzMM
DOH,"September 24, 2022",Vaxcert Missing Dose,SUCCESSFUL,Travel local and abroad,07/05/2021 - 07/27/2022,https://www.foi.gov.ph/requests/aglzfmVmb2ktcGhyHQsSB0NvbnRlbnQiEERPSC0xNDc5ODg1NTQwMjcM
BUKSU,"September 24, 2022",NSTP Serial Number,PENDING,Graduation Requirement,06/05/2012 - 05/23/2013,https://www.foi.gov.ph/requests/aglzfmVmb2ktcGhyHwsSB0NvbnRlbnQiEkJVS1NVLTIxOTg3OTI2OTUxNAw
DOTr,"September 24, 2022",Number of Traffic Violations commited in the Philippines,REFERRED,Educational purposes and Research for Data Analytics Subject.,01/01/2018 - 01/01/2022,https://www.foi.gov.ph/requests/aglzfmVmb2ktcGhyHgsSB0NvbnRlbnQiEURPVHItMzM3Nzc3MTQxNTE0DA
DOH,"September 24, 2022",Request to change surname in vaccine certificate,SUCCESSFUL,Travel Purpose,09/24/2022 - 09/24/2022,https://www.foi.gov.ph/requests/aglzfmVmb2ktcGhyHQsSB0NvbnRlbnQiEERPSC0yNDI3NDU0ODY2MDgM
DOH,"September 24, 2022",number of Independent Pharmacists in Rizal Province,SUCCESSFUL,Research and Development,01/01/2021 - 09/01/2022,https://www.foi.gov.ph/requests/aglzfmVmb2ktcGhyHQsSB0NvbnRlbnQiEERPSC03MDA3NTk2MjI0MjYM
DepEd,"September 24, 2022",TRANSCRIPT OF RECORD AND DIPLOMA,SUCCESSFUL,MAKATI HIGHSCHOOL PIO DELPILAR ANNEX,04/01/2000 - 05/31/2000,https://www.foi.gov.ph/requests/aglzfmVmb2ktcGhyHwsSB0NvbnRlbnQiEkRlcEVkLTA5Mzc4MzgzMTc4NAw
DOH,"September 24, 2022",The number of reported rabies cases in the Philippines by region,SUCCESSFUL,Undergraduate Thesis,01/01/2010 - 12/30/2020,https://www.foi.gov.ph/requests/aglzfmVmb2ktcGhyHQsSB0NvbnRlbnQiEERPSC03MDYyMzI4NjQ5OTUM
DPWH,"September 24, 2022","BRS-DPWH Daily Water Level and Discharge Data of Pinacanauan River, Isabela",AWAITING CLARIFICATION,Feasibility Studies,01/01/2000 - 12/31/2020,https://www.foi.gov.ph/requests/aglzfmVmb2ktcGhyHgsSB0NvbnRlbnQiEURQV0gtNzczMjUxNDEyMjQ1DA
NORSU,"September 24, 2022",The number of depression cases in the Philippines,PENDING,Research,09/24/2016 - 09/24/2022,https://www.foi.gov.ph/requests/aglzfmVmb2ktcGhyHwsSB0NvbnRlbnQiEk5PUlNVLTU3MDUyNzI0NzkyMQw
PSA,"September 24, 2022",The number of elderly people catered by home for the aged,PENDING,research in regards to a combined space for the elderly and young orphans,09/24/2022 - 09/24/2022,https://www.foi.gov.ph/requests/aglzfmVmb2ktcGhyHQsSB0NvbnRlbnQiEFBTQS03OTEwNTQ4NTI4MjMM
PDEA,"September 24, 2022",Statistics of Drug Cases,SUCCESSFUL,Thesis,09/24/2022 - 09/24/2022,https://www.foi.gov.ph/requests/aglzfmVmb2ktcGhyHgsSB0NvbnRlbnQiEVBERUEtNjgyNzI5MzE0NDU4DA
DDB,"September 24, 2022",Statistics of Drug Cases,SUCCESSFUL,Thesis,09/24/2022 - 09/24/2022,https://www.foi.gov.ph/requests/aglzfmVmb2ktcGhyHQsSB0NvbnRlbnQiEEREQi03NzM3NjUwNzczNzUM
DOH,"September 24, 2022",Statistics of Drug Cases,PROCESSING,Thesis,09/24/2022 - 09/24/2022,https://www.foi.gov.ph/requests/aglzfmVmb2ktcGhyHQsSB0NvbnRlbnQiEERPSC00MDA2OTIzNDIzNTcM
LMB,"September 24, 2022",Agricultural land that is converted in BATAAN,ACCEPTED,Research for my Thesis,09/24/2022 - 09/24/2022,https://www.foi.gov.ph/requests/aglzfmVmb2ktcGhyIQsSB0NvbnRlbnQiFERFTlJMTUItMDM4NzY2Njg0MDQ4DA
PSA,"September 24, 2022",The number of abandoned Children in Cebu,PENDING,Research proposal for a combined space for the elderly and young orphans,09/24/2022 - 09/24/2022,https://www.foi.gov.ph/requests/aglzfmVmb2ktcGhyHQsSB0NvbnRlbnQiEFBTQS0zODg2MTcxMjA2NTQM
NHA,"September 24, 2022",The List of Existing Socialized Housing,SUCCESSFUL,Case Study,09/24/2022 - 09/24/2022,https://www.foi.gov.ph/requests/aglzfmVmb2ktcGhyHQsSB0NvbnRlbnQiEE5IQS03MzQ0MTA0MDE5NTcM
DSWD,"September 24, 2022",Child Abuses Cases,AWAITING CLARIFICATION,Thesis,09/24/2022 - 09/24/2022,https://www.foi.gov.ph/requests/aglzfmVmb2ktcGhyHgsSB0NvbnRlbnQiEURTV0QtNzM4MzA3NzUwMjUwDA
PNAC,"September 24, 2022",Analysis of HIV/AIDS cases in the Philippines by region,PENDING,Undergraduate Thesis,01/01/2015 - 01/01/2020,https://www.foi.gov.ph/requests/aglzfmVmb2ktcGhyHgsSB0NvbnRlbnQiEVBOQUMtMTM0ODU4OTYwNTMxDA
PSA,"September 24, 2022",Number of Establishments in Los Banos Laguna,PENDING,Undergraduate Thesis,09/24/2012 - 09/24/2022,https://www.foi.gov.ph/requests/aglzfmVmb2ktcGhyHQsSB0NvbnRlbnQiEFBTQS0yODk5NjkxNDc1NTQM
DA,"September 24, 2022",Requesting a carabao for farming,SUCCESSFUL,Para po sa pagsasaka,09/10/2022 - 09/24/2022,https://www.foi.gov.ph/requests/aglzfmVmb2ktcGhyHAsSB0NvbnRlbnQiD0RBLTY1NzI4NTE4MTI3Mgw
DPWH,"September 24, 2022","Existing Data of the Drainage System of Labangan National Road in San Jose, Occidental Mindoro",AWAITING CLARIFICATION,Research Paper,01/01/2013 - 12/31/2021,https://www.foi.gov.ph/requests/aglzfmVmb2ktcGhyHgsSB0NvbnRlbnQiEURQV0gtOTU4Nzc5NjY3Njc3DA
DDB,"September 24, 2022",Statistics/ Rate and Population,SUCCESSFUL,Architectural Research Thesis,09/24/2022 - 09/24/2022,https://www.foi.gov.ph/requests/aglzfmVmb2ktcGhyHQsSB0NvbnRlbnQiEEREQi04ODk0ODQwOTIxNDMM
PDEA,"September 24, 2022",Percentage/population of substance abuse,SUCCESSFUL,Research purposes,09/24/2022 - 09/24/2022,https://www.foi.gov.ph/requests/aglzfmVmb2ktcGhyHgsSB0NvbnRlbnQiEVBERUEtMzEzODA2NjE3MDU1DA
CHED,"September 24, 2022",The number of student graduates in the Province of Sorsogon with Degree in B.S. Biology and Nursing,DENIED,Architectural Thesis data,09/23/2022 - 09/23/2022,https://www.foi.gov.ph/requests/aglzfmVmb2ktcGhyHgsSB0NvbnRlbnQiEUNIRUQtNjQwNTUzNDY4MzgwDA
NNC,"September 24, 2022",Analysis of Malnutrition in the Philippines,SUCCESSFUL,Undergraduate Thesis,01/01/2015 - 01/01/2020,https://www.foi.gov.ph/requests/aglzfmVmb2ktcGhyHQsSB0NvbnRlbnQiEE5OQy0yNDc4MDEwNzMwMDgM
DepEd,"September 24, 2022",ALS DIPLOMA,SUCCESSFUL,For my application abroad,06/02/2003 - 04/16/2004,https://www.foi.gov.ph/requests/aglzfmVmb2ktcGhyHwsSB0NvbnRlbnQiEkRlcEVkLTY3MDQzMDkzMDQ1NAw
