agency,date,title,status,purpose,period_covered,link
LTO,"May 14, 2023",Non pro driving license,PENDING,taiwan driving license,05/14/2023 - 05/14/2023,https://www.foi.gov.ph/requests/aglzfmVmb2ktcGhyHQsSB0NvbnRlbnQiEExUTy01ODkzMTgxMDgxMjQM
NCCA,"May 14, 2023",Cultural Center,PENDING,Research and development of cultural centers,05/14/2023 - 05/14/2023,https://www.foi.gov.ph/requests/aglzfmVmb2ktcGhyHgsSB0NvbnRlbnQiEU5DQ0EtNzA2MDY2NTk0MDgzDA
LTO,"May 14, 2023",The Number of Licensed Drivers in Manila City,SUCCESSFUL,Research and Development,01/01/2021 - 05/14/2023,https://www.foi.gov.ph/requests/aglzfmVmb2ktcGhyHQsSB0NvbnRlbnQiEExUTy0wNTkyNDUyMTM2MjQM
PCG,"May 14, 2023",Marine Accident Inquiry Report,PENDING,Research,01/31/2017 - 02/28/2017,https://www.foi.gov.ph/requests/aglzfmVmb2ktcGhyHQsSB0NvbnRlbnQiEFBDRy0wMDUzODQwNTY1MjAM
NHA,"May 14, 2023",Pambansang Pabahay Pilipino Program,SUCCESSFUL,Para po magkaroon na kami ng sariling bahay,04/13/2023 - 05/12/2023,https://www.foi.gov.ph/requests/aglzfmVmb2ktcGhyHQsSB0NvbnRlbnQiEE5IQS0zNzIwNDYwMDk4NTAM
CHED,"May 14, 2023",The number of College Students in the Philippines,ACCEPTED,Research purpose for my Entrepreneurship Subject.,05/14/2023 - 05/14/2023,https://www.foi.gov.ph/requests/aglzfmVmb2ktcGhyHgsSB0NvbnRlbnQiEUNIRUQtNjY5NjA2MDQ0MTg1DA
PHIVOLCS,"May 14, 2023",Vector file of the active fault line in Leyte Island,DENIED,Research,05/14/2023 - 05/14/2023,https://www.foi.gov.ph/requests/aglzfmVmb2ktcGhyIgsSB0NvbnRlbnQiFVBISVZPTENTLTIxOTM1MDI5OTYyNgw
LIBI,"May 14, 2023",COCONUT INDUSTRY INVESTMENT FUND CAPITAL STOCK,PENDING,claim of common shares,07/25/1983 - 05/14/2023,https://www.foi.gov.ph/requests/aglzfmVmb2ktcGhyHgsSB0NvbnRlbnQiEUxJQkktMTc2NjM2MDMzNTc0DA
OPAPP,"May 14, 2023",Victim of Torture and inhumane degrading treatment,PENDING,In desperate need of legal assistance for criminal & immigration purposes,06/01/2020 - 05/13/2023,https://www.foi.gov.ph/requests/aglzfmVmb2ktcGhyHwsSB0NvbnRlbnQiEk9QQVBQLTAyNTQxMTczNTM3OAw
CFO,"May 14, 2023",Victim of Torture and inhumane degrading treatment,REFERRED,In desperate need of legal assistance for immigration purposes,01/06/2020 - 05/13/2023,https://www.foi.gov.ph/requests/aglzfmVmb2ktcGhyHQsSB0NvbnRlbnQiEENGTy02MzU2OTI3MDA1MzcM
DFA,"May 14, 2023",Victim of Torture and inhumane Degrading Treatment,DENIED,In desperate need of legal assistance for immigration purposes,01/06/2020 - 05/13/2023,https://www.foi.gov.ph/requests/aglzfmVmb2ktcGhyHQsSB0NvbnRlbnQiEERGQS04NTI4Mjg0NjM5NDMM
NHA,"May 14, 2023",Murang pabahay,ACCEPTED,Makpagkalooban na maging isa sa makakuha ng murang pabahay,05/10/2023 - 05/11/2023,https://www.foi.gov.ph/requests/aglzfmVmb2ktcGhyHQsSB0NvbnRlbnQiEE5IQS05ODcxODkxNjE0OTEM
PH,"May 14, 2023",Philhealth,DENIED,Para mahulugan ko po,06/11/1993 - 06/11/1993,https://www.foi.gov.ph/requests/aglzfmVmb2ktcGhyHAsSB0NvbnRlbnQiD1BILTQxNzY3MTE1NzQ1Mww
BI,"May 14, 2023",Aplication for lifting black list,SUCCESSFUL,lifting up black list,01/30/2020 - 05/09/2020,https://www.foi.gov.ph/requests/aglzfmVmb2ktcGhyHAsSB0NvbnRlbnQiD0JJLTkwMzkyMjU4NTIyMAw
OWWA,"May 14, 2023",Victim of Torture and inhumane degrading treatment,SUCCESSFUL,In desperate need of Legal Assistance from OWWA or anyone in the Philippines,02/20/2020 - 05/13/2023,https://www.foi.gov.ph/requests/aglzfmVmb2ktcGhyHgsSB0NvbnRlbnQiEU9XV0EtMDkwNzQ0MzgzNDM0DA
GAB,"May 14, 2023","Estimated occupancy on an Esports Facility (Location is along Fort Bonifacio, BGC)",DENIED,Thesis Proposal for Educational purposes,05/13/2021 - 05/13/2023,https://www.foi.gov.ph/requests/aglzfmVmb2ktcGhyHQsSB0NvbnRlbnQiEEdBQi0zNzY3NDEwNTU3NzUM
NTC,"May 14, 2023",reporting stolen phone samsung AO4,PARTIALLY SUCCESSFUL,to avoid scam and fake identification,04/30/2023 - 05/13/2023,https://www.foi.gov.ph/requests/aglzfmVmb2ktcGhyHQsSB0NvbnRlbnQiEE5UQy02MTUzMTg5MzU2NzcM
NCCA,"May 14, 2023",Architectural Projects in the Philippines (Culture),PENDING,Architectural Capstone Research,05/14/2023 - 05/14/2023,https://www.foi.gov.ph/requests/aglzfmVmb2ktcGhyHgsSB0NvbnRlbnQiEU5DQ0EtODU1MDE3OTk4MTA3DA
DOJ,"May 14, 2023",Information about pending criminal charges,REFERRED,Research,05/14/2020 - 05/14/2023,https://www.foi.gov.ph/requests/aglzfmVmb2ktcGhyHQsSB0NvbnRlbnQiEERPSi0xMjg0MTA1MTA1NTQM
DOJ,"May 14, 2023",Information about pending criminal charges,REFERRED,Research,05/14/2020 - 05/14/2023,https://www.foi.gov.ph/requests/aglzfmVmb2ktcGhyHQsSB0NvbnRlbnQiEERPSi0wNzY5NjgxODYwMTgM
DTI,"May 14, 2023",The Total Numbers of Registered Businesses in the Poblacion Uno Cabuyao City Of Laguna,DENIED,Research and Development,05/12/2023 - 05/13/2023,https://www.foi.gov.ph/requests/aglzfmVmb2ktcGhyHQsSB0NvbnRlbnQiEERUSS0yNzA0MzkxNDM4MTYM
NBI,"May 14, 2023",prime suspect serial killer margareth rillo murder in Jobstreet PH companies.,PENDING,PNP Blotter Report for suspect margareth rillo employment banned permanent death in PH.,01/01/2017 - 05/14/2023,https://www.foi.gov.ph/requests/aglzfmVmb2ktcGhyHQsSB0NvbnRlbnQiEE5CSS0zNzQwNjU5NzY1OTIM
NTC,"May 14, 2023",Tracing Unknown Number,REFERRED,Supporting Documents for filling complain to PNP Anti Cyber Crime,05/13/2023 - 05/13/2023,https://www.foi.gov.ph/requests/aglzfmVmb2ktcGhyHQsSB0NvbnRlbnQiEE5UQy0wNzE3Mjg2NDA3MDMM
NTC,"May 14, 2023",Tracing/Blocking of lost smartphone,PARTIALLY SUCCESSFUL,Security Purposes,04/29/2023 - 05/14/2023,https://www.foi.gov.ph/requests/aglzfmVmb2ktcGhyHQsSB0NvbnRlbnQiEE5UQy0xNzA0NzMyMDAyMDYM
DOH,"May 14, 2023","Recent Wastewater Quality Result at Barangay San Mateo, Norzagaray, Bulacan",REFERRED,Capstone Design Project,01/01/2023 - 05/14/2023,https://www.foi.gov.ph/requests/aglzfmVmb2ktcGhyHQsSB0NvbnRlbnQiEERPSC03Mjc2NjcyODY5MzcM
NORWD,"May 14, 2023","Recent Wastewater Quality Testing Result at Barangay San Mateo, Norzagaray, Bulacan",PENDING,Capstone Design Project,01/01/2023 - 05/14/2023,https://www.foi.gov.ph/requests/aglzfmVmb2ktcGhyHwsSB0NvbnRlbnQiEk5PUldELTk4OTUxODMxNDc2Mww
NEDA,"May 14, 2023",ODA Terms and Conditions for Multilateral and Bilateral Loans (2019-2023),PENDING,Research,10/01/2019 - 03/31/2023,https://www.foi.gov.ph/requests/aglzfmVmb2ktcGhyHgsSB0NvbnRlbnQiEU5FREEtMDkwOTE5Mjc4NTE0DA
DSWD,"May 14, 2023",Number of Youth hub/center or youth facility in the philippines,PROCESSING,Architectural Thesis research writing,05/14/2023 - 05/14/2023,https://www.foi.gov.ph/requests/aglzfmVmb2ktcGhyHgsSB0NvbnRlbnQiEURTV0QtMzY5MzMzOTUzNjYyDA
NBI,"May 14, 2023",ako si margareth rillo serial killer blacklisted karma.,PENDING,PNP Blotter Report for suspect margareth rillo employment banned permanent death in PH.,01/01/2017 - 05/14/2023,https://www.foi.gov.ph/requests/aglzfmVmb2ktcGhyHQsSB0NvbnRlbnQiEE5CSS02NjY0MjM4NTMyMjEM
NTC,"May 14, 2023",NO ACTION BEING DONE ON MY PLDT TICKET,PARTIALLY SUCCESSFUL,Complaint,05/11/2023 - 05/14/2023,https://www.foi.gov.ph/requests/aglzfmVmb2ktcGhyHQsSB0NvbnRlbnQiEE5UQy02ODk1MjY3NTEyODQM
PNP,"May 14, 2023",suspect margareth rillo convicted permanent banned or blacklist deceased reported in PNP.,DENIED,PNP Blotter Report for suspect margareth rillo employment banned permanent death in PH.,01/01/2017 - 05/14/2023,https://www.foi.gov.ph/requests/aglzfmVmb2ktcGhyHQsSB0NvbnRlbnQiEFBOUC0zNDIzMTgwODE2NTUM
NBI,"May 14, 2023","margareth rillo,Jen,carol,maxima the lords flock charismatic witchcraft group serial killer real.",PENDING,Ako si margareth rillo. Patuloy na nirereklamo sa NBI at PNP sa mga kasalanang kriminal.,01/01/2017 - 05/14/2023,https://www.foi.gov.ph/requests/aglzfmVmb2ktcGhyHQsSB0NvbnRlbnQiEE5CSS03MDg5ODcwNTY3MTEM
PNP,"May 14, 2023",suspect margareth rillo convicted permanent banned or blacklist deceased reported in PNP.,DENIED,PNP Blotter Report for suspect margareth rillo employment banned permanent death in PH.,01/01/2017 - 05/14/2023,https://www.foi.gov.ph/requests/aglzfmVmb2ktcGhyHQsSB0NvbnRlbnQiEFBOUC05NTg1ODIyNDg5MDkM
DOLE,"May 14, 2023",margareth rillo as dreaded blacklisted hardcoded banned criminal in NCR DOLE,PENDING,PNP Blotter Report for suspect margareth rillo employment banned permanent death in PH.,01/01/2017 - 05/14/2023,https://www.foi.gov.ph/requests/aglzfmVmb2ktcGhyHgsSB0NvbnRlbnQiEURPTEUtNzAzMjg0NTc1OTgzDA
PNP,"May 14, 2023",ako si margareth rillo serial killer blacklisted sa 77Global PH at JobstreetPH reported in PNP.,DENIED,PNP Blotter Report for suspect margareth rillo employment banned permanent death in PH.,01/01/2017 - 05/14/2023,https://www.foi.gov.ph/requests/aglzfmVmb2ktcGhyHQsSB0NvbnRlbnQiEFBOUC03NzkwOTM1NzI0NjEM
NBI,"May 14, 2023",permanent lifetime banned margareth rillo convicted serial killer blacklisted in the Philippines.,PENDING,PNP Blotter Report for suspect margareth rillo employment banned permanent death in PH.,01/01/2017 - 05/14/2023,https://www.foi.gov.ph/requests/aglzfmVmb2ktcGhyHQsSB0NvbnRlbnQiEE5CSS05Njg1OTYzNzcwNzEM
NBI,"May 14, 2023",Reddit blacklist serial killer margareth rillo in the philippines jail,PENDING,PNP Blotter Report for suspect margareth rillo employment banned permanent death in PH.,01/01/2017 - 05/14/2023,https://www.foi.gov.ph/requests/aglzfmVmb2ktcGhyHQsSB0NvbnRlbnQiEE5CSS0zMjI1NTk1NjQ4MTYM
DOLE,"May 14, 2023",margareth rillo convicted as serial killer real-time blacklisted blackout employment banned in DOLE,PENDING,PNP Blotter Report for suspect margareth rillo employment banned permanent death in PH.,01/01/2017 - 05/14/2023,https://www.foi.gov.ph/requests/aglzfmVmb2ktcGhyHgsSB0NvbnRlbnQiEURPTEUtMzg4NDUwNTczNjMyDA
NBI,"May 14, 2023","margareth rillo,Jen,carol,maxima the lords flock charismatic witchcraft group serial killer real.",PENDING,PNP Blotter Report for suspect margareth rillo employment banned permanent death in PH.,01/01/2017 - 05/14/2023,https://www.foi.gov.ph/requests/aglzfmVmb2ktcGhyHQsSB0NvbnRlbnQiEE5CSS00Njc4NzI2Mjc5MzQM
NBI,"May 14, 2023",margareth rillo real-time blacklisted under luisa beltran and girlie javier account 77GlobalPH-ADB.,PENDING,PNP Blotter Report for suspect margareth rillo employment banned permanent death in PH.,01/01/2017 - 05/14/2023,https://www.foi.gov.ph/requests/aglzfmVmb2ktcGhyHQsSB0NvbnRlbnQiEE5CSS05MTg2MzQ2MDIzMzIM
PNP,"May 14, 2023",blacklist serial killer margareth rillo versus Ma.Rossette Palo filed PNP murder blotter complaint,DENIED,PNP Blotter Report for suspect margareth rillo employment banned permanent death in PH.,01/01/2017 - 05/14/2023,https://www.foi.gov.ph/requests/aglzfmVmb2ktcGhyHQsSB0NvbnRlbnQiEFBOUC03NzcxMzg2NDg4NzMM
NBI,"May 14, 2023",serial killer margareth rillo versus Girlie Claire A. Javier file blotter theft murder report,PENDING,PNP Blotter Report for suspect margareth rillo employment banned permanent death in PH.,01/01/2017 - 05/14/2023,https://www.foi.gov.ph/requests/aglzfmVmb2ktcGhyHQsSB0NvbnRlbnQiEE5CSS02OTg3ODA2NDE2NzEM
NBI,"May 14, 2023",suspected serial killer margareth rillo in San Juan Manila real-time ban 77GlobalPH 6329157747,PENDING,PNP Blotter Report for suspect margareth rillo employment banned permanent death in PH.,01/01/2017 - 05/14/2023,https://www.foi.gov.ph/requests/aglzfmVmb2ktcGhyHQsSB0NvbnRlbnQiEE5CSS0yMTg4MjcwMzc3NjIM
CIC,"May 14, 2023",Credit information,PENDING,Personal use,05/13/2019 - 05/13/2023,https://www.foi.gov.ph/requests/aglzfmVmb2ktcGhyHQsSB0NvbnRlbnQiEENJQy0yMzIyMjM1NDA4OTgM
NBI,"May 14, 2023",margareth rillo family convicted serial killer involve in spiritual witchcraft occultism in PH.,PENDING,PNP Blotter Report for suspect margareth rillo employment banned permanent death in PH.,01/01/2017 - 05/14/2023,https://www.foi.gov.ph/requests/aglzfmVmb2ktcGhyHQsSB0NvbnRlbnQiEE5CSS0zOTgwODk0Mzg3OTIM
DOLE,"May 14, 2023",margareth rillo convicted permanently banned real-time blacklist in PH companies for sexual assault,PENDING,PNP Blotter Report for suspect margareth rillo employment banned permanent death in PH.,01/01/2017 - 05/14/2023,https://www.foi.gov.ph/requests/aglzfmVmb2ktcGhyHgsSB0NvbnRlbnQiEURPTEUtNzAxODAzMDEwNDM3DA
NBI,"May 14, 2023",margareth rillo convicted as serial killer real-time blacklisted banned in 77GlobalPh blackout,PENDING,PNP Blotter Report for suspect margareth rillo employment banned permanent death in PH.,01/01/2017 - 05/14/2023,https://www.foi.gov.ph/requests/aglzfmVmb2ktcGhyHQsSB0NvbnRlbnQiEE5CSS05MDQ0MzY4MDEyMzUM
DOLE,"May 14, 2023",554 rejecting banned content margareth rillo real-time blacklisted employment banned in 77GlobalPH,PENDING,PNP Blotter Report for suspect margareth rillo employment banned permanent death in PH.,01/01/2017 - 05/14/2023,https://www.foi.gov.ph/requests/aglzfmVmb2ktcGhyHgsSB0NvbnRlbnQiEURPTEUtMzI0MTgyOTg4NzY4DA
NBI,"May 14, 2023",margareth rillo convicted permanently banned real-time blacklist in PH companies for theft/robbery,PENDING,PNP Blotter Report for suspect margareth rillo employment banned permanent death in PH.,01/01/2017 - 05/14/2023,https://www.foi.gov.ph/requests/aglzfmVmb2ktcGhyHQsSB0NvbnRlbnQiEE5CSS05MDAyMTI4MDkxMDYM
NBI,"May 14, 2023",margareth rillo convicted permanently banned real-time blacklist in PH companies for theft/robbery,PENDING,PNP Blotter Report for suspect margareth rillo employment banned permanent death in PH.,01/01/2017 - 05/13/2023,https://www.foi.gov.ph/requests/aglzfmVmb2ktcGhyHQsSB0NvbnRlbnQiEE5CSS0zNDA3ODA0OTM2NDIM
DOH,"May 13, 2023",Mental Health Statistic on each region,PARTIALLY SUCCESSFUL,Research and Thesis,05/09/2016 - 05/09/2022,https://www.foi.gov.ph/requests/aglzfmVmb2ktcGhyHQsSB0NvbnRlbnQiEERPSC05MDg3MTIxNDY1NjcM
DepEd,"May 13, 2023",Highschool Diploma and Form 137,SUCCESSFUL,"to study abroad, specifically in Canada",06/10/2007 - 05/06/2009,https://www.foi.gov.ph/requests/aglzfmVmb2ktcGhyHwsSB0NvbnRlbnQiEkRlcEVkLTU0MDM0OTIyNDc0Ngw
NBI,"May 13, 2023","margareth rillo,Jen,carol,maxima the lords flock charismatic witchcraft group serial killer real.",PENDING,Ako si margareth rillo. Patuloy na nirereklamo sa NBI at PNP sa mga kasalanang kriminal.,01/01/2017 - 05/13/2023,https://www.foi.gov.ph/requests/aglzfmVmb2ktcGhyHQsSB0NvbnRlbnQiEE5CSS0zNTIwOTMyMzU0MTYM
DTI,"May 13, 2023",ZONE -MALL.COM CO.LTD,REFERRED,To make sure if this safe for entering a business,12/01/2019 - 05/13/2023,https://www.foi.gov.ph/requests/aglzfmVmb2ktcGhyHQsSB0NvbnRlbnQiEERUSS0xMTQ2NDY2NzUwMTQM
BAYWD,"May 13, 2023",Highschool Diploma and Form 137,PENDING,to study abroad,06/05/2008 - 05/05/2009,https://www.foi.gov.ph/requests/aglzfmVmb2ktcGhyHwsSB0NvbnRlbnQiEkJBWVdELTI3Nzc2ODk2MjU4Mgw
BUCOR,"May 13, 2023",Number of BuCor Personnel & Ratio of BuCor Personnel-PDL,ACCEPTED,Undergraduate Thesis,05/13/2023 - 05/13/2023,https://www.foi.gov.ph/requests/aglzfmVmb2ktcGhyHwsSB0NvbnRlbnQiEkJVQ09SLTUzNzkzMTY1MDQ2Mgw
NAP,"May 13, 2023","Old map of Municipality of San Juan, Batangas",DENIED,Research,01/01/1565 - 01/01/2023,https://www.foi.gov.ph/requests/aglzfmVmb2ktcGhyHQsSB0NvbnRlbnQiEE5BUC05NjI4NzczMzE4NzYM
CHED,"May 13, 2023",Number of Student Leaders in Public Universities in Metro Manila Philippines,DENIED,Research,01/01/2018 - 01/01/2023,https://www.foi.gov.ph/requests/aglzfmVmb2ktcGhyHgsSB0NvbnRlbnQiEUNIRUQtNzQ4NTExNDU2MjkwDA
DCWD,"May 13, 2023",Water Treatment Facility or Any Other Liquid Processes Involving Purification or Filtration,ACCEPTED,Environmental and Sanitary Chemistry Lecture Report Assignment,03/20/2023 - 05/13/2023,https://www.foi.gov.ph/requests/aglzfmVmb2ktcGhyHgsSB0NvbnRlbnQiEURDV0QtNjkyOTUxMDA0MzcwDA
NHCP,"May 13, 2023","Old and New Official Seal of the Municipality of Taguig, Rizal and now City of Taguig, Metro Manila",SUCCESSFUL,Research and Documentation,01/01/1900 - 05/13/2023,https://www.foi.gov.ph/requests/aglzfmVmb2ktcGhyHgsSB0NvbnRlbnQiEU5IQ1AtODk2Mzc0ODg2Mjg5DA
LMB,"May 13, 2023","BLLM 1 and 2, Infanta coordinates",ACCEPTED,Research and development,01/01/2019 - 01/01/2021,https://www.foi.gov.ph/requests/aglzfmVmb2ktcGhyIQsSB0NvbnRlbnQiFERFTlJMTUItNDM3NjgyMzk0NzgwDA
NTC,"May 13, 2023",IMEI Block request,PARTIALLY SUCCESSFUL,To prevent the use of lost(possibily stolen) phone,05/13/2023 - 05/13/2023,https://www.foi.gov.ph/requests/aglzfmVmb2ktcGhyHQsSB0NvbnRlbnQiEE5UQy00NzU5MjI4MDkwOTYM
DSWD,"May 13, 2023",CRCF Infrastructure Project,ACCEPTED,Thesis Research Proposal,05/13/2023 - 05/13/2023,https://www.foi.gov.ph/requests/aglzfmVmb2ktcGhyHgsSB0NvbnRlbnQiEURTV0QtNTA0ODY2MjkwOTIzDA
DTI,"May 13, 2023",Number of registered RTW (apparel) business in Lucena City,DENIED,For documentary/educational purposes.,04/01/2023 - 05/13/2023,https://www.foi.gov.ph/requests/aglzfmVmb2ktcGhyHQsSB0NvbnRlbnQiEERUSS05MDM3MDQ5OTU4NDQM
BIR,"May 13, 2023",Income Tax Return of Abigail Jeanne Castro Agoncillo 2022-2023,AWAITING CLARIFICATION,For travel requirements,01/01/2022 - 01/01/2023,https://www.foi.gov.ph/requests/aglzfmVmb2ktcGhyHQsSB0NvbnRlbnQiEEJJUi02MjUyNjUyNzc0MjgM
BIR,"May 13, 2023",ITR,AWAITING CLARIFICATION,to submit a copy of a personal loan bank,01/01/2019 - 05/13/2023,https://www.foi.gov.ph/requests/aglzfmVmb2ktcGhyHQsSB0NvbnRlbnQiEEJJUi02NTMxMjUwMjAyNTgM
SSS,"May 13, 2023",Request for transaction reference number,PENDING,For my ePhilsysId,09/13/2021 - 05/13/2023,https://www.foi.gov.ph/requests/aglzfmVmb2ktcGhyHQsSB0NvbnRlbnQiEFNTUy01OTAxMDA1NTUyMjkM
NTC,"May 13, 2023",scammer,PARTIALLY SUCCESSFUL,to recover my money and report the scammer so the public may know,05/05/2023 - 05/13/2023,https://www.foi.gov.ph/requests/aglzfmVmb2ktcGhyHQsSB0NvbnRlbnQiEE5UQy0xNjcxMzgwMDcyNTcM
DA,"May 13, 2023","Data on the Production of Crops, Poultry, and Livestock",SUCCESSFUL,Production and Suitability Map,01/01/2022 - 12/03/2022,https://www.foi.gov.ph/requests/aglzfmVmb2ktcGhyHAsSB0NvbnRlbnQiD0RBLTMzNzYxODMzMjg5NQw
PSA,"May 13, 2023",PSA,PENDING,Research,05/13/2020 - 05/13/2023,https://www.foi.gov.ph/requests/aglzfmVmb2ktcGhyHQsSB0NvbnRlbnQiEFBTQS05MzAxMDk4NTczMTEM
DOH,"May 13, 2023","Breakdown of 7,660",PROCESSING,Thesis,01/01/2019 - 05/13/2023,https://www.foi.gov.ph/requests/aglzfmVmb2ktcGhyHQsSB0NvbnRlbnQiEERPSC04Mjg2NjM2MDk4MDEM
MMDA,"May 13, 2023","Updated MMARAS report location are along Quezon Ave, West Ave, and Timog Ave of Quezon City",PARTIALLY SUCCESSFUL,Thesis Completion,05/13/2023 - 05/13/2023,https://www.foi.gov.ph/requests/aglzfmVmb2ktcGhyHgsSB0NvbnRlbnQiEU1NREEtOTY1MDExOTM3NTc0DA
DOH,"May 13, 2023",Top 10 Morbidity Cases in the Philippines,PARTIALLY SUCCESSFUL,Research and Development Academe,01/01/2010 - 12/31/2022,https://www.foi.gov.ph/requests/aglzfmVmb2ktcGhyHQsSB0NvbnRlbnQiEERPSC0zMjA0ODc3OTM1MzEM
PNP,"May 13, 2023",Number of Elderly Abuse Cases reported in Calabarzon,SUCCESSFUL,Architectural Thesis,01/01/2015 - 05/08/2023,https://www.foi.gov.ph/requests/aglzfmVmb2ktcGhyHQsSB0NvbnRlbnQiEFBOUC00NTEwOTkzMjQ4NzYM
PAGASA,"May 13, 2023",Philippine Climate Type and Administrative Area Shapefiles,AWAITING CLARIFICATION,Research,05/13/2023 - 05/13/2023,https://www.foi.gov.ph/requests/aglzfmVmb2ktcGhyIAsSB0NvbnRlbnQiE1BBR0FTQS0wNDIyMzE0ODU1MDMM
PCSO,"May 13, 2023",Financial support for the hospitalization of my baby daughter,SUCCESSFUL,Financial help for doctors fee,05/06/2023 - 05/13/2023,https://www.foi.gov.ph/requests/aglzfmVmb2ktcGhyHgsSB0NvbnRlbnQiEVBDU08tNjczMzQ1MTg3MDE4DA
PSA,"May 13, 2023",Birth Certificate,PARTIALLY SUCCESSFUL,A requirement for Phillippine Passport Application,11/01/1948 - 05/13/2023,https://www.foi.gov.ph/requests/aglzfmVmb2ktcGhyHQsSB0NvbnRlbnQiEFBTQS0zNDk4NTE5ODMwMzMM
PSA,"May 13, 2023",List of Names of the Registered SMEs in the City of Manila,PARTIALLY SUCCESSFUL,College Research Thesis Paper,01/01/2000 - 05/13/2023,https://www.foi.gov.ph/requests/aglzfmVmb2ktcGhyHQsSB0NvbnRlbnQiEFBTQS0zOTA5MzQyMzUwNTkM
PNP,"May 13, 2023",Recorded Cases of Sexual Related Crimes in Cavite Per Municipality/City,SUCCESSFUL,Architecture Thesis,01/01/2016 - 12/31/2021,https://www.foi.gov.ph/requests/aglzfmVmb2ktcGhyHQsSB0NvbnRlbnQiEFBOUC0xNjY2MzMxMTE0MTEM
LRA,"May 13, 2023",Clean Title Verification,SUCCESSFUL,Property Verification & Risk Assessment,04/01/2023 - 05/13/2023,https://www.foi.gov.ph/requests/aglzfmVmb2ktcGhyHQsSB0NvbnRlbnQiEExSQS02MjM1MzI3MjMwMjEM
CARSU,"May 13, 2023",Cabadbaran watershed forest reserve,PENDING,research and education,01/01/2000 - 05/11/2023,https://www.foi.gov.ph/requests/aglzfmVmb2ktcGhyHwsSB0NvbnRlbnQiEkNBUlNVLTY3MDY2NzYyOTEyNQw
PRC,"May 13, 2023",list of marine engineer passer last 2004,ACCEPTED,for reference,01/01/2004 - 12/30/2004,https://www.foi.gov.ph/requests/aglzfmVmb2ktcGhyHQsSB0NvbnRlbnQiEFBSQy0yNTIyMDE0Njc5NTEM
SSS,"May 13, 2023",Sss online account recovery,PENDING,Use of account,08/17/2007 - 05/13/2023,https://www.foi.gov.ph/requests/aglzfmVmb2ktcGhyHQsSB0NvbnRlbnQiEFNTUy00OTAzNjE0OTI2MTIM
PNP,"May 13, 2023",suspect margareth rillo convicted permanent banned or blacklist deceased reported in PNP.,DENIED,PNP Blotter Report for suspect margareth rillo employment banned permanent death in PH.,01/01/2017 - 05/13/2023,https://www.foi.gov.ph/requests/aglzfmVmb2ktcGhyHQsSB0NvbnRlbnQiEFBOUC04NzY0NTU2ODE3NjgM
DepEd,"May 13, 2023",Teacher Shortage in the Philippines,AWAITING CLARIFICATION,undergraduate research,01/01/2013 - 05/13/2023,https://www.foi.gov.ph/requests/aglzfmVmb2ktcGhyHwsSB0NvbnRlbnQiEkRlcEVkLTIzNjUyMTMxMjUyNAw
BUCOR,"May 13, 2023",PDL KEVIN NUIQUE YGUINTO,DENIED,Tulong po,04/14/2023 - 05/13/2023,https://www.foi.gov.ph/requests/aglzfmVmb2ktcGhyHwsSB0NvbnRlbnQiEkJVQ09SLTQ0OTc1MjY1NTYwMAw
CFO,"May 13, 2023",Number of Filipino Teachers Working as Teachers Abroad,REFERRED,Undergraduate research,01/01/2013 - 05/13/2023,https://www.foi.gov.ph/requests/aglzfmVmb2ktcGhyHQsSB0NvbnRlbnQiEENGTy03ODg4NjUxNDI3NDQM
BIR,"May 13, 2023",2316 BIR form,AWAITING CLARIFICATION,For New Employment,08/14/2017 - 07/27/2022,https://www.foi.gov.ph/requests/aglzfmVmb2ktcGhyHQsSB0NvbnRlbnQiEEJJUi04NjM4MjMwODk2MDgM
UsaP,"May 13, 2023",Health Financing Budget of Pasig City for 2023,SUCCESSFUL,Community thesis,01/01/2023 - 05/13/2023,https://www.foi.gov.ph/requests/aglzfmVmb2ktcGhyHgsSB0NvbnRlbnQiEVVTQVAtMjQ5MTU2OTUwNzQ0DA
ITDI,"May 13, 2023",Process to get TEM image of a phage sample if DOST offers TEM micrography,SUCCESSFUL,research proposal development,04/12/2023 - 05/12/2023,https://www.foi.gov.ph/requests/aglzfmVmb2ktcGhyHgsSB0NvbnRlbnQiEUlUREktMjYyNTIwMjg0NTI2DA
DOH,"May 13, 2023",HIV Statistics in Cavite Province,PROCESSING,Undergraduate Thesis,12/31/2020 - 05/13/2023,https://www.foi.gov.ph/requests/aglzfmVmb2ktcGhyHQsSB0NvbnRlbnQiEERPSC0yNjgxMjA1MjI4MDQM
PSA,"May 13, 2023",Statistics Letter of Request,PENDING,Research and development,05/13/2018 - 05/13/2023,https://www.foi.gov.ph/requests/aglzfmVmb2ktcGhyHQsSB0NvbnRlbnQiEFBTQS04ODA0OTIwMDAzNTYM
DOH,"May 13, 2023",The top 10 leading causes of mortality in Pasig City,REFERRED,Academic Research,01/01/2022 - 01/01/2023,https://www.foi.gov.ph/requests/aglzfmVmb2ktcGhyHQsSB0NvbnRlbnQiEERPSC0yOTgyNjExNDEzMDMM
UsaP,"May 13, 2023",The top 10 mortality cases in Pasig City,SUCCESSFUL,Academic Research,01/01/2022 - 12/31/2022,https://www.foi.gov.ph/requests/aglzfmVmb2ktcGhyHgsSB0NvbnRlbnQiEVVTQVAtNjAzOTA3NjE4OTM5DA
NTC,"May 13, 2023",NTC Permit,SUCCESSFUL,To acquire NTC Permit for our package,05/13/2023 - 05/13/2023,https://www.foi.gov.ph/requests/aglzfmVmb2ktcGhyHQsSB0NvbnRlbnQiEE5UQy03MzExMjE1NDA2OTMM
CHED,"May 13, 2023",Number of Student Leaders in Private Universities in Metro Manila Philippines,DENIED,Research Paper,01/01/2018 - 01/01/2023,https://www.foi.gov.ph/requests/aglzfmVmb2ktcGhyHgsSB0NvbnRlbnQiEUNIRUQtNTM4NDE5NDY0MjA0DA
MMDA,"May 13, 2023",Number of Student Leaders in Private Universities in Metro Manila Philippines,REFERRED,Research Paper,01/20/2018 - 05/13/2023,https://www.foi.gov.ph/requests/aglzfmVmb2ktcGhyHgsSB0NvbnRlbnQiEU1NREEtMDE1NTE3NDQ0NDg5DA
DOH,"May 13, 2023",Hospital Classification Levels Standards and Requirements,SUCCESSFUL,Research,01/01/2022 - 01/01/2023,https://www.foi.gov.ph/requests/aglzfmVmb2ktcGhyHQsSB0NvbnRlbnQiEERPSC0yNDg4NTg4MTE5ODAM
PCSO,"May 13, 2023",Request for Financial assistance for Fistula surgery,SUCCESSFUL,Hemodialysis Access surgery for AV Fistula,05/13/2023 - 05/13/2023,https://www.foi.gov.ph/requests/aglzfmVmb2ktcGhyHgsSB0NvbnRlbnQiEVBDU08tMDAzNDUwNDk0Njc2DA
SSS,"May 13, 2023",SSS,PENDING,To know if my sss is active,04/25/2022 - 04/21/2023,https://www.foi.gov.ph/requests/aglzfmVmb2ktcGhyHQsSB0NvbnRlbnQiEFNTUy00NjM1MzUyMjMzMTQM
PSA,"May 13, 2023",Highest educational attainment of household head (Census 2020),PENDING,Academic research,01/01/2011 - 12/31/2020,https://www.foi.gov.ph/requests/aglzfmVmb2ktcGhyHQsSB0NvbnRlbnQiEFBTQS02NjU2NTUzMDUwMTkM
DOH,"May 13, 2023",Hospital and Trauma Center,SUCCESSFUL,Thesis purposes,05/13/2020 - 05/13/2023,https://www.foi.gov.ph/requests/aglzfmVmb2ktcGhyHQsSB0NvbnRlbnQiEERPSC02NzIxOTkzNjAwMTUM
DOH,"May 13, 2023",Costs Range of Medical Procedures Offered in Medical Tourism Services in the Philippines,SUCCESSFUL,Architectural Research,01/01/2020 - 01/01/2022,https://www.foi.gov.ph/requests/aglzfmVmb2ktcGhyHQsSB0NvbnRlbnQiEERPSC0wMTk4MDIxNTQzMDgM
DOH,"May 13, 2023",Cancellation of VaxCert update request,SUCCESSFUL,Flight,05/13/2023 - 05/13/2023,https://www.foi.gov.ph/requests/aglzfmVmb2ktcGhyHQsSB0NvbnRlbnQiEERPSC04OTA3NTEzODA2NjcM
PSA,"May 13, 2023",Community Project: MANILA,PENDING,Reasearch for our community project,05/13/2023 - 05/13/2023,https://www.foi.gov.ph/requests/aglzfmVmb2ktcGhyHQsSB0NvbnRlbnQiEFBTQS0wMzU2OTY3MTI1NTIM
MGB,"May 13, 2023",Regional Geology of Davao Oriental,PARTIALLY SUCCESSFUL,Research and Additional Information and Reference for Technical Paper,01/01/2000 - 05/13/2023,https://www.foi.gov.ph/requests/aglzfmVmb2ktcGhyHQsSB0NvbnRlbnQiEE1HQi0yNzk2MTkxMTA2NDMM
USEP,"May 13, 2023",Regional Geology of Davao Oriental,REFERRED,Research and Additional Information and Reference for Technical Paper,01/01/2000 - 05/13/2023,https://www.foi.gov.ph/requests/aglzfmVmb2ktcGhyHgsSB0NvbnRlbnQiEVVTRVAtMTk3MTg0Mjk4MDcwDA
