agency,date,title,status,purpose,period_covered,link
DPWH,"February 04, 2023","Geotechnical Data of Biñan Laguna, vicinity of barangay Delapaz and Malaban",AWAITING CLARIFICATION,Capstone Project,02/04/2023 - 02/04/2023,https://www.foi.gov.ph/requests/aglzfmVmb2ktcGhyHgsSB0NvbnRlbnQiEURQV0gtMjIzNjMzODgyMzQ4DA
DPWH,"February 04, 2023","Traffic Data of Biñan Laguna, vicinity of barangay Delapaz and Malaban",AWAITING CLARIFICATION,Capstone Project,02/04/2023 - 02/04/2023,https://www.foi.gov.ph/requests/aglzfmVmb2ktcGhyHgsSB0NvbnRlbnQiEURQV0gtOTY1OTk3NDg2MDk4DA
DOH,"February 04, 2023",Vaccine card,SUCCESSFUL,Travel,02/04/2023 - 02/04/2023,https://www.foi.gov.ph/requests/aglzfmVmb2ktcGhyHQsSB0NvbnRlbnQiEERPSC0wNTc4ODk1MDI5NTEM
MMDA,"February 04, 2023",Traffic Data of Makati and Mandaluyong City,SUCCESSFUL,Capstone Project at De La Salle University,02/03/2023 - 02/03/2023,https://www.foi.gov.ph/requests/aglzfmVmb2ktcGhyHgsSB0NvbnRlbnQiEU1NREEtNDEzMjYxNjUzODI2DA
DOJ,"February 04, 2023",Release Order of Glecerio Melano's homicide case,PENDING,Clearance for Police Record,02/04/2023 - 02/04/2023,https://www.foi.gov.ph/requests/aglzfmVmb2ktcGhyHQsSB0NvbnRlbnQiEERPSi00ODE5Njk1MDg2MTYM
DOH,"February 04, 2023",Vaccine card,SUCCESSFUL,Traveling,02/04/2023 - 02/04/2023,https://www.foi.gov.ph/requests/aglzfmVmb2ktcGhyHQsSB0NvbnRlbnQiEERPSC0zMDEzODUwNzUxNzQM
MMDA,"February 04, 2023",Traffic Data of Streets along the Pasig River,DENIED,Capstone Design Project (De La Salle University - Manila),01/21/2023 - 02/03/2023,https://www.foi.gov.ph/requests/aglzfmVmb2ktcGhyHgsSB0NvbnRlbnQiEU1NREEtMTk2NjE3OTQ3Njg4DA
MMDA,"February 04, 2023",Topographic and Hydrographic Data of Barangays Olympia and Vergara (Makati-Mandaluyong),DENIED,Capstone Design Project (De La Salle University-Manila),01/21/2023 - 02/03/2023,https://www.foi.gov.ph/requests/aglzfmVmb2ktcGhyHgsSB0NvbnRlbnQiEU1NREEtMjY4NDYyMjQ1NzY0DA
DSWD,"February 04, 2023",Dialysis Patient,DENIED,Financial Assistance,02/04/2023 - 02/04/2023,https://www.foi.gov.ph/requests/aglzfmVmb2ktcGhyHgsSB0NvbnRlbnQiEURTV0QtNTM1MzcwMzI2ODI1DA
DA,"February 04, 2023",Value Chain analysis of Lowland Rice in General Santos City,PENDING,Research/Thesis,01/01/2018 - 01/01/2022,https://www.foi.gov.ph/requests/aglzfmVmb2ktcGhyHAsSB0NvbnRlbnQiD0RBLTExMDM0MTI1MDY3OQw
OWWA,"February 04, 2023",Educational Assistance,SUCCESSFUL,Request for financial assistance,02/04/2023 - 02/04/2023,https://www.foi.gov.ph/requests/aglzfmVmb2ktcGhyHgsSB0NvbnRlbnQiEU9XV0EtMzYzMzU1NTE1MTQxDA
DepEd,"February 04, 2023",Form 137,SUCCESSFUL,Enlistment in the United States Military,01/01/2013 - 02/04/2013,https://www.foi.gov.ph/requests/aglzfmVmb2ktcGhyHwsSB0NvbnRlbnQiEkRlcEVkLTM4MTE4MTgxNjQ0NAw
DPWH,"February 04, 2023",Classified Traffic Volume Count Data,PENDING,Research and Development,01/03/2018 - 02/04/2023,https://www.foi.gov.ph/requests/aglzfmVmb2ktcGhyHgsSB0NvbnRlbnQiEURQV0gtMTQ5NzA4Njk4OTMwDA
NTC,"February 04, 2023",TRACK LOST PHONE,PENDING,Track lost phone,02/02/2023 - 02/03/2023,https://www.foi.gov.ph/requests/aglzfmVmb2ktcGhyHQsSB0NvbnRlbnQiEE5UQy0yNjE5MjcwMzg0MTIM
DTI,"February 04, 2023",The number of small and medium businesses in the agricultural industry,DENIED,Research and Development,02/04/2023 - 02/04/2023,https://www.foi.gov.ph/requests/aglzfmVmb2ktcGhyHQsSB0NvbnRlbnQiEERUSS0yODAzOTg0NDU5MDIM
NBI,"February 04, 2023",margareth rillo jobless suspect for murder and JobStreet blacklist scammer with PNP criminal record.,DENIED,Police Arrest Blotter Report Permanent Blacklist Order and suspension of margareth rillo,01/01/2018 - 02/02/2023,https://www.foi.gov.ph/requests/aglzfmVmb2ktcGhyHQsSB0NvbnRlbnQiEE5CSS02NDk0MTI5NjgxMTQM
NBI,"February 04, 2023",margareth rillo jobless suspect for murder and JobStreet blacklist scammer with PNP criminal record.,DENIED,Police Arrest Blotter Report Permanent Blacklist Order and suspension of margareth rillo,01/01/2018 - 02/04/2023,https://www.foi.gov.ph/requests/aglzfmVmb2ktcGhyHQsSB0NvbnRlbnQiEE5CSS0zOTI5NjMzMjgxODkM
CHED,"February 04, 2023",Polytechnic University of the Philippines (PUP) Floor plan,PENDING,Architectural Research,02/04/2023 - 02/04/2023,https://www.foi.gov.ph/requests/aglzfmVmb2ktcGhyHgsSB0NvbnRlbnQiEUNIRUQtMjM5OTM2MDQxNzM3DA
SSS,"February 04, 2023",How to reset my account sss online,PENDING,Sana may makatulong sa problema ko na lock account ko sa sss online,01/01/2023 - 02/04/2023,https://www.foi.gov.ph/requests/aglzfmVmb2ktcGhyHQsSB0NvbnRlbnQiEFNTUy0zNjMyMzAwMDQ3ODgM
DepEd,"February 04, 2023",CB-EPT Result 2022,SUCCESSFUL,Ranking,09/07/2022 - 09/07/2022,https://www.foi.gov.ph/requests/aglzfmVmb2ktcGhyHwsSB0NvbnRlbnQiEkRlcEVkLTkyNDE5Njc1NTc5NQw
DPWH,"February 04, 2023","Geotechnical Data of Biñan Laguna, vicinity of barangay Delapaz and Malaban",AWAITING CLARIFICATION,Capstone Project,02/04/2023 - 02/04/2023,https://www.foi.gov.ph/requests/aglzfmVmb2ktcGhyHgsSB0NvbnRlbnQiEURQV0gtMjIzNjMzODgyMzQ4DA
DPWH,"February 04, 2023","Traffic Data of Biñan Laguna, vicinity of barangay Delapaz and Malaban",AWAITING CLARIFICATION,Capstone Project,02/04/2023 - 02/04/2023,https://www.foi.gov.ph/requests/aglzfmVmb2ktcGhyHgsSB0NvbnRlbnQiEURQV0gtOTY1OTk3NDg2MDk4DA
DOH,"February 04, 2023",Vaccine card,SUCCESSFUL,Travel,02/04/2023 - 02/04/2023,https://www.foi.gov.ph/requests/aglzfmVmb2ktcGhyHQsSB0NvbnRlbnQiEERPSC0wNTc4ODk1MDI5NTEM
MMDA,"February 04, 2023",Traffic Data of Makati and Mandaluyong City,SUCCESSFUL,Capstone Project at De La Salle University,02/03/2023 - 02/03/2023,https://www.foi.gov.ph/requests/aglzfmVmb2ktcGhyHgsSB0NvbnRlbnQiEU1NREEtNDEzMjYxNjUzODI2DA
DOJ,"February 04, 2023",Release Order of Glecerio Melano's homicide case,PENDING,Clearance for Police Record,02/04/2023 - 02/04/2023,https://www.foi.gov.ph/requests/aglzfmVmb2ktcGhyHQsSB0NvbnRlbnQiEERPSi00ODE5Njk1MDg2MTYM
DOH,"February 04, 2023",Vaccine card,SUCCESSFUL,Traveling,02/04/2023 - 02/04/2023,https://www.foi.gov.ph/requests/aglzfmVmb2ktcGhyHQsSB0NvbnRlbnQiEERPSC0zMDEzODUwNzUxNzQM
MMDA,"February 04, 2023",Traffic Data of Streets along the Pasig River,DENIED,Capstone Design Project (De La Salle University - Manila),01/21/2023 - 02/03/2023,https://www.foi.gov.ph/requests/aglzfmVmb2ktcGhyHgsSB0NvbnRlbnQiEU1NREEtMTk2NjE3OTQ3Njg4DA
MMDA,"February 04, 2023",Topographic and Hydrographic Data of Barangays Olympia and Vergara (Makati-Mandaluyong),DENIED,Capstone Design Project (De La Salle University-Manila),01/21/2023 - 02/03/2023,https://www.foi.gov.ph/requests/aglzfmVmb2ktcGhyHgsSB0NvbnRlbnQiEU1NREEtMjY4NDYyMjQ1NzY0DA
DSWD,"February 04, 2023",Dialysis Patient,DENIED,Financial Assistance,02/04/2023 - 02/04/2023,https://www.foi.gov.ph/requests/aglzfmVmb2ktcGhyHgsSB0NvbnRlbnQiEURTV0QtNTM1MzcwMzI2ODI1DA
DA,"February 04, 2023",Value Chain analysis of Lowland Rice in General Santos City,PENDING,Research/Thesis,01/01/2018 - 01/01/2022,https://www.foi.gov.ph/requests/aglzfmVmb2ktcGhyHAsSB0NvbnRlbnQiD0RBLTExMDM0MTI1MDY3OQw
OWWA,"February 04, 2023",Educational Assistance,SUCCESSFUL,Request for financial assistance,02/04/2023 - 02/04/2023,https://www.foi.gov.ph/requests/aglzfmVmb2ktcGhyHgsSB0NvbnRlbnQiEU9XV0EtMzYzMzU1NTE1MTQxDA
DepEd,"February 04, 2023",Form 137,SUCCESSFUL,Enlistment in the United States Military,01/01/2013 - 02/04/2013,https://www.foi.gov.ph/requests/aglzfmVmb2ktcGhyHwsSB0NvbnRlbnQiEkRlcEVkLTM4MTE4MTgxNjQ0NAw
DPWH,"February 04, 2023",Classified Traffic Volume Count Data,PENDING,Research and Development,01/03/2018 - 02/04/2023,https://www.foi.gov.ph/requests/aglzfmVmb2ktcGhyHgsSB0NvbnRlbnQiEURQV0gtMTQ5NzA4Njk4OTMwDA
NTC,"February 04, 2023",TRACK LOST PHONE,PENDING,Track lost phone,02/02/2023 - 02/03/2023,https://www.foi.gov.ph/requests/aglzfmVmb2ktcGhyHQsSB0NvbnRlbnQiEE5UQy0yNjE5MjcwMzg0MTIM
DTI,"February 04, 2023",The number of small and medium businesses in the agricultural industry,DENIED,Research and Development,02/04/2023 - 02/04/2023,https://www.foi.gov.ph/requests/aglzfmVmb2ktcGhyHQsSB0NvbnRlbnQiEERUSS0yODAzOTg0NDU5MDIM
NBI,"February 04, 2023",margareth rillo jobless suspect for murder and JobStreet blacklist scammer with PNP criminal record.,DENIED,Police Arrest Blotter Report Permanent Blacklist Order and suspension of margareth rillo,01/01/2018 - 02/02/2023,https://www.foi.gov.ph/requests/aglzfmVmb2ktcGhyHQsSB0NvbnRlbnQiEE5CSS02NDk0MTI5NjgxMTQM
NBI,"February 04, 2023",margareth rillo jobless suspect for murder and JobStreet blacklist scammer with PNP criminal record.,DENIED,Police Arrest Blotter Report Permanent Blacklist Order and suspension of margareth rillo,01/01/2018 - 02/04/2023,https://www.foi.gov.ph/requests/aglzfmVmb2ktcGhyHQsSB0NvbnRlbnQiEE5CSS0zOTI5NjMzMjgxODkM
DOH,"February 04, 2023",Lost Vaccine Card,SUCCESSFUL,Incase it is required to be shown.,03/01/2022 - 01/03/2023,https://www.foi.gov.ph/requests/aglzfmVmb2ktcGhyHQsSB0NvbnRlbnQiEERPSC03OTEyODU2OTE0MjkM
DPWH,"February 04, 2023","Borehole Log of New Washington and Batan, Aklan, Philippines",PENDING,Undergraduate Capstone Project,01/01/2019 - 12/31/2022,https://www.foi.gov.ph/requests/aglzfmVmb2ktcGhyHgsSB0NvbnRlbnQiEURQV0gtOTk4NzMxMjEzNDI0DA
DPWH,"February 04, 2023","Traffic Data of New Washington and Batan, Aklan, Philippines",AWAITING CLARIFICATION,Undergraduate Capstone project,01/01/2019 - 12/31/2022,https://www.foi.gov.ph/requests/aglzfmVmb2ktcGhyHgsSB0NvbnRlbnQiEURQV0gtMjE2NjE3NTI1MzAwDA
NTC,"February 04, 2023",Find my lost or stolen tablet,PENDING,Request for return,02/03/2023 - 02/03/2023,https://www.foi.gov.ph/requests/aglzfmVmb2ktcGhyHQsSB0NvbnRlbnQiEE5UQy02NTY2NjQ5MjA0NDIM
DOH,"February 04, 2023",Staffing of Cancer Cancer,PROCESSING,For Architectural Thesis,02/04/2023 - 02/04/2023,https://www.foi.gov.ph/requests/aglzfmVmb2ktcGhyHQsSB0NvbnRlbnQiEERPSC02MTA1MzM1OTEzNDYM
CDA,"February 04, 2023",Agusan del Sur Cooperative List with Coop Peso Score/Rating.,ACCEPTED,Research and Investment,01/01/2022 - 12/31/2022,https://www.foi.gov.ph/requests/aglzfmVmb2ktcGhyHQsSB0NvbnRlbnQiEENEQS03MTQ1MzMwMDQyNDAM
DPWH,"February 04, 2023","Geotechnical Report, and Topographic and Hydrographic Data of Sorsogon and Samar",AWAITING CLARIFICATION,Research and Development,02/01/2022 - 02/01/2023,https://www.foi.gov.ph/requests/aglzfmVmb2ktcGhyHgsSB0NvbnRlbnQiEURQV0gtODM4MTAwOTM4NDgwDA
SSS,"February 03, 2023",Disclosure of statement,PENDING,Need a copy for my employer,02/03/2023 - 02/03/2023,https://www.foi.gov.ph/requests/aglzfmVmb2ktcGhyHQsSB0NvbnRlbnQiEFNTUy02OTE4OTY5OTYwMjgM
NTC,"February 03, 2023",my gcash account,PENDING,to refund my gcash funds amounting of 6798 pesos,01/30/2023 - 02/03/2023,https://www.foi.gov.ph/requests/aglzfmVmb2ktcGhyHQsSB0NvbnRlbnQiEE5UQy01NTE0NDY1MjMzNTcM
CIAP,"February 03, 2023",Case of construction accident in Valenzuela City,PENDING,Research Purpose,01/03/2023 - 01/03/2023,https://www.foi.gov.ph/requests/aglzfmVmb2ktcGhyHgsSB0NvbnRlbnQiEUNJQVAtNzQwMTk1Njg4Njk5DA
BFP,"February 03, 2023",Fire Incident Statistic of year 2022,PENDING,For seminar on fire prevention,01/01/2022 - 12/31/2022,https://www.foi.gov.ph/requests/aglzfmVmb2ktcGhyHQsSB0NvbnRlbnQiEEJGUC0xMDM4ODY0MjE3NDkM
DPWH,"February 03, 2023","President Cory C. Aquino Boulevard, Camarines Norte",PENDING,THESIS for Architectural Design 10,02/03/2023 - 02/03/2023,https://www.foi.gov.ph/requests/aglzfmVmb2ktcGhyHgsSB0NvbnRlbnQiEURQV0gtMTc0ODMzNzAxMTA4DA
NAMRIA,"February 03, 2023",Stream Networks,DENIED,Research,02/03/2023 - 02/03/2023,https://www.foi.gov.ph/requests/aglzfmVmb2ktcGhyJAsSB0NvbnRlbnQiF0RFTlJOQU1SSUEtMzk5OTk1NTI5OTQ4DA
DepEd,"February 03, 2023",Form 137A and Form 138,SUCCESSFUL,Back to studying,03/31/2009 - 03/31/2010,https://www.foi.gov.ph/requests/aglzfmVmb2ktcGhyHwsSB0NvbnRlbnQiEkRlcEVkLTM3MjAwNTM0MjY2NAw
MMDA,"February 03, 2023","Classified Traffic Volume Count Data of Zapote, Las Piñas, Metro Manila",DENIED,Research,01/03/2019 - 02/03/2023,https://www.foi.gov.ph/requests/aglzfmVmb2ktcGhyHgsSB0NvbnRlbnQiEU1NREEtNTMyNDY0ODUxMTQ4DA
DOLE,"February 03, 2023",Latest Data on Total Number of Construction Workers PER REGION,PARTIALLY SUCCESSFUL,Academic Research,01/01/2015 - 02/03/2023,https://www.foi.gov.ph/requests/aglzfmVmb2ktcGhyHgsSB0NvbnRlbnQiEURPTEUtNzM0MTkyMDg3MDI1DA
DENR,"February 03, 2023","Geotechnical Analysis Report on Zapote, Las Piñas City, Metro Manila",REFERRED,Research,01/01/2020 - 12/01/2022,https://www.foi.gov.ph/requests/aglzfmVmb2ktcGhyHgsSB0NvbnRlbnQiEURFTlItMTMzMDkxNjgzMTEyDA
MMDA,"February 03, 2023",Classified Traffic Volume Count Data,DENIED,Research and Development,01/03/2019 - 02/03/2023,https://www.foi.gov.ph/requests/aglzfmVmb2ktcGhyHgsSB0NvbnRlbnQiEU1NREEtMDMwMDQ4NjA5Njg1DA
MMDA,"February 03, 2023",Traffic data of Mandaluyong,SUCCESSFUL,Educational/Capstone Design Project,02/03/2020 - 02/03/2023,https://www.foi.gov.ph/requests/aglzfmVmb2ktcGhyHgsSB0NvbnRlbnQiEU1NREEtODczMzM2OTkxODA2DA
MMDA,"February 03, 2023",Traffic data of Makati,SUCCESSFUL,Educational/Capstone design project,02/03/2023 - 02/03/2023,https://www.foi.gov.ph/requests/aglzfmVmb2ktcGhyHgsSB0NvbnRlbnQiEU1NREEtNDcwMjkzNzM2NTUzDA
SSS,"February 03, 2023",SSS Number Verification,PENDING,to continue my SSS contribution,01/01/2015 - 12/31/2015,https://www.foi.gov.ph/requests/aglzfmVmb2ktcGhyHQsSB0NvbnRlbnQiEFNTUy01MDg3MDM1MjQwNTgM
DENR,"February 03, 2023","Geotechnical Analysis Report on Molino, Bacoor City, Cavite",REFERRED,Research,01/01/2020 - 12/01/2022,https://www.foi.gov.ph/requests/aglzfmVmb2ktcGhyHgsSB0NvbnRlbnQiEURFTlItMjIwMDA3OTkwNTM4DA
NTC,"February 03, 2023",TO BLOCK MY STOLEN XIAOMI 12T BLACK 8GB + 256GB,PENDING,TO BLOCK MY STOLEN XIAOMI 12T BLACK 8GB + 256GB with IMEI: 860232066424688,02/03/2023 - 02/03/2023,https://www.foi.gov.ph/requests/aglzfmVmb2ktcGhyHQsSB0NvbnRlbnQiEE5UQy04NzE2MDg2MDAxODAM
DPWH,"February 03, 2023",Traffic Data of Makati and Mandaluyong City,REFERRED,Capstone Project at De La Salle University,02/03/2023 - 02/03/2023,https://www.foi.gov.ph/requests/aglzfmVmb2ktcGhyHgsSB0NvbnRlbnQiEURQV0gtNDk1MDYxOTkyNzQ5DA
NBI,"February 03, 2023",scammed by a BPI account,DENIED,Crime,12/03/2022 - 01/02/2023,https://www.foi.gov.ph/requests/aglzfmVmb2ktcGhyHQsSB0NvbnRlbnQiEE5CSS0zMjA5MTQ5MTQ0MDgM
PSA,"February 03, 2023",Latest Data on Total Number of Construction Workers PER REGION,PENDING,Academic Research,01/01/2015 - 02/03/2023,https://www.foi.gov.ph/requests/aglzfmVmb2ktcGhyHQsSB0NvbnRlbnQiEFBTQS0yNzYwMDc1MDQ0OTMM
MMDA,"February 03, 2023","AADT for Sta. Ana Brgy. 900, Manila City",DENIED,Research,01/01/2020 - 12/31/2020,https://www.foi.gov.ph/requests/aglzfmVmb2ktcGhyHgsSB0NvbnRlbnQiEU1NREEtOTY5NjI1OTYxNzE4DA
DPWH,"February 03, 2023",Geotechnical Report of Pasig River,AWAITING CLARIFICATION,Capstone Project at De La Salle University,02/03/2023 - 02/03/2023,https://www.foi.gov.ph/requests/aglzfmVmb2ktcGhyHgsSB0NvbnRlbnQiEURQV0gtNTM4OTcyNTE5NjcwDA
DPWH,"February 03, 2023","Geotechnical Report for Namayan, Mandaluyong",PENDING,Educational/Capstone/Design Project,02/03/2018 - 02/03/2023,https://www.foi.gov.ph/requests/aglzfmVmb2ktcGhyHgsSB0NvbnRlbnQiEURQV0gtMTE2MTkwMzA3NzQ5DA
MMDA,"February 03, 2023","AADT and Speed Inventory for Pedro Gil Street, Barangay 879, Manila City",DENIED,Capstone Project Research,01/01/2020 - 12/31/2020,https://www.foi.gov.ph/requests/aglzfmVmb2ktcGhyHgsSB0NvbnRlbnQiEU1NREEtODc1NTA2NTg4MTMxDA
DENR EMB,"February 03, 2023",Certification of the existence of Sanitary Landfill,DENIED,For reference,02/08/2021 - 02/03/2023,https://www.foi.gov.ph/requests/aglzfmVmb2ktcGhyIQsSB0NvbnRlbnQiFERFTlJFTUItMTI5NjY5MjU3NzE5DA
DPWH,"February 03, 2023","Geotechnical Analysis Report of Carmona, Makati City, Metro Manila",AWAITING CLARIFICATION,Education/Capstone,01/01/2018 - 02/03/2023,https://www.foi.gov.ph/requests/aglzfmVmb2ktcGhyHgsSB0NvbnRlbnQiEURQV0gtNDg4ODA0OTE3OTA3DA
DepEd,"February 03, 2023",CB-EPT 2022,SUCCESSFUL,Teacher's Ranking,09/05/2022 - 09/16/2022,https://www.foi.gov.ph/requests/aglzfmVmb2ktcGhyHwsSB0NvbnRlbnQiEkRlcEVkLTA3MzM0NzU1NTkxMAw
BFP,"February 03, 2023",Request for Age waiver certificates,PENDING,Application for age waiver for Fire Officer 1 at BFP,02/01/2023 - 02/03/2023,https://www.foi.gov.ph/requests/aglzfmVmb2ktcGhyHQsSB0NvbnRlbnQiEEJGUC0yOTQyOTcyMjg2NzYM
BFP,"February 03, 2023",Request for Age waiver certificates,PENDING,Application for age waiver for Fire Officer 1 at BFP,02/01/2023 - 02/03/2023,https://www.foi.gov.ph/requests/aglzfmVmb2ktcGhyHQsSB0NvbnRlbnQiEEJGUC0zODk3NDQ2MDIzNTIM
PSA,"February 03, 2023","The number of registered beverage establishment, coffee shops and milktea chains in Philippines",PENDING,Research and Development,01/01/2015 - 01/01/2021,https://www.foi.gov.ph/requests/aglzfmVmb2ktcGhyHQsSB0NvbnRlbnQiEFBTQS0xMjI0NDEyMDkxNzAM
NTC,"February 03, 2023",Please locate unknown numbers,PENDING,Tracking purpose due to inappropriate messages,02/01/2023 - 02/03/2023,https://www.foi.gov.ph/requests/aglzfmVmb2ktcGhyHQsSB0NvbnRlbnQiEE5UQy02NjIxMzc4NjM1NzgM
NBI,"February 03, 2023",Ask to locate unknown number,DENIED,Tracking purposes,02/01/2023 - 02/01/2023,https://www.foi.gov.ph/requests/aglzfmVmb2ktcGhyHQsSB0NvbnRlbnQiEE5CSS03MDI5NjIyNzUyOTIM
NBI,"February 03, 2023",margareth rillo jobless suspect for murder and JobStreet blacklist scammer with PNP criminal record.,DENIED,Police Arrest Blotter Report Permanent Blacklist Order and suspension of margareth rillo,01/01/2018 - 02/03/2023,https://www.foi.gov.ph/requests/aglzfmVmb2ktcGhyHQsSB0NvbnRlbnQiEE5CSS04NDkyNDY2MDA1ODQM
DSWD,"February 03, 2023",Number of VOLUNTARILY COMMITTED CHILDREN (surrendered) in NCR served by DSWD from 2016-2022,ACCEPTED,Research Purposes (THESIS),02/03/2023 - 02/03/2023,https://www.foi.gov.ph/requests/aglzfmVmb2ktcGhyHgsSB0NvbnRlbnQiEURTV0QtNjg1OTk1MDkzNTc1DA
BJMP,"February 03, 2023",Thesis purposes,ACCEPTED,Thesis purpose,12/01/2022 - 01/31/2023,https://www.foi.gov.ph/requests/aglzfmVmb2ktcGhyHgsSB0NvbnRlbnQiEUJKTVAtMzIyMDc2OTE1NDMxDA
NTC,"February 03, 2023",Stolen Phone,PENDING,Cannot be use any more,02/03/2023 - 02/03/2023,https://www.foi.gov.ph/requests/aglzfmVmb2ktcGhyHQsSB0NvbnRlbnQiEE5UQy0wNDEzNDg0OTI3NTIM
NBI,"February 03, 2023",Scammer,DENIED,Research and Refund,02/03/2023 - 02/03/2023,https://www.foi.gov.ph/requests/aglzfmVmb2ktcGhyHQsSB0NvbnRlbnQiEE5CSS01MDc5ODUzNzk4NTAM
CHED,"February 03, 2023",Higher Education Facilities Planning Manual (CHED Building Requirements for Colleges),PENDING,Research for Architectural Thesis,02/03/2023 - 02/03/2023,https://www.foi.gov.ph/requests/aglzfmVmb2ktcGhyHgsSB0NvbnRlbnQiEUNIRUQtMjcwOTE5MjQyMzIyDA
NTC,"February 03, 2023",GCASH HAS YET TO REFUND MY MONEY FROM CEBU PACIFIC,PENDING,Want assistance on how do we go about my refund process as Gcash is not helping me with this.,12/06/2022 - 02/03/2023,https://www.foi.gov.ph/requests/aglzfmVmb2ktcGhyHQsSB0NvbnRlbnQiEE5UQy0wMDc0NjE5MjkzMjgM
PRC,"February 03, 2023",LUPON NG MGA NARSES,PENDING,FOR EMPLOYMENT LOCAL AND ABROAD,08/07/2013 - 02/03/2023,https://www.foi.gov.ph/requests/aglzfmVmb2ktcGhyHQsSB0NvbnRlbnQiEFBSQy0wNjYzMDQyNjIwNTYM
BI,"February 03, 2023",BLO CASE OF MR. Huang He-Kai,PENDING,Remove BLO restrictions,12/01/2021 - 02/03/2023,https://www.foi.gov.ph/requests/aglzfmVmb2ktcGhyHAsSB0NvbnRlbnQiD0JJLTQ0NTE5ODc5NzcyNQw
DPWH,"February 03, 2023",Traffic Data of Streets along the Pasig River,REFERRED,Capstone Design Project (De La Salle University - Manila),01/21/2023 - 02/03/2023,https://www.foi.gov.ph/requests/aglzfmVmb2ktcGhyHgsSB0NvbnRlbnQiEURQV0gtNDM3NTczMzUxMDQ5DA
IC,"February 03, 2023",PRU IC Exam Result,ACCEPTED,PRU Branch Monitoring,01/21/2023 - 01/21/2023,https://www.foi.gov.ph/requests/aglzfmVmb2ktcGhyHAsSB0NvbnRlbnQiD0lDLTQ1NTM4MTUyNzg4Nww
BI,"February 03, 2023",Passport arrival sticker/ stamp,PENDING,For arrival stamp,12/09/2022 - 12/10/2022,https://www.foi.gov.ph/requests/aglzfmVmb2ktcGhyHAsSB0NvbnRlbnQiD0JJLTcwMTE4ODcyODgzOAw
NTC,"February 03, 2023",NATIONAL TELECOMMUNICATIONS COMMISSION LIST OF VALUE-ADDED SERVICE PROVIDERS WITH VALID CERTIFICATE,PENDING,Research and Verification,01/31/2022 - 12/31/2022,https://www.foi.gov.ph/requests/aglzfmVmb2ktcGhyHQsSB0NvbnRlbnQiEE5UQy0xMjI5ODU3ODQzMDIM
DENR,"February 03, 2023",Permits Required to Travel Furniture,DENIED,For personal information,02/03/2023 - 02/03/2023,https://www.foi.gov.ph/requests/aglzfmVmb2ktcGhyHgsSB0NvbnRlbnQiEURFTlItNDY0NTc3MTk2ODM4DA
NTC,"February 03, 2023",REQUEST TO RETRIEVE CELLPHONE,PENDING,Request to retrieve my mothers mobile number,02/03/2023 - 02/03/2023,https://www.foi.gov.ph/requests/aglzfmVmb2ktcGhyHQsSB0NvbnRlbnQiEE5UQy0zMTM5MDE2NzUzMzEM
PhilSCA,"February 03, 2023",Transcript of Records,PENDING,Enrollment,06/01/2014 - 10/31/2014,https://www.foi.gov.ph/requests/aglzfmVmb2ktcGhyIQsSB0NvbnRlbnQiFFBoaWxTQ0EtNDE3MzM1NTg1MTk3DA
NBI,"February 03, 2023",Got scammed out of 7k. Sent a broken laptop,DENIED,Scam Report,02/02/2023 - 02/03/2023,https://www.foi.gov.ph/requests/aglzfmVmb2ktcGhyHQsSB0NvbnRlbnQiEE5CSS0yODUyMTc2MDM4ODcM
TUP,"February 03, 2023",APPROVED SOP IN MONITORING AND PROCESSING THE DRA OF FACULTY IN THE COLLEGE OF LIBERAL ARTS (CLA),PENDING,Be provided copy of Approved SOP on Monitoring and Processing the DRA of Faculty in the CLA.,10/01/2022 - 02/03/2023,https://www.foi.gov.ph/requests/aglzfmVmb2ktcGhyHQsSB0NvbnRlbnQiEFRVUC0yMjIwOTcyOTk2NDYM
SEC,"February 03, 2023",Top 1000 Corporations (2010-2022),ACCEPTED,Research and Development,02/03/2023 - 02/03/2023,https://www.foi.gov.ph/requests/aglzfmVmb2ktcGhyHQsSB0NvbnRlbnQiEFNFQy0yMjAzOTkzMDU2NDUM
DPWH,"February 03, 2023",Topographic and Hydrographic Data of Barangays Olympia and Vergara (Makati-Mandaluyong),REFERRED,Capstone Design Project (De La Salle University-Manila),01/21/2023 - 02/03/2023,https://www.foi.gov.ph/requests/aglzfmVmb2ktcGhyHgsSB0NvbnRlbnQiEURQV0gtNDM3MjI4MjgwMDQ0DA
NTC,"February 03, 2023",Lost/Stolen Phone,PENDING,To trace my lost/stolen phone and retrieve it.,02/02/2023 - 02/03/2023,https://www.foi.gov.ph/requests/aglzfmVmb2ktcGhyHQsSB0NvbnRlbnQiEE5UQy00MDY4MDg4NjQ1NTYM
DOH,"February 03, 2023",Vaccination Certificate Update,SUCCESSFUL,Travel requirements,08/16/2021 - 09/09/2022,https://www.foi.gov.ph/requests/aglzfmVmb2ktcGhyHQsSB0NvbnRlbnQiEERPSC01OTg2MDc2MjQ3MDcM
DENR,"February 03, 2023",Various Data of Pampanga River,REFERRED,Civil Engineering Capstone Design (Thesis),02/03/2023 - 02/03/2023,https://www.foi.gov.ph/requests/aglzfmVmb2ktcGhyHgsSB0NvbnRlbnQiEURFTlItNDA4NTIwNjcxMTM5DA
DOLE,"February 03, 2023",DO174 Exemption Certificate,PENDING,Requirement as a Vendor in a BPO Company,02/01/2023 - 02/02/2023,https://www.foi.gov.ph/requests/aglzfmVmb2ktcGhyHgsSB0NvbnRlbnQiEURPTEUtNjg5MTQ5MzQyNTM1DA
PAGASA,"February 03, 2023",Aurora and Quezon weather/climatological data,AWAITING CLARIFICATION,Undergraduate thesis,09/01/2022 - 09/30/2022,https://www.foi.gov.ph/requests/aglzfmVmb2ktcGhyIAsSB0NvbnRlbnQiE1BBR0FTQS0yMDM3OTk1NjIzNTkM
DAR,"February 03, 2023",DARAB Order for Ejectment of Agricultural Lessees/Share Tenants,PENDING,Research Purposes Only,02/03/2023 - 02/03/2023,https://www.foi.gov.ph/requests/aglzfmVmb2ktcGhyHQsSB0NvbnRlbnQiEERBUi0xNjM2ODY5MTgwODUM
NTC,"February 03, 2023",block phone,PENDING,update me and block the phone,02/03/2023 - 02/03/2023,https://www.foi.gov.ph/requests/aglzfmVmb2ktcGhyHQsSB0NvbnRlbnQiEE5UQy02NDg4MTI1ODQ1NTgM
MGB,"February 03, 2023",Sipocot Topographic Map and Hydrographic Survey Data,REFERRED,"Capstone Design Project (CDP), Undergraduate Research",01/01/2021 - 01/01/2023,https://www.foi.gov.ph/requests/aglzfmVmb2ktcGhyHQsSB0NvbnRlbnQiEE1HQi0wNTE5OTQ4OTk3NjgM
DENR,"February 03, 2023",DENR Eviction cases,REFERRED,"The purpose of this request is to ensure the appropriate use of templates, if any, in initiating the",02/03/2018 - 02/03/2023,https://www.foi.gov.ph/requests/aglzfmVmb2ktcGhyHgsSB0NvbnRlbnQiEURFTlItNjM5Njc4OTc5MjE0DA
OMB,"February 03, 2023",renewal of license as dealer storage devices,PENDING,Renewal of OMB license as dealer storage devices,02/17/2022 - 02/17/2022,https://www.foi.gov.ph/requests/aglzfmVmb2ktcGhyHQsSB0NvbnRlbnQiEE9NQi0xMzM2Mjg1MjMxMzIM
FNRI,"February 03, 2023",Bougainvillea flower,PENDING,Research project,01/31/2023 - 02/03/2023,https://www.foi.gov.ph/requests/aglzfmVmb2ktcGhyHgsSB0NvbnRlbnQiEUZOUkktMzgzNzAwNDg5ODMwDA
SSS,"February 03, 2023",UNABLE TO CONFIRM RECEIPT OF MY SICKNESS BENEFIT,PENDING,FOR ME TO RECEIVE MY SSS SICKNESS BENEFIT,01/01/2023 - 01/30/2023,https://www.foi.gov.ph/requests/aglzfmVmb2ktcGhyHQsSB0NvbnRlbnQiEFNTUy01Mzk3NjMzNDY3NjIM
SEC,"February 03, 2023",Complaint for unfair practices of OkPeso,SUCCESSFUL,Complaint,01/11/2023 - 02/03/2023,https://www.foi.gov.ph/requests/aglzfmVmb2ktcGhyHQsSB0NvbnRlbnQiEFNFQy0wMzcxODUyNzc3NzUM
DOE,"February 03, 2023",Metro Manila Energy Consumption,PENDING,Presentation to the funder promoting Renewable Energy (Solar).,02/03/2023 - 02/03/2023,https://www.foi.gov.ph/requests/aglzfmVmb2ktcGhyHQsSB0NvbnRlbnQiEERPRS02NDEzMzUxNDMyMzUM
NTC,"February 03, 2023",NTC Permit,PENDING,FedEx Custom Clearance,02/03/2023 - 02/03/2023,https://www.foi.gov.ph/requests/aglzfmVmb2ktcGhyHQsSB0NvbnRlbnQiEE5UQy03OTk4OTYxODgyMDQM
IC,"February 03, 2023",List of Licensed Financial Advisors,DENIED,Undergraduate thesis of a 3rd yr BSIE student,01/01/2020 - 02/02/2023,https://www.foi.gov.ph/requests/aglzfmVmb2ktcGhyHAsSB0NvbnRlbnQiD0lDLTY5ODE3MDk2MDEwNAw
PSA,"February 03, 2023",Gross regional domestic product year 2022,PENDING,Research,01/01/2021 - 12/31/2022,https://www.foi.gov.ph/requests/aglzfmVmb2ktcGhyHQsSB0NvbnRlbnQiEFBTQS03ODcyMzQzNjAzOTgM
NCMF,"February 03, 2023",Age waiver for converted to islam,PENDING,Bjmp application.,01/04/2023 - 01/04/2023,https://www.foi.gov.ph/requests/aglzfmVmb2ktcGhyHgsSB0NvbnRlbnQiEU5DTUYtNzg3ODE2NTAzOTI4DA
PRC,"February 03, 2023",PRC ID RENEWAL AND CHANGE LAST NAME,PENDING,PRC ID Renewal and Change Last Name,01/03/2023 - 02/03/2023,https://www.foi.gov.ph/requests/aglzfmVmb2ktcGhyHQsSB0NvbnRlbnQiEFBSQy01OTEwOTg5NTM1MjUM
