agency,date,title,status,purpose,period_covered,link
PSA,"May 17, 2023",PhlysysTracking reference number,PARTIALLY SUCCESSFUL,For my national ID,11/09/2022 - 11/09/2022,https://www.foi.gov.ph/requests/aglzfmVmb2ktcGhyHQsSB0NvbnRlbnQiEFBTQS01MjE0MjEyMjk0OTMM
DOF,"May 17, 2023",Manila's Financial Statement for the First Quarter of 2023,DENIED,journalism article (news analysis),01/01/2023 - 03/31/2023,https://www.foi.gov.ph/requests/aglzfmVmb2ktcGhyHQsSB0NvbnRlbnQiEERPRi02NDgzNTY4NTc1NDUM
DA,"May 17, 2023",Composition of Committee on Anti- Red Tape (CART),SUCCESSFUL,Updating of Database for CART,05/17/2023 - 05/17/2023,https://www.foi.gov.ph/requests/aglzfmVmb2ktcGhyHAsSB0NvbnRlbnQiD0RBLTQ0MTYyOTAwMjczNww
DBM,"May 17, 2023",Composition of Committee on Anti-Red Tape Authority (CART),DENIED,Updating of Database for CART,05/17/2023 - 05/17/2023,https://www.foi.gov.ph/requests/aglzfmVmb2ktcGhyHQsSB0NvbnRlbnQiEERCTS00OTk2NTU3NTY4MzkM
SEC,"May 17, 2023",Collateral Loans/Lending in the Philippines,ACCEPTED,Research,01/01/2018 - 04/30/2023,https://www.foi.gov.ph/requests/aglzfmVmb2ktcGhyHQsSB0NvbnRlbnQiEFNFQy0zMjA5MjQ0NTcwMDIM
DOH,"May 17, 2023",VaxCert No Record Found,SUCCESSFUL,Vaccination Certificate Follow-up,11/10/2021 - 05/17/2023,https://www.foi.gov.ph/requests/aglzfmVmb2ktcGhyHQsSB0NvbnRlbnQiEERPSC04MTE0NjMyNzAxMzIM
NTC,"May 17, 2023",Trace the number,SUCCESSFUL,Upang maibalik ang nawalang pera,04/02/2023 - 05/17/2023,https://www.foi.gov.ph/requests/aglzfmVmb2ktcGhyHQsSB0NvbnRlbnQiEE5UQy05NDc1OTAzODU2NzcM
MTRCB,"May 17, 2023","Films, TV Shows, for Children",PENDING,Research,01/01/2018 - 04/30/2023,https://www.foi.gov.ph/requests/aglzfmVmb2ktcGhyHwsSB0NvbnRlbnQiEk1UUkNCLTU4MDk1NjI1MDE0MQw
MLWD,"May 17, 2023","Water Supply and Distribution Layout in Padre Garcia, Batangas",PENDING,Research and Development,05/17/2023 - 05/17/2023,https://www.foi.gov.ph/requests/aglzfmVmb2ktcGhyHgsSB0NvbnRlbnQiEU1MV0QtNDY5Njg0MTYyOTM4DA
NTC,"May 17, 2023",Block Device And Sim,PARTIALLY SUCCESSFUL,To avoid robbers use my device as well as my number associated in it.,05/15/2023 - 05/17/2023,https://www.foi.gov.ph/requests/aglzfmVmb2ktcGhyHQsSB0NvbnRlbnQiEE5UQy04OTcyNDYyMDM3NTEM
DOH,"May 17, 2023",Covid booster vaccine,SUCCESSFUL,For abroad,04/20/2023 - 04/28/2023,https://www.foi.gov.ph/requests/aglzfmVmb2ktcGhyHQsSB0NvbnRlbnQiEERPSC04NjEyMjExNjgwOTYM
BIR,"May 17, 2023",1701Q for the year 2022,ACCEPTED,Tourist visa application,01/01/2022 - 12/31/2022,https://www.foi.gov.ph/requests/aglzfmVmb2ktcGhyHQsSB0NvbnRlbnQiEEJJUi0xNTI3NjM4MjY3MzIM
DA,"May 17, 2023","Shapefile of Production of Crops, Poultry, and Livestock in San Leonardo, Nueva Ecija",SUCCESSFUL,School Project,01/01/2019 - 12/31/2020,https://www.foi.gov.ph/requests/aglzfmVmb2ktcGhyHAsSB0NvbnRlbnQiD0RBLTc3NDE5MjMyNzc2MAw
DTI,"May 17, 2023","The list of DTI-registered MSMEs in Brgy. San Antonio, Paranaque City",ACCEPTED,Research and Development,01/01/2022 - 12/31/2022,https://www.foi.gov.ph/requests/aglzfmVmb2ktcGhyHQsSB0NvbnRlbnQiEERUSS01NTY5MTQwMjM1NTcM
NBI,"May 17, 2023","SCAM ON THE FB PAGE NAME: Gamewerks Gadget PH, OWNER NAME: LITO B. PASCUL",PENDING,Public Announcement,05/14/2023 - 05/17/2023,https://www.foi.gov.ph/requests/aglzfmVmb2ktcGhyHQsSB0NvbnRlbnQiEE5CSS0yMzUwNDM5NjUxNzcM
CHED,"May 17, 2023",REQUEST FOR NSTP SERIAL NUMBER,PENDING,Personal Document File,03/01/2012 - 03/30/2016,https://www.foi.gov.ph/requests/aglzfmVmb2ktcGhyHgsSB0NvbnRlbnQiEUNIRUQtMjA2ODMxOTQ1NzUzDA
FDCP,"May 17, 2023",Film Training Institutes,PENDING,Architectural Thesis,04/29/2020 - 04/29/2023,https://www.foi.gov.ph/requests/aglzfmVmb2ktcGhyHgsSB0NvbnRlbnQiEUZEQ1AtNzY3NDMyMjE1MjA3DA
BSWM,"May 17, 2023","Shapefile of Production of Crops, Poultry, and Livestock in San Leonardo, Nueva Ecija",REFERRED,School Project,01/01/2019 - 12/31/2020,https://www.foi.gov.ph/requests/aglzfmVmb2ktcGhyHgsSB0NvbnRlbnQiEUJTV00tMjU5NzMxNzI1MTEwDA
PSA,"May 17, 2023",Latest Statistic of informal business in the Philippines,PENDING,Research,01/01/2020 - 01/01/2022,https://www.foi.gov.ph/requests/aglzfmVmb2ktcGhyHQsSB0NvbnRlbnQiEFBTQS02OTE5OTc5OTEyMzUM
NTC,"May 17, 2023",BLACKMAIL,SUCCESSFUL,URGENT 😭,05/16/2023 - 05/17/2023,https://www.foi.gov.ph/requests/aglzfmVmb2ktcGhyHQsSB0NvbnRlbnQiEE5UQy05NjM5NDU0ODM2MTAM
PSA,"May 17, 2023",Ivan Cerbo Child,PARTIALLY SUCCESSFUL,Educational purpose,09/01/2021 - 05/16/2023,https://www.foi.gov.ph/requests/aglzfmVmb2ktcGhyHQsSB0NvbnRlbnQiEFBTQS05NjkxMDU3MDY0NjYM
BIR,"May 17, 2023",The latest Income Tax Return of parents and Bir form 2316 for fixed income ew,SUCCESSFUL,SCHOLAR,12/01/2022 - 04/10/2023,https://www.foi.gov.ph/requests/aglzfmVmb2ktcGhyHQsSB0NvbnRlbnQiEEJJUi0xMTkzOTE1NDY4MTEM
DepEd,"May 17, 2023",Request Original Copy of Highschool Diploma,SUCCESSFUL,For License to Exercise Scty. Professional (LESP) and legal purposes,03/22/2000 - 03/22/2002,https://www.foi.gov.ph/requests/aglzfmVmb2ktcGhyHwsSB0NvbnRlbnQiEkRlcEVkLTYzNDc2MTE0NjA4Nww
LTO,"May 17, 2023",Total of registered vehicle 2Wheels and 4 Wheels in Central Luzon and Nort Luzon,PENDING,For research pusposes,01/01/2020 - 04/30/2023,https://www.foi.gov.ph/requests/aglzfmVmb2ktcGhyHQsSB0NvbnRlbnQiEExUTy03NzAwMTU4OTU2NzQM
DBM,"May 17, 2023",Manila's financial statement for the first quarter of 2023,REFERRED,For journalism article (news analysis),01/01/2023 - 03/31/2023,https://www.foi.gov.ph/requests/aglzfmVmb2ktcGhyHQsSB0NvbnRlbnQiEERCTS03MDQwNzkzNDI4NTYM
NTC,"May 17, 2023",Block Sim Card,PARTIALLY SUCCESSFUL,To stop this No. from scamming,05/17/2023 - 05/17/2023,https://www.foi.gov.ph/requests/aglzfmVmb2ktcGhyHQsSB0NvbnRlbnQiEE5UQy05OTg3MDEzMzY1MzIM
OWWA,"May 17, 2023",The number of OFWs in Looc Calamba City,SUCCESSFUL,For Thesis,01/20/2016 - 01/20/2016,https://www.foi.gov.ph/requests/aglzfmVmb2ktcGhyHgsSB0NvbnRlbnQiEU9XV0EtNjUwNjMxODg0NDkzDA
DOH,"May 17, 2023",Philippine Mental Health Statistics - NCMH,PROCESSING,Capstone Design Project -Thesis,05/17/2023 - 05/17/2023,https://www.foi.gov.ph/requests/aglzfmVmb2ktcGhyHQsSB0NvbnRlbnQiEERPSC05NzQ1NDg3MTI4NTIM
MMDA,"May 17, 2023",Integrated Solid Waste Disposal Facility,ACCEPTED,Architectural Thesis,05/17/2023 - 05/17/2023,https://www.foi.gov.ph/requests/aglzfmVmb2ktcGhyHgsSB0NvbnRlbnQiEU1NREEtOTc5MDI4MDY5NTg1DA
MMDA,"May 17, 2023",Number of Daily commuters,REFERRED,Feasibility Study,05/17/2023 - 05/17/2023,https://www.foi.gov.ph/requests/aglzfmVmb2ktcGhyHgsSB0NvbnRlbnQiEU1NREEtMDk2MTkxODI2NTkwDA
DepEd,"May 17, 2023",NSAT result,AWAITING CLARIFICATION,Requirement to attend College School,06/01/1993 - 06/19/1994,https://www.foi.gov.ph/requests/aglzfmVmb2ktcGhyHwsSB0NvbnRlbnQiEkRlcEVkLTE4Njc2MjIwMTM2Mgw
DA,"May 17, 2023",Annual Number of Vegetable Farms in Batangas Probince,SUCCESSFUL,Feasibility Study,05/17/2013 - 05/17/2023,https://www.foi.gov.ph/requests/aglzfmVmb2ktcGhyHAsSB0NvbnRlbnQiD0RBLTc0MDE4NDUzMTQwMww
MinDA,"May 17, 2023",Agreement on hydrogen energy investments in Zamboanga Sibugay,PENDING,"Energy research, public policy",05/05/2023 - 05/05/2023,https://www.foi.gov.ph/requests/aglzfmVmb2ktcGhyHwsSB0NvbnRlbnQiEk1pbkRBLTUxMDYwNzM2ODA0Ngw
DSWD,"May 17, 2023","Reported number of cases of the victim of violence against men, women and children",PENDING,Architectural thesis,01/01/2020 - 12/31/2022,https://www.foi.gov.ph/requests/aglzfmVmb2ktcGhyHgsSB0NvbnRlbnQiEURTV0QtNTc4NzcyNzQ3NDk5DA
NTC,"May 17, 2023",BLOCK SIM CARD,PARTIALLY SUCCESSFUL,Block sim card,05/01/2023 - 05/17/2023,https://www.foi.gov.ph/requests/aglzfmVmb2ktcGhyHQsSB0NvbnRlbnQiEE5UQy01MDk5MDA0MDEzMjgM
PSA,"May 17, 2023",Population of Baguio City and Estimated Coffee Drinkers,PENDING,For thesis reference of data and information,01/01/2018 - 12/31/2022,https://www.foi.gov.ph/requests/aglzfmVmb2ktcGhyHQsSB0NvbnRlbnQiEFBTQS0zODk0MDMyOTE0MjEM
DOH,"May 17, 2023","OCA and HEA from March 2022-December 31, 2022",SUCCESSFUL,For follow up of delayed OCA and HEA,03/01/2022 - 12/31/2022,https://www.foi.gov.ph/requests/aglzfmVmb2ktcGhyHQsSB0NvbnRlbnQiEERPSC01MDQ5OTY4NzEzNzQM
DILG,"May 17, 2023",The technological specifics of the hydrogen power plant to be built in Zamboanga Sibugay,PENDING,Energy research,01/01/2023 - 04/19/2023,https://www.foi.gov.ph/requests/aglzfmVmb2ktcGhyHgsSB0NvbnRlbnQiEURJTEctOTMwMjc4NTE2NDY2DA
DENR EMB,"May 17, 2023",ENVIRONMENTAL IMPACT STATEMENT OF BATANGAS CITY GRAND TERMINAL,PENDING,Research Development (Academic Purposes),05/16/2023 - 05/17/2023,https://www.foi.gov.ph/requests/aglzfmVmb2ktcGhyIQsSB0NvbnRlbnQiFERFTlJFTUItOTMxNjY1MzIwMDQ5DA
DBM,"May 17, 2023",Internal Revenue Allotment for Specified LGU units,SUCCESSFUL,Research and Assessment,01/20/2022 - 05/17/2023,https://www.foi.gov.ph/requests/aglzfmVmb2ktcGhyHQsSB0NvbnRlbnQiEERCTS0yNTYzMTg2MDY2OTYM
GSIS,"May 17, 2023","Kindly requesting for list of foreclosed property at San Mateo, Rizal",PENDING,Purchase of Property,05/17/2023 - 05/17/2023,https://www.foi.gov.ph/requests/aglzfmVmb2ktcGhyHgsSB0NvbnRlbnQiEUdTSVMtNTI1MjQwMzU2MDIzDA
DOH,"May 17, 2023",. Total Number of patients/reported cases with Mental Disorder (all disorders) including anxiety and,PROCESSING,Architectural Thesis,05/03/2023 - 05/17/2023,https://www.foi.gov.ph/requests/aglzfmVmb2ktcGhyHQsSB0NvbnRlbnQiEERPSC01MDc2NjA0NjM5NTkM
HDMF,"May 17, 2023",Land utilization and productivity for all. Is this part of government?,PENDING,Information and legality,05/17/2023 - 05/17/2023,https://www.foi.gov.ph/requests/aglzfmVmb2ktcGhyHgsSB0NvbnRlbnQiEUhETUYtMTM3NzYxMDM4MjI5DA
BI,"May 17, 2023",Hold departure order,PENDING,I wish to travel,12/17/2022 - 05/17/2023,https://www.foi.gov.ph/requests/aglzfmVmb2ktcGhyHAsSB0NvbnRlbnQiD0JJLTE2NDk5OTExMTc1MAw
DOH,"May 17, 2023","OCA and HEA from March 2022-December 31, 2022",SUCCESSFUL,Follow up for OCA and HEA,03/01/2022 - 12/31/2022,https://www.foi.gov.ph/requests/aglzfmVmb2ktcGhyHQsSB0NvbnRlbnQiEERPSC02OTU3MTA5MDQ3MDQM
ITDI,"May 17, 2023",Weighing scale calibration standard,SUCCESSFUL,to establish accuracy calibration standard of weighing scale,01/20/2022 - 05/16/2023,https://www.foi.gov.ph/requests/aglzfmVmb2ktcGhyHgsSB0NvbnRlbnQiEUlUREktMzY0MTk2MjczNjEzDA
NYC,"May 17, 2023",Out of School Youth,ACCEPTED,Research,01/01/2014 - 12/31/2022,https://www.foi.gov.ph/requests/aglzfmVmb2ktcGhyHQsSB0NvbnRlbnQiEE5ZQy0xNTM4NTQ0ODA0MjcM
DepEd,"May 17, 2023",Out of School Youth,AWAITING CLARIFICATION,Research,01/01/2013 - 12/31/2022,https://www.foi.gov.ph/requests/aglzfmVmb2ktcGhyHwsSB0NvbnRlbnQiEkRlcEVkLTAxNjMzNzExNzE0MQw
PSA,"May 17, 2023",Out of School Youth,PENDING,Research,01/01/2014 - 12/31/2022,https://www.foi.gov.ph/requests/aglzfmVmb2ktcGhyHQsSB0NvbnRlbnQiEFBTQS04ODAxNDQwODAzMzkM
DOH,"May 17, 2023",Update Vaccination Certificate,SUCCESSFUL,Travel to Singapore,08/18/2022 - 08/18/2022,https://www.foi.gov.ph/requests/aglzfmVmb2ktcGhyHQsSB0NvbnRlbnQiEERPSC0zMDgyNDIxNzMzNjEM
NBI,"May 17, 2023",Estafa or Criminal Case Verification,PENDING,To clear my name if necessary,07/01/2022 - 05/17/2023,https://www.foi.gov.ph/requests/aglzfmVmb2ktcGhyHQsSB0NvbnRlbnQiEE5CSS0xNzQ1MTc1ODE3NzUM
DOH,"May 17, 2023",vaccination certificate,SUCCESSFUL,vaccination certificate update request cancellation,05/17/2023 - 05/17/2023,https://www.foi.gov.ph/requests/aglzfmVmb2ktcGhyHQsSB0NvbnRlbnQiEERPSC05MzU5MzI5NTYwMTAM
NTC,"May 17, 2023",Updated list of Telecommunications Corporations (Franchise Holders) under NTC,PENDING,Research,01/01/1980 - 05/17/2023,https://www.foi.gov.ph/requests/aglzfmVmb2ktcGhyHQsSB0NvbnRlbnQiEE5UQy00NDI4MTA3Nzc0NjMM
CDA,"May 17, 2023",Five Years Asset Size and Value from 2017 to 2022 of Registered Cooperatives in the Philippines,PENDING,Research and Development,01/01/2017 - 12/31/2022,https://www.foi.gov.ph/requests/aglzfmVmb2ktcGhyHQsSB0NvbnRlbnQiEENEQS0yMDE3NTA2MTU4NTEM
NTC,"May 17, 2023",UNLAWFUL PURCHASE OF CELLULAR PHONE,PARTIALLY SUCCESSFUL,Disable cellphone purchased through a stolen credit card,05/12/2023 - 05/17/2023,https://www.foi.gov.ph/requests/aglzfmVmb2ktcGhyHQsSB0NvbnRlbnQiEE5UQy04NzQ4NzA4MzEzMTEM
DOH,"May 17, 2023",Master List of All Hospitals,PARTIALLY SUCCESSFUL,Research and development,01/01/2022 - 12/31/2022,https://www.foi.gov.ph/requests/aglzfmVmb2ktcGhyHQsSB0NvbnRlbnQiEERPSC04MjE2NjA4NjM2NzYM
BIR,"May 17, 2023",Requirements to support 0% VAT entitlement,SUCCESSFUL,research purposes,05/17/2023 - 05/17/2023,https://www.foi.gov.ph/requests/aglzfmVmb2ktcGhyHQsSB0NvbnRlbnQiEEJJUi0xMjU3Mzc5OTI0NDAM
NTC,"May 17, 2023",WRONG CASHED IN NUMBER FOR GCASH VIA 7/11 KIOSK MACHINE,DENIED,para mabawi ang funds/ money na cash in na ko sa wrong number,05/16/2023 - 05/17/2023,https://www.foi.gov.ph/requests/aglzfmVmb2ktcGhyHQsSB0NvbnRlbnQiEE5UQy0zMTM5MTAzNDQ1MDgM
BSWM,"May 17, 2023",Soil Type Agricultural Suitability and Soil Characteristics,PROCESSING,Updating of Comprehensive Land Use Plan,01/01/2016 - 05/17/2023,https://www.foi.gov.ph/requests/aglzfmVmb2ktcGhyHgsSB0NvbnRlbnQiEUJTV00tMzkwOTExMjEyNTk5DA
DOH,"May 17, 2023",The case number of diseases of children in Bicol Region and number of Pediatrician in Bicol Region,PROCESSING,Architectural Thesis: A proposed Bicol Pediatric Hospital,01/01/2018 - 01/01/2022,https://www.foi.gov.ph/requests/aglzfmVmb2ktcGhyHQsSB0NvbnRlbnQiEERPSC0zNzQzODQ1NjcyMjQM
PSA,"May 17, 2023",Children's Population and number of cases of children's diseases in Bicol,SUCCESSFUL,Architectural Thesis: Bicol Pediatric Hospital,01/01/2018 - 01/01/2023,https://www.foi.gov.ph/requests/aglzfmVmb2ktcGhyHQsSB0NvbnRlbnQiEFBTQS0xMTIwODQ3MzM5MjcM
NBI,"May 17, 2023",Complaint against OLA,PENDING,To take necessary action on these OLA and to stop operating,05/17/2023 - 05/17/2023,https://www.foi.gov.ph/requests/aglzfmVmb2ktcGhyHQsSB0NvbnRlbnQiEE5CSS04Njc2MjI2OTE4MDQM
NEDA,"May 17, 2023",Pampanga Megalopolis Plan,DENIED,Academic purposes,05/17/2017 - 05/17/2023,https://www.foi.gov.ph/requests/aglzfmVmb2ktcGhyHgsSB0NvbnRlbnQiEU5FREEtODMxNDI1Mzk2MDAxDA
PNP,"May 17, 2023",Electoral Violence sex-disaggregated data (men and women) from 2013 elections to 2023 elections,ACCEPTED,Master's Thesis Research,01/01/2013 - 05/17/2023,https://www.foi.gov.ph/requests/aglzfmVmb2ktcGhyHQsSB0NvbnRlbnQiEFBOUC00NzE3MzEyNjIxMDUM
PSA,"May 17, 2023",Population by age and gender per barangay,PARTIALLY SUCCESSFUL,research,12/31/2020 - 12/31/2020,https://www.foi.gov.ph/requests/aglzfmVmb2ktcGhyHQsSB0NvbnRlbnQiEFBTQS01MTgwNjM4MjM3MDUM
DOH,"May 17, 2023",Additional Data for College Thesis,PROCESSING,College Thesis,01/30/2020 - 03/29/2023,https://www.foi.gov.ph/requests/aglzfmVmb2ktcGhyHQsSB0NvbnRlbnQiEERPSC00NTUwNTUxMjYyMzYM
DILG,"May 17, 2023",DILG Memorandum Circular 2000-117,PENDING,Research and records,08/30/2000 - 09/23/2000,https://www.foi.gov.ph/requests/aglzfmVmb2ktcGhyHgsSB0NvbnRlbnQiEURJTEctNzQyMTI2NzE3MzMxDA
DA,"May 17, 2023","Shapefile of Production of Crops, Poultry, and Livestock in San Leonardo, Nueva Ecija",REFERRED,School Project,01/01/2019 - 12/31/2020,https://www.foi.gov.ph/requests/aglzfmVmb2ktcGhyHAsSB0NvbnRlbnQiD0RBLTc0Nzg5NDQ0Nzg4MQw
BSWM,"May 17, 2023",STW and SPIS that uses georesisitivity in site location in Camarines Sur,PROCESSING,Thesis regarding STW and SPIS which uses georesistivity method in site locating,05/16/2023 - 05/16/2023,https://www.foi.gov.ph/requests/aglzfmVmb2ktcGhyHgsSB0NvbnRlbnQiEUJTV00tNzU3MjQzNDYyMjY5DA
DOH,"May 17, 2023",Number of cases of Diabetes Mellitus Type 2 in Cebu City from 2020-2023,PROCESSING,Research,01/01/2020 - 05/17/2023,https://www.foi.gov.ph/requests/aglzfmVmb2ktcGhyHQsSB0NvbnRlbnQiEERPSC0yMjIzNzkyNDcwMzQM
DOH,"May 17, 2023",The total number of cases of diabetes mellitus type 2 from 2022-2023 in Cebu City,PROCESSING,Research,01/01/2022 - 05/17/2023,https://www.foi.gov.ph/requests/aglzfmVmb2ktcGhyHQsSB0NvbnRlbnQiEERPSC03MjA5NDc3Mzg3NDMM
NTC,"May 17, 2023",BLACKMAIL,PARTIALLY SUCCESSFUL,URGENT 😭,05/16/2023 - 05/17/2023,https://www.foi.gov.ph/requests/aglzfmVmb2ktcGhyHQsSB0NvbnRlbnQiEE5UQy02Nzg0MzAyNzA2NjgM
LTO,"May 17, 2023",Conductor's License Serial Number,DENIED,Driver's License Renewal,05/17/2023 - 05/17/2023,https://www.foi.gov.ph/requests/aglzfmVmb2ktcGhyHQsSB0NvbnRlbnQiEExUTy0xMjEyNjY5MTE2ODcM
BI,"May 17, 2023",DFA APOSTILLE BUREAU OF IMMIGRATION WITH TRAVEL HISTORY,PENDING,QUATAR POLICE CLEARANCE,04/02/2016 - 02/29/2020,https://www.foi.gov.ph/requests/aglzfmVmb2ktcGhyHAsSB0NvbnRlbnQiD0JJLTk0ODIwOTU2OTA5OQw
CHED,"May 17, 2023",Form 137,PENDING,For birth certificate correction requirements and for employment,06/16/2008 - 04/01/2011,https://www.foi.gov.ph/requests/aglzfmVmb2ktcGhyHgsSB0NvbnRlbnQiEUNIRUQtNzk3NzgyNjAzNjE3DA
DENR EMB,"May 17, 2023",INQUIRY REGARDING CONSTRUCTION AND DEMOLITON CONCRETE WASTE,PENDING,Research and Development,05/16/2023 - 05/16/2023,https://www.foi.gov.ph/requests/aglzfmVmb2ktcGhyIQsSB0NvbnRlbnQiFERFTlJFTUItNTQwMjYzNzg3MDc3DA
CHED,"May 17, 2023",Transcript of Record,PENDING,For birth certificate correction and for employment,06/16/2014 - 04/14/2018,https://www.foi.gov.ph/requests/aglzfmVmb2ktcGhyHgsSB0NvbnRlbnQiEUNIRUQtMjgzMTU5Njg4NzA3DA
BIR,"May 17, 2023",Income Tax Return,AWAITING CLARIFICATION,application for graduate studies scholarship.,05/01/2022 - 05/17/2023,https://www.foi.gov.ph/requests/aglzfmVmb2ktcGhyHQsSB0NvbnRlbnQiEEJJUi0yMjM2MDYyOTUyMTgM
NBI,"May 17, 2023",Criminal Case Verification (Estafa),PENDING,To take necessary action if needed,07/01/2022 - 07/01/2022,https://www.foi.gov.ph/requests/aglzfmVmb2ktcGhyHQsSB0NvbnRlbnQiEE5CSS05MjA0MDQ1MzE3NDYM
NTC,"May 17, 2023",BLACKMAIL,PARTIALLY SUCCESSFUL,URGENT 😭,05/16/2023 - 05/17/2023,https://www.foi.gov.ph/requests/aglzfmVmb2ktcGhyHQsSB0NvbnRlbnQiEE5UQy01NDc0NjY2MzEzODEM
DOH,"May 17, 2023",Number of vaccinated and unvaccinated covid cases for 2023,PROCESSING,For transparency purposes,03/15/2021 - 05/17/2023,https://www.foi.gov.ph/requests/aglzfmVmb2ktcGhyHQsSB0NvbnRlbnQiEERPSC00NTI3MTQ1MDAwODAM
CLSU,"May 17, 2023","DATA ON PRODUCTION OF CROPS, POULTRY, LIVESTOCK AND FISHERIES IN GUIMBA, NUEVA ECIJA",ACCEPTED,Research,01/01/2022 - 01/01/2023,https://www.foi.gov.ph/requests/aglzfmVmb2ktcGhyHgsSB0NvbnRlbnQiEUNMU1UtMDUwMDM2MjQwMjI1DA
DOH,"May 17, 2023",Lost Vaccination Card,SUCCESSFUL,Travel Purpose,05/17/2023 - 05/17/2023,https://www.foi.gov.ph/requests/aglzfmVmb2ktcGhyHQsSB0NvbnRlbnQiEERPSC03NjAyOTI0MDU4MTYM
DepEd,"May 17, 2023",Scholastic Record,DENIED,Application of University,05/15/2023 - 05/15/2023,https://www.foi.gov.ph/requests/aglzfmVmb2ktcGhyHwsSB0NvbnRlbnQiEkRlcEVkLTkwNDQ2ODY3MTMxMgw
LMB,"May 17, 2023",Shapefile of Region-IVA municipalities,ACCEPTED,Research,05/17/2023 - 05/17/2023,https://www.foi.gov.ph/requests/aglzfmVmb2ktcGhyIQsSB0NvbnRlbnQiFERFTlJMTUItOTM2NjU0ODA3NzE3DA
RSU,"May 17, 2023",Beema Bamboos,PENDING,Research,01/01/2013 - 12/31/2022,https://www.foi.gov.ph/requests/aglzfmVmb2ktcGhyHQsSB0NvbnRlbnQiEFJTVS0wODE4NzAyMDg1NTUM
NTC,"May 17, 2023",Block or Trace my Stolen phone,PARTIALLY SUCCESSFUL,To block or Trace my phone,11/09/2022 - 05/09/2023,https://www.foi.gov.ph/requests/aglzfmVmb2ktcGhyHQsSB0NvbnRlbnQiEE5UQy0xNjAyNDY0NDc4ODAM
DA,"May 17, 2023",Biofertilizer options under MO 32 s. 2023,PENDING,Research,01/01/2023 - 05/17/2023,https://www.foi.gov.ph/requests/aglzfmVmb2ktcGhyHAsSB0NvbnRlbnQiD0RBLTgyNzE3NjcxNDk4MAw
DA,"May 17, 2023","Data on the Production of Crops, Poultry, and Livestock of Llanera, Nueva Ecija",SUCCESSFUL,Research,01/01/2022 - 12/30/2022,https://www.foi.gov.ph/requests/aglzfmVmb2ktcGhyHAsSB0NvbnRlbnQiD0RBLTUxNjAyNTU5NDczNgw
NHCP,"May 17, 2023",Carriedo Water System Layout,SUCCESSFUL,Research under the University of the Philippines Diliman,05/17/1800 - 05/17/2023,https://www.foi.gov.ph/requests/aglzfmVmb2ktcGhyHgsSB0NvbnRlbnQiEU5IQ1AtMDg4NDk2NjMxNjg0DA
DOH,"May 17, 2023",Space Requirements for a Psychiatric Treatment and Rehabilitation Center,SUCCESSFUL,Architectural Thesis Project,05/03/2023 - 05/17/2023,https://www.foi.gov.ph/requests/aglzfmVmb2ktcGhyHQsSB0NvbnRlbnQiEERPSC02MzE0OTM4OTg1ODUM
CHED,"May 17, 2023",Municipal Record for Higher Education,PENDING,Architectural Thesis Research,01/01/2020 - 05/17/2023,https://www.foi.gov.ph/requests/aglzfmVmb2ktcGhyHgsSB0NvbnRlbnQiEUNIRUQtMzkzMTI1MjU5ODEwDA
DOH,"May 16, 2023",DOH AO No. 2006-0030,SUCCESSFUL,Research,09/16/2006 - 09/16/2006,https://www.foi.gov.ph/requests/aglzfmVmb2ktcGhyHQsSB0NvbnRlbnQiEERPSC0yNzkwODEwNDY4NDEM
PSA,"May 16, 2023","Mortality Due to Diseases in Dasmariñas, Cavite from 2013-2022",PARTIALLY SUCCESSFUL,Research project requirement,01/01/2012 - 12/31/2022,https://www.foi.gov.ph/requests/aglzfmVmb2ktcGhyHQsSB0NvbnRlbnQiEFBTQS0wMjI4ODA1NDM1NDkM
DA,"May 16, 2023",STW and SPIS that uses georesisitivity in site location in Camarines Sur,REFERRED,Thesis regarding STW and SPIS which uses georesistivity method in site locating,05/16/2023 - 05/16/2023,https://www.foi.gov.ph/requests/aglzfmVmb2ktcGhyHAsSB0NvbnRlbnQiD0RBLTY4ODcxMDU1NTMzOQw
LRA,"May 16, 2023",Copy of Absolute Deed pf Sale,SUCCESSFUL,Buying property,05/16/2023 - 05/16/2023,https://www.foi.gov.ph/requests/aglzfmVmb2ktcGhyHQsSB0NvbnRlbnQiEExSQS0wODQ2MzM1MzE2ODgM
DSWD,"May 16, 2023",Total number of DSWD-recognized orphanages in Region IV-A (CALABARZON),PENDING,Research/Thesis,01/01/2019 - 05/16/2023,https://www.foi.gov.ph/requests/aglzfmVmb2ktcGhyHgsSB0NvbnRlbnQiEURTV0QtMDQ5MjM0NDQ5NzY3DA
DOH,"May 16, 2023",Vaccine Card,SUCCESSFUL,Requirements in Airport for tomorrow.,05/16/2023 - 05/16/2023,https://www.foi.gov.ph/requests/aglzfmVmb2ktcGhyHQsSB0NvbnRlbnQiEERPSC0xMzM3OTk0NjUwNjMM
DOST,"May 16, 2023",Weighing scale calibration standard,REFERRED,to establish accuracy calibration standard of weighing scale,01/20/2022 - 05/16/2023,https://www.foi.gov.ph/requests/aglzfmVmb2ktcGhyHgsSB0NvbnRlbnQiEURPU1QtMDk5OTEwMTMxOTU1DA
BI,"May 16, 2023",59 day visitor visa,PENDING,Preparing for travel to Philippines,05/16/2023 - 05/16/2023,https://www.foi.gov.ph/requests/aglzfmVmb2ktcGhyHAsSB0NvbnRlbnQiD0JJLTk5MzgyMzE1NTg2OQw
DENR,"May 16, 2023",ENVIRONMENTAL IMPACT STATEMENT OF BATANGAS CITY GRAND TERMINAL,REFERRED,RESEARCH,01/01/2023 - 05/16/2023,https://www.foi.gov.ph/requests/aglzfmVmb2ktcGhyHgsSB0NvbnRlbnQiEURFTlItNTI2NjkyODgxMDU4DA
MMDA,"May 16, 2023",Number of vehicles passing through slex northbound,DENIED,Research and development,04/01/2023 - 04/30/2023,https://www.foi.gov.ph/requests/aglzfmVmb2ktcGhyHgsSB0NvbnRlbnQiEU1NREEtNDQxNjczODUxNDY1DA
DOH,"May 16, 2023",Hospitals in Quezon City with hemodialysis unit/center,PARTIALLY SUCCESSFUL,Research,05/16/2023 - 05/16/2023,https://www.foi.gov.ph/requests/aglzfmVmb2ktcGhyHQsSB0NvbnRlbnQiEERPSC04MTc3ODI2NjgxMjUM
BJMP,"May 16, 2023","Number PDL committed or charged on Drug cases in District 1, Region 2",ACCEPTED,Research Project in fulfillment for our course and graduation,01/01/2021 - 05/16/2023,https://www.foi.gov.ph/requests/aglzfmVmb2ktcGhyHgsSB0NvbnRlbnQiEUJKTVAtMDYyNTgxNzU4OTQ3DA
DepEd,"May 16, 2023",High School TOR/Form 137,SUCCESSFUL,Required for Enrollment Abroad,06/16/2005 - 04/01/2009,https://www.foi.gov.ph/requests/aglzfmVmb2ktcGhyHwsSB0NvbnRlbnQiEkRlcEVkLTQ3Nzg4MDM5MjUwNAw
IPOPHL,"May 16, 2023",Copyright information of TALA Dance Choreography,PENDING,Research and Development for my thesis,01/01/2013 - 05/16/2023,https://www.foi.gov.ph/requests/aglzfmVmb2ktcGhyIAsSB0NvbnRlbnQiE0lQT1BITC0yNDE2NzQzMTI0NDcM
NHA,"May 16, 2023",Pabahay Ni PBBM,ACCEPTED,Research and Development,04/14/2023 - 05/16/2023,https://www.foi.gov.ph/requests/aglzfmVmb2ktcGhyHQsSB0NvbnRlbnQiEE5IQS0zODMwODgzNjE3NTEM
SEC,"May 16, 2023",Moneycat too much interest,ACCEPTED,for information,04/29/2023 - 05/17/2023,https://www.foi.gov.ph/requests/aglzfmVmb2ktcGhyHQsSB0NvbnRlbnQiEFNFQy02MDU3NzM2MzA3MTYM
URS,"May 16, 2023","List of Projects intended for Palmera Homes II Barangay dolores Taytay, Rizal (last 10yrs since 2013",PENDING,Riprap repair was declared with a certain amount in millions which never happened based onphotostake,01/01/2013 - 05/16/2023,https://www.foi.gov.ph/requests/aglzfmVmb2ktcGhyHQsSB0NvbnRlbnQiEFVSUy0yMTI5NjA3MDgxMzQM
IC,"May 16, 2023",total number of insured people in the Philippines,SUCCESSFUL,research study about insurance strategies,05/16/2023 - 05/16/2023,https://www.foi.gov.ph/requests/aglzfmVmb2ktcGhyHAsSB0NvbnRlbnQiD0lDLTIwNTYwODgzNDMxNQw
DPWH,"May 16, 2023","dpwh design guidelines, criteria & standards (dcgs) volume 5 bridge design 2015",SUCCESSFUL,Research,05/16/2023 - 05/16/2023,https://www.foi.gov.ph/requests/aglzfmVmb2ktcGhyHgsSB0NvbnRlbnQiEURQV0gtNDQyNDQ4NDQ5MjYxDA
DepEd,"May 16, 2023",The number of High School and Senior High School Students in Tondo Manila Distric 1,AWAITING CLARIFICATION,Research Purposes,06/13/2022 - 06/13/2022,https://www.foi.gov.ph/requests/aglzfmVmb2ktcGhyHwsSB0NvbnRlbnQiEkRlcEVkLTI5MTIzNjA1MDQ0MAw
NBI,"May 16, 2023",Threats and Harrassment on Online Lending,PENDING,Nais ko pong mahinto po ang operasyon ng pangbabanta at panloloko nila sa kapwa tao nila,05/01/2023 - 05/16/2023,https://www.foi.gov.ph/requests/aglzfmVmb2ktcGhyHQsSB0NvbnRlbnQiEE5CSS0wOTgxODI0NzExOTYM
PNP,"May 16, 2023",Request for Updated Street Crime Statistic Data and Incidents in Paranaque City,ACCEPTED,Research,05/16/2021 - 05/16/2023,https://www.foi.gov.ph/requests/aglzfmVmb2ktcGhyHQsSB0NvbnRlbnQiEFBOUC04NTc5MjE4NTk1MjUM
DOH,"May 16, 2023",Vaxcert no record found for my 1st booster shot for covid 19,SUCCESSFUL,For my international flight requirement,07/06/2021 - 12/06/2022,https://www.foi.gov.ph/requests/aglzfmVmb2ktcGhyHQsSB0NvbnRlbnQiEERPSC05MjQyNTIwMjA4MDkM
PSA,"May 16, 2023",Philippine Income Classes May 2023,SUCCESSFUL,Research,01/01/2023 - 05/05/2023,https://www.foi.gov.ph/requests/aglzfmVmb2ktcGhyHQsSB0NvbnRlbnQiEFBTQS04OTQ4NTk0MzAxNzIM
PIDS,"May 16, 2023",Philippine Income Classes May 2023,PROCESSING,Research Instrument needed for our study,05/16/2023 - 05/16/2023,https://www.foi.gov.ph/requests/aglzfmVmb2ktcGhyHgsSB0NvbnRlbnQiEVBJRFMtODkzMzg2MDA2MTcxDA
