agency,date,title,status,purpose,period_covered,link
MMDA,"June 17, 2022",The daytime and nighttime population in NCR from 2013 - 2021,REFERRED,Research,01/01/2013 - 06/17/2022,https://www.foi.gov.ph/requests/aglzfmVmb2ktcGhyHgsSB0NvbnRlbnQiEU1NREEtNTMzMDc4MjQwODE3DA
POPCOM,"June 17, 2022",The daytime and nighttime population in NCR from 2013 - 2021,REFERRED,Research,01/01/2013 - 06/17/2022,https://www.foi.gov.ph/requests/aglzfmVmb2ktcGhyIAsSB0NvbnRlbnQiE1BPUENPTS0wNDEwMDE3ODUwMzEM
PSA,"June 17, 2022",The daytime and nighttime population in NCR from 2013 - 2021,PARTIALLY SUCCESSFUL,Research,01/01/2013 - 06/17/2022,https://www.foi.gov.ph/requests/aglzfmVmb2ktcGhyHQsSB0NvbnRlbnQiEFBTQS04MDM1OTYyMDg3MDgM
DepEd,"June 17, 2022",Certified/AuthenticatedGrades 9 and 10 report cards,SUCCESSFUL,To acquire correct procedures and requirements needed for Authentication of documents,06/01/2020 - 06/17/2022,https://www.foi.gov.ph/requests/aglzfmVmb2ktcGhyHwsSB0NvbnRlbnQiEkRlcEVkLTkwNjUwMjQwNjIyMww
DOH,"June 17, 2022",Vax Cert,SUCCESSFUL,Travel Purpose (Nearing Travel),01/20/2022 - 02/01/2022,https://www.foi.gov.ph/requests/aglzfmVmb2ktcGhyHQsSB0NvbnRlbnQiEERPSC03NDIxNDQ2MDYyODcM
DOH,"June 17, 2022",URGENT: VAXCERTPH Updating for Foreign Travel Requirement,SUCCESSFUL,VAXCERTPH Certificate Updating for Foreign Travel Requirement,06/13/2022 - 06/17/2022,https://www.foi.gov.ph/requests/aglzfmVmb2ktcGhyHQsSB0NvbnRlbnQiEERPSC0xMzgyOTAxNjg5NjkM
LMB,"June 17, 2022","BLLM 1 CAD 451-D Tayug, Pangasinan",SUCCESSFUL,"Lot Map Plotting at Barangay Amistad, Tayug, Pangasinan",06/17/2022 - 06/17/2022,https://www.foi.gov.ph/requests/aglzfmVmb2ktcGhyIQsSB0NvbnRlbnQiFERFTlJMTUItNDE3NjY4MTY5ODI3DA
BIR,"June 17, 2022",Income Tax Return Copy,AWAITING CLARIFICATION,To be used for Verification on Home Loan,07/26/2021 - 06/17/2022,https://www.foi.gov.ph/requests/aglzfmVmb2ktcGhyHQsSB0NvbnRlbnQiEEJJUi01MjkwMDM1OTc1NTEM
NHCP,"June 17, 2022",commision,REFERRED,pananaliksik sa impormation,06/17/2010 - 06/17/2022,https://www.foi.gov.ph/requests/aglzfmVmb2ktcGhyHgsSB0NvbnRlbnQiEU5IQ1AtMTY0MTI3Nzk4MTc0DA
DOH,"June 17, 2022",Update Vaccine information,SUCCESSFUL,Leaving country,05/17/2022 - 06/17/2022,https://www.foi.gov.ph/requests/aglzfmVmb2ktcGhyHQsSB0NvbnRlbnQiEERPSC0xMDU4NzY3MDY0MDcM
BLGF,"June 17, 2022",Philippine Valuation Standards 2018,SUCCESSFUL,Research and Library Copy for our Students,01/01/2018 - 12/30/2018,https://www.foi.gov.ph/requests/aglzfmVmb2ktcGhyHgsSB0NvbnRlbnQiEUJMR0YtMzY5MjE4NzYyMTYzDA
LSPU,"June 17, 2022",Laguna State Polytechnic University- San Pablo City,SUCCESSFUL,Research,01/01/2022 - 06/17/2022,https://www.foi.gov.ph/requests/aglzfmVmb2ktcGhyHgsSB0NvbnRlbnQiEUxTUFUtMzA2MzI3NDE3NjEwDA
ERDB,"June 17, 2022",Conservation Status of spp.,SUCCESSFUL,Undergraduate Thesis.,01/01/2011 - 10/15/2021,https://www.foi.gov.ph/requests/aglzfmVmb2ktcGhyIgsSB0NvbnRlbnQiFURFTlJFUkRCLTM1NTg4NDYxNjI1OAw
DOH,"June 17, 2022",List of all Hospitals (Government and Private) in the Philippines including the bed capacity,SUCCESSFUL,Research and Market Strategy Planning,01/01/2021 - 05/31/2022,https://www.foi.gov.ph/requests/aglzfmVmb2ktcGhyHQsSB0NvbnRlbnQiEERPSC05Nzg1MzAxNjMzNjYM
DOH,"June 17, 2022",BOOSTER VACCINE CERTIFICATE,SUCCESSFUL,TRAVEL ABROAD - SINGAPORE,06/03/2022 - 06/17/2022,https://www.foi.gov.ph/requests/aglzfmVmb2ktcGhyHQsSB0NvbnRlbnQiEERPSC03MTA2MDY3NTEzNzcM
DepEd,"June 17, 2022",DepEd Learner Reference Number,SUCCESSFUL,DOST-JLSS Scholarship Application,06/14/2022 - 06/17/2022,https://www.foi.gov.ph/requests/aglzfmVmb2ktcGhyHwsSB0NvbnRlbnQiEkRlcEVkLTMzOTkxMjY3MzkyOQw
PRC,"June 17, 2022",PRC Lice se,SUCCESSFUL,PRC License renewal,03/01/2022 - 05/19/2022,https://www.foi.gov.ph/requests/aglzfmVmb2ktcGhyHQsSB0NvbnRlbnQiEFBSQy00OTE2MDYxMzAyNDMM
DOH,"June 17, 2022","The updated number of unvaccinated individuals on each barangays in Paete, Laguna",PROCESSING,Research/Thesis,05/17/2022 - 06/17/2022,https://www.foi.gov.ph/requests/aglzfmVmb2ktcGhyHQsSB0NvbnRlbnQiEERPSC00MjA4Nzc0MTc0MDYM
LTO,"June 17, 2022",Detailed Number of All Types of Vehicles in Region X and IX by Province,PENDING,Research and Development,01/01/2014 - 12/31/2021,https://www.foi.gov.ph/requests/aglzfmVmb2ktcGhyHQsSB0NvbnRlbnQiEExUTy01MTg5NjU5NzY4NDIM
VALCWD,"June 17, 2022",Local Water District Information Sheet,PENDING,For Digos Water District benchmarking purposes only,01/01/2021 - 12/31/2021,https://www.foi.gov.ph/requests/aglzfmVmb2ktcGhyIAsSB0NvbnRlbnQiE1ZBTENXRC03MjQ5MjM0MTExODAM
TANZWD,"June 17, 2022",Local Water District Information Sheet,SUCCESSFUL,For Digos Water District benchmarking purposes only,01/01/2021 - 12/31/2021,https://www.foi.gov.ph/requests/aglzfmVmb2ktcGhyIAsSB0NvbnRlbnQiE1RBTlpXRC04Njg2MzEwNjE1MzgM
BIR,"June 17, 2022",ITR 2021,DENIED,International Travel,01/01/2021 - 12/31/2021,https://www.foi.gov.ph/requests/aglzfmVmb2ktcGhyHQsSB0NvbnRlbnQiEEJJUi0zNzcwMzI5MjU1MzAM
TANAYWD,"June 17, 2022",Local Water District Information Sheet,SUCCESSFUL,For Digos Water District benchmarking purposes only,01/01/2021 - 12/31/2021,https://www.foi.gov.ph/requests/aglzfmVmb2ktcGhyIQsSB0NvbnRlbnQiFFRBTkFZV0QtODQ0ODczMjAzMTYwDA
ECC,"June 17, 2022",Rejected EC claim,SUCCESSFUL,Claims,09/08/2021 - 09/28/2021,https://www.foi.gov.ph/requests/aglzfmVmb2ktcGhyHQsSB0NvbnRlbnQiEEVDQy05MjgyMjg0MzQ1NzgM
SKWD,"June 17, 2022",Local Water District Information Sheet,SUCCESSFUL,For Digos Water District benchmarking purposes only,01/01/2021 - 12/31/2021,https://www.foi.gov.ph/requests/aglzfmVmb2ktcGhyHgsSB0NvbnRlbnQiEVNLV0QtMTQ4MDA2MTY5MDE2DA
NHA,"June 17, 2022",Latest Housing Backlog statistics in the Philippines,SUCCESSFUL,Research purposes,01/01/2022 - 05/31/2022,https://www.foi.gov.ph/requests/aglzfmVmb2ktcGhyHQsSB0NvbnRlbnQiEE5IQS00OTAxMzAyOTM1NjUM
DepEd,"June 17, 2022",F138 and F137,SUCCESSFUL,Requirements for Graduating in College,06/10/2008 - 04/30/2012,https://www.foi.gov.ph/requests/aglzfmVmb2ktcGhyHwsSB0NvbnRlbnQiEkRlcEVkLTExMTk0ODk3OTcyNww
BJMP,"June 17, 2022",Statistics on the population of Women Deprived of Liberty in the Philippines,SUCCESSFUL,Research and Development,01/01/2017 - 01/01/2022,https://www.foi.gov.ph/requests/aglzfmVmb2ktcGhyHgsSB0NvbnRlbnQiEUJKTVAtNDU3MjUwMjcwMzg3DA
GSIS,"June 17, 2022",Service Record from GSIS,SUCCESSFUL,Pertinent Document for reference,05/22/2017 - 06/17/2022,https://www.foi.gov.ph/requests/aglzfmVmb2ktcGhyHgsSB0NvbnRlbnQiEUdTSVMtODQzOTU5MDk3MzYxDA
ERC,"June 17, 2022",2017-2021 Distribution Planning Studies (DPS) of PDU BUSECO,DENIED,To develop an interactive Geographical Information System Map.,01/01/2017 - 12/31/2021,https://www.foi.gov.ph/requests/aglzfmVmb2ktcGhyHQsSB0NvbnRlbnQiEEVSQy0yMjkzNjc1MjQ1NTkM
ERC,"June 17, 2022",2017-2021 Distribution Planning Studies (DPS) of PDU CEPALCO,DENIED,research,01/01/2017 - 12/31/2021,https://www.foi.gov.ph/requests/aglzfmVmb2ktcGhyHQsSB0NvbnRlbnQiEEVSQy0yNjE2MTYwMjU4MjMM
DSWD,"June 17, 2022",The location of the Regional Rehabilitation Centers in the Philippines,PROCESSING,Research and Development,11/11/1950 - 06/17/2022,https://www.foi.gov.ph/requests/aglzfmVmb2ktcGhyHgsSB0NvbnRlbnQiEURTV0QtNDExMDcwNDU0NjI5DA
OCD,"June 17, 2022",Death toll of typhoons in the last 5 years,PENDING,Public Inquiry,01/01/2017 - 06/16/2022,https://www.foi.gov.ph/requests/aglzfmVmb2ktcGhyHQsSB0NvbnRlbnQiEE9DRC0zMTkxOTUzMzc0MzcM
CARCARWD,"June 17, 2022",BACTEST - 2020,PENDING,research,01/01/2020 - 12/31/2020,https://www.foi.gov.ph/requests/aglzfmVmb2ktcGhyIgsSB0NvbnRlbnQiFUNBUkNBUldELTgwNzE0NzcwNTcxMAw
DICT,"June 17, 2022",Philippine Telecommunications Industry data,PENDING,Research,06/17/2022 - 06/17/2022,https://www.foi.gov.ph/requests/aglzfmVmb2ktcGhyHgsSB0NvbnRlbnQiEURJQ1QtODUwNjYxOTc0Mjk5DA
ERC,"June 17, 2022",Reliability Indices of BUSECO's substations every year 2017-2021,PROCESSING,To develop an interactive Geographical Information System Map. Identify reliability scales,01/01/2017 - 06/15/2022,https://www.foi.gov.ph/requests/aglzfmVmb2ktcGhyHQsSB0NvbnRlbnQiEEVSQy0xMTM0NzU1NjQ3NzYM
NEA,"June 17, 2022",cancellation of request,PENDING,cancellation of request,01/01/2019 - 12/31/2021,https://www.foi.gov.ph/requests/aglzfmVmb2ktcGhyHQsSB0NvbnRlbnQiEE5FQS01OTUyMDc3OTk4NTMM
ERC,"June 17, 2022",Reliability Indices of CEPALCO's substations every year 2017-2021,PROCESSING,To develop an interactive Geographical Information System Map. Identify reliability scales,01/01/2017 - 12/31/2021,https://www.foi.gov.ph/requests/aglzfmVmb2ktcGhyHQsSB0NvbnRlbnQiEEVSQy01OTIxNzkyODY5MTUM
DOJ,"June 17, 2022",IRR of RA 11643 AN ACT GRANTING SURVIVORSHIP BENEFITS TO THE SURVIVING LEGITIMATE SPOUSE OF NPS,PROCESSING,reference for claim,01/13/2022 - 06/17/2022,https://www.foi.gov.ph/requests/aglzfmVmb2ktcGhyHQsSB0NvbnRlbnQiEERPSi0xOTM0NTg1NjQ4NDYM
DOST,"June 17, 2022",DOST-TRC vs Mr. Carlos Pagba.,DENIED,Audit Purposes,01/04/2021 - 06/10/2022,https://www.foi.gov.ph/requests/aglzfmVmb2ktcGhyHgsSB0NvbnRlbnQiEURPU1QtNjA5NzU1OTIwNzMwDA
HDMF,"June 17, 2022",Request for my Pag-ibig Loan Voucher,DENIED,For employment purposes (requirements),06/17/2022 - 06/17/2022,https://www.foi.gov.ph/requests/aglzfmVmb2ktcGhyHgsSB0NvbnRlbnQiEUhETUYtNjg3NDU3NDE4MzM5DA
BLGF,"June 17, 2022",Philippine Valuation Standards 2017,SUCCESSFUL,For Reference in the coming 2022 REA Exam,01/01/2017 - 12/31/2017,https://www.foi.gov.ph/requests/aglzfmVmb2ktcGhyHgsSB0NvbnRlbnQiEUJMR0YtOTM3MDcwODc2NTg2DA
DICT,"June 17, 2022",Philippine Telecommunications Industry data,PENDING,Research,06/17/2022 - 06/17/2022,https://www.foi.gov.ph/requests/aglzfmVmb2ktcGhyHgsSB0NvbnRlbnQiEURJQ1QtMjgzMTY1ODAxODk1DA
PCSO,"June 17, 2022",Hospital bill of my grandmother,SUCCESSFUL,Financial assistance for my grandmother hospital bill.,06/11/2022 - 06/17/2022,https://www.foi.gov.ph/requests/aglzfmVmb2ktcGhyHgsSB0NvbnRlbnQiEVBDU08tOTU2MDY0NjM1MDEyDA
DOH,"June 17, 2022","SRA, MAT, One-Covid allowance and other frontlines benefits",PROCESSING,"inquery on how much SRA, MAT, One-Covid allowance and other frontlines benefits you can received",05/15/2022 - 05/15/2022,https://www.foi.gov.ph/requests/aglzfmVmb2ktcGhyHQsSB0NvbnRlbnQiEERPSC01NDM4NTI0ODc5NTMM
PNP,"June 17, 2022","Recapitulation of PNP Troops in Dinagat Islands, Caraga",SUCCESSFUL,Completion of 2022 Local Data Capture Sheet,06/01/2022 - 06/15/2022,https://www.foi.gov.ph/requests/aglzfmVmb2ktcGhyHQsSB0NvbnRlbnQiEFBOUC0wNDQ3MDM5MDUwNTMM
PolWD,"June 17, 2022",Local Water District Information Sheet,SUCCESSFUL,For Digos Water District benchmarking purposes only,01/01/2021 - 12/31/2021,https://www.foi.gov.ph/requests/aglzfmVmb2ktcGhyHwsSB0NvbnRlbnQiElBvbFdELTAyMDU3NzI5NTgxMQw
DENR,"June 17, 2022",Internationally Transferred Mitigation Outcomes,REFERRED,Market Research,01/01/2022 - 06/15/2022,https://www.foi.gov.ph/requests/aglzfmVmb2ktcGhyHgsSB0NvbnRlbnQiEURFTlItNDIwMDQyNjY0MDUzDA
DOE,"June 17, 2022",Internationally Transferred Mitigation Outcomes (ITMO),DENIED,Market Research,01/01/2022 - 06/15/2022,https://www.foi.gov.ph/requests/aglzfmVmb2ktcGhyHQsSB0NvbnRlbnQiEERPRS0yMTQwMTMyOTIwNDQM
DOE,"June 17, 2022",Historical Annual Demand for Petroleum Products - 2001 to 2021,SUCCESSFUL,Research,01/01/2001 - 12/31/2021,https://www.foi.gov.ph/requests/aglzfmVmb2ktcGhyHQsSB0NvbnRlbnQiEERPRS01ODk2NjQ1OTkxMDMM
DOE,"June 17, 2022","Monthly Common Price - Gasoline, Diesel, and Kerosene",SUCCESSFUL,Research,01/01/2020 - 12/31/2021,https://www.foi.gov.ph/requests/aglzfmVmb2ktcGhyHQsSB0NvbnRlbnQiEERPRS0zNTk5OTI0MDIzMDQM
PNP,"June 17, 2022",Bina blockmail ako ng Lending company na inutangan ko,DENIED,Matukoy at mapasara yung 24H peso sobra ang pang blockmail nila sakin.,05/11/2022 - 06/14/2022,https://www.foi.gov.ph/requests/aglzfmVmb2ktcGhyHQsSB0NvbnRlbnQiEFBOUC01NzcyNDYwNTExNjcM
DILG,"June 17, 2022",FOI: Face mask and vaccination inquiry,PENDING,Transparency of DILG,05/02/2022 - 06/10/2022,https://www.foi.gov.ph/requests/aglzfmVmb2ktcGhyHgsSB0NvbnRlbnQiEURJTEctMTg0OTM4NDE1Mzk4DA
DILG,"June 17, 2022","FOI: Face mask, vaccine inquiry",PENDING,Transparency to the public,05/02/2022 - 06/10/2022,https://www.foi.gov.ph/requests/aglzfmVmb2ktcGhyHgsSB0NvbnRlbnQiEURJTEctMTk1NDQ4NTk1Mjg3DA
DOH,"June 17, 2022",Vaccination card/ statement,SUCCESSFUL,Lost vaccination card,01/01/2021 - 01/01/2022,https://www.foi.gov.ph/requests/aglzfmVmb2ktcGhyHQsSB0NvbnRlbnQiEERPSC02Mjg5NTE4MzMyNDQM
USEP,"June 17, 2022",2022-2027 Strategic Plan Related Documents,SUCCESSFUL,For BEED Level 4 Accreditation,01/01/2021 - 06/16/2022,https://www.foi.gov.ph/requests/aglzfmVmb2ktcGhyHgsSB0NvbnRlbnQiEVVTRVAtMTEzMTIwMTE1MzY4DA
PSA,"June 17, 2022",PHILSYS - PHILIPPINE IDENTIFICATION SYSTEM,PARTIALLY SUCCESSFUL,Change the delivery address of my National ID,06/17/2022 - 06/17/2022,https://www.foi.gov.ph/requests/aglzfmVmb2ktcGhyHQsSB0NvbnRlbnQiEFBTQS02MzI1MTQ4MjcxNjEM
PSA,"June 17, 2022",Change of National Id Delivery Address,PARTIALLY SUCCESSFUL,Change of PhilSys National ID indicated delivery address,06/17/2022 - 06/17/2022,https://www.foi.gov.ph/requests/aglzfmVmb2ktcGhyHQsSB0NvbnRlbnQiEFBTQS02MjU3NTYzNDQ1NzkM
DOH,"June 17, 2022",FHSIS 2015 to 2020,PARTIALLY SUCCESSFUL,Research,01/01/2015 - 01/01/2020,https://www.foi.gov.ph/requests/aglzfmVmb2ktcGhyHQsSB0NvbnRlbnQiEERPSC0wNjUzMjYwNzE3NjQM
DA,"June 17, 2022","Number of RSBSA Registered Farmers in the Cordillera by Province, 2020 to 2022",SUCCESSFUL,Reference in the drafting of the 2021 Cordillera Regional Development Report,01/01/2020 - 06/15/2022,https://www.foi.gov.ph/requests/aglzfmVmb2ktcGhyHAsSB0NvbnRlbnQiD0RBLTI2NzYwMzE2ODUyMQw
PSA,"June 17, 2022",List of Banana Processing Plants and their Annual Production,PARTIALLY SUCCESSFUL,Plant Design - Production of Polyhydroxybutyrate from Banana Peels,01/01/2018 - 06/17/2022,https://www.foi.gov.ph/requests/aglzfmVmb2ktcGhyHQsSB0NvbnRlbnQiEFBTQS02MTQ0MzQxMTM2NjIM
DOH,"June 17, 2022",Requesting for correction of my name in my VaxCert.,SUCCESSFUL,Work Abroad,10/22/2021 - 11/19/2021,https://www.foi.gov.ph/requests/aglzfmVmb2ktcGhyHQsSB0NvbnRlbnQiEERPSC0xNDgyMjY5OTM1NzUM
DOH,"June 17, 2022",Vaccination Certificate QR Code,SUCCESSFUL,School requirement,07/17/2021 - 01/13/2022,https://www.foi.gov.ph/requests/aglzfmVmb2ktcGhyHQsSB0NvbnRlbnQiEERPSC0xMjgxNTU3NTE3NDUM
NTC,"June 17, 2022",Stolen phone,DENIED,Blacklist emei,05/16/2022 - 06/17/2022,https://www.foi.gov.ph/requests/aglzfmVmb2ktcGhyHQsSB0NvbnRlbnQiEE5UQy02MDgwNTMzMTQ4NTIM
DOH,"June 16, 2022",URGENT: Missing Booster Shot - VaxCert,SUCCESSFUL,Travel Abroad,04/12/2022 - 04/12/2022,https://www.foi.gov.ph/requests/aglzfmVmb2ktcGhyHQsSB0NvbnRlbnQiEERPSC05MzQyMTkyMjg0NTUM
LMB,"June 16, 2022",Vacant Quezon City Lots,SUCCESSFUL,Architectural Thesis,06/16/2022 - 06/16/2022,https://www.foi.gov.ph/requests/aglzfmVmb2ktcGhyIQsSB0NvbnRlbnQiFERFTlJMTUItNjQ5MTkwOTM4MTQzDA
DILG,"June 16, 2022",Seal of Good Governance,PENDING,Thesis data for college thesis,06/16/2019 - 06/16/2022,https://www.foi.gov.ph/requests/aglzfmVmb2ktcGhyHgsSB0NvbnRlbnQiEURJTEctNjc2NjI5MDAyNjM4DA
NAP,"June 16, 2022",BIRTH RECORDS OF CRISTINA DIZON CORPUZ,DENIED,DSWD Application for Centenarian,04/01/1931 - 04/01/1941,https://www.foi.gov.ph/requests/aglzfmVmb2ktcGhyHQsSB0NvbnRlbnQiEE5BUC0xNDgzMTIxMjM5OTUM
PSA,"June 16, 2022","The number of individuals aged 25 to 55 years old in San Juan City, Metro Manila",SUCCESSFUL,Research and Development,06/16/2022 - 06/16/2022,https://www.foi.gov.ph/requests/aglzfmVmb2ktcGhyHQsSB0NvbnRlbnQiEFBTQS03OTI3MjM1MzgzNTgM
BFAR,"June 16, 2022","Sea Depth of Barangay Mandaragat, Puerto Princesa",PARTIALLY SUCCESSFUL,Undergraduate Thesis Study,09/01/2010 - 01/01/2022,https://www.foi.gov.ph/requests/aglzfmVmb2ktcGhyHgsSB0NvbnRlbnQiEUJGQVItNzkxNjc2Mjg4OTc2DA
PCSO,"June 16, 2022",Financial Assistance,SUCCESSFUL,Financial Assistance for Medication for Mental Disorder,05/27/2022 - 06/16/2022,https://www.foi.gov.ph/requests/aglzfmVmb2ktcGhyHgsSB0NvbnRlbnQiEVBDU08tNDU2MjUzMzE0MDY1DA
ERC,"June 16, 2022",Electricity Sales of BUSECO every month from Jan 2017- Dec 2021,SUCCESSFUL,To develop an existing power distribution utilities study,01/01/2017 - 12/31/2021,https://www.foi.gov.ph/requests/aglzfmVmb2ktcGhyHQsSB0NvbnRlbnQiEEVSQy03NzU3MjUyNzYzOTgM
ERC,"June 16, 2022","Peak Loading of all of BUSECOâ€™s substations 2017-2021, forecasted to 2026",SUCCESSFUL,To develop an interactive Geographical Information System Map. Identify load growth and load pattern,01/01/2017 - 12/31/2021,https://www.foi.gov.ph/requests/aglzfmVmb2ktcGhyHQsSB0NvbnRlbnQiEEVSQy03MzkxNjExNTcxMTIM
ERC,"June 16, 2022","2017-2021 Distribution Development Plan (DDP) of PDU BUSECO, as per PDC 2017, Sec. 5.2.5.2",DENIED,existing power distribution Study,01/01/2017 - 12/31/2021,https://www.foi.gov.ph/requests/aglzfmVmb2ktcGhyHQsSB0NvbnRlbnQiEEVSQy03OTcwMjkxMTY1ODgM
ERC,"June 16, 2022",BUSECO Existing Simple and Geographic Single Line Diagram,EXTENDED,"To develop a Geographic Information System Map showing 500kV 230kV 69kV, 34.5kV, and 13.8kv lines",01/01/2017 - 06/15/2022,https://www.foi.gov.ph/requests/aglzfmVmb2ktcGhyHQsSB0NvbnRlbnQiEEVSQy00MTI0OTkwMzIwMjYM
DOF,"June 16, 2022",Philippine Valuation Standards 2017,REFERRED,For Reference in the coming 2022 REA Exam,01/01/2017 - 12/31/2017,https://www.foi.gov.ph/requests/aglzfmVmb2ktcGhyHQsSB0NvbnRlbnQiEERPRi01MzA1NzY0OTEyMTgM
ERC,"June 16, 2022","Peak Loading of all of CEPALCOâ€™s substations 2017-2021, forecasted to 2026",SUCCESSFUL,To develop an interactive Geographical Information System Map. Identify load growth and load pattern,01/01/2017 - 12/31/2021,https://www.foi.gov.ph/requests/aglzfmVmb2ktcGhyHQsSB0NvbnRlbnQiEEVSQy0wNDg0ODU3NDU0ODgM
NTC,"June 16, 2022",Block stolen phone,DENIED,Block the IMEI number of my phone that was stolen.,06/15/2022 - 06/15/2022,https://www.foi.gov.ph/requests/aglzfmVmb2ktcGhyHQsSB0NvbnRlbnQiEE5UQy05ODE3NzI5NjMwMjEM
ERC,"June 16, 2022",CEPALCO Existing Simple and Geographic Single Line Diagram,SUCCESSFUL,"To develop a Geographic Information System Map showing 500kV 230kV 69kV, 34.5kV, and 13.8kv lines",01/01/2017 - 06/15/2022,https://www.foi.gov.ph/requests/aglzfmVmb2ktcGhyHQsSB0NvbnRlbnQiEEVSQy03MTA2NjUzNjcyNDkM
PSA,"June 16, 2022",Population of City of Caloocan in 2021,SUCCESSFUL,Undergraduate Thesis,01/01/2021 - 12/31/2021,https://www.foi.gov.ph/requests/aglzfmVmb2ktcGhyHQsSB0NvbnRlbnQiEFBTQS02MTIxNDA3NjgwMzIM
POEA,"June 16, 2022",Status of Employers Accreditation,SUCCESSFUL,To have OEC,05/04/2022 - 06/16/2022,https://www.foi.gov.ph/requests/aglzfmVmb2ktcGhyHgsSB0NvbnRlbnQiEVBPRUEtODc2MTAyNDQxMzk1DA
DOST,"June 16, 2022",River discharge of Pasig River,DENIED,Research on marine litter in Pasig River,01/01/2010 - 06/16/2022,https://www.foi.gov.ph/requests/aglzfmVmb2ktcGhyHgsSB0NvbnRlbnQiEURPU1QtMDM2NTc0Nzk0ODMxDA
DepEd,"June 16, 2022",Natinal Career Assessment Examination (NCAE) Result,SUCCESSFUL,Senior High School requirement for enrollment,10/07/2014 - 10/07/2014,https://www.foi.gov.ph/requests/aglzfmVmb2ktcGhyHwsSB0NvbnRlbnQiEkRlcEVkLTA5MzUyOTU1OTE2Nww
LMB,"June 16, 2022",karst map of isabela negros occidental,SUCCESSFUL,"FOR THE USE OF COMPREHENSIVE LAND USE PLAN OF THE MUNICIPALITY OF ISABELA,NEGROS OCCIDENTAL",01/01/2000 - 05/27/2022,https://www.foi.gov.ph/requests/aglzfmVmb2ktcGhyIQsSB0NvbnRlbnQiFERFTlJMTUItNjA2MDQ2OTY5MjkxDA
BIR,"June 16, 2022",BIR Form No. 2316,SUCCESSFUL,Pay evidence for Skills Assessment,01/01/2018 - 12/31/2018,https://www.foi.gov.ph/requests/aglzfmVmb2ktcGhyHQsSB0NvbnRlbnQiEEJJUi04MTkyOTcwMzI1OTAM
POEA,"June 16, 2022",Filipino Workers in UAE,PARTIALLY SUCCESSFUL,Thesis,06/16/1970 - 06/16/2022,https://www.foi.gov.ph/requests/aglzfmVmb2ktcGhyHgsSB0NvbnRlbnQiEVBPRUEtMzc5NjY1NjE2MTU2DA
CIC,"June 16, 2022",HARASSMENT & DISCLOSING OF CLIENT INFORMATION,PENDING,To Report Illegal Online Lender (Loan Sharks) in Philippines,06/10/2022 - 06/16/2022,https://www.foi.gov.ph/requests/aglzfmVmb2ktcGhyHQsSB0NvbnRlbnQiEENJQy0wNTA1MTc2MjUyMjUM
NTC,"June 16, 2022",Letter of Intent to Release DHL - WAYBILL 1034360434,PARTIALLY SUCCESSFUL,Letter of Intent to Release DHL - WAYBILL 1034360434,06/16/2022 - 06/16/2022,https://www.foi.gov.ph/requests/aglzfmVmb2ktcGhyHQsSB0NvbnRlbnQiEE5UQy0wOTQyMzUwNTE2ODEM
SSU,"June 16, 2022",enrollment form,DENIED,to enroll and study in this school,06/16/2022 - 06/16/2022,https://www.foi.gov.ph/requests/aglzfmVmb2ktcGhyHQsSB0NvbnRlbnQiEFNTVS0wODUxMzAyOTA3NzAM
PSA,"June 16, 2022",HRM Policies of Selected BPO Industries on Employee Retention,PARTIALLY SUCCESSFUL,Research and development (Undergraduate Thesis),06/16/2022 - 06/16/2022,https://www.foi.gov.ph/requests/aglzfmVmb2ktcGhyHQsSB0NvbnRlbnQiEFBTQS0zNzg4MDQwNTcyNDUM
USEP,"June 16, 2022",University Curriculum Review Documents pertaining BEED Curriculum Revision,SUCCESSFUL,BEED Accreditation,01/01/2018 - 12/31/2018,https://www.foi.gov.ph/requests/aglzfmVmb2ktcGhyHgsSB0NvbnRlbnQiEVVTRVAtMzc0MjM4OTU1MDA1DA
PAGASA,"June 16, 2022",Death toll of typhoons in the last 5 years,REFERRED,Public Inquiry,01/01/2017 - 06/16/2022,https://www.foi.gov.ph/requests/aglzfmVmb2ktcGhyIAsSB0NvbnRlbnQiE1BBR0FTQS0yMzExOTQ1MzkzNzQM
NTC,"June 16, 2022",Blocking IMEI of stolen phone,DENIED,Need assistance regarding with blocking the IMEI of my stolen device so it couldn't be use to anyone,06/15/2022 - 06/16/2022,https://www.foi.gov.ph/requests/aglzfmVmb2ktcGhyHQsSB0NvbnRlbnQiEE5UQy0zOTI4NDE5NDg2OTEM
USEP,"June 16, 2022","excerpts of the Minutes of the University Academic Council Meeting on BEED, BECE Curriculum Revision",SUCCESSFUL,For Accreditation,01/01/2018 - 12/31/2018,https://www.foi.gov.ph/requests/aglzfmVmb2ktcGhyHgsSB0NvbnRlbnQiEVVTRVAtMDE4NzEwNzcxMDIwDA
NTC,"June 16, 2022",Request to lock IMEI of stolen device,DENIED,Block IMEI of stolen phone,06/15/2022 - 06/16/2022,https://www.foi.gov.ph/requests/aglzfmVmb2ktcGhyHQsSB0NvbnRlbnQiEE5UQy0wNTcwMjYwOTQ2NDgM
DA,"June 16, 2022",2009 and 2010 Post-Audit COA Report of the Department of Agriculture,SUCCESSFUL,Research,01/01/2009 - 12/31/2010,https://www.foi.gov.ph/requests/aglzfmVmb2ktcGhyHAsSB0NvbnRlbnQiD0RBLTE3ODM1NzcwMjEyOAw
BFP,"June 16, 2022",Self Contained Breathing Apparatus - Warranty Period,PENDING,Research,01/01/2022 - 06/16/2022,https://www.foi.gov.ph/requests/aglzfmVmb2ktcGhyHQsSB0NvbnRlbnQiEEJGUC05MzM0NjY0NTA3MTUM
BSWM,"June 16, 2022",Soil Map of Kalinga Province,SUCCESSFUL,Work related research for Kalinga province,03/21/2022 - 05/29/2022,https://www.foi.gov.ph/requests/aglzfmVmb2ktcGhyHgsSB0NvbnRlbnQiEUJTV00tNTU1MzMxODI1NDk3DA
DOH,"June 16, 2022",Follow up my vaxcert,SUCCESSFUL,For sign off in singapore,06/01/2022 - 06/16/2022,https://www.foi.gov.ph/requests/aglzfmVmb2ktcGhyHQsSB0NvbnRlbnQiEERPSC0yMTUwMTA5OTE2NDgM
PSA,"June 16, 2022",Number of BPO Employees in Quezon City,SUCCESSFUL,For Research Purposes,01/01/2018 - 01/01/2022,https://www.foi.gov.ph/requests/aglzfmVmb2ktcGhyHQsSB0NvbnRlbnQiEFBTQS0zNDQzODk1ODk5ODgM
PSA,"June 16, 2022",2018 Merged FIES-LFS Survey,PARTIALLY SUCCESSFUL,Research,01/01/2018 - 12/01/2018,https://www.foi.gov.ph/requests/aglzfmVmb2ktcGhyHQsSB0NvbnRlbnQiEFBTQS05MzQyNzkwMjUxMjMM
NPC,"June 16, 2022",Mocamoca App - Harassment and Offering Illegal Products,DENIED,Ban this product,05/01/2022 - 06/15/2022,https://www.foi.gov.ph/requests/aglzfmVmb2ktcGhyHQsSB0NvbnRlbnQiEE5QQy0xMjg5NTY4NzgyNDkM
NBI,"June 16, 2022",robbed in my condo by fake gf,DENIED,love scam be robbed by a pretending gf,03/06/2022 - 04/06/2022,https://www.foi.gov.ph/requests/aglzfmVmb2ktcGhyHQsSB0NvbnRlbnQiEE5CSS01MDc2NTI4NTM3MDkM
IC,"June 16, 2022",Insurance Commission Exam Result,SUCCESSFUL,For application to be an insurance agent to a new branch,05/30/2016 - 06/30/2016,https://www.foi.gov.ph/requests/aglzfmVmb2ktcGhyHAsSB0NvbnRlbnQiD0lDLTc5MjIyMDQzMjk2Ngw
PMS,"June 16, 2022","All Statements of Assets, Liabilities, Net Worth (SALN) of President Rodrigo Duterte",PENDING,News reporting,01/01/2018 - 06/16/2022,https://www.foi.gov.ph/requests/aglzfmVmb2ktcGhyHQsSB0NvbnRlbnQiEFBNUy0wMjg3ODIyNzEzMjAM
NORWD,"June 16, 2022",Local Water District Information Sheet,SUCCESSFUL,For Digos Water District benchmarking purposes only,01/01/2021 - 12/31/2021,https://www.foi.gov.ph/requests/aglzfmVmb2ktcGhyHwsSB0NvbnRlbnQiEk5PUldELTg5ODUwOTQwMjI2MAw
MRWD,"June 16, 2022",Local Water District Information Sheet,PENDING,For Digos Water District benchmarking purposes only,01/01/2021 - 12/31/2021,https://www.foi.gov.ph/requests/aglzfmVmb2ktcGhyHgsSB0NvbnRlbnQiEU1SV0QtNDAzODQyOTE4OTgzDA
DBM,"June 16, 2022",Internal Revenue Allotment,SUCCESSFUL,For Research and Development Purposes,01/16/2022 - 06/16/2022,https://www.foi.gov.ph/requests/aglzfmVmb2ktcGhyHQsSB0NvbnRlbnQiEERCTS0yMzI3MTAzNzMxMDQM
MARIWAD,"June 16, 2022",Local Water District Information Sheet,PENDING,For Digos Water District benchmarking purposes only,01/01/2021 - 12/31/2021,https://www.foi.gov.ph/requests/aglzfmVmb2ktcGhyIQsSB0NvbnRlbnQiFE1BUklXQUQtNjc4OTQxMzE4NDE2DA
BIR,"June 16, 2022",Income Tax Return,AWAITING CLARIFICATION,For application of enrollment for my children,01/01/2021 - 12/31/2021,https://www.foi.gov.ph/requests/aglzfmVmb2ktcGhyHQsSB0NvbnRlbnQiEEJJUi0xNzI1Mzk1MjkyMjgM
MANGWD,"June 16, 2022",Local Water District Information Sheet,PENDING,For Digos Water District benchmarking purposes only,01/01/2021 - 12/31/2021,https://www.foi.gov.ph/requests/aglzfmVmb2ktcGhyIAsSB0NvbnRlbnQiE01BTkdXRC0xOTUxNDUzNDY2ODcM
IC,"June 16, 2022",IC exam results,SUCCESSFUL,For personal record,08/19/2019 - 08/19/2019,https://www.foi.gov.ph/requests/aglzfmVmb2ktcGhyHAsSB0NvbnRlbnQiD0lDLTU1MDIyMTM0MDA1Mww
SSS,"June 16, 2022",Wrong Employer,PENDING,Loan Query,06/16/2022 - 06/16/2022,https://www.foi.gov.ph/requests/aglzfmVmb2ktcGhyHQsSB0NvbnRlbnQiEFNTUy0yOTQ0NzM0ODc1MTUM
HAGWD,"June 16, 2022",Local Water District Information Sheet,PENDING,For Digos Water District benchmarking purposes only,01/01/2021 - 12/31/2021,https://www.foi.gov.ph/requests/aglzfmVmb2ktcGhyHwsSB0NvbnRlbnQiEkhBR1dELTk4MTk2Nzk0NTMzMgw
