agency,date,title,status,purpose,period_covered,link
SSS,"November 21, 2022",Block account,SUCCESSFUL,To unlock my SSS account.,11/21/2022 - 11/21/2022,https://www.foi.gov.ph/requests/aglzfmVmb2ktcGhyHQsSB0NvbnRlbnQiEFNTUy0xMjIwMzI2OTk4MzkM
DPWH,"November 21, 2022",The standard pedestrian bridge design and soil analysis data for educational purposes,AWAITING CLARIFICATION,THESIS,01/01/2018 - 11/21/2022,https://www.foi.gov.ph/requests/aglzfmVmb2ktcGhyHgsSB0NvbnRlbnQiEURQV0gtMjI0NjkzMzI5OTQ3DA
ERC,"November 21, 2022",Forward Contracting for RCOA or Contestable Customers?,ACCEPTED,Research and Data Gathering,11/21/2022 - 11/21/2022,https://www.foi.gov.ph/requests/aglzfmVmb2ktcGhyHQsSB0NvbnRlbnQiEEVSQy0wMzQ0ODg4ODU4NDcM
DOE,"November 21, 2022",Forward Contracting for RCOA or Contestable Customers?,ACCEPTED,Research and Data Gathering,11/21/2022 - 11/21/2022,https://www.foi.gov.ph/requests/aglzfmVmb2ktcGhyHQsSB0NvbnRlbnQiEERPRS03NDE0ODUwODg5ODkM
NBI,"November 21, 2022",Unlawful Harrassments and Unfair Debt Collection of these Online Lending Apps,DENIED,To seek justice for this lending apps,11/21/2022 - 11/21/2022,https://www.foi.gov.ph/requests/aglzfmVmb2ktcGhyHQsSB0NvbnRlbnQiEE5CSS04ODQxNjk0MTg0ODEM
LMB,"November 21, 2022",Request of BLLM coordinates of Pamplona Camarines Sur,ACCEPTED,Mapping and plotting of government own land and business establishment,11/21/2022 - 11/21/2022,https://www.foi.gov.ph/requests/aglzfmVmb2ktcGhyIQsSB0NvbnRlbnQiFERFTlJMTUItMzIwMjk0MDgzNTY0DA
IC,"November 21, 2022",Annual Statement of BPI/MS and Malayan Company,ACCEPTED,Data will be used in conducting an analysis.,12/31/2017 - 12/31/2021,https://www.foi.gov.ph/requests/aglzfmVmb2ktcGhyHAsSB0NvbnRlbnQiD0lDLTA2NzU3OTUzODgxOQw
PSA,"November 21, 2022","Latest Provincial Statistics of Blind People in Nueva Vizcaya, Philippines",SUCCESSFUL,Research and Development,11/19/2022 - 11/20/2022,https://www.foi.gov.ph/requests/aglzfmVmb2ktcGhyHQsSB0NvbnRlbnQiEFBTQS0zOTU4MDUwMzUyMzYM
PNPDIDM,"November 21, 2022","the number of CICL of every barangay of Calapan City, Oriental Mindoro",PENDING,for RESEARCH PURPOSES ONLY,01/01/2010 - 01/01/2022,https://www.foi.gov.ph/requests/aglzfmVmb2ktcGhyIQsSB0NvbnRlbnQiFFBOUERJRE0tMTU3NzI2NDQxODk3DA
PSA,"November 21, 2022","Annual income distribution per household in General Luna, Quezon",PARTIALLY SUCCESSFUL,Academic Research,01/01/2020 - 10/18/2022,https://www.foi.gov.ph/requests/aglzfmVmb2ktcGhyHQsSB0NvbnRlbnQiEFBTQS04ODUwMjY4MzgzNzAM
DOH,"November 21, 2022",percentage or list of population suffer from mental health issues in Pangasinam,PROCESSING,for thesis,11/20/2022 - 11/20/2022,https://www.foi.gov.ph/requests/aglzfmVmb2ktcGhyHQsSB0NvbnRlbnQiEERPSC04NDU1NDk2NDkzMjMM
DSWD,"November 21, 2022",Free laptop,DENIED,"School purposes, Teaching",10/15/2022 - 11/19/2022,https://www.foi.gov.ph/requests/aglzfmVmb2ktcGhyHgsSB0NvbnRlbnQiEURTV0QtMjk3MjcwNTY1NzgzDA
DOH,"November 21, 2022",Prevalence of PCOS in the NCR Region,PROCESSING,Research and Development,01/01/2012 - 11/21/2022,https://www.foi.gov.ph/requests/aglzfmVmb2ktcGhyHQsSB0NvbnRlbnQiEERPSC01MTYyOTk3MDI4NzAM
LTFRB,"November 21, 2022",GTFS Data on Public Transit Routes in Quezon City,PENDING,High School Research,01/01/2018 - 11/21/2022,https://www.foi.gov.ph/requests/aglzfmVmb2ktcGhyHwsSB0NvbnRlbnQiEkxURlJCLTQ1NTc3OTU4MDg2Nww
LLDA,"November 21, 2022",Plant Identification for Thesis,ACCEPTED,Thesis purposes,11/20/2022 - 11/21/2022,https://www.foi.gov.ph/requests/aglzfmVmb2ktcGhyIgsSB0NvbnRlbnQiFURFTlJMTERBLTkyNjY2NjUxOTQwMgw
PSA,"November 21, 2022",Birth Certificate of my father,PARTIALLY SUCCESSFUL,For visa application,11/01/2022 - 11/21/2022,https://www.foi.gov.ph/requests/aglzfmVmb2ktcGhyHQsSB0NvbnRlbnQiEFBTQS02OTY1MjgzMTc3NTIM
DSWD,"November 21, 2022",No. of Solo-Parents who have received assistance under Section 5 of R.A. 8972,PROCESSING,Undergraduate Thesis,01/01/2000 - 11/21/2022,https://www.foi.gov.ph/requests/aglzfmVmb2ktcGhyHgsSB0NvbnRlbnQiEURTV0QtMTM3NTk5ODkyOTQxDA
DOH,"November 21, 2022",Number of cases of Neurological Diseases in NCR or Philippines,PROCESSING,Thesis,11/21/2022 - 11/21/2022,https://www.foi.gov.ph/requests/aglzfmVmb2ktcGhyHQsSB0NvbnRlbnQiEERPSC0xMDAzMDE1MTQ2NTUM
SEC,"November 21, 2022",Unlawful Harrassments and Unfair Debt Collection of these Online Lending Apps,SUCCESSFUL,Shutdown OLA's for violating the laws in truth in lending act and unfair collection practices.,11/16/2022 - 11/21/2022,https://www.foi.gov.ph/requests/aglzfmVmb2ktcGhyHQsSB0NvbnRlbnQiEFNFQy0yNTY3MzkyMDIxMzUM
NBI,"November 21, 2022",Harassment and death threats via SMS from unknown no.,DENIED,Reporting harassment and death threat,11/20/2022 - 11/21/2022,https://www.foi.gov.ph/requests/aglzfmVmb2ktcGhyHQsSB0NvbnRlbnQiEE5CSS05NzY4NTk3NzM0MDMM
NPC,"November 21, 2022",Legalities of these Unlawful Harrassments and Unfair Debt Collection of these Online Lending Apps,PENDING,To sanction and shutdown these Unlawful and Illegal Online Lending Apps,07/01/2022 - 11/21/2022,https://www.foi.gov.ph/requests/aglzfmVmb2ktcGhyHQsSB0NvbnRlbnQiEE5QQy05MTUxNzI0NTcxODkM
SEC,"November 21, 2022",Legalities of these Unlawful Harrassments and Unfair Debt Collection of these Online Lending Apps,SUCCESSFUL,To sanction and shutdown these Unlawful and Illegal Online Lending Apps,07/01/2022 - 11/21/2022,https://www.foi.gov.ph/requests/aglzfmVmb2ktcGhyHQsSB0NvbnRlbnQiEFNFQy04OTE1NjI4MDA4NzYM
NBI,"November 21, 2022",Legalities of these Unlawful Harrassments and Unfair Debt Collection of these Online Lending Apps,DENIED,To sanction and shutdown these Unlawful and Illegal Online Lending Apps,07/01/2022 - 11/21/2022,https://www.foi.gov.ph/requests/aglzfmVmb2ktcGhyHQsSB0NvbnRlbnQiEE5CSS01NDQyNjAxMzkzMjgM
DOH,"November 21, 2022",a Study on Employing PWDs in Cagayan De Oro City and its Impact in the Workplace,PROCESSING,The data will be presented in our group research project in this coming thesis defense,11/21/2022 - 11/21/2022,https://www.foi.gov.ph/requests/aglzfmVmb2ktcGhyHQsSB0NvbnRlbnQiEERPSC0yOTEzMjY3NzM4NjkM
PSA,"November 21, 2022",A study on employing Persons with Disabilities in Cagayan De Oro City and its Impact in the Workplac,PARTIALLY SUCCESSFUL,The following requested information will be presented to our group research project.,11/21/2022 - 11/21/2022,https://www.foi.gov.ph/requests/aglzfmVmb2ktcGhyHQsSB0NvbnRlbnQiEFBTQS0yMjQ5NzcxMjUyNjIM
NBI,"November 21, 2022",Online scammer,DENIED,Investigation ( I want a refund from her),10/28/2022 - 11/21/2022,https://www.foi.gov.ph/requests/aglzfmVmb2ktcGhyHQsSB0NvbnRlbnQiEE5CSS03NTAyMDczMzA5MTMM
NBI,"November 21, 2022",Legalities of these Unlawful Harrassments and Unfair Debt Collection of these Online Lending Apps,DENIED,To sanction and shutdown these Unlawful and Illegal Online Lending Apps,07/01/2022 - 11/21/2022,https://www.foi.gov.ph/requests/aglzfmVmb2ktcGhyHQsSB0NvbnRlbnQiEE5CSS03MzM4MzY3MzA3OTgM
NPC,"November 21, 2022",Legalities of these Unlawful Harrassments and Unfair Debt Collection of these Online Lending Apps,PENDING,To sanction and shutdown these Unlawful and Illegal Online Lending Apps,07/01/2022 - 11/21/2022,https://www.foi.gov.ph/requests/aglzfmVmb2ktcGhyHQsSB0NvbnRlbnQiEE5QQy04NTU4ODI5Mzg3NDgM
SEC,"November 21, 2022",Legalities of these Unlawful Harrassments and Unfair Debt Collection of these Online Lending Apps,SUCCESSFUL,To sanction and shutdown these Unlawful and Illegal Online Lending Apps,07/01/2022 - 11/20/2022,https://www.foi.gov.ph/requests/aglzfmVmb2ktcGhyHQsSB0NvbnRlbnQiEFNFQy03MjI5MzIyNzI3MjYM
LTO,"November 21, 2022",Driver's License serial number,DENIED,License's renuewal,10/27/2001 - 10/27/2022,https://www.foi.gov.ph/requests/aglzfmVmb2ktcGhyHQsSB0NvbnRlbnQiEExUTy0wNDAyNjU0MTA5NTQM
BIR,"November 21, 2022",The Financial Statement of the Municipality of Solano in Nueva Vizcaya,DENIED,Research and Development,01/01/2019 - 06/30/2022,https://www.foi.gov.ph/requests/aglzfmVmb2ktcGhyHQsSB0NvbnRlbnQiEEJJUi0yMzgwMjI1NDUzNDIM
DENR,"November 21, 2022",Camp Sites Site Selection,REFERRED,Architectural Thesis,01/01/2018 - 11/21/2022,https://www.foi.gov.ph/requests/aglzfmVmb2ktcGhyHgsSB0NvbnRlbnQiEURFTlItMDQ2NTQ0Mjg1OTIxDA
UPC,"November 21, 2022",UP Cebu MBA degree accreditation and level,SUCCESSFUL,For my graduate studies,10/01/2022 - 11/21/2022,https://www.foi.gov.ph/requests/aglzfmVmb2ktcGhyHQsSB0NvbnRlbnQiEFVQQy00MTY5OTM1MzAzMDYM
DOT,"November 21, 2022",Environmental impact of tourism site on the local communities in barangay cuyambay,DENIED,For Research proposal,11/21/2022 - 11/21/2022,https://www.foi.gov.ph/requests/aglzfmVmb2ktcGhyHQsSB0NvbnRlbnQiEERPVC0xNzA1ODQ5MzQ2MzcM
PSA,"November 21, 2022",Phil ID,PARTIALLY SUCCESSFUL,EPhil ID,11/20/2022 - 11/20/2022,https://www.foi.gov.ph/requests/aglzfmVmb2ktcGhyHQsSB0NvbnRlbnQiEFBTQS0yMjc1NTEwODk0MzIM
AFP,"November 21, 2022",Land Bearing of the lot of the Philippine Navy Headquarters (Jose Andrada Naval Station),SUCCESSFUL,Architectural Thesis Proposal,10/08/2022 - 10/08/2022,https://www.foi.gov.ph/requests/aglzfmVmb2ktcGhyHQsSB0NvbnRlbnQiEEFGUC00NTQ3OTM2NTAzMjIM
DPWH,"November 21, 2022",List of frequently used service contractor of DPWH,AWAITING CLARIFICATION,Research and Development,01/01/2010 - 11/21/2021,https://www.foi.gov.ph/requests/aglzfmVmb2ktcGhyHgsSB0NvbnRlbnQiEURQV0gtNTM3MTQxNTIyMzIyDA
DPWH,"November 21, 2022",The complete list of managed infrastructure by DPWH,SUCCESSFUL,Research and Development,10/31/2022 - 10/31/2022,https://www.foi.gov.ph/requests/aglzfmVmb2ktcGhyHgsSB0NvbnRlbnQiEURQV0gtMzIwNjA5MDA1MDY1DA
PNP,"November 21, 2022","Raw data of reported incidents, complaints, or crimes in the Philippines",DENIED,Case Study,01/01/2015 - 08/30/2022,https://www.foi.gov.ph/requests/aglzfmVmb2ktcGhyHQsSB0NvbnRlbnQiEFBOUC0xOTIwMjAyOTE1MDgM
PNP,"November 21, 2022",REQUEST A POLICE REPORT,PARTIALLY SUCCESSFUL,requesting a police report,11/20/2022 - 11/21/2022,https://www.foi.gov.ph/requests/aglzfmVmb2ktcGhyHQsSB0NvbnRlbnQiEFBOUC0yMjAzNTgxMTQ3NDkM
DOH,"November 21, 2022","Health Statistics, 2020-2021, MiMaRoPa Region",PROCESSING,Thesis,01/01/2020 - 01/01/2021,https://www.foi.gov.ph/requests/aglzfmVmb2ktcGhyHQsSB0NvbnRlbnQiEERPSC03NTE0Mzg1MDIyNjgM
DOH,"November 20, 2022",Name:Rosalita Ranullo Batibut,SUCCESSFUL,para po sa vaxsert certifecation,11/20/2022 - 11/20/2022,https://www.foi.gov.ph/requests/aglzfmVmb2ktcGhyHQsSB0NvbnRlbnQiEERPSC00MDUwNDUxNjg0NTEM
PSA,"November 20, 2022",Change of delivery address of my national id,PARTIALLY SUCCESSFUL,Transfer of new home,10/01/2021 - 11/30/2021,https://www.foi.gov.ph/requests/aglzfmVmb2ktcGhyHQsSB0NvbnRlbnQiEFBTQS04NDgwOTg5MTYzMDEM
PSA,"November 20, 2022",Distribution of Visual Disability,PARTIALLY SUCCESSFUL,Architectural Thesis,01/01/2018 - 11/20/2022,https://www.foi.gov.ph/requests/aglzfmVmb2ktcGhyHQsSB0NvbnRlbnQiEFBTQS03NDgwNDI2Nzk4NjYM
BIR,"November 20, 2022",Copy of Latest ITR,DENIED,Requirement for personal loan application,11/20/2022 - 11/20/2022,https://www.foi.gov.ph/requests/aglzfmVmb2ktcGhyHQsSB0NvbnRlbnQiEEJJUi0wNTczNTMyMDI0MjMM
BIR,"November 20, 2022",Copy of Latest ITT,DENIED,Puruposes of a personal loan application,11/20/2022 - 11/20/2022,https://www.foi.gov.ph/requests/aglzfmVmb2ktcGhyHQsSB0NvbnRlbnQiEEJJUi00NjQzNzUzNDgxMDcM
NBI,"November 20, 2022",Online Scammer,DENIED,Help me track this scammer using her bank account number and report her to the police.,11/18/2022 - 11/20/2022,https://www.foi.gov.ph/requests/aglzfmVmb2ktcGhyHQsSB0NvbnRlbnQiEE5CSS03OTc5ODQ3ODc2MTEM
DOLE,"November 20, 2022",Data of Labor force,REFERRED,Thesis,01/01/2019 - 12/30/2021,https://www.foi.gov.ph/requests/aglzfmVmb2ktcGhyHgsSB0NvbnRlbnQiEURPTEUtMTI0MjAwMTczNTc4DA
PSA,"November 20, 2022",Percentage of Deaf and Mute Population in the Philippines,PARTIALLY SUCCESSFUL,Research,01/01/2009 - 11/20/2022,https://www.foi.gov.ph/requests/aglzfmVmb2ktcGhyHQsSB0NvbnRlbnQiEFBTQS04NTUxODMyMDQ3NTgM
DOT,"November 20, 2022",Number of Tourist Arrivals,AWAITING CLARIFICATION,Education and for Undergraduate Thesis,01/01/2015 - 12/30/2021,https://www.foi.gov.ph/requests/aglzfmVmb2ktcGhyHQsSB0NvbnRlbnQiEERPVC02OTM3Mjk3OTIwNTEM
DOT,"November 20, 2022",Recreational Camp Facility Guidelines,DENIED,Architectural Thesis,01/01/2018 - 11/20/2022,https://www.foi.gov.ph/requests/aglzfmVmb2ktcGhyHQsSB0NvbnRlbnQiEERPVC04Njc3OTMzNDc3MjgM
PAGASA,"November 20, 2022","Rainfall data of Typhoon Ulysses in Bocaue, Bulacan",AWAITING CLARIFICATION,Thesis,11/11/2020 - 11/18/2020,https://www.foi.gov.ph/requests/aglzfmVmb2ktcGhyIAsSB0NvbnRlbnQiE1BBR0FTQS03NzgyNTc0MDAzNDUM
BIR,"November 20, 2022",LATEST ITR REQUEST,AWAITING CLARIFICATION,Credit Card Application,08/03/2020 - 11/20/2022,https://www.foi.gov.ph/requests/aglzfmVmb2ktcGhyHQsSB0NvbnRlbnQiEEJJUi0zMjA1NDk0Nzk1NDMM
LMB,"November 20, 2022","Updated List of BLLM, MBM, BBM of Tarlac Province",ACCEPTED,For Assessment of Lot Boundaries for housing project,11/20/2022 - 11/20/2022,https://www.foi.gov.ph/requests/aglzfmVmb2ktcGhyIQsSB0NvbnRlbnQiFERFTlJMTUItNDY4MTI0NTQ1MDI3DA
DENR,"November 20, 2022","REQUEST of LOT DATA COMP & TECH DESCRIPTION for LOT 5346, CAD 519D, PALOMPON CADASTRE",DENIED,School Research output,10/31/2022 - 11/20/2022,https://www.foi.gov.ph/requests/aglzfmVmb2ktcGhyHgsSB0NvbnRlbnQiEURFTlItNDM0NzE4ODMxNzkwDA
MMDA,"November 20, 2022",Manila City Hazard Maps,DENIED,Thesis Research,11/20/2022 - 11/20/2022,https://www.foi.gov.ph/requests/aglzfmVmb2ktcGhyHgsSB0NvbnRlbnQiEU1NREEtMzM1Mzg0OTg5MTU0DA
DOH,"November 20, 2022",Philippine Health Statistics,DENIED,Architectural Research,01/01/2020 - 11/19/2022,https://www.foi.gov.ph/requests/aglzfmVmb2ktcGhyHQsSB0NvbnRlbnQiEERPSC0wMTE2NjYwMDQ4MTQM
PhilRice,"November 20, 2022",RICE AREAS IN THE PROVINCE OF BOHOL/REGION 7,ACCEPTED,IRRIGATION AND MECHANIZATION ANALYSIS,10/31/2022 - 11/20/2022,https://www.foi.gov.ph/requests/aglzfmVmb2ktcGhyIgsSB0NvbnRlbnQiFVBoaWxSaWNlLTM0NzQ4NTM0NjI0OAw
PAGASA,"November 20, 2022","Rainfall data of Typhoon Ondoy in Bocaue, Bulacan",AWAITING CLARIFICATION,Thesis,09/24/2009 - 09/28/2009,https://www.foi.gov.ph/requests/aglzfmVmb2ktcGhyIAsSB0NvbnRlbnQiE1BBR0FTQS03OTQyNDg2NTg2NjkM
JJWC,"November 20, 2022","the number of CICL of every barangay of Calapan City, Oriental Mindoro",REFERRED,for RESEARCH PURPOSES ONLY,01/01/2010 - 01/01/2022,https://www.foi.gov.ph/requests/aglzfmVmb2ktcGhyHgsSB0NvbnRlbnQiEUpKV0MtMzQyNTQ0NzczMTk0DA
DTI,"November 20, 2022",Number of MSMEs in Magugpo Tagum City,REFERRED,For my business plan as a requirement of out course. Because the said areas are my target market.,01/01/2015 - 12/31/2020,https://www.foi.gov.ph/requests/aglzfmVmb2ktcGhyHQsSB0NvbnRlbnQiEERUSS03MTM3ODMwMzc4NTcM
DA,"November 20, 2022",1. List of registered salt production farm in the Philippines 2. Salt production status in the Phili,REFERRED,Research and Development,11/20/2022 - 11/20/2022,https://www.foi.gov.ph/requests/aglzfmVmb2ktcGhyHAsSB0NvbnRlbnQiD0RBLTQzOTg0Njk5Mzk4Mgw
DA,"November 20, 2022",1. List of registered salt production farm in the Philippines 2. Salt production status in the Phili,REFERRED,Research and development,11/20/2022 - 11/20/2022,https://www.foi.gov.ph/requests/aglzfmVmb2ktcGhyHAsSB0NvbnRlbnQiD0RBLTgyNDA3MzE4MTA3OQw
LRA,"November 20, 2022",transfer certificate of title,PENDING,to claim our property of grand mother,02/22/1944 - 06/14/1987,https://www.foi.gov.ph/requests/aglzfmVmb2ktcGhyHQsSB0NvbnRlbnQiEExSQS0wMTg5NTMzMTIxMDMM
DENR,"November 20, 2022",Groundwater Data in Laguna,REFERRED,Undergraduate thesis,01/01/2012 - 09/21/2022,https://www.foi.gov.ph/requests/aglzfmVmb2ktcGhyHgsSB0NvbnRlbnQiEURFTlItMTMyNjc4ODgzNzQ1DA
NTC,"November 20, 2022","Harassment , privacy breech and assault",REFERRED,"Privacy Breeach, harassment and assault against loan sharks",11/19/2022 - 11/20/2022,https://www.foi.gov.ph/requests/aglzfmVmb2ktcGhyHQsSB0NvbnRlbnQiEE5UQy00OTQyOTQwMTAwNjkM
POPCOM,"November 20, 2022",percentage or list of population suffer from mental health issues in Pangasinam,REFERRED,for thesis,11/20/2022 - 11/20/2022,https://www.foi.gov.ph/requests/aglzfmVmb2ktcGhyIAsSB0NvbnRlbnQiE1BPUENPTS0wMzE1NDYyNjc4ODEM
PVAO,"November 20, 2022",WW2 Zamboanga Del Sur Veterans,PENDING,to know about his serial number,09/01/1939 - 09/02/1945,https://www.foi.gov.ph/requests/aglzfmVmb2ktcGhyHgsSB0NvbnRlbnQiEVBWQU8tMDczNDk2MzkzODMxDA
DOH,"November 20, 2022",Dengue cases for every province of the Philippines (2016-2022),PROCESSING,Research,01/01/2016 - 11/01/2022,https://www.foi.gov.ph/requests/aglzfmVmb2ktcGhyHQsSB0NvbnRlbnQiEERPSC0yMzY4Mzg4MjU4NjUM
MMDA,"November 20, 2022",Raw Data of Pedestrian and Bicycle-Related Accidents from 2012-2022,PARTIALLY SUCCESSFUL,Case Study,01/01/2012 - 11/20/2022,https://www.foi.gov.ph/requests/aglzfmVmb2ktcGhyHgsSB0NvbnRlbnQiEU1NREEtMzc1ODAzNzY4MTc3DA
BSWM,"November 20, 2022","RemoS and GIS-aided Suitability Analysis of Lands in San Jose, Occidental Mindoro for Growing Onions",PROCESSING,For our research project that is our final project for GsE 189 under BS GE in UP Diliman,10/20/2022 - 11/20/2022,https://www.foi.gov.ph/requests/aglzfmVmb2ktcGhyHgsSB0NvbnRlbnQiEUJTV00tNjc4MDg1MTA2MDA2DA
NTC,"November 20, 2022",Online lending app,REFERRED,For shut down or closed,10/31/2022 - 11/20/2022,https://www.foi.gov.ph/requests/aglzfmVmb2ktcGhyHQsSB0NvbnRlbnQiEE5UQy05MDE2MjUzMDI1NzYM
TSU,"November 20, 2022",BS Architecture syllabus 2005-2010,AWAITING CLARIFICATION,Requirements for Accreditation of Profession in other country,06/01/2005 - 04/15/2010,https://www.foi.gov.ph/requests/aglzfmVmb2ktcGhyHQsSB0NvbnRlbnQiEFRTVS02NTA1Nzg2Nzg5NjAM
BI,"November 20, 2022",Affidavit and documents required for international travel as a tourist,PARTIALLY SUCCESSFUL,Information and documentation,11/20/2022 - 11/20/2022,https://www.foi.gov.ph/requests/aglzfmVmb2ktcGhyHAsSB0NvbnRlbnQiD0JJLTE0ODA0NTE4NzUzOQw
FOIPMO,"November 20, 2022",Vaxcert,REFERRED,Travel purpose,09/11/2022 - 11/20/2022,https://www.foi.gov.ph/requests/aglzfmVmb2ktcGhyIAsSB0NvbnRlbnQiE0ZPSVBNTy0xNzMyNjg2OTk3NTIM
BIR,"November 20, 2022",The number of Registered Motorcycle (2 wheel vehicle) Business in North and South Caloocan City,ACCEPTED,Research Study,01/01/2016 - 12/31/2021,https://www.foi.gov.ph/requests/aglzfmVmb2ktcGhyHQsSB0NvbnRlbnQiEEJJUi0xOTE3MDI5NzcxODQM
NBI,"November 20, 2022",Online Scammer,DENIED,Should be accountable for her actions.,11/18/2022 - 11/20/2022,https://www.foi.gov.ph/requests/aglzfmVmb2ktcGhyHQsSB0NvbnRlbnQiEE5CSS03NzMzNjc2NjgxNTAM
LMB,"November 20, 2022","Cadastral Map of San Pablo City, Laguna",SUCCESSFUL,Research and development,11/20/2022 - 11/20/2022,https://www.foi.gov.ph/requests/aglzfmVmb2ktcGhyIQsSB0NvbnRlbnQiFERFTlJMTUItMTM3NjUxNzEwNTM0DA
CHED,"November 20, 2022",NUMBER OF GRADUATES,ACCEPTED,For thesis purposes,11/20/2022 - 11/20/2022,https://www.foi.gov.ph/requests/aglzfmVmb2ktcGhyHgsSB0NvbnRlbnQiEUNIRUQtOTY1ODM4MjE5MDEyDA
PSA,"November 20, 2022",NUMBER OF GRADUATES,PARTIALLY SUCCESSFUL,For undergraduate architectural thesis purposes,08/01/2022 - 09/21/2022,https://www.foi.gov.ph/requests/aglzfmVmb2ktcGhyHQsSB0NvbnRlbnQiEFBTQS0wODA1NjA0MDQ0MTMM
PSA,"November 20, 2022",Mixed-Use Commercial Development in the Philippines,PENDING,Research and Development,01/01/2020 - 11/13/2022,https://www.foi.gov.ph/requests/aglzfmVmb2ktcGhyHQsSB0NvbnRlbnQiEFBTQS0wNzY0ODA0NzM0MzAM
DPWH,"November 20, 2022",Demand of Mixed-Use Commercial Development in the Philippines,DENIED,Research and Development,01/01/2020 - 11/13/2022,https://www.foi.gov.ph/requests/aglzfmVmb2ktcGhyHgsSB0NvbnRlbnQiEURQV0gtMjA0MzQ4ODc1OTMxDA
SSS,"November 20, 2022",Name and/or date of birth does not match on my sss record,SUCCESSFUL,Acces my sss acount on online application of sss,11/20/2022 - 11/20/2022,https://www.foi.gov.ph/requests/aglzfmVmb2ktcGhyHQsSB0NvbnRlbnQiEFNTUy02NDg4MzU0MTE1MjEM
LTO,"November 20, 2022",Number of registered motorycle (two wheel) in NCR with breakdown per City,SUCCESSFUL,Research Paper,01/01/2016 - 12/31/2021,https://www.foi.gov.ph/requests/aglzfmVmb2ktcGhyHQsSB0NvbnRlbnQiEExUTy0xOTI2MzU4ODE2NTkM
DA,"November 20, 2022",Agriculture and Aquaculture sectors in CALABARZON,SUCCESSFUL,Architecture Thesis,11/20/2022 - 11/20/2022,https://www.foi.gov.ph/requests/aglzfmVmb2ktcGhyHAsSB0NvbnRlbnQiD0RBLTkwNjY1NDcxMjc0MQw
CHED,"November 20, 2022",accreditition and permit of pacific intercontental college to offer trasnnational education,AWAITING CLARIFICATION,for verification,10/22/2022 - 11/20/2022,https://www.foi.gov.ph/requests/aglzfmVmb2ktcGhyHgsSB0NvbnRlbnQiEUNIRUQtOTkyODc1MzM1OTY1DA
DENR,"November 20, 2022",DATA FILE OR CERTIFIED TRU COPY CADT IN TALAKAG BUKIDNON,DENIED,FOR REVIEW AND REFERENCE,07/18/1963 - 12/09/1991,https://www.foi.gov.ph/requests/aglzfmVmb2ktcGhyHgsSB0NvbnRlbnQiEURFTlItMTAzNDQyNDgzMTcxDA
SEC,"November 20, 2022",OLA HARASSMENT,SUCCESSFUL,Illegal and Fraud OLA Harassment,10/10/2022 - 11/20/2022,https://www.foi.gov.ph/requests/aglzfmVmb2ktcGhyHQsSB0NvbnRlbnQiEFNFQy00MjA0ODE5NzQ4MTMM
DA,"November 20, 2022",Census of Agriculture and Fisheries,SUCCESSFUL,Research and Development,01/01/2020 - 11/20/2022,https://www.foi.gov.ph/requests/aglzfmVmb2ktcGhyHAsSB0NvbnRlbnQiD0RBLTcxMTU3MTMwMDA2OQw
PSA,"November 20, 2022",Census of Agriculture and Fisheries,SUCCESSFUL,Research and Development,01/01/2020 - 11/20/2022,https://www.foi.gov.ph/requests/aglzfmVmb2ktcGhyHQsSB0NvbnRlbnQiEFBTQS05MTcwMzA3MTM4MDgM
DOF,"November 20, 2022",The Financial Statement of the Municipality of Solano in Nueva Vizcaya,REFERRED,Research and Development,01/01/2019 - 06/30/2022,https://www.foi.gov.ph/requests/aglzfmVmb2ktcGhyHQsSB0NvbnRlbnQiEERPRi05MTk4NDg3NDAyNzYM
DOH,"November 20, 2022",Doh covid 19 compensation,PROCESSING,To claim doh assistance covid 19,02/07/2022 - 02/25/2022,https://www.foi.gov.ph/requests/aglzfmVmb2ktcGhyHQsSB0NvbnRlbnQiEERPSC05MzA4NzM3NDkzNDEM
NTC,"November 20, 2022",Number of Complaints filed and reported every month for NCR,ACCEPTED,For Academic Purposes Only,11/20/2012 - 11/20/2022,https://www.foi.gov.ph/requests/aglzfmVmb2ktcGhyHQsSB0NvbnRlbnQiEE5UQy01NzY2MjEzNzI5NDIM
DOT,"November 20, 2022",Number of tourists in Nueva Ecija,AWAITING CLARIFICATION,Academic Purpose,01/01/2015 - 11/20/2022,https://www.foi.gov.ph/requests/aglzfmVmb2ktcGhyHQsSB0NvbnRlbnQiEERPVC04MzMwMzM2NzM4NDAM
LTO,"November 20, 2022","Number of Private and Public Vehicles in Labo, Camarines Norte registered from year 2017-2021",SUCCESSFUL,For educational purposes,01/01/2017 - 12/31/2021,https://www.foi.gov.ph/requests/aglzfmVmb2ktcGhyHQsSB0NvbnRlbnQiEExUTy0wMzg4MjkyMDg4MzIM
DPWH,"November 20, 2022","Soil Investigation Report near L. Sumulong Circle Road, Brgy. San Roque, Antipolo City",PENDING,CE Design Project,11/20/2022 - 11/20/2022,https://www.foi.gov.ph/requests/aglzfmVmb2ktcGhyHgsSB0NvbnRlbnQiEURQV0gtMTAwMTI2Nzc5ODYwDA
DPWH,"November 20, 2022","Feasibility Study of Ala-uli Flyover in Pilar, Bataan",AWAITING CLARIFICATION,Research and Development,11/20/2022 - 11/20/2022,https://www.foi.gov.ph/requests/aglzfmVmb2ktcGhyHgsSB0NvbnRlbnQiEURQV0gtNzAwNjA0MTcyODAyDA
PDEA,"November 20, 2022",Drug Rates of CALABARZON covering the Period from 2019 to 2022,PENDING,Research,01/01/2019 - 11/20/2022,https://www.foi.gov.ph/requests/aglzfmVmb2ktcGhyHgsSB0NvbnRlbnQiEVBERUEtNDI4NTg1MjgwMTk2DA
PSA,"November 20, 2022",Latest Binondo Socio-economic Profile,PARTIALLY SUCCESSFUL,Architectural Research,11/20/2022 - 11/20/2022,https://www.foi.gov.ph/requests/aglzfmVmb2ktcGhyHQsSB0NvbnRlbnQiEFBTQS01NjQ1MzQ4MDY2ODEM
PSA,"November 20, 2022",Generation Z Population for Thesis requirement,SUCCESSFUL,Thesis,01/01/1996 - 12/31/2012,https://www.foi.gov.ph/requests/aglzfmVmb2ktcGhyHQsSB0NvbnRlbnQiEFBTQS02NzUzNDQ3MjYyMDMM
NTC,"November 20, 2022",Report Scam,PARTIALLY SUCCESSFUL,I want my money back and stop their bullshit operations so they can't fool people.,11/20/2022 - 11/20/2022,https://www.foi.gov.ph/requests/aglzfmVmb2ktcGhyHQsSB0NvbnRlbnQiEE5UQy00NzgzMDgzNjUwNzEM
MMDA,"November 20, 2022","Annual Average Daily Traffic (AADT) in Filinvest City, Alabang, Muntinlupa",PENDING,academic purpose (Thesis),01/01/2019 - 12/31/2021,https://www.foi.gov.ph/requests/aglzfmVmb2ktcGhyHgsSB0NvbnRlbnQiEU1NREEtMTcxNDQwNTY4OTEzDA
IA,"November 20, 2022","TOTAL NUMBER OF STUDENTS AND EMPLOYEES IN INTRAMUROS, MANILA",DENIED,Business Research,03/09/2020 - 07/06/2022,https://www.foi.gov.ph/requests/aglzfmVmb2ktcGhyHAsSB0NvbnRlbnQiD0lBLTk3Mjk4MTYxMDc0Mww
IA,"November 20, 2022","TOTAL POPULATION OF INTRAMUROS, MANILA",DENIED,Business Research,03/18/2020 - 11/12/2022,https://www.foi.gov.ph/requests/aglzfmVmb2ktcGhyHAsSB0NvbnRlbnQiD0lBLTQ5MjE3NTIzNDgwMQw
DOT,"November 20, 2022","The Number of Tourist Arrival in Malaybalay, Bukidnon",AWAITING CLARIFICATION,Research and Development,11/20/2012 - 11/20/2022,https://www.foi.gov.ph/requests/aglzfmVmb2ktcGhyHQsSB0NvbnRlbnQiEERPVC04MzI5MTA3NDMwNTkM
OWWA,"November 20, 2022",30k financial assistance,SUCCESSFUL,Know applocation status for tabang program,08/20/2021 - 11/20/2022,https://www.foi.gov.ph/requests/aglzfmVmb2ktcGhyHgsSB0NvbnRlbnQiEU9XV0EtNzk3MTM4Nzg1ODI5DA
PSA,"November 20, 2022",Family income and expenditure survey 2021,PARTIALLY SUCCESSFUL,Graduate thesis,11/20/2020 - 11/20/2022,https://www.foi.gov.ph/requests/aglzfmVmb2ktcGhyHQsSB0NvbnRlbnQiEFBTQS02MTU1NDAxNzAzNTEM
CHED,"November 20, 2022",MRequest |EMOI/MOI - Certificate of English as Medium of Instruction,DENIED,International Study,11/03/2022 - 11/20/2022,https://www.foi.gov.ph/requests/aglzfmVmb2ktcGhyHgsSB0NvbnRlbnQiEUNIRUQtMTY2NDYxODQ3NjM1DA
BatSU,"November 20, 2022","CLUP, CDP, and Zoning Ordinance of Amadeo, Cavite",DENIED,ARCHITECTURAL RESEARCH PURPOSES,11/20/2022 - 11/20/2022,https://www.foi.gov.ph/requests/aglzfmVmb2ktcGhyHwsSB0NvbnRlbnQiEkJBVFNVLTYzMjk2NzE4OTEwMQw
BIR,"November 20, 2022",ITRs,AWAITING CLARIFICATION,Engineers Australia Skills Assessment,05/23/2017 - 06/03/2021,https://www.foi.gov.ph/requests/aglzfmVmb2ktcGhyHQsSB0NvbnRlbnQiEEJJUi05NzU5Mzc1NTU4NjIM
