agency,date,title,status,purpose,period_covered,link
SSS,"May 11, 2023",disclosure statement on Loan Credit Transaction,PENDING,Requirement of employer,05/11/2023 - 05/11/2023,https://www.foi.gov.ph/requests/aglzfmVmb2ktcGhyHQsSB0NvbnRlbnQiEFNTUy0yODU3MTUxMDYxNTkM
DENR,"May 11, 2023",Number of Tons of coconut shell turn into charcoal transport in Cebu,DENIED,Research and Development,05/11/2020 - 05/11/2023,https://www.foi.gov.ph/requests/aglzfmVmb2ktcGhyHgsSB0NvbnRlbnQiEURFTlItNDE4MDczNDUwMTM5DA
LRA,"May 11, 2023",NOTICE OF LIS PENDENS,SUCCESSFUL,REFERENCE,05/11/2006 - 05/11/2008,https://www.foi.gov.ph/requests/aglzfmVmb2ktcGhyHQsSB0NvbnRlbnQiEExSQS0wMjY1NDc0ODk2NzQM
NAP,"May 11, 2023",NOTICE OF LIS PENDENS,DENIED,reference,05/11/2006 - 01/05/2008,https://www.foi.gov.ph/requests/aglzfmVmb2ktcGhyHQsSB0NvbnRlbnQiEE5BUC0yMjU0NzMwOTMxNDQM
NTC,"May 11, 2023",Request to block my stolen/lost phone,PARTIALLY SUCCESSFUL,Block/Lock my phone For my private information security,05/10/2023 - 05/11/2023,https://www.foi.gov.ph/requests/aglzfmVmb2ktcGhyHQsSB0NvbnRlbnQiEE5UQy03Nzc5NDcxOTk3OTEM
LMB,"May 11, 2023",Registered land.,DENIED,Grandparent's property.,05/11/1970 - 05/11/2023,https://www.foi.gov.ph/requests/aglzfmVmb2ktcGhyIQsSB0NvbnRlbnQiFERFTlJMTUItMjgzOTMzOTQ1NTQzDA
RTU,"May 11, 2023","The number of JHS, SHS, and college students in Rizal Technological University",SUCCESSFUL,Research and Development,08/08/2022 - 05/11/2023,https://www.foi.gov.ph/requests/aglzfmVmb2ktcGhyHQsSB0NvbnRlbnQiEFJUVS01MzY4OTczOTEwMzkM
DepEd,"May 11, 2023",Highschool Dimploma,SUCCESSFUL,Job requirement.,06/11/2008 - 04/15/2009,https://www.foi.gov.ph/requests/aglzfmVmb2ktcGhyHwsSB0NvbnRlbnQiEkRlcEVkLTkwNTY2NzA5ODUyNgw
PSA,"May 11, 2023",Quarterly nationwide female employment rate from 2011 Q1 to 2022 Q4,PENDING,Student Research,01/01/2011 - 12/31/2022,https://www.foi.gov.ph/requests/aglzfmVmb2ktcGhyHQsSB0NvbnRlbnQiEFBTQS02NDAzMzg2OTYxODYM
SSS,"May 11, 2023",Certificate of Total SSS Contribution,PENDING,Visa Application Requirement,11/01/2017 - 04/01/2023,https://www.foi.gov.ph/requests/aglzfmVmb2ktcGhyHQsSB0NvbnRlbnQiEFNTUy03MzcxMzI3ODAxMjMM
LRA,"May 11, 2023",JOINT AFFIDAVIT OF ADVERSE CLAIM,SUCCESSFUL,REFERENCE,05/02/2002 - 05/01/2007,https://www.foi.gov.ph/requests/aglzfmVmb2ktcGhyHQsSB0NvbnRlbnQiEExSQS0xMDU2ODg1NTAxMDkM
SRWD2,"May 11, 2023",Booster Vaccine Certificate,DENIED,Job Requirement,02/01/2023 - 02/15/2023,https://www.foi.gov.ph/requests/aglzfmVmb2ktcGhyHwsSB0NvbnRlbnQiElNSV0QyLTIxNDU1OTQ4NTkxNQw
NAP,"May 11, 2023",Joint Affidavit of Adverse Claim,DENIED,reference,05/01/2002 - 05/01/2007,https://www.foi.gov.ph/requests/aglzfmVmb2ktcGhyHQsSB0NvbnRlbnQiEE5BUC0wMDQ2NjM3NTczNzMM
NBI,"May 11, 2023",scammed https://www.shoppo.life/index,PENDING,i need my money back!,05/11/2023 - 05/11/2023,https://www.foi.gov.ph/requests/aglzfmVmb2ktcGhyHQsSB0NvbnRlbnQiEE5CSS01MTQxOTYzMjI2NTEM
SSS,"May 11, 2023",Loan Voucher,PENDING,For Settlement/Payment,04/01/2017 - 05/11/2023,https://www.foi.gov.ph/requests/aglzfmVmb2ktcGhyHQsSB0NvbnRlbnQiEFNTUy04MTYzNzAwNjE0MDkM
NAP,"May 11, 2023",notarized real estate mortgage,DENIED,reference,01/05/1992 - 01/05/1994,https://www.foi.gov.ph/requests/aglzfmVmb2ktcGhyHQsSB0NvbnRlbnQiEE5BUC0xNTY3MjMyMjk4MDMM
BIR,"May 11, 2023",Notarized deed of sale,DENIED,reference,05/01/2008 - 05/01/2010,https://www.foi.gov.ph/requests/aglzfmVmb2ktcGhyHQsSB0NvbnRlbnQiEEJJUi0wNjc5OTE5MjY5MTYM
NAP,"May 11, 2023",notarized deed of sale,DENIED,for reference,01/02/2008 - 01/02/2009,https://www.foi.gov.ph/requests/aglzfmVmb2ktcGhyHQsSB0NvbnRlbnQiEE5BUC0xMjUzNzg3NTIwNjEM
DOLE,"May 11, 2023",margareth rillo convicted as serial killer real-time blacklisted blackout employment banned in DOLE,PENDING,PNP Blotter Report for suspect margareth rillo employment banned permanent death in PH.,01/01/2017 - 05/11/2023,https://www.foi.gov.ph/requests/aglzfmVmb2ktcGhyHgsSB0NvbnRlbnQiEURPTEUtNjY1NjgyNjkwNTcyDA
DPWH,"May 11, 2023","DETAILED ENGINEERING DESIGN PLAN CONSTRUCTION OF MULTI - PURPOSE BUILDING BARANGAY STA. ANA, BULAKAN",AWAITING CLARIFICATION,Guide Plan for a project in Principles of Steel Design - Drafting,05/11/2023 - 05/11/2023,https://www.foi.gov.ph/requests/aglzfmVmb2ktcGhyHgsSB0NvbnRlbnQiEURQV0gtNjIyNTE2NDM2ODMyDA
DILG,"May 11, 2023",lease contract quezon city public market ppp,PENDING,research,05/11/2023 - 05/11/2023,https://www.foi.gov.ph/requests/aglzfmVmb2ktcGhyHgsSB0NvbnRlbnQiEURJTEctNTQ0ODE2MzM4OTUwDA
DENR,"May 11, 2023","Average PM 2.5 Ambient Concentration of Dasmariñas City, Cavite Annually from 2012 to 2022",DENIED,Research Requirement (Data Collection),01/01/2012 - 12/31/2022,https://www.foi.gov.ph/requests/aglzfmVmb2ktcGhyHgsSB0NvbnRlbnQiEURFTlItNTkzOTk1NTQ3NTc3DA
DPWH,"May 11, 2023","DETAILED ENGINEERING DESCONSTRUCTION OF MULTI - PURPOSE BUILDING BARANGAY STA. ANA, BULAKAN, BULACAN",AWAITING CLARIFICATION,Guide Plan for a project in Principles of Steel Design - Drafting,05/11/2023 - 05/11/2023,https://www.foi.gov.ph/requests/aglzfmVmb2ktcGhyHgsSB0NvbnRlbnQiEURQV0gtMzU4OTcyNjA3OTA0DA
DENR FMB,"May 11, 2023",Forest Development Map LC 2848,DENIED,Research before acquisition,05/11/2023 - 05/11/2023,https://www.foi.gov.ph/requests/aglzfmVmb2ktcGhyIQsSB0NvbnRlbnQiFERFTlJGTUItOTA0MjY3MjAwNzY2DA
DOH,"May 11, 2023",National Children's Hospital Data and Information,PROCESSING,Architectural Thesis,05/10/2023 - 05/11/2023,https://www.foi.gov.ph/requests/aglzfmVmb2ktcGhyHQsSB0NvbnRlbnQiEERPSC05NTMwNjM3ODg4ODUM
PNP,"May 11, 2023",IRR of RA 11917,ACCEPTED,Research and development,01/01/2022 - 05/11/2023,https://www.foi.gov.ph/requests/aglzfmVmb2ktcGhyHQsSB0NvbnRlbnQiEFBOUC01MjM2MzMwNTExNTIM
BSWM,"May 11, 2023",Soil Quality Standards in the Philippines,PROCESSING,Research,05/11/2023 - 05/11/2023,https://www.foi.gov.ph/requests/aglzfmVmb2ktcGhyHgsSB0NvbnRlbnQiEUJTV00tNjQzNzAyMjg4NDIxDA
DBM,"May 11, 2023",NOSCA follow up updates,SUCCESSFUL,FOLLOW UP MY NOSCA,04/19/2023 - 05/09/2023,https://www.foi.gov.ph/requests/aglzfmVmb2ktcGhyHQsSB0NvbnRlbnQiEERCTS0zMDY5NDI3ODczMzgM
NBI,"May 11, 2023",Supporting document for Paymaya scam,PENDING,To file a complaint against the scammer,05/11/2023 - 05/11/2023,https://www.foi.gov.ph/requests/aglzfmVmb2ktcGhyHQsSB0NvbnRlbnQiEE5CSS0zMjk1MTIyNzcxOTAM
BIR,"May 11, 2023",Income Tax Return,AWAITING CLARIFICATION,Scholarship application,04/11/2023 - 05/11/2023,https://www.foi.gov.ph/requests/aglzfmVmb2ktcGhyHQsSB0NvbnRlbnQiEEJJUi00ODE1MTk3NDY0OTMM
DOLE,"May 11, 2023",List of Companies that Closed in Cavite last 2017,PENDING,for skills assessment for visa processing,01/01/2017 - 12/31/2017,https://www.foi.gov.ph/requests/aglzfmVmb2ktcGhyHgsSB0NvbnRlbnQiEURPTEUtMTI3NTMxNTE2NjM2DA
LTO,"May 11, 2023",Practical Driving Cert,ACCEPTED,Personal for application of Driver License,04/29/2023 - 05/11/2023,https://www.foi.gov.ph/requests/aglzfmVmb2ktcGhyHQsSB0NvbnRlbnQiEExUTy0xMjc0MzM4OTg3MTcM
MGB,"May 11, 2023",Number of operating mining companies in Region XII,ACCEPTED,"Environmental Law Research, Academic Research",05/11/2023 - 05/11/2023,https://www.foi.gov.ph/requests/aglzfmVmb2ktcGhyHQsSB0NvbnRlbnQiEE1HQi02NjczNzg5MTM4NTcM
MMDA,"May 11, 2023",Existing Land Use of Metro Manila Cities,DENIED,Academic Research,01/01/2023 - 05/06/2023,https://www.foi.gov.ph/requests/aglzfmVmb2ktcGhyHgsSB0NvbnRlbnQiEU1NREEtNzAzNDg1NjgxMjcxDA
BAI,"May 11, 2023",Selected Retail Price List of Animal Feed,PENDING,College Thesis,01/01/2012 - 12/31/2022,https://www.foi.gov.ph/requests/aglzfmVmb2ktcGhyHQsSB0NvbnRlbnQiEEJBSS0zODY1MzIzOTIzMzcM
PNPDRD,"May 11, 2023",Cavite Age Group of VAW Victims,PENDING,Architecture Thesis,01/01/2016 - 12/31/2022,https://www.foi.gov.ph/requests/aglzfmVmb2ktcGhyIAsSB0NvbnRlbnQiE1BOUERSRC0zNjY4OTI4MDE2MzYM
LTO,"May 11, 2023",Number of Registered Vehicles (Public and Private) in MIMAROPA,PARTIALLY SUCCESSFUL,Research and Development,12/30/2010 - 12/30/2022,https://www.foi.gov.ph/requests/aglzfmVmb2ktcGhyHQsSB0NvbnRlbnQiEExUTy05OTQ5NTc5ODAxODMM
DOJ,"May 11, 2023",Criminal Case Verification,SUCCESSFUL,Verification,01/01/2019 - 05/11/2023,https://www.foi.gov.ph/requests/aglzfmVmb2ktcGhyHQsSB0NvbnRlbnQiEERPSi04ODQ4MjQ2NDE1MDUM
PSA,"May 11, 2023","Teenage Pregnant adolescents by region, from 2010 up to 2023",PENDING,Undergraduate Thesis,01/01/2010 - 01/01/2023,https://www.foi.gov.ph/requests/aglzfmVmb2ktcGhyHQsSB0NvbnRlbnQiEFBTQS0yNDIwODg0NzY3NDgM
CARSU,"May 11, 2023",Cabadbaran River Watershed Forest,PENDING,Educational Purposes,01/01/2000 - 05/11/2023,https://www.foi.gov.ph/requests/aglzfmVmb2ktcGhyHwsSB0NvbnRlbnQiEkNBUlNVLTA0MTAwMjkyNTUxOQw
PNR,"May 11, 2023",PNR MONTHLY AND ANNUAL RIDERSHIP DATA (2000-2023),AWAITING CLARIFICATION,Graduate thesis,01/01/2000 - 05/11/2023,https://www.foi.gov.ph/requests/aglzfmVmb2ktcGhyHQsSB0NvbnRlbnQiEFBOUi0yMDk1MzQ3MzA2MzYM
LRTA,"May 11, 2023",LRT1 AND LRT 2 MONTHLY AND ANNUAL RIDERSHIP DATA (2000-2023),PENDING,Graduate thesis,01/01/2000 - 05/11/2023,https://www.foi.gov.ph/requests/aglzfmVmb2ktcGhyHgsSB0NvbnRlbnQiEUxSVEEtODUwOTQyMzA4MDU4DA
LMB,"May 11, 2023",cadastral map / technical description,DENIED,for documentation/verification,04/01/1955 - 05/28/1955,https://www.foi.gov.ph/requests/aglzfmVmb2ktcGhyIQsSB0NvbnRlbnQiFERFTlJMTUItNDU4NDM4ODIyOTYwDA
NTC,"May 11, 2023",I was scammed by Organize-shop.vip,DENIED,to return my money in gcash and stop them to scammiing the poor people like me .,05/10/2023 - 05/10/2023,https://www.foi.gov.ph/requests/aglzfmVmb2ktcGhyHQsSB0NvbnRlbnQiEE5UQy03NjU1MzYzMjIwMjcM
SBMA,"May 11, 2023",Structural Plans - 411A&B Zambales Highway,SUCCESSFUL,to use the said plans as reference in the renovation of the said housing units,11/24/1996 - 05/11/2023,https://www.foi.gov.ph/requests/aglzfmVmb2ktcGhyHgsSB0NvbnRlbnQiEVNCTUEtNTg5NjY2MDczNTEzDA
DENR,"May 11, 2023",Survey plan,SUCCESSFUL,Requirements for renovation building permit,01/01/2020 - 01/01/2023,https://www.foi.gov.ph/requests/aglzfmVmb2ktcGhyHgsSB0NvbnRlbnQiEURFTlItNjk0OTM1NDE4NDk2DA
CEZA,"May 11, 2023",2018 Financial Technology Solutions (FTSOVC) Rules & Regulations,SUCCESSFUL,Research,01/01/2018 - 05/11/2023,https://www.foi.gov.ph/requests/aglzfmVmb2ktcGhyHgsSB0NvbnRlbnQiEUNFWkEtMTQ2NTkwNjExMzcxDA
NBI,"May 11, 2023",to refund my payment in gcash,PENDING,requirements,05/09/2023 - 05/11/2023,https://www.foi.gov.ph/requests/aglzfmVmb2ktcGhyHQsSB0NvbnRlbnQiEE5CSS04NzczMzYwMjI4NzMM
MMDA,"May 11, 2023",First Pedestrian Overpass/Footbridge ever built in Metro Manila,PENDING,Historical Research,01/01/1900 - 05/11/2023,https://www.foi.gov.ph/requests/aglzfmVmb2ktcGhyHgsSB0NvbnRlbnQiEU1NREEtNTI1MDUyOTk1OTExDA
PSA,"May 11, 2023","Total Registered Micro, Small and Medium Enterprises",SUCCESSFUL,Research,01/01/2020 - 01/01/2022,https://www.foi.gov.ph/requests/aglzfmVmb2ktcGhyHQsSB0NvbnRlbnQiEFBTQS0xMTg4OTc1MzkwMDUM
CHED,"May 11, 2023",OJT REQUIREMENTS AND INFORMATION FOR BSBA - HUMAN RESOURCE MANAGEMENT MAJOR,AWAITING CLARIFICATION,APPLICATION FOR GRADUATION,01/01/2023 - 05/09/2023,https://www.foi.gov.ph/requests/aglzfmVmb2ktcGhyHgsSB0NvbnRlbnQiEUNIRUQtMTAyNjEwNDc3MzY0DA
BSWM,"May 11, 2023",Soil Report / Soil Classification,DENIED,Feasibility Study,05/11/2023 - 05/11/2023,https://www.foi.gov.ph/requests/aglzfmVmb2ktcGhyHgsSB0NvbnRlbnQiEUJTV00tNjAwMzcyNzc4MTg4DA
BLGF,"May 11, 2023","Parañaque City Ordinance Nos. 09-02, 19-29 and 10-09",DENIED,Research,05/11/2009 - 05/11/2023,https://www.foi.gov.ph/requests/aglzfmVmb2ktcGhyHgsSB0NvbnRlbnQiEUJMR0YtOTc5OTg0ODE4NjE4DA
BLGF,"May 11, 2023","Parañaque City Ordinance Nos. 19-29, 09-02 and 10-09",DENIED,Research,05/11/2009 - 05/11/2023,https://www.foi.gov.ph/requests/aglzfmVmb2ktcGhyHgsSB0NvbnRlbnQiEUJMR0YtMzczNTY5ODI5MjkzDA
LTO,"May 11, 2023",Official Receipt,PENDING,Resend my Official Receipt at my active email,04/14/2023 - 05/10/2023,https://www.foi.gov.ph/requests/aglzfmVmb2ktcGhyHQsSB0NvbnRlbnQiEExUTy0xNzIyNjM2NjA0NDIM
PNOCEC,"May 11, 2023",The number of barrels of petroleum products consumed in Puerto Princesa City from 2010-2022,DENIED,Research and Development,12/30/2010 - 12/30/2022,https://www.foi.gov.ph/requests/aglzfmVmb2ktcGhyIAsSB0NvbnRlbnQiE1BOT0NFQy0yNDM0NTA1ODE5OTgM
BUCOR,"May 11, 2023",Site Selection Criteria for developing correctional centers,PENDING,Thesis,04/01/2023 - 05/11/2023,https://www.foi.gov.ph/requests/aglzfmVmb2ktcGhyHwsSB0NvbnRlbnQiEkJVQ09SLTA0ODY1NTUwMzE5Mgw
PAGASA,"May 11, 2023","Flood Hazard Map of Region I, II and CAR",SUCCESSFUL,Research and Development,01/01/2012 - 01/01/2022,https://www.foi.gov.ph/requests/aglzfmVmb2ktcGhyIAsSB0NvbnRlbnQiE1BBR0FTQS04NDIxNjU0OTc5OTMM
PSA,"May 11, 2023",Regional female employment rate from 2013 to 2017,PENDING,Student research,01/01/2013 - 12/31/2017,https://www.foi.gov.ph/requests/aglzfmVmb2ktcGhyHQsSB0NvbnRlbnQiEFBTQS0zODAzMzA1MzYxNzcM
DepEd,"May 11, 2023",High school diploma,SUCCESSFUL,To be submitted to my employer,06/10/1985 - 06/10/1989,https://www.foi.gov.ph/requests/aglzfmVmb2ktcGhyHwsSB0NvbnRlbnQiEkRlcEVkLTMxNjQzNzUyNTg2NQw
NSWMC,"May 11, 2023",NSWMC Resolution No. 1150 Series of 2018,PENDING,Filing of all documents/attachments for SGLG,01/01/2018 - 12/31/2018,https://www.foi.gov.ph/requests/aglzfmVmb2ktcGhyHwsSB0NvbnRlbnQiEk5TV01DLTE4OTc1NjAzMTAzNAw
DOJ,"May 11, 2023",PESO ONLINE COW LENDING APP,SUCCESSFUL,Because i can't afford to pay that loan within a week with very high interest,05/11/2023 - 05/11/2023,https://www.foi.gov.ph/requests/aglzfmVmb2ktcGhyHQsSB0NvbnRlbnQiEERPSi0yOTY1ODM1MDk3MzUM
NSWMC,"May 11, 2023",NSWMC Resolution No. 1150 s 2018,PENDING,For collection of data for the 2023 SGLG,01/01/2018 - 12/31/2018,https://www.foi.gov.ph/requests/aglzfmVmb2ktcGhyHwsSB0NvbnRlbnQiEk5TV01DLTQyMTY2NzQzNzE0NQw
UsaP,"May 11, 2023",Standard Operating Procedure of Ugnayan sa Pasig/Freedom of information,SUCCESSFUL,Research and development,05/11/2023 - 05/11/2023,https://www.foi.gov.ph/requests/aglzfmVmb2ktcGhyHgsSB0NvbnRlbnQiEVVTQVAtNjUxMTkzMzQ4MzU3DA
PSA,"May 11, 2023",ANTIPOLO STUDENT POPULATION,PENDING,Research,05/11/2023 - 05/11/2023,https://www.foi.gov.ph/requests/aglzfmVmb2ktcGhyHQsSB0NvbnRlbnQiEFBTQS00NDUwNjUzOTM4MTQM
DOT,"May 11, 2023","Tourist Arrival in Taytay, Rizal",DENIED,for academic purposes,01/01/2010 - 05/11/2023,https://www.foi.gov.ph/requests/aglzfmVmb2ktcGhyHQsSB0NvbnRlbnQiEERPVC04MTk2NTEzNDY4OTQM
NBI,"May 11, 2023",Seek Assistance from Scam,PENDING,Report,05/10/2023 - 05/11/2023,https://www.foi.gov.ph/requests/aglzfmVmb2ktcGhyHQsSB0NvbnRlbnQiEE5CSS03NDUyMTEzMDAyNTcM
DOJ,"May 11, 2023",Filed Pending Case Verification,SUCCESSFUL,Personal knowledge to have,01/01/2011 - 05/11/2023,https://www.foi.gov.ph/requests/aglzfmVmb2ktcGhyHQsSB0NvbnRlbnQiEERPSi03NzkwODg0NDY5NTEM
CHED,"May 11, 2023",Transcript of Record,ACCEPTED,Government Employment Requirements,06/15/1998 - 10/11/2003,https://www.foi.gov.ph/requests/aglzfmVmb2ktcGhyHgsSB0NvbnRlbnQiEUNIRUQtNjMzMDc2MjY3MTM5DA
NTC,"May 11, 2023",Selling of Internet,PENDING,Comfirmation and Verification,12/20/2022 - 05/11/2023,https://www.foi.gov.ph/requests/aglzfmVmb2ktcGhyHQsSB0NvbnRlbnQiEE5UQy04NDA0OTEwMDM5NDMM
LMB,"May 11, 2023",Cadastral Map,DENIED,Relocation,01/01/1980 - 05/11/2023,https://www.foi.gov.ph/requests/aglzfmVmb2ktcGhyIQsSB0NvbnRlbnQiFERFTlJMTUItODkwOTY1OTI0MDc5DA
NCCA,"May 11, 2023",Metropolitan Theater High Resolution Render/photo,PENDING,"Will be used for the Philippine Independence Day Celebration Event in Doha, Qatar",01/11/2020 - 05/11/2023,https://www.foi.gov.ph/requests/aglzfmVmb2ktcGhyHgsSB0NvbnRlbnQiEU5DQ0EtMzk5MDQ0MDYzODU3DA
LMB,"May 11, 2023",Comprehensive Land Use Plan of Abra,ACCEPTED,Research and Development,05/11/2023 - 05/11/2023,https://www.foi.gov.ph/requests/aglzfmVmb2ktcGhyIQsSB0NvbnRlbnQiFERFTlJMTUItNjM0Mzk1NzIxMjM1DA
SBMA,"May 11, 2023",MOA or Lease Agreement Between Agila Subic and SBMA,ACCEPTED,to check if there is any stipulation in the agreement about utilities in the Agila Subic Facility,05/11/2023 - 05/11/2023,https://www.foi.gov.ph/requests/aglzfmVmb2ktcGhyHgsSB0NvbnRlbnQiEVNCTUEtNTA1MTUzNjgzMzM3DA
GPPB,"May 11, 2023","List of all policy, laws, issuances pertaining to emergency public procurement during pandemic",SUCCESSFUL,Research and development,01/01/2020 - 05/11/2023,https://www.foi.gov.ph/requests/aglzfmVmb2ktcGhyHgsSB0NvbnRlbnQiEUdQUEItMjUwMzk4OTE3MjQzDA
PSA,"May 11, 2023",Volume of Mango Production by Province 2016-2022 and Exports of Mango for 2016-2022,PENDING,Research and Development,05/11/2023 - 05/11/2023,https://www.foi.gov.ph/requests/aglzfmVmb2ktcGhyHQsSB0NvbnRlbnQiEFBTQS01MDQ5MzYwMzU4MzMM
SSS,"May 11, 2023",SSS DISCLOSURE STATEMENT,PENDING,Employer purposes,05/11/2023 - 05/11/2023,https://www.foi.gov.ph/requests/aglzfmVmb2ktcGhyHQsSB0NvbnRlbnQiEFNTUy0zOTU3Mjg3MjQyODEM
DepEd,"May 11, 2023",DepEd Position and Competency Profiles (as of 2021),AWAITING CLARIFICATION,This will be used as reference for job posting.,05/11/2023 - 05/11/2023,https://www.foi.gov.ph/requests/aglzfmVmb2ktcGhyHwsSB0NvbnRlbnQiEkRlcEVkLTE1OTg0MTY3NjkzMgw
ECC,"May 11, 2023",Employees' Compensation Commission,SUCCESSFUL,COVID-19 Assistance Grant,12/14/2021 - 05/11/2023,https://www.foi.gov.ph/requests/aglzfmVmb2ktcGhyHQsSB0NvbnRlbnQiEEVDQy0yMTE1NDMyNjg3NzYM
NFRDI,"May 11, 2023",Production level data of sea cucumbers,PENDING,Research and development,01/01/2000 - 12/31/2022,https://www.foi.gov.ph/requests/aglzfmVmb2ktcGhyHwsSB0NvbnRlbnQiEk5GUkRJLTExOTI3MzM4NzA5Nww
BIR,"May 11, 2023",BIR 2316,DENIED,Requirements for employment,09/16/2022 - 02/16/2023,https://www.foi.gov.ph/requests/aglzfmVmb2ktcGhyHQsSB0NvbnRlbnQiEEJJUi0yMjAxMzczNTg2OTgM
DOLE,"May 11, 2023",List of Organization/Association of Livelihood Workers,SUCCESSFUL,For possible membership with Pag-ibig Fund,05/05/2023 - 05/11/2023,https://www.foi.gov.ph/requests/aglzfmVmb2ktcGhyHgsSB0NvbnRlbnQiEURPTEUtMTYwMzAyMzM3OTIwDA
DOT,"May 11, 2023",Tourism Statistics of Carcar City,AWAITING CLARIFICATION,Research and Development,01/01/2019 - 05/11/2023,https://www.foi.gov.ph/requests/aglzfmVmb2ktcGhyHQsSB0NvbnRlbnQiEERPVC0zMzY5MjIxNjI5NDkM
BIR,"May 11, 2023","1973 Zonal Values of Toledo City, Cebu",SUCCESSFUL,extrajudicial partition of estate,01/01/1973 - 12/31/1973,https://www.foi.gov.ph/requests/aglzfmVmb2ktcGhyHQsSB0NvbnRlbnQiEEJJUi0zMTA4NzAyMjEwMzcM
CHED,"May 11, 2023",CHED Internship/OJT Manual for Academic Year 2023,SUCCESSFUL,Will be used as guide and compliance to rules and required documents on our internship engagement.,01/11/2022 - 05/11/2023,https://www.foi.gov.ph/requests/aglzfmVmb2ktcGhyHgsSB0NvbnRlbnQiEUNIRUQtNzI2NDIyOTIyODYyDA
CHED,"May 11, 2023",Scholarship,AWAITING CLARIFICATION,makapagtapos agad ng pag-aaral,05/11/2023 - 05/11/2023,https://www.foi.gov.ph/requests/aglzfmVmb2ktcGhyHgsSB0NvbnRlbnQiEUNIRUQtNDQzMzQ4MjcyMTMxDA
USEP,"May 11, 2023","BOR Resolution No. 88, s. 2017",SUCCESSFUL,Accreditation,01/01/2018 - 01/01/2021,https://www.foi.gov.ph/requests/aglzfmVmb2ktcGhyHgsSB0NvbnRlbnQiEVVTRVAtNjc0OTUwMzQ4NDM2DA
PSA,"May 11, 2023",List of Manufacturing Industries in Metro Manila,PENDING,Graduate School Research,01/01/2019 - 01/01/2023,https://www.foi.gov.ph/requests/aglzfmVmb2ktcGhyHQsSB0NvbnRlbnQiEFBTQS03MzY1NTI5MDkwMzUM
ECC,"May 11, 2023",Covid-19 Ec Cash Assistance Claims Follow up,SUCCESSFUL,Personal,10/17/2020 - 01/04/2021,https://www.foi.gov.ph/requests/aglzfmVmb2ktcGhyHQsSB0NvbnRlbnQiEEVDQy00NDkzMDYwNDExMTkM
CSU,"May 11, 2023",Land Cover/ Land use Change,PENDING,Research,01/11/1970 - 05/11/2023,https://www.foi.gov.ph/requests/aglzfmVmb2ktcGhyHQsSB0NvbnRlbnQiEENTVS0yOTg0NDQxMTM0NDcM
SSS,"May 11, 2023",To register online,PENDING,To register online/update,05/11/2016 - 05/11/2023,https://www.foi.gov.ph/requests/aglzfmVmb2ktcGhyHQsSB0NvbnRlbnQiEFNTUy0zNjU3ODM4OTk1NDIM
NAMRIA,"May 11, 2023",Barangay Administrative Shapefiles,REFERRED,Research and Reference,01/01/2020 - 05/11/2023,https://www.foi.gov.ph/requests/aglzfmVmb2ktcGhyJAsSB0NvbnRlbnQiF0RFTlJOQU1SSUEtODE2NzY1MjI4ODE2DA
SSS,"May 11, 2023",SSS,PENDING,CHANGE EMAIL FOR FINANCIAL PURPOSES,05/09/2023 - 05/11/2023,https://www.foi.gov.ph/requests/aglzfmVmb2ktcGhyHQsSB0NvbnRlbnQiEFNTUy0zNzk1MzI0NzU3NDMM
DTI,"May 11, 2023",The List of Registered Business Names of Sole-Proprietorship Businesses in Bacolod City,ACCEPTED,Research purpose only,01/01/2022 - 05/11/2023,https://www.foi.gov.ph/requests/aglzfmVmb2ktcGhyHQsSB0NvbnRlbnQiEERUSS0yMDcwNzQwMjY0NzAM
ECC,"May 11, 2023",Ecc covid 19 compensation,SUCCESSFUL,Claim,01/01/2020 - 05/11/2023,https://www.foi.gov.ph/requests/aglzfmVmb2ktcGhyHQsSB0NvbnRlbnQiEEVDQy0yNTA2OTY3NDMzNTIM
DOH,"May 11, 2023",DOH VAX CERTIFICATE,SUCCESSFUL,Vax Certification for travel outside the country,05/19/2021 - 01/05/2022,https://www.foi.gov.ph/requests/aglzfmVmb2ktcGhyHQsSB0NvbnRlbnQiEERPSC0wNDA0NzQ3MjE5NjgM
DOH,"May 11, 2023",Fees and Charges Data Request,SUCCESSFUL,"implementation of aO No. 31 (s. 2012), as implemented by the DOF-DBM-NEDA Joint Circular No. 1-2013.",05/11/2020 - 05/11/2023,https://www.foi.gov.ph/requests/aglzfmVmb2ktcGhyHQsSB0NvbnRlbnQiEERPSC00MTA5MDk1NTA1MzAM
DOH,"May 11, 2023",Vaccine Certificate,SUCCESSFUL,For travel Abroad,08/13/2021 - 07/04/2022,https://www.foi.gov.ph/requests/aglzfmVmb2ktcGhyHQsSB0NvbnRlbnQiEERPSC0xMDE1NjcwMjAwMzgM
LTO,"May 11, 2023",MVUC Collections (2018 - 2022),PENDING,Research,01/01/2018 - 12/31/2022,https://www.foi.gov.ph/requests/aglzfmVmb2ktcGhyHQsSB0NvbnRlbnQiEExUTy01OTc1NDY0MTc5MzgM
DOH,"May 11, 2023",Institutional Statistics,SUCCESSFUL,Academe,01/01/2020 - 03/31/2023,https://www.foi.gov.ph/requests/aglzfmVmb2ktcGhyHQsSB0NvbnRlbnQiEERPSC04MzU1NzAyMjY1OTAM
DepEd,"May 11, 2023",Certificate/ Diploma Request,SUCCESSFUL,For employment purposes,02/01/2014 - 04/04/2014,https://www.foi.gov.ph/requests/aglzfmVmb2ktcGhyHwsSB0NvbnRlbnQiEkRlcEVkLTIzNTM5ODU2MDM1NQw
NTC,"May 11, 2023",blocked this sim cards sending email links to my number,PARTIALLY SUCCESSFUL,to stop scammer alerts on my number,04/30/2023 - 05/09/2023,https://www.foi.gov.ph/requests/aglzfmVmb2ktcGhyHQsSB0NvbnRlbnQiEE5UQy05NjIwMTkyMTU1MTEM
DPWH,"May 11, 2023",Traffic Count,AWAITING CLARIFICATION,Research,01/01/2018 - 12/31/2022,https://www.foi.gov.ph/requests/aglzfmVmb2ktcGhyHgsSB0NvbnRlbnQiEURQV0gtNjk3MDEwMDEyMDQxDA
DOH,"May 11, 2023",Local Statistics of Beta Thalassemia in Cagayan,SUCCESSFUL,Academe,01/01/2021 - 12/31/2022,https://www.foi.gov.ph/requests/aglzfmVmb2ktcGhyHQsSB0NvbnRlbnQiEERPSC04NjAxNTE2Mzk4MDMM
SSS,"May 11, 2023",Not Existing CRN/SS Number,PENDING,For Employment,04/01/2023 - 05/11/2023,https://www.foi.gov.ph/requests/aglzfmVmb2ktcGhyHQsSB0NvbnRlbnQiEFNTUy00OTU3MTQ0MTQwODUM
NTC,"May 11, 2023",numerous alerts of gcash transaction of payment to google,DENIED,to stop the scammer using gcash account,05/06/2023 - 05/10/2023,https://www.foi.gov.ph/requests/aglzfmVmb2ktcGhyHQsSB0NvbnRlbnQiEE5UQy04MjMwMTk2MTczNjgM
DOH,"May 11, 2023",Cancellation of vaccine update request,SUCCESSFUL,Employment abroad,05/05/2023 - 05/11/2023,https://www.foi.gov.ph/requests/aglzfmVmb2ktcGhyHQsSB0NvbnRlbnQiEERPSC05OTg0NTM0OTg5MTQM
DILG,"May 11, 2023",Legal Documents Supporting the Conversion of City into Highly Urbanized City,PENDING,Supporting Document on Policy Issuance of the DOE,05/11/1990 - 05/11/2023,https://www.foi.gov.ph/requests/aglzfmVmb2ktcGhyHgsSB0NvbnRlbnQiEURJTEctNTcwNDc3MjkzNDM5DA
MMDA,"May 11, 2023","Road Crash Statistics (2019, 2021, and 2022)",SUCCESSFUL,Research,01/01/2018 - 12/31/2022,https://www.foi.gov.ph/requests/aglzfmVmb2ktcGhyHgsSB0NvbnRlbnQiEU1NREEtMDE2OTcyOTM2OTI2DA
USEP,"May 11, 2023",Annual Reports,DENIED,For the publication,05/11/2023 - 05/11/2023,https://www.foi.gov.ph/requests/aglzfmVmb2ktcGhyHgsSB0NvbnRlbnQiEVVTRVAtNTYyNTc1NzAxNjc2DA
FNRI,"May 11, 2023",Prevalence of malnutrition for children,SUCCESSFUL,Research and development,05/11/2023 - 05/11/2023,https://www.foi.gov.ph/requests/aglzfmVmb2ktcGhyHgsSB0NvbnRlbnQiEUZOUkktMzczOTM5OTU0NTY5DA
FNRI,"May 11, 2023",Various Data on Health,SUCCESSFUL,Research and Development,05/11/2023 - 05/11/2023,https://www.foi.gov.ph/requests/aglzfmVmb2ktcGhyHgsSB0NvbnRlbnQiEUZOUkktODQ3NDA3ODkzMTg3DA
PPA,"May 11, 2023","As-Built Structural Plans of Pier 5, Port of Manila South Harbor, Philippines",AWAITING CLARIFICATION,Master's Thesis,01/01/2013 - 05/01/2023,https://www.foi.gov.ph/requests/aglzfmVmb2ktcGhyHQsSB0NvbnRlbnQiEFBQQS01MjgwNjA5OTkwODMM
BIR,"May 11, 2023",No. of Parcel Deliveries Made by E-commerce Logistic Companies Annually in the Philippines,DENIED,Undergraduate Research,01/01/2018 - 12/31/2022,https://www.foi.gov.ph/requests/aglzfmVmb2ktcGhyHQsSB0NvbnRlbnQiEEJJUi0yMzA2NzA1ODA0ODAM
FNRI,"May 11, 2023",Request for feeding program,AWAITING CLARIFICATION,Feeding Program Development,01/01/2000 - 01/01/2023,https://www.foi.gov.ph/requests/aglzfmVmb2ktcGhyHgsSB0NvbnRlbnQiEUZOUkktODMwMTM5MDk0OTMxDA
LLDA,"May 11, 2023",LLDA clearance or permit,SUCCESSFUL,Personal copy for our Business,05/11/2018 - 05/11/2023,https://www.foi.gov.ph/requests/aglzfmVmb2ktcGhyIgsSB0NvbnRlbnQiFURFTlJMTERBLTc0NzM0Mzc4MzI4Mww
NSWMC,"May 11, 2023","WACS data or SWM plans of Batangas, Romblon, Mindoro and Marinduque",PENDING,"R&D, Data to support Grant Funding for SWM",01/01/2018 - 05/11/2023,https://www.foi.gov.ph/requests/aglzfmVmb2ktcGhyHwsSB0NvbnRlbnQiEk5TV01DLTI5MzQ5MTkxNzI5NAw
PCSO,"May 11, 2023",Financial Support,REFERRED,Pamabayad po sa loan,04/01/2023 - 05/11/2023,https://www.foi.gov.ph/requests/aglzfmVmb2ktcGhyHgsSB0NvbnRlbnQiEVBDU08tMTIxNDMyOTU0MjQ1DA
PSA,"May 11, 2023",The number of first born Filipino citizens,PENDING,Research and Development,01/01/2005 - 01/01/2005,https://www.foi.gov.ph/requests/aglzfmVmb2ktcGhyHQsSB0NvbnRlbnQiEFBTQS0wNjgyNTY1NzQzODEM
DA,"May 11, 2023","Value Chain Analysis (VCA) for Cacao, Mango, Rubber and Durian in Davao Region",PARTIALLY SUCCESSFUL,The VCA data will be used for my course requirements to conduct an industry analysis.,05/11/2023 - 05/11/2023,https://www.foi.gov.ph/requests/aglzfmVmb2ktcGhyHAsSB0NvbnRlbnQiD0RBLTY2NTc1OTYxOTkwOAw
