agency,date,title,status,purpose,period_covered,link
DTI,"March 02, 2023","The recent number, data, and information of Micro Franchising Businesses in the Philippines",REFERRED,For Academic and Research Purposes only.,05/23/2008 - 03/02/2023,https://www.foi.gov.ph/requests/aglzfmVmb2ktcGhyHQsSB0NvbnRlbnQiEERUSS0zOTQzNzY4NDU2ODcM
NEDA,"March 02, 2023",The recent number of Micro Franchising Businesses in the Philippines,REFERRED,For Academic and Research Purposes only.,05/01/2008 - 03/02/2023,https://www.foi.gov.ph/requests/aglzfmVmb2ktcGhyHgsSB0NvbnRlbnQiEU5FREEtMTE0NTc5MjM1ODE2DA
NTC,"March 02, 2023",Notarized Affidavit of Loss,PENDING,For GCash Funds transfer,02/22/2023 - 03/02/2023,https://www.foi.gov.ph/requests/aglzfmVmb2ktcGhyHQsSB0NvbnRlbnQiEE5UQy04MTM2ODg1NTYzMDUM
CHED,"March 02, 2023",Transcript of Records,AWAITING CLARIFICATION,Employment,06/01/2006 - 08/01/2008,https://www.foi.gov.ph/requests/aglzfmVmb2ktcGhyHgsSB0NvbnRlbnQiEUNIRUQtMjIzMTEzMjk5MTA0DA
DICT,"March 02, 2023",Frequency of Airlines' Marketing Schemes,PENDING,Academic Purposes (MBA),01/01/2022 - 12/31/2022,https://www.foi.gov.ph/requests/aglzfmVmb2ktcGhyHgsSB0NvbnRlbnQiEURJQ1QtMjI4OTIwMDc3NzcxDA
PSA,"March 02, 2023",Total population of employed bicycle delivery riders from FoodPanda and Grab in Sta.Mesa Mani,PENDING,Research,02/01/2020 - 03/02/2023,https://www.foi.gov.ph/requests/aglzfmVmb2ktcGhyHQsSB0NvbnRlbnQiEFBTQS0xNTM0NDg5OTY1ODEM
GSIS,"March 02, 2023",BP number,PENDING,My purpose is to register online and to claim whatever benefits I am entitled to.,01/01/1988 - 09/01/2010,https://www.foi.gov.ph/requests/aglzfmVmb2ktcGhyHgsSB0NvbnRlbnQiEUdTSVMtMDYyNDE2MjM3ODY1DA
DOLE,"March 02, 2023",Labor Complaints,PROCESSING,Academic Research,01/01/2020 - 12/31/2022,https://www.foi.gov.ph/requests/aglzfmVmb2ktcGhyHgsSB0NvbnRlbnQiEURPTEUtMDM0MDU2NTg2MjkyDA
LRA,"March 02, 2023",Land Title of Maria Corazon Olanosa Bantola,DENIED,To research and retrieve duplicate copy of the title.,01/01/1980 - 03/02/2023,https://www.foi.gov.ph/requests/aglzfmVmb2ktcGhyHQsSB0NvbnRlbnQiEExSQS0zMjUxMDc4ODkwODQM
NLPSC,"March 02, 2023",Certificate of English,PENDING,School Requirement,06/04/2009 - 04/13/2013,https://www.foi.gov.ph/requests/aglzfmVmb2ktcGhyHwsSB0NvbnRlbnQiEk5MUFNDLTI4Mzc1NzA4OTgwMQw
DILG,"March 02, 2023",National tax allotment (IRA) per barangay in region 8 biliran,PENDING,Research and Economic Development Project,01/01/2011 - 01/01/2023,https://www.foi.gov.ph/requests/aglzfmVmb2ktcGhyHgsSB0NvbnRlbnQiEURJTEctNjY5MTgzNjU0ODM1DA
DSWD,"March 02, 2023",The number of orphanages in the Philippines,ACCEPTED,A Research Study for Architectural Thesis Student,01/01/2018 - 01/01/2023,https://www.foi.gov.ph/requests/aglzfmVmb2ktcGhyHgsSB0NvbnRlbnQiEURTV0QtNjcyMjQ3MDk1NjQ1DA
NBI,"March 02, 2023",Jimboy pelegro odchigue,PENDING,Inform the authorities,03/02/2023 - 03/02/2023,https://www.foi.gov.ph/requests/aglzfmVmb2ktcGhyHQsSB0NvbnRlbnQiEE5CSS05MDM2MzUxNTE5MjMM
MGB,"March 02, 2023",Geologic and Hydrogeologic Map of Pangasinan,SUCCESSFUL,Research,01/01/1980 - 03/02/2023,https://www.foi.gov.ph/requests/aglzfmVmb2ktcGhyHQsSB0NvbnRlbnQiEE1HQi00OTIzNzczNzYyMjMM
MGB,"March 02, 2023",Geologic and Hydrogeologic Map of La Union,SUCCESSFUL,Research,01/01/1980 - 03/02/2023,https://www.foi.gov.ph/requests/aglzfmVmb2ktcGhyHQsSB0NvbnRlbnQiEE1HQi04ODIyMzIxNjgzMTkM
MGB,"March 02, 2023",Geologic Map of Benguet,ACCEPTED,Research,01/01/1980 - 03/02/2023,https://www.foi.gov.ph/requests/aglzfmVmb2ktcGhyHQsSB0NvbnRlbnQiEE1HQi0xNzU3NTMyMDY2MTEM
CFO,"March 02, 2023",Title: Inquiry on J1 Visa (Cultural Exchange),SUCCESSFUL,Cultural Exchange Inquiry,03/01/2023 - 03/01/2023,https://www.foi.gov.ph/requests/aglzfmVmb2ktcGhyHQsSB0NvbnRlbnQiEENGTy0wOTI4OTkwMDg2MzIM
CHED,"March 02, 2023",Medium of Instruction,DENIED,For study abroad,04/08/2008 - 03/02/2023,https://www.foi.gov.ph/requests/aglzfmVmb2ktcGhyHgsSB0NvbnRlbnQiEUNIRUQtNjg0Njg2NDcxNTM4DA
DOH,"March 02, 2023",LOST OF VACCINE CARD,SUCCESSFUL,International Travel Requirement,08/20/2021 - 10/29/2021,https://www.foi.gov.ph/requests/aglzfmVmb2ktcGhyHQsSB0NvbnRlbnQiEERPSC0zMDAwNDk4NTU3OTYM
ERC,"March 02, 2023",Database/List of Contestable Customers,ACCEPTED,Research and Development of Company,03/02/2023 - 03/02/2023,https://www.foi.gov.ph/requests/aglzfmVmb2ktcGhyHQsSB0NvbnRlbnQiEEVSQy0xODE1MTcxODk1MzQM
BI,"March 02, 2023",Latest arrival stamp,DENIED,Requirement of application in OWWA,11/01/2022 - 03/02/2023,https://www.foi.gov.ph/requests/aglzfmVmb2ktcGhyHAsSB0NvbnRlbnQiD0JJLTA4NTQxMTU3NzMxMQw
PSA,"March 02, 2023",Request for TRN of PhilSys ID,PARTIALLY SUCCESSFUL,Additional Family Members,03/01/2023 - 03/02/2023,https://www.foi.gov.ph/requests/aglzfmVmb2ktcGhyHQsSB0NvbnRlbnQiEFBTQS0xMTYxNDk0NTY1NzUM
NHA,"March 02, 2023",The list of relocated informal settlers from Manila to other provinces,ACCEPTED,Research,01/01/2022 - 03/02/2023,https://www.foi.gov.ph/requests/aglzfmVmb2ktcGhyHQsSB0NvbnRlbnQiEE5IQS03MjcxOTU3MDc2MzkM
PSA,"March 02, 2023",Request for TRN of PhilSys ID,PARTIALLY SUCCESSFUL,Additional 3 Family members,03/01/2023 - 03/02/2023,https://www.foi.gov.ph/requests/aglzfmVmb2ktcGhyHQsSB0NvbnRlbnQiEFBTQS00MjkwMzk0MzE1NTQM
NBI,"March 02, 2023",Criminal/Civil Case Verification,PENDING,verification,08/01/2022 - 03/01/2023,https://www.foi.gov.ph/requests/aglzfmVmb2ktcGhyHQsSB0NvbnRlbnQiEE5CSS0wOTc2NjU4Nzk1MDkM
DepEd,"March 02, 2023",High School Transcript of Records,SUCCESSFUL,Requirement for Degree equivalency application in Qatar,06/03/1996 - 03/31/2000,https://www.foi.gov.ph/requests/aglzfmVmb2ktcGhyHwsSB0NvbnRlbnQiEkRlcEVkLTM2ODc1ODM1MjEzMgw
NBI,"March 02, 2023",Criminal case verification,PENDING,For Work Purposes,01/01/2022 - 03/01/2023,https://www.foi.gov.ph/requests/aglzfmVmb2ktcGhyHQsSB0NvbnRlbnQiEE5CSS0yODY3NTE4OTg4MDgM
NBI,"March 02, 2023",Pending Civil & Criminal cases,PENDING,im receiving threats and just want to verify,03/02/2023 - 03/02/2023,https://www.foi.gov.ph/requests/aglzfmVmb2ktcGhyHQsSB0NvbnRlbnQiEE5CSS01NDcxMjE2ODU4MTMM
NAMRIA,"March 02, 2023","Topographic and Hydrographic Data of Las Piñas and Bacoor, Cavite",DENIED,Research and development,03/02/2022 - 03/02/2023,https://www.foi.gov.ph/requests/aglzfmVmb2ktcGhyJAsSB0NvbnRlbnQiF0RFTlJOQU1SSUEtMDUyNjA2Nzg0NTM3DA
MGB,"March 02, 2023","Geotechnical Study of Taytay, Rizal",REFERRED,Research and development,01/01/2010 - 03/02/2023,https://www.foi.gov.ph/requests/aglzfmVmb2ktcGhyHQsSB0NvbnRlbnQiEE1HQi03ODE3ODM5MTI5NDAM
DPWH,"March 02, 2023","Geotechnical Study of Taytay, Rizal",AWAITING CLARIFICATION,Research and development,01/01/2010 - 03/02/2023,https://www.foi.gov.ph/requests/aglzfmVmb2ktcGhyHgsSB0NvbnRlbnQiEURQV0gtNTExMjgyMzkwMjc2DA
MGB,"March 02, 2023","Geotechnical Study of Cainta, Rizal",REFERRED,Research and development,01/01/2010 - 03/02/2023,https://www.foi.gov.ph/requests/aglzfmVmb2ktcGhyHQsSB0NvbnRlbnQiEE1HQi04Mzk1MzI1NDA0MTkM
DPWH,"March 02, 2023","Geotechnical Study of Cainta, Rizal",AWAITING CLARIFICATION,Research and development,01/01/2010 - 03/02/2023,https://www.foi.gov.ph/requests/aglzfmVmb2ktcGhyHgsSB0NvbnRlbnQiEURQV0gtMDUyMDM3NjE1ODI0DA
MGB,"March 02, 2023",Geotechnical Report of Quezon City,REFERRED,Research and Development,01/01/2010 - 03/02/2023,https://www.foi.gov.ph/requests/aglzfmVmb2ktcGhyHQsSB0NvbnRlbnQiEE1HQi0zNDI4MTY2OTg5MTIM
DPWH,"March 02, 2023",Geotechnical Report of Quezon City,AWAITING CLARIFICATION,Research and development,01/01/2010 - 03/02/2023,https://www.foi.gov.ph/requests/aglzfmVmb2ktcGhyHgsSB0NvbnRlbnQiEURQV0gtNDQ3NjMxNDA1ODQzDA
MGB,"March 02, 2023",Geotechnical Study of Pasig,REFERRED,Research and development,01/01/2010 - 03/02/2023,https://www.foi.gov.ph/requests/aglzfmVmb2ktcGhyHQsSB0NvbnRlbnQiEE1HQi01MTUwNzUzMTExMjEM
DPWH,"March 02, 2023",Geotechnical Study of Pasig City,AWAITING CLARIFICATION,Research and development,01/01/2010 - 03/02/2023,https://www.foi.gov.ph/requests/aglzfmVmb2ktcGhyHgsSB0NvbnRlbnQiEURQV0gtMTA1NzY1Njg4NTM4DA
PSA,"March 02, 2023",Request for TRN of PhilSys ID,PARTIALLY SUCCESSFUL,To be able to get my ePhilID from PSA website,03/01/2023 - 03/02/2023,https://www.foi.gov.ph/requests/aglzfmVmb2ktcGhyHQsSB0NvbnRlbnQiEFBTQS0wMzA1Mzk4ODIyMTkM
DOLE,"March 02, 2023",BPO company is prolonging my final pay,SUCCESSFUL,Report,02/17/2023 - 03/02/2023,https://www.foi.gov.ph/requests/aglzfmVmb2ktcGhyHgsSB0NvbnRlbnQiEURPTEUtMTA3Nzg2MzY2ODY4DA
DOJ,"March 02, 2023",Pending Civil & Criminal cases,REFERRED,im receiving threats and just want to verify,03/02/2023 - 03/02/2023,https://www.foi.gov.ph/requests/aglzfmVmb2ktcGhyHQsSB0NvbnRlbnQiEERPSi0yODE0MDQxMjY5NDcM
LCWD,"March 02, 2023",jovelyn salano,DENIED,Clearance certificate from the legal services no pending penalty or prohibition engage in the lpg ac,03/02/2023 - 03/02/2023,https://www.foi.gov.ph/requests/aglzfmVmb2ktcGhyHgsSB0NvbnRlbnQiEUxDV0QtODY5MTg4OTY3OTIzDA
DOH,"March 02, 2023",Lost Vaccination Card,SUCCESSFUL,"Required in the hospital, we are having a check up and it's needed",01/10/2022 - 03/02/2023,https://www.foi.gov.ph/requests/aglzfmVmb2ktcGhyHQsSB0NvbnRlbnQiEERPSC0xOTUwNjMzNTAwMzAM
DENR,"March 02, 2023",Bllm coordinates,REFERRED,Land verification,01/02/2023 - 01/31/2023,https://www.foi.gov.ph/requests/aglzfmVmb2ktcGhyHgsSB0NvbnRlbnQiEURFTlItMjU3MTExOTc4NjEzDA
DENR,"March 02, 2023","TECHNICAL DESCRIPTION, APPROVED SUBDIVISION PLAN",DENIED,RELOCATION SURVEY,09/25/2001 - 11/19/2001,https://www.foi.gov.ph/requests/aglzfmVmb2ktcGhyHgsSB0NvbnRlbnQiEURFTlItOTc5Mzc2NjI3MDg1DA
NAPOLCOM,"March 02, 2023",Height waiver,ACCEPTED,Application in Philippine National Police Region 4B,03/02/2023 - 03/02/2023,https://www.foi.gov.ph/requests/aglzfmVmb2ktcGhyIgsSB0NvbnRlbnQiFU5BUE9MQ09NLTc4MDE5MjAxNTQ0OQw
DPWH,"March 02, 2023","Geotechnical Report of Brgy. Dela Paz, Antipolo City",AWAITING CLARIFICATION,Capstone Design Project,01/01/2022 - 03/01/2023,https://www.foi.gov.ph/requests/aglzfmVmb2ktcGhyHgsSB0NvbnRlbnQiEURQV0gtNTY1Mzk2NTE0MDQ2DA
OSG,"March 02, 2023",Status of finality certificate of my annulment,SUCCESSFUL,Change status,10/04/2022 - 03/02/2023,https://www.foi.gov.ph/requests/aglzfmVmb2ktcGhyHQsSB0NvbnRlbnQiEE9TRy0wMDk3ODE1MTM1NTQM
PCSO,"March 02, 2023",I'd like to help my down syndrome brother with his medical expenditures.,SUCCESSFUL,Asking for Medical Assistance,03/01/2023 - 03/02/2023,https://www.foi.gov.ph/requests/aglzfmVmb2ktcGhyHgsSB0NvbnRlbnQiEVBDU08tODM3OTYxNjQ0MjY3DA
NCIP,"March 02, 2023",Height waiver,DENIED,Application in Philippine National Police Region 4B,03/02/2023 - 03/02/2023,https://www.foi.gov.ph/requests/aglzfmVmb2ktcGhyHgsSB0NvbnRlbnQiEU5DSVAtNDYzNDgxNTQ4MTQyDA
CAGSU,"March 02, 2023",College Diploma,PENDING,Requirement for Applying Job in Taiwan,06/20/2014 - 06/04/2018,https://www.foi.gov.ph/requests/aglzfmVmb2ktcGhyHwsSB0NvbnRlbnQiEkNBR1NVLTEzOTM5MzIwODEzNAw
CHED,"March 02, 2023",Honorable Dismissal and Good Moral Conduct,DENIED,College application (transferee,01/01/2013 - 01/01/2015,https://www.foi.gov.ph/requests/aglzfmVmb2ktcGhyHgsSB0NvbnRlbnQiEUNIRUQtODc3MTE5MDk0NTAyDA
BPI,"March 02, 2023",License to Operate,PENDING,Research and Development,01/01/2020 - 12/31/2022,https://www.foi.gov.ph/requests/aglzfmVmb2ktcGhyHQsSB0NvbnRlbnQiEEJQSS02OTc4NjgwNDg3OTAM
CHED,"March 02, 2023",Transcreipt of Records,ACCEPTED,College application (transferee),01/01/2013 - 01/01/2015,https://www.foi.gov.ph/requests/aglzfmVmb2ktcGhyHgsSB0NvbnRlbnQiEUNIRUQtMTk0MDg3NjMxMDEwDA
DOLE,"March 02, 2023",E-Certification of Involuntary Seperation,PENDING,To Process SSS Unemployment Claim Benefit,11/02/2022 - 02/28/2023,https://www.foi.gov.ph/requests/aglzfmVmb2ktcGhyHgsSB0NvbnRlbnQiEURPTEUtMzI5OTM4MDMzMDc5DA
DA,"March 02, 2023",Digital Copies of E-Extension Agenda (All available issues),DENIED,Policy research,01/01/2007 - 03/02/2023,https://www.foi.gov.ph/requests/aglzfmVmb2ktcGhyHAsSB0NvbnRlbnQiD0RBLTAzNDc3MzgwMjY0MQw
DTI,"March 02, 2023",The number and list of construction supply businesses in La Union,DENIED,Feasibility Study,03/02/2023 - 03/02/2023,https://www.foi.gov.ph/requests/aglzfmVmb2ktcGhyHQsSB0NvbnRlbnQiEERUSS0wNTU5NzQ5ODU3NzIM
DepEd,"March 02, 2023",Transcript of records,SUCCESSFUL,To get my neice’s records as we badly needed it.,03/01/2020 - 03/02/2023,https://www.foi.gov.ph/requests/aglzfmVmb2ktcGhyHwsSB0NvbnRlbnQiEkRlcEVkLTAxMDI0NjQxMjEwOAw
DOH,"March 02, 2023",CORRECTION OF BIRTHDAY,SUCCESSFUL,For abroad,03/02/2023 - 03/02/2023,https://www.foi.gov.ph/requests/aglzfmVmb2ktcGhyHQsSB0NvbnRlbnQiEERPSC02MzYyNzAwMjYzMDAM
BJMP,"March 02, 2023",Manila City Jail Demography,ACCEPTED,Research and Development of Design for Academic Purposes,03/02/2018 - 03/02/2023,https://www.foi.gov.ph/requests/aglzfmVmb2ktcGhyHgsSB0NvbnRlbnQiEUJKTVAtNTUwOTAwMTM5NDI2DA
BUCOR,"March 02, 2023",Number of Women Currently Incarcerated in the Philippines,ACCEPTED,Research,03/02/2003 - 03/02/2023,https://www.foi.gov.ph/requests/aglzfmVmb2ktcGhyHwsSB0NvbnRlbnQiEkJVQ09SLTc2NjQ4MTYyMzAwMAw
NBI,"March 02, 2023",lazada scam,PENDING,get back my money,02/28/2023 - 03/02/2023,https://www.foi.gov.ph/requests/aglzfmVmb2ktcGhyHQsSB0NvbnRlbnQiEE5CSS0zNTUzODI1NDczNTcM
DTI,"March 02, 2023",The number and list of construction supply businesses in La Union,DENIED,"Feasibility Study, please asap for my defense next week",03/02/2023 - 03/02/2023,https://www.foi.gov.ph/requests/aglzfmVmb2ktcGhyHQsSB0NvbnRlbnQiEERUSS05NDU1MTYzNzIwMjEM
DPWH,"March 02, 2023",The number and list of construction supply businesses in La Union,REFERRED,Feasibility Study,03/02/2023 - 03/02/2023,https://www.foi.gov.ph/requests/aglzfmVmb2ktcGhyHgsSB0NvbnRlbnQiEURQV0gtMTkxMTE2MzI4NTA5DA
NBI,"March 02, 2023",Astoriajob.com wesite scammer,PENDING,Help to take down the website and put in jail that everyone behind ths website,02/27/2023 - 03/01/2023,https://www.foi.gov.ph/requests/aglzfmVmb2ktcGhyHQsSB0NvbnRlbnQiEE5CSS05OTM1NDk5NjA1NjkM
NBI,"March 02, 2023",NBI Clearance of Johnder Manabat,PENDING,Employment Verification,10/01/2022 - 02/28/2023,https://www.foi.gov.ph/requests/aglzfmVmb2ktcGhyHQsSB0NvbnRlbnQiEE5CSS01NjQxMzQyMTc1ODAM
DOTr,"March 02, 2023",Metro Manila Average number of daily commuters 2022,PENDING,Research Project,01/01/2022 - 12/31/2022,https://www.foi.gov.ph/requests/aglzfmVmb2ktcGhyHgsSB0NvbnRlbnQiEURPVHItMzkwNjgzNjY1Mzg3DA
DOTr,"March 02, 2023",Average number of daily commuters from West Avenue to P. Campa 2022,PENDING,Research project,01/01/2022 - 12/31/2022,https://www.foi.gov.ph/requests/aglzfmVmb2ktcGhyHgsSB0NvbnRlbnQiEURPVHItNzA2ODY5Njg2ODc5DA
SRA,"March 02, 2023","Supply and Demand of RAW SUGAR, WHITE SUGAR AND BROWN SUGAR",PENDING,Research,01/01/2000 - 03/02/2023,https://www.foi.gov.ph/requests/aglzfmVmb2ktcGhyHQsSB0NvbnRlbnQiEFNSQS0xMDcwNzc5NjY2NjgM
DSWD,"March 02, 2023",Pensioned Individuals in the Philippines,ACCEPTED,Academic Requirement,01/01/2012 - 12/31/2022,https://www.foi.gov.ph/requests/aglzfmVmb2ktcGhyHgsSB0NvbnRlbnQiEURTV0QtMzQyMjYxMTYxMzIxDA
DENR,"March 02, 2023",Measure of garbage being thrown in Pasig River in the last 10 years,DENIED,Investigative Journalism,01/01/2012 - 12/31/2022,https://www.foi.gov.ph/requests/aglzfmVmb2ktcGhyHgsSB0NvbnRlbnQiEURFTlItMjc5MjQ1MDQ1NDMzDA
BSP,"March 02, 2023",Hello..... I'm Royal family Justice at Lurd empperaon puoi King Edward henry Rabe,PENDING,Hello..... I'm Royal family Justice at Lurd empperaon puoi King Edward henry Rabe,10/04/1980 - 10/04/2020,https://www.foi.gov.ph/requests/aglzfmVmb2ktcGhyHQsSB0NvbnRlbnQiEEJTUC03MDI5MDg0MjQ5MjAM
DFA,"March 02, 2023",Crisanta dela Cruz Zamora,DENIED,For applying abroad,03/02/2023 - 03/02/2023,https://www.foi.gov.ph/requests/aglzfmVmb2ktcGhyHQsSB0NvbnRlbnQiEERGQS0zMDg1MzEwNjE2OTUM
NCMF,"March 02, 2023",Number of Mosque in Regions of the Philippines,PENDING,Thesis,03/02/2010 - 03/02/2023,https://www.foi.gov.ph/requests/aglzfmVmb2ktcGhyHgsSB0NvbnRlbnQiEU5DTUYtNzkzODY4MzA0MDMwDA
PSA,"March 02, 2023",Number of registered coffee shops in the Philippines,ACCEPTED,Research and development,01/01/2021 - 01/01/2022,https://www.foi.gov.ph/requests/aglzfmVmb2ktcGhyHQsSB0NvbnRlbnQiEFBTQS05NjA0MTEyMTY3MzMM
PSA,"March 02, 2023","Imports, Exports, Supply, and Demand of Succinic Acid in the Philippines",ACCEPTED,Research study for academic requirements,03/01/2013 - 03/01/2023,https://www.foi.gov.ph/requests/aglzfmVmb2ktcGhyHQsSB0NvbnRlbnQiEFBTQS04MzA4OTI4MjQxNTcM
PHRA,"March 02, 2023",SSRV Holders per nationality in Puerto Princesa City and Palawan,PENDING,Research and Development,01/01/2018 - 12/31/2022,https://www.foi.gov.ph/requests/aglzfmVmb2ktcGhyHgsSB0NvbnRlbnQiEVBIUkEtMjk2NzU4Njk1Njc3DA
CIAP,"March 02, 2023",PCAB List of Licensed Contractors as of Year 2023,PENDING,Research and Development,01/01/2020 - 03/02/2023,https://www.foi.gov.ph/requests/aglzfmVmb2ktcGhyHgsSB0NvbnRlbnQiEUNJQVAtODk3NDkyNzM0OTM4DA
DSWD,"March 02, 2023",Complete Data of all Barangays in the country,DENIED,For work. Will be use as a reference.,03/02/2023 - 03/02/2023,https://www.foi.gov.ph/requests/aglzfmVmb2ktcGhyHgsSB0NvbnRlbnQiEURTV0QtODc2OTgxMjQzNjgzDA
NBI,"March 02, 2023",LAZADA EFFORTLESS SHOPPING SCAM,PENDING,TO RETURN MY MONEY AND STOP THEM FROM INVITING OTHER PEOPLE,02/28/2023 - 03/02/2023,https://www.foi.gov.ph/requests/aglzfmVmb2ktcGhyHQsSB0NvbnRlbnQiEE5CSS00MTQ2MzAwODM0ODgM
PSA,"March 02, 2023",Mahaplag Census,PARTIALLY SUCCESSFUL,Research and Education,01/01/2020 - 01/01/2023,https://www.foi.gov.ph/requests/aglzfmVmb2ktcGhyHQsSB0NvbnRlbnQiEFBTQS0xNDk2NjA1NTA4NTgM
FOIPMO,"March 02, 2023",CORRECTION OF BIRTHDAY,REFERRED,For abroad,03/02/2023 - 03/02/2023,https://www.foi.gov.ph/requests/aglzfmVmb2ktcGhyIAsSB0NvbnRlbnQiE0ZPSVBNTy01OTQ3MzI3MzEyOTIM
NTC,"March 02, 2023",Blocking my IMEI Number | 359142790212002,PARTIALLY SUCCESSFUL,Retrieve my sim and data and possible to block my IMEI number.,03/01/2023 - 03/01/2023,https://www.foi.gov.ph/requests/aglzfmVmb2ktcGhyHQsSB0NvbnRlbnQiEE5UQy0wNDY3NTI0NzU0MTcM
NBI,"March 02, 2023",SCAM/FAKE SELLER,PENDING,Refund money from the seller.,03/01/2023 - 03/02/2023,https://www.foi.gov.ph/requests/aglzfmVmb2ktcGhyHQsSB0NvbnRlbnQiEE5CSS0zMjY1MDkwMjYzNTYM
NBI,"March 02, 2023",Astoriajob.com wesite scammer,PENDING,Help to take down the website and put in jail that everyone behind ths website,02/27/2023 - 03/01/2023,https://www.foi.gov.ph/requests/aglzfmVmb2ktcGhyHQsSB0NvbnRlbnQiEE5CSS05OTM1NDk5NjA1NjkM
NBI,"March 02, 2023",NBI Clearance of Johnder Manabat,PENDING,Employment Verification,10/01/2022 - 02/28/2023,https://www.foi.gov.ph/requests/aglzfmVmb2ktcGhyHQsSB0NvbnRlbnQiEE5CSS01NjQxMzQyMTc1ODAM
DOTr,"March 02, 2023",Metro Manila Average number of daily commuters 2022,PENDING,Research Project,01/01/2022 - 12/31/2022,https://www.foi.gov.ph/requests/aglzfmVmb2ktcGhyHgsSB0NvbnRlbnQiEURPVHItMzkwNjgzNjY1Mzg3DA
DOTr,"March 02, 2023",Average number of daily commuters from West Avenue to P. Campa 2022,PENDING,Research project,01/01/2022 - 12/31/2022,https://www.foi.gov.ph/requests/aglzfmVmb2ktcGhyHgsSB0NvbnRlbnQiEURPVHItNzA2ODY5Njg2ODc5DA
SRA,"March 02, 2023","Supply and Demand of RAW SUGAR, WHITE SUGAR AND BROWN SUGAR",PENDING,Research,01/01/2000 - 03/02/2023,https://www.foi.gov.ph/requests/aglzfmVmb2ktcGhyHQsSB0NvbnRlbnQiEFNSQS0xMDcwNzc5NjY2NjgM
DSWD,"March 02, 2023",Pensioned Individuals in the Philippines,ACCEPTED,Academic Requirement,01/01/2012 - 12/31/2022,https://www.foi.gov.ph/requests/aglzfmVmb2ktcGhyHgsSB0NvbnRlbnQiEURTV0QtMzQyMjYxMTYxMzIxDA
DENR,"March 02, 2023",Measure of garbage being thrown in Pasig River in the last 10 years,DENIED,Investigative Journalism,01/01/2012 - 12/31/2022,https://www.foi.gov.ph/requests/aglzfmVmb2ktcGhyHgsSB0NvbnRlbnQiEURFTlItMjc5MjQ1MDQ1NDMzDA
BSP,"March 02, 2023",Hello..... I'm Royal family Justice at Lurd empperaon puoi King Edward henry Rabe,PENDING,Hello..... I'm Royal family Justice at Lurd empperaon puoi King Edward henry Rabe,10/04/1980 - 10/04/2020,https://www.foi.gov.ph/requests/aglzfmVmb2ktcGhyHQsSB0NvbnRlbnQiEEJTUC03MDI5MDg0MjQ5MjAM
DFA,"March 02, 2023",Crisanta dela Cruz Zamora,DENIED,For applying abroad,03/02/2023 - 03/02/2023,https://www.foi.gov.ph/requests/aglzfmVmb2ktcGhyHQsSB0NvbnRlbnQiEERGQS0zMDg1MzEwNjE2OTUM
NCMF,"March 02, 2023",Number of Mosque in Regions of the Philippines,PENDING,Thesis,03/02/2010 - 03/02/2023,https://www.foi.gov.ph/requests/aglzfmVmb2ktcGhyHgsSB0NvbnRlbnQiEU5DTUYtNzkzODY4MzA0MDMwDA
PSA,"March 02, 2023",Number of registered coffee shops in the Philippines,ACCEPTED,Research and development,01/01/2021 - 01/01/2022,https://www.foi.gov.ph/requests/aglzfmVmb2ktcGhyHQsSB0NvbnRlbnQiEFBTQS05NjA0MTEyMTY3MzMM
PSA,"March 02, 2023","Imports, Exports, Supply, and Demand of Succinic Acid in the Philippines",ACCEPTED,Research study for academic requirements,03/01/2013 - 03/01/2023,https://www.foi.gov.ph/requests/aglzfmVmb2ktcGhyHQsSB0NvbnRlbnQiEFBTQS04MzA4OTI4MjQxNTcM
PHRA,"March 02, 2023",SSRV Holders per nationality in Puerto Princesa City and Palawan,PENDING,Research and Development,01/01/2018 - 12/31/2022,https://www.foi.gov.ph/requests/aglzfmVmb2ktcGhyHgsSB0NvbnRlbnQiEVBIUkEtMjk2NzU4Njk1Njc3DA
CIAP,"March 02, 2023",PCAB List of Licensed Contractors as of Year 2023,PENDING,Research and Development,01/01/2020 - 03/02/2023,https://www.foi.gov.ph/requests/aglzfmVmb2ktcGhyHgsSB0NvbnRlbnQiEUNJQVAtODk3NDkyNzM0OTM4DA
DSWD,"March 02, 2023",Complete Data of all Barangays in the country,DENIED,For work. Will be use as a reference.,03/02/2023 - 03/02/2023,https://www.foi.gov.ph/requests/aglzfmVmb2ktcGhyHgsSB0NvbnRlbnQiEURTV0QtODc2OTgxMjQzNjgzDA
NBI,"March 02, 2023",LAZADA EFFORTLESS SHOPPING SCAM,PENDING,TO RETURN MY MONEY AND STOP THEM FROM INVITING OTHER PEOPLE,02/28/2023 - 03/02/2023,https://www.foi.gov.ph/requests/aglzfmVmb2ktcGhyHQsSB0NvbnRlbnQiEE5CSS00MTQ2MzAwODM0ODgM
PSA,"March 02, 2023",Mahaplag Census,PARTIALLY SUCCESSFUL,Research and Education,01/01/2020 - 01/01/2023,https://www.foi.gov.ph/requests/aglzfmVmb2ktcGhyHQsSB0NvbnRlbnQiEFBTQS0xNDk2NjA1NTA4NTgM
FOIPMO,"March 02, 2023",CORRECTION OF BIRTHDAY,REFERRED,For abroad,03/02/2023 - 03/02/2023,https://www.foi.gov.ph/requests/aglzfmVmb2ktcGhyIAsSB0NvbnRlbnQiE0ZPSVBNTy01OTQ3MzI3MzEyOTIM
NTC,"March 02, 2023",Blocking my IMEI Number | 359142790212002,PARTIALLY SUCCESSFUL,Retrieve my sim and data and possible to block my IMEI number.,03/01/2023 - 03/01/2023,https://www.foi.gov.ph/requests/aglzfmVmb2ktcGhyHQsSB0NvbnRlbnQiEE5UQy0wNDY3NTI0NzU0MTcM
NBI,"March 02, 2023",SCAM/FAKE SELLER,PENDING,Refund money from the seller.,03/01/2023 - 03/02/2023,https://www.foi.gov.ph/requests/aglzfmVmb2ktcGhyHQsSB0NvbnRlbnQiEE5CSS0zMjY1MDkwMjYzNTYM
DICT,"March 02, 2023",The percentage of internet users that seek health information online,PENDING,Thesis,01/01/2020 - 01/01/2023,https://www.foi.gov.ph/requests/aglzfmVmb2ktcGhyHgsSB0NvbnRlbnQiEURJQ1QtNzA1OTA0NDU0OTQ5DA
DOH,"March 02, 2023",Covid Vaccine Second Dose,SUCCESSFUL,Vaxx Cert to be updated for Travel purposes,09/25/2021 - 09/25/2021,https://www.foi.gov.ph/requests/aglzfmVmb2ktcGhyHQsSB0NvbnRlbnQiEERPSC02NzIyOTI3NDg3MzUM
CHED,"March 02, 2023",Request for National Service Training Program (NSTP) Serial Number,ACCEPTED,Entrance Credentials for Transferee Student,08/31/2021 - 06/08/2022,https://www.foi.gov.ph/requests/aglzfmVmb2ktcGhyHgsSB0NvbnRlbnQiEUNIRUQtNDc4MTY0OTU0NDIxDA
DPWH,"March 02, 2023",Expansive Clay Soil (location and properties) in Bulacan and Metro Manila,AWAITING CLARIFICATION,Research,03/01/2023 - 03/01/2023,https://www.foi.gov.ph/requests/aglzfmVmb2ktcGhyHgsSB0NvbnRlbnQiEURQV0gtNjE3MDI0MzE0MTc5DA
DOH,"March 02, 2023",Cancellation of vaxcert update request,SUCCESSFUL,Work Abroad,02/28/2023 - 03/02/2023,https://www.foi.gov.ph/requests/aglzfmVmb2ktcGhyHQsSB0NvbnRlbnQiEERPSC04MTAzMTMwNjMxMjMM
DAR,"March 02, 2023",Mag iinquirew tungkol sa hiring na Job Order,DENIED,Layunin ko po ay makapasok kahit Job Order lang dahil kaylangan ko po talaga nang tarabaho,03/01/2023 - 03/02/2023,https://www.foi.gov.ph/requests/aglzfmVmb2ktcGhyHQsSB0NvbnRlbnQiEERBUi0wMTkyNTU3MzE3MzkM
NTC,"March 02, 2023",tracing the number,PARTIALLY SUCCESSFUL,to know who is this person so that this person will pay for the damages that they've done..,02/16/2023 - 03/01/2023,https://www.foi.gov.ph/requests/aglzfmVmb2ktcGhyHQsSB0NvbnRlbnQiEE5UQy0wNTc0NjA1MDM0NjMM
NTC,"March 02, 2023",Request to locate my lost phone,PARTIALLY SUCCESSFUL,To get my phone back,03/01/2023 - 03/02/2023,https://www.foi.gov.ph/requests/aglzfmVmb2ktcGhyHQsSB0NvbnRlbnQiEE5UQy0zNzQ5NjM3Njg1NjYM
DOLE,"March 02, 2023",Request for involuntary separation for sss,SUCCESSFUL,For unemployment benefits for SSS,03/23/2017 - 11/29/2021,https://www.foi.gov.ph/requests/aglzfmVmb2ktcGhyHgsSB0NvbnRlbnQiEURPTEUtOTEwNzA0ODY1NDk2DA
PNP,"March 02, 2023",Blotter Certificate,PROCESSING,as requirements for securing new plate in LTO,02/16/2023 - 02/16/2023,https://www.foi.gov.ph/requests/aglzfmVmb2ktcGhyHQsSB0NvbnRlbnQiEFBOUC03MDczMjQ1Nzg0MTcM
PGLU,"March 02, 2023","Executive Order No. 25, series of 2022",PENDING,Research and Development,03/02/2023 - 03/02/2023,https://www.foi.gov.ph/requests/aglzfmVmb2ktcGhyHgsSB0NvbnRlbnQiEVBHTFUtMzM5MTIwODQ5MDQwDA
NYC,"March 02, 2023",Implementing Rules and Regulations (IRR) of RA 11768,SUCCESSFUL,Reference,08/01/2022 - 01/31/2023,https://www.foi.gov.ph/requests/aglzfmVmb2ktcGhyHQsSB0NvbnRlbnQiEE5ZQy03OTUzNTUzNTgzMzAM
LTO,"March 02, 2023",LTO Memorandum,PENDING,Research and development,01/01/2010 - 03/02/2023,https://www.foi.gov.ph/requests/aglzfmVmb2ktcGhyHQsSB0NvbnRlbnQiEExUTy04NjE0NzI4MTQyMTEM
PNP,"March 02, 2023","Numebr of Road Accident in Pan Philippine Highway, Cabanatuan City Nueva Ecija",DENIED,Thesis,03/02/2015 - 03/02/2023,https://www.foi.gov.ph/requests/aglzfmVmb2ktcGhyHQsSB0NvbnRlbnQiEFBOUC0wNTIwNzI0NzY1NTAM
LTO,"March 02, 2023","Number of registered vehicles in Cabanatuan City, Nueva Ecija.",SUCCESSFUL,Thesis,03/02/2015 - 03/02/2023,https://www.foi.gov.ph/requests/aglzfmVmb2ktcGhyHQsSB0NvbnRlbnQiEExUTy02MjYwMTcyNzk4MDQM
