agency,date,title,status,purpose,period_covered,link
CHED,"November 23, 2022",30 k financial assistance,DENIED,For Follow-up,08/01/2021 - 08/01/2022,https://www.foi.gov.ph/requests/aglzfmVmb2ktcGhyHgsSB0NvbnRlbnQiEUNIRUQtMzAwMTA0ODg0NDg2DA
BIR,"November 23, 2022",TIN verification,DENIED,For housing loan,03/09/2021 - 04/23/2021,https://www.foi.gov.ph/requests/aglzfmVmb2ktcGhyHQsSB0NvbnRlbnQiEEJJUi0xODA4MjkyODM4NDkM
PNP,"November 23, 2022","The number or rate of traffic accidents in Dasmariñas City, Cavite",ACCEPTED,Research,01/01/2021 - 11/23/2022,https://www.foi.gov.ph/requests/aglzfmVmb2ktcGhyHQsSB0NvbnRlbnQiEFBOUC04Mjk1MjA5NzM5MjQM
PSA,"November 23, 2022",changing address and contact number,PARTIALLY SUCCESSFUL,To get my national id,11/23/2022 - 11/23/2022,https://www.foi.gov.ph/requests/aglzfmVmb2ktcGhyHQsSB0NvbnRlbnQiEFBTQS00MTUyNTg0MzA1OTYM
FOIPMO,"November 23, 2022",Criminal Case,REFERRED,Verification,07/01/2021 - 11/23/2022,https://www.foi.gov.ph/requests/aglzfmVmb2ktcGhyIAsSB0NvbnRlbnQiE0ZPSVBNTy05OTEzNTIyMzcyNjQM
DOE,"November 23, 2022",Power Consumption of Municipalities In Occidental Mindoro,DENIED,Research and Academic,01/01/2010 - 01/01/2021,https://www.foi.gov.ph/requests/aglzfmVmb2ktcGhyHQsSB0NvbnRlbnQiEERPRS0zMTAzMTQyNjA4NjEM
LMB,"November 23, 2022","Cadastral Map of Baloi(Momungan),lanao del norte",ACCEPTED,For research and development,01/01/0935 - 11/23/2022,https://www.foi.gov.ph/requests/aglzfmVmb2ktcGhyIQsSB0NvbnRlbnQiFERFTlJMTUItNTMwMTkxMDA5MTY2DA
NBI,"November 23, 2022",NBI,PENDING,To refund my payment to gcash,11/22/2022 - 11/23/2022,https://www.foi.gov.ph/requests/aglzfmVmb2ktcGhyHQsSB0NvbnRlbnQiEE5CSS04MzQzNDY3MzE0NjYM
LMB,"November 23, 2022",Sketch Plan with technical description,ACCEPTED,For titling,01/04/1980 - 09/04/2022,https://www.foi.gov.ph/requests/aglzfmVmb2ktcGhyIQsSB0NvbnRlbnQiFERFTlJMTUItMjk0ODQ2MTY1OTU0DA
BIR,"November 23, 2022",CERTIFICATE OF NO INCOME,SUCCESSFUL,SCHOLARSHIP,11/23/2012 - 11/23/2022,https://www.foi.gov.ph/requests/aglzfmVmb2ktcGhyHQsSB0NvbnRlbnQiEEJJUi0xOTk0ODQyMDYyNzMM
NBI,"November 23, 2022",Refund or Reschedule my NBI Clearance Payment in Gcash,PENDING,Refunding my Gcash payment for NBI Clearance,10/22/2022 - 11/23/2022,https://www.foi.gov.ph/requests/aglzfmVmb2ktcGhyHQsSB0NvbnRlbnQiEE5CSS03ODMwNjMxNjQxOTgM
LRA,"November 23, 2022","List of Registered land in Banga, Akaln",PENDING,to know if the land we occupying in Aklan is already registered to other name,01/01/1920 - 12/30/2021,https://www.foi.gov.ph/requests/aglzfmVmb2ktcGhyHQsSB0NvbnRlbnQiEExSQS0zMjY5NjY3NzM2OTkM
PIDS,"November 23, 2022","General Election years (2010, 2013, 2016, 2019 and 2022) and LGU local health expenditures",PROCESSING,Research and development,11/23/2010 - 11/23/2022,https://www.foi.gov.ph/requests/aglzfmVmb2ktcGhyHgsSB0NvbnRlbnQiEVBJRFMtMjkzOTQ3NDkwMjAwDA
BI,"November 23, 2022",Travel Record of Rufino Cascolan in the year 1992 in the Philippines,PENDING,Evidence to nullify the Waiver of Rights to Real Property,01/10/1992 - 01/30/1993,https://www.foi.gov.ph/requests/aglzfmVmb2ktcGhyHAsSB0NvbnRlbnQiD0JJLTUwMDYwOTgyMzY4MQw
ERC,"November 23, 2022",CONTESTABLE CUSTOMERS IN ZAMBOANGA,ACCEPTED,Market Research,11/23/2022 - 11/23/2022,https://www.foi.gov.ph/requests/aglzfmVmb2ktcGhyHQsSB0NvbnRlbnQiEEVSQy0zNzExNjExMTYyMjkM
GTWD,"November 23, 2022",Water Well Data of PS 1,SUCCESSFUL,Research and Development,11/14/2022 - 11/23/2022,https://www.foi.gov.ph/requests/aglzfmVmb2ktcGhyHgsSB0NvbnRlbnQiEUdUV0QtNDY4ODQ3MjAyODkyDA
DOE,"November 23, 2022",CONTESTABLE CUSTOMERS IN ZAMBOANGA,REFERRED,Market Research,11/23/2022 - 11/23/2022,https://www.foi.gov.ph/requests/aglzfmVmb2ktcGhyHQsSB0NvbnRlbnQiEERPRS0zMjc4ODQ3ODY2NjkM
DENR EMB,"November 23, 2022",Stack Characteristics of Diesel-fed Powerplants in Region 10,DENIED,Research and Development,01/01/2022 - 11/23/2022,https://www.foi.gov.ph/requests/aglzfmVmb2ktcGhyIQsSB0NvbnRlbnQiFERFTlJFTUItNjI4MTE0MDAwNTA5DA
DOH,"November 23, 2022",RE: VaxCert Correction Request (Ref ID - Plaridel: 1787272),SUCCESSFUL,INTERNATIONAL TRAVEL (SENIOR CITIZEN/URGENT),07/28/2021 - 01/17/2022,https://www.foi.gov.ph/requests/aglzfmVmb2ktcGhyHQsSB0NvbnRlbnQiEERPSC0yOTcwMDYzMzgyMzMM
LTO,"November 23, 2022",registered new motor vehicle in Dumaguete,SUCCESSFUL,for company data research,01/01/2017 - 12/31/2021,https://www.foi.gov.ph/requests/aglzfmVmb2ktcGhyHQsSB0NvbnRlbnQiEExUTy0yOTA2Nzc1Mjg4MTQM
DOE,"November 23, 2022",Department Circular No. 2022-11-0034,SUCCESSFUL,information on the amendment of the Epira law about renewable energy,11/17/2022 - 11/23/2022,https://www.foi.gov.ph/requests/aglzfmVmb2ktcGhyHQsSB0NvbnRlbnQiEERPRS05ODE1NDYzNjM4NTgM
DTI,"November 23, 2022",List of Registered Manpower Agencies,REFERRED,Research and Development,01/01/2017 - 11/16/2022,https://www.foi.gov.ph/requests/aglzfmVmb2ktcGhyHQsSB0NvbnRlbnQiEERUSS0zNDA0MDg1MjY0NjcM
SEC,"November 23, 2022",List of Registered Manpower Agencies,SUCCESSFUL,Research and Development,01/01/2017 - 11/16/2022,https://www.foi.gov.ph/requests/aglzfmVmb2ktcGhyHQsSB0NvbnRlbnQiEFNFQy02ODU3MjQxMjkyNDMM
PSA,"November 23, 2022",Current Status of Persons with Disability (PWDs) in Makati City,PARTIALLY SUCCESSFUL,Policy Paper Writing,01/01/2020 - 11/23/2022,https://www.foi.gov.ph/requests/aglzfmVmb2ktcGhyHQsSB0NvbnRlbnQiEFBTQS0xODU5NjUxMjI0NjYM
DICT,"November 23, 2022",RE: VaxCert Correction Request (Ref ID - Plaridel: 1787272),PENDING,INTERNATIONAL TRAVEL (URGENT/SENIOR CITIZEN),07/28/2021 - 01/17/2022,https://www.foi.gov.ph/requests/aglzfmVmb2ktcGhyHgsSB0NvbnRlbnQiEURJQ1QtNDM2NDQwNDAwMzY0DA
POEA,"November 23, 2022",Seafarers Statistical Report,PENDING,Research and Development,01/01/2017 - 11/16/2022,https://www.foi.gov.ph/requests/aglzfmVmb2ktcGhyHgsSB0NvbnRlbnQiEVBPRUEtMzkzNzI1ODUzOTQ1DA
BPI,"November 23, 2022",Supply of soybean in Manila,PENDING,Feasibility Study,01/01/2016 - 11/22/2022,https://www.foi.gov.ph/requests/aglzfmVmb2ktcGhyHQsSB0NvbnRlbnQiEEJQSS02MDg5MDU1ODYzODYM
PH,"November 23, 2022",Lost PhilHealth ID,ACCEPTED,For Educational Assistance,08/31/2022 - 11/15/2022,https://www.foi.gov.ph/requests/aglzfmVmb2ktcGhyHAsSB0NvbnRlbnQiD1BILTE4MDM5NjQzNDgxOAw
PNP,"November 23, 2022",List of Accredited Private Security Agencies,ACCEPTED,Research and Development,01/01/2017 - 11/16/2022,https://www.foi.gov.ph/requests/aglzfmVmb2ktcGhyHQsSB0NvbnRlbnQiEFBOUC03OTUzNjAzNjY4ODcM
AMLCS,"November 23, 2022",Anti money laundering investigative contact,PENDING,For reporting,11/23/2022 - 11/23/2022,https://www.foi.gov.ph/requests/aglzfmVmb2ktcGhyHwsSB0NvbnRlbnQiEkFNTENTLTYzNDgzODUyMDEzMgw
MARINA,"November 23, 2022",Marina Statistical Report 2021-2022,PENDING,Research and Development,01/01/2017 - 11/16/2022,https://www.foi.gov.ph/requests/aglzfmVmb2ktcGhyIAsSB0NvbnRlbnQiE01BUklOQS0yMzU4ODI3MTU3MzYM
LTO,"November 23, 2022",LTO Memorandum dated 01 July 2005 re Dress Code Policy,PENDING,Drafting of Policy,11/23/2022 - 11/23/2022,https://www.foi.gov.ph/requests/aglzfmVmb2ktcGhyHQsSB0NvbnRlbnQiEExUTy0zNjExNDI2OTc2MTQM
PNP,"November 23, 2022",Oplan Visa,ACCEPTED,For PNP checkpoint,11/21/2022 - 11/21/2022,https://www.foi.gov.ph/requests/aglzfmVmb2ktcGhyHQsSB0NvbnRlbnQiEFBOUC0wNzI4NDAwMTA0MzYM
DOTr,"November 23, 2022",DOTR MRT-3 PET POLICY AND PROCEDURE,ACCEPTED,Drafting of Policy and Procedure for LRT-2,11/23/2022 - 11/23/2022,https://www.foi.gov.ph/requests/aglzfmVmb2ktcGhyHgsSB0NvbnRlbnQiEURPVHItNjQxMzU4NTc3MDc3DA
NYC,"November 23, 2022",Implementing Rules and Regulations of Republic Act 11768,PENDING,Research,11/23/2022 - 11/23/2022,https://www.foi.gov.ph/requests/aglzfmVmb2ktcGhyHQsSB0NvbnRlbnQiEE5ZQy01NDE1Mzk2MDcyMTMM
DOH,"November 23, 2022",ANNUAL HOSPITAL STATISTICAL REPORTS EMHI AND ADH,PROCESSING,Research,11/23/2022 - 11/23/2022,https://www.foi.gov.ph/requests/aglzfmVmb2ktcGhyHQsSB0NvbnRlbnQiEERPSC0zNTg3OTQ3ODIwNjkM
BAI,"November 23, 2022",Data regarding Poultry Farms,PENDING,Research and Development,11/22/2018 - 11/22/2022,https://www.foi.gov.ph/requests/aglzfmVmb2ktcGhyHQsSB0NvbnRlbnQiEEJBSS02NzkzMDE0NjM4NjYM
BAI,"November 23, 2022",The number of Reported Rotten/Rejected Quail Eggs,PENDING,Research and Development,11/22/2022 - 11/22/2022,https://www.foi.gov.ph/requests/aglzfmVmb2ktcGhyHQsSB0NvbnRlbnQiEEJBSS01NDQ3MjEyNTUyNTkM
PSA,"November 23, 2022",LGBT Population in the Philippines,PARTIALLY SUCCESSFUL,Research,01/01/2015 - 01/01/2022,https://www.foi.gov.ph/requests/aglzfmVmb2ktcGhyHQsSB0NvbnRlbnQiEFBTQS03OTU4MTk1NTY1NDQM
LMB,"November 23, 2022",BLLM Coordinates Nation wide,ACCEPTED,Project Implementation in support to NPAAAD and SAFDZ,11/23/2022 - 11/23/2022,https://www.foi.gov.ph/requests/aglzfmVmb2ktcGhyIQsSB0NvbnRlbnQiFERFTlJMTUItOTEzNDkyMTMzNDIyDA
DENR FMB,"November 23, 2022",Target bamboo plantation in Region 10,PENDING,Research,11/23/2022 - 11/23/2022,https://www.foi.gov.ph/requests/aglzfmVmb2ktcGhyIQsSB0NvbnRlbnQiFERFTlJGTUItNzI4MDQxNTM1OTAzDA
DOE,"November 23, 2022",Energy Data,ACCEPTED,Research,11/23/2021 - 11/23/2022,https://www.foi.gov.ph/requests/aglzfmVmb2ktcGhyHQsSB0NvbnRlbnQiEERPRS00NTk4MzUyNDIzMzIM
NTC,"November 23, 2022",Missing android phone,PARTIALLY SUCCESSFUL,"retrieval, preservation of private information",11/22/2022 - 11/22/2022,https://www.foi.gov.ph/requests/aglzfmVmb2ktcGhyHQsSB0NvbnRlbnQiEE5UQy02NTMzNTkxNTI5NTQM
DOH,"November 23, 2022",Change name in Vaccination Card,SUCCESSFUL,Change my name and passport number in my vaccination card/record.,08/20/2021 - 10/04/2021,https://www.foi.gov.ph/requests/aglzfmVmb2ktcGhyHQsSB0NvbnRlbnQiEERPSC00NDcyMTA5NDQwMTcM
DOH,"November 23, 2022",San Lazaro Hospital FOI Point of Person,SUCCESSFUL,Thesis,10/20/2022 - 10/23/2022,https://www.foi.gov.ph/requests/aglzfmVmb2ktcGhyHQsSB0NvbnRlbnQiEERPSC0wODkzMTgyNDAyOTEM
DOH,"November 23, 2022",Update VaxCert,SUCCESSFUL,Request updating of VaxCert,09/27/2022 - 09/27/2022,https://www.foi.gov.ph/requests/aglzfmVmb2ktcGhyHQsSB0NvbnRlbnQiEERPSC0zNjQwMTM4NzU5MzQM
DepEd,"November 23, 2022",High School Diploma,SUCCESSFUL,Job Application,06/04/2018 - 04/04/2019,https://www.foi.gov.ph/requests/aglzfmVmb2ktcGhyHwsSB0NvbnRlbnQiEkRlcEVkLTUxNzU1NzI2NDcxMAw
NTC,"November 23, 2022",Lost Phone,PARTIALLY SUCCESSFUL,To find my lost phone,03/21/2022 - 11/23/2022,https://www.foi.gov.ph/requests/aglzfmVmb2ktcGhyHQsSB0NvbnRlbnQiEE5UQy0wMjg0Mjk3Njg3NzEM
IA,"November 23, 2022",Intramuros Master Plan,PARTIALLY SUCCESSFUL,Research,01/01/2016 - 11/23/2022,https://www.foi.gov.ph/requests/aglzfmVmb2ktcGhyHAsSB0NvbnRlbnQiD0lBLTQyOTQ1MzYwMDcwNww
BOC,"November 23, 2022",List Of Accredited Importers of 2022,AWAITING CLARIFICATION,Marketing and offering of services,01/01/2021 - 11/23/2022,https://www.foi.gov.ph/requests/aglzfmVmb2ktcGhyHQsSB0NvbnRlbnQiEEJPQy0wOTc3ODM5MDAxNjgM
DPWH,"November 23, 2022",DPWH Guidelines,SUCCESSFUL,Practice of Profession,11/23/2022 - 11/23/2022,https://www.foi.gov.ph/requests/aglzfmVmb2ktcGhyHgsSB0NvbnRlbnQiEURQV0gtNzkyODU1MDU3OTMwDA
LMB,"November 23, 2022","Tiepoint of BLLM 20, PLS 112",ACCEPTED,To plot the requested area of the client.,10/04/2021 - 11/23/2022,https://www.foi.gov.ph/requests/aglzfmVmb2ktcGhyIQsSB0NvbnRlbnQiFERFTlJMTUItNDIxMTk4OTkzODE1DA
NNC,"November 23, 2022",Malnutrition Data in Davao del Norte,SUCCESSFUL,To complete the research project for Davao del Norte on malnutrition data mining,01/01/2017 - 12/31/2021,https://www.foi.gov.ph/requests/aglzfmVmb2ktcGhyHQsSB0NvbnRlbnQiEE5OQy0zNzQ2ODg1NDYyNzEM
DOH,"November 23, 2022",Covid Booster Shot Vaccine Certificate,SUCCESSFUL,For international travel purposes,03/12/2022 - 05/31/2022,https://www.foi.gov.ph/requests/aglzfmVmb2ktcGhyHQsSB0NvbnRlbnQiEERPSC0zOTk0NzQ2MzMxMzMM
DOH,"November 23, 2022",For vaccination certificate,SUCCESSFUL,For apply abroad,11/23/2022 - 11/23/2022,https://www.foi.gov.ph/requests/aglzfmVmb2ktcGhyHQsSB0NvbnRlbnQiEERPSC05NjMxMTQxMTc2MzcM
NEDA,"November 23, 2022",Conflict of Interest,PENDING,Research and development,11/23/2022 - 11/23/2022,https://www.foi.gov.ph/requests/aglzfmVmb2ktcGhyHgsSB0NvbnRlbnQiEU5FREEtMjM3NjYzMTM1ODUxDA
MMDA,"November 23, 2022",Traffic flow (Vehicle count per hour or per day) in Quezon City.,PENDING,Research,10/01/2022 - 11/22/2022,https://www.foi.gov.ph/requests/aglzfmVmb2ktcGhyHgsSB0NvbnRlbnQiEU1NREEtMTY2ODA0MjczODIxDA
BIR,"November 23, 2022",Operations Memorandum No. 66-2022,DENIED,Research,10/25/2022 - 11/23/2022,https://www.foi.gov.ph/requests/aglzfmVmb2ktcGhyHQsSB0NvbnRlbnQiEEJJUi0wMTY2ODIyODY3MjIM
MMDA,"November 23, 2022",Traffic flow (Vehicle count per hour or per day) in Quezon City.,PENDING,Research,11/22/2022 - 11/22/2022,https://www.foi.gov.ph/requests/aglzfmVmb2ktcGhyHgsSB0NvbnRlbnQiEU1NREEtMDQwNjI0MDY0OTA4DA
DENR,"November 23, 2022","Spatial data of Buhangin District, Davao City, Davao del Sur",REFERRED,Research and Development,01/01/1998 - 11/22/2022,https://www.foi.gov.ph/requests/aglzfmVmb2ktcGhyHgsSB0NvbnRlbnQiEURFTlItMTQ0NDcyOTg4NDc1DA
BSWM,"November 23, 2022",Soil Data in the Municipality of GErona/ Tarlac Province,PROCESSING,for Research and Development,11/22/2020 - 11/22/2022,https://www.foi.gov.ph/requests/aglzfmVmb2ktcGhyHgsSB0NvbnRlbnQiEUJTV00tNzczNjI0NDMzODA3DA
PH,"November 23, 2022",Decined Reimbursement benefit claim due to Policy gap of Philhealth circular number 2020-0011,ACCEPTED,For Immediate action/result please.,03/18/2020 - 03/27/2020,https://www.foi.gov.ph/requests/aglzfmVmb2ktcGhyHAsSB0NvbnRlbnQiD1BILTUzNTIzNTY5MDc2Nww
PSA,"November 23, 2022",Textile production and Consumption,PENDING,Thesis purposes,11/23/2022 - 11/23/2022,https://www.foi.gov.ph/requests/aglzfmVmb2ktcGhyHQsSB0NvbnRlbnQiEFBTQS02NTQ3MDE0MzkwMTEM
MGB,"November 23, 2022","Hazard Maps and Contour Maps of Palaui Island, Cagayan",ACCEPTED,Research and Design Project for Architectural Design 7 Course,11/22/2022 - 11/22/2022,https://www.foi.gov.ph/requests/aglzfmVmb2ktcGhyHQsSB0NvbnRlbnQiEE1HQi05NDczMzM2OTAwNjMM
UP,"November 23, 2022",The number of college dropout from 2018-2022,PENDING,Research,01/01/2019 - 11/22/2022,https://www.foi.gov.ph/requests/aglzfmVmb2ktcGhyHAsSB0NvbnRlbnQiD1VQLTI1MDI3MTMxODQ1Mgw
MMDA,"November 23, 2022",CLUP OF MANILA CITY,PENDING,Research and thesis,01/01/2022 - 11/23/2022,https://www.foi.gov.ph/requests/aglzfmVmb2ktcGhyHgsSB0NvbnRlbnQiEU1NREEtOTY0MzIyMDg2NTEwDA
PCIEERD,"November 23, 2022",Evapotranspiration and Recharge Values in Marinduque or nearby stations,PENDING,Undergraduate thesis,11/22/1960 - 11/22/2022,https://www.foi.gov.ph/requests/aglzfmVmb2ktcGhyIQsSB0NvbnRlbnQiFFBDSUVFUkQtOTQyOTY5MTA2Nzc5DA
SEI,"November 23, 2022",DOST scholarship benificiaries for the past five years,SUCCESSFUL,Academic purposes,01/01/2017 - 11/22/2022,https://www.foi.gov.ph/requests/aglzfmVmb2ktcGhyHQsSB0NvbnRlbnQiEFNFSS0xMjE5NzUzODMzMzUM
CCP,"November 23, 2022",Manila Film Center,PENDING,Research,01/01/1900 - 11/17/2022,https://www.foi.gov.ph/requests/aglzfmVmb2ktcGhyHQsSB0NvbnRlbnQiEENDUC03MTQwNDE1NjU2MzEM
NTC,"November 23, 2022",Stolen phone,PARTIALLY SUCCESSFUL,Personal use,11/22/2022 - 11/22/2022,https://www.foi.gov.ph/requests/aglzfmVmb2ktcGhyHQsSB0NvbnRlbnQiEE5UQy04NjA5MjA3NTkwMTkM
PNU,"November 23, 2022",Transcript of Records,PENDING,Application for Graduate School,06/01/2014 - 04/03/2019,https://www.foi.gov.ph/requests/aglzfmVmb2ktcGhyHQsSB0NvbnRlbnQiEFBOVS0wMzY0NTk2NzMxOTkM
PRC,"November 23, 2022",Renewing of PRC ID IN PRC LERIS IS RECORDS MISMATCHED,ACCEPTED,For Renewal,11/23/2022 - 11/23/2022,https://www.foi.gov.ph/requests/aglzfmVmb2ktcGhyHQsSB0NvbnRlbnQiEFBSQy0zMzU1MjAxMDk0MDQM
NTC,"November 23, 2022",Phone Lost,PARTIALLY SUCCESSFUL,For my bank and privacy purposes,10/22/2022 - 10/23/2022,https://www.foi.gov.ph/requests/aglzfmVmb2ktcGhyHQsSB0NvbnRlbnQiEE5UQy0yMDUwMzY3OTI1MDIM
DOLE,"November 23, 2022",Dole member status,PENDING,For INQUIRIES my dole status,10/14/2021 - 11/20/2022,https://www.foi.gov.ph/requests/aglzfmVmb2ktcGhyHgsSB0NvbnRlbnQiEURPTEUtMTc0MTM3MTM5ODk2DA
NTC,"November 23, 2022",Stolen/Lost Phone,PARTIALLY SUCCESSFUL,To trace my stolen phone,11/22/2022 - 11/22/2022,https://www.foi.gov.ph/requests/aglzfmVmb2ktcGhyHQsSB0NvbnRlbnQiEE5UQy03MDE0OTk5NzAwMDEM
DA,"November 23, 2022",Distribution of the programs and services beneficiaries of AFMA,REFERRED,Academic requirement,01/01/2019 - 11/23/2022,https://www.foi.gov.ph/requests/aglzfmVmb2ktcGhyHAsSB0NvbnRlbnQiD0RBLTczOTkyMzczNDk5Nww
DOT,"November 23, 2022",Budget allocation for the programs and activities of NESAP 2013-2022,AWAITING CLARIFICATION,Academic requirement,01/01/2013 - 11/23/2022,https://www.foi.gov.ph/requests/aglzfmVmb2ktcGhyHQsSB0NvbnRlbnQiEERPVC03ODY3NjE4OTMzMDgM
LMB,"November 23, 2022","Shapefile of Boundaries specifically, municipal and barangays of Mexico, Pampanga.",ACCEPTED,Undergraduate Thesis,01/01/2016 - 10/13/2022,https://www.foi.gov.ph/requests/aglzfmVmb2ktcGhyIQsSB0NvbnRlbnQiFERFTlJMTUItNDQ1NjM1NDU2NDIxDA
BIR,"November 22, 2022",ITR,AWAITING CLARIFICATION,Confirmation if filed by employer correctly.,01/01/2018 - 11/22/2022,https://www.foi.gov.ph/requests/aglzfmVmb2ktcGhyHQsSB0NvbnRlbnQiEEJJUi01ODIxNTg0OTIwODIM
PAGASA,"November 22, 2022","Rainfall Intensity Projection at Brgy. Talayan, Quezon City",AWAITING CLARIFICATION,Capstone Design Project - Civil Engineering Student,01/01/2010 - 11/22/2022,https://www.foi.gov.ph/requests/aglzfmVmb2ktcGhyIAsSB0NvbnRlbnQiE1BBR0FTQS02MzE5MDQ2NzIzNjMM
DENR,"November 22, 2022","River Profile of San Juan River at Brgy. Talayan, Quezon City",REFERRED,Capstone Design Project - Civil Engineering Student,01/01/2000 - 11/22/2022,https://www.foi.gov.ph/requests/aglzfmVmb2ktcGhyHgsSB0NvbnRlbnQiEURFTlItMzg2ODk0MzY2MjM3DA
NBI,"November 22, 2022",Bogus Buyer in Facebook,PENDING,To report and be compensated for the money spent and effort made for the order processed.,11/01/2022 - 11/22/2022,https://www.foi.gov.ph/requests/aglzfmVmb2ktcGhyHQsSB0NvbnRlbnQiEE5CSS01MzQ3ODU3NjAyNzUM
MMDA,"November 22, 2022",Request: Recent Shapefile of Land Use in Metro Manila,PENDING,University Project,11/22/2022 - 11/22/2022,https://www.foi.gov.ph/requests/aglzfmVmb2ktcGhyHgsSB0NvbnRlbnQiEU1NREEtMTI1NDgzNzc2MTgyDA
LTFRB,"November 22, 2022",Fare Matrix of All Jeepney Routes in Rizal Province,ACCEPTED,Research,11/23/2022 - 11/23/2022,https://www.foi.gov.ph/requests/aglzfmVmb2ktcGhyHwsSB0NvbnRlbnQiEkxURlJCLTI0MDY1MTE5NzU0MAw
LTO,"November 22, 2022",drivers license serial number,DENIED,To renew my drivers license,11/27/2017 - 11/22/2022,https://www.foi.gov.ph/requests/aglzfmVmb2ktcGhyHQsSB0NvbnRlbnQiEExUTy0yMTMyNjE0NjQ1MTkM
PAGASA,"November 22, 2022","Evapotranspiration data in Tubay, Poblacion 1 and 2, Agusan Del Norte",AWAITING CLARIFICATION,Undergraduate Research,01/01/2018 - 11/22/2022,https://www.foi.gov.ph/requests/aglzfmVmb2ktcGhyIAsSB0NvbnRlbnQiE1BBR0FTQS04NTQ0NTM5NDU0MjMM
DOH,"November 22, 2022",The number of reported Mental Health Disorder cases in the City of Dasmariñas,PROCESSING,For thesis purposes,01/01/2019 - 11/22/2022,https://www.foi.gov.ph/requests/aglzfmVmb2ktcGhyHQsSB0NvbnRlbnQiEERPSC02MjEyNjk2NDY0NTQM
DOH,"November 22, 2022",VaxCert Change Last Name,SUCCESSFUL,Travel Purposes,12/07/2021 - 11/14/2022,https://www.foi.gov.ph/requests/aglzfmVmb2ktcGhyHQsSB0NvbnRlbnQiEERPSC0xNjYwMzQ4MTcxMzYM
PAGCOR,"November 22, 2022",Updated List of third party chipwashing and junket operators in Cebu Philippines,PENDING,Research,10/01/2022 - 11/22/2022,https://www.foi.gov.ph/requests/aglzfmVmb2ktcGhyIAsSB0NvbnRlbnQiE1BBR0NPUi05ODA2ODM4NTk4NTIM
DOH,"November 22, 2022",ANGELU RAVEN SAMONTE,SUCCESSFUL,VACCINATION CERTIFICATE,10/24/2022 - 11/22/2022,https://www.foi.gov.ph/requests/aglzfmVmb2ktcGhyHQsSB0NvbnRlbnQiEERPSC05NTAzMTYxMzc0MDYM
DA,"November 22, 2022",Supply of soybean in Manila,REFERRED,Feasibility Study,01/01/2016 - 11/22/2022,https://www.foi.gov.ph/requests/aglzfmVmb2ktcGhyHAsSB0NvbnRlbnQiD0RBLTIyNjkwOTA3MTc0Mww
DA,"November 22, 2022",Volume of Production / supply of Meat (beef) in Manila,PARTIALLY SUCCESSFUL,Feasibility study,01/01/2016 - 11/22/2022,https://www.foi.gov.ph/requests/aglzfmVmb2ktcGhyHAsSB0NvbnRlbnQiD0RBLTQ5NjA0MjMyNzU3OQw
IC,"November 22, 2022",Insurance claims; urgent,ACCEPTED,Insurance claim from prudential(under BDO),11/10/2022 - 11/13/2022,https://www.foi.gov.ph/requests/aglzfmVmb2ktcGhyHAsSB0NvbnRlbnQiD0lDLTUwNTU2MDk2NzI4MAw
DOH,"November 22, 2022",Vaxcert,SUCCESSFUL,Travel Purposes,11/14/2022 - 11/22/2022,https://www.foi.gov.ph/requests/aglzfmVmb2ktcGhyHQsSB0NvbnRlbnQiEERPSC0zODQxODc3ODUzNTkM
PSA,"November 22, 2022",Accommodation and Food Service Activities Sector for Zamboanga City,SUCCESSFUL,Thesis Research,11/21/2022 - 11/21/2022,https://www.foi.gov.ph/requests/aglzfmVmb2ktcGhyHQsSB0NvbnRlbnQiEFBTQS03MDg2MjY3MjUwMjYM
PSA,"November 22, 2022",The number of reported Mental Health Disorder cases in the City of Dasmariñas,REFERRED,For thesis purposes,01/01/2019 - 11/22/2022,https://www.foi.gov.ph/requests/aglzfmVmb2ktcGhyHQsSB0NvbnRlbnQiEFBTQS00ODY5NjEzMDgxNTcM
DOH,"November 22, 2022",The number of reported Mental Health Disorder cases in the City of Dasmariñas,PROCESSING,For thesis purposes,01/01/2019 - 11/22/2022,https://www.foi.gov.ph/requests/aglzfmVmb2ktcGhyHQsSB0NvbnRlbnQiEERPSC02NjAzNjQ4NDk0MTEM
MMDA,"November 22, 2022",Manila Master Plan,PENDING,Research,01/01/2016 - 11/21/2022,https://www.foi.gov.ph/requests/aglzfmVmb2ktcGhyHgsSB0NvbnRlbnQiEU1NREEtMzg1NTQ4OTMwODAxDA
DOJ,"November 22, 2022",The city with the lowest crime rate in the Philippines,REFERRED,Research and development for Architectural thesis,11/22/2012 - 11/22/2022,https://www.foi.gov.ph/requests/aglzfmVmb2ktcGhyHQsSB0NvbnRlbnQiEERPSi0yNDU2NjA0MzYwMDMM
DepEd,"November 22, 2022",Public school population,AWAITING CLARIFICATION,Shortlisting of public schools that may be adopted as beneficiary school of Security Bank Foundation,01/01/2017 - 11/22/2022,https://www.foi.gov.ph/requests/aglzfmVmb2ktcGhyHwsSB0NvbnRlbnQiEkRlcEVkLTI4NDY0OTIyMjEzMQw
NAMRIA,"November 22, 2022","Hazard Maps and Contour Maps of Palaui Island, Cagayan",REFERRED,Research and Design Project for Architectural Design 7 Course,11/22/2022 - 11/22/2022,https://www.foi.gov.ph/requests/aglzfmVmb2ktcGhyJAsSB0NvbnRlbnQiF0RFTlJOQU1SSUEtNTUzODE2NjU4MjI0DA
PAGASA,"November 22, 2022",Clarification Regarding Corona's Four Climate Types,SUCCESSFUL,Student Research,01/01/2005 - 12/31/2020,https://www.foi.gov.ph/requests/aglzfmVmb2ktcGhyIAsSB0NvbnRlbnQiE1BBR0FTQS0zNTIyNzA1ODM0NDMM
PSA,"November 22, 2022","Population of Palaui Island, Cagayan",SUCCESSFUL,Research,11/22/2022 - 11/22/2022,https://www.foi.gov.ph/requests/aglzfmVmb2ktcGhyHQsSB0NvbnRlbnQiEFBTQS0yNTIzOTg2NzY1NjIM
PSA,"November 22, 2022","Population of Palaui Island, Cagayan",PARTIALLY SUCCESSFUL,Research,11/22/2022 - 11/22/2022,https://www.foi.gov.ph/requests/aglzfmVmb2ktcGhyHQsSB0NvbnRlbnQiEFBTQS05MjIwMzg1MDE0ODMM
NTC,"November 22, 2022",Death Treats and harrasing my contact,PARTIALLY SUCCESSFUL,Stop OLA's,11/16/2022 - 11/22/2022,https://www.foi.gov.ph/requests/aglzfmVmb2ktcGhyHQsSB0NvbnRlbnQiEE5UQy02MjMyMzkzNDI1MjIM
NBI,"November 22, 2022",Reference Number : MP6LLZSYTN,PENDING,To refund my payment from gcash,11/22/2022 - 11/22/2022,https://www.foi.gov.ph/requests/aglzfmVmb2ktcGhyHQsSB0NvbnRlbnQiEE5CSS0xNTkwMjM0NjQ1MjgM
PSA,"November 22, 2022",2017 NDHS data,SUCCESSFUL,Research/Thesis,01/01/2017 - 12/22/2017,https://www.foi.gov.ph/requests/aglzfmVmb2ktcGhyHQsSB0NvbnRlbnQiEFBTQS0yNzEzNjc3MjEyMTYM
DOST,"November 22, 2022",DOST scholarship benificiaries for the past five years,REFERRED,Academic purposes,01/01/2017 - 11/22/2022,https://www.foi.gov.ph/requests/aglzfmVmb2ktcGhyHgsSB0NvbnRlbnQiEURPU1QtOTAxODY4MjQzMDQ3DA
CFO,"November 22, 2022",Number of Filipino in South Korea in 2022,PARTIALLY SUCCESSFUL,for marketing report data,01/01/2022 - 11/22/2022,https://www.foi.gov.ph/requests/aglzfmVmb2ktcGhyHQsSB0NvbnRlbnQiEENGTy0wMzI5MDQwMzE2MDAM
PUP,"November 22, 2022",Minutes of the Meeting of the Board of Regents,DENIED,"Research and Development for Policy Making Structures, Statistical Analysis.",01/01/2021 - 11/22/2022,https://www.foi.gov.ph/requests/aglzfmVmb2ktcGhyHQsSB0NvbnRlbnQiEFBVUC05NDQ4OTkwOTA0NzEM
PSA,"November 22, 2022",Mangyan Population in Mindoro Inquiry,PENDING,Architectural Thesis,11/22/2017 - 11/22/2022,https://www.foi.gov.ph/requests/aglzfmVmb2ktcGhyHQsSB0NvbnRlbnQiEFBTQS01ODkwODA3MDk3ODMM
NBI,"November 22, 2022",Online lending company,PENDING,Harrasment of lending company,10/31/2022 - 11/22/2022,https://www.foi.gov.ph/requests/aglzfmVmb2ktcGhyHQsSB0NvbnRlbnQiEE5CSS00MzI2MzMwMTA4OTcM
SEC,"November 22, 2022",Financial Statements,SUCCESSFUL,Research purposes,11/22/2022 - 11/22/2022,https://www.foi.gov.ph/requests/aglzfmVmb2ktcGhyHQsSB0NvbnRlbnQiEFNFQy0yMTE1NzE0NzAyODkM
BIR,"November 22, 2022",Request for BIR Form 2316 and/or Income Tax Return,DENIED,College Scholarship,11/17/2022 - 11/22/2022,https://www.foi.gov.ph/requests/aglzfmVmb2ktcGhyHQsSB0NvbnRlbnQiEEJJUi00MTExOTMxOTE5NzYM
DOTr,"November 22, 2022",BRT-NPMO Department and BRT,SUCCESSFUL,Undergraduate Thesis,03/16/2017 - 11/22/2022,https://www.foi.gov.ph/requests/aglzfmVmb2ktcGhyHgsSB0NvbnRlbnQiEURPVHItNzU3MDIyMzE1NzY2DA
DOH,"November 22, 2022",VaxCert,SUCCESSFUL,For Travel abroad,10/27/2022 - 11/22/2022,https://www.foi.gov.ph/requests/aglzfmVmb2ktcGhyHQsSB0NvbnRlbnQiEERPSC0wODk5MzgwOTc4MjEM
DOT,"November 22, 2022","ALILEM, ILOCOS SUR TOURISM ARRIVAL",AWAITING CLARIFICATION,For our tourism development project.,01/01/2016 - 11/22/2022,https://www.foi.gov.ph/requests/aglzfmVmb2ktcGhyHQsSB0NvbnRlbnQiEERPVC00NjE5MzQ0MTQ3NTYM
PSA,"November 22, 2022",Recreational Camp Facilities,PENDING,Architectural Thesis,01/01/2016 - 11/22/2022,https://www.foi.gov.ph/requests/aglzfmVmb2ktcGhyHQsSB0NvbnRlbnQiEFBTQS05NjE1NzEzMjMyNDYM
PSA,"November 22, 2022",No Found Status on our National ID,PARTIALLY SUCCESSFUL,Personal Use,10/08/2021 - 11/22/2022,https://www.foi.gov.ph/requests/aglzfmVmb2ktcGhyHQsSB0NvbnRlbnQiEFBTQS0wNTY4OTM4OTEyODIM
