agency,date,title,status,purpose,period_covered,link
BIR,"June 22, 2022",Request for copy of ITR,AWAITING CLARIFICATION,Requirement for visa application/ Overseas employment,02/24/2014 - 06/22/2022,https://www.foi.gov.ph/requests/aglzfmVmb2ktcGhyHQsSB0NvbnRlbnQiEEJJUi00NTg3NjkxMDg4NjUM
CDA,"June 22, 2022","List of credit, Cooperative Bank and Multi purpose cooperatives ( offering credit to their members)",ACCEPTED,Research and Development,06/06/2022 - 06/06/2022,https://www.foi.gov.ph/requests/aglzfmVmb2ktcGhyHQsSB0NvbnRlbnQiEENEQS00Mjc5MzQ3NzYzODkM
BIR,"June 22, 2022",Income Tax Return,AWAITING CLARIFICATION,Application,12/01/2021 - 01/01/2022,https://www.foi.gov.ph/requests/aglzfmVmb2ktcGhyHQsSB0NvbnRlbnQiEEJJUi03MjY4OTAwOTkyOTQM
SSS,"June 22, 2022",Salary loan,PENDING,Budget,05/26/2022 - 06/22/2022,https://www.foi.gov.ph/requests/aglzfmVmb2ktcGhyHQsSB0NvbnRlbnQiEFNTUy01NzYzNzIyMjYxNjAM
BIR,"June 22, 2022",Income Tax Return,AWAITING CLARIFICATION,For Visa application,08/01/2021 - 08/01/2021,https://www.foi.gov.ph/requests/aglzfmVmb2ktcGhyHQsSB0NvbnRlbnQiEEJJUi00MDc5MDgyMjI4MjYM
DOE,"June 22, 2022",Annual Load Demand and PV Generation,SUCCESSFUL,Research Paper,01/01/2017 - 12/31/2021,https://www.foi.gov.ph/requests/aglzfmVmb2ktcGhyHQsSB0NvbnRlbnQiEERPRS0xMjgxMDQ3Mzk5MTUM
CDA,"June 22, 2022",List of cooperatives,SUCCESSFUL,Research and development,06/22/2015 - 06/22/2022,https://www.foi.gov.ph/requests/aglzfmVmb2ktcGhyHQsSB0NvbnRlbnQiEENEQS05OTg0OTI3MzMyODYM
CHED,"June 22, 2022",Number of college students per year level AY 2020-2021 in Manila City,SUCCESSFUL,Research and Development,01/01/2020 - 12/31/2021,https://www.foi.gov.ph/requests/aglzfmVmb2ktcGhyHgsSB0NvbnRlbnQiEUNIRUQtNTQzMjEyMTUwNjg1DA
AFP,"June 22, 2022",Enlistment Order/Assignment Order to Mobilization Center,DENIED,Application/Requirement for PA Reserve Force,06/01/2008 - 06/22/2022,https://www.foi.gov.ph/requests/aglzfmVmb2ktcGhyHQsSB0NvbnRlbnQiEEFGUC04NDkwNjkzODAwNTgM
DOTr,"June 22, 2022",Request for Site Selection Criteria of an Intermodal Transportation Terminal,SUCCESSFUL,Undergraduate Architectural Thesis,06/22/2022 - 06/22/2022,https://www.foi.gov.ph/requests/aglzfmVmb2ktcGhyHgsSB0NvbnRlbnQiEURPVHItODI3NzMwMTE4MDAyDA
LTFRB,"June 22, 2022",Request for Site Selection Criteria of an Intermodal Transportation Terminal,PENDING,Undergraduate Architectural Thesis,06/22/2022 - 06/22/2022,https://www.foi.gov.ph/requests/aglzfmVmb2ktcGhyHwsSB0NvbnRlbnQiEkxURlJCLTczNzUxMzYwNjYwNQw
DOE,"June 22, 2022",Consolidated Regional Prevailing Retail Pump Prices,SUCCESSFUL,research and monitoring,05/31/2021 - 06/22/2022,https://www.foi.gov.ph/requests/aglzfmVmb2ktcGhyHQsSB0NvbnRlbnQiEERPRS02MDg5NTU3NjA5MjUM
DILG,"June 22, 2022",Region 3 and 4A LGUs Compliance Assessment Result on SGLG-EM Indicators (2019-2021),PENDING,Training and Development.,01/01/2019 - 06/22/2022,https://www.foi.gov.ph/requests/aglzfmVmb2ktcGhyHgsSB0NvbnRlbnQiEURJTEctODg0MDIyNDU5ODQyDA
BIR,"June 22, 2022",Tin verification slip,DENIED,Tin verification slip,06/22/2022 - 06/22/2022,https://www.foi.gov.ph/requests/aglzfmVmb2ktcGhyHQsSB0NvbnRlbnQiEEJJUi0xNzE3MjE3MzYwNzUM
LTO,"June 22, 2022","LTO DATA for number of cars registered in Dapa, Siargao",PENDING,Research and Development,01/01/2020 - 06/22/2022,https://www.foi.gov.ph/requests/aglzfmVmb2ktcGhyHQsSB0NvbnRlbnQiEExUTy03NzM1MzIzMjU4NzIM
SEC,"June 22, 2022",Complain against Oceanmarket. org Broker,SUCCESSFUL,1 help with fraudulent transaction on my trading account 2 Recover a hard earned investment,06/01/2022 - 06/17/2022,https://www.foi.gov.ph/requests/aglzfmVmb2ktcGhyHQsSB0NvbnRlbnQiEFNFQy01MjEyODk0OTc0ODIM
DOH,"June 22, 2022",Lost Vaccine Card,SUCCESSFUL,Request another vaccine card,06/22/2022 - 06/22/2022,https://www.foi.gov.ph/requests/aglzfmVmb2ktcGhyHQsSB0NvbnRlbnQiEERPSC0wMzMyMzc5NzIzODYM
NLP,"June 22, 2022",The Philippine Declaration of Independence,PENDING,Research and development,06/12/1898 - 06/22/2022,https://www.foi.gov.ph/requests/aglzfmVmb2ktcGhyHQsSB0NvbnRlbnQiEE5MUC02MzY4NTE3NDI1NTYM
PRC,"June 22, 2022",Registered master electrician,AWAITING CLARIFICATION,renewal,09/22/2017 - 09/22/2017,https://www.foi.gov.ph/requests/aglzfmVmb2ktcGhyHQsSB0NvbnRlbnQiEFBSQy02ODU0NDE4NDY0OTkM
LMB,"June 22, 2022","PRS coordinates of BLLM 13, Cad-291, Pili, Camarines Sur",SUCCESSFUL,Reference for relocation survey,10/06/1986 - 06/22/2022,https://www.foi.gov.ph/requests/aglzfmVmb2ktcGhyIQsSB0NvbnRlbnQiFERFTlJMTUItNzU1Nzc1NDM0MDg3DA
NBI,"June 22, 2022",refund my payment for nbi clearance,DENIED,refund my payment for nbi clearance,06/21/2022 - 06/21/2022,https://www.foi.gov.ph/requests/aglzfmVmb2ktcGhyHQsSB0NvbnRlbnQiEE5CSS0wNzMyNjQ1MDU5NjYM
BLGF,"June 22, 2022",UPDATED 2022 Income Class of LGUs,SUCCESSFUL,Training and Development,06/22/2022 - 06/22/2022,https://www.foi.gov.ph/requests/aglzfmVmb2ktcGhyHgsSB0NvbnRlbnQiEUJMR0YtOTcwNDAwNDgwMjA1DA
BI,"June 23, 2022",Memorandum on the cancellation of visa due to failure to report change of address,ACCEPTED,For research purposes and information,06/22/2022 - 06/23/2022,https://www.foi.gov.ph/requests/aglzfmVmb2ktcGhyHAsSB0NvbnRlbnQiD0JJLTQ3MTA3ODE3MDMwMQw
BMB,"June 22, 2022",Guidelines for ecotourism development in protected areas,DENIED,Research and Development,06/22/2012 - 06/22/2022,https://www.foi.gov.ph/requests/aglzfmVmb2ktcGhyIQsSB0NvbnRlbnQiFERFTlJCTUItNTc4NzMyMjUyMDY2DA
DENR,"June 22, 2022",Guidelines for ecotourism development in protected areas,REFERRED,Research and Development,06/22/2012 - 06/22/2022,https://www.foi.gov.ph/requests/aglzfmVmb2ktcGhyHgsSB0NvbnRlbnQiEURFTlItMTg1MzEzNTc0MjIwDA
DOH,"June 22, 2022",Update Record/Correction- VaxCert,SUCCESSFUL,For Travelling Abroad,06/22/2022 - 06/22/2022,https://www.foi.gov.ph/requests/aglzfmVmb2ktcGhyHQsSB0NvbnRlbnQiEERPSC0wNjk3OTAwMjE4OTIM
PSA,"June 22, 2022",Change of delivery address of Philsys ID,PARTIALLY SUCCESSFUL,Change of delivery address of my PHILSYS ID.,06/22/2022 - 06/22/2022,https://www.foi.gov.ph/requests/aglzfmVmb2ktcGhyHQsSB0NvbnRlbnQiEFBTQS05MDEwNjQ3Njk5MzIM
PSA,"June 22, 2022",Change delivery address for Philsys ID,PARTIALLY SUCCESSFUL,Requesting change of delivery address,06/22/2022 - 06/22/2022,https://www.foi.gov.ph/requests/aglzfmVmb2ktcGhyHQsSB0NvbnRlbnQiEFBTQS0yMzQ2NTIzMTMxODQM
DepEd,"June 22, 2022",ALS Certificate,SUCCESSFUL,For College Enrollment Purposes,06/21/2022 - 06/22/2022,https://www.foi.gov.ph/requests/aglzfmVmb2ktcGhyHwsSB0NvbnRlbnQiEkRlcEVkLTc1NTg3MTIyMzM3NAw
LTO,"June 22, 2022",Number of Motor Vehicles Registered by Type of Vehicle and Province,PENDING,Market Research,01/01/2010 - 12/31/2021,https://www.foi.gov.ph/requests/aglzfmVmb2ktcGhyHQsSB0NvbnRlbnQiEExUTy03MzI2NDI4MzUzNzIM
LMB,"June 22, 2022",Lot Description,SUCCESSFUL,"Relocation Survey, Research",06/21/2022 - 06/22/2022,https://www.foi.gov.ph/requests/aglzfmVmb2ktcGhyIQsSB0NvbnRlbnQiFERFTlJMTUItODEzMzI3NTI4ODEyDA
DPWH,"June 22, 2022",Comprehensive Land Use Plan and Zoning Ordinance in Masbate Province,DENIED,Academic Purpose,06/22/2012 - 06/22/2022,https://www.foi.gov.ph/requests/aglzfmVmb2ktcGhyHgsSB0NvbnRlbnQiEURQV0gtNzk4Mzk4ODU0Njk3DA
NHA,"June 22, 2022",Comprehensive Land Use Plan and Zoning Ordinance in Masbate Province,SUCCESSFUL,Academic Purpose,06/22/2012 - 06/22/2022,https://www.foi.gov.ph/requests/aglzfmVmb2ktcGhyHQsSB0NvbnRlbnQiEE5IQS03NDE5MTU3OTQxMzQM
BCDA,"June 22, 2022",Comprehensive Land Use Plan and Zoning Ordinance in Masbate Province,SUCCESSFUL,Academic Purpose,06/22/2012 - 06/22/2022,https://www.foi.gov.ph/requests/aglzfmVmb2ktcGhyHgsSB0NvbnRlbnQiEUJDREEtNjc0NjU5NTQ0OTM4DA
LMB,"June 22, 2022",Comprehensive Land Use Plan and Zoning Ordinance in Masbate Province,SUCCESSFUL,Academic Purpose,06/22/2012 - 06/22/2022,https://www.foi.gov.ph/requests/aglzfmVmb2ktcGhyIQsSB0NvbnRlbnQiFERFTlJMTUItNDczOTE3NTQ1MzQ5DA
TIEZA,"June 22, 2022",Comprehensive Land Use Plan and Zoning Ordinance in Masbate Province,DENIED,Academic Purpose,06/22/2012 - 06/22/2022,https://www.foi.gov.ph/requests/aglzfmVmb2ktcGhyHwsSB0NvbnRlbnQiElRJRVpBLTU1NjMyOTgyNjI5Mww
NAP,"June 22, 2022",Comprehensive Land Use Plan and Zoning Ordinance in Masbate Province,DENIED,Academic Purpose,06/22/2012 - 06/22/2022,https://www.foi.gov.ph/requests/aglzfmVmb2ktcGhyHQsSB0NvbnRlbnQiEE5BUC0zMzI4ODA3NTcwMjAM
DENR,"June 22, 2022",Comprehensive Land Use Plan and Zoning Ordinance in Masbate Province,REFERRED,Academic Purpose,06/22/2012 - 06/22/2022,https://www.foi.gov.ph/requests/aglzfmVmb2ktcGhyHgsSB0NvbnRlbnQiEURFTlItNTYzODM1MzQ5MDI2DA
DOT,"June 22, 2022",Comprehensive Land Use Plan and Zoning Ordinance in Masbate Province,DENIED,Academic Purpose,06/22/2012 - 06/22/2022,https://www.foi.gov.ph/requests/aglzfmVmb2ktcGhyHQsSB0NvbnRlbnQiEERPVC04NzYzMzk0OTE3MDYM
SSS,"June 22, 2022",Follow up sickness benefit (medical evaluation),PENDING,Follow up sickness benefit ( medical evaluation),06/08/2022 - 06/21/2022,https://www.foi.gov.ph/requests/aglzfmVmb2ktcGhyHQsSB0NvbnRlbnQiEFNTUy0zMTYzMDQwMjEwNDUM
NBI,"June 22, 2022",NBI REFUND,DENIED,PAYMENT REFUND,06/22/2022 - 06/22/2022,https://www.foi.gov.ph/requests/aglzfmVmb2ktcGhyHQsSB0NvbnRlbnQiEE5CSS03NTI1NDQ1MDIwNzQM
DOH,"June 22, 2022",New vaccination card,SUCCESSFUL,Request of new vaccination card,06/22/2022 - 06/22/2022,https://www.foi.gov.ph/requests/aglzfmVmb2ktcGhyHQsSB0NvbnRlbnQiEERPSC01NDQyNzMxNjQ4NjYM
PNP,"June 22, 2022",Sample of Pilice Reports,SUCCESSFUL,Thesis,01/01/2022 - 06/22/2022,https://www.foi.gov.ph/requests/aglzfmVmb2ktcGhyHQsSB0NvbnRlbnQiEFBOUC0zNTExNTU5NzA2MzgM
DENR,"June 22, 2022","Land, Water, and Air Pollution for Municipality of Kalibo",REFERRED,Case Study Research,01/01/2018 - 06/01/2022,https://www.foi.gov.ph/requests/aglzfmVmb2ktcGhyHgsSB0NvbnRlbnQiEURFTlItNTUxNDQwNTgyMzcyDA
DOH,"June 22, 2022",For Correction of Vaccination Record (Incorrect Birthdate and Missing 2nd Dose Record),SUCCESSFUL,Correction of Vaccination Record (Incorrect Birthdate and Missing 2nd Dose Record,11/11/2021 - 12/17/2021,https://www.foi.gov.ph/requests/aglzfmVmb2ktcGhyHQsSB0NvbnRlbnQiEERPSC03NjQ1MTQzNjQ3MDEM
PNP,"June 22, 2022",Crime Statistics in PRO2 specifically in Santiago City,SUCCESSFUL,Research,01/01/2015 - 06/22/2022,https://www.foi.gov.ph/requests/aglzfmVmb2ktcGhyHQsSB0NvbnRlbnQiEFBOUC05OTU1MDM0NTAzMDUM
DOST,"June 22, 2022","Sanitary General Rules at Burgos, Siargao Island, Surigao del Norte",REFERRED,REBUILDING SIARGAO COMMUNITY CENTER + URBAN INTERVENTIONS,06/22/2022 - 06/22/2022,https://www.foi.gov.ph/requests/aglzfmVmb2ktcGhyHgsSB0NvbnRlbnQiEURPU1QtODI2NTE0NTA0NTM5DA
CHED,"June 22, 2022",Number of per year level AY 2020-2021 Financial Management students in Manila City,SUCCESSFUL,Research and Development,01/01/2020 - 06/22/2022,https://www.foi.gov.ph/requests/aglzfmVmb2ktcGhyHgsSB0NvbnRlbnQiEUNIRUQtMTExNTY5MTE1MzI5DA
SSS,"June 22, 2022",Follow up on sickness benefit claim,PENDING,For Sickness benefit claim,04/10/2022 - 05/15/2022,https://www.foi.gov.ph/requests/aglzfmVmb2ktcGhyHQsSB0NvbnRlbnQiEFNTUy0wNTg3MjUzMjcxNjIM
DOH,"June 22, 2022",Covid vaccine card,SUCCESSFUL,For travel purpose,07/23/2021 - 07/23/2021,https://www.foi.gov.ph/requests/aglzfmVmb2ktcGhyHQsSB0NvbnRlbnQiEERPSC05NTc3ODQ0MzExMjcM
BIR,"June 22, 2022",Request for copy of ITR,AWAITING CLARIFICATION,Requirement for visa application/ Overseas employment,02/24/2014 - 06/22/2022,https://www.foi.gov.ph/requests/aglzfmVmb2ktcGhyHQsSB0NvbnRlbnQiEEJJUi00NTg3NjkxMDg4NjUM
CDA,"June 22, 2022","List of credit, Cooperative Bank and Multi purpose cooperatives ( offering credit to their members)",ACCEPTED,Research and Development,06/06/2022 - 06/06/2022,https://www.foi.gov.ph/requests/aglzfmVmb2ktcGhyHQsSB0NvbnRlbnQiEENEQS00Mjc5MzQ3NzYzODkM
BIR,"June 22, 2022",Income Tax Return,AWAITING CLARIFICATION,Application,12/01/2021 - 01/01/2022,https://www.foi.gov.ph/requests/aglzfmVmb2ktcGhyHQsSB0NvbnRlbnQiEEJJUi03MjY4OTAwOTkyOTQM
SSS,"June 22, 2022",Salary loan,PENDING,Budget,05/26/2022 - 06/22/2022,https://www.foi.gov.ph/requests/aglzfmVmb2ktcGhyHQsSB0NvbnRlbnQiEFNTUy01NzYzNzIyMjYxNjAM
BIR,"June 22, 2022",Income Tax Return,AWAITING CLARIFICATION,For Visa application,08/01/2021 - 08/01/2021,https://www.foi.gov.ph/requests/aglzfmVmb2ktcGhyHQsSB0NvbnRlbnQiEEJJUi00MDc5MDgyMjI4MjYM
DOE,"June 22, 2022",Annual Load Demand and PV Generation,SUCCESSFUL,Research Paper,01/01/2017 - 12/31/2021,https://www.foi.gov.ph/requests/aglzfmVmb2ktcGhyHQsSB0NvbnRlbnQiEERPRS0xMjgxMDQ3Mzk5MTUM
CDA,"June 22, 2022",List of cooperatives,SUCCESSFUL,Research and development,06/22/2015 - 06/22/2022,https://www.foi.gov.ph/requests/aglzfmVmb2ktcGhyHQsSB0NvbnRlbnQiEENEQS05OTg0OTI3MzMyODYM
CHED,"June 22, 2022",Number of college students per year level AY 2020-2021 in Manila City,SUCCESSFUL,Research and Development,01/01/2020 - 12/31/2021,https://www.foi.gov.ph/requests/aglzfmVmb2ktcGhyHgsSB0NvbnRlbnQiEUNIRUQtNTQzMjEyMTUwNjg1DA
AFP,"June 22, 2022",Enlistment Order/Assignment Order to Mobilization Center,DENIED,Application/Requirement for PA Reserve Force,06/01/2008 - 06/22/2022,https://www.foi.gov.ph/requests/aglzfmVmb2ktcGhyHQsSB0NvbnRlbnQiEEFGUC04NDkwNjkzODAwNTgM
DOTr,"June 22, 2022",Request for Site Selection Criteria of an Intermodal Transportation Terminal,SUCCESSFUL,Undergraduate Architectural Thesis,06/22/2022 - 06/22/2022,https://www.foi.gov.ph/requests/aglzfmVmb2ktcGhyHgsSB0NvbnRlbnQiEURPVHItODI3NzMwMTE4MDAyDA
LTFRB,"June 22, 2022",Request for Site Selection Criteria of an Intermodal Transportation Terminal,PENDING,Undergraduate Architectural Thesis,06/22/2022 - 06/22/2022,https://www.foi.gov.ph/requests/aglzfmVmb2ktcGhyHwsSB0NvbnRlbnQiEkxURlJCLTczNzUxMzYwNjYwNQw
DOE,"June 22, 2022",Consolidated Regional Prevailing Retail Pump Prices,SUCCESSFUL,research and monitoring,05/31/2021 - 06/22/2022,https://www.foi.gov.ph/requests/aglzfmVmb2ktcGhyHQsSB0NvbnRlbnQiEERPRS02MDg5NTU3NjA5MjUM
DILG,"June 22, 2022",Region 3 and 4A LGUs Compliance Assessment Result on SGLG-EM Indicators (2019-2021),PENDING,Training and Development.,01/01/2019 - 06/22/2022,https://www.foi.gov.ph/requests/aglzfmVmb2ktcGhyHgsSB0NvbnRlbnQiEURJTEctODg0MDIyNDU5ODQyDA
BIR,"June 22, 2022",Tin verification slip,DENIED,Tin verification slip,06/22/2022 - 06/22/2022,https://www.foi.gov.ph/requests/aglzfmVmb2ktcGhyHQsSB0NvbnRlbnQiEEJJUi0xNzE3MjE3MzYwNzUM
LTO,"June 22, 2022","LTO DATA for number of cars registered in Dapa, Siargao",PENDING,Research and Development,01/01/2020 - 06/22/2022,https://www.foi.gov.ph/requests/aglzfmVmb2ktcGhyHQsSB0NvbnRlbnQiEExUTy03NzM1MzIzMjU4NzIM
SEC,"June 22, 2022",Complain against Oceanmarket. org Broker,SUCCESSFUL,1 help with fraudulent transaction on my trading account 2 Recover a hard earned investment,06/01/2022 - 06/17/2022,https://www.foi.gov.ph/requests/aglzfmVmb2ktcGhyHQsSB0NvbnRlbnQiEFNFQy01MjEyODk0OTc0ODIM
DOH,"June 22, 2022",Lost Vaccine Card,SUCCESSFUL,Request another vaccine card,06/22/2022 - 06/22/2022,https://www.foi.gov.ph/requests/aglzfmVmb2ktcGhyHQsSB0NvbnRlbnQiEERPSC0wMzMyMzc5NzIzODYM
NLP,"June 22, 2022",The Philippine Declaration of Independence,PENDING,Research and development,06/12/1898 - 06/22/2022,https://www.foi.gov.ph/requests/aglzfmVmb2ktcGhyHQsSB0NvbnRlbnQiEE5MUC02MzY4NTE3NDI1NTYM
PRC,"June 22, 2022",Registered master electrician,AWAITING CLARIFICATION,renewal,09/22/2017 - 09/22/2017,https://www.foi.gov.ph/requests/aglzfmVmb2ktcGhyHQsSB0NvbnRlbnQiEFBSQy02ODU0NDE4NDY0OTkM
LMB,"June 22, 2022","PRS coordinates of BLLM 13, Cad-291, Pili, Camarines Sur",SUCCESSFUL,Reference for relocation survey,10/06/1986 - 06/22/2022,https://www.foi.gov.ph/requests/aglzfmVmb2ktcGhyIQsSB0NvbnRlbnQiFERFTlJMTUItNzU1Nzc1NDM0MDg3DA
NBI,"June 22, 2022",refund my payment for nbi clearance,DENIED,refund my payment for nbi clearance,06/21/2022 - 06/21/2022,https://www.foi.gov.ph/requests/aglzfmVmb2ktcGhyHQsSB0NvbnRlbnQiEE5CSS0wNzMyNjQ1MDU5NjYM
BLGF,"June 22, 2022",UPDATED 2022 Income Class of LGUs,SUCCESSFUL,Training and Development,06/22/2022 - 06/22/2022,https://www.foi.gov.ph/requests/aglzfmVmb2ktcGhyHgsSB0NvbnRlbnQiEUJMR0YtOTcwNDAwNDgwMjA1DA
DILG,"June 22, 2022",List of LGUs Located within Sierra Madre Mountain Ranges (Region 3 and 4A),PENDING,Training and Development,06/22/2022 - 06/22/2022,https://www.foi.gov.ph/requests/aglzfmVmb2ktcGhyHgsSB0NvbnRlbnQiEURJTEctMzgwODUzNTM2ODgyDA
DENR,"June 22, 2022",List of LGUs Located within Sierra Madre Mountain Ranges,REFERRED,Project Development. Training and Development. Capacity Building,06/22/2022 - 06/22/2022,https://www.foi.gov.ph/requests/aglzfmVmb2ktcGhyHgsSB0NvbnRlbnQiEURFTlItNTM4OTcyNjk5NzIwDA
PSA,"June 22, 2022",Philippine National ID,PARTIALLY SUCCESSFUL,Request to Change delivery address due to change of house,05/22/2022 - 06/22/2022,https://www.foi.gov.ph/requests/aglzfmVmb2ktcGhyHQsSB0NvbnRlbnQiEFBTQS05MTU0MDc4MDM1NTQM
DOH,"June 22, 2022",Vaccine Card,SUCCESSFUL,For work-related purposes,10/01/2021 - 10/29/2021,https://www.foi.gov.ph/requests/aglzfmVmb2ktcGhyHQsSB0NvbnRlbnQiEERPSC01NDIzMDMxNjA5MTYM
LMB,"June 22, 2022",T-31759,SUCCESSFUL,research,06/22/2022 - 06/22/2022,https://www.foi.gov.ph/requests/aglzfmVmb2ktcGhyIQsSB0NvbnRlbnQiFERFTlJMTUItOTAyODE1MDU4MTgzDA
PAGASA,"June 22, 2022",RIDF of Metro Manila,AWAITING CLARIFICATION,For the Design of Temporary Flood Control Mitigation Measure in Quezon City,06/22/2010 - 06/22/2022,https://www.foi.gov.ph/requests/aglzfmVmb2ktcGhyIAsSB0NvbnRlbnQiE1BBR0FTQS00NTE4OTAyMDc2MDcM
PNP,"June 22, 2022",Nr Domestic Violence filed in Nueva Vizcaya,SUCCESSFUL,Thesis/research,01/01/2015 - 01/01/2022,https://www.foi.gov.ph/requests/aglzfmVmb2ktcGhyHQsSB0NvbnRlbnQiEFBOUC04MTkwMDY0NTk2MTYM
PCGG,"June 22, 2022",The latest accomplishment report of the PCGG for the year 2021,SUCCESSFUL,Research and development,01/01/2021 - 06/22/2022,https://www.foi.gov.ph/requests/aglzfmVmb2ktcGhyHgsSB0NvbnRlbnQiEVBDR0ctODg4MzI2OTQzMzY0DA
BSWM,"June 22, 2022","Updated Soil Type Map of Brgy. San Juan, Antipolo, Rizal",PROCESSING,Undergraduate Thesis,06/22/2021 - 06/22/2022,https://www.foi.gov.ph/requests/aglzfmVmb2ktcGhyHgsSB0NvbnRlbnQiEUJTV00tOTc1NTIwMTAzMjMyDA
LRA,"June 22, 2022",LRC No. 35 Series 1983,PENDING,For Guidance judicial reconstitution of title,06/13/1983 - 06/13/1983,https://www.foi.gov.ph/requests/aglzfmVmb2ktcGhyHQsSB0NvbnRlbnQiEExSQS05MjQwNDgxMjIyNDMM
BIR,"June 22, 2022",Income Tax Return Copy,AWAITING CLARIFICATION,For Bank Loan Requirement,08/01/2017 - 08/01/2020,https://www.foi.gov.ph/requests/aglzfmVmb2ktcGhyHQsSB0NvbnRlbnQiEEJJUi0zNDI1NTk1OTM2MTIM
BSWM,"June 22, 2022","Soil Type Map of Brgy. San Juan, Antipolo, Rizal",PROCESSING,Undergraduate Thesis,06/22/2021 - 06/22/2022,https://www.foi.gov.ph/requests/aglzfmVmb2ktcGhyHgsSB0NvbnRlbnQiEUJTV00tNzczOTc4Nzk4OTU3DA
IC,"June 22, 2022",List of Exam Passers for June 15 IC Exam both Traditional and VUL,SUCCESSFUL,Personal,06/15/2022 - 06/17/2022,https://www.foi.gov.ph/requests/aglzfmVmb2ktcGhyHAsSB0NvbnRlbnQiD0lDLTA5ODQ2ODgxNjI2OQw
BSWM,"June 22, 2022","Soil Type Analysis Data of Barangay San Juan, Antipolo, Rizal",PROCESSING,Undergraduate Thesis,06/22/2021 - 06/22/2022,https://www.foi.gov.ph/requests/aglzfmVmb2ktcGhyHgsSB0NvbnRlbnQiEUJTV00tNTcxOTU4MjIyODUzDA
CHED,"June 22, 2022","Tertiary Education Subsidy grantees and budget, by region and institution type",ACCEPTED,Thesis,01/01/2018 - 12/31/2018,https://www.foi.gov.ph/requests/aglzfmVmb2ktcGhyHgsSB0NvbnRlbnQiEUNIRUQtNDA3NTQyMTQyMzcyDA
UPM,"June 22, 2022",Budget Circular No. 2003-5 dated 26 September 2003,SUCCESSFUL,Reference of Memorandum for newborn screening program,09/01/2003 - 06/22/2022,https://www.foi.gov.ph/requests/aglzfmVmb2ktcGhyHQsSB0NvbnRlbnQiEFVQTS0wNzk4ODI3NzMzODEM
DFA,"June 22, 2022",Passport Release,DENIED,Release of Passport to a Representative,05/22/2022 - 06/22/2022,https://www.foi.gov.ph/requests/aglzfmVmb2ktcGhyHQsSB0NvbnRlbnQiEERGQS01NDExMTEwNjY0MDAM
CIC,"June 22, 2022",Credit Report,PENDING,To know my actual and updated credit score.,01/01/2013 - 06/22/2022,https://www.foi.gov.ph/requests/aglzfmVmb2ktcGhyHQsSB0NvbnRlbnQiEENJQy0xNjYxODQ5MDA3MDAM
NBI,"June 22, 2022",Death Threats,DENIED,A.K.A COMANDER PITAW,06/21/2022 - 06/22/2022,https://www.foi.gov.ph/requests/aglzfmVmb2ktcGhyHQsSB0NvbnRlbnQiEE5CSS00OTEwNzE5Mjg1NjEM
MMDA,"June 22, 2022",Traffic Data along EDSA-Kamuning Road and NIA Road,PARTIALLY SUCCESSFUL,Detailed Engineering Design for New DPWH Building,01/01/2019 - 12/31/2020,https://www.foi.gov.ph/requests/aglzfmVmb2ktcGhyHgsSB0NvbnRlbnQiEU1NREEtNDcwNDIzMzYxMzM2DA
PAGASA,"June 22, 2022","Water Level at Sto. Nino Station, Marikina River",AWAITING CLARIFICATION,Undergraduate Thesis,01/01/2019 - 03/31/2022,https://www.foi.gov.ph/requests/aglzfmVmb2ktcGhyIAsSB0NvbnRlbnQiE1BBR0FTQS0zNjc1NTE0NTE2NzkM
LTO,"June 22, 2022",Number of Registered Vehicles,PENDING,Research and Development,01/01/2019 - 12/31/2021,https://www.foi.gov.ph/requests/aglzfmVmb2ktcGhyHQsSB0NvbnRlbnQiEExUTy00MDM4MzQ4OTU0OTcM
CHED,"June 22, 2022",Student Perceptions regarding School Administrative Practices dataset/s,DENIED,School Research and Development,01/01/2017 - 06/22/2022,https://www.foi.gov.ph/requests/aglzfmVmb2ktcGhyHgsSB0NvbnRlbnQiEUNIRUQtMTk3MTUzNTQxOTg1DA
WMSU,"June 22, 2022",NSTP Serial Number,PENDING,Requirement to get a new copy of my Master in Nursing Official Transcript of Records.,06/02/2003 - 03/31/2004,https://www.foi.gov.ph/requests/aglzfmVmb2ktcGhyHgsSB0NvbnRlbnQiEVdNU1UtNDk2MDExMTUyMDI3DA
PSA,"June 22, 2022",List of informal settlers in Barangay Matahimik and Barangay Mandaragat,ACCEPTED,Feasibility Study,06/07/2000 - 05/02/2015,https://www.foi.gov.ph/requests/aglzfmVmb2ktcGhyHQsSB0NvbnRlbnQiEFBTQS01NTE0MTUxMzk0MTEM
DepEd,"June 22, 2022",Copy of Form 137,SUCCESSFUL,College Application and for future work application,06/05/2017 - 05/13/2019,https://www.foi.gov.ph/requests/aglzfmVmb2ktcGhyHwsSB0NvbnRlbnQiEkRlcEVkLTE3MjUzNDY0NTY0MQw
BIR,"June 22, 2022",RMC 43-1991,SUCCESSFUL,For research purposes,01/01/1991 - 12/31/1991,https://www.foi.gov.ph/requests/aglzfmVmb2ktcGhyHQsSB0NvbnRlbnQiEEJJUi04MjEwNzcyMzc1NTYM
LRA,"June 22, 2022",Lot number 207,PENDING,To obtain any pertinent documents such as deed of donation/assignment for Marciano Malales,03/26/1980 - 06/22/2022,https://www.foi.gov.ph/requests/aglzfmVmb2ktcGhyHQsSB0NvbnRlbnQiEExSQS0zNDU1MjUyNjQyMDMM
NBI,"June 22, 2022",My payment in nbi clearance is pending yet it is paid in my gcash,DENIED,To successfully paid the transaction,06/20/2022 - 06/21/2022,https://www.foi.gov.ph/requests/aglzfmVmb2ktcGhyHQsSB0NvbnRlbnQiEE5CSS00NzY1NzE1OTk5MTcM
DOH,"June 22, 2022",Vaccination record,SUCCESSFUL,Request Record for vaccination,08/11/2021 - 08/11/2021,https://www.foi.gov.ph/requests/aglzfmVmb2ktcGhyHQsSB0NvbnRlbnQiEERPSC00MTI0Nzc1NTA4OTcM
PSAU,"June 22, 2022",Transcript of records or Any school Credential,SUCCESSFUL,For my Pre-Employment,06/22/2021 - 07/22/2021,https://www.foi.gov.ph/requests/aglzfmVmb2ktcGhyHgsSB0NvbnRlbnQiEVBTQVUtOTAyNjMzOTMxOTQ0DA
DPWH,"June 22, 2022","Bawi ,Padre garcia -Ibaan Soil survey",AWAITING CLARIFICATION,Analysis purposes,06/22/2022 - 06/22/2022,https://www.foi.gov.ph/requests/aglzfmVmb2ktcGhyHgsSB0NvbnRlbnQiEURQV0gtNzk4Mzc5NTk4MjIzDA
DOH,"June 22, 2022",VAXCERT PH,SUCCESSFUL,VAXCERT PH TRAVEL TO SINGAPORE,05/01/2022 - 06/22/2022,https://www.foi.gov.ph/requests/aglzfmVmb2ktcGhyHQsSB0NvbnRlbnQiEERPSC04MzAyNjIxNjA4MTIM
CCP,"June 22, 2022","The latest Statement of Assets, Liabilities, and Net Worth (SALN) of CCP Chairperson Margie Moran",PENDING,Research and Development,06/22/2022 - 06/22/2022,https://www.foi.gov.ph/requests/aglzfmVmb2ktcGhyHQsSB0NvbnRlbnQiEENDUC03NjAxNjQ2Nzk0MDUM
CCP,"June 22, 2022",The latest annual report of the CCP,ACCEPTED,Research and development,06/22/2022 - 06/22/2022,https://www.foi.gov.ph/requests/aglzfmVmb2ktcGhyHQsSB0NvbnRlbnQiEENDUC0yMjYwMDAwNDczOTQM
PCGG,"June 22, 2022",The official list of jewelries of Imelda Marcos auctioned and under litigation process,ACCEPTED,Research qnd development,02/28/1986 - 06/22/2022,https://www.foi.gov.ph/requests/aglzfmVmb2ktcGhyHgsSB0NvbnRlbnQiEVBDR0ctMjEwOTUzNzcyNDE2DA
DPWH,"June 22, 2022",EDSA FLY-OVER BRIDGE,ACCEPTED,Research Study for Academic Requirements,05/24/1985 - 05/24/2022,https://www.foi.gov.ph/requests/aglzfmVmb2ktcGhyHgsSB0NvbnRlbnQiEURQV0gtMTAxODQ0OTk0NDAzDA
DTI,"June 22, 2022",Questionnaire used in MSME Resiliency report with iPrepare Business Team,SUCCESSFUL,Thesis,06/22/2012 - 06/22/2022,https://www.foi.gov.ph/requests/aglzfmVmb2ktcGhyHQsSB0NvbnRlbnQiEERUSS02MDMyMjc1OTc4NjgM
NTC,"June 22, 2022",Lost Mobile Device,DENIED,I would like to retrieve my saved office files and documents on the device.,06/03/2022 - 06/20/2022,https://www.foi.gov.ph/requests/aglzfmVmb2ktcGhyHQsSB0NvbnRlbnQiEE5UQy03OTk1MjM4NjcwMjgM
DepEd,"June 22, 2022",Assistance for LAPTOP,REFERRED,Helps me to my study and to find a job online at home.,05/31/2022 - 06/22/2022,https://www.foi.gov.ph/requests/aglzfmVmb2ktcGhyHwsSB0NvbnRlbnQiEkRlcEVkLTg0MTIwMDExNTA3Nww
BAFPS,"June 22, 2022",TOP CERTIFICATION BODY IN THE PHILIPPINES,PENDING,Research and Development for Marketing Strategy,01/01/2021 - 12/31/2021,https://www.foi.gov.ph/requests/aglzfmVmb2ktcGhyHwsSB0NvbnRlbnQiEkJBRlBTLTE4NjY1MjgyMjc0OAw
DepEd,"June 22, 2022","Enclosure to DepEd Order No. 15, s. 2012 with Annexes",PROCESSING,Reference.,01/01/2012 - 12/31/2012,https://www.foi.gov.ph/requests/aglzfmVmb2ktcGhyHwsSB0NvbnRlbnQiEkRlcEVkLTkzOTAwMzgyMjA1OQw
DOH,"June 22, 2022",LOST VACCINATION CARD,SUCCESSFUL,Request for a new Vaccine Card,06/17/2022 - 06/22/2022,https://www.foi.gov.ph/requests/aglzfmVmb2ktcGhyHQsSB0NvbnRlbnQiEERPSC0wMTI2Mjc4MzY4MzQM
CHED,"June 22, 2022",Higher Education Enrollment and Graduates in SUCs per Province and Municipality for 5 Academic Years,SUCCESSFUL,Academic and Planning Purposes,06/01/2016 - 06/22/2022,https://www.foi.gov.ph/requests/aglzfmVmb2ktcGhyHgsSB0NvbnRlbnQiEUNIRUQtNDg2MDMxMDM4OTEwDA
