agency,date,title,status,purpose,period_covered,link
NTC,"December 07, 2022",To block my lost phone,PARTIALLY SUCCESSFUL,"To block my lost phone so that my personal details, emails cannot be use by someone",12/07/2022 - 12/07/2022,https://www.foi.gov.ph/requests/aglzfmVmb2ktcGhyHQsSB0NvbnRlbnQiEE5UQy0zMjIwNzY1NTM4NTQM
CHED,"December 07, 2022",Total Percentage of Currently Enrolled Female Engineering Students across the Philippines,PENDING,Research study/Thesis,01/01/2018 - 12/07/2022,https://www.foi.gov.ph/requests/aglzfmVmb2ktcGhyHgsSB0NvbnRlbnQiEUNIRUQtNDgxMTU3NjQxMzYyDA
LTO,"December 07, 2022",Requirement to register Electric trucks,DENIED,for study,12/06/2022 - 12/07/2022,https://www.foi.gov.ph/requests/aglzfmVmb2ktcGhyHQsSB0NvbnRlbnQiEExUTy05NjE0OTI5OTk0MjEM
DOLE,"December 07, 2022",Collective Bargaining Agreement Coca Cola Philippines 2021,PENDING,Research Purposes,12/07/2022 - 12/07/2022,https://www.foi.gov.ph/requests/aglzfmVmb2ktcGhyHgsSB0NvbnRlbnQiEURPTEUtMzUxMjcwOTkzMDc3DA
DSWD,"December 07, 2022",Area Vocational Rehabilitation Center,PENDING,Architectural Research,01/01/2016 - 01/01/2022,https://www.foi.gov.ph/requests/aglzfmVmb2ktcGhyHgsSB0NvbnRlbnQiEURTV0QtODUxNjQ2ODc2Njg3DA
PCW,"December 07, 2022",Number of women whose partners sexually assault them from January to March 2022,ACCEPTED,For educational purposes,01/01/2022 - 03/31/2022,https://www.foi.gov.ph/requests/aglzfmVmb2ktcGhyHQsSB0NvbnRlbnQiEFBDVy02NzIxMTcyNTIwOTYM
PSA,"December 07, 2022",Death/Cemetery Statistics,PENDING,Research and Development - Product Research,12/07/2022 - 12/07/2022,https://www.foi.gov.ph/requests/aglzfmVmb2ktcGhyHQsSB0NvbnRlbnQiEFBTQS01NTU1ODM3MTU1MjUM
PCMC,"December 07, 2022",Number of Children who are admitted with Pneumonia from January to March 2022.,PENDING,for educational purposes,01/01/2022 - 03/31/2022,https://www.foi.gov.ph/requests/aglzfmVmb2ktcGhyHgsSB0NvbnRlbnQiEVBDTUMtOTUzOTcwNDA0NTQ3DA
MMSU,"December 07, 2022",The total number of Government Nurses in Ilocos Norte,PENDING,Research Study,12/07/2022 - 12/07/2022,https://www.foi.gov.ph/requests/aglzfmVmb2ktcGhyHgsSB0NvbnRlbnQiEU1NU1UtODMxMjYwNDcwNzg1DA
LTFRB,"December 07, 2022",Request for Legal Office/Division Staffing pattern,PENDING,For Research and benchmarking of positions,11/01/2022 - 12/07/2022,https://www.foi.gov.ph/requests/aglzfmVmb2ktcGhyHwsSB0NvbnRlbnQiEkxURlJCLTU1Mjc0Nzg5MjI2MQw
DENR,"December 07, 2022",Does electric truck need Certificate of conformity?,PENDING,for study,12/05/2022 - 12/07/2022,https://www.foi.gov.ph/requests/aglzfmVmb2ktcGhyHgsSB0NvbnRlbnQiEURFTlItNjk1MDMzNjA3OTc1DA
PAGASA,"December 07, 2022","Wind Speed Data at 3m to 5m height in SRP, Cebu City",ACCEPTED,Research,12/07/2022 - 12/07/2022,https://www.foi.gov.ph/requests/aglzfmVmb2ktcGhyIAsSB0NvbnRlbnQiE1BBR0FTQS04MjA0NjE1MTUxNDkM
DENR EMB,"December 07, 2022",establishments in Davao City that have adapted wastewater nutrient removal systems,DENIED,Research,01/01/2010 - 12/06/2022,https://www.foi.gov.ph/requests/aglzfmVmb2ktcGhyIQsSB0NvbnRlbnQiFERFTlJFTUItMzg1OTY0OTU2NDM5DA
NLRCom,"December 07, 2022",Request for Legal Office/Division Staffing pattern,PENDING,For Research and benchmarking of positions,11/01/2022 - 12/07/2022,https://www.foi.gov.ph/requests/aglzfmVmb2ktcGhyIAsSB0NvbnRlbnQiE05MUkNvbS04MzA2MTYyMzY2ODkM
NCMB,"December 07, 2022",Request for Legal Office/Division Staffing pattern,ACCEPTED,For Research and benchmarking of positions,11/01/2022 - 12/07/2022,https://www.foi.gov.ph/requests/aglzfmVmb2ktcGhyHgsSB0NvbnRlbnQiEU5DTUItMjkyNDUxNDIzOTAxDA
MARINA,"December 07, 2022",Request for Legal Office/Division Staffing pattern,PENDING,For Research purposes and benchmarking,11/01/2022 - 12/07/2022,https://www.foi.gov.ph/requests/aglzfmVmb2ktcGhyIAsSB0NvbnRlbnQiE01BUklOQS01OTkxMzgyNzI4MDMM
NTC,"December 07, 2022",Verifying if successfully blocked smartphone requested on NTC region 10 Cagayan de Oro,PARTIALLY SUCCESSFUL,Verifying walk In requested,12/06/2022 - 12/07/2022,https://www.foi.gov.ph/requests/aglzfmVmb2ktcGhyHQsSB0NvbnRlbnQiEE5UQy0xMTEzNTY5NTgzNTMM
BI,"December 07, 2022",Request for Legal Office/Division Staffing pattern,PENDING,For Research purposes. Benchmarking from other government agencies,11/01/2022 - 12/07/2022,https://www.foi.gov.ph/requests/aglzfmVmb2ktcGhyHAsSB0NvbnRlbnQiD0JJLTk5MjMwODczNjY1OQw
DENR EMB,"December 07, 2022",establishments in Davao City that have adapted wastewater nutrient removal systems,DENIED,School Research,01/01/2010 - 12/06/2022,https://www.foi.gov.ph/requests/aglzfmVmb2ktcGhyIQsSB0NvbnRlbnQiFERFTlJFTUItMzEyMzM2MDIzODMyDA
DILG,"December 07, 2022","Request of CLUP, CDP, Zoning Ordinance of San Fernando, Cebu",PENDING,Architecture and Undergraduate Research,12/06/2022 - 12/06/2022,https://www.foi.gov.ph/requests/aglzfmVmb2ktcGhyHgsSB0NvbnRlbnQiEURJTEctNDUxNjI3ODk4NjI0DA
GSIS,"December 07, 2022",GSIS,PENDING,Research and public interest,01/01/2010 - 01/01/2022,https://www.foi.gov.ph/requests/aglzfmVmb2ktcGhyHgsSB0NvbnRlbnQiEUdTSVMtNzg5OTM3MzY3Nzk3DA
SSS,"December 07, 2022",Projected performance/profits of prospective SSS contribution/share in the Maharlika Wealth Fund,PENDING,Research and public interest.,01/01/2012 - 12/07/2022,https://www.foi.gov.ph/requests/aglzfmVmb2ktcGhyHQsSB0NvbnRlbnQiEFNTUy00OTY0NjY2MjI4OTYM
DOH,"December 07, 2022",SITE SELECTION CRITERIA FOR SHELTER FOR WOMEN,REFERRED,Architecture Thesis,01/01/2018 - 12/05/2022,https://www.foi.gov.ph/requests/aglzfmVmb2ktcGhyHQsSB0NvbnRlbnQiEERPSC00NDI1MDQyNjQyNTkM
DBM,"December 07, 2022",Research paper and projected profits/investment performance of Maharlika Wealth Fund,ACCEPTED,Research and public interest,12/07/2022 - 12/07/2022,https://www.foi.gov.ph/requests/aglzfmVmb2ktcGhyHQsSB0NvbnRlbnQiEERCTS00NTAyMDA2NDEzMjUM
PSA,"December 07, 2022","Demographic Profile of Cagayan de Oro City, Misamis Oriental",PARTIALLY SUCCESSFUL,Thesis Purposes,12/07/2000 - 12/07/2022,https://www.foi.gov.ph/requests/aglzfmVmb2ktcGhyHQsSB0NvbnRlbnQiEFBTQS0wMDk3MTQ5NzA1MTEM
SBC,"December 07, 2022",List of MSME Beneficiaries of CARES Program Under Bayanihan 2 in Metro Manila,PENDING,Research,10/01/2020 - 01/01/2022,https://www.foi.gov.ph/requests/aglzfmVmb2ktcGhyHQsSB0NvbnRlbnQiEFNCQy03NDI5MTEwNTU3ODMM
GSIS,"December 07, 2022",GSIS,PENDING,Research and public interest,01/01/2000 - 12/07/2022,https://www.foi.gov.ph/requests/aglzfmVmb2ktcGhyHgsSB0NvbnRlbnQiEUdTSVMtNjkzNjY3Njg1Njg2DA
DA,"December 07, 2022","Rice Field Mapping of Pantabangan, Rizal and Bongangon, Nueva Ecija.",PENDING,Undergraduate Thesis,11/29/2021 - 11/29/2022,https://www.foi.gov.ph/requests/aglzfmVmb2ktcGhyHAsSB0NvbnRlbnQiD0RBLTIwODYyNjM5MjAzOAw
SSS,"December 07, 2022",Annual breakdown and investment performance of SSS' investible funds (2000-2022),PENDING,Research and public interest,01/01/2000 - 12/07/2022,https://www.foi.gov.ph/requests/aglzfmVmb2ktcGhyHQsSB0NvbnRlbnQiEFNTUy02MTc2Mzk5MDI4OTIM
PNP,"December 07, 2022",Check if criminal history if scamming,ACCEPTED,I was scammed by her do want to check if she has criminal background of scamming.,12/06/2000 - 12/06/2022,https://www.foi.gov.ph/requests/aglzfmVmb2ktcGhyHQsSB0NvbnRlbnQiEFBOUC03MDAyMjc1MTg1NDcM
LMB,"December 07, 2022","Kalibo, Aklan Clup",ACCEPTED,Architectural Thesis Requirement,11/16/2022 - 12/07/2022,https://www.foi.gov.ph/requests/aglzfmVmb2ktcGhyIQsSB0NvbnRlbnQiFERFTlJMTUItMDIyMDA4Njc2MzY1DA
BTr,"December 07, 2022",National Government Budget Deficit of the Philippines from January 2022 to November 2022,SUCCESSFUL,Research,01/01/2022 - 11/30/2022,https://www.foi.gov.ph/requests/aglzfmVmb2ktcGhyHQsSB0NvbnRlbnQiEEJUci04Mjc2NTk4MDQ5MjQM
PAGASA,"December 07, 2022","Request of Wind Speed (10m), Temperature, and Humidity Data for SRP Cebu (2022)",ACCEPTED,Data is needed to complete Thesis.,01/01/2022 - 12/07/2022,https://www.foi.gov.ph/requests/aglzfmVmb2ktcGhyIAsSB0NvbnRlbnQiE1BBR0FTQS0zMTc4NDU1NjY3NTcM
DOH,"December 07, 2022","Raw, anonymized demographic data on women who use contraceptives in the Philipines",ACCEPTED,For academic purposes,01/01/2020 - 12/03/2022,https://www.foi.gov.ph/requests/aglzfmVmb2ktcGhyHQsSB0NvbnRlbnQiEERPSC0wMDExNDAyMTE4MzIM
NBI,"December 07, 2022",Complaint about an unauthorized transaction in Security Bank,PENDING,refund for the loss money deposited in the bank,12/29/2021 - 12/07/2022,https://www.foi.gov.ph/requests/aglzfmVmb2ktcGhyHQsSB0NvbnRlbnQiEE5CSS03MTkwMDU5NDkxMTgM
PSA,"December 07, 2022","Raw, anonymized demographic data on women who are farmers in the Philippines",PARTIALLY SUCCESSFUL,For academic purposes,01/01/2017 - 10/17/2022,https://www.foi.gov.ph/requests/aglzfmVmb2ktcGhyHQsSB0NvbnRlbnQiEFBTQS03MzI2NTg3Mjk2NzEM
SBMA,"December 07, 2022",: Inquiry on Manufacturing Sectors Located at SBFZ during Pre & Post COVID-19 Pandemic,PENDING,Thesis Writing,01/01/2019 - 12/07/2022,https://www.foi.gov.ph/requests/aglzfmVmb2ktcGhyHgsSB0NvbnRlbnQiEVNCTUEtNjE3MjI2MjcyOTY0DA
PSA,"December 07, 2022",Educational Attainment of Men and Women Nationwide,SUCCESSFUL,Research and Data Analysis,01/01/2017 - 12/07/2022,https://www.foi.gov.ph/requests/aglzfmVmb2ktcGhyHQsSB0NvbnRlbnQiEFBTQS0wNzIwODEzNjA0MTYM
DOTr,"December 07, 2022",Metro Manila BRT and BRT-NPMO Department,PENDING,Research Study,03/16/2017 - 12/07/2022,https://www.foi.gov.ph/requests/aglzfmVmb2ktcGhyHgsSB0NvbnRlbnQiEURPVHItMjUyNTc1Mjk0OTM5DA
DOH,"December 07, 2022",Data and breakdown of demography of deaths,ACCEPTED,Data Management,01/01/2020 - Invalid date,https://www.foi.gov.ph/requests/aglzfmVmb2ktcGhyHQsSB0NvbnRlbnQiEERPSC03MTE0NTE4OTg0OTYM
DILG,"December 07, 2022",Updated and official barangay boundaries (shp),PENDING,Conflict resolution,12/07/2022 - 12/07/2022,https://www.foi.gov.ph/requests/aglzfmVmb2ktcGhyHgsSB0NvbnRlbnQiEURJTEctMjcwMTY3MDk3MjAxDA
LMB,"December 07, 2022",Updated and official barangay boundaries (shp),AWAITING CLARIFICATION,Conflict resolution,12/07/2022 - 12/07/2022,https://www.foi.gov.ph/requests/aglzfmVmb2ktcGhyIQsSB0NvbnRlbnQiFERFTlJMTUItNTE3Njg5NjYxMTIyDA
DepEd,"December 07, 2022",NOSCA,SUCCESSFUL,To have an update about the issuance of NOSCA.,07/11/2022 - 12/06/2022,https://www.foi.gov.ph/requests/aglzfmVmb2ktcGhyHwsSB0NvbnRlbnQiEkRlcEVkLTE3OTk0MTYzODI4OQw
CHED,"December 07, 2022",CHED Accredited Journals as of 2022,PENDING,Research and Development. Publication,12/07/2022 - 12/07/2022,https://www.foi.gov.ph/requests/aglzfmVmb2ktcGhyHgsSB0NvbnRlbnQiEUNIRUQtMjg3Mjc5MDg0ODQ1DA
NTC,"December 07, 2022",Track and request to block the stolen phone,PARTIALLY SUCCESSFUL,block the cellphone number,12/07/2022 - 12/07/2022,https://www.foi.gov.ph/requests/aglzfmVmb2ktcGhyHQsSB0NvbnRlbnQiEE5UQy0wNzYxMTU4MDY1MzgM
LTO,"December 07, 2022",The number of 2 wheel motorcycles registered in the Philippines,PENDING,Research and development,01/01/2022 - 12/01/2022,https://www.foi.gov.ph/requests/aglzfmVmb2ktcGhyHQsSB0NvbnRlbnQiEExUTy01NzA1MTA3MDQzOTIM
PNAC,"December 07, 2022",The Number of HIV Cases in NCR,PENDING,Research,01/01/2020 - 12/31/2021,https://www.foi.gov.ph/requests/aglzfmVmb2ktcGhyHgsSB0NvbnRlbnQiEVBOQUMtOTY1MTg4MjE3NTE3DA
DOH,"December 07, 2022",The Number of HIV cases in NCR Philippines,PROCESSING,Research,01/01/2020 - 12/31/2021,https://www.foi.gov.ph/requests/aglzfmVmb2ktcGhyHQsSB0NvbnRlbnQiEERPSC04NTA2MjE2OTI1NzYM
CHED,"December 07, 2022",Request for Scholarship or Educational Assistance,PENDING,Request for Scholarship or Educational Assistance,11/01/2022 - 12/07/2022,https://www.foi.gov.ph/requests/aglzfmVmb2ktcGhyHgsSB0NvbnRlbnQiEUNIRUQtMzkxNTUyMDIwMDc2DA
IC,"December 07, 2022",Insurance Broker Statistics as of 2021,ACCEPTED,This would be for personal use/ research not affiliated with any agency or company,01/01/2021 - 12/31/2021,https://www.foi.gov.ph/requests/aglzfmVmb2ktcGhyHAsSB0NvbnRlbnQiD0lDLTI1NzA1MzIzOTM4Ngw
DFA,"December 07, 2022",To request refund of passport fee,PENDING,Passport fee request refund,04/02/2022 - 12/07/2022,https://www.foi.gov.ph/requests/aglzfmVmb2ktcGhyHQsSB0NvbnRlbnQiEERGQS0zNTYxMTUwNzU1OTkM
TUP,"December 07, 2022",NSTP SERIAL NUMBER,DENIED,CURRENT SCHOOL REQUIREMENT,06/08/2018 - 05/06/2019,https://www.foi.gov.ph/requests/aglzfmVmb2ktcGhyHQsSB0NvbnRlbnQiEFRVUC00MzM5NTQ2Mjg4NzQM
DOT,"December 07, 2022",Number of tourist arrival per year in Antipolo City,AWAITING CLARIFICATION,Research,01/01/2019 - 12/07/2022,https://www.foi.gov.ph/requests/aglzfmVmb2ktcGhyHQsSB0NvbnRlbnQiEERPVC02MjI2ODEyOTk1MDUM
NBI,"December 07, 2022",Online Scammer,PENDING,Track them and give them lecture,12/06/2022 - 12/06/2022,https://www.foi.gov.ph/requests/aglzfmVmb2ktcGhyHQsSB0NvbnRlbnQiEE5CSS02Nzk2MDUzMTg3NzEM
PILWD,"December 07, 2022","Panoypoyan, Bula Camsur Water supply map",DENIED,Architectural thesis,12/01/2022 - 12/02/2022,https://www.foi.gov.ph/requests/aglzfmVmb2ktcGhyHwsSB0NvbnRlbnQiElBJTFdELTI3MTE3NTI5MTQyMQw
DOE,"December 07, 2022",Power supply map/Line of Service of Casureco III,PENDING,Architectural thesis,12/01/2022 - 12/02/2022,https://www.foi.gov.ph/requests/aglzfmVmb2ktcGhyHQsSB0NvbnRlbnQiEERPRS02MDU2OTQxMjcwNTAM
ITDI,"December 07, 2022",etv,SUCCESSFUL,research,01/01/2000 - 12/06/2022,https://www.foi.gov.ph/requests/aglzfmVmb2ktcGhyHgsSB0NvbnRlbnQiEUlUREktMTY1Mjg4ODA4MDc3DA
BATOWD,"December 07, 2022",Water supply Map/Line of Service Map,PENDING,Thesis,12/01/2022 - 12/02/2022,https://www.foi.gov.ph/requests/aglzfmVmb2ktcGhyIAsSB0NvbnRlbnQiE0JBVE9XRC01OTQ4NjgyOTYwMjkM
MMDA,"December 07, 2022",Average Annual Daily Traffic of Roxas Blvd and Diosdado Macapagal Blvd.,PARTIALLY SUCCESSFUL,Undergraduate Research,12/07/2022 - 12/07/2022,https://www.foi.gov.ph/requests/aglzfmVmb2ktcGhyHgsSB0NvbnRlbnQiEU1NREEtMjg4MTgwNzI0Mjk5DA
BIR,"December 07, 2022",Income Tax Return,SUCCESSFUL,Needed for work,01/01/2020 - 01/01/2022,https://www.foi.gov.ph/requests/aglzfmVmb2ktcGhyHQsSB0NvbnRlbnQiEEJJUi00MzYzNzM5Mjc5MTgM
PSA,"December 07, 2022",Marriage Certificate,PARTIALLY SUCCESSFUL,To change my status as soon as possible.,11/24/2022 - 12/07/2022,https://www.foi.gov.ph/requests/aglzfmVmb2ktcGhyHQsSB0NvbnRlbnQiEFBTQS0yNzk5NDA4NDg1NDgM
GCG,"December 07, 2022",Updated List of GOCCs/GFIs that has an ATI CPCS,ACCEPTED,For Information of everyone,11/01/2022 - 11/30/2022,https://www.foi.gov.ph/requests/aglzfmVmb2ktcGhyHQsSB0NvbnRlbnQiEEdDRy0wMDA3Njc1ODczNzgM
DepEd,"December 07, 2022",Issuance on allowing a private school to have a full face to face Intramurals,PENDING,For Information of everyone,11/01/2022 - 11/30/2022,https://www.foi.gov.ph/requests/aglzfmVmb2ktcGhyHwsSB0NvbnRlbnQiEkRlcEVkLTAwMTU3Mjk3MzAzMgw
BIR,"December 07, 2022",Solo Parent Requirements ( ITR ),SUCCESSFUL,Solo Parent Application,12/07/2022 - 12/07/2022,https://www.foi.gov.ph/requests/aglzfmVmb2ktcGhyHQsSB0NvbnRlbnQiEEJJUi03NDA3MDU2MDcwNzQM
PGO-PIO,"December 07, 2022",vaccination card,PENDING,copy,12/21/2021 - 01/06/2022,https://www.foi.gov.ph/requests/aglzfmVmb2ktcGhyIQsSB0NvbnRlbnQiFFBHTy1QSU8tNjM5MzI3NTUzMDAzDA
DOH,"December 07, 2022","Hydroxychloroquine is effective, and consistently so when provided early, for COVID-19:",PROCESSING,Data Management,01/01/2020 - 12/07/2022,https://www.foi.gov.ph/requests/aglzfmVmb2ktcGhyHQsSB0NvbnRlbnQiEERPSC0wNDc1MzY5MDg4MDIM
PSA,"December 07, 2022",Senior Citizens Living Alone in Baguio City,PENDING,Undergraduate Architectural Thesis Research,01/01/2018 - 12/07/2022,https://www.foi.gov.ph/requests/aglzfmVmb2ktcGhyHQsSB0NvbnRlbnQiEFBTQS01ODYxMzIyODczNzkM
DSWD,"December 07, 2022",Indigent Senior Citizens in Baguio City,PENDING,Undergraduate Architectural Thesis Research,01/01/2018 - 12/07/2022,https://www.foi.gov.ph/requests/aglzfmVmb2ktcGhyHgsSB0NvbnRlbnQiEURTV0QtMzIwODI1ODY4Mjg3DA
DSWD,"December 07, 2022",Data Request on Home for the Aged,PENDING,Undergraduate Architectural Thesis Research,01/01/2018 - 12/07/2022,https://www.foi.gov.ph/requests/aglzfmVmb2ktcGhyHgsSB0NvbnRlbnQiEURTV0QtNTUxMzgxMjMzNDQ5DA
NHCP,"December 07, 2022",Frequency of tourist coming back to cultural/historical buildings in the Philippines,PENDING,Architectural Thesis,12/07/2018 - 12/07/2022,https://www.foi.gov.ph/requests/aglzfmVmb2ktcGhyHgsSB0NvbnRlbnQiEU5IQ1AtMDg1Mzg5MjkwNDczDA
PNP,"December 07, 2022",CAR AND CICL IN QUEZON PROVINCE,ACCEPTED,thesis,01/01/2019 - 11/29/2022,https://www.foi.gov.ph/requests/aglzfmVmb2ktcGhyHQsSB0NvbnRlbnQiEFBOUC0xMDIwNTQ5ODA5MzIM
DepEd,"December 07, 2022",DepEd Junior High School Form 137,SUCCESSFUL,Applying for Admission,12/07/2022 - 12/07/2022,https://www.foi.gov.ph/requests/aglzfmVmb2ktcGhyHwsSB0NvbnRlbnQiEkRlcEVkLTQxOTk5OTYxMTUxNAw
BUCOR,"December 07, 2022",Lydia seva,PENDING,For clarification,06/08/2001 - 06/08/2022,https://www.foi.gov.ph/requests/aglzfmVmb2ktcGhyHwsSB0NvbnRlbnQiEkJVQ09SLTEyMDc3MjU3NjkzNAw
NBI,"December 07, 2022",Online Scammer,PENDING,Track them and give them lecture,12/06/2022 - 12/06/2022,https://www.foi.gov.ph/requests/aglzfmVmb2ktcGhyHQsSB0NvbnRlbnQiEE5CSS02Nzk2MDUzMTg3NzEM
PILWD,"December 07, 2022","Panoypoyan, Bula Camsur Water supply map",DENIED,Architectural thesis,12/01/2022 - 12/02/2022,https://www.foi.gov.ph/requests/aglzfmVmb2ktcGhyHwsSB0NvbnRlbnQiElBJTFdELTI3MTE3NTI5MTQyMQw
DOE,"December 07, 2022",Power supply map/Line of Service of Casureco III,PENDING,Architectural thesis,12/01/2022 - 12/02/2022,https://www.foi.gov.ph/requests/aglzfmVmb2ktcGhyHQsSB0NvbnRlbnQiEERPRS02MDU2OTQxMjcwNTAM
ITDI,"December 07, 2022",etv,SUCCESSFUL,research,01/01/2000 - 12/06/2022,https://www.foi.gov.ph/requests/aglzfmVmb2ktcGhyHgsSB0NvbnRlbnQiEUlUREktMTY1Mjg4ODA4MDc3DA
BATOWD,"December 07, 2022",Water supply Map/Line of Service Map,PENDING,Thesis,12/01/2022 - 12/02/2022,https://www.foi.gov.ph/requests/aglzfmVmb2ktcGhyIAsSB0NvbnRlbnQiE0JBVE9XRC01OTQ4NjgyOTYwMjkM
MMDA,"December 07, 2022",Average Annual Daily Traffic of Roxas Blvd and Diosdado Macapagal Blvd.,PARTIALLY SUCCESSFUL,Undergraduate Research,12/07/2022 - 12/07/2022,https://www.foi.gov.ph/requests/aglzfmVmb2ktcGhyHgsSB0NvbnRlbnQiEU1NREEtMjg4MTgwNzI0Mjk5DA
BIR,"December 07, 2022",Income Tax Return,SUCCESSFUL,Needed for work,01/01/2020 - 01/01/2022,https://www.foi.gov.ph/requests/aglzfmVmb2ktcGhyHQsSB0NvbnRlbnQiEEJJUi00MzYzNzM5Mjc5MTgM
PSA,"December 07, 2022",Marriage Certificate,PARTIALLY SUCCESSFUL,To change my status as soon as possible.,11/24/2022 - 12/07/2022,https://www.foi.gov.ph/requests/aglzfmVmb2ktcGhyHQsSB0NvbnRlbnQiEFBTQS0yNzk5NDA4NDg1NDgM
GCG,"December 07, 2022",Updated List of GOCCs/GFIs that has an ATI CPCS,ACCEPTED,For Information of everyone,11/01/2022 - 11/30/2022,https://www.foi.gov.ph/requests/aglzfmVmb2ktcGhyHQsSB0NvbnRlbnQiEEdDRy0wMDA3Njc1ODczNzgM
DepEd,"December 07, 2022",Issuance on allowing a private school to have a full face to face Intramurals,PENDING,For Information of everyone,11/01/2022 - 11/30/2022,https://www.foi.gov.ph/requests/aglzfmVmb2ktcGhyHwsSB0NvbnRlbnQiEkRlcEVkLTAwMTU3Mjk3MzAzMgw
BIR,"December 07, 2022",Solo Parent Requirements ( ITR ),SUCCESSFUL,Solo Parent Application,12/07/2022 - 12/07/2022,https://www.foi.gov.ph/requests/aglzfmVmb2ktcGhyHQsSB0NvbnRlbnQiEEJJUi03NDA3MDU2MDcwNzQM
PGO-PIO,"December 07, 2022",vaccination card,PENDING,copy,12/21/2021 - 01/06/2022,https://www.foi.gov.ph/requests/aglzfmVmb2ktcGhyIQsSB0NvbnRlbnQiFFBHTy1QSU8tNjM5MzI3NTUzMDAzDA
DOH,"December 07, 2022","Hydroxychloroquine is effective, and consistently so when provided early, for COVID-19:",PROCESSING,Data Management,01/01/2020 - 12/07/2022,https://www.foi.gov.ph/requests/aglzfmVmb2ktcGhyHQsSB0NvbnRlbnQiEERPSC0wNDc1MzY5MDg4MDIM
PSA,"December 07, 2022",Senior Citizens Living Alone in Baguio City,PENDING,Undergraduate Architectural Thesis Research,01/01/2018 - 12/07/2022,https://www.foi.gov.ph/requests/aglzfmVmb2ktcGhyHQsSB0NvbnRlbnQiEFBTQS01ODYxMzIyODczNzkM
DSWD,"December 07, 2022",Indigent Senior Citizens in Baguio City,PENDING,Undergraduate Architectural Thesis Research,01/01/2018 - 12/07/2022,https://www.foi.gov.ph/requests/aglzfmVmb2ktcGhyHgsSB0NvbnRlbnQiEURTV0QtMzIwODI1ODY4Mjg3DA
DSWD,"December 07, 2022",Data Request on Home for the Aged,PENDING,Undergraduate Architectural Thesis Research,01/01/2018 - 12/07/2022,https://www.foi.gov.ph/requests/aglzfmVmb2ktcGhyHgsSB0NvbnRlbnQiEURTV0QtNTUxMzgxMjMzNDQ5DA
NHCP,"December 07, 2022",Frequency of tourist coming back to cultural/historical buildings in the Philippines,PENDING,Architectural Thesis,12/07/2018 - 12/07/2022,https://www.foi.gov.ph/requests/aglzfmVmb2ktcGhyHgsSB0NvbnRlbnQiEU5IQ1AtMDg1Mzg5MjkwNDczDA
PNP,"December 07, 2022",CAR AND CICL IN QUEZON PROVINCE,ACCEPTED,thesis,01/01/2019 - 11/29/2022,https://www.foi.gov.ph/requests/aglzfmVmb2ktcGhyHQsSB0NvbnRlbnQiEFBOUC0xMDIwNTQ5ODA5MzIM
DepEd,"December 07, 2022",DepEd Junior High School Form 137,SUCCESSFUL,Applying for Admission,12/07/2022 - 12/07/2022,https://www.foi.gov.ph/requests/aglzfmVmb2ktcGhyHwsSB0NvbnRlbnQiEkRlcEVkLTQxOTk5OTYxMTUxNAw
BUCOR,"December 07, 2022",Lydia seva,PENDING,For clarification,06/08/2001 - 06/08/2022,https://www.foi.gov.ph/requests/aglzfmVmb2ktcGhyHwsSB0NvbnRlbnQiEkJVQ09SLTEyMDc3MjU3NjkzNAw
BLGF,"December 07, 2022",Computation of Fees for Business and Mayor's Permit,PENDING,Research and Payment of Taxes,01/01/2022 - 12/07/2022,https://www.foi.gov.ph/requests/aglzfmVmb2ktcGhyHgsSB0NvbnRlbnQiEUJMR0YtNTQ5MDQ2NjQ3MzU4DA
OSG,"December 07, 2022",Civil Case No. 2017-0-05FC,PENDING,PSA Update and Passport Renewal,06/06/2017 - 12/07/2022,https://www.foi.gov.ph/requests/aglzfmVmb2ktcGhyHQsSB0NvbnRlbnQiEE9TRy0zNjYyMjM3MDUyOTcM
DOJ,"December 07, 2022",Civil Case No. 2017-0-05FC,PENDING,PSA Update and Passport Renewal,06/07/2017 - 12/07/2022,https://www.foi.gov.ph/requests/aglzfmVmb2ktcGhyHQsSB0NvbnRlbnQiEERPSi0yOTkzMzQzMzg1NjEM
MMDA,"December 07, 2022",Average Annual Daily Traffic of Roxas Blvd and Diosdado Macapagal Blvd.,PARTIALLY SUCCESSFUL,Undergraduate Research,12/07/2022 - 12/07/2022,https://www.foi.gov.ph/requests/aglzfmVmb2ktcGhyHgsSB0NvbnRlbnQiEU1NREEtMzMyMjI1NzUzNzgzDA
DPWH,"December 07, 2022",Average Annual Daily Traffic of Roxas Blvd and Diosdado Macapagal Blvd.,REFERRED,Undergraduate Research,12/07/2022 - 12/07/2022,https://www.foi.gov.ph/requests/aglzfmVmb2ktcGhyHgsSB0NvbnRlbnQiEURQV0gtOTUyNDc2MzYwMTQxDA
PNP,"December 06, 2022",Youth Detention Homes,ACCEPTED,Research Purposes,12/06/2022 - 12/06/2022,https://www.foi.gov.ph/requests/aglzfmVmb2ktcGhyHQsSB0NvbnRlbnQiEFBOUC02NDM5MDIyNjM2MTgM
JJWC,"December 06, 2022",Youth Detention Homes,PENDING,Research Purposes,12/06/2022 - 12/06/2022,https://www.foi.gov.ph/requests/aglzfmVmb2ktcGhyHgsSB0NvbnRlbnQiEUpKV0MtNTUzNzgyNDAwNTQ4DA
DOH,"December 06, 2022",Vaxcert missing dose,SUCCESSFUL,Vaxcert for travel,10/28/2021 - 02/24/2022,https://www.foi.gov.ph/requests/aglzfmVmb2ktcGhyHQsSB0NvbnRlbnQiEERPSC00NzE1MDEwMTk4NTYM
NTC,"December 06, 2022",Locate and Block lost/stolen cellphone,PARTIALLY SUCCESSFUL,Online classes,11/18/2022 - 11/21/2022,https://www.foi.gov.ph/requests/aglzfmVmb2ktcGhyHQsSB0NvbnRlbnQiEE5UQy02ODgxMjM2OTYxODIM
PSA,"December 06, 2022","The number of Dealers of Agricultural Products in Regions III, IV-A, and IV-B from year 2020 to 2022",PENDING,Research Purposes,01/01/2020 - 11/30/2022,https://www.foi.gov.ph/requests/aglzfmVmb2ktcGhyHQsSB0NvbnRlbnQiEFBTQS0wMzIwMTQzMjIyODMM
DepEd,"December 06, 2022",NCAE RESULT - COPY,SUCCESSFUL,NCAE Results is needed as a requirement for my Nursing - Scholarship application,12/06/2022 - 12/06/2022,https://www.foi.gov.ph/requests/aglzfmVmb2ktcGhyHwsSB0NvbnRlbnQiEkRlcEVkLTgyNzM5NzIzNDg0MAw
IC,"December 06, 2022",VUL and TRAD Licensure Exam Results,ACCEPTED,For coding,02/15/2019 - 02/15/2019,https://www.foi.gov.ph/requests/aglzfmVmb2ktcGhyHAsSB0NvbnRlbnQiD0lDLTg1NDI0MTQ4NjE0MQw
LRTA,"December 06, 2022","Average Daily Passenger of each stations (Antipolo, Recto, Cubao) in LRT 2",PENDING,Research 1,01/01/2022 - 12/01/2022,https://www.foi.gov.ph/requests/aglzfmVmb2ktcGhyHgsSB0NvbnRlbnQiEUxSVEEtMjY1MDA4MTczMDIwDA
GCG,"December 06, 2022",PAGCOR CPCS UPDATE/STATUS,ACCEPTED,For information dissemination.,11/28/2022 - 12/06/2022,https://www.foi.gov.ph/requests/aglzfmVmb2ktcGhyHQsSB0NvbnRlbnQiEEdDRy0zOTIwNDE0MDM0MjkM
DBM,"December 06, 2022",NOSCA,REFERRED,To have an update about the issuance of NOSCA.,07/11/2022 - 12/06/2022,https://www.foi.gov.ph/requests/aglzfmVmb2ktcGhyHQsSB0NvbnRlbnQiEERCTS0yODcxNzMwMTQ3ODQM
DOE,"December 06, 2022",Historical Consumption of Petroleum Products per Industry per Year,ACCEPTED,Investment Proposal,01/01/2010 - Invalid date,https://www.foi.gov.ph/requests/aglzfmVmb2ktcGhyHQsSB0NvbnRlbnQiEERPRS0yOTUzOTI5MDYxNDgM
BIR,"December 06, 2022",Request for a copy of ITR,SUCCESSFUL,Car Financing,12/06/2022 - 12/06/2022,https://www.foi.gov.ph/requests/aglzfmVmb2ktcGhyHQsSB0NvbnRlbnQiEEJJUi00NjIzODYyNzczMjkM
DOTr,"December 06, 2022",number of daily bus passengers in Metro Manila,PENDING,preliminary requirement,12/06/2022 - 12/06/2022,https://www.foi.gov.ph/requests/aglzfmVmb2ktcGhyHgsSB0NvbnRlbnQiEURPVHItMzM3MjMyMjE2NTgxDA
SEC,"December 06, 2022",Fraud and misleading informations on lending app PAUTANG PESO,SUCCESSFUL,Investigation and closure of the company,11/01/2022 - 12/06/2022,https://www.foi.gov.ph/requests/aglzfmVmb2ktcGhyHQsSB0NvbnRlbnQiEFNFQy0wODYwNTU5ODQ4NzkM
PSA,"December 06, 2022",Senior Citizen Population per Region and City,SUCCESSFUL,Solely for Architectural Research,12/06/2022 - 12/06/2022,https://www.foi.gov.ph/requests/aglzfmVmb2ktcGhyHQsSB0NvbnRlbnQiEFBTQS00MDU5NDM3MDExMDIM
PSC,"December 06, 2022",Number of Philippine athletes and coaches in 2022,PENDING,for Architectural Thesis,11/01/2022 - 12/06/2022,https://www.foi.gov.ph/requests/aglzfmVmb2ktcGhyHQsSB0NvbnRlbnQiEFBTQy05MDkyODk3NzY4OTIM
DOH,"December 06, 2022",Weekly dengue infections per province from 2020-2022,PROCESSING,Research,01/01/2020 - 11/30/2022,https://www.foi.gov.ph/requests/aglzfmVmb2ktcGhyHQsSB0NvbnRlbnQiEERPSC00MDcxNjgxNzQzNjcM
DOH,"December 06, 2022",HIV Cases,PROCESSING,Research and PSA Short film,03/20/2022 - 11/30/2022,https://www.foi.gov.ph/requests/aglzfmVmb2ktcGhyHQsSB0NvbnRlbnQiEERPSC0xMTQ3Nzk0MDc5OTMM
