agency,date,title,status,purpose,period_covered,link
DPWH,"October 18, 2022",CLUP of Angeles City,DENIED,Undergraduate Thesis,01/01/2000 - 10/01/2022,https://www.foi.gov.ph/requests/aglzfmVmb2ktcGhyHgsSB0NvbnRlbnQiEURQV0gtNjU1OTkzNjQ5MTE5DA
DOT,"October 18, 2022",total tourist arrival data 2021,SUCCESSFUL,undergrad research paper,01/01/2021 - 12/31/2021,https://www.foi.gov.ph/requests/aglzfmVmb2ktcGhyHQsSB0NvbnRlbnQiEERPVC0xMTcyNDc3Mjg3MTMM
CDC,"October 18, 2022",Legal Framework and Environment Systems,SUCCESSFUL,Undergraduate Thesis,10/18/2022 - 10/18/2022,https://www.foi.gov.ph/requests/aglzfmVmb2ktcGhyHQsSB0NvbnRlbnQiEENEQy0wMTM4NjUzNTU0MDUM
CHED,"October 18, 2022",Number of enrolled students in Music Courses/Programs,ACCEPTED,Architectural Thesis,01/01/2015 - 10/17/2022,https://www.foi.gov.ph/requests/aglzfmVmb2ktcGhyHgsSB0NvbnRlbnQiEUNIRUQtMzg2NjEzODUwMzQzDA
CHED,"October 17, 2022",Number of Tertiary College Students,ACCEPTED,Thesis (architectural capstone),10/17/2022 - 10/17/2022,https://www.foi.gov.ph/requests/aglzfmVmb2ktcGhyHgsSB0NvbnRlbnQiEUNIRUQtOTk4ODMyNzU2MTM4DA
DOH,"October 17, 2022",to put my middle name on my vaxcert certification,SUCCESSFUL,to put my middle name on my vaxcert certificate,10/17/2022 - 10/17/2022,https://www.foi.gov.ph/requests/aglzfmVmb2ktcGhyHQsSB0NvbnRlbnQiEERPSC0wMjk1NTk5NTkyODAM
NHA,"October 17, 2022",murang pabahay sa ofw,ACCEPTED,murang pabahay sa ofw,10/17/2022 - 10/17/2022,https://www.foi.gov.ph/requests/aglzfmVmb2ktcGhyHQsSB0NvbnRlbnQiEE5IQS04ODQyMjg3NDc3MDIM
BULSU,"October 17, 2022",Transcript of Records,ACCEPTED,Requirements for Work,06/10/2013 - 06/20/2018,https://www.foi.gov.ph/requests/aglzfmVmb2ktcGhyHwsSB0NvbnRlbnQiEkJVTFNVLTcxNjEzMjIyNzk0NQw
MMDA,"October 17, 2022",Request for Traffic Data,ACCEPTED,Research Study,01/17/2022 - 10/17/2022,https://www.foi.gov.ph/requests/aglzfmVmb2ktcGhyHgsSB0NvbnRlbnQiEU1NREEtNjM5ODczNjE4NjI1DA
CIAC,"October 17, 2022",Old CIA building data,PENDING,Undergraduate Research,10/17/2022 - 10/17/2022,https://www.foi.gov.ph/requests/aglzfmVmb2ktcGhyHgsSB0NvbnRlbnQiEUNJQUMtMDI3NjM5MjcxODc1DA
MMDA,"October 17, 2022",Number of Accidents Involving Pedestrians 2021 Report,ACCEPTED,Research and Development,01/01/2021 - 12/31/2021,https://www.foi.gov.ph/requests/aglzfmVmb2ktcGhyHgsSB0NvbnRlbnQiEU1NREEtODQ5NDk1NTcwNDUzDA
DOH,"October 17, 2022",Scientific basis of the statement of Dr. Edsel Salvaña,PROCESSING,For research purposes,03/15/2021 - 10/17/2022,https://www.foi.gov.ph/requests/aglzfmVmb2ktcGhyHQsSB0NvbnRlbnQiEERPSC05OTYwMzgzMTA1MTAM
PSA,"October 17, 2022",Data about population,SUCCESSFUL,Undergraduate Research,10/17/2022 - 10/17/2022,https://www.foi.gov.ph/requests/aglzfmVmb2ktcGhyHQsSB0NvbnRlbnQiEFBTQS0xNjc2MzkzMjEwNjQM
CDC,"October 17, 2022",Population of Clark,DENIED,Undergraduate Research,10/17/2022 - 10/17/2022,https://www.foi.gov.ph/requests/aglzfmVmb2ktcGhyHQsSB0NvbnRlbnQiEENEQy0wNDAwMjUyMTQzOTUM
PSA,"October 17, 2022",Population of Clark,SUCCESSFUL,Undergraduate Thesis,10/17/2022 - 10/17/2022,https://www.foi.gov.ph/requests/aglzfmVmb2ktcGhyHQsSB0NvbnRlbnQiEFBTQS04OTEzNTcxMzYyODcM
BAI,"October 17, 2022",Company importing soybean by products such as soybean meal,PENDING,RESEARCH,01/01/2022 - 10/17/2022,https://www.foi.gov.ph/requests/aglzfmVmb2ktcGhyHQsSB0NvbnRlbnQiEEJBSS0zNzk3NTM0NTc2ODMM
PNP,"October 17, 2022",Analysis of Cybercrime cases in the Philippines using K-means,AWAITING CLARIFICATION,Undergraduate Thesis,01/01/2015 - 12/31/2021,https://www.foi.gov.ph/requests/aglzfmVmb2ktcGhyHQsSB0NvbnRlbnQiEFBOUC03MjYzNjI4MjQxMTQM
LTFRB,"October 17, 2022","Number of registered operating PUV in Muntinlupa, (if possible particularly in Alabang) such as jeep",PENDING,Architectural Thesis,01/01/2017 - 10/01/2022,https://www.foi.gov.ph/requests/aglzfmVmb2ktcGhyHwsSB0NvbnRlbnQiEkxURlJCLTQ4MDYxMDUwNTQ4NQw
NCIP,"October 17, 2022",site selection criteria for Iraya Mangyan community and Livelihood Center,ACCEPTED,Architectural Thesis,10/17/2022 - 10/17/2022,https://www.foi.gov.ph/requests/aglzfmVmb2ktcGhyHgsSB0NvbnRlbnQiEU5DSVAtMDIzNzc3NjM1MDM2DA
DepEd,"October 17, 2022",FOLLOW UP REQUEST LETTER FROM SDO PASIG,PENDING,FOLLOW UP,10/17/2022 - 10/17/2022,https://www.foi.gov.ph/requests/aglzfmVmb2ktcGhyHwsSB0NvbnRlbnQiEkRlcEVkLTI1MDAxNjM3OTQ4Mgw
NPO,"October 17, 2022",FAR No. 4- Monthly Report of Disbursement (MRD),PARTIALLY SUCCESSFUL,Research Purposes,01/01/2021 - 12/31/2021,https://www.foi.gov.ph/requests/aglzfmVmb2ktcGhyHQsSB0NvbnRlbnQiEE5QTy02NDg3MDE5MDkzMDUM
NPO,"October 17, 2022",FAR No. 3- Aging of Due and Demandable (ADDO),PARTIALLY SUCCESSFUL,Research Purposes,01/01/2021 - 12/31/2021,https://www.foi.gov.ph/requests/aglzfmVmb2ktcGhyHQsSB0NvbnRlbnQiEE5QTy04Nzk4NTg5NTk1MDEM
MTRCB,"October 17, 2022",FAR No. 3- Aging of Due and Demandable (ADDO),PROCESSING,Research Purposes,01/01/2021 - 12/31/2021,https://www.foi.gov.ph/requests/aglzfmVmb2ktcGhyHwsSB0NvbnRlbnQiEk1UUkNCLTAyNDM5ODkyOTU2Mww
LMB,"October 17, 2022",Taytay Comprehensive Land Use Map,ACCEPTED,For Undergraduate Architectural thesis,10/17/2022 - 10/17/2022,https://www.foi.gov.ph/requests/aglzfmVmb2ktcGhyIQsSB0NvbnRlbnQiFERFTlJMTUItMzc0MzIwMzI1MjgxDA
DICT,"October 17, 2022",WiFi Hotspots in Metro Manila,PENDING,"Studies, Research and Development",10/17/2022 - 10/17/2022,https://www.foi.gov.ph/requests/aglzfmVmb2ktcGhyHgsSB0NvbnRlbnQiEURJQ1QtMDMyMTM4MDE4NzUzDA
DepEd,"October 17, 2022",Certificate of English as Medium Instruction,SUCCESSFUL,Supporting Document for International Student Application,09/14/2022 - 10/17/2022,https://www.foi.gov.ph/requests/aglzfmVmb2ktcGhyHwsSB0NvbnRlbnQiEkRlcEVkLTI2MzAzMDYxOTQ0Nww
BIR,"October 17, 2022",Income Tax Return,DENIED,The purpose of my request is for my Korean Visa Application.,01/03/2022 - 10/17/2022,https://www.foi.gov.ph/requests/aglzfmVmb2ktcGhyHQsSB0NvbnRlbnQiEEJJUi0zMTg5NTM5NDczNDUM
DepEd,"October 17, 2022",DEPED NAT Result of Davao city,AWAITING CLARIFICATION,Research Study,01/01/2018 - 12/31/2019,https://www.foi.gov.ph/requests/aglzfmVmb2ktcGhyHwsSB0NvbnRlbnQiEkRlcEVkLTI2MDc5ODc2MTkwOQw
DepEd,"October 17, 2022",Paranaque City School statistic,PENDING,Research,10/17/2022 - 10/17/2022,https://www.foi.gov.ph/requests/aglzfmVmb2ktcGhyHwsSB0NvbnRlbnQiEkRlcEVkLTY5MTcxNDE5ODk1OAw
DepEd,"October 17, 2022",School Statistics for Paranaque City,AWAITING CLARIFICATION,Research,10/17/2022 - 10/17/2022,https://www.foi.gov.ph/requests/aglzfmVmb2ktcGhyHwsSB0NvbnRlbnQiEkRlcEVkLTcyNzA3MDQ1MDA5Ngw
NCDA,"October 17, 2022",Population of children with ADHD in cavite,SUCCESSFUL,Research reference,10/17/2022 - 10/17/2022,https://www.foi.gov.ph/requests/aglzfmVmb2ktcGhyHgsSB0NvbnRlbnQiEU5DREEtNzA0ODY2NDc4MTg3DA
DOH,"October 17, 2022",vaxcert,SUCCESSFUL,requesting vaxcert.for travel purpose,12/17/2021 - 01/06/2022,https://www.foi.gov.ph/requests/aglzfmVmb2ktcGhyHQsSB0NvbnRlbnQiEERPSC04OTUzMzEyMjM5MDkM
DOH,"October 17, 2022","Number reported depression cases in CALABARZON, METRO MANILA AND CENTRAL LUZON from 2021 to present",PROCESSING,architectural thesis,10/17/2022 - 10/17/2022,https://www.foi.gov.ph/requests/aglzfmVmb2ktcGhyHQsSB0NvbnRlbnQiEERPSC0yMjk3NzE4NDE3NzcM
DOH,"October 17, 2022",vaxcert/travel purpose,SUCCESSFUL,requesting vaxcert.for my unfound vaccinatiin card.,12/17/2021 - 01/06/2022,https://www.foi.gov.ph/requests/aglzfmVmb2ktcGhyHQsSB0NvbnRlbnQiEERPSC00NDg2MjE5MzUzMjgM
DOH,"October 17, 2022",Wrong Birthdate on my Vaccination Card,SUCCESSFUL,VISA Application,10/17/2022 - 10/17/2022,https://www.foi.gov.ph/requests/aglzfmVmb2ktcGhyHQsSB0NvbnRlbnQiEERPSC05MTEzMzgzMjk4OTgM
DPWH,"October 17, 2022",Philippine Traffic data 2021 - 2022,AWAITING CLARIFICATION,Research and Development for business establishment,01/01/2021 - 10/17/2022,https://www.foi.gov.ph/requests/aglzfmVmb2ktcGhyHgsSB0NvbnRlbnQiEURQV0gtNzAwMzkzMDE0NzY2DA
DOH,"October 17, 2022",List of qualified illnesses to avail PWD ID in the Philippines,PROCESSING,Personal/Reference purposes,09/17/2022 - 10/17/2022,https://www.foi.gov.ph/requests/aglzfmVmb2ktcGhyHQsSB0NvbnRlbnQiEERPSC0yODM0MDk0MDE1NjcM
CHED,"October 17, 2022",Higher Education Statistics for Academic Year 2022-2023,ACCEPTED,Feasibility Study,08/15/2022 - 10/17/2022,https://www.foi.gov.ph/requests/aglzfmVmb2ktcGhyHgsSB0NvbnRlbnQiEUNIRUQtNTc2NDQ3MDI2MTcyDA
NTC,"October 17, 2022",My mom’s hacker who scammed so many friends and family,REFERRED,For filing of formal complaint to police,10/16/2022 - 10/17/2022,https://www.foi.gov.ph/requests/aglzfmVmb2ktcGhyHQsSB0NvbnRlbnQiEE5UQy02NjU2NDQ2NDk1NDEM
DTI,"October 17, 2022",Number of Local Markets in Tondo,DENIED,For Research and Development,01/01/2012 - 10/17/2022,https://www.foi.gov.ph/requests/aglzfmVmb2ktcGhyHQsSB0NvbnRlbnQiEERUSS0xNDgyMTI1Mzc0NjkM
DepEd,"October 17, 2022",Basic Education Statistics for School Year 20122-2023 in Quezon Province,PROCESSING,Feasibility Study,08/22/2022 - 10/17/2022,https://www.foi.gov.ph/requests/aglzfmVmb2ktcGhyHwsSB0NvbnRlbnQiEkRlcEVkLTk4ODQ4NjU3MTM2OAw
DOH,"October 17, 2022",Tarlac and region 3 mental health illness statistic,PROCESSING,For architectural thesis,01/01/2021 - 01/01/2022,https://www.foi.gov.ph/requests/aglzfmVmb2ktcGhyHQsSB0NvbnRlbnQiEERPSC01OTY2OTU0MDcwNjEM
MMDA,"October 17, 2022",Annual Average Daily Traffic (AADT) 2019-2021,SUCCESSFUL,Studies; Research and Analysis,01/01/2019 - 12/31/2021,https://www.foi.gov.ph/requests/aglzfmVmb2ktcGhyHgsSB0NvbnRlbnQiEU1NREEtMzgxODAwNzM4MjQ2DA
PSA,"October 17, 2022","Economy of Brgy. Kay-Anlog , Calamba",PENDING,Research and Development,10/17/2019 - 10/17/2022,https://www.foi.gov.ph/requests/aglzfmVmb2ktcGhyHQsSB0NvbnRlbnQiEFBTQS0wMDUyMzU5NjI4OTMM
DOH,"October 17, 2022",Vaccine Certificate,SUCCESSFUL,"For vaccination profile update, may go overseas in the next few months. Thank you!",10/17/2022 - 10/17/2022,https://www.foi.gov.ph/requests/aglzfmVmb2ktcGhyHQsSB0NvbnRlbnQiEERPSC05NDY5ODY1NzIzODUM
PSA,"October 17, 2022",Population of Quezon Province 2022,SUCCESSFUL,Research and Feasibility Study,01/01/2022 - 10/17/2022,https://www.foi.gov.ph/requests/aglzfmVmb2ktcGhyHQsSB0NvbnRlbnQiEFBTQS04NjY1NjU2Mjc3OTgM
PNP,"October 17, 2022",Crime Incidences in First District of Quezon from 2018 to 2022,PROCESSING,Research purposes,01/01/2018 - 08/31/2022,https://www.foi.gov.ph/requests/aglzfmVmb2ktcGhyHQsSB0NvbnRlbnQiEFBOUC0xNDg4NjA1MzExOTAM
DOTr,"October 17, 2022",Inquiries for research on the viability of modifying traditional jeepneys for the modernization prog,PENDING,Research and development,06/01/2017 - 10/17/2022,https://www.foi.gov.ph/requests/aglzfmVmb2ktcGhyHgsSB0NvbnRlbnQiEURPVHItMDA1NDExNTIzMzM1DA
NTC,"October 17, 2022",DITO TELECOM PINAHINA ANG SIGNAL SA KAWIT,PARTIALLY SUCCESSFUL,ibalik ang malakas at maayos na signal ng dito telecom dito sa aming lugar na kawit cavite,07/09/2022 - 10/12/2022,https://www.foi.gov.ph/requests/aglzfmVmb2ktcGhyHQsSB0NvbnRlbnQiEE5UQy05NjEwNTcwMjA5NDcM
PSA,"October 17, 2022",Population of Quezon Province 2022,SUCCESSFUL,for Research and Feasibility Study,01/01/2022 - 10/01/2022,https://www.foi.gov.ph/requests/aglzfmVmb2ktcGhyHQsSB0NvbnRlbnQiEFBTQS0wNTU5MTA1NTU0NDAM
DOH,"October 17, 2022","List of the healthcare facility and retreat centers in Antipolo City, Rizal",PARTIALLY SUCCESSFUL,Undergraduate Architectural Thesis,01/01/2010 - 10/17/2022,https://www.foi.gov.ph/requests/aglzfmVmb2ktcGhyHQsSB0NvbnRlbnQiEERPSC01NzU5NDI1MzYzMTYM
SRA,"October 17, 2022",Raw Sugar of the Philippines,ACCEPTED,For thesis purposes,01/01/1991 - 12/31/2021,https://www.foi.gov.ph/requests/aglzfmVmb2ktcGhyHQsSB0NvbnRlbnQiEFNSQS05Nzg4Mjc1OTU4MDAM
CAAP,"October 17, 2022",Information Regarding Daet Airport,PENDING,Feasibility Study,01/01/2018 - 10/17/2022,https://www.foi.gov.ph/requests/aglzfmVmb2ktcGhyHgsSB0NvbnRlbnQiEUNBQVAtOTIzMDY1MTA1Mzc5DA
NTC,"October 17, 2022",STOLEN PHONE REQUEST TO BLOCK,PARTIALLY SUCCESSFUL,Plss block 866400052182487 para ndi na magamit at mabenta sa ibang tao,10/08/2022 - 10/17/2022,https://www.foi.gov.ph/requests/aglzfmVmb2ktcGhyHQsSB0NvbnRlbnQiEE5UQy0yNjc1MDg1NzA1ODEM
PNP,"October 17, 2022","Request of map borders of Barangays in the Municipalities of Bagumbayan, Province of Sultan",ACCEPTED,QGIS Crime Mapping and accurate grid coordinates,10/17/2022 - 10/17/2022,https://www.foi.gov.ph/requests/aglzfmVmb2ktcGhyHQsSB0NvbnRlbnQiEFBOUC01MDc3MTQxNDkyMjAM
DA,"October 17, 2022","Crop Area and Production in Teresa, Rizal",PARTIALLY SUCCESSFUL,Undergraduate Thesis,01/01/2017 - 10/17/2022,https://www.foi.gov.ph/requests/aglzfmVmb2ktcGhyHAsSB0NvbnRlbnQiD0RBLTU4NjQ5Nzk4MDA3OAw
DOH,"October 17, 2022",Vaccination card,SUCCESSFUL,"Proof that I'm vaccinated, for hospital purposes",10/17/2022 - 10/17/2022,https://www.foi.gov.ph/requests/aglzfmVmb2ktcGhyHQsSB0NvbnRlbnQiEERPSC0yMDg4MDg4MzYwMzAM
DTI,"October 17, 2022",List of SMEs in DAVAO CITY,DENIED,RESEARCH AND DEVELOPMENT,01/01/2021 - 10/17/2022,https://www.foi.gov.ph/requests/aglzfmVmb2ktcGhyHQsSB0NvbnRlbnQiEERUSS01MjkyMzc5NzQ5NzQM
LMB,"October 17, 2022",Comprehensive Land Use plan of Agusan Del Sur,ACCEPTED,Thesis Paper,10/01/2022 - 10/17/2022,https://www.foi.gov.ph/requests/aglzfmVmb2ktcGhyIQsSB0NvbnRlbnQiFERFTlJMTUItNzc0MjQ4Mzc5NzM1DA
NAPOLCOM,"October 17, 2022",Pessobuffet,REFERRED,"Report for scammer ,harassment and cyber crime",09/29/2022 - 10/17/2022,https://www.foi.gov.ph/requests/aglzfmVmb2ktcGhyIgsSB0NvbnRlbnQiFU5BUE9MQ09NLTE1NzUxODY4Mjk4NAw
DOTr,"October 17, 2022",Drainage Plans for LRT-1 Doroteo Jose Station,DENIED,Thesis project/research implementation,01/01/2022 - 10/17/2022,https://www.foi.gov.ph/requests/aglzfmVmb2ktcGhyHgsSB0NvbnRlbnQiEURPVHItMTA1MjcyNTI3NzAwDA
PCW,"October 17, 2022",The statistic data of Sexually Abused Woman,SUCCESSFUL,Thesis,10/14/2022 - 10/14/2022,https://www.foi.gov.ph/requests/aglzfmVmb2ktcGhyHQsSB0NvbnRlbnQiEFBDVy04NjE0ODQxNDc3MDkM
BJMP,"October 17, 2022",The most recent recidivism rates in The Philippines,SUCCESSFUL,Research,10/14/2018 - 10/14/2022,https://www.foi.gov.ph/requests/aglzfmVmb2ktcGhyHgsSB0NvbnRlbnQiEUJKTVAtNzAxNzAxNzYzNDk5DA
PAGASA,"October 17, 2022",Cagayan River Basin Rainfall Data and Buntun Bride Water Level Monitoring and Stage-Discharge Curve,AWAITING CLARIFICATION,Simulation Research (Thesis),03/15/2014 - 11/12/2020,https://www.foi.gov.ph/requests/aglzfmVmb2ktcGhyIAsSB0NvbnRlbnQiE1BBR0FTQS0zNDI2NzM3OTY4ODAM
BFAR,"October 17, 2022",Supply and Value Chain of Fishery Industry in Occidental Mindoro,ACCEPTED,Research and Development,01/01/2010 - 10/17/2022,https://www.foi.gov.ph/requests/aglzfmVmb2ktcGhyHgsSB0NvbnRlbnQiEUJGQVItMjM5MTIyODI4MjU0DA
DOE,"October 17, 2022",List of Active Affiliated Renewable Energy Centers (ARECs),ACCEPTED,Research and Development,01/01/2013 - 10/17/2022,https://www.foi.gov.ph/requests/aglzfmVmb2ktcGhyHQsSB0NvbnRlbnQiEERPRS01MTU4ODE4NDQ1MDgM
PAGASA,"October 17, 2022",Rainfall Timeseries Data,AWAITING CLARIFICATION,Undergraduate Thesis Research,01/01/2002 - 12/31/2012,https://www.foi.gov.ph/requests/aglzfmVmb2ktcGhyIAsSB0NvbnRlbnQiE1BBR0FTQS00NjY2MTMxODU4MzMM
PSA,"October 17, 2022",PUF for CPH 2020 and FIES 2021,PARTIALLY SUCCESSFUL,Company Research,10/17/2022 - 10/17/2022,https://www.foi.gov.ph/requests/aglzfmVmb2ktcGhyHQsSB0NvbnRlbnQiEFBTQS0wNTM0NDI3ODU2ODgM
DSWD,"October 17, 2022",IRR OF RA NO. 11861,DENIED,Reference,10/17/2022 - 10/17/2022,https://www.foi.gov.ph/requests/aglzfmVmb2ktcGhyHgsSB0NvbnRlbnQiEURTV0QtNzkxOTQ4MzE0OTkzDA
DOH,"October 17, 2022",Statistics for children with Autism Spectrum Disorder in the Philippines,SUCCESSFUL,Research and Thesis Project,01/01/2012 - 10/17/2022,https://www.foi.gov.ph/requests/aglzfmVmb2ktcGhyHQsSB0NvbnRlbnQiEERPSC00ODgzNDAyMDQxNjQM
PPPC,"October 17, 2022",Summary of PPP Projects in the Philippines,ACCEPTED,Research and Feasibility study,01/01/2019 - 09/01/2022,https://www.foi.gov.ph/requests/aglzfmVmb2ktcGhyHgsSB0NvbnRlbnQiEVBQUEMtMDYzNDk0NjYxODQwDA
DepEd,"October 17, 2022",Certificate of Medium of Instruction,SUCCESSFUL,Employment,06/01/2004 - 03/30/2010,https://www.foi.gov.ph/requests/aglzfmVmb2ktcGhyHwsSB0NvbnRlbnQiEkRlcEVkLTEyNDgwNTYxODMzNQw
BAI,"October 17, 2022",Statistics of Stray Dogs and Cats in the Philippines,PENDING,Thesis and Research,01/01/2021 - 10/14/2022,https://www.foi.gov.ph/requests/aglzfmVmb2ktcGhyHQsSB0NvbnRlbnQiEEJBSS03Njk4NjY3ODI1NzUM
DOH,"October 17, 2022","The number of psychiatrist and psychologist in Legazpi City, Albay",PARTIALLY SUCCESSFUL,Architectural Thesis,01/01/2012 - 10/14/2022,https://www.foi.gov.ph/requests/aglzfmVmb2ktcGhyHQsSB0NvbnRlbnQiEERPSC00MTgyMTUzODUwNDcM
DOH,"October 17, 2022",CALABARZON PEDIATRIC BED ALLOTMENT,PROCESSING,Thesis,01/01/2016 - 10/17/2022,https://www.foi.gov.ph/requests/aglzfmVmb2ktcGhyHQsSB0NvbnRlbnQiEERPSC01NjE1MzI3NTc2MDMM
DSWD,"October 17, 2022",IRR OF RA NO. 11861,SUCCESSFUL,Reference,09/30/2022 - 10/17/2022,https://www.foi.gov.ph/requests/aglzfmVmb2ktcGhyHgsSB0NvbnRlbnQiEURTV0QtOTMwNDc5NDQ1MzA4DA
PSA,"October 17, 2022",Number of Households in San Jose del Monte Bulacan,PARTIALLY SUCCESSFUL,Research Purposes (thesis),01/01/2022 - 10/01/2022,https://www.foi.gov.ph/requests/aglzfmVmb2ktcGhyHQsSB0NvbnRlbnQiEFBTQS0wNjY3NjU5OTU1MzcM
DENR,"October 17, 2022",Basis of PBBM's Climate Change Data at the 77th UN General Assembly,REFERRED,Research and Development,01/01/2021 - 12/31/2021,https://www.foi.gov.ph/requests/aglzfmVmb2ktcGhyHgsSB0NvbnRlbnQiEURFTlItMTc4NDAyNzA4NTkwDA
DOTr,"October 17, 2022","Volume of Passengers using MRT, LRT, PNR and other Railway System",ACCEPTED,Academic Research,10/17/2017 - 10/17/2022,https://www.foi.gov.ph/requests/aglzfmVmb2ktcGhyHgsSB0NvbnRlbnQiEURPVHItMDQyODMwMjQ2MTI4DA
PNP,"October 17, 2022",8 Focus Crime of Davao City from September 2017 to September 2022,ACCEPTED,"Research, Thesis Paper",09/30/2017 - 09/30/2022,https://www.foi.gov.ph/requests/aglzfmVmb2ktcGhyHQsSB0NvbnRlbnQiEFBOUC0yOTE3MzA2MDIwMTYM
DOH,"October 17, 2022",Vaccination Certificate Correction,SUCCESSFUL,"For VaxCert and BOQ Yellow Card, international Travel",08/09/2021 - 09/06/2021,https://www.foi.gov.ph/requests/aglzfmVmb2ktcGhyHQsSB0NvbnRlbnQiEERPSC0yMTYwODYyMzEzOTkM
LTO,"October 17, 2022",Number of private vehicles in Quezon Province,PARTIALLY SUCCESSFUL,Feasibility Study,01/01/2022 - 10/16/2022,https://www.foi.gov.ph/requests/aglzfmVmb2ktcGhyHQsSB0NvbnRlbnQiEExUTy02MTg4MDYwNTE2MTAM
BIR,"October 17, 2022",BIR 2316,DENIED,Job Requirements,01/31/2021 - 02/28/2022,https://www.foi.gov.ph/requests/aglzfmVmb2ktcGhyHQsSB0NvbnRlbnQiEEJJUi0yNjA3NzQ5MzQyNTMM
BSWM,"October 17, 2022",types of soil,REFERRED,Thesis,10/17/2022 - 10/17/2022,https://www.foi.gov.ph/requests/aglzfmVmb2ktcGhyHgsSB0NvbnRlbnQiEUJTV00tMDE4MjUwNzg3OTIxDA
BIR,"October 17, 2022",Requesting for my TIN verification,DENIED,For Real estate,09/25/2022 - 10/14/2022,https://www.foi.gov.ph/requests/aglzfmVmb2ktcGhyHQsSB0NvbnRlbnQiEEJJUi02Nzc3NTUwMjgxMjYM
PCSO,"October 17, 2022",Financial assistance for surgery and confinement,SUCCESSFUL,Ask for help financially,10/17/2022 - 10/17/2022,https://www.foi.gov.ph/requests/aglzfmVmb2ktcGhyHgsSB0NvbnRlbnQiEVBDU08tNDUzNDM4Njg1MTc4DA
NHA,"October 17, 2022",Bem John Martinez,ACCEPTED,Renovation,10/17/2022 - 10/17/2022,https://www.foi.gov.ph/requests/aglzfmVmb2ktcGhyHQsSB0NvbnRlbnQiEE5IQS01Njk4ODAyNjU2ODUM
LTO,"October 17, 2022",The number of Motorcycle Registered in the Philippines,SUCCESSFUL,Feasibility Study,10/17/2022 - 10/17/2022,https://www.foi.gov.ph/requests/aglzfmVmb2ktcGhyHQsSB0NvbnRlbnQiEExUTy01NTMyNDczNzg5MDcM
BAI,"October 17, 2022",Statistics of Stray Dogs and Cats in the Philippines,PENDING,Undergraduate Thesis,01/01/2021 - 10/14/2022,https://www.foi.gov.ph/requests/aglzfmVmb2ktcGhyHQsSB0NvbnRlbnQiEEJBSS0zNzgxMTU5OTE4NDIM
PRC,"October 17, 2022",Mismatched Record,ACCEPTED,"To match my record, so that I can apply for the renewal of my PRC ID",10/17/2022 - 10/17/2022,https://www.foi.gov.ph/requests/aglzfmVmb2ktcGhyHQsSB0NvbnRlbnQiEFBSQy0yMzY3MTc2NDAwODkM
DPWH,"October 17, 2022",Small Sewage Treatment Plant,REFERRED,Architectural Thesis,10/17/2022 - 10/17/2022,https://www.foi.gov.ph/requests/aglzfmVmb2ktcGhyHgsSB0NvbnRlbnQiEURQV0gtOTU3NTU0NzIwMTY3DA
DENR,"October 17, 2022",Small Sewage Treatment Plant,REFERRED,Architectural Thesis,10/17/2022 - 10/17/2022,https://www.foi.gov.ph/requests/aglzfmVmb2ktcGhyHgsSB0NvbnRlbnQiEURFTlItMTIxODI0NTA4Nzc5DA
PRC,"October 17, 2022",Inquiry on the number of CPA and Non CPA in Commerce and Industry and Public Practice in Makati City,DENIED,Undergraduate Thesis,01/01/2022 - 10/17/2022,https://www.foi.gov.ph/requests/aglzfmVmb2ktcGhyHQsSB0NvbnRlbnQiEFBSQy00MDYzNDAzNjEwNDAM
DOH,"October 17, 2022",vaccine record,SUCCESSFUL,record update. very urgent,10/17/2022 - 10/17/2022,https://www.foi.gov.ph/requests/aglzfmVmb2ktcGhyHQsSB0NvbnRlbnQiEERPSC01MzM4ODU5MzU2MjYM
DENR EMB,"October 17, 2022",List of Laws governing the Planning and Building of Coal-Fired Power Plants in the Philippines,PENDING,Research and Academic Purposes,10/14/2022 - 10/14/2022,https://www.foi.gov.ph/requests/aglzfmVmb2ktcGhyIQsSB0NvbnRlbnQiFERFTlJFTUItMDEyNTUwMzk5OTU5DA
DTI,"October 17, 2022","Average Profit Margin, Asset Turnover, and Equity Multiplier in the Philippines",REFERRED,Research,12/31/2018 - 12/31/2020,https://www.foi.gov.ph/requests/aglzfmVmb2ktcGhyHQsSB0NvbnRlbnQiEERUSS04NzE5Mjk4MzA4OTMM
PFDA,"October 17, 2022","Data on Palawan's Contribution in fish landed on major fishports (Navotas, Gen San, IloIlo, lucena)",ACCEPTED,For Official Statistics in Report Presentation,01/01/2020 - 01/10/2022,https://www.foi.gov.ph/requests/aglzfmVmb2ktcGhyHgsSB0NvbnRlbnQiEVBGREEtMjA0NDk0Nzc3MzU3DA
DOJ,"October 17, 2022",a successful conviction of a successful frustrated felony from 1901 until today.,DENIED,Criminal law 1 class silliman University,01/01/1901 - 10/17/2022,https://www.foi.gov.ph/requests/aglzfmVmb2ktcGhyHQsSB0NvbnRlbnQiEERPSi03MzczNzE0MTQ2NDkM
PAO,"October 17, 2022",Statistics of a successful conviction of frustrated felony in the Philippines,PENDING,Criminal law 1 class assignment for research,01/01/1901 - 10/17/2022,https://www.foi.gov.ph/requests/aglzfmVmb2ktcGhyHQsSB0NvbnRlbnQiEFBBTy0wNDQ0MDk0MzIzNTQM
UsaP,"October 17, 2022",MARY GRACE GRANTOS,REFERRED,I want to recovered my SSS account to apply Maternity benefits for me and my child.,12/04/1997 - 12/04/1997,https://www.foi.gov.ph/requests/aglzfmVmb2ktcGhyHgsSB0NvbnRlbnQiEVVTQVAtODcwMTg1MDMwMDA1DA
DOST,"October 17, 2022",Data related to Science Museum in the Philippines,REFERRED,Undergraduate Thesis,01/01/2000 - 10/17/2022,https://www.foi.gov.ph/requests/aglzfmVmb2ktcGhyHgsSB0NvbnRlbnQiEURPU1QtNzY3MDUyMTYwMTYwDA
NAPOLCOM,"October 17, 2022",Age Waiver,ACCEPTED,Age Waiver for PNP Application,10/17/2022 - 10/17/2022,https://www.foi.gov.ph/requests/aglzfmVmb2ktcGhyIgsSB0NvbnRlbnQiFU5BUE9MQ09NLTk5ODkxNjI3OTg5OQw
DTI,"October 17, 2022","The number of youths (15-24 years old), who applied and were accepted in BPO",REFERRED,Writing and development of a data story,01/01/2017 - 10/17/2022,https://www.foi.gov.ph/requests/aglzfmVmb2ktcGhyHQsSB0NvbnRlbnQiEERUSS0zMDU5OTQ5OTE5OTQM
DOF,"October 17, 2022","Average Profit Margin, Asset Turnover, and Equity Multiplier in the Philippines",REFERRED,Research,12/31/2018 - 12/31/2020,https://www.foi.gov.ph/requests/aglzfmVmb2ktcGhyHQsSB0NvbnRlbnQiEERPRi0yMzMwNDc4MTU2NTQM
DOLE,"October 17, 2022",Latest data of Labor force in Caloocan City per Barangay including eemployment and unemployment rate,PENDING,Academic Research and Development,10/17/2015 - 08/17/2022,https://www.foi.gov.ph/requests/aglzfmVmb2ktcGhyHgsSB0NvbnRlbnQiEURPTEUtODY4MzQ3MTU5ODc5DA
PSA,"October 17, 2022",NATIONAL ID CHANGE OF DELIVERY ADDRESS,PARTIALLY SUCCESSFUL,NATIONAL ID,09/21/2021 - 10/17/2022,https://www.foi.gov.ph/requests/aglzfmVmb2ktcGhyHQsSB0NvbnRlbnQiEFBTQS0yNzM5ODYyMjEyMDYM
PCMC,"October 17, 2022",PCMC Workflow,SUCCESSFUL,Thesis Paper,01/01/2016 - 06/20/2022,https://www.foi.gov.ph/requests/aglzfmVmb2ktcGhyHgsSB0NvbnRlbnQiEVBDTUMtMDQ4ODQwNzE0NTg1DA
DepEd,"October 17, 2022",Number of Students in Taguig City,PROCESSING,Thesis (Architectural Capstone),10/17/2022 - 10/17/2022,https://www.foi.gov.ph/requests/aglzfmVmb2ktcGhyHwsSB0NvbnRlbnQiEkRlcEVkLTU3MjgyMjIxNTM3MAw
NPC,"October 17, 2022",harrassment defamation of character,PENDING,"breach of data privacy, threat, defamation of character",09/01/2022 - 10/15/2022,https://www.foi.gov.ph/requests/aglzfmVmb2ktcGhyHQsSB0NvbnRlbnQiEE5QQy01ODAyMzExNTUyMzIM
NTC,"October 17, 2022",request to locate this mobile number,PARTIALLY SUCCESSFUL,to stop this number for making stories about me.,10/17/2022 - 10/17/2022,https://www.foi.gov.ph/requests/aglzfmVmb2ktcGhyHQsSB0NvbnRlbnQiEE5UQy00NzQ3OTIxODU2NDgM
PIDS,"October 17, 2022","Raw anonymized demographic data on youths (15-24 years old), who applied and were accepted in BPO",PROCESSING,course requirements on producing a data story,01/01/2017 - 10/17/2022,https://www.foi.gov.ph/requests/aglzfmVmb2ktcGhyHgsSB0NvbnRlbnQiEVBJRFMtMDI4Mjc1ODgxMTY4DA
RTU,"October 17, 2022",NBC 404,SUCCESSFUL,For policy formulation,10/17/2022 - 10/17/2022,https://www.foi.gov.ph/requests/aglzfmVmb2ktcGhyHQsSB0NvbnRlbnQiEFJUVS0xNDA3MzkyNTM2MzkM
PAGASA,"October 17, 2022",API for Weather System Records in Davao City,AWAITING CLARIFICATION,Research and development,01/01/2017 - 10/17/2022,https://www.foi.gov.ph/requests/aglzfmVmb2ktcGhyIAsSB0NvbnRlbnQiE1BBR0FTQS05NzMyOTAyNzU5NTEM
DOH,"October 17, 2022",Mental Health Statistics in MIMAROPA Region,PROCESSING,Thesis Writing,10/17/2022 - 10/17/2022,https://www.foi.gov.ph/requests/aglzfmVmb2ktcGhyHQsSB0NvbnRlbnQiEERPSC04MDg1MzYxMzE2NjkM
PSA,"October 17, 2022","The number of MSME in Imus, Cavite",SUCCESSFUL,Research,10/14/2022 - 10/14/2022,https://www.foi.gov.ph/requests/aglzfmVmb2ktcGhyHQsSB0NvbnRlbnQiEFBTQS00MjEyMTc5MjM3NDQM
