agency,date,title,status,purpose,period_covered,link
PSA,"November 03, 2022",Statistics on abandoned and neglected children,PENDING,Research and academic purposes (architectural thesis),01/01/2020 - 11/03/2022,https://www.foi.gov.ph/requests/aglzfmVmb2ktcGhyHQsSB0NvbnRlbnQiEFBTQS03MjY1Njk5NTM2NDQM
MGB,"November 03, 2022","The Flood Hazard Map of Lagonoy, Camarines Sur",ACCEPTED,Academic Purposes,11/03/2010 - 11/03/2022,https://www.foi.gov.ph/requests/aglzfmVmb2ktcGhyHQsSB0NvbnRlbnQiEE1HQi0yNDI1ODkxNzA5OTQM
PNP,"November 03, 2022",Suspect for murder margareth rillo reported in PNP. Issuance of warrant arrest for murder complaint.,DENIED,Lifetime Permanent Banned Blacklist Order for dreaded blacklisted margareth rillo reported in PNP.,01/01/2018 - 11/03/2022,https://www.foi.gov.ph/requests/aglzfmVmb2ktcGhyHQsSB0NvbnRlbnQiEFBOUC01OTI1NjQ3MDU2MDYM
NBI,"November 03, 2022",OLA's Threat Messaging,DENIED,Search,11/03/2022 - 11/03/2022,https://www.foi.gov.ph/requests/aglzfmVmb2ktcGhyHQsSB0NvbnRlbnQiEE5CSS0zOTM4OTMxOTIxMjAM
PNP,"November 03, 2022",Suspect for murder margareth rillo reported in PNP. Issuance of warrant arrest for murder complaint.,DENIED,Lifetime Permanent Banned Blacklist Order for dreaded blacklisted margareth rillo reported in PNP.,01/01/2018 - 11/03/2022,https://www.foi.gov.ph/requests/aglzfmVmb2ktcGhyHQsSB0NvbnRlbnQiEFBOUC02ODYwNTU1MTM2NTgM
PNP,"November 03, 2022",Suspect for murder margareth rillo reported in PNP. Issuance of warrant arrest for murder complaint.,DENIED,Lifetime Permanent Banned Blacklist Order for dreaded blacklisted margareth rillo reported in PNP.,01/01/2018 - 11/03/2022,https://www.foi.gov.ph/requests/aglzfmVmb2ktcGhyHQsSB0NvbnRlbnQiEFBOUC0zOTY0NjcxMDY1NjQM
PSA,"November 03, 2022",PSA NEGATIVE RESULT,PENDING,Late registration of birth certificate,03/28/2022 - 11/03/2022,https://www.foi.gov.ph/requests/aglzfmVmb2ktcGhyHQsSB0NvbnRlbnQiEFBTQS0xMjc0OTIyMjczODEM
DTI,"November 03, 2022",List of Edible Utensils Manufacturer in the Philippines,REFERRED,Research and development,11/03/2017 - 11/03/2022,https://www.foi.gov.ph/requests/aglzfmVmb2ktcGhyHQsSB0NvbnRlbnQiEERUSS00MDI3NTM3OTgxMDQM
RTU,"November 03, 2022",The total number of Enrolled students in the CED Department in Boni Campus,PENDING,Research,08/08/2022 - 10/31/2022,https://www.foi.gov.ph/requests/aglzfmVmb2ktcGhyHQsSB0NvbnRlbnQiEFJUVS0xMTE5ODY2MTgyNzcM
PNP,"November 03, 2022",Suspect murder margareth rillo reported in PNP.,DENIED,Lifetime Permanent Banned Blacklist Order for dreaded blacklisted margareth rillo reported in PNP.,01/01/2018 - 11/03/2022,https://www.foi.gov.ph/requests/aglzfmVmb2ktcGhyHQsSB0NvbnRlbnQiEFBOUC00MDgxNTkzNzM1MjAM
BJMP,"November 03, 2022",LGBTQ population in Cavite,DENIED,Research,01/03/2020 - 11/03/2022,https://www.foi.gov.ph/requests/aglzfmVmb2ktcGhyHgsSB0NvbnRlbnQiEUJKTVAtOTg5Nzg1MjQ0MTg2DA
DOH,"November 03, 2022",LGBTQ population in Cavite,REFERRED,Research,01/03/2020 - 11/03/2022,https://www.foi.gov.ph/requests/aglzfmVmb2ktcGhyHQsSB0NvbnRlbnQiEERPSC02NTY0NDQ5MzQ0NTUM
DSWD,"November 03, 2022",LGBTQ population in Cavite,REFERRED,Research,01/01/2020 - 11/03/2022,https://www.foi.gov.ph/requests/aglzfmVmb2ktcGhyHgsSB0NvbnRlbnQiEURTV0QtMzgzNzYwODk2MzM3DA
PNP,"November 03, 2022",Suspect murder margareth rillo reported in PNP.,DENIED,Lifetime Permanent Banned Blacklist Order for dreaded blacklisted margareth rillo reported in PNP.,01/01/2018 - 11/03/2022,https://www.foi.gov.ph/requests/aglzfmVmb2ktcGhyHQsSB0NvbnRlbnQiEFBOUC04MjEwNTk1MjQ1NTEM
CHED,"November 03, 2022",Number of enrollees in State Universities and colleges and Private institutions for S.Y 2022 to 2023,ACCEPTED,Research,06/01/2022 - 11/03/2022,https://www.foi.gov.ph/requests/aglzfmVmb2ktcGhyHgsSB0NvbnRlbnQiEUNIRUQtNzQ1NTQ3Njg5NDgwDA
DTI,"November 03, 2022","The number of coffee shops in Manila City, Caloocan City, Quezon City from the year 2017-2022",DENIED,Research and development,11/03/2022 - 11/03/2022,https://www.foi.gov.ph/requests/aglzfmVmb2ktcGhyHQsSB0NvbnRlbnQiEERUSS00MjM2NjI3MDQ4ODYM
NEDA,"November 03, 2022","The number of vegetarians in Manila City, Caloocan City, Quezon City from the year 2017-2022",REFERRED,Research and development,11/03/2017 - 11/03/2022,https://www.foi.gov.ph/requests/aglzfmVmb2ktcGhyHgsSB0NvbnRlbnQiEU5FREEtODU4Nzg3NTQwNDY1DA
NBI,"November 03, 2022",Harassment and death treat by Online lending,DENIED,Harassment and death treat,11/03/2022 - 11/03/2022,https://www.foi.gov.ph/requests/aglzfmVmb2ktcGhyHQsSB0NvbnRlbnQiEE5CSS01MDg4Mzk3OTA5NDEM
DOT,"November 03, 2022",Annual Tourist Number in Quezon and the whole of CALABARZON,PARTIALLY SUCCESSFUL,For research and development use.,11/03/2022 - 11/03/2022,https://www.foi.gov.ph/requests/aglzfmVmb2ktcGhyHQsSB0NvbnRlbnQiEERPVC01NTU2NDM5ODM3NDEM
NPC,"November 03, 2022",complaining,PENDING,na sana alisin po ang mga information at personal data information ko po sa kanila,10/21/2022 - 11/03/2022,https://www.foi.gov.ph/requests/aglzfmVmb2ktcGhyHQsSB0NvbnRlbnQiEE5QQy0wNjMzNDQ3NjQ5OTEM
IC,"November 03, 2022","October 22,2022 Exam passer",SUCCESSFUL,I want to know if I passed the exam.,10/20/2022 - 10/22/2022,https://www.foi.gov.ph/requests/aglzfmVmb2ktcGhyHAsSB0NvbnRlbnQiD0lDLTExNTU5MzkyMTgwOAw
DOH,"November 03, 2022",vax cert,SUCCESSFUL,travel abroad,11/03/2022 - 11/03/2022,https://www.foi.gov.ph/requests/aglzfmVmb2ktcGhyHQsSB0NvbnRlbnQiEERPSC0zMzc5OTQ1MjM3NjkM
DOH,"November 03, 2022",Vaccination Certificate,SUCCESSFUL,Travel abroad,11/03/2022 - 11/03/2022,https://www.foi.gov.ph/requests/aglzfmVmb2ktcGhyHQsSB0NvbnRlbnQiEERPSC0xMjQxMjM2Mzc3ODcM
DA,"November 03, 2022",List of Banana Growers in the Philippines,SUCCESSFUL,Research and Development,11/03/0202 - 11/03/2022,https://www.foi.gov.ph/requests/aglzfmVmb2ktcGhyHAsSB0NvbnRlbnQiD0RBLTcwNjk0MTM0NTgxOQw
BFP,"November 03, 2022",Copy of the RA 9514 2019 Edition,PENDING,Used for reference in compliance to the Fire Code of the Philippines,11/01/2022 - 11/03/2022,https://www.foi.gov.ph/requests/aglzfmVmb2ktcGhyHQsSB0NvbnRlbnQiEEJGUC05NjM0MTgzODY5NDgM
PNP,"November 03, 2022",Suspect murder margareth rillo reported in PNP.,DENIED,Lifetime Permanent Banned Blacklist Order for dreaded blacklisted margareth rillo reported in PNP.,01/01/2018 - 11/03/2022,https://www.foi.gov.ph/requests/aglzfmVmb2ktcGhyHQsSB0NvbnRlbnQiEFBOUC02ODU2OTI0NDAzNDAM
NBI,"November 03, 2022",Lifetime Permanent Banned Blacklist Order for dreaded blacklisted margareth rillo reported in PNP.,DENIED,Lifetime Permanent Banned Blacklist Order for dreaded blacklisted margareth rillo reported in PNP.,01/01/2018 - 11/03/2022,https://www.foi.gov.ph/requests/aglzfmVmb2ktcGhyHQsSB0NvbnRlbnQiEE5CSS0wMTU0NDQ2MjY1MzcM
DepEd,"November 03, 2022",My LRN (Learner Reference Number) request,SUCCESSFUL,For OJT and employment,11/03/2022 - 11/03/2022,https://www.foi.gov.ph/requests/aglzfmVmb2ktcGhyHwsSB0NvbnRlbnQiEkRlcEVkLTQ4NDc3MzQ3MDE4MQw
BAR,"November 03, 2022",Space requirement for agricultural research center,PENDING,thesis and research project,11/03/2022 - 11/03/2022,https://www.foi.gov.ph/requests/aglzfmVmb2ktcGhyHQsSB0NvbnRlbnQiEEJBUi0zMzE0Njc4NDI5MDIM
DOH,"November 03, 2022",Annual Hospital Statistic Reports,PROCESSING,Strategic Management Paper for Masteral Class,01/01/2017 - 12/31/2019,https://www.foi.gov.ph/requests/aglzfmVmb2ktcGhyHQsSB0NvbnRlbnQiEERPSC00OTIyNTc4NTI5NzEM
SSS,"November 03, 2022",update mobile number,PENDING,online sss,11/03/2012 - 11/03/2022,https://www.foi.gov.ph/requests/aglzfmVmb2ktcGhyHQsSB0NvbnRlbnQiEFNTUy01NzEyNDAzMzI5MzIM
OMB,"November 03, 2022",Certification from Optical Media Board,DENIED,Personal,10/31/2022 - 11/03/2022,https://www.foi.gov.ph/requests/aglzfmVmb2ktcGhyHQsSB0NvbnRlbnQiEE9NQi0wNjA2ODc2NTIwNjcM
DOH,"November 03, 2022",Change my birthdate,SUCCESSFUL,Travel Abroad,11/23/2021 - 12/14/2021,https://www.foi.gov.ph/requests/aglzfmVmb2ktcGhyHQsSB0NvbnRlbnQiEERPSC05MTM5NjUyNTgyMjIM
DOT,"November 03, 2022",Tourist Statistics of Bukidnon Province,PROCESSING,"Feasibility Study, Research and Development. Educational Requirements.",01/01/2015 - 01/31/2022,https://www.foi.gov.ph/requests/aglzfmVmb2ktcGhyHQsSB0NvbnRlbnQiEERPVC0zNDc2OTc4MzA2ODYM
DTI,"November 03, 2022",Request for the Latest DTI List of Establishments (MSME),ACCEPTED,Market Research and Development,01/01/2021 - 10/30/2022,https://www.foi.gov.ph/requests/aglzfmVmb2ktcGhyHQsSB0NvbnRlbnQiEERUSS04NTU2MDA5NTY4MTgM
DOST,"November 03, 2022",The number of registered vegetarian population in Metro Manila In year 2016-2021,REFERRED,Research and development,11/02/2016 - 11/03/2021,https://www.foi.gov.ph/requests/aglzfmVmb2ktcGhyHgsSB0NvbnRlbnQiEURPU1QtMjQxNDU5NjYyOTExDA
PNP,"November 03, 2022",Suspect murder margareth rillo reported in PNP.,DENIED,Lifetime Permanent Banned Blacklist Order for dreaded blacklisted margareth rillo reported in PNP.,01/01/2018 - 11/03/2022,https://www.foi.gov.ph/requests/aglzfmVmb2ktcGhyHQsSB0NvbnRlbnQiEFBOUC0zODc1ODQ3MjI5NDUM
PSA,"November 03, 2022","The number of Coffee shops/ Cafes in Las Pias, Makati and Malabon",PENDING,Research and development,11/03/2017 - 11/03/2022,https://www.foi.gov.ph/requests/aglzfmVmb2ktcGhyHQsSB0NvbnRlbnQiEFBTQS0wNjMzNzEyMTcwNjAM
DENR,"November 03, 2022",Cadastral map of 1-B-19,ACCEPTED,For checking and verification,11/03/2022 - 11/03/2022,https://www.foi.gov.ph/requests/aglzfmVmb2ktcGhyHgsSB0NvbnRlbnQiEURFTlItMTg2MDYyNjQ4NjA2DA
PSA,"November 03, 2022","The number of vegetarians in Las Pias, Makati and Malabon",PENDING,Research and development,11/03/2017 - 11/03/2022,https://www.foi.gov.ph/requests/aglzfmVmb2ktcGhyHQsSB0NvbnRlbnQiEFBTQS05ODEwNTgzMjA2OTYM
PNP,"November 03, 2022",Suspect murder margareth rillo reported in PNP.,DENIED,Lifetime Permanent Banned Blacklist Order for dreaded blacklisted margareth rillo reported in PNP.,01/01/2018 - 11/03/2022,https://www.foi.gov.ph/requests/aglzfmVmb2ktcGhyHQsSB0NvbnRlbnQiEFBOUC0wMTcwNTMwOTc1MjcM
LRA,"November 03, 2022",Checking for CCT Details - Trees,PENDING,Purchase Unit,10/01/2022 - 10/31/2022,https://www.foi.gov.ph/requests/aglzfmVmb2ktcGhyHQsSB0NvbnRlbnQiEExSQS04MTg4MjU0OTMzNTkM
PSA,"November 03, 2022","The number of Coffee shops/ Cafe in Las Pias, Makati and Malabon",PENDING,Research and development,11/03/2017 - 11/03/2022,https://www.foi.gov.ph/requests/aglzfmVmb2ktcGhyHQsSB0NvbnRlbnQiEFBTQS04MTQ3NzgyNDcyNzcM
PSA,"November 03, 2022","The number of Coffee shops/ Cafe in Las Pias, Makati and Malabon",PENDING,Research and development,11/03/2017 - 11/03/2022,https://www.foi.gov.ph/requests/aglzfmVmb2ktcGhyHQsSB0NvbnRlbnQiEFBTQS0xMDUwNDMxODc2MDEM
PH,"November 03, 2022",Tranexamic Acid,AWAITING CLARIFICATION,Market research,01/01/2017 - 10/31/2022,https://www.foi.gov.ph/requests/aglzfmVmb2ktcGhyHAsSB0NvbnRlbnQiD1BILTM2ODIxNzc0MDQ4Mgw
DTI,"November 03, 2022",The number of Coffee shops/ cafe in Las Pias,DENIED,Research and development,11/03/2017 - 11/03/2022,https://www.foi.gov.ph/requests/aglzfmVmb2ktcGhyHQsSB0NvbnRlbnQiEERUSS05MDc3NzEzMjgwODMM
PNP,"November 03, 2022",Suspect murder margareth rillo reported in PNP.,DENIED,Lifetime Permanent Banned Blacklist Order for dreaded blacklisted margareth rillo reported in PNP.,01/01/2018 - 11/03/2022,https://www.foi.gov.ph/requests/aglzfmVmb2ktcGhyHQsSB0NvbnRlbnQiEFBOUC0xMDgwMzU0Mzg2NzgM
BIR,"November 03, 2022",Request for OM No. 20-2019,DENIED,For legal purposes in withholding tax,11/03/2022 - 11/03/2022,https://www.foi.gov.ph/requests/aglzfmVmb2ktcGhyHQsSB0NvbnRlbnQiEEJJUi0zMjg3NzQ5MzY1MTgM
DOH,"November 03, 2022",Profile of Foreign Tourists Jan - Oct 2022,REFERRED,Analysis of possible ATM transaction of foreigners in the Philippines,01/01/2022 - 09/30/2022,https://www.foi.gov.ph/requests/aglzfmVmb2ktcGhyHQsSB0NvbnRlbnQiEERPSC0xOTU3NDEzMTI2NzQM
PRC,"November 03, 2022",Licensure Examination Result Statistics from2009 to 2019,SUCCESSFUL,For research and development and for my dissertation,01/03/2009 - 12/30/2019,https://www.foi.gov.ph/requests/aglzfmVmb2ktcGhyHQsSB0NvbnRlbnQiEFBSQy01MzI2OTYwMjM3NDYM
CHED,"November 03, 2022","Original copies of Diploma, TOR and SO",AWAITING CLARIFICATION,For LET review/ exam application,01/06/1995 - 01/03/2000,https://www.foi.gov.ph/requests/aglzfmVmb2ktcGhyHgsSB0NvbnRlbnQiEUNIRUQtMzUwMTY5NDg1NTE0DA
PNP,"November 03, 2022",Suspect for murder margareth rillo reported in PNP.,DENIED,Lifetime Permanent Banned Blacklist Order for dreaded blacklisted margareth rillo reported in PNP.,01/01/2018 - 11/03/2022,https://www.foi.gov.ph/requests/aglzfmVmb2ktcGhyHQsSB0NvbnRlbnQiEFBOUC00NjQyNDQ2MTU5ODUM
NAP,"November 03, 2022",Extrajudicial Adjudication of Estate and Deed of Absolute Sale,PENDING,I intend to buy this lot but I need to verify the authenticity of this document,03/26/1980 - 03/26/1980,https://www.foi.gov.ph/requests/aglzfmVmb2ktcGhyHQsSB0NvbnRlbnQiEE5BUC0wMDc0OTI2ODQxMzQM
CDC,"November 03, 2022",Lease Contracts,ACCEPTED,Feasibility study for a new business venture.,01/01/1993 - 11/03/2022,https://www.foi.gov.ph/requests/aglzfmVmb2ktcGhyHQsSB0NvbnRlbnQiEENEQy02MzU5NTE0MTI3MzMM
DTI,"November 03, 2022",Number of coffee shop/ cafes and Vegetarian,DENIED,Research and development,01/01/2017 - 11/03/2022,https://www.foi.gov.ph/requests/aglzfmVmb2ktcGhyHQsSB0NvbnRlbnQiEERUSS05NzY4NzgzODQ5NTgM
PCAF,"November 03, 2022",List of Banana Growers in the Philippines,REFERRED,Research and Development,11/03/0202 - 11/03/2022,https://www.foi.gov.ph/requests/aglzfmVmb2ktcGhyHgsSB0NvbnRlbnQiEVBDQUYtNjc4NzgwNTUzODgyDA
SSS,"November 03, 2022",Definition and Statistics of Regularly Paying Members of SSS,PENDING,Preparation of research material,01/01/2019 - 10/31/2022,https://www.foi.gov.ph/requests/aglzfmVmb2ktcGhyHQsSB0NvbnRlbnQiEFNTUy02MDY4MDkxNTgwNTMM
NEDA,"November 03, 2022",The required number of employees/workers per 300 Million Pesos project cost of a GOCC.,PENDING,Research,11/03/2022 - 11/03/2022,https://www.foi.gov.ph/requests/aglzfmVmb2ktcGhyHgsSB0NvbnRlbnQiEU5FREEtODk3MDM5MDc5NzkxDA
DOLE,"November 03, 2022",E-CERTIFICATION (Unemployment / Involuntary Separation Benefit),SUCCESSFUL,SSS unemployment benefits,10/29/2015 - 12/31/2020,https://www.foi.gov.ph/requests/aglzfmVmb2ktcGhyHgsSB0NvbnRlbnQiEURPTEUtNzk3NzI4MTQ4MzEzDA
FNRI,"November 03, 2022",The number of registered vegetarian population in Metro Manila year 2017-2018,REFERRED,Research and development,11/02/2017 - 11/02/2022,https://www.foi.gov.ph/requests/aglzfmVmb2ktcGhyHgsSB0NvbnRlbnQiEUZOUkktOTg5OTkzMDE1MDAxDA
FNRI,"November 03, 2022",The number of registered vegetarian population in Metro manila within 2017-2022,REFERRED,Research and development,11/02/2017 - 11/02/2022,https://www.foi.gov.ph/requests/aglzfmVmb2ktcGhyHgsSB0NvbnRlbnQiEUZOUkktODU4MjM5NTExODg1DA
BUCOR,"November 03, 2022",BUCOR OPERATION MANUAL,SUCCESSFUL,CRIMINOLOGY BOARD REVIEW,11/03/2022 - 11/03/2022,https://www.foi.gov.ph/requests/aglzfmVmb2ktcGhyHwsSB0NvbnRlbnQiEkJVQ09SLTA5Nzg5MzAyNTcwOQw
PSA,"November 03, 2022",Demographics of Sitio Tarukan,PENDING,Architectural Thesis,01/01/2019 - 11/02/2022,https://www.foi.gov.ph/requests/aglzfmVmb2ktcGhyHQsSB0NvbnRlbnQiEFBTQS05NTE4MzQxMDExMjQM
DOH,"November 03, 2022",Booster Vaccine Certificate,SUCCESSFUL,For Personal Purpose,07/12/2022 - 07/12/2022,https://www.foi.gov.ph/requests/aglzfmVmb2ktcGhyHQsSB0NvbnRlbnQiEERPSC01MzkxNTEyMjA2MjAM
NEA,"November 03, 2022",NEA EQUIPMENT AND MATERIALS PRICE INDEX 2021 AND 2020,SUCCESSFUL,Research and guidelines,01/01/2020 - 12/31/2021,https://www.foi.gov.ph/requests/aglzfmVmb2ktcGhyHQsSB0NvbnRlbnQiEE5FQS0xMjI3NzI2Mzg5NzMM
DTI,"November 03, 2022",Demand ang Supply of Ethylene in the Philippines,DENIED,Plant Design for Academic Requirements.,10/30/2017 - 10/30/2022,https://www.foi.gov.ph/requests/aglzfmVmb2ktcGhyHQsSB0NvbnRlbnQiEERUSS0zNzc3MTM5NzQ5NTYM
DSWD,"November 03, 2022",The number of children who have experienced trauma as a result of parental separation.,PROCESSING,academic purposes (architectural thesis),01/01/2020 - 11/03/2022,https://www.foi.gov.ph/requests/aglzfmVmb2ktcGhyHgsSB0NvbnRlbnQiEURTV0QtNjEzODEwODI3MDkzDA
PHLPost,"November 03, 2022",List of Zip Codes in the Philippines in Excel Format,PENDING,Research and development,10/01/2022 - 11/03/2022,https://www.foi.gov.ph/requests/aglzfmVmb2ktcGhyIQsSB0NvbnRlbnQiFFBITFBvc3QtNTAxOTI2NzMxMzMzDA
PSA,"November 03, 2022","Plastic cup production and consumption in Taguig, City in year 2017-2021",PENDING,Research and development,11/03/2017 - 10/03/2021,https://www.foi.gov.ph/requests/aglzfmVmb2ktcGhyHQsSB0NvbnRlbnQiEFBTQS02MzAyMTE5NTk3MTkM
PSA,"November 03, 2022",The number of children who have experienced trauma as a result of parental separation.,PENDING,Academic purposes (architectural thesis),01/01/2020 - 11/03/2022,https://www.foi.gov.ph/requests/aglzfmVmb2ktcGhyHQsSB0NvbnRlbnQiEFBTQS01NzExOTkzODY5NTQM
DENR EMB,"November 03, 2022",Site selection criteria for a waste management facility,PENDING,Architectural thesis,11/02/2022 - 11/02/2022,https://www.foi.gov.ph/requests/aglzfmVmb2ktcGhyIQsSB0NvbnRlbnQiFERFTlJFTUItNDEzMjI5NzYxOTk2DA
PSA,"November 03, 2022",The number of children who have experienced trauma as a result of parental separation,PENDING,Academic purposes (architectural thesis),01/01/2021 - 11/03/2022,https://www.foi.gov.ph/requests/aglzfmVmb2ktcGhyHQsSB0NvbnRlbnQiEFBTQS0xMTg2NTU4NDA5MjMM
DPWH,"November 03, 2022",REQUEST DPWH RROW CLEARANCE & CERTIFICATION FOR GLOBE TELECOM POLE ERECTION ALONG PUBLIC ROAD,SUCCESSFUL,TO PROVIDE TELECOMMUNICATIONS FACILITIES AND SERVICES IN THE AREAS.,10/03/2022 - 11/03/2022,https://www.foi.gov.ph/requests/aglzfmVmb2ktcGhyHgsSB0NvbnRlbnQiEURQV0gtMDk4MTkwMDc1ODkyDA
UsaP,"November 03, 2022",Reported number of motor vehicle collisions in Pasig City,ACCEPTED,Research purposes,01/01/2020 - 11/03/2022,https://www.foi.gov.ph/requests/aglzfmVmb2ktcGhyHgsSB0NvbnRlbnQiEVVTQVAtMTMxNTU4NzQwODI0DA
NEDA,"November 03, 2022",Study on the Agglomeration Model for Mindanao Regions,PENDING,Thesis,01/03/2018 - 12/31/2018,https://www.foi.gov.ph/requests/aglzfmVmb2ktcGhyHgsSB0NvbnRlbnQiEU5FREEtNDk5MzE3NjEyOTUwDA
PSA,"November 03, 2022","The number of Librarian OFWS worlwide, ASEAN, and in Thailand.",PENDING,Research Paper,01/01/2022 - 11/03/2022,https://www.foi.gov.ph/requests/aglzfmVmb2ktcGhyHQsSB0NvbnRlbnQiEFBTQS0yMTgwMzQzOTIzNTAM
POEA,"November 03, 2022","The number of Librarian OFWS worlwide, ASEAN, and in Thailand.",PARTIALLY SUCCESSFUL,Research Paper,01/01/2022 - 11/03/2022,https://www.foi.gov.ph/requests/aglzfmVmb2ktcGhyHgsSB0NvbnRlbnQiEVBPRUEtNDE5NTAxNDEzOTY4DA
PSA,"November 03, 2022",List of Establishments (LE) 1990-2021,PENDING,Research and Development,01/01/1990 - 12/12/2021,https://www.foi.gov.ph/requests/aglzfmVmb2ktcGhyHQsSB0NvbnRlbnQiEFBTQS01Njg5MjUyMjEyMzkM
DTI,"November 03, 2022",The number of Micro-enterprises of Retail and Grocery stores in Mandaluyong City,DENIED,Thesis / Research Study,11/03/2022 - 11/03/2022,https://www.foi.gov.ph/requests/aglzfmVmb2ktcGhyHQsSB0NvbnRlbnQiEERUSS0zNTE2MDk3ODQzMzEM
PNP,"November 03, 2022",Suspect murder margareth rillo reported in PNP.,DENIED,Lifetime Permanent Banned Blacklist Order for dreaded blacklisted margareth rillo reported in PNP.,01/01/2018 - 11/03/2022,https://www.foi.gov.ph/requests/aglzfmVmb2ktcGhyHQsSB0NvbnRlbnQiEFBOUC01NTQ5MDA4NDcwMDAM
PNP,"November 03, 2022",Suspect murder margareth rillo reported in PNP.,DENIED,Lifetime Permanent Banned Blacklist Order for dreaded blacklisted margareth rillo reported in PNP.,01/01/2018 - 11/03/2022,https://www.foi.gov.ph/requests/aglzfmVmb2ktcGhyHQsSB0NvbnRlbnQiEFBOUC0wNjUxMjQxNjE4NzAM
PNAC,"November 03, 2022",Sixth HIV & AIDS Medium Term Plan 2017-2022,SUCCESSFUL,Academic Purposes,11/03/2022 - 11/03/2022,https://www.foi.gov.ph/requests/aglzfmVmb2ktcGhyHgsSB0NvbnRlbnQiEVBOQUMtMDAxODgzNDY2NjMxDA
PNP,"November 03, 2022",STATISTICS OF CHILDREN IN CONFLICT WITH THE LAW,ACCEPTED,Research,01/01/2018 - 11/03/2022,https://www.foi.gov.ph/requests/aglzfmVmb2ktcGhyHQsSB0NvbnRlbnQiEFBOUC0wNDc0ODk3NDgyNzQM
DOTr,"November 03, 2022",NORTH EAST COMMUTER RAILAY LANE,AWAITING CLARIFICATION,for thesis purposes,11/03/2022 - 11/03/2022,https://www.foi.gov.ph/requests/aglzfmVmb2ktcGhyHgsSB0NvbnRlbnQiEURPVHItODM4MzIwNjY4NTA5DA
PNR,"November 03, 2022",BALAGTAS-CABANATUAN RAILWAY ROUTE,PENDING,THESIS,11/03/2022 - 11/03/2022,https://www.foi.gov.ph/requests/aglzfmVmb2ktcGhyHQsSB0NvbnRlbnQiEFBOUi00NjM0NzUzMzMxMzEM
PNP,"November 03, 2022",The number of Robbery Cases in Quezon Police Station Nueva Vizcaya from January - October 2022,SUCCESSFUL,Research,01/01/2022 - 10/31/2022,https://www.foi.gov.ph/requests/aglzfmVmb2ktcGhyHQsSB0NvbnRlbnQiEFBOUC02MjY2Nzc2MTg2NDgM
PNP,"November 03, 2022",Suspect murder margareth rillo reported in PNP.,DENIED,Lifetime Permanent Banned Blacklist Order for dreaded blacklisted margareth rillo reported in PNP.,01/01/2018 - 11/03/2022,https://www.foi.gov.ph/requests/aglzfmVmb2ktcGhyHQsSB0NvbnRlbnQiEFBOUC0wNzI3MzExNzcxODQM
CHED,"November 03, 2022",For my Education,DENIED,Research and Development,10/03/2022 - 11/03/2022,https://www.foi.gov.ph/requests/aglzfmVmb2ktcGhyHgsSB0NvbnRlbnQiEUNIRUQtMDcwMTIzNzA0OTMyDA
NBI,"November 03, 2022",Criminal Case Verification.,DENIED,Criminal Case Verification,11/03/2012 - 11/03/2022,https://www.foi.gov.ph/requests/aglzfmVmb2ktcGhyHQsSB0NvbnRlbnQiEE5CSS02ODcwOTk1NTYzNjMM
DepEd,"November 03, 2022",High School Diploma,SUCCESSFUL,For application,06/03/1997 - 03/19/1998,https://www.foi.gov.ph/requests/aglzfmVmb2ktcGhyHwsSB0NvbnRlbnQiEkRlcEVkLTkzNDQ3NTcyOTA2NQw
PSA,"November 03, 2022",Population by age group in Cities/Municipalities in Albay Province,PENDING,The purpose of my request is for me to be able to make a Demand Analysis for my Architectural Thesis,01/01/2020 - 11/03/2022,https://www.foi.gov.ph/requests/aglzfmVmb2ktcGhyHQsSB0NvbnRlbnQiEFBTQS0xNDU2NjYwMzkxNzQM
LRA,"November 03, 2022",Follow up for Registered Land Title,PENDING,request for update and follow up,10/06/2022 - 11/03/2022,https://www.foi.gov.ph/requests/aglzfmVmb2ktcGhyHQsSB0NvbnRlbnQiEExSQS05NDY0MTc2ODg0MjYM
BIR,"November 03, 2022",SKYBLUESHOP/PARAGON DEPT SCAMMERS,DENIED,TO GET MY MONEY BACK FROM SCAMMERS,10/15/2022 - 10/17/2022,https://www.foi.gov.ph/requests/aglzfmVmb2ktcGhyHQsSB0NvbnRlbnQiEEJJUi0yMTc2MDk1NjU1ODYM
ERC,"November 03, 2022",NEA EQUIPMENT AND MATERIALS PRICE INDEX 2021 AND 2020,REFERRED,Research and guidelines,01/01/2020 - 12/31/2021,https://www.foi.gov.ph/requests/aglzfmVmb2ktcGhyHQsSB0NvbnRlbnQiEEVSQy0wMjM0MzI0MTUzNzMM
NBI,"November 03, 2022",SKYBLUESHOP/PARAGON-DEPT SCAMMER,DENIED,To get my money back from the scammers,10/15/2022 - 10/17/2022,https://www.foi.gov.ph/requests/aglzfmVmb2ktcGhyHQsSB0NvbnRlbnQiEE5CSS0xNDI0MTI0MTQ1NTMM
PSA,"November 03, 2022",Total Number of MSME in NCR by category and city,SUCCESSFUL,Research for undergrad thesis,11/02/2022 - 11/02/2022,https://www.foi.gov.ph/requests/aglzfmVmb2ktcGhyHQsSB0NvbnRlbnQiEFBTQS0xMzA4Nzc2NTM0OTgM
PSA,"November 03, 2022",Footwear data,PENDING,Undergraduate research,01/01/2018 - 11/02/2022,https://www.foi.gov.ph/requests/aglzfmVmb2ktcGhyHQsSB0NvbnRlbnQiEFBTQS00ODQzMDY5NTg3NzYM
DENR EMB,"November 03, 2022",The number of consumption of plastic cups inMetro Manila in the year 2017-2021,DENIED,Research and development,11/02/2017 - 11/03/2021,https://www.foi.gov.ph/requests/aglzfmVmb2ktcGhyIQsSB0NvbnRlbnQiFERFTlJFTUItMTQyMjgxNjc0NzIxDA
DepEd,"November 03, 2022",Site Selection Criteria for Establishing School for Autistic Children and youth,AWAITING CLARIFICATION,Architectural Thesis,11/03/2022 - 11/03/2022,https://www.foi.gov.ph/requests/aglzfmVmb2ktcGhyHwsSB0NvbnRlbnQiEkRlcEVkLTM4ODE3MDAzMDM0Ngw
MMDA,"November 03, 2022",The number of consumption of plastic cups in Metro Manila in 2017-2022,PENDING,Research and development,11/02/2017 - 11/03/2021,https://www.foi.gov.ph/requests/aglzfmVmb2ktcGhyHgsSB0NvbnRlbnQiEU1NREEtMTA4NTI5MDE2NDgyDA
DPWH,"November 03, 2022",Design Standards for Steel Girder and Truss Bridge,AWAITING CLARIFICATION,Thesis,11/03/2010 - 11/03/2022,https://www.foi.gov.ph/requests/aglzfmVmb2ktcGhyHgsSB0NvbnRlbnQiEURQV0gtMDA3NDc2MDc1OTk5DA
DILG,"November 03, 2022",List of Elected and Appointed Youth Leaders in SK in Davao City,PENDING,Thesis,01/01/2022 - 11/03/2022,https://www.foi.gov.ph/requests/aglzfmVmb2ktcGhyHgsSB0NvbnRlbnQiEURJTEctNDIzNTQ1NTgwMTcxDA
DOH,"November 03, 2022",Average number of outpatient in Quirino Memorial Medical Center,PROCESSING,Undergraduate Thesis,01/01/2015 - 12/31/2021,https://www.foi.gov.ph/requests/aglzfmVmb2ktcGhyHQsSB0NvbnRlbnQiEERPSC0wNjA3NjM5MzIyNTUM
PNP,"November 03, 2022",Suspect murder margareth rillo reported in PNP.,DENIED,Lifetime Permanent Banned Blacklist Order for dreaded blacklisted margareth rillo reported in PNP.,01/01/2018 - 11/03/2022,https://www.foi.gov.ph/requests/aglzfmVmb2ktcGhyHQsSB0NvbnRlbnQiEFBOUC05OTMxMzYwNzQ3MzAM
PFDA,"November 03, 2022",Name of vessel and frequency of trips in General Santos City,ACCEPTED,Research and Development,01/01/2019 - 01/01/2022,https://www.foi.gov.ph/requests/aglzfmVmb2ktcGhyHgsSB0NvbnRlbnQiEVBGREEtNDY5MzY2NjM5ODMxDA
DOH,"November 03, 2022",Vaccination Card,SUCCESSFUL,For my personal use and international flight,11/03/2022 - 11/03/2022,https://www.foi.gov.ph/requests/aglzfmVmb2ktcGhyHQsSB0NvbnRlbnQiEERPSC02OTEwNTcxMDE2MTkM
PAGASA,"November 03, 2022",RIDF for UPLB Station,AWAITING CLARIFICATION,Research and Development,01/01/2011 - 12/31/2021,https://www.foi.gov.ph/requests/aglzfmVmb2ktcGhyIAsSB0NvbnRlbnQiE1BBR0FTQS0yMDUxMTgxMDc3MzUM
NBI,"November 03, 2022","Harassment of OLA, mocca mocca, peso buffet, loan moto",DENIED,Stop the harassment and breaching the data privacy act,10/25/2022 - 11/03/2022,https://www.foi.gov.ph/requests/aglzfmVmb2ktcGhyHQsSB0NvbnRlbnQiEE5CSS02ODI0NTk0OTczODcM
DepEd,"November 03, 2022",For my Education,REFERRED,Research and Development,10/03/2022 - 11/03/2022,https://www.foi.gov.ph/requests/aglzfmVmb2ktcGhyHwsSB0NvbnRlbnQiEkRlcEVkLTgzMTMxNTcyOTY2OAw
