agency,date,title,status,purpose,period_covered,link
DICT,"October 14, 2022",Website Investigation https://skyblueshop.ph,PENDING,https://skyblueshop.ph Scam site,09/30/2022 - 10/14/2022,https://www.foi.gov.ph/requests/aglzfmVmb2ktcGhyHgsSB0NvbnRlbnQiEURJQ1QtMjEwNzg4OTYwMzQ1DA
DICT,"October 14, 2022",https://skyblueshop.ph Scam Site,PENDING,IMMEDIATE ACTION OF INVESTIGATION,10/01/2022 - 10/14/2022,https://www.foi.gov.ph/requests/aglzfmVmb2ktcGhyHgsSB0NvbnRlbnQiEURJQ1QtMDIwMzY5NTY3OTE3DA
DBM,"October 14, 2022",IRA Barangays in Dapitan City Zamboanga del Norte,ACCEPTED,For Research,01/01/2017 - 12/31/2021,https://www.foi.gov.ph/requests/aglzfmVmb2ktcGhyHQsSB0NvbnRlbnQiEERCTS01NzUyMzA2MDgyOTkM
SEC,"October 14, 2022",Audited Financial Statements of Max's Group Inc. from 2018-2021,SUCCESSFUL,Reference for Strategic Management paper,10/14/2018 - 10/14/2022,https://www.foi.gov.ph/requests/aglzfmVmb2ktcGhyHQsSB0NvbnRlbnQiEFNFQy02NjQwNjY1NTE5NzQM
DOH,"October 14, 2022",National Center for Geriatric Health Plans,PROCESSING,"For research purposes, use as reference.",09/01/2019 - 10/14/2022,https://www.foi.gov.ph/requests/aglzfmVmb2ktcGhyHQsSB0NvbnRlbnQiEERPSC0zNjAxNTk2MjA5ODgM
NBI,"October 14, 2022","Harrassment from PAUTANG PESO, an online lending app.",DENIED,Stop harassment and collecting too high interests,09/17/2022 - 10/14/2022,https://www.foi.gov.ph/requests/aglzfmVmb2ktcGhyHQsSB0NvbnRlbnQiEE5CSS01MDYwMzg4OTIzODEM
LTO,"October 14, 2022",Copy of Memo Circular 99-323,DENIED,Research,10/14/2022 - 10/14/2022,https://www.foi.gov.ph/requests/aglzfmVmb2ktcGhyHQsSB0NvbnRlbnQiEExUTy01Mzk4NDU5OTk0MjQM
NBI,"October 14, 2022",Harassment and Threats from lending app Pinoy Lend,DENIED,Report a harassment and threats,10/13/2022 - 10/14/2022,https://www.foi.gov.ph/requests/aglzfmVmb2ktcGhyHQsSB0NvbnRlbnQiEE5CSS0xNzIzMjY5NzE2NzEM
DTI,"October 14, 2022",National Logistics Master Plan,REFERRED,Architectural Thesis,01/01/2017 - 10/14/2022,https://www.foi.gov.ph/requests/aglzfmVmb2ktcGhyHQsSB0NvbnRlbnQiEERUSS00MDYyOTU2MjUxNTEM
NCDA,"October 14, 2022",Medical Rehabilitation Center for PWD's in Region 4-a,SUCCESSFUL,Architectural Thesis,10/13/2020 - 10/13/2022,https://www.foi.gov.ph/requests/aglzfmVmb2ktcGhyHgsSB0NvbnRlbnQiEU5DREEtNjEyNDczMzM0Nzk0DA
SSS,"October 14, 2022",Check the validity of my sss account,PENDING,Verify my Sss Account,04/30/2022 - 04/30/2022,https://www.foi.gov.ph/requests/aglzfmVmb2ktcGhyHQsSB0NvbnRlbnQiEFNTUy03MzE2ODU2MDM3NzUM
DOLE,"October 14, 2022",Request to change name of RECEIVER FOR DOLE-AKAP Assistance,PENDING,for financial assistance & for payment of debt,06/09/2020 - 07/14/2022,https://www.foi.gov.ph/requests/aglzfmVmb2ktcGhyHgsSB0NvbnRlbnQiEURPTEUtNzYxNTE3NDc0NTMzDA
DSWD,"October 14, 2022",The number of domestic abuse in households and child abuse in the Philippines,AWAITING CLARIFICATION,Research Thesis Proposal for Demographics purposes,10/14/2018 - 10/14/2022,https://www.foi.gov.ph/requests/aglzfmVmb2ktcGhyHgsSB0NvbnRlbnQiEURTV0QtNjcwOTc2ODU1MTkwDA
BIR,"October 14, 2022",ITR,AWAITING CLARIFICATION,For business matter,10/14/2021 - 10/14/2022,https://www.foi.gov.ph/requests/aglzfmVmb2ktcGhyHQsSB0NvbnRlbnQiEEJJUi0yNTg0NTYxMzY0MDYM
DTI,"October 14, 2022",Registered Trucking Company,REFERRED,Research,01/01/2019 - 01/01/2021,https://www.foi.gov.ph/requests/aglzfmVmb2ktcGhyHQsSB0NvbnRlbnQiEERUSS04MTYyNjMzOTk2NDEM
PSA,"October 14, 2022",Data Analysis of Housing Prices in the Philippines,PENDING,Undergraduate Thesis,01/01/2018 - 12/31/2021,https://www.foi.gov.ph/requests/aglzfmVmb2ktcGhyHQsSB0NvbnRlbnQiEFBTQS0zNDU4NTc0OTEyODIM
NHA,"October 14, 2022",Data Analysis of Housing Prices in the Philippines,SUCCESSFUL,Undergraduate Thesis,01/01/2018 - 12/31/2021,https://www.foi.gov.ph/requests/aglzfmVmb2ktcGhyHQsSB0NvbnRlbnQiEE5IQS02ODM2NjIxOTI0NTcM
DOTr,"October 14, 2022",Inquiries for research on the viability of modifying traditional jeepneys for the modernization prog,PENDING,Research and development,06/01/2017 - 10/14/2022,https://www.foi.gov.ph/requests/aglzfmVmb2ktcGhyHgsSB0NvbnRlbnQiEURPVHItNDYwNDg0Nzk0ODI4DA
DOLE,"October 14, 2022",Akap assistance,REFERRED,To cash out,10/14/2022 - 10/14/2022,https://www.foi.gov.ph/requests/aglzfmVmb2ktcGhyHgsSB0NvbnRlbnQiEURPTEUtMjM0ODYzMTIzNjk5DA
DOT,"October 14, 2022",Farm Resort Hotel and Resort Hotel Guidelines and Plans for Academic Architecture Research purposes,PROCESSING,Architecture Research Development,10/14/2022 - 10/14/2022,https://www.foi.gov.ph/requests/aglzfmVmb2ktcGhyHQsSB0NvbnRlbnQiEERPVC02ODk0OTIyOTAxNjgM
LTO,"October 14, 2022",MEMORANDUM,SUCCESSFUL,"FOR CHECK POINTS OF LTO, PNP, HPG",08/01/2021 - 08/01/2022,https://www.foi.gov.ph/requests/aglzfmVmb2ktcGhyHQsSB0NvbnRlbnQiEExUTy0yNjExNTYzMDIxNTMM
DOH,"October 14, 2022",The total number of Breast Cancer patient in Premiere Hospital (Cabanatuan City),DENIED,Research (Special Problem),01/01/2020 - 01/01/2022,https://www.foi.gov.ph/requests/aglzfmVmb2ktcGhyHQsSB0NvbnRlbnQiEERPSC05MDAwMzI0MzQ5MDEM
PSA,"October 14, 2022",Demographics of PWD in the Philippines,PENDING,Research study,01/01/2020 - 10/14/2022,https://www.foi.gov.ph/requests/aglzfmVmb2ktcGhyHQsSB0NvbnRlbnQiEFBTQS01OTgwMTgyNDE0ODAM
BCDA,"October 14, 2022",Study on Multiplier Effect of the BBB Program,PENDING,Transparency and research,04/18/2016 - 10/14/2022,https://www.foi.gov.ph/requests/aglzfmVmb2ktcGhyHgsSB0NvbnRlbnQiEUJDREEtNTU5MTU3NDI5MTIzDA
DOF,"October 14, 2022",Share of R&D expenditures to GDP per sector and type of activity,REFERRED,Research for thesis,01/01/2000 - 12/31/2020,https://www.foi.gov.ph/requests/aglzfmVmb2ktcGhyHQsSB0NvbnRlbnQiEERPRi00MDQ4NjM5ODc1NjQM
DPWH,"October 14, 2022",Traffic Data within the vicinity of New Taytay Public Market,AWAITING CLARIFICATION,Capstone Design Project,10/14/2018 - 10/14/2022,https://www.foi.gov.ph/requests/aglzfmVmb2ktcGhyHgsSB0NvbnRlbnQiEURQV0gtNzc4NTAzMzkzNDA1DA
DOH,"October 14, 2022",Cost of Hospitalization,PROCESSING,Research,10/14/2022 - 10/14/2022,https://www.foi.gov.ph/requests/aglzfmVmb2ktcGhyHQsSB0NvbnRlbnQiEERPSC05NjEwMjM2Njc2NDEM
HLURB,"October 14, 2022","CLUP of Calamba, Laguna",PENDING,Thesis,01/25/2020 - 10/14/2022,https://www.foi.gov.ph/requests/aglzfmVmb2ktcGhyHwsSB0NvbnRlbnQiEkhMVVJCLTM5Njc3NjM2MTAyOQw
PSA,"October 14, 2022",List of Establishments (MSMEs) in Legazpi City,PENDING,Master's Thesis,01/01/2021 - 09/30/2022,https://www.foi.gov.ph/requests/aglzfmVmb2ktcGhyHQsSB0NvbnRlbnQiEFBTQS02NDYzMDgzNjkwNjkM
PAGASA,"October 14, 2022",List of typhoons and their magnitude and distribution in Surigao del Norte for the last 50 years,AWAITING CLARIFICATION,For Research purposes,10/14/2000 - 10/14/2022,https://www.foi.gov.ph/requests/aglzfmVmb2ktcGhyIAsSB0NvbnRlbnQiE1BBR0FTQS0wNzAxMzA1ODg4MTgM
DOH,"October 14, 2022","VAX CERT UPDATING, CORRECTION",SUCCESSFUL,FOR TRAVEL,07/09/2021 - 08/04/2021,https://www.foi.gov.ph/requests/aglzfmVmb2ktcGhyHQsSB0NvbnRlbnQiEERPSC0zNzYwNDg1NzM5MTAM
PAGASA,"October 14, 2022",Rainfall Intensity Duration Frequency and Return period at Surigao del Norte,SUCCESSFUL,Research/Capstone Design Project purposes,10/14/2012 - 10/14/2022,https://www.foi.gov.ph/requests/aglzfmVmb2ktcGhyIAsSB0NvbnRlbnQiE1BBR0FTQS00NjU1OTM1MzIxMTAM
DOH,"October 14, 2022",Wrong Birthdate on Vaccination Card,SUCCESSFUL,For international travel,10/13/2022 - 10/14/2022,https://www.foi.gov.ph/requests/aglzfmVmb2ktcGhyHQsSB0NvbnRlbnQiEERPSC0xNzYzODY4NjI3OTYM
PSA,"October 14, 2022","The number of road accidents in Pagsanjan, Laguna",PARTIALLY SUCCESSFUL,Research,01/01/2021 - 12/31/2021,https://www.foi.gov.ph/requests/aglzfmVmb2ktcGhyHQsSB0NvbnRlbnQiEFBTQS05OTg3NjE5NTgzNTYM
PSA,"October 14, 2022",Salt Research,PENDING,Research and development,01/01/2015 - 03/30/2022,https://www.foi.gov.ph/requests/aglzfmVmb2ktcGhyHQsSB0NvbnRlbnQiEFBTQS03NjAxNzE1NjU5MTUM
DOH,"October 14, 2022",The statistic data of Sexually Abused Woman,REFERRED,Thesis,10/14/2022 - 10/14/2022,https://www.foi.gov.ph/requests/aglzfmVmb2ktcGhyHQsSB0NvbnRlbnQiEERPSC03NDU4NzU0NzIzNzgM
BIR,"October 14, 2022",income tax return,AWAITING CLARIFICATION,to be used in Visa application,08/01/2015 - 08/30/2019,https://www.foi.gov.ph/requests/aglzfmVmb2ktcGhyHQsSB0NvbnRlbnQiEEJJUi0yNzc3NDkwMDA5MjEM
NTC,"October 14, 2022",Blocking of my phone,PARTIALLY SUCCESSFUL,Upang di na magamit ang phone ko dahil maglalaman eto mg mga mahahalagang detalye,10/14/2022 - 10/14/2022,https://www.foi.gov.ph/requests/aglzfmVmb2ktcGhyHQsSB0NvbnRlbnQiEE5UQy02NTcyNTA2MDIyNjEM
CHED,"October 14, 2022",Number of Pharmacy enrollees in Metro Manila,ACCEPTED,Research (undergraduate thesis),10/14/2022 - 10/14/2022,https://www.foi.gov.ph/requests/aglzfmVmb2ktcGhyHgsSB0NvbnRlbnQiEUNIRUQtMzQ0ODk1OTcxMzAyDA
PNP,"October 14, 2022",CICL & Children at Risk Profile per Barangay in Cebu City,PROCESSING,Undergraduate Thesis Study,01/01/2018 - 10/14/2022,https://www.foi.gov.ph/requests/aglzfmVmb2ktcGhyHQsSB0NvbnRlbnQiEFBOUC03NjY2MjU4OTA4ODcM
DPWH,"October 14, 2022",Drainage Plans for LRT-1 D. Jose Station,ACCEPTED,Research implementation/Thesis,01/01/2022 - 10/14/2022,https://www.foi.gov.ph/requests/aglzfmVmb2ktcGhyHgsSB0NvbnRlbnQiEURQV0gtMzQ3Mzk5MTgyMDIyDA
PSA,"October 14, 2022","Market Study on Tea consumption of City of San Fernando, Pampanga",PENDING,Project Feasibility Study (Market Study),01/01/2018 - 10/14/2022,https://www.foi.gov.ph/requests/aglzfmVmb2ktcGhyHQsSB0NvbnRlbnQiEFBTQS0wMjI1NDYyNDI2NDUM
NPC,"October 14, 2022","Abusive messages, data privacy",PENDING,"Data Privacy, harassment",10/14/2022 - 10/14/2022,https://www.foi.gov.ph/requests/aglzfmVmb2ktcGhyHQsSB0NvbnRlbnQiEE5QQy04NDU1NDA4MzQ4OTQM
DOH,"October 14, 2022",Vaccination Card Replacement,SUCCESSFUL,Replacement of lost vaccination card,10/14/2022 - 10/14/2022,https://www.foi.gov.ph/requests/aglzfmVmb2ktcGhyHQsSB0NvbnRlbnQiEERPSC0yNzkxNDUwNTM3MzAM
DPWH,"October 14, 2022",Geotechnical Report Conducted in Brgy. San Luis Antipolo City,AWAITING CLARIFICATION,Capstone Design,01/01/2010 - 10/14/2022,https://www.foi.gov.ph/requests/aglzfmVmb2ktcGhyHgsSB0NvbnRlbnQiEURQV0gtNTAyMzEyNzUxMTAwDA
PCA,"October 14, 2022",Coconut Wine (Lambanog) Industry in Quezon Province,PENDING,Undergraduate Thesis,01/01/2000 - 06/30/2022,https://www.foi.gov.ph/requests/aglzfmVmb2ktcGhyHQsSB0NvbnRlbnQiEFBDQS00MTM5MjkyMzczMTkM
FNRI,"October 14, 2022",Food Waste in the Philippines 2021,SUCCESSFUL,Research and Development,10/14/2021 - 10/14/2022,https://www.foi.gov.ph/requests/aglzfmVmb2ktcGhyHgsSB0NvbnRlbnQiEUZOUkktMzE4NzM1NTQwMDE4DA
PAGASA,"October 14, 2022",high tides in san isidro leyte,DENIED,Project hazard measures,10/14/2021 - 10/14/2022,https://www.foi.gov.ph/requests/aglzfmVmb2ktcGhyIAsSB0NvbnRlbnQiE1BBR0FTQS02MzU4MTQxMjQwODIM
PNP,"October 14, 2022",Data of Vehicular Accident Recorded in the Municipality of Odiongan,PROCESSING,Thesis,01/01/2019 - 10/14/2022,https://www.foi.gov.ph/requests/aglzfmVmb2ktcGhyHQsSB0NvbnRlbnQiEFBOUC01NjQ0MzY3Mjk3ODIM
DOH,"October 14, 2022",VAXCERTIFICATE,SUCCESSFUL,REQUIREMENTS FOR TRAVELING ABROAD,07/26/2021 - 10/14/2022,https://www.foi.gov.ph/requests/aglzfmVmb2ktcGhyHQsSB0NvbnRlbnQiEERPSC0xNTM1MTQ4NjE3OTcM
NCMF,"October 14, 2022",Studies on the Cultural Development of Muslim Filipinos,PENDING,Architectural Thesis for Undergraduate Studies,10/14/2022 - 10/14/2022,https://www.foi.gov.ph/requests/aglzfmVmb2ktcGhyHgsSB0NvbnRlbnQiEU5DTUYtNzIzMzAyMzIzMTU1DA
DOLE,"October 14, 2022",List of RTIPC Officers and Members,ACCEPTED,For industry partnerships and engagement in trainings,01/01/2021 - 08/31/2022,https://www.foi.gov.ph/requests/aglzfmVmb2ktcGhyHgsSB0NvbnRlbnQiEURPTEUtMDc1MzUyODIyNjgwDA
DepEd,"October 14, 2022",To be part of AlS even outside of the Philippines,SUCCESSFUL,For college,10/14/2022 - 10/14/2022,https://www.foi.gov.ph/requests/aglzfmVmb2ktcGhyHwsSB0NvbnRlbnQiEkRlcEVkLTI3MDY2MjM0NTUyMQw
OWWA,"October 14, 2022",OWWA AKAP,SUCCESSFUL,update may OWWA AKAP ASSISTANCE REG,10/13/2022 - 10/13/2022,https://www.foi.gov.ph/requests/aglzfmVmb2ktcGhyHgsSB0NvbnRlbnQiEU9XV0EtODMwMTY3OTQ5NDk1DA
DOH,"October 14, 2022",WHERE TO PURCHASE SNAKE BITE ANTI-VENOM,SUCCESSFUL,For our employees' use,10/14/2022 - 10/14/2022,https://www.foi.gov.ph/requests/aglzfmVmb2ktcGhyHQsSB0NvbnRlbnQiEERPSC0xODYxMTA5MzI2NTMM
CHED,"October 14, 2022","Number of Graduates, Enrollees and List of Schools",AWAITING CLARIFICATION,Research,01/01/2019 - 10/14/2022,https://www.foi.gov.ph/requests/aglzfmVmb2ktcGhyHgsSB0NvbnRlbnQiEUNIRUQtMTU1MTY2Njc2MjAxDA
DOH,"October 14, 2022","name, contact number and email address of the HEALTH OFFICE HEAD of Antipolo Rizal",PARTIALLY SUCCESSFUL,R esearch and Deveopment,10/14/2022 - 10/14/2022,https://www.foi.gov.ph/requests/aglzfmVmb2ktcGhyHQsSB0NvbnRlbnQiEERPSC0wOTgwNzYyMDY2NjcM
DepEd,"October 14, 2022",National Carrer Assessment Examination,SUCCESSFUL,Enrolment,12/13/2018 - 12/18/2018,https://www.foi.gov.ph/requests/aglzfmVmb2ktcGhyHwsSB0NvbnRlbnQiEkRlcEVkLTMwNjgzMzUwOTgwMAw
DepEd,"October 14, 2022",ALS HIghschool Diploma,SUCCESSFUL,My lawyer is requesting it for residency proof for the process of my annulment.,08/01/2009 - 08/01/2010,https://www.foi.gov.ph/requests/aglzfmVmb2ktcGhyHwsSB0NvbnRlbnQiEkRlcEVkLTMxMzEzODcyNjg3Mgw
DOH,"October 14, 2022",Waiting for updated Vaxcert,SUCCESSFUL,To travel work abroad,10/10/2022 - 10/14/2022,https://www.foi.gov.ph/requests/aglzfmVmb2ktcGhyHQsSB0NvbnRlbnQiEERPSC0yMzY5MzUzNTUyNzkM
DOH,"October 14, 2022",Vaxcert update,SUCCESSFUL,For travel abroad,10/14/2022 - 10/14/2022,https://www.foi.gov.ph/requests/aglzfmVmb2ktcGhyHQsSB0NvbnRlbnQiEERPSC0wNDEzMjU3NzcyNzYM
DepEd,"October 14, 2022","Schools Imposing Comprehensive Sexuality Education (CSE) K-12 Curriculum Guide in Regions 1,7, & 11",AWAITING CLARIFICATION,For academic research,07/13/2018 - 10/14/2022,https://www.foi.gov.ph/requests/aglzfmVmb2ktcGhyHwsSB0NvbnRlbnQiEkRlcEVkLTc0ODU4ODgwNjMwMww
DSWD,"October 14, 2022",The number of foster children and foster parents,PROCESSING,For our case study in our university,01/01/2018 - 10/14/2022,https://www.foi.gov.ph/requests/aglzfmVmb2ktcGhyHgsSB0NvbnRlbnQiEURTV0QtODgwNjMxOTI4OTc4DA
PRC,"October 14, 2022",Certificate of Good Standing,SUCCESSFUL,For my Canadian Association of Medical Radiation Technologist (CAMRT) Assessment.,07/18/2014 - 10/13/2022,https://www.foi.gov.ph/requests/aglzfmVmb2ktcGhyHQsSB0NvbnRlbnQiEFBSQy0yNjY2MzQyNzc3NTIM
DBM,"October 14, 2022",Share of R&D expenditures to GDP per sector and type of activity,REFERRED,Research for thesis,01/01/2000 - 12/31/2020,https://www.foi.gov.ph/requests/aglzfmVmb2ktcGhyHQsSB0NvbnRlbnQiEERCTS0yMTI2ODc1MTcwMjgM
DepEd,"October 14, 2022",Guidelines and standards on designing an indigenous school,AWAITING CLARIFICATION,Architectural thesis project,10/14/2012 - 10/14/2022,https://www.foi.gov.ph/requests/aglzfmVmb2ktcGhyHwsSB0NvbnRlbnQiEkRlcEVkLTg0OTkxNzI1MDIxNww
DOH,"October 14, 2022",VaxCert,SUCCESSFUL,For work abroad,09/16/2022 - 10/14/2022,https://www.foi.gov.ph/requests/aglzfmVmb2ktcGhyHQsSB0NvbnRlbnQiEERPSC03MDg1OTM4MjU2MTQM
NPC,"October 14, 2022",Report and Investigation the said online lending app to stop the from sending death threats.,PENDING,I want them to stop doing this because this traumatizing and giving us pressure.,08/26/2022 - 10/13/2022,https://www.foi.gov.ph/requests/aglzfmVmb2ktcGhyHQsSB0NvbnRlbnQiEE5QQy0yODQ1NjQzMTI4NDcM
BIR,"October 14, 2022",Latest Benchmark Rates for Revenue Region 15,ACCEPTED,BIR Compliance,01/01/2022 - 10/14/2022,https://www.foi.gov.ph/requests/aglzfmVmb2ktcGhyHQsSB0NvbnRlbnQiEEJJUi0yMTAyNzg3ODc3OTYM
NKTI,"October 14, 2022",Philippine Renal Disease Registry on Pediatric patients,DENIED,for feasibility study,01/01/2017 - 12/31/2021,https://www.foi.gov.ph/requests/aglzfmVmb2ktcGhyHgsSB0NvbnRlbnQiEU5LVEktMzI0NjU0NzcwNzY5DA
NBI,"October 14, 2022",Report and Investigation the said online lending app to stop the from sending death threats,DENIED,I want them to stop doing this because this traumatizing and giving us pressure.,08/26/2022 - 10/13/2022,https://www.foi.gov.ph/requests/aglzfmVmb2ktcGhyHQsSB0NvbnRlbnQiEE5CSS05Nzk0NTczMDM2NDIM
DOH,"October 14, 2022",Verification of DOH accredited medical laboratory in Batangas,PROCESSING,For work purposes,10/14/2022 - 10/14/2022,https://www.foi.gov.ph/requests/aglzfmVmb2ktcGhyHQsSB0NvbnRlbnQiEERPSC04MDg0MDE1NTA4OTUM
NBI,"October 14, 2022",Fake seller,DENIED,"want my money back, i paid 2200 for my order and after I paid they didn't reply and not delivered it",10/03/2022 - 10/14/2022,https://www.foi.gov.ph/requests/aglzfmVmb2ktcGhyHQsSB0NvbnRlbnQiEE5CSS02NzA1MjkwODg3NDMM
TESDA,"October 14, 2022",Space Requirements and Organization for TESDA school,ACCEPTED,Architectural Thesis for Undergraduate Studies,10/14/2022 - 10/14/2022,https://www.foi.gov.ph/requests/aglzfmVmb2ktcGhyHwsSB0NvbnRlbnQiElRFU0RBLTUwMjI5MzUxMjYxMQw
SBMA,"October 14, 2022","Latest CLUP, CDP, and Zoning Ordinance in Subic Bay Freeport Zone",SUCCESSFUL,Architectural Thesis Research,09/05/2017 - 09/05/2022,https://www.foi.gov.ph/requests/aglzfmVmb2ktcGhyHgsSB0NvbnRlbnQiEVNCTUEtNTg4MzcxOTA1NDA4DA
PAO,"October 14, 2022",convicted frustrated felony cases under RPC from when it started under Article 6,PENDING,For research - Criminal law 1 class,01/01/1901 - 10/13/2022,https://www.foi.gov.ph/requests/aglzfmVmb2ktcGhyHQsSB0NvbnRlbnQiEFBBTy01MDc3MTkzNzE4NTkM
CAAP,"October 14, 2022",Request for Data on Passenger Traffic and Aircraft Movement,SUCCESSFUL,School Paper,01/01/2015 - 12/30/2021,https://www.foi.gov.ph/requests/aglzfmVmb2ktcGhyHgsSB0NvbnRlbnQiEUNBQVAtODQ3NzM0MTc2NzA0DA
NTC,"October 14, 2022",Loss/stolen phone,PARTIALLY SUCCESSFUL,To block my stolen phone,02/10/2021 - 10/11/2022,https://www.foi.gov.ph/requests/aglzfmVmb2ktcGhyHQsSB0NvbnRlbnQiEE5UQy0yMTU3NDg4MzM3MTIM
NTC,"October 14, 2022",Loss/stolen phone,PARTIALLY SUCCESSFUL,To block my loss/stolen phone,02/10/2022 - 10/11/2022,https://www.foi.gov.ph/requests/aglzfmVmb2ktcGhyHQsSB0NvbnRlbnQiEE5UQy01NzA3NDg0MjQ4NDUM
PRC,"October 14, 2022",Record Mismatched,SUCCESSFUL,Oathtaking,10/14/2022 - 10/14/2022,https://www.foi.gov.ph/requests/aglzfmVmb2ktcGhyHQsSB0NvbnRlbnQiEFBSQy05NjU2ODc5MTc3MDYM
MGB,"October 14, 2022",Flood Hazard Map,DENIED,Capstone Project,10/13/2021 - 10/13/2022,https://www.foi.gov.ph/requests/aglzfmVmb2ktcGhyHQsSB0NvbnRlbnQiEE1HQi0yODU1NjMzNDkxOTMM
BJMP,"October 14, 2022",Recidivism Rates in Philippines from the year 2000 - up to Present,SUCCESSFUL,Thesis and Research,01/01/2000 - 10/01/2022,https://www.foi.gov.ph/requests/aglzfmVmb2ktcGhyHgsSB0NvbnRlbnQiEUJKTVAtNjc5NTAxMjQ5ODQ5DA
DOLE,"October 14, 2022",Certified True Copy Certificate of Upper Manula Farmer's Association,SUCCESSFUL,For Legal Purposes,07/27/2022 - 08/02/2022,https://www.foi.gov.ph/requests/aglzfmVmb2ktcGhyHgsSB0NvbnRlbnQiEURPTEUtMDE4MDQ2OTI1NjQ0DA
DOLE,"October 14, 2022",Certified True Copy Certificate of Upper Manula Farmer's Association,SUCCESSFUL,For accreditation,07/05/2022 - 07/05/2022,https://www.foi.gov.ph/requests/aglzfmVmb2ktcGhyHgsSB0NvbnRlbnQiEURPTEUtODkyMTEwNDg5OTYwDA
NBI,"October 14, 2022",GCASH unauthorized transaction - Online Scam,DENIED,for POLICE REPORT / GCASH REFUND REQUEST,10/12/2022 - 10/12/2022,https://www.foi.gov.ph/requests/aglzfmVmb2ktcGhyHQsSB0NvbnRlbnQiEE5CSS0zOTczNjQ2OTIzMzYM
DPWH,"October 14, 2022",CLUP of Cavite,DENIED,Thesis,10/13/2022 - 10/14/2022,https://www.foi.gov.ph/requests/aglzfmVmb2ktcGhyHgsSB0NvbnRlbnQiEURQV0gtMzQ2NTQ3Njk1NTI0DA
BIR,"October 14, 2022",certificate of compensation payment/tax withheld Form 2316,AWAITING CLARIFICATION,for visa processing,03/01/2005 - 10/14/2022,https://www.foi.gov.ph/requests/aglzfmVmb2ktcGhyHQsSB0NvbnRlbnQiEEJJUi04NTE5Njk5MDk2NjgM
DOH,"October 14, 2022",Hospital Pharmacies in Iloilo City,PARTIALLY SUCCESSFUL,School Research,09/01/2022 - 10/04/2022,https://www.foi.gov.ph/requests/aglzfmVmb2ktcGhyHQsSB0NvbnRlbnQiEERPSC00NDQwMzY4MDc3OTkM
LMB,"October 14, 2022","The CLUP of camiling, Tarlac",ACCEPTED,For my thesis Research,10/13/2022 - 10/14/2022,https://www.foi.gov.ph/requests/aglzfmVmb2ktcGhyIQsSB0NvbnRlbnQiFERFTlJMTUItMzU3OTYxNjUyNTY4DA
PNP,"October 14, 2022",number of incidents of vehicular accident from january 2022 to pressent,ACCEPTED,research,01/01/2022 - 10/07/2022,https://www.foi.gov.ph/requests/aglzfmVmb2ktcGhyHQsSB0NvbnRlbnQiEFBOUC04NjAwNzYwNzAwMTkM
DSWD,"October 14, 2022",FINNANCIAL ASSISTANCE,DENIED,Pang puhunan po sa pang load. Pag bili nang pangnegosyo ma pwede sa Bahay lang.,04/21/2019 - 10/14/2022,https://www.foi.gov.ph/requests/aglzfmVmb2ktcGhyHgsSB0NvbnRlbnQiEURTV0QtODExOTgzMzE0ODMxDA
AMLCS,"October 14, 2022",Provisional registration in Anti-money Laundering council,AWAITING CLARIFICATION,Use for filling requirements in BSP to grant authority to operate pawnshops.,06/01/2019 - 07/31/2019,https://www.foi.gov.ph/requests/aglzfmVmb2ktcGhyHwsSB0NvbnRlbnQiEkFNTENTLTMwNjIwNzIzMTg3MAw
DOT,"October 14, 2022",Regional Travelers from January 2019to June 2019,SUCCESSFUL,Data would be used for the ATM business analysis and expansion of the business in the Philippines,01/01/2019 - 06/30/2019,https://www.foi.gov.ph/requests/aglzfmVmb2ktcGhyHQsSB0NvbnRlbnQiEERPVC05Nzc4OTM0OTQ1NjMM
NBI,"October 14, 2022",Abusive messaging and harassment,DENIED,For abusive messaging and data Privacy,10/11/2022 - 10/14/2022,https://www.foi.gov.ph/requests/aglzfmVmb2ktcGhyHQsSB0NvbnRlbnQiEE5CSS0xNTYwODk2NTQ1ODQM
NBI,"October 14, 2022",https://skyblueshop.ph Scam Site,DENIED,Immediate action of investigation,10/01/2022 - 10/14/2022,https://www.foi.gov.ph/requests/aglzfmVmb2ktcGhyHQsSB0NvbnRlbnQiEE5CSS0yOTQ0MjA4OTIyNzIM
BLGF,"October 14, 2022",https://skyblueshop.ph Scam Site,REFERRED,IMMEDIATE ACTION OF INVESTIGATION,10/01/2022 - 10/14/2022,https://www.foi.gov.ph/requests/aglzfmVmb2ktcGhyHgsSB0NvbnRlbnQiEUJMR0YtMDc3NTAzMDE3MTQyDA
NBI,"October 14, 2022",https://skyblueshop.ph Scam Site,DENIED,Immediate Investigation,10/01/2022 - 10/14/2022,https://www.foi.gov.ph/requests/aglzfmVmb2ktcGhyHQsSB0NvbnRlbnQiEE5CSS0yODY0ODIxNDQxNjYM
BLGF,"October 14, 2022",Website Investigation https://skyblueshop.ph,REFERRED,https://skyblueshop.ph Scam site,09/30/2022 - 10/14/2022,https://www.foi.gov.ph/requests/aglzfmVmb2ktcGhyHgsSB0NvbnRlbnQiEUJMR0YtODMxOTAyNzk0MzU5DA
LMB,"October 14, 2022","MBM 33, Mauban = Request for Coordinates",ACCEPTED,Research and due diligence,10/14/2022 - 10/14/2022,https://www.foi.gov.ph/requests/aglzfmVmb2ktcGhyIQsSB0NvbnRlbnQiFERFTlJMTUItODgyODk0MDAyMDI4DA
DOLE,"October 14, 2022",Authenticated copy of Certificate of Registration of MAGLAHUS VEGETABLE COMMUNITY FARMERS ASSOCIATIO,SUCCESSFUL,For Accreditation,09/14/2022 - 09/14/2022,https://www.foi.gov.ph/requests/aglzfmVmb2ktcGhyHgsSB0NvbnRlbnQiEURPTEUtMTI0ODE4NDE4ODgxDA
DOLE,"October 14, 2022",Authenticated copy of Certificate of Registration of ALIWAGWAG IP FARMERS AND AQUA CULTURE DEVELOPME,SUCCESSFUL,For Accreditation,09/14/2022 - 09/14/2022,https://www.foi.gov.ph/requests/aglzfmVmb2ktcGhyHgsSB0NvbnRlbnQiEURPTEUtNzU5NzQ0Njc4Mzg4DA
NTC,"October 14, 2022",Blocking of my lost cellphone unit,PARTIALLY SUCCESSFUL,Blocking of my lost cellphone unit,10/14/2022 - 10/14/2022,https://www.foi.gov.ph/requests/aglzfmVmb2ktcGhyHQsSB0NvbnRlbnQiEE5UQy0zNzY3NTg4OTM3ODUM
CHED,"October 14, 2022",student population in university belt,AWAITING CLARIFICATION,Conducting a Feasibility Study,10/14/2021 - 10/14/2022,https://www.foi.gov.ph/requests/aglzfmVmb2ktcGhyHgsSB0NvbnRlbnQiEUNIRUQtNDg2NzIwNDE1MjI5DA
DA,"October 14, 2022",The list of RSBSA farmers 2022,SUCCESSFUL,To virify if my parents included the list .,09/01/2022 - 10/13/2022,https://www.foi.gov.ph/requests/aglzfmVmb2ktcGhyHAsSB0NvbnRlbnQiD0RBLTIxMTUzNjk4NTc1Nww
DOLE,"October 14, 2022",Malunas Farmers Association Documents,SUCCESSFUL,Requirements for Livelihood,09/28/2022 - 09/28/2022,https://www.foi.gov.ph/requests/aglzfmVmb2ktcGhyHgsSB0NvbnRlbnQiEURPTEUtMDUwNTc2Njc2OTc4DA
DOLE,"October 14, 2022",Minutes of SENA Conference on June and July 2022,SUCCESSFUL,support the legal proceedings,09/26/2022 - 09/26/2022,https://www.foi.gov.ph/requests/aglzfmVmb2ktcGhyHgsSB0NvbnRlbnQiEURPTEUtOTQ1NDg5MTE4MjYzDA
DOLE,"October 14, 2022","Certificate of Registration for the year 2011, Bylaws and Financial Statements",SUCCESSFUL,legal proceedings,09/12/2022 - 09/12/2022,https://www.foi.gov.ph/requests/aglzfmVmb2ktcGhyHgsSB0NvbnRlbnQiEURPTEUtOTk3NDk3MTY3MTA1DA
DOH,"October 14, 2022",Lost Vaccine Card,SUCCESSFUL,Replacement,10/14/2022 - 10/14/2022,https://www.foi.gov.ph/requests/aglzfmVmb2ktcGhyHQsSB0NvbnRlbnQiEERPSC0wOTE0NDI5MzE3NzMM
DOLE,"October 14, 2022",copy of Certificate of Registration,SUCCESSFUL,Renewal of CSO Accreditation,09/07/2022 - 09/07/2022,https://www.foi.gov.ph/requests/aglzfmVmb2ktcGhyHgsSB0NvbnRlbnQiEURPTEUtMDkxMjg4NTQ1NDIyDA
DOLE,"October 14, 2022",List of Non Governmental Organization in Digos City,SUCCESSFUL,Academic Research,09/06/2022 - 09/06/2022,https://www.foi.gov.ph/requests/aglzfmVmb2ktcGhyHgsSB0NvbnRlbnQiEURPTEUtNzg2MDQ4NDA4NTkwDA
DOLE,"October 14, 2022",Certified true copy of the Certificate of Registration of Mipangi Farmers Association.,SUCCESSFUL,Requirements for Philmech,09/29/2022 - 09/29/2022,https://www.foi.gov.ph/requests/aglzfmVmb2ktcGhyHgsSB0NvbnRlbnQiEURPTEUtMzc4NzE1MTYyMTA4DA
DOLE,"October 14, 2022",Certified true copy of the Certificate of Registration of Dumlan Association Cacao Planters.,SUCCESSFUL,Certified True Copy,09/27/2022 - 09/27/2022,https://www.foi.gov.ph/requests/aglzfmVmb2ktcGhyHgsSB0NvbnRlbnQiEURPTEUtNDE2MDU4NzY3Mjk2DA
DOLE,"October 14, 2022",Certified true copy of the Certificate of Registration of Barangay Awao Coconut Farmers Association.,SUCCESSFUL,For accreditation,09/27/2022 - 09/27/2022,https://www.foi.gov.ph/requests/aglzfmVmb2ktcGhyHgsSB0NvbnRlbnQiEURPTEUtMzk0NTc1NDU1NTY0DA
PNP,"October 14, 2022",Retirement Order,PROCESSING,For requirements,09/30/2000 - 09/30/2000,https://www.foi.gov.ph/requests/aglzfmVmb2ktcGhyHQsSB0NvbnRlbnQiEFBOUC02NzI4ODE1MzU2OTUM
