agency,date,title,status,purpose,period_covered,link
BIR,"June 22, 2023",BIR 2316,AWAITING CLARIFICATION,For Employment,09/23/2021 - 04/08/2023,https://www.foi.gov.ph/requests/aglzfmVmb2ktcGhyHQsSB0NvbnRlbnQiEEJJUi0wNDczNjI2OTU5OTUM
DPWH,"June 22, 2023",DUPA FOR BUILDING CONSTRUCTION AND ASPHALT OVERLAY,AWAITING CLARIFICATION,Reference for project cost estimate,01/03/2022 - 06/22/2023,https://www.foi.gov.ph/requests/aglzfmVmb2ktcGhyHgsSB0NvbnRlbnQiEURQV0gtNjM1ODk5MDg3OTg4DA
LTO,"June 22, 2023",Electronic Vehicle per Location per Year,PENDING,Research and Development,01/01/2012 - 12/31/2022,https://www.foi.gov.ph/requests/aglzfmVmb2ktcGhyHQsSB0NvbnRlbnQiEExUTy03ODY4OTk0MzY4MTMM
DepEd,"June 22, 2023",National Achievement Test Result 2022-2023,AWAITING CLARIFICATION,Research and Thesis,01/01/2022 - 06/22/2023,https://www.foi.gov.ph/requests/aglzfmVmb2ktcGhyHwsSB0NvbnRlbnQiEkRlcEVkLTUwOTQ0MTkwOTMxMww
LTO,"June 22, 2023",Motor Vehicle Verification - Plate Number NAR 7554,PENDING,Verification of vehicle to be purchased,01/01/2023 - 06/22/2023,https://www.foi.gov.ph/requests/aglzfmVmb2ktcGhyHQsSB0NvbnRlbnQiEExUTy00NjY0MjY3NzA0ODMM
DOLE,"June 22, 2023",DOLE 174 Exemption Certificate,ACCEPTED,DOLE Compliance,01/01/2023 - 06/22/2023,https://www.foi.gov.ph/requests/aglzfmVmb2ktcGhyHgsSB0NvbnRlbnQiEURPTEUtMTI5NDczMDkyMDgwDA
BUCOR,"June 22, 2023",Personal purpose,PENDING,update of his case,02/21/2004 - 06/21/2023,https://www.foi.gov.ph/requests/aglzfmVmb2ktcGhyHwsSB0NvbnRlbnQiEkJVQ09SLTAyODIwMjI3OTc4OAw
PRC,"June 22, 2023",Accounting Research,ACCEPTED,Accountancy Research,06/22/2023 - 06/22/2023,https://www.foi.gov.ph/requests/aglzfmVmb2ktcGhyHQsSB0NvbnRlbnQiEFBSQy01ODAxODQzMjY0ODcM
NTC,"June 22, 2023",How to file an official complaint against Converge ICT,PARTIALLY SUCCESSFUL,Formal Complaint against CONVERGE ICT.,06/22/2023 - 06/22/2023,https://www.foi.gov.ph/requests/aglzfmVmb2ktcGhyHQsSB0NvbnRlbnQiEE5UQy00MTY0MDE1NzM2ODcM
OMB,"June 22, 2023",OMB PERMIT,PENDING,Getting OMB Permit for releasing my parcel,06/22/2023 - 06/22/2023,https://www.foi.gov.ph/requests/aglzfmVmb2ktcGhyHQsSB0NvbnRlbnQiEE9NQi0yODU4NDQ5MjI1MjQM
NTC,"June 22, 2023",NTC PERMIT,PENDING,Expedite the shipment,06/22/2023 - 06/22/2023,https://www.foi.gov.ph/requests/aglzfmVmb2ktcGhyHQsSB0NvbnRlbnQiEE5UQy01NDAxMTYzMDkyMDMM
LMB,"June 22, 2023",BLLM LOCATIONS (COORDINATES ON GOOGLE MAP),ACCEPTED,RESEARCH,06/22/1980 - 06/22/2023,https://www.foi.gov.ph/requests/aglzfmVmb2ktcGhyIQsSB0NvbnRlbnQiFERFTlJMTUItOTc3MDQ5MjkzMzE4DA
DPWH,"June 22, 2023",DPWH BLUE BOOK LATEST EDITION,SUCCESSFUL,RESEARCH AND DEVELOPMENT,01/04/2021 - 06/22/2023,https://www.foi.gov.ph/requests/aglzfmVmb2ktcGhyHgsSB0NvbnRlbnQiEURQV0gtMjI4NDU5Mjk5MDQ5DA
BIR,"June 22, 2023",ITR 2316,AWAITING CLARIFICATION,Immigration Purposes,01/01/2018 - 01/01/2023,https://www.foi.gov.ph/requests/aglzfmVmb2ktcGhyHQsSB0NvbnRlbnQiEEJJUi03MjA2MjI5ODM1NzgM
DTI,"June 22, 2023",Businesses in Marinduque Island,DENIED,Study the economic potential of Marinduque island,01/01/2022 - 01/01/2023,https://www.foi.gov.ph/requests/aglzfmVmb2ktcGhyHQsSB0NvbnRlbnQiEERUSS00MDAyNzk3Mjc0MjIM
DA,"June 22, 2023",RSBSA Corn Farmers,SUCCESSFUL,Research and Development,06/22/2022 - 06/22/2023,https://www.foi.gov.ph/requests/aglzfmVmb2ktcGhyHAsSB0NvbnRlbnQiD0RBLTI5NTcxMzE0NjI4NQw
LMB,"June 22, 2023",Cadastral Maps of Municipalities in Negros Oriental,ACCEPTED,Research,05/01/2023 - 05/31/2023,https://www.foi.gov.ph/requests/aglzfmVmb2ktcGhyIQsSB0NvbnRlbnQiFERFTlJMTUItODI3ODQ2NDA2Mzc0DA
DepEd,"June 22, 2023",High School Diploma,SUCCESSFUL,Needed for my Medical Billing and Coding Program in UEI - Riverside California.,06/01/1993 - 03/01/1996,https://www.foi.gov.ph/requests/aglzfmVmb2ktcGhyHwsSB0NvbnRlbnQiEkRlcEVkLTcxNjg1NzM5ODM1MQw
NTC,"June 22, 2023",To lock serial #,PARTIALLY SUCCESSFUL,To block/Lock serial number of my phone,12/26/2020 - 06/20/2023,https://www.foi.gov.ph/requests/aglzfmVmb2ktcGhyHQsSB0NvbnRlbnQiEE5UQy02MDg4NDM0MTE3NTYM
NLP,"June 22, 2023",List of Public Libraries,DENIED,For academic research,01/01/1900 - 06/21/2023,https://www.foi.gov.ph/requests/aglzfmVmb2ktcGhyHQsSB0NvbnRlbnQiEE5MUC04MDIzNzcwMjM4MDEM
DOTr,"June 22, 2023",Financial Performance of MRT3 and Payments out of Mass Transport Subsidy (2015-2022),PENDING,To be used in the estimation of economic impact of proposed MRT3 fare hike,01/01/2015 - 06/22/2023,https://www.foi.gov.ph/requests/aglzfmVmb2ktcGhyHgsSB0NvbnRlbnQiEURPVHItMDI4ODI2MjIyNTYxDA
NBI,"June 22, 2023",NCR serial killer blacklist margareth rillo reported in NBI,PENDING,PNP Blotter Report for suspect margareth rillo employment banned permanent death in PH.,01/01/2017 - 06/22/2023,https://www.foi.gov.ph/requests/aglzfmVmb2ktcGhyHQsSB0NvbnRlbnQiEE5CSS0zMDgzMjM2MDExNzEM
DPWH,"June 22, 2023",Inquiry on the road between Molino Boulevard and Molino Road,SUCCESSFUL,Research,01/01/2020 - 06/22/2023,https://www.foi.gov.ph/requests/aglzfmVmb2ktcGhyHgsSB0NvbnRlbnQiEURQV0gtMzAyNzcwMzY2MjUyDA
PSA,"June 22, 2023",Philippines Wide Household Income Demographic Map per Province,PENDING,Site selection to place a hydroponic farm development.,01/01/2022 - 01/01/2023,https://www.foi.gov.ph/requests/aglzfmVmb2ktcGhyHQsSB0NvbnRlbnQiEFBTQS04OTYxOTA2Njg4ODcM
BIR,"June 22, 2023",Confirmation on issuance of electronic copy of 2307,SUCCESSFUL,Compliance on BIR Regulations,01/01/2023 - 02/28/2023,https://www.foi.gov.ph/requests/aglzfmVmb2ktcGhyHQsSB0NvbnRlbnQiEEJJUi02NTY2NTg4MjYyMDUM
PSA,"June 22, 2023",Lost PhilSys ID TRN,PARTIALLY SUCCESSFUL,To obtain my national ID.,06/22/2023 - 06/22/2023,https://www.foi.gov.ph/requests/aglzfmVmb2ktcGhyHQsSB0NvbnRlbnQiEFBTQS0zMDU1MTQ2MTkyMTEM
DepEd,"June 22, 2023",Enrollment Data of Elementary Learners Tagged as Gifted in the Learner Information System (LIS),AWAITING CLARIFICATION,Research,06/01/2015 - 06/22/2023,https://www.foi.gov.ph/requests/aglzfmVmb2ktcGhyHwsSB0NvbnRlbnQiEkRlcEVkLTQ3OTQ4ODQ3NzY0MAw
NTC,"June 22, 2023",LOST XIAOMI REDMI NOTE 9,PARTIALLY SUCCESSFUL,So they cannot use it anymore.,06/07/2023 - 06/22/2023,https://www.foi.gov.ph/requests/aglzfmVmb2ktcGhyHQsSB0NvbnRlbnQiEE5UQy0zNzc4OTM4ODExNjUM
DepEd,"June 22, 2023",Als Certificate diploma,SUCCESSFUL,college,06/22/2023 - 06/22/2023,https://www.foi.gov.ph/requests/aglzfmVmb2ktcGhyHwsSB0NvbnRlbnQiEkRlcEVkLTAxNzI0ODU2MDA3OQw
NTC,"June 22, 2023",Find my stolen device,PARTIALLY SUCCESSFUL,Retrieving my phone,06/20/2023 - 06/20/2023,https://www.foi.gov.ph/requests/aglzfmVmb2ktcGhyHQsSB0NvbnRlbnQiEE5UQy04OTI4MjE4MTQ3NzcM
CHED,"June 22, 2023",Aviation and Maintenance Training Schools,DENIED,Research and Development,01/01/2013 - 01/01/2023,https://www.foi.gov.ph/requests/aglzfmVmb2ktcGhyHgsSB0NvbnRlbnQiEUNIRUQtOTMxNTMwODExMDU2DA
CAAP,"June 22, 2023",Aeronautical and Maintenance Training Schools,PENDING,Research and Development,01/01/2013 - 01/01/2023,https://www.foi.gov.ph/requests/aglzfmVmb2ktcGhyHgsSB0NvbnRlbnQiEUNBQVAtMDk0ODgxMDE4MzI1DA
DOLE,"June 22, 2023",DOLE CERTIFICATE FOR SSS UNEMPLOYMENT BENEFITS,SUCCESSFUL,For my SSS Unemployment Benefit,04/28/2018 - 03/10/2023,https://www.foi.gov.ph/requests/aglzfmVmb2ktcGhyHgsSB0NvbnRlbnQiEURPTEUtNzkyNzYxMjU3Mzg5DA
DOH,"June 22, 2023",MANUAL ON TECHNICAL GUIDELINES FOR HOSPITAL PLANNING AND DESIGN_250-BED HOSPITAL (LEVEL 3),SUCCESSFUL,Thesis Data,06/11/2018 - 06/22/2023,https://www.foi.gov.ph/requests/aglzfmVmb2ktcGhyHQsSB0NvbnRlbnQiEERPSC05MDA4MDY0MTk2NDUM
BIR,"June 22, 2023",Certificate Tax Exemption,SUCCESSFUL,College Scholarship,06/01/2022 - 06/01/2023,https://www.foi.gov.ph/requests/aglzfmVmb2ktcGhyHQsSB0NvbnRlbnQiEEJJUi0zMjU2OTYxMjE0OTcM
BUKSU,"June 22, 2023",Gcash Loan,PENDING,Action,06/22/2023 - 06/22/2023,https://www.foi.gov.ph/requests/aglzfmVmb2ktcGhyHwsSB0NvbnRlbnQiEkJVS1NVLTg5NTA0MjY1MjE0MQw
PSA,"June 22, 2023","Economic Development of Biñan, Laguna",PENDING,Research (School purposes only),01/01/2021 - 06/21/2023,https://www.foi.gov.ph/requests/aglzfmVmb2ktcGhyHQsSB0NvbnRlbnQiEFBTQS04MTQ0NjgwMzU0NjEM
PSA,"June 21, 2023",Population and Demographics of Deaf People,PENDING,Research,01/01/2015 - 01/01/2020,https://www.foi.gov.ph/requests/aglzfmVmb2ktcGhyHQsSB0NvbnRlbnQiEFBTQS00MjEwNTE2MDQyMDYM
PSA,"June 21, 2023",The population of OFWs in CALABARZON,PENDING,Architectural Thesis,01/01/2021 - 12/31/2022,https://www.foi.gov.ph/requests/aglzfmVmb2ktcGhyHQsSB0NvbnRlbnQiEFBTQS05MzIxNTAwNTYyNjkM
SSS,"June 21, 2023",SSS member information,DENIED,For Verification And Requesting Loan,10/25/2015 - 06/20/2023,https://www.foi.gov.ph/requests/aglzfmVmb2ktcGhyHQsSB0NvbnRlbnQiEFNTUy01MDk1MDk3NjkyNDMM
BIR,"June 21, 2023",BIR Form No. 2316,AWAITING CLARIFICATION,One of the requirements for the skills assessment in Australian Computer Society (ASC),01/01/2019 - 12/31/2019,https://www.foi.gov.ph/requests/aglzfmVmb2ktcGhyHQsSB0NvbnRlbnQiEEJJUi0wMTUzNDE1OTA1MjEM
NTC,"June 21, 2023",My phone was stolen,PARTIALLY SUCCESSFUL,"Block my phone, my sim and block the thiefs phone to avoid accessing my accounts.",05/01/2023 - 06/21/2023,https://www.foi.gov.ph/requests/aglzfmVmb2ktcGhyHQsSB0NvbnRlbnQiEE5UQy05NDUxNDY2MDAwMTUM
PSA,"June 21, 2023","Percentage of ""Mute that can hear"" and ""Mute that cannot hear""",PENDING,Thesis purposes,01/01/2020 - 06/21/2023,https://www.foi.gov.ph/requests/aglzfmVmb2ktcGhyHQsSB0NvbnRlbnQiEFBTQS0xOTQ5OTE5ODA4MDMM
NTC,"June 21, 2023",Number of SIM card registered to my name,PARTIALLY SUCCESSFUL,For safety purposes,05/11/2023 - 06/21/2023,https://www.foi.gov.ph/requests/aglzfmVmb2ktcGhyHQsSB0NvbnRlbnQiEE5UQy0zMjM1OTczNzE2NjMM
DOH,"June 21, 2023",Request for vaccine card,SUCCESSFUL,For employment,01/03/2022 - 02/07/2022,https://www.foi.gov.ph/requests/aglzfmVmb2ktcGhyHQsSB0NvbnRlbnQiEERPSC03NzY1MDk0MDMzMjgM
NTC,"June 21, 2023",Track My Stolen Phone's Current Location,PENDING,To be able to give it back to me as I really need it,06/15/2023 - 06/15/2023,https://www.foi.gov.ph/requests/aglzfmVmb2ktcGhyHQsSB0NvbnRlbnQiEE5UQy0wNzkxMjk2NjQzNTYM
LMB,"June 21, 2023","Zoning Ordinance and Land Use Plan of Jose Panganiban, Camarines Norte",ACCEPTED,Research,01/01/2018 - 06/21/2023,https://www.foi.gov.ph/requests/aglzfmVmb2ktcGhyIQsSB0NvbnRlbnQiFERFTlJMTUItOTAwNzk2MjY3OTc4DA
LMB,"June 21, 2023",Zoning Ordinance and Land Use Plan of Lanao Del Sur (Picong),ACCEPTED,Research and Proposal,01/01/2018 - 06/21/2023,https://www.foi.gov.ph/requests/aglzfmVmb2ktcGhyIQsSB0NvbnRlbnQiFERFTlJMTUItODc4MzY2OTk0Mjc3DA
NTC,"June 21, 2023",Sms scammer,PARTIALLY SUCCESSFUL,To report it immediately to the authorities to handle the situation and to get the money back.,06/21/2023 - 06/21/2023,https://www.foi.gov.ph/requests/aglzfmVmb2ktcGhyHQsSB0NvbnRlbnQiEE5UQy02NzMyOTcwNjE5MDkM
SHFC,"June 21, 2023",Amount of payment that our HOA have transmitted,PARTIALLY SUCCESSFUL,to get updated on how much should be pay to complete the acquisition,01/01/2010 - 06/21/2023,https://www.foi.gov.ph/requests/aglzfmVmb2ktcGhyHgsSB0NvbnRlbnQiEVNIRkMtMjAxODY5MTU3MDIxDA
PSA,"June 21, 2023",Change Registered Phone Number,PENDING,Update Personal Info,06/21/2023 - 06/21/2023,https://www.foi.gov.ph/requests/aglzfmVmb2ktcGhyHQsSB0NvbnRlbnQiEFBTQS0xOTYyNzQ5NDI5OTQM
CIAP,"June 21, 2023",Construction Industry Market Research up to 2023,PENDING,School term paper,06/21/2019 - 06/21/2023,https://www.foi.gov.ph/requests/aglzfmVmb2ktcGhyHgsSB0NvbnRlbnQiEUNJQVAtNTYyNzkwNjg3ODgwDA
DOH,"June 21, 2023",Data on Palliative and Hospice Care,SUCCESSFUL,Thesis,06/21/2016 - 06/21/2023,https://www.foi.gov.ph/requests/aglzfmVmb2ktcGhyHQsSB0NvbnRlbnQiEERPSC01MTg5MDg0NjIyNTkM
PUP,"June 21, 2023","Floor plans, elevations, and sections of the PUP Mabini Museum",DENIED,Research for History of Architecture 4,10/14/1904 - 06/21/2023,https://www.foi.gov.ph/requests/aglzfmVmb2ktcGhyHQsSB0NvbnRlbnQiEFBVUC0wMzg2OTU5MTMzMjYM
BI,"June 21, 2023",Travel History,DENIED,Visa Application,01/01/2017 - 12/31/2019,https://www.foi.gov.ph/requests/aglzfmVmb2ktcGhyHAsSB0NvbnRlbnQiD0JJLTM3MDEwOTIxMDI5MAw
PSA,"June 21, 2023",Request of Phylsys Tracking Number,PENDING,To track my the process of my ID,09/27/2021 - 06/21/2023,https://www.foi.gov.ph/requests/aglzfmVmb2ktcGhyHQsSB0NvbnRlbnQiEFBTQS00MzAyNDE5NTc4MzMM
DepEd,"June 21, 2023",Pay slip,SUCCESSFUL,To be Presented for Evidence that I was paying my Loan,01/01/2010 - 04/30/2013,https://www.foi.gov.ph/requests/aglzfmVmb2ktcGhyHwsSB0NvbnRlbnQiEkRlcEVkLTM5NzgwNzQ4MTYzMAw
PSHS,"June 21, 2023",Updated list of S&T Courses for PSHS Graduates,PENDING,Research,08/01/2022 - 06/21/2023,https://www.foi.gov.ph/requests/aglzfmVmb2ktcGhyHgsSB0NvbnRlbnQiEVBTSFMtNzA1NTYxMTc3NDgzDA
NTC,"June 21, 2023",Magpapa block ng iphone dahil itoy ninakaw,PARTIALLY SUCCESSFUL,Maipa block upang hindi na mapakinabangan,05/24/2023 - 06/21/2023,https://www.foi.gov.ph/requests/aglzfmVmb2ktcGhyHQsSB0NvbnRlbnQiEE5UQy00NTA5NTY3MDIxODAM
NTC,"June 21, 2023",Block Stolen phone,PARTIALLY SUCCESSFUL,Want to block my stolen.phone.,06/20/2023 - 06/20/2023,https://www.foi.gov.ph/requests/aglzfmVmb2ktcGhyHQsSB0NvbnRlbnQiEE5UQy0zMjg5MzM2MzAwODUM
DepEd,"June 21, 2023",Certified True Copy of My Daughters Form 138 Grade 10,SUCCESSFUL,For College Admission,09/03/2021 - 06/21/2022,https://www.foi.gov.ph/requests/aglzfmVmb2ktcGhyHwsSB0NvbnRlbnQiEkRlcEVkLTkyMTE5NTc3MzI4MAw
BIR,"June 21, 2023",request for 2316 from former employer,AWAITING CLARIFICATION,for employment,08/16/2021 - 05/02/2023,https://www.foi.gov.ph/requests/aglzfmVmb2ktcGhyHQsSB0NvbnRlbnQiEEJJUi00NDI3NzUxNTc1MjkM
PSA,"June 21, 2023",Ephilid id number issue,PARTIALLY SUCCESSFUL,For my philhealth new member registration,06/21/2023 - 06/21/2023,https://www.foi.gov.ph/requests/aglzfmVmb2ktcGhyHQsSB0NvbnRlbnQiEFBTQS05OTkzNTM2MzM0OTQM
NHA,"June 21, 2023","All pertinent issuances, rules, and procedure on the award of land in Parola Tondo and Binondo",ACCEPTED,Socio Legal Research,01/01/2017 - 06/21/2023,https://www.foi.gov.ph/requests/aglzfmVmb2ktcGhyHQsSB0NvbnRlbnQiEE5IQS01MzEwMjE5NTc5NTcM
MWSS,"June 21, 2023",Daily Water Consumption of Manila City in 2020-2023,ACCEPTED,For research purposes in designing a modern revision of the Carriedo Waterworks,06/21/2020 - 06/21/2023,https://www.foi.gov.ph/requests/aglzfmVmb2ktcGhyHgsSB0NvbnRlbnQiEU1XU1MtOTAwMzIxMTY1NTAyDA
SSS,"June 21, 2023",SS log in and CRN/ SS number issue,DENIED,New Employee,06/20/2023 - 06/21/2023,https://www.foi.gov.ph/requests/aglzfmVmb2ktcGhyHQsSB0NvbnRlbnQiEFNTUy01NTM1NDgzNzAxNzIM
NTC,"June 21, 2023",Stolen phone,PARTIALLY SUCCESSFUL,Locate my phone,06/21/2023 - 06/21/2023,https://www.foi.gov.ph/requests/aglzfmVmb2ktcGhyHQsSB0NvbnRlbnQiEE5UQy05Mjk3NDI1NzY3NDcM
MMDA,"June 21, 2023",To lock serial #,REFERRED,To block/Lock serial number of my phone,12/26/2020 - 06/20/2023,https://www.foi.gov.ph/requests/aglzfmVmb2ktcGhyHgsSB0NvbnRlbnQiEU1NREEtNzUyMzA0NjIzNjcxDA
BIR,"June 21, 2023",My BIR 2316 for the year 2022 and 2021,AWAITING CLARIFICATION,For VISA application requirements,01/01/2021 - 12/31/2022,https://www.foi.gov.ph/requests/aglzfmVmb2ktcGhyHQsSB0NvbnRlbnQiEEJJUi04MjY0OTY4ODMyMzYM
DOLE,"June 21, 2023",Cancellation of OCT 100k LRC Civil case no. 3957-p filedy former Sec. Serafin Cuevas,PENDING,To know the update result of this OCT,01/14/1955 - 06/21/2023,https://www.foi.gov.ph/requests/aglzfmVmb2ktcGhyHgsSB0NvbnRlbnQiEURPTEUtNTMyODM4MTQ5ODIyDA
NTC,"June 21, 2023",Locate or Blocked the Stolen Phone,PARTIALLY SUCCESSFUL,Locate the Stolen Phone / Blocked the Phone to NTC,06/20/2023 - 06/20/2023,https://www.foi.gov.ph/requests/aglzfmVmb2ktcGhyHQsSB0NvbnRlbnQiEE5UQy0wMDI1NTQ0Mzg1ODgM
DOLE,"June 21, 2023",Alien Employment Permit (ID Card Verification),PENDING,TO CHECK AND VALIDATE IF THE AEP ID CARD THAT THE AGENCY GAVE ME IS LEGIT OR FAKE,06/06/2023 - 06/21/2023,https://www.foi.gov.ph/requests/aglzfmVmb2ktcGhyHgsSB0NvbnRlbnQiEURPTEUtNDMxMzUyMzY3NjA5DA
DOJ,"June 21, 2023",Criminal Case Violation,REFERRED,To determine pending criminal case against me,06/01/2021 - 06/21/2023,https://www.foi.gov.ph/requests/aglzfmVmb2ktcGhyHQsSB0NvbnRlbnQiEERPSi01NzYxNjY3NjM4NDUM
CIC,"June 21, 2023",Personal Credit Information,PENDING,Personal Review as i might have been involved in identity theft,06/21/2018 - 06/21/2023,https://www.foi.gov.ph/requests/aglzfmVmb2ktcGhyHQsSB0NvbnRlbnQiEENJQy0yNjQ5NTUzMDM3OTQM
DA,"June 21, 2023",Determining Crop Suitability in Cagayan,REFERRED,QGIS Mapping and Research Purposes,06/21/2013 - 06/21/2023,https://www.foi.gov.ph/requests/aglzfmVmb2ktcGhyHAsSB0NvbnRlbnQiD0RBLTQ5MTk5NTczMjQyMAw
ISPSC,"June 21, 2023",National tourism development plan 2023-2028,PENDING,Studies,01/21/2023 - 06/21/2023,https://www.foi.gov.ph/requests/aglzfmVmb2ktcGhyHwsSB0NvbnRlbnQiEklTUFNDLTE5NTEzNTQ1NDI4OQw
CDA,"June 21, 2023",Inquiry on 2022 Top 100 Cooperatives by Performance,ACCEPTED,Impact of cooperatives on the economy and society.,01/01/2022 - 12/31/2022,https://www.foi.gov.ph/requests/aglzfmVmb2ktcGhyHQsSB0NvbnRlbnQiEENEQS02Mzg2ODEyNzQzODUM
NLP,"June 21, 2023",List of Public Libraries in the Philippines,DENIED,Academic Research,01/01/1900 - 06/21/2023,https://www.foi.gov.ph/requests/aglzfmVmb2ktcGhyHQsSB0NvbnRlbnQiEE5MUC04NjgzMzMxMDAxNDQM
NAMRIA,"June 21, 2023",List of Public Libraries,REFERRED,For academic research,01/01/1900 - 06/21/2023,https://www.foi.gov.ph/requests/aglzfmVmb2ktcGhyJAsSB0NvbnRlbnQiF0RFTlJOQU1SSUEtMjQyMzMzMDg4MTUxDA
PSA,"June 21, 2023",Richard soldevilla phylsis ephil id,PARTIALLY SUCCESSFUL,Passport application,04/08/2022 - 06/21/2023,https://www.foi.gov.ph/requests/aglzfmVmb2ktcGhyHQsSB0NvbnRlbnQiEFBTQS00MzQ0NDIzMTA1MDEM
DOH,"June 21, 2023",Number of mental health facilities in luzon,PARTIALLY SUCCESSFUL,Thesis Research,06/20/2023 - 06/20/2023,https://www.foi.gov.ph/requests/aglzfmVmb2ktcGhyHQsSB0NvbnRlbnQiEERPSC0yMzQzMjU4NTQxNTQM
MGB,"June 21, 2023",Geohazard map for Tarlac City,SUCCESSFUL,as requirement for funding request,05/27/2023 - 06/21/2023,https://www.foi.gov.ph/requests/aglzfmVmb2ktcGhyHQsSB0NvbnRlbnQiEE1HQi00MjE0MTM1MTQ2MjQM
DA,"June 21, 2023",Crop Water Requirement of the Crops in the Philippines,REFERRED,Undergraduate thesis,06/21/2023 - 06/21/2023,https://www.foi.gov.ph/requests/aglzfmVmb2ktcGhyHAsSB0NvbnRlbnQiD0RBLTAwNDY4OTgyMTg5Ngw
LTO,"June 21, 2023",license＃N29-23-000439,ACCEPTED,Reset my email account,06/21/2023 - 06/21/2023,https://www.foi.gov.ph/requests/aglzfmVmb2ktcGhyHQsSB0NvbnRlbnQiEExUTy04MjI5MDIzNTE1MjkM
MMSU,"June 21, 2023",Pedro Almazan and his contribution during the Spanish Occupation,ACCEPTED,Research and Development,01/01/1600 - 01/01/1661,https://www.foi.gov.ph/requests/aglzfmVmb2ktcGhyHgsSB0NvbnRlbnQiEU1NU1UtMDIyMzgxMzI3MDE5DA
PSA,"June 21, 2023",Inflation and GDP growth in Davao City,PARTIALLY SUCCESSFUL,Data for Thesis,01/01/2002 - 12/31/2022,https://www.foi.gov.ph/requests/aglzfmVmb2ktcGhyHQsSB0NvbnRlbnQiEFBTQS02NjgxNjE1NTQ5NDgM
DA,"June 21, 2023",Agricultural Hub Data,SUCCESSFUL,Architectural Thesis,06/21/2023 - 06/21/2023,https://www.foi.gov.ph/requests/aglzfmVmb2ktcGhyHAsSB0NvbnRlbnQiD0RBLTI3MDU4MzUxMTg3Mgw
LTO,"June 21, 2023",Driver's License LTO Certification & DFA Authentication,PENDING,Apply for a license in Ireland,06/21/2023 - 06/21/2023,https://www.foi.gov.ph/requests/aglzfmVmb2ktcGhyHQsSB0NvbnRlbnQiEExUTy0yMDg0MzMxNDU4NDAM
SEC,"June 21, 2023",Businesses in Marinduque,SUCCESSFUL,Study on the potential of Marinduque Island (Supercluster),01/01/2022 - 01/01/2023,https://www.foi.gov.ph/requests/aglzfmVmb2ktcGhyHQsSB0NvbnRlbnQiEFNFQy03NDkzNTA5NTM2MDAM
DTI,"June 21, 2023","List of Small and Medium Enterprises (SMEs) owners in Lipa City, Batangas and Meaning of SMEs",PARTIALLY SUCCESSFUL,Thesis Study,05/31/2023 - 06/21/2023,https://www.foi.gov.ph/requests/aglzfmVmb2ktcGhyHQsSB0NvbnRlbnQiEERUSS03NDgzNDU4NDkwMDIM
DTI,"June 21, 2023",Marinduque Businesses,DENIED,Study - potential of Marinduque Island,01/01/2021 - 01/01/2023,https://www.foi.gov.ph/requests/aglzfmVmb2ktcGhyHQsSB0NvbnRlbnQiEERUSS00MjgwNTg2MjYyMzIM
DPWH,"June 21, 2023",CMPD for 1st Quarter 2023,AWAITING CLARIFICATION,Costing of DPWH Projects (ABC/POW etc.),01/01/2023 - 03/31/2023,https://www.foi.gov.ph/requests/aglzfmVmb2ktcGhyHgsSB0NvbnRlbnQiEURQV0gtODUwNjI1MTU0NDY0DA
DOTr,"June 21, 2023","Demands and Volume of Commuters in San Jose del Monte, Bulacan",DENIED,Architectural Thesis,05/03/2023 - 05/03/2023,https://www.foi.gov.ph/requests/aglzfmVmb2ktcGhyHgsSB0NvbnRlbnQiEURPVHItMzUzMzk2Mzc1NTI5DA
DOH,"June 21, 2023",Vaccine certificate,SUCCESSFUL,For travel,06/21/2021 - 07/26/2022,https://www.foi.gov.ph/requests/aglzfmVmb2ktcGhyHQsSB0NvbnRlbnQiEERPSC03NzkwMjIyOTAwNzAM
DOST,"June 21, 2023",Microplastics on Facemasks,REFERRED,For transparency,06/21/2020 - 06/21/2023,https://www.foi.gov.ph/requests/aglzfmVmb2ktcGhyHgsSB0NvbnRlbnQiEURPU1QtNDUxMzg2NDQzMjgwDA
BMB,"June 21, 2023",NIPAS Shapefile Request,ACCEPTED,Research and development,06/21/2023 - 06/21/2023,https://www.foi.gov.ph/requests/aglzfmVmb2ktcGhyIQsSB0NvbnRlbnQiFERFTlJCTUItNzU4NzY1ODc2MzY0DA
DOH,"June 21, 2023","Annual Number of Birth and percentage(Balungao and Bautista,Pangasinan-2022 coverage)",DENIED,for DSP reference,01/31/2022 - 12/31/2022,https://www.foi.gov.ph/requests/aglzfmVmb2ktcGhyHQsSB0NvbnRlbnQiEERPSC02OTA1NzgxMDg2MDMM
BUCOR,"June 21, 2023",An update for parole,PENDING,Personal purpose,02/14/2018 - 06/21/2023,https://www.foi.gov.ph/requests/aglzfmVmb2ktcGhyHwsSB0NvbnRlbnQiEkJVQ09SLTUyNTk0MDI4MjU0Mww
MMDA,"June 21, 2023",Traffic Count BGC / Fort Bonifacio,DENIED,Research and Development,01/01/2022 - 12/31/2022,https://www.foi.gov.ph/requests/aglzfmVmb2ktcGhyHgsSB0NvbnRlbnQiEU1NREEtOTc2NTc5NDgxOTIwDA
PRC,"June 21, 2023",REQUIRED CPD POINTS,ACCEPTED,PRC Renewal,06/21/2023 - 06/21/2023,https://www.foi.gov.ph/requests/aglzfmVmb2ktcGhyHQsSB0NvbnRlbnQiEFBSQy0yOTE1MjIyNjkzNjcM
SSS,"June 21, 2023",Death Claim,DENIED,To get the benifets,06/21/2023 - 06/21/2023,https://www.foi.gov.ph/requests/aglzfmVmb2ktcGhyHQsSB0NvbnRlbnQiEFNTUy01MzI4NjY2NzM0ODMM
LTO,"June 21, 2023",Authenticated Driver's License,PENDING,For Employer's Promotion,06/21/2023 - 06/21/2023,https://www.foi.gov.ph/requests/aglzfmVmb2ktcGhyHQsSB0NvbnRlbnQiEExUTy0zMTU0MzAzMTI4NjQM
ERC,"June 21, 2023",Electrical Energy Consumption on District I (Siargao Islands) of Surigao del Norte,ACCEPTED,Research,01/01/2015 - 12/31/2019,https://www.foi.gov.ph/requests/aglzfmVmb2ktcGhyHQsSB0NvbnRlbnQiEEVSQy02MDA5OTI0MjQ0MjEM
LWUA,"June 21, 2023",Water Consumption on District I (Siargao Islands) of Surigao del Norte,PENDING,Research,01/01/2015 - 12/31/2019,https://www.foi.gov.ph/requests/aglzfmVmb2ktcGhyHgsSB0NvbnRlbnQiEUxXVUEtMzY4MDcyMjM3MjM1DA
SSS,"June 21, 2023",Upgrading paycard in union bank,DENIED,To have a paycard in sss,06/21/2023 - 06/21/2023,https://www.foi.gov.ph/requests/aglzfmVmb2ktcGhyHQsSB0NvbnRlbnQiEFNTUy0zNDA2NDAzMTExNTAM
DENR EMB,"June 21, 2023",Modelling Carbon Emmision in Tarlac City,DENIED,Research,01/01/2019 - 01/01/2023,https://www.foi.gov.ph/requests/aglzfmVmb2ktcGhyIQsSB0NvbnRlbnQiFERFTlJFTUItMjk1OTU4MzMyNTc2DA
NTC,"June 21, 2023",Problem with Converge ICT,PARTIALLY SUCCESSFUL,Request to unblock website,06/21/2023 - 06/21/2023,https://www.foi.gov.ph/requests/aglzfmVmb2ktcGhyHQsSB0NvbnRlbnQiEE5UQy0yNTgwNDg3ODQ2OTQM
CHED,"June 21, 2023",Request for TOR from Abraham Dumlao Colleges of the Philippines Branch Kaligayan Novaliches Q.C,ACCEPTED,I need the transcript from Dumlao school to be forwarded to University of Caloocan City.,06/21/2007 - 11/21/2007,https://www.foi.gov.ph/requests/aglzfmVmb2ktcGhyHgsSB0NvbnRlbnQiEUNIRUQtOTQ3NjU3MjgxMDk0DA
SSS,"June 21, 2023",SSS,DENIED,Pension Loan,06/21/2023 - 06/21/2023,https://www.foi.gov.ph/requests/aglzfmVmb2ktcGhyHQsSB0NvbnRlbnQiEFNTUy0wNzcwOTAxNzIzMzAM
SSS,"June 21, 2023",SSS,DENIED,Pension Loan,06/21/2023 - 06/21/2023,https://www.foi.gov.ph/requests/aglzfmVmb2ktcGhyHQsSB0NvbnRlbnQiEFNTUy00MjM5ODcwOTQ0NTAM
PSA,"June 21, 2023","The data about mortality rate in Kalibo, Aklan",PENDING,Thesis Research,01/01/2019 - 01/01/2023,https://www.foi.gov.ph/requests/aglzfmVmb2ktcGhyHQsSB0NvbnRlbnQiEFBTQS0xOTQwMzA4MjkwNzQM
DENR EMB,"June 21, 2023",Environmental Impact Statement of the Leyte Road Heightening and Tide Embankment Project,SUCCESSFUL,End of Term Paper at School,06/21/2023 - 06/21/2023,https://www.foi.gov.ph/requests/aglzfmVmb2ktcGhyIQsSB0NvbnRlbnQiFERFTlJFTUItMzA2NjYwMDgxNDEyDA
CHED,"June 21, 2023",Transcript of Records,AWAITING CLARIFICATION,For Employment,06/01/2015 - 05/30/2019,https://www.foi.gov.ph/requests/aglzfmVmb2ktcGhyHgsSB0NvbnRlbnQiEUNIRUQtMTQ0NjYwMDU4Nzk4DA
BI,"June 21, 2023","Number of Airline passengers per nationality, point of origin, and airport entry point (2020-2023)",ACCEPTED,College Requirement (Tourism Profile for Pasay),01/01/2020 - 06/19/2023,https://www.foi.gov.ph/requests/aglzfmVmb2ktcGhyHAsSB0NvbnRlbnQiD0JJLTAyNzA5MjY3MDU0OQw
PNP,"June 21, 2023",RWP POI (Mountain Province),SUCCESSFUL,Basis in conducting RWP Training,06/21/2023 - 06/21/2023,https://www.foi.gov.ph/requests/aglzfmVmb2ktcGhyHQsSB0NvbnRlbnQiEFBOUC0wMzMwNzY5Mjk1NTUM
BIR,"June 21, 2023",ITR for 2022,AWAITING CLARIFICATION,Employment Requirement,01/01/2022 - 12/31/2022,https://www.foi.gov.ph/requests/aglzfmVmb2ktcGhyHQsSB0NvbnRlbnQiEEJJUi02MjI0MjQxODk2MTEM
PRC,"June 21, 2023",PRC online Record Mismatched,ACCEPTED,for application of a license here in Saudi Arabia,06/18/2023 - 06/21/2023,https://www.foi.gov.ph/requests/aglzfmVmb2ktcGhyHQsSB0NvbnRlbnQiEFBSQy01MTM5NTgwMjMwODgM
NBI,"June 21, 2023",Requesting for criminal record,PENDING,For my own record,06/21/2007 - 06/21/2012,https://www.foi.gov.ph/requests/aglzfmVmb2ktcGhyHQsSB0NvbnRlbnQiEE5CSS0xMTA5NzY5MjMyNzcM
PSA,"June 21, 2023",Statistics of MSME in Bulacan,PARTIALLY SUCCESSFUL,feasibility study and business planning,06/20/2023 - 06/20/2023,https://www.foi.gov.ph/requests/aglzfmVmb2ktcGhyHQsSB0NvbnRlbnQiEFBTQS05MDE5NDg1NTMzMTgM
