agency,date,title,status,purpose,period_covered,link
BIR,"June 28, 2022","BIR-FORM 1702-RT Taxable year Feb. 28, 2022, tin# 765-004-687-000",PARTIALLY SUCCESSFUL,BIR- Confirmation Receipt not sent to lsi_royportugal@yahoo.com,02/28/2021 - 02/28/2022,https://www.foi.gov.ph/requests/aglzfmVmb2ktcGhyHQsSB0NvbnRlbnQiEEJJUi03NTA2NDk1NDU0NjYM
PH,"June 28, 2022",Marketing Strategies Implementing By Government Agency to Reach Informal Sectors m,SUCCESSFUL,For Research and Development,01/01/2020 - 06/28/2022,https://www.foi.gov.ph/requests/aglzfmVmb2ktcGhyHAsSB0NvbnRlbnQiD1BILTQ1MDg5MzgyMjk1NAw
PGO-PIO,"June 28, 2022",List of Accredited CSOs in the Province of South Cotabato,PENDING,"Research, development, and stakeholder mapping",01/01/2021 - 06/28/2022,https://www.foi.gov.ph/requests/aglzfmVmb2ktcGhyIQsSB0NvbnRlbnQiFFBHTy1QSU8tMTAyMDE3MjE4OTM4DA
PGLU,"June 28, 2022",List of Accredited CSOs in the Province of La Union,PENDING,"Research, development, and stakeholder mapping",01/01/2021 - 06/28/2022,https://www.foi.gov.ph/requests/aglzfmVmb2ktcGhyHgsSB0NvbnRlbnQiEVBHTFUtMzA5NDgxNjI4MDg2DA
BJMP,"June 28, 2022",Welfare and Development Program of Provincial Jail,ACCEPTED,Dissertation Study,06/28/2012 - 06/28/2022,https://www.foi.gov.ph/requests/aglzfmVmb2ktcGhyHgsSB0NvbnRlbnQiEUJKTVAtNzA1MzMyNTgyOTIyDA
PLGUB,"June 28, 2022",List of Accredited CSOs in the Province of Benguet,PENDING,"Research, development, and stakeholder mapping",01/01/2021 - 06/28/2022,https://www.foi.gov.ph/requests/aglzfmVmb2ktcGhyHwsSB0NvbnRlbnQiElBMR1VCLTUzMzE5NDY0ODY2OAw
PAKIL,"June 28, 2022","List of Accredited CSOs in the Municipality of Pakil, Laguna",PENDING,"Research, development, and stakeholder mapping",01/01/2020 - 06/28/2022,https://www.foi.gov.ph/requests/aglzfmVmb2ktcGhyHwsSB0NvbnRlbnQiElBBS0lMLTA3OTk4NTYzNDEwNgw
BAI,"June 28, 2022",Estimated Population of Registered Cat and Dog Owners in the Philippines,PENDING,Thesis,01/01/2022 - 06/28/2022,https://www.foi.gov.ph/requests/aglzfmVmb2ktcGhyHQsSB0NvbnRlbnQiEEJBSS05MzYxMjM3MDIyMTgM
LEGAZPI,"June 28, 2022",List of Accredited CSOs in City of Legazpi LGU,PENDING,"Research, development, and stakeholder mapping",01/01/2021 - 06/28/2022,https://www.foi.gov.ph/requests/aglzfmVmb2ktcGhyIQsSB0NvbnRlbnQiFExFR0FaUEktNzg1NjQ5NDEyOTIxDA
CGA,"June 28, 2022",List of Accredited LGUs in Antipolo,PENDING,"Research, development, and stakeholder mapping",01/01/2021 - 06/28/2022,https://www.foi.gov.ph/requests/aglzfmVmb2ktcGhyHQsSB0NvbnRlbnQiEENHQS02MjYyMzg4NjcxNDQM
UsaP,"June 28, 2022",List of Accredited CSOs in Pasig,ACCEPTED,"Research, development, and stakeholder mapping of participatory budgeting activities",06/28/2022 - 06/28/2022,https://www.foi.gov.ph/requests/aglzfmVmb2ktcGhyHgsSB0NvbnRlbnQiEVVTQVAtOTQyMzQzODU1MTI5DA
AFAB,"June 28, 2022",List of Port Locators,ACCEPTED,Company Research and Development,06/28/2015 - 06/28/2022,https://www.foi.gov.ph/requests/aglzfmVmb2ktcGhyHgsSB0NvbnRlbnQiEUFGQUItOTYwMjUxNzYwMDM3DA
ERC,"June 28, 2022",Every Distribution Planning Studies (DPS) of PDU MERALCO from 2017-2021,DENIED,To develop an interactive Geographical Information System Map. Identify load growth and load pattern,01/01/2017 - 12/31/2021,https://www.foi.gov.ph/requests/aglzfmVmb2ktcGhyHQsSB0NvbnRlbnQiEEVSQy04NTY0NTExODQ5MzMM
DOH,"June 28, 2022",Vaxcertificate,SUCCESSFUL,Travel Abroad,06/28/2022 - 06/28/2022,https://www.foi.gov.ph/requests/aglzfmVmb2ktcGhyHQsSB0NvbnRlbnQiEERPSC00NDczMzIwODY0NTUM
ERC,"June 28, 2022","Historical Peak Loading in MW of all of MERALCOâ€™s substations 2017-2021, with forecast to 2026",ACCEPTED,To develop an interactive Geographical Information System Map. Identify load growth and load pattern,01/01/2017 - 12/31/2021,https://www.foi.gov.ph/requests/aglzfmVmb2ktcGhyHQsSB0NvbnRlbnQiEEVSQy05NTE1NjM4MDYxMDIM
PSALM,"June 28, 2022",JDM_ Luzon Power Plants and Electric Utilities,ACCEPTED,Research and Partnership,06/28/2022 - 06/28/2022,https://www.foi.gov.ph/requests/aglzfmVmb2ktcGhyHwsSB0NvbnRlbnQiElBTQUxNLTkzODMzMTc4OTYwOQw
DOH,"June 28, 2022",Vaxcertificate,SUCCESSFUL,Travel Abroad,06/28/2022 - 06/28/2022,https://www.foi.gov.ph/requests/aglzfmVmb2ktcGhyHQsSB0NvbnRlbnQiEERPSC0yNjA1OTU2ODM1NTYM
DTI,"June 28, 2022",The number of restaurant/food chain registered in DTI which uses Chopsticks,PARTIALLY SUCCESSFUL,Research and Development,01/01/2019 - 12/31/2021,https://www.foi.gov.ph/requests/aglzfmVmb2ktcGhyHQsSB0NvbnRlbnQiEERUSS02NTU3ODE0NjQxOTIM
ERC,"June 28, 2022",Substation Reliability Indices of MERLACO for every year from 2017-2021,ACCEPTED,To develop an interactive Geographical Information System Map. Identify reliability scales,01/01/2017 - 12/31/2021,https://www.foi.gov.ph/requests/aglzfmVmb2ktcGhyHQsSB0NvbnRlbnQiEEVSQy04ODgwNTgxNjY0MjMM
ERC,"June 28, 2022",Every Distribution Development Plan (DDP) of PDU MERALCO from 2001-2010 as per PDC 2001 Sec. 6.2.5,DENIED,to research existing power distribution Studies,01/01/2001 - 12/31/2010,https://www.foi.gov.ph/requests/aglzfmVmb2ktcGhyHQsSB0NvbnRlbnQiEEVSQy04MzE1MzM3MzUyMzAM
ERC,"June 28, 2022",Every Distribution Development Plan (DDP) of PDU MERALCO from 2010-2016 as per PDC 2017 Sec. 5.2.5,DENIED,to research existing power distribution Studies,01/01/2010 - 12/31/2016,https://www.foi.gov.ph/requests/aglzfmVmb2ktcGhyHQsSB0NvbnRlbnQiEEVSQy0xNzY0NTkxMjYyMzAM
CHED,"June 28, 2022",NSTP Serial Number,AWAITING CLARIFICATION,Academic Purposes,07/01/2012 - 08/31/2012,https://www.foi.gov.ph/requests/aglzfmVmb2ktcGhyHgsSB0NvbnRlbnQiEUNIRUQtMTk5MTc4MDAzMzk3DA
OMB,"June 28, 2022",Data on Piracy Rates in the Philippines,SUCCESSFUL,Research for a journalistic story/project,06/27/2012 - 06/27/2022,https://www.foi.gov.ph/requests/aglzfmVmb2ktcGhyHQsSB0NvbnRlbnQiEE9NQi04MTEyMzI0NDQ4NjUM
ERC,"June 28, 2022",Every Distribution Development Plan (DDP) of PDU MERALCO from 2017-2020 as per PDC 2017 Sec. 5.2.5,DENIED,to research existing power distribution Studies,01/01/2017 - 12/31/2020,https://www.foi.gov.ph/requests/aglzfmVmb2ktcGhyHQsSB0NvbnRlbnQiEEVSQy0zMzY0ODQ5ODAyNTQM
ERC,"June 28, 2022",MERALCO's Existing Simple and Geographic Single Line Diagram,ACCEPTED,"To develop a Geographic Information System Map showing 500kV 230kV 69kV, 34.5kV, and 13.8kv lines",01/01/2017 - 12/31/2021,https://www.foi.gov.ph/requests/aglzfmVmb2ktcGhyHQsSB0NvbnRlbnQiEEVSQy0zNzY0NDMzOTg5NTEM
CHED,"June 28, 2022",Requesting Laptop Assistance for a Scholar Student in a University,DENIED,For Academic Purpose: Practice Teaching this coming Academic Year 2022-2023,06/27/2022 - 06/27/2022,https://www.foi.gov.ph/requests/aglzfmVmb2ktcGhyHgsSB0NvbnRlbnQiEUNIRUQtMzQ1MjYxMTExMDg4DA
DTI,"June 28, 2022",List of AAAA PCAB License Holder,REFERRED,Research,06/27/2022 - 06/27/2022,https://www.foi.gov.ph/requests/aglzfmVmb2ktcGhyHQsSB0NvbnRlbnQiEERUSS00NjY2MDM0MjM1ODAM
ECC,"June 28, 2022",Angel quidato IV,PENDING,COVID-19 positive claim,09/14/2021 - 10/04/2021,https://www.foi.gov.ph/requests/aglzfmVmb2ktcGhyHQsSB0NvbnRlbnQiEEVDQy02NzUwMTc2MjcwNDEM
DTI,"June 28, 2022","The number of registered stores or establishments such as pasalubong center, gift shops in Batangas",PARTIALLY SUCCESSFUL,Research (Feasibility Study),06/28/2016 - 06/28/2022,https://www.foi.gov.ph/requests/aglzfmVmb2ktcGhyHQsSB0NvbnRlbnQiEERUSS05OTMwMDQyMjQ1OTkM
PSA,"June 28, 2022",Family Income and Expenditure Survey (FIES),PENDING,For SDG 3.5.2 Research,01/01/2012 - 12/31/2021,https://www.foi.gov.ph/requests/aglzfmVmb2ktcGhyHQsSB0NvbnRlbnQiEFBTQS0wNzkxMDY3NjAxMDUM
BI,"June 28, 2022",The litres of alcohol consumed by tourists (15 years of age and older),REFERRED,For SDG 3.5.2 Research,01/01/2019 - 01/01/2021,https://www.foi.gov.ph/requests/aglzfmVmb2ktcGhyHAsSB0NvbnRlbnQiD0JJLTkzMjIxNzI2MzY1Mww
DOLE,"June 28, 2022",Finding part-time jobs for students,PENDING,Earning and daily needs,06/28/2022 - 06/28/2022,https://www.foi.gov.ph/requests/aglzfmVmb2ktcGhyHgsSB0NvbnRlbnQiEURPTEUtOTMyODkyNDE4NzMxDA
PRC,"June 28, 2022",The Number of Certified Public Accountants in Metro Manila including Non-CPAs,ACCEPTED,Accounting Research,05/25/2020 - 06/25/2022,https://www.foi.gov.ph/requests/aglzfmVmb2ktcGhyHQsSB0NvbnRlbnQiEFBSQy0xNDQ4NjU2MzMyODkM
DepEd,"June 28, 2022",Requesting for Form 137,SUCCESSFUL,"For getting the Grade 12 Card, Diploma and applying college.",06/28/2022 - 06/28/2022,https://www.foi.gov.ph/requests/aglzfmVmb2ktcGhyHwsSB0NvbnRlbnQiEkRlcEVkLTk3MzAzNzk0ODc0OAw
IC,"June 28, 2022",list of credit and insurance cooperatives in the Philippines,AWAITING CLARIFICATION,research and to help establish new cooperative for teachers,06/24/2021 - 06/24/2022,https://www.foi.gov.ph/requests/aglzfmVmb2ktcGhyHAsSB0NvbnRlbnQiD0lDLTk5MjYwNTI5NDM4MQw
DOH,"June 28, 2022",Vaccination,SUCCESSFUL,Correction of my VaxCert,06/27/2022 - 06/28/2022,https://www.foi.gov.ph/requests/aglzfmVmb2ktcGhyHQsSB0NvbnRlbnQiEERPSC0wNDUzMDk4Njk1MzAM
DOH,"June 28, 2022",Vaccine Certificate,SUCCESSFUL,Travel,06/24/2021 - 07/22/2021,https://www.foi.gov.ph/requests/aglzfmVmb2ktcGhyHQsSB0NvbnRlbnQiEERPSC02Nzg2MTA2MTg4NDUM
NAP,"June 28, 2022",Birth Certificate of Abraham Ibalio,PENDING,Research,01/01/1924 - 12/31/1929,https://www.foi.gov.ph/requests/aglzfmVmb2ktcGhyHQsSB0NvbnRlbnQiEE5BUC0wNjU4MTY1NTEwNzEM
BIR,"June 28, 2022",Income Tax Return or BIR FORM 2316,AWAITING CLARIFICATION,Visa Application,07/30/2016 - 10/30/2019,https://www.foi.gov.ph/requests/aglzfmVmb2ktcGhyHQsSB0NvbnRlbnQiEEJJUi03MzE2ODU1ODY1MTAM
NTC,"June 28, 2022",Trace the location of this number 09533422519,DENIED,To have a concrete evidence and file libel case for the owner of the phone number.,06/01/2022 - 06/28/2022,https://www.foi.gov.ph/requests/aglzfmVmb2ktcGhyHQsSB0NvbnRlbnQiEE5UQy03NDE5MDE3NTEwNzEM
NTC,"June 28, 2022","Gcash holding my transferred money (20,000.00)",PARTIALLY SUCCESSFUL,"I need Gcash to release my 20,000",06/25/2022 - 06/28/2022,https://www.foi.gov.ph/requests/aglzfmVmb2ktcGhyHQsSB0NvbnRlbnQiEE5UQy0zMzM4NTY1OTg5NDMM
NPC,"June 28, 2022",Harassment From Cashmart Philippines,PENDING,Reporting harassment from an agent from Cashmart.,06/28/2022 - 06/28/2022,https://www.foi.gov.ph/requests/aglzfmVmb2ktcGhyHQsSB0NvbnRlbnQiEE5QQy03MjcwNjczMTQ5MzAM
LTO,"June 28, 2022",Motorcycle Riders in the Philippines,PENDING,Research,01/01/2015 - 05/30/2022,https://www.foi.gov.ph/requests/aglzfmVmb2ktcGhyHQsSB0NvbnRlbnQiEExUTy0yMTIxNTg3NjM5MTkM
DOH,"June 28, 2022",Covid vaccine certificate,SUCCESSFUL,"Purpose for International flight on July 9, 2022",07/27/2021 - 08/30/2021,https://www.foi.gov.ph/requests/aglzfmVmb2ktcGhyHQsSB0NvbnRlbnQiEERPSC0zNzIxOTY4NDY3NDgM
DOTr,"June 27, 2022",Redevelopment of Bacolod-Silay Airport,AWAITING CLARIFICATION,Undergraduate Architectural Research,06/27/2022 - 06/27/2022,https://www.foi.gov.ph/requests/aglzfmVmb2ktcGhyHgsSB0NvbnRlbnQiEURPVHItNDY0OTU0Nzg1OTA3DA
PCSO,"June 27, 2022",Dialysis Patient,SUCCESSFUL,Medical Assistance,05/30/2022 - 06/27/2022,https://www.foi.gov.ph/requests/aglzfmVmb2ktcGhyHgsSB0NvbnRlbnQiEVBDU08tNTU1ODM1NzkxMDQyDA
DTI,"June 27, 2022",Annual Consumption of Silicon Carbide in Philippines,REFERRED,Plant Design Research,01/01/2016 - 01/11/2022,https://www.foi.gov.ph/requests/aglzfmVmb2ktcGhyHQsSB0NvbnRlbnQiEERUSS0zMjMzOTQxNjAwNTUM
PSA,"June 27, 2022",Annual demand of Silicon Carbide in the Philippines per industry,PARTIALLY SUCCESSFUL,Plant Design Research,01/01/2016 - 01/01/2022,https://www.foi.gov.ph/requests/aglzfmVmb2ktcGhyHQsSB0NvbnRlbnQiEFBTQS0zNzgxNjI5MTUxOTcM
BSWM,"June 27, 2022",Soil Properties in Southern Leyte,PROCESSING,Research,01/01/2000 - 06/27/2022,https://www.foi.gov.ph/requests/aglzfmVmb2ktcGhyHgsSB0NvbnRlbnQiEUJTV00tNjA3ODkyNTU4MzExDA
POEA,"June 27, 2022",OFW in UAE,PENDING,Thesis,06/27/1970 - 06/27/2022,https://www.foi.gov.ph/requests/aglzfmVmb2ktcGhyHgsSB0NvbnRlbnQiEVBPRUEtNTkwMDU2MzQ4MTUxDA
DOH,"June 27, 2022",Request for Vaxcert,SUCCESSFUL,"Request for vaxcert is always resulting to ""Your Update Request is still in Progress""",12/02/2021 - 06/27/2022,https://www.foi.gov.ph/requests/aglzfmVmb2ktcGhyHQsSB0NvbnRlbnQiEERPSC0zOTczMjkyOTY5NDEM
DENR,"June 27, 2022",Sample of Memorandum of Agreement on Material Recovery Facility between LGU and homeowners associati,REFERRED,reference only,06/27/2022 - 06/27/2022,https://www.foi.gov.ph/requests/aglzfmVmb2ktcGhyHgsSB0NvbnRlbnQiEURFTlItNTQ0Mzc0MDYxMzQyDA
NBI,"June 27, 2022",Request Deletion,PENDING,Data Privacy,06/27/2022 - 06/27/2022,https://www.foi.gov.ph/requests/aglzfmVmb2ktcGhyHQsSB0NvbnRlbnQiEE5CSS04NDMzNzk4MTg0NzQM
BUCOR,"June 27, 2022",Philippine Prisons and statistics,ACCEPTED,Research and Development,01/01/1990 - 01/01/2022,https://www.foi.gov.ph/requests/aglzfmVmb2ktcGhyHwsSB0NvbnRlbnQiEkJVQ09SLTQ0OTk3NDAxNjQyOAw
NTC,"June 27, 2022",Complaint Against Globe Telecom,DENIED,For Globe to take action on my request.,06/11/2022 - 06/27/2022,https://www.foi.gov.ph/requests/aglzfmVmb2ktcGhyHQsSB0NvbnRlbnQiEE5UQy02MTEwMzgxMTY5MzkM
BJMP,"June 27, 2022",Jails and statistics,SUCCESSFUL,Research and development,01/01/1950 - 01/01/2022,https://www.foi.gov.ph/requests/aglzfmVmb2ktcGhyHgsSB0NvbnRlbnQiEUJKTVAtODc1MjQxNTYzNTcyDA
NHCP,"June 27, 2022","Listing of Elected Officials in Mayorga, Leyte",REFERRED,"Tracking the lost political history of Mayorga, Leyte",08/25/1955 - 06/27/2022,https://www.foi.gov.ph/requests/aglzfmVmb2ktcGhyHgsSB0NvbnRlbnQiEU5IQ1AtNDQ2NDI2NTM5NzU0DA
DTI,"June 27, 2022","The number of registered stores or establishments such as pasalubong centers, gift shops in Batangas",PARTIALLY SUCCESSFUL,Research (Undergrad Thesis),06/27/2016 - 06/27/2022,https://www.foi.gov.ph/requests/aglzfmVmb2ktcGhyHQsSB0NvbnRlbnQiEERUSS01NjE3Mzc4Nzk5NTcM
NRCP,"June 27, 2022",List of researches involving Children in Conflict with the Law,SUCCESSFUL,Thesis proposal,01/01/2010 - 01/01/2022,https://www.foi.gov.ph/requests/aglzfmVmb2ktcGhyHgsSB0NvbnRlbnQiEU5SQ1AtNDM4NjQ3OTA1OTA2DA
NRCP,"June 27, 2022",List of Researches involving female inmates/PDL,SUCCESSFUL,Thesis Proposal,01/01/2000 - 01/01/2022,https://www.foi.gov.ph/requests/aglzfmVmb2ktcGhyHgsSB0NvbnRlbnQiEU5SQ1AtNTk1NTkwMTc2Njc0DA
NTC,"June 27, 2022",To Find and Block Stolen Mobile Phone,DENIED,To find and block a stolen phone,06/26/2022 - 06/27/2022,https://www.foi.gov.ph/requests/aglzfmVmb2ktcGhyHQsSB0NvbnRlbnQiEE5UQy05MDc4NTk2MjQ4MzMM
DENR,"June 27, 2022","Request for Alienable and disposable land map of Culat, Casiguran, Aurora",REFERRED,Farm Development / Eco Tourism / AgriTech,06/27/2000 - 06/27/2022,https://www.foi.gov.ph/requests/aglzfmVmb2ktcGhyHgsSB0NvbnRlbnQiEURFTlItOTIxMjI3OTgwMzE1DA
DOH,"June 27, 2022",Vaxcert.ph,SUCCESSFUL,Flight to US,09/28/2021 - 04/29/2022,https://www.foi.gov.ph/requests/aglzfmVmb2ktcGhyHQsSB0NvbnRlbnQiEERPSC01NzgxODM2MDE3ODgM
UsaP,"June 27, 2022",current events in the City of Pasig,ACCEPTED,Research and development,01/01/2000 - 06/27/2022,https://www.foi.gov.ph/requests/aglzfmVmb2ktcGhyHgsSB0NvbnRlbnQiEVVTQVAtMDMwMDgxMzQzODcxDA
DOH,"June 27, 2022",Changing of Birthdate on Vaccination Certificate,SUCCESSFUL,Correction of information on vaccination certificate,06/27/2022 - 06/27/2022,https://www.foi.gov.ph/requests/aglzfmVmb2ktcGhyHQsSB0NvbnRlbnQiEERPSC02MjcyNDQ3ODczODkM
BJMP,"June 27, 2022",Request for BJMP staff to participate in a survey to provide feedback on the system we developed,ACCEPTED,College Capstone/ Thesis,06/27/2022 - 06/27/2022,https://www.foi.gov.ph/requests/aglzfmVmb2ktcGhyHgsSB0NvbnRlbnQiEUJKTVAtOTkwODgyMTExMjgwDA
HDMF,"June 27, 2022",PAGIBIG HDMF - MP2 Savings Account Number,DENIED,To Determine my member/savings account number for online payments,03/01/2022 - 06/27/2022,https://www.foi.gov.ph/requests/aglzfmVmb2ktcGhyHgsSB0NvbnRlbnQiEUhETUYtNzk2OTE5MDIzNjgwDA
SSS,"June 27, 2022",EC claim for evaluation,PENDING,For Evaluation,06/11/2021 - 07/10/2021,https://www.foi.gov.ph/requests/aglzfmVmb2ktcGhyHQsSB0NvbnRlbnQiEFNTUy02NzA1NDUzODA3NDIM
PSA,"June 27, 2022","Statistics on Household Consumption/Expenditures, including auto loans",PARTIALLY SUCCESSFUL,Research on auto loans industry in the Philippines,01/01/2017 - 01/01/2022,https://www.foi.gov.ph/requests/aglzfmVmb2ktcGhyHQsSB0NvbnRlbnQiEFBTQS05NTc4NDc2NTg2MjYM
LTO,"June 27, 2022","Number of New Motor Vehicles registered, By Region",PENDING,Research on the state of auto financial services in the Philippines,01/01/2017 - 03/01/2022,https://www.foi.gov.ph/requests/aglzfmVmb2ktcGhyHQsSB0NvbnRlbnQiEExUTy04NTI3ODk3OTg1NDUM
PCIEERD,"June 27, 2022",REQUESTED A FREE LAPTOP,DENIED,For online class,06/27/2022 - 06/27/2022,https://www.foi.gov.ph/requests/aglzfmVmb2ktcGhyIQsSB0NvbnRlbnQiFFBDSUVFUkQtNzY0NjY5ODIyNjkwDA
DOE,"June 27, 2022",Industrial Engineering Thesis,ACCEPTED,School Thesis,06/27/2022 - 06/27/2022,https://www.foi.gov.ph/requests/aglzfmVmb2ktcGhyHQsSB0NvbnRlbnQiEERPRS04MTM4NDA3MDMxMDMM
ASU,"June 27, 2022",Covid vaccine certificate,REFERRED,"Purpose for International flight on July 9, 2022",07/27/2021 - 08/30/2021,https://www.foi.gov.ph/requests/aglzfmVmb2ktcGhyHQsSB0NvbnRlbnQiEEFTVS04MjIzOTk2OTkwMzIM
PRC,"June 27, 2022",The Number of LET Passers Elementary and Secondary per SUC (if possible LSPU),DENIED,Research and Development.,01/01/2017 - 06/27/2022,https://www.foi.gov.ph/requests/aglzfmVmb2ktcGhyHQsSB0NvbnRlbnQiEFBSQy0yMjM1NDkyMDU1NDAM
DOE,"June 27, 2022","2017-2021 Distribution Development Plan (DDP) of PDU BUSECO, as per PDC 2017, Sec. 5.2.5.2",PARTIALLY SUCCESSFUL,Research existing power distribution Study,01/01/2017 - 12/31/2021,https://www.foi.gov.ph/requests/aglzfmVmb2ktcGhyHQsSB0NvbnRlbnQiEERPRS02MzMwMDE3NjgxODkM
NEA,"June 27, 2022","2017-2021 Distribution Development Plan (DDP) of PDU BUSECO, as per PDC 2017, Sec. 5.2.5.2",ACCEPTED,Research the existing power distribution Study,01/01/2017 - 12/31/2021,https://www.foi.gov.ph/requests/aglzfmVmb2ktcGhyHQsSB0NvbnRlbnQiEE5FQS0yOTQ5NTU0MjU4NzkM
PCSO,"June 27, 2022",Requesting Laptop Assistance for a Scholar Student in a University,REFERRED,For Academic Purpose: Practice Teaching this coming Academic Year 2022-2023,06/27/2022 - 06/27/2022,https://www.foi.gov.ph/requests/aglzfmVmb2ktcGhyHgsSB0NvbnRlbnQiEVBDU08tNDEwMjY1ODQ1ODk4DA
DENR,"June 27, 2022",Comprehensive Land Use Plan (CLUP) of Silang Cavite,REFERRED,School Research and Feasibility Study,06/01/2020 - 06/01/2022,https://www.foi.gov.ph/requests/aglzfmVmb2ktcGhyHgsSB0NvbnRlbnQiEURFTlItMzQ5MTk4NzU3NTM1DA
SSS,"June 27, 2022",Request to replace my phone number,PENDING,To replace my phone number,06/27/2022 - 06/27/2022,https://www.foi.gov.ph/requests/aglzfmVmb2ktcGhyHQsSB0NvbnRlbnQiEFNTUy01NzIwNzA2NzUxMzQM
POEA,"June 27, 2022",Third-country recruitment schemes for deployment of OFWs to Poland,PENDING,Research,01/01/2020 - 06/27/2022,https://www.foi.gov.ph/requests/aglzfmVmb2ktcGhyHgsSB0NvbnRlbnQiEVBPRUEtNDEzMzMyMDM5OTcyDA
DOH,"June 27, 2022",Vaccine Certificate Missing 1st Dose & Booster shot,SUCCESSFUL,Requirement work abroad,06/23/2022 - 06/27/2022,https://www.foi.gov.ph/requests/aglzfmVmb2ktcGhyHQsSB0NvbnRlbnQiEERPSC0xNjE4NzI1ODYwMjQM
DTI,"June 27, 2022","The number of registered stores and retail establishments(ie.pasalubong centers, giftshops) in Batan",DENIED,Research (Undergrad Thesis),01/01/2016 - 06/27/2022,https://www.foi.gov.ph/requests/aglzfmVmb2ktcGhyHQsSB0NvbnRlbnQiEERUSS01MzQ2OTMzMjczNzEM
DepEd,"June 27, 2022",Prudential gold scholar,DENIED,Claim for educational plan maturity,05/29/1997 - 05/29/2013,https://www.foi.gov.ph/requests/aglzfmVmb2ktcGhyHwsSB0NvbnRlbnQiEkRlcEVkLTE5NDA5NDM4NTc0Ngw
DOH,"June 27, 2022",Vaccination Certificate - Correction,SUCCESSFUL,Correction of My vaccination Certificate,06/27/2022 - 06/27/2022,https://www.foi.gov.ph/requests/aglzfmVmb2ktcGhyHQsSB0NvbnRlbnQiEERPSC00Mzg5MzU1NzU1NzMM
NIA,"June 27, 2022","The irrigation per cubic meter for farming of Naic, Cavite",PENDING,Undergraduate Thesis,01/01/2012 - 12/31/2021,https://www.foi.gov.ph/requests/aglzfmVmb2ktcGhyHQsSB0NvbnRlbnQiEE5JQS0wNjQyNTc2NjEyOTIM
DepEd,"June 27, 2022",Historical-Number-of-Enrollment-in-ALL-SECTOR-Senior-High-School at Municipality Level,AWAITING CLARIFICATION,Research on interest per SHS strand,01/01/2016 - 06/27/2022,https://www.foi.gov.ph/requests/aglzfmVmb2ktcGhyHwsSB0NvbnRlbnQiEkRlcEVkLTMwOTk5NDI1NjMxNAw
DOH,"June 27, 2022",2nd Booster Shot for Covid 19 - ICV,SUCCESSFUL,Family Visit Visa Requirements,06/27/2022 - 06/27/2022,https://www.foi.gov.ph/requests/aglzfmVmb2ktcGhyHQsSB0NvbnRlbnQiEERPSC0xNzkxMjIxODAzMjgM
BIR,"June 27, 2022",checking of RDO code from BIR,SUCCESSFUL,To check my status about my RDO registration.,06/27/2022 - 06/27/2022,https://www.foi.gov.ph/requests/aglzfmVmb2ktcGhyHQsSB0NvbnRlbnQiEEJJUi00Mzc0MDAzMTIyODYM
PSA,"June 27, 2022","Total Population per Age Group by Province, City, Municipality",PENDING,Research purpose to determine different age group cohorts,01/01/2022 - 06/27/2022,https://www.foi.gov.ph/requests/aglzfmVmb2ktcGhyHQsSB0NvbnRlbnQiEFBTQS0zNjYyMzE2ODcxNzIM
DOH,"June 27, 2022",LOST VACCINATION CARD,SUCCESSFUL,LOST VACCINATION CARD,06/27/2022 - 06/27/2022,https://www.foi.gov.ph/requests/aglzfmVmb2ktcGhyHQsSB0NvbnRlbnQiEERPSC03NjExNDYyMzA0NDUM
UsaP,"June 27, 2022",Pasig City plans,ACCEPTED,Research for Masters Thesis at the SCHOOL OF URBAN AND REGIONAL PLANNING - UP Diliman,06/27/2014 - 06/27/2022,https://www.foi.gov.ph/requests/aglzfmVmb2ktcGhyHgsSB0NvbnRlbnQiEVVTQVAtNzIyMDczODgzOTM0DA
PAGASA,"June 27, 2022",Rainfall data in Southern Leyte,AWAITING CLARIFICATION,Research,01/01/2006 - 01/01/2021,https://www.foi.gov.ph/requests/aglzfmVmb2ktcGhyIAsSB0NvbnRlbnQiE1BBR0FTQS00NDQ1MjE5NzY1MTgM
CHED,"June 27, 2022",Enrollment and Graduation Count by HEI and Discipline Group from 2016 to 2022 (last 5 years),DENIED,Research purpose to determine interest at various courses/discipline group,01/01/2016 - 06/27/2022,https://www.foi.gov.ph/requests/aglzfmVmb2ktcGhyHgsSB0NvbnRlbnQiEUNIRUQtMTIxMTU4NDExNzMzDA
PEZA,"June 27, 2022",The Number of BPO Employees in NCR,PENDING,Research and Development,06/23/2020 - 06/23/2022,https://www.foi.gov.ph/requests/aglzfmVmb2ktcGhyHgsSB0NvbnRlbnQiEVBFWkEtNzYyNjU3NDk2NjQ1DA
PRC,"June 27, 2022",PRC ONLINE RECORDS MISMATCHED,ACCEPTED,PRC ID Renewal,06/26/2022 - 06/27/2022,https://www.foi.gov.ph/requests/aglzfmVmb2ktcGhyHQsSB0NvbnRlbnQiEFBSQy05ODU1MzUzOTgwNTIM
MGB,"June 27, 2022","Data on Soil Properties of Southern Leyte, Land Use Map of Southern Leyte",ACCEPTED,Research,01/01/2005 - 06/27/2022,https://www.foi.gov.ph/requests/aglzfmVmb2ktcGhyHQsSB0NvbnRlbnQiEE1HQi02NjI3NTAzODYxMTAM
NAMRIA,"June 27, 2022",Land Use Map and Data on Soil Properties of Southern Leyte,DENIED,Research,01/01/2005 - 06/27/2022,https://www.foi.gov.ph/requests/aglzfmVmb2ktcGhyJAsSB0NvbnRlbnQiF0RFTlJOQU1SSUEtNjcxMDY5NzE5NjY0DA
NHA,"June 27, 2022",Request Approved Subdivision Plan,ACCEPTED,PAG-IBIG HOUSING LOAN,06/27/2022 - 06/27/2022,https://www.foi.gov.ph/requests/aglzfmVmb2ktcGhyHQsSB0NvbnRlbnQiEE5IQS0xNzMxNzIwMzU2NzYM
BSWM,"June 27, 2022","Soil Types, Soil Map, and Land Use Map of Southern Leyte",SUCCESSFUL,Research,01/01/2010 - 06/27/2022,https://www.foi.gov.ph/requests/aglzfmVmb2ktcGhyHgsSB0NvbnRlbnQiEUJTV00tNjY4NzY5NzkxNDk1DA
SSS,"June 27, 2022",Sickness Claim Follow Up,PENDING,Follow up my sickness claim when I got Covid19 infected.,01/10/2022 - 01/19/2022,https://www.foi.gov.ph/requests/aglzfmVmb2ktcGhyHQsSB0NvbnRlbnQiEFNTUy0wNzgzMjYxMjYzMTIM
DPWH,"June 27, 2022",List of AAAA PCAB License Holder,REFERRED,Research,06/27/2022 - 06/27/2022,https://www.foi.gov.ph/requests/aglzfmVmb2ktcGhyHgsSB0NvbnRlbnQiEURQV0gtOTE5MTkzMDU2NDYzDA
PUP,"June 27, 2022",Total Population of Recruitment Specialists who works in food retails store,DENIED,RESEARCH / THESIS WRITING,03/10/2020 - 06/27/2022,https://www.foi.gov.ph/requests/aglzfmVmb2ktcGhyHQsSB0NvbnRlbnQiEFBVUC02NTk1NDc0MjczMzkM
LTO,"June 27, 2022",List of registered motorcyles in the province of Aklan,PENDING,Market research,01/01/2021 - 12/31/2021,https://www.foi.gov.ph/requests/aglzfmVmb2ktcGhyHQsSB0NvbnRlbnQiEExUTy0wMjc2MTU2NTY2NTcM
PSA,"June 27, 2022","total population, number of household, sex disaggregation per barangay in Los BaÃ±os, Laguna",SUCCESSFUL,Updating of Tadlac Lake Management Plan,06/27/2022 - 06/27/2022,https://www.foi.gov.ph/requests/aglzfmVmb2ktcGhyHQsSB0NvbnRlbnQiEFBTQS0wNTU1MDY3ODUzNjgM
BIR,"June 27, 2022",Income Tax Return,AWAITING CLARIFICATION,Income Tax Return copy from my previous employer,05/18/2021 - 06/27/2022,https://www.foi.gov.ph/requests/aglzfmVmb2ktcGhyHQsSB0NvbnRlbnQiEEJJUi02NjMwNTU4ODczNjAM
POEA,"June 27, 2022",The number of complaints lodged by OFWs in Poland,PENDING,Research,01/01/2020 - 06/27/2022,https://www.foi.gov.ph/requests/aglzfmVmb2ktcGhyHgsSB0NvbnRlbnQiEVBPRUEtODY3MjM2NTU3OTMyDA
NAP,"June 27, 2022",Deed of Sale with Right to Repurchase,PENDING,Legal Purposes,06/01/1998 - 06/30/1998,https://www.foi.gov.ph/requests/aglzfmVmb2ktcGhyHQsSB0NvbnRlbnQiEE5BUC0xMzQyMTU5MzA5MTYM
CHED,"June 27, 2022",Request for Laptop Assistance for Indigent Student,DENIED,For academic purposes of my college degree,06/25/2022 - 06/25/2022,https://www.foi.gov.ph/requests/aglzfmVmb2ktcGhyHgsSB0NvbnRlbnQiEUNIRUQtNTQ3MTM1NTIyNzM3DA
DSWD,"June 27, 2022",Financial Assistance,DENIED,For debt consolidation due to medical bills,06/27/2022 - 06/27/2022,https://www.foi.gov.ph/requests/aglzfmVmb2ktcGhyHgsSB0NvbnRlbnQiEURTV0QtMzUzNTU5MzE4MzYzDA
DILG,"June 27, 2022",DILG MC NO. 99-65,PENDING,Research,04/23/1999 - 04/23/1999,https://www.foi.gov.ph/requests/aglzfmVmb2ktcGhyHgsSB0NvbnRlbnQiEURJTEctMDE3NjMzNjM3Mjk3DA
CIC,"June 27, 2022",Credit report inquiry,PENDING,To know if I'm eligible for a bank personal loan,01/01/2016 - 06/27/2022,https://www.foi.gov.ph/requests/aglzfmVmb2ktcGhyHQsSB0NvbnRlbnQiEENJQy0wMTY3NDAzMjY5NDUM
DOT,"June 27, 2022",Number of Tourist entering Caticlan Airport,DENIED,Internationalization of Education,01/01/2019 - 05/31/2022,https://www.foi.gov.ph/requests/aglzfmVmb2ktcGhyHQsSB0NvbnRlbnQiEERPVC05MTM0MzYwNTgxMTIM
