agency,date,title,status,purpose,period_covered,link
HDMF,"May 19, 2023",Foreclosed property bid,PENDING,To avail pag ibig housing,05/12/2023 - 05/19/2023,https://www.foi.gov.ph/requests/aglzfmVmb2ktcGhyHgsSB0NvbnRlbnQiEUhETUYtNDUyNjkzODIxODk3DA
DOH,"May 19, 2023",Vaccine card,SUCCESSFUL,Applying work,05/19/2023 - 05/19/2023,https://www.foi.gov.ph/requests/aglzfmVmb2ktcGhyHQsSB0NvbnRlbnQiEERPSC04ODE3OTYzNjk2OTYM
DOE,"May 19, 2023",List of Grid Status Updates from 2019,PENDING,Research,01/01/2019 - 01/01/2023,https://www.foi.gov.ph/requests/aglzfmVmb2ktcGhyHQsSB0NvbnRlbnQiEERPRS0xNDIyOTI2NzU5MzEM
PCG,"May 19, 2023",GUIDELINES ON INVESTIGATION OF MARINE CASUALTIES AND INCIDENTS,PENDING,Research and Information,10/20/2014 - 05/19/2023,https://www.foi.gov.ph/requests/aglzfmVmb2ktcGhyHQsSB0NvbnRlbnQiEFBDRy0xNTk0NDA5MjQ0NTYM
NLP,"May 19, 2023","The Gallery of Heroes located at Luneta Park, Manila",DENIED,Thesis Research,05/19/2013 - 05/19/2023,https://www.foi.gov.ph/requests/aglzfmVmb2ktcGhyHQsSB0NvbnRlbnQiEE5MUC0yNDkxMzE4NDc4ODkM
DOE,"May 19, 2023",2022-2023 Monthly Common Prices of Gas and Diesel,PENDING,Research Study,01/01/2023 - 05/19/2023,https://www.foi.gov.ph/requests/aglzfmVmb2ktcGhyHQsSB0NvbnRlbnQiEERPRS04NTU1NjYwMjIxNzEM
DOH,"May 19, 2023",vaxcert,SUCCESSFUL,Employment,05/19/2023 - 05/19/2023,https://www.foi.gov.ph/requests/aglzfmVmb2ktcGhyHQsSB0NvbnRlbnQiEERPSC00NDY0MzE0NTU1NTYM
DICT,"May 19, 2023",harassment from number 639190763751 continues update,PENDING,To stoo threating from a phising or a scammer.,05/17/2023 - 05/19/2023,https://www.foi.gov.ph/requests/aglzfmVmb2ktcGhyHgsSB0NvbnRlbnQiEURJQ1QtMTc3OTE0NTk3NDc4DA
NTC,"May 19, 2023",Scam,PENDING,To know the identity of person to file a case,09/20/2022 - 09/21/2022,https://www.foi.gov.ph/requests/aglzfmVmb2ktcGhyHQsSB0NvbnRlbnQiEE5UQy0xNTg5NjE1MDIzMjgM
UsaP,"May 19, 2023",Pasig City LCCAP,PENDING,Research and Development,05/19/2023 - 05/19/2023,https://www.foi.gov.ph/requests/aglzfmVmb2ktcGhyHgsSB0NvbnRlbnQiEVVTQVAtMjkzODM0MzMyMjI5DA
NCIP,"May 19, 2023","Effects of Regenerative Tourism to Quality of Life of Aetas in San Felipe, Zambales",ACCEPTED,Research,05/01/2023 - 05/19/2023,https://www.foi.gov.ph/requests/aglzfmVmb2ktcGhyHgsSB0NvbnRlbnQiEU5DSVAtMzk2NjczNDU1NzE4DA
LMB,"May 19, 2023",BBM 14 PAGBILAO CADASTRE,ACCEPTED,"For Vicinity map and lot plan, survey works",05/19/2023 - 05/19/2023,https://www.foi.gov.ph/requests/aglzfmVmb2ktcGhyIQsSB0NvbnRlbnQiFERFTlJMTUItNzkzMTU3MTA3NzA4DA
PSA,"May 19, 2023",Maternal Mortality Rate In Makati City,PENDING,Research and development for our COPAR paper In nursing,05/19/2020 - 05/19/2023,https://www.foi.gov.ph/requests/aglzfmVmb2ktcGhyHQsSB0NvbnRlbnQiEFBTQS02ODAyNzgzNTA1MDgM
LTO,"May 19, 2023",Total Number of Registered Motor Vehicles in Mapandan,SUCCESSFUL,Data requirements for the Compilation of 2018-2022 Provincial Product Accounts (PPA),01/01/2018 - 12/31/2022,https://www.foi.gov.ph/requests/aglzfmVmb2ktcGhyHQsSB0NvbnRlbnQiEExUTy0yNTU1MjgxNTM2OTcM
LTO,"May 19, 2023",Ordinances for the location of motorbike side mirror,PENDING,For guidance purpose only to avoid violation and penalty.,05/31/2022 - 05/19/2023,https://www.foi.gov.ph/requests/aglzfmVmb2ktcGhyHQsSB0NvbnRlbnQiEExUTy0wNjc5MTExNTg2ODkM
PSA,"May 19, 2023",ePhilID Transaction Reference Number (TRN),PARTIALLY SUCCESSFUL,ePhilID,05/19/2023 - 05/19/2023,https://www.foi.gov.ph/requests/aglzfmVmb2ktcGhyHQsSB0NvbnRlbnQiEFBTQS00NDUyOTc1Mjc3MzgM
NTC,"May 19, 2023",A Report on Stolen Phone,PENDING,To report the theft of a mobile phone an assist in its recovery and sim card information protection.,05/18/2023 - 05/18/2023,https://www.foi.gov.ph/requests/aglzfmVmb2ktcGhyHQsSB0NvbnRlbnQiEE5UQy0zMzMzMTU3OTU5OTMM
DOH,"May 19, 2023",Follow-up Status of Vaccination Record Update,SUCCESSFUL,Record Update for VAXCERT for International Flight,01/09/2022 - 06/29/2022,https://www.foi.gov.ph/requests/aglzfmVmb2ktcGhyHQsSB0NvbnRlbnQiEERPSC05OTE2ODE0MzQwMzAM
NTC,"May 19, 2023",Block my daughter's stolen phone and sim.,PENDING,Purpose: To avoid robbers use the device as well as the number associated in it.,03/13/2023 - 03/13/2023,https://www.foi.gov.ph/requests/aglzfmVmb2ktcGhyHQsSB0NvbnRlbnQiEE5UQy0wMDc4NzQ5MDExMjcM
PNP,"May 19, 2023","Reported number of cases of the victim of violence against men, women and children",PENDING,Architectural thesis,01/01/2020 - 12/31/2022,https://www.foi.gov.ph/requests/aglzfmVmb2ktcGhyHQsSB0NvbnRlbnQiEFBOUC01OTcwNzMyMTg3OTgM
DTI,"May 19, 2023",Monthly Historical Prices of Flour [Data Request],REFERRED,Commodity Analysis,01/01/2000 - 05/19/2023,https://www.foi.gov.ph/requests/aglzfmVmb2ktcGhyHQsSB0NvbnRlbnQiEERUSS0xNjE4MzEzMzQzNjIM
DOH,"May 19, 2023",VACCINATION CERTIFICATE,SUCCESSFUL,VISA APPLICATION,05/18/2023 - 05/19/2023,https://www.foi.gov.ph/requests/aglzfmVmb2ktcGhyHQsSB0NvbnRlbnQiEERPSC0wODY4ODU1MDk0MDMM
DepEd,"May 19, 2023",ALS Certificate/Diploma,SUCCESSFUL,College Enrollment,01/01/2019 - 01/19/2020,https://www.foi.gov.ph/requests/aglzfmVmb2ktcGhyHwsSB0NvbnRlbnQiEkRlcEVkLTA4MDA1MTU1NDI3NQw
DOH,"May 19, 2023",The number of women with PCOS in NCR,DENIED,Research,01/01/2022 - 05/19/2023,https://www.foi.gov.ph/requests/aglzfmVmb2ktcGhyHQsSB0NvbnRlbnQiEERPSC03Mzc2ODM5NTQwMzQM
DOH,"May 19, 2023",VACCINATION CERTIFICATE,SUCCESSFUL,VISA or Travel International,05/18/2023 - 05/19/2023,https://www.foi.gov.ph/requests/aglzfmVmb2ktcGhyHQsSB0NvbnRlbnQiEERPSC05MDA5ODAwODQxMzIM
SEC,"May 19, 2023",Harassment from online loaning apps,SUCCESSFUL,To stop Harassment and delete my information,05/01/2023 - 05/19/2023,https://www.foi.gov.ph/requests/aglzfmVmb2ktcGhyHQsSB0NvbnRlbnQiEFNFQy03MDA0OTAxNDg4MTMM
PSA,"May 19, 2023",Household Population by Religious Affiliation,PARTIALLY SUCCESSFUL,Research and Development,05/01/2015 - 05/01/2023,https://www.foi.gov.ph/requests/aglzfmVmb2ktcGhyHQsSB0NvbnRlbnQiEFBTQS02MzIxODQwMjQyMDkM
IC,"May 19, 2023",Loyola - Educational Plan,ACCEPTED,Education plan & hospitalisation bills,01/01/2015 - 01/01/2017,https://www.foi.gov.ph/requests/aglzfmVmb2ktcGhyHAsSB0NvbnRlbnQiD0lDLTc0NjE4ODYyOTM1MAw
PSA,"May 19, 2023",ASPBI data,PENDING,Research,05/19/2023 - 05/19/2023,https://www.foi.gov.ph/requests/aglzfmVmb2ktcGhyHQsSB0NvbnRlbnQiEFBTQS0yMzQyOTI3OTI2NzcM
DOH,"May 19, 2023",Philippine Mental Health Statistics,PENDING,Capstone Design Project -Thesis,05/19/2023 - 05/19/2023,https://www.foi.gov.ph/requests/aglzfmVmb2ktcGhyHQsSB0NvbnRlbnQiEERPSC0wNjc4NDY0MTE2MjMM
PSA,"May 19, 2023",Data on Agricultural Crops per Province,PENDING,Research,05/19/2023 - 05/19/2023,https://www.foi.gov.ph/requests/aglzfmVmb2ktcGhyHQsSB0NvbnRlbnQiEFBTQS00MjAyNjUxMjA4OTcM
PSA,"May 19, 2023",ANNUAL POVERTY INDICATORS SURVEY,SUCCESSFUL,Master's Thesis,05/19/2023 - 05/19/2023,https://www.foi.gov.ph/requests/aglzfmVmb2ktcGhyHQsSB0NvbnRlbnQiEFBTQS01NDYwODIxMjgzMDMM
PSA,"May 19, 2023",ANNUAL POVERTY INDICATORS SURVEY,SUCCESSFUL,For Master's Thesis,05/19/2017 - 05/19/2020,https://www.foi.gov.ph/requests/aglzfmVmb2ktcGhyHQsSB0NvbnRlbnQiEFBTQS0zMjUwNDU5MjQ2NTQM
DOE,"May 19, 2023",Study of Technical Operations of Electric Cooperatives,PENDING,Research Paper,01/01/2017 - 12/31/2022,https://www.foi.gov.ph/requests/aglzfmVmb2ktcGhyHQsSB0NvbnRlbnQiEERPRS0wNjMyMDg3NDEzODQM
LTO,"May 19, 2023",Total #of Registered and Licensed Drivers in Tacurong City Sultan Kudarat,PENDING,"Feasibility Study, Research Study",12/01/2021 - 12/31/2022,https://www.foi.gov.ph/requests/aglzfmVmb2ktcGhyHQsSB0NvbnRlbnQiEExUTy0wODE4MTk2OTIxNzAM
NAMRIA,"May 19, 2023",Land Classification,DENIED,Updating of CLUP,01/01/2016 - 05/17/2023,https://www.foi.gov.ph/requests/aglzfmVmb2ktcGhyJAsSB0NvbnRlbnQiF0RFTlJOQU1SSUEtMzQ3NTM0MzEzMjkzDA
NAPOCOR,"May 19, 2023",Follow up on the GSIS contribution for DAMA claimant,PENDING,Personal Use,01/01/1985 - 03/25/2023,https://www.foi.gov.ph/requests/aglzfmVmb2ktcGhyIQsSB0NvbnRlbnQiFE5BUE9DT1ItNjg0MTczNjE3OTk5DA
GSIS,"May 19, 2023",Status of the remittance from NAPOCOR/PSALM,SUCCESSFUL,Personal Use,01/01/1985 - 03/25/2023,https://www.foi.gov.ph/requests/aglzfmVmb2ktcGhyHgsSB0NvbnRlbnQiEUdTSVMtMDE1NjcyODAyOTc3DA
DOH,"May 19, 2023",VACCINATION CARD,SUCCESSFUL,International Travel,05/18/2023 - 05/19/2023,https://www.foi.gov.ph/requests/aglzfmVmb2ktcGhyHQsSB0NvbnRlbnQiEERPSC0yMDY5MzkwNTU1NzYM
SSS,"May 19, 2023",Death Claims (sss # 3337125192,PENDING,Death claoms for children education,01/19/2023 - 02/19/2023,https://www.foi.gov.ph/requests/aglzfmVmb2ktcGhyHQsSB0NvbnRlbnQiEFNTUy0yNjg2NzQyNDI1MjIM
BAI,"May 19, 2023",Number of cases regarding parasitic infections on domestic animals,PENDING,Research,01/01/2020 - 05/18/2023,https://www.foi.gov.ph/requests/aglzfmVmb2ktcGhyHQsSB0NvbnRlbnQiEEJBSS01NTczMTU3MDA5NDYM
SEC,"May 19, 2023",LEGITEMATE MLM/ DIRECT SELLING COMPANY,ACCEPTED,Personal research for business,01/01/2023 - 05/19/2023,https://www.foi.gov.ph/requests/aglzfmVmb2ktcGhyHQsSB0NvbnRlbnQiEFNFQy05NTEzOTU4NTc1ODIM
MWSS,"May 19, 2023",TAT for Customer Complaint,ACCEPTED,For reference/guidance.,04/19/2023 - 05/19/2023,https://www.foi.gov.ph/requests/aglzfmVmb2ktcGhyHgsSB0NvbnRlbnQiEU1XU1MtMTg0NTAzOTE0MTgyDA
CHED,"May 19, 2023",Requesting for NSTP 2 Serial Number,PENDING,School Requirements,05/19/2023 - 05/19/2023,https://www.foi.gov.ph/requests/aglzfmVmb2ktcGhyHgsSB0NvbnRlbnQiEUNIRUQtMjU1OTg3MTc3OTc4DA
CIC,"May 19, 2023",Request for a copy of all my credit information,PENDING,Personal Use,05/19/2002 - 05/19/2023,https://www.foi.gov.ph/requests/aglzfmVmb2ktcGhyHQsSB0NvbnRlbnQiEENJQy05OTk2MjAzMjQ3MjEM
NBI,"May 19, 2023",Check this lending loan apps,PENDING,Checking this online loan shark,04/02/2023 - 05/19/2023,https://www.foi.gov.ph/requests/aglzfmVmb2ktcGhyHQsSB0NvbnRlbnQiEE5CSS02NzQ4NjgyNjgwNjQM
DOH,"May 19, 2023",Cancellation of Vaxcert,SUCCESSFUL,For international travel.,01/24/2023 - 05/19/2023,https://www.foi.gov.ph/requests/aglzfmVmb2ktcGhyHQsSB0NvbnRlbnQiEERPSC02OTM3OTU2ODY0ODMM
NBI,"May 19, 2023","Reason for always getting ""HIT"" in the clearance application and request for removal",PENDING,Personal Use,05/19/2002 - 05/19/2023,https://www.foi.gov.ph/requests/aglzfmVmb2ktcGhyHQsSB0NvbnRlbnQiEE5CSS00Mjg3MzcxNzcyNDkM
PSA,"May 19, 2023",FIES raw household level data 2015 and 2021,SUCCESSFUL,Research and development,01/01/2015 - 12/31/2021,https://www.foi.gov.ph/requests/aglzfmVmb2ktcGhyHQsSB0NvbnRlbnQiEFBTQS03OTk1NTI3ODc2ODUM
NTC,"May 19, 2023",REALME C35 IMEI/86872106121507,PENDING,Para po mabalik pinundar KO NG 2years para mabili KO. 6 months Lang na gamit,05/08/2023 - 05/19/2023,https://www.foi.gov.ph/requests/aglzfmVmb2ktcGhyHQsSB0NvbnRlbnQiEE5UQy04MjY4NDc3MjIyMTUM
DOH,"May 19, 2023",Vaccertificate,SUCCESSFUL,Employment,05/19/2023 - 05/19/2023,https://www.foi.gov.ph/requests/aglzfmVmb2ktcGhyHQsSB0NvbnRlbnQiEERPSC01MzE4ODg5MTUxNDIM
DOH,"May 19, 2023",Vaccert,SUCCESSFUL,Employment,05/19/2023 - 05/19/2023,https://www.foi.gov.ph/requests/aglzfmVmb2ktcGhyHQsSB0NvbnRlbnQiEERPSC0zOTAyNzkyNjgyNDQM
DepEd,"May 19, 2023",REQUEST OF NAT RESULT,AWAITING CLARIFICATION,For my master degree research,05/19/2019 - 05/19/2023,https://www.foi.gov.ph/requests/aglzfmVmb2ktcGhyHwsSB0NvbnRlbnQiEkRlcEVkLTMzODczNzQ5NTQyMQw
DOLE,"May 19, 2023",ISC - Involuntary Separation Certificate,SUCCESSFUL,Certificate of Involuntary Separation Status,05/17/2023 - 05/18/2023,https://www.foi.gov.ph/requests/aglzfmVmb2ktcGhyHgsSB0NvbnRlbnQiEURPTEUtNzU4NzIxODkxNDc4DA
SSS,"May 19, 2023",Social security System,PENDING,Para sa mga nangangarap Tulad ko na nagiging hadlang ay SI SSS,05/19/2023 - 05/19/2023,https://www.foi.gov.ph/requests/aglzfmVmb2ktcGhyHQsSB0NvbnRlbnQiEFNTUy0yNjAyMDM3ODA5MDAM
PCSO,"May 19, 2023",Documents needed for medical treatment assistance for cancer patient,ACCEPTED,For the upcoming medical treatment (immunotherapy procedure) on June and July 2023,04/01/2023 - 05/19/2023,https://www.foi.gov.ph/requests/aglzfmVmb2ktcGhyHgsSB0NvbnRlbnQiEVBDU08tMTU2NTEzNjQ1NjMwDA
NTC,"May 19, 2023",Assistance for tracking a stolen/lost phone,PENDING,To retrieve my phone by tracking it using IMEI.,05/16/2023 - 05/19/2023,https://www.foi.gov.ph/requests/aglzfmVmb2ktcGhyHQsSB0NvbnRlbnQiEE5UQy0zNDE4MDA5MjEwMTAM
DepEd,"May 19, 2023",Form 137 request,SUCCESSFUL,Graduation,06/01/2011 - 04/30/2021,https://www.foi.gov.ph/requests/aglzfmVmb2ktcGhyHwsSB0NvbnRlbnQiEkRlcEVkLTU1OTM0MDcyNTU2Mww
MMDA,"May 19, 2023",Follow up on #MMDA-581861204375,PARTIALLY SUCCESSFUL,Follow up,03/26/2023 - 03/26/2023,https://www.foi.gov.ph/requests/aglzfmVmb2ktcGhyHgsSB0NvbnRlbnQiEU1NREEtMjMzMTkyODc5ODkwDA
PNP,"May 19, 2023",PNP Blotter Report for suspect margareth rillo employment banned permanent death in PH.,PENDING,PNP Blotter Report for suspect margareth rillo employment banned permanent death in PH.,01/01/2017 - 05/19/2023,https://www.foi.gov.ph/requests/aglzfmVmb2ktcGhyHQsSB0NvbnRlbnQiEFBOUC0yNzk3MjI0ODcwMDIM
NBI,"May 19, 2023",margareth rillo convicted as serial killer real-time blacklisted 42 age permanent death blackout,PENDING,PNP Blotter Report for suspect margareth rillo employment banned permanent death in PH.,01/01/2017 - 05/19/2023,https://www.foi.gov.ph/requests/aglzfmVmb2ktcGhyHQsSB0NvbnRlbnQiEE5CSS02MjU2MDgyODQ1MzMM
PNP,"May 19, 2023",suspect margareth rillo convicted permanent banned or blacklist deceased reported in PNP.,PENDING,PNP Blotter Report for suspect margareth rillo employment banned permanent death in PH.,01/01/2017 - 05/19/2023,https://www.foi.gov.ph/requests/aglzfmVmb2ktcGhyHQsSB0NvbnRlbnQiEFBOUC0yMTUyNzg2NjA4MjAM
DOE,"May 19, 2023",Power shortage,PENDING,Thesis,05/19/2018 - 05/19/2023,https://www.foi.gov.ph/requests/aglzfmVmb2ktcGhyHQsSB0NvbnRlbnQiEERPRS03NDY0NjM3MTQzMzgM
PSA,"May 19, 2023",Number of E-vehicle sold in the visayas island,PENDING,research purposes,05/19/2018 - 05/19/2023,https://www.foi.gov.ph/requests/aglzfmVmb2ktcGhyHQsSB0NvbnRlbnQiEFBTQS00MDIxMzY3NDE0OTAM
DOLE,"May 19, 2023",margareth rillo as dreaded blacklisted hardcoded banned criminal in NCR DOLE,PENDING,PNP Blotter Report for suspect margareth rillo employment banned permanent death in PH.,01/01/2017 - 05/19/2023,https://www.foi.gov.ph/requests/aglzfmVmb2ktcGhyHgsSB0NvbnRlbnQiEURPTEUtMjM0MzExNDU1ODU4DA
BIR,"May 19, 2023",The number of E-bicycle and other e-bicycle alike sold in the visayas,DENIED,Research paper ( Thesis),05/19/2018 - 05/19/2023,https://www.foi.gov.ph/requests/aglzfmVmb2ktcGhyHQsSB0NvbnRlbnQiEEJJUi05ODI0MjI3NzA3NjgM
PNP,"May 19, 2023",ako si margareth rillo serial killer blacklisted sa 77Global PH at JobstreetPH reported in PNP.,PENDING,PNP Blotter Report for suspect margareth rillo employment banned permanent death in PH.,01/01/2017 - 05/19/2023,https://www.foi.gov.ph/requests/aglzfmVmb2ktcGhyHQsSB0NvbnRlbnQiEFBOUC0xMzI1MDM3MjExMzgM
NBI,"May 19, 2023",Reddit blacklist serial killer margareth rillo in the philippines jail,PENDING,PNP Blotter Report for suspect margareth rillo employment banned permanent death in PH.,01/01/2017 - 05/19/2023,https://www.foi.gov.ph/requests/aglzfmVmb2ktcGhyHQsSB0NvbnRlbnQiEE5CSS02MTc3NDk2MzE2NzcM
LTO,"May 19, 2023",Region X Number of Registered vehicles,SUCCESSFUL,Feasibility Study,01/01/2023 - 01/31/2023,https://www.foi.gov.ph/requests/aglzfmVmb2ktcGhyHQsSB0NvbnRlbnQiEExUTy04ODUxNDA5NzczMTAM
DOLE,"May 19, 2023",margareth rillo convicted as serial killer real-time blacklisted blackout employment banned in DOLE,PENDING,PNP Blotter Report for suspect margareth rillo employment banned permanent death in PH.,01/01/2017 - 05/19/2023,https://www.foi.gov.ph/requests/aglzfmVmb2ktcGhyHgsSB0NvbnRlbnQiEURPTEUtMTYwODAwNzkzODY1DA
DepEd,"May 19, 2023",Statistics of Enrolled Students and Out-of-School Youths in Zamboanga City for SY 2021-2022,AWAITING CLARIFICATION,Academic Endeavors and Research Purposes,06/01/2021 - 05/31/2022,https://www.foi.gov.ph/requests/aglzfmVmb2ktcGhyHwsSB0NvbnRlbnQiEkRlcEVkLTg4MTQ2NzkwMDg3Mww
NBI,"May 19, 2023","margareth rillo,Jen,carol,maxima the lords flock charismatic witchcraft group serial killer real.",PENDING,PNP Blotter Report for suspect margareth rillo employment banned permanent death in PH.,01/01/2017 - 05/19/2023,https://www.foi.gov.ph/requests/aglzfmVmb2ktcGhyHQsSB0NvbnRlbnQiEE5CSS02NjUxNzEzOTg1NjUM
NBI,"May 19, 2023",margareth rillo real-time blacklisted under luisa beltran and girlie javier account 77GlobalPH-ADB.,PENDING,PNP Blotter Report for suspect margareth rillo employment banned permanent death in PH.,01/01/2017 - 05/19/2023,https://www.foi.gov.ph/requests/aglzfmVmb2ktcGhyHQsSB0NvbnRlbnQiEE5CSS0zMTc0MjQ1OTQzMTQM
BULSU,"May 19, 2023",Transcript of Records,ACCEPTED,Employment Purposes,05/13/2004 - 06/30/2007,https://www.foi.gov.ph/requests/aglzfmVmb2ktcGhyHwsSB0NvbnRlbnQiEkJVTFNVLTk3MzI2MTQ2ODYyNAw
NTC,"May 19, 2023",My Mobile phone stolen,PENDING,My device has been stolen my registered sims and 2 ID's also stolen. please help.,05/18/2023 - 05/19/2023,https://www.foi.gov.ph/requests/aglzfmVmb2ktcGhyHQsSB0NvbnRlbnQiEE5UQy01MTg1MTU1NDgzMTEM
PNP,"May 19, 2023",blacklist serial killer margareth rillo versus Ma.Rossette Palo filed PNP murder blotter complaint,PENDING,PNP Blotter Report for suspect margareth rillo employment banned permanent death in PH.,01/01/2017 - 05/19/2023,https://www.foi.gov.ph/requests/aglzfmVmb2ktcGhyHQsSB0NvbnRlbnQiEFBOUC05NDkyMjE5Mjg4NDQM
NBI,"May 19, 2023",serial killer margareth rillo versus Girlie Claire A. Javier file blotter theft murder report,PENDING,PNP Blotter Report for suspect margareth rillo employment banned permanent death in PH.,01/01/2017 - 05/19/2023,https://www.foi.gov.ph/requests/aglzfmVmb2ktcGhyHQsSB0NvbnRlbnQiEE5CSS05NTU5MjMyMzM5ODQM
NBI,"May 19, 2023",suspected serial killer margareth rillo in San Juan Manila real-time ban 77GlobalPH 6329157747,PENDING,PNP Blotter Report for suspect margareth rillo employment banned permanent death in PH.,01/01/2017 - 05/19/2023,https://www.foi.gov.ph/requests/aglzfmVmb2ktcGhyHQsSB0NvbnRlbnQiEE5CSS01MjM2MjEyNDYwNTYM
NBI,"May 19, 2023",margareth rillo family convicted serial killer involve in spiritual witchcraft occultism in PH.,PENDING,PNP Blotter Report for suspect margareth rillo employment banned permanent death in PH.,01/01/2017 - 05/19/2023,https://www.foi.gov.ph/requests/aglzfmVmb2ktcGhyHQsSB0NvbnRlbnQiEE5CSS02NjM4ODYxMzUwODIM
NTC,"May 19, 2023",Harassment and threatening,PENDING,To know the name and location to file a case in the court,05/13/2023 - 05/19/2023,https://www.foi.gov.ph/requests/aglzfmVmb2ktcGhyHQsSB0NvbnRlbnQiEE5UQy0zNDY4MzExMjQ2MDIM
NBI,"May 19, 2023",margareth rillo convicted as serial killer real-time blacklisted banned in 77GlobalPh blackout,PENDING,PNP Blotter Report for suspect margareth rillo employment banned permanent death in PH.,01/01/2017 - 05/19/2023,https://www.foi.gov.ph/requests/aglzfmVmb2ktcGhyHQsSB0NvbnRlbnQiEE5CSS0xNTA0NzczNzAwMzYM
BALWAD,"May 19, 2023",Raw Septage Quality Historical Data,ACCEPTED,Feasibility Study,05/19/2023 - 05/19/2023,https://www.foi.gov.ph/requests/aglzfmVmb2ktcGhyIAsSB0NvbnRlbnQiE0JBTFdBRC04MzE1NDkyNjQ1MTkM
PSA,"May 19, 2023",Statistics of Women PDL in the Philippines and Region 10,PENDING,Research Purposes,01/01/2018 - 01/01/2023,https://www.foi.gov.ph/requests/aglzfmVmb2ktcGhyHQsSB0NvbnRlbnQiEFBTQS01OTQ1ODQyODgwODAM
PCW,"May 19, 2023",The number of women with PCOS in NCR,REFERRED,Research,01/01/2022 - 05/19/2023,https://www.foi.gov.ph/requests/aglzfmVmb2ktcGhyHQsSB0NvbnRlbnQiEFBDVy03MTg1OTkzMjg5ODkM
NBI,"May 19, 2023",554 rejecting banned content margareth rillo real-time blacklisted employment banned in 77GlobalPH,PENDING,PNP Blotter Report for suspect margareth rillo employment banned permanent death in PH.,01/01/2017 - 05/19/2023,https://www.foi.gov.ph/requests/aglzfmVmb2ktcGhyHQsSB0NvbnRlbnQiEE5CSS02NjQwOTgwMTc0NDMM
NBI,"May 19, 2023",margareth rillo convicted permanently banned real-time blacklist in PH companies for theft/robbery,PENDING,PNP Blotter Report for suspect margareth rillo employment banned permanent death in PH.,01/01/2017 - 05/19/2023,https://www.foi.gov.ph/requests/aglzfmVmb2ktcGhyHQsSB0NvbnRlbnQiEE5CSS0wNjczMjE0ODMwNDcM
NBI,"May 19, 2023",margareth rillo witchcraft group serial killer real in philippines,PENDING,PNP Blotter Report for suspect margareth rillo employment banned permanent death in PH.,01/01/2017 - 05/19/2023,https://www.foi.gov.ph/requests/aglzfmVmb2ktcGhyHQsSB0NvbnRlbnQiEE5CSS05ODcyMzEyOTk1MDYM
NTC,"May 19, 2023",LOST IPHONE,PENDING,FIND MY LOST IPHONE,05/18/2023 - 05/18/2023,https://www.foi.gov.ph/requests/aglzfmVmb2ktcGhyHQsSB0NvbnRlbnQiEE5UQy01MzcyMDI0MTEwMTQM
NBI,"May 19, 2023","margareth rillo,Jen,carol,maxima the lords flock charismatic witchcraft group serial killer real.",PENDING,PNP Blotter Report for suspect margareth rillo employment banned permanent death in PH.,01/01/2017 - 05/19/2023,https://www.foi.gov.ph/requests/aglzfmVmb2ktcGhyHQsSB0NvbnRlbnQiEE5CSS01MjA1OTI2NTYxNDkM
NBI,"May 19, 2023",primary serial killer margareth rillo blacklisted in JobstreetPH companies.,PENDING,PNP Blotter Report for suspect margareth rillo employment banned permanent death in PH.,01/01/2017 - 05/19/2023,https://www.foi.gov.ph/requests/aglzfmVmb2ktcGhyHQsSB0NvbnRlbnQiEE5CSS0zOTk4NjQwNjc5ODcM
NBI,"May 19, 2023",permanent lifetime banned margareth rillo convicted serial killer blacklisted in the Philippines,PENDING,PNP Blotter Report for suspect margareth rillo employment banned permanent death in PH.,01/01/2017 - 05/19/2023,https://www.foi.gov.ph/requests/aglzfmVmb2ktcGhyHQsSB0NvbnRlbnQiEE5CSS04NDI2MTQyODA1MzAM
ECC,"May 18, 2023",ECC follow up,SUCCESSFUL,follow up of release of check,10/01/2021 - 12/31/2021,https://www.foi.gov.ph/requests/aglzfmVmb2ktcGhyHQsSB0NvbnRlbnQiEEVDQy0xODA1ODE4ODMwNTEM
DOLE,"May 18, 2023",The number of minimum wage earners in General Santos City as of 2023 or any updated year.,REFERRED,Research Paper,01/31/2022 - 01/31/2023,https://www.foi.gov.ph/requests/aglzfmVmb2ktcGhyHgsSB0NvbnRlbnQiEURPTEUtODUxMDI3Nzc2NDE1DA
PRC,"May 18, 2023",NMC United Kingdon Registration Verification,DENIED,employment,05/16/2023 - 05/18/2023,https://www.foi.gov.ph/requests/aglzfmVmb2ktcGhyHQsSB0NvbnRlbnQiEFBSQy0zNjM0ODQzMTA4NjMM
DILG,"May 18, 2023",List of cities that needs Libraries in the Philippines,PENDING,Architectural Thesis,04/18/2023 - 05/18/2023,https://www.foi.gov.ph/requests/aglzfmVmb2ktcGhyHgsSB0NvbnRlbnQiEURJTEctNDQzMjczMjUwNjM0DA
NTC,"May 18, 2023",to block my stolen imei phone and sim card,PENDING,please block my stolen imei simcard and phone.,05/18/2023 - 05/18/2023,https://www.foi.gov.ph/requests/aglzfmVmb2ktcGhyHQsSB0NvbnRlbnQiEE5UQy0xMTM5MDkzMDkxMzQM
AMLCS,"May 18, 2023",Anti-Money Laundering,AWAITING CLARIFICATION,As a proof on my package,05/01/2023 - 05/18/2023,https://www.foi.gov.ph/requests/aglzfmVmb2ktcGhyHwsSB0NvbnRlbnQiEkFNTENTLTQwOTk0ODY5OTMzMgw
GAB,"May 18, 2023",Number of Esports player in the Philippines,PENDING,Thesis proposal for Academic purposes,05/13/2021 - 05/13/2023,https://www.foi.gov.ph/requests/aglzfmVmb2ktcGhyHQsSB0NvbnRlbnQiEEdBQi00MDE2NjA0MjYxMzQM
NTC,"May 18, 2023",Block/deactivate my IMEI,PENDING,To deactivate the phone that was stolen from me,05/18/2023 - 05/18/2023,https://www.foi.gov.ph/requests/aglzfmVmb2ktcGhyHQsSB0NvbnRlbnQiEE5UQy0yMTUxMDI0NjE1MDMM
SSS,"May 18, 2023",Disclosure Statement On Loan/Credit Transaction,PENDING,Requirement of employer,04/30/2023 - 05/16/2023,https://www.foi.gov.ph/requests/aglzfmVmb2ktcGhyHQsSB0NvbnRlbnQiEFNTUy0wNTI1NTQ0NTk0MTkM
DTI,"May 18, 2023","""Import and Export Rates in Each Region of the Philippines""",REFERRED,Map-making Project,01/01/2000 - 05/01/2023,https://www.foi.gov.ph/requests/aglzfmVmb2ktcGhyHQsSB0NvbnRlbnQiEERUSS04MzQwMDA5MDk2MjcM
DTI,"May 18, 2023","""Import and Export Rates in Each Region of the Philippines""",REFERRED,Map-making Project,01/01/2000 - 05/01/2023,https://www.foi.gov.ph/requests/aglzfmVmb2ktcGhyHQsSB0NvbnRlbnQiEERUSS02MDMwOTQ5MzQ0OTEM
RTU,"May 18, 2023",Enrolled students in RTU Boni,PENDING,Policy Paper in Partial Fulfillment of Requirements for the Degree of Bachelor of Science in Busine,08/01/2022 - 05/18/2023,https://www.foi.gov.ph/requests/aglzfmVmb2ktcGhyHQsSB0NvbnRlbnQiEFJUVS0wNzk0ODkzODc4NTMM
NHCP,"May 18, 2023",Diocesan Shrine and Parish of San Agustin Church de Masinloc - Zambales,PARTIALLY SUCCESSFUL,Thesis,05/18/2023 - 05/18/2023,https://www.foi.gov.ph/requests/aglzfmVmb2ktcGhyHgsSB0NvbnRlbnQiEU5IQ1AtMTMzODQyODQ4NjczDA
DOH,"May 18, 2023",NCMH,PROCESSING,Thesis,01/01/2018 - 05/18/2023,https://www.foi.gov.ph/requests/aglzfmVmb2ktcGhyHQsSB0NvbnRlbnQiEERPSC0xOTk1OTA4NzE4NjUM
DENR FMB,"May 18, 2023",Map of Forestland in the philippines.,PENDING,Research and Development,05/18/2023 - 05/18/2023,https://www.foi.gov.ph/requests/aglzfmVmb2ktcGhyIQsSB0NvbnRlbnQiFERFTlJGTUItNTI3MTYzMTE2MDQwDA
IC,"May 18, 2023","IC Exam Results May 6, 2023",ACCEPTED,To check if I pass the IC Examination,05/06/2023 - 05/06/2023,https://www.foi.gov.ph/requests/aglzfmVmb2ktcGhyHAsSB0NvbnRlbnQiD0lDLTA4MTM0NzQ0NzA4Mgw
PSA,"May 18, 2023",number of organizations that provide funding for youth initiative projects,PENDING,Research and development,05/18/2023 - 05/18/2023,https://www.foi.gov.ph/requests/aglzfmVmb2ktcGhyHQsSB0NvbnRlbnQiEFBTQS0xNzIyMzU0NTEzMDcM
NBI,"May 18, 2023",Facebook Online Scam,PENDING,Dispute to pay loan processed by an online scammer on my behalf,05/06/2023 - 05/07/2023,https://www.foi.gov.ph/requests/aglzfmVmb2ktcGhyHQsSB0NvbnRlbnQiEE5CSS03OTEzOTk3NDU4MjEM
CVSU,"May 18, 2023",Turnover rates of LGU employees in Cavite,PENDING,Research and development,01/30/2022 - 05/18/2023,https://www.foi.gov.ph/requests/aglzfmVmb2ktcGhyHgsSB0NvbnRlbnQiEUNWU1UtMTM1MzU3OTg5NTIzDA
LMB,"May 18, 2023",The Number and Distribution of Remote Areas in the Philippines by Province in 2023,ACCEPTED,Map-making Project,01/01/0000 - 01/01/2023,https://www.foi.gov.ph/requests/aglzfmVmb2ktcGhyIQsSB0NvbnRlbnQiFERFTlJMTUItMDU2OTYxNzA2NDY3DA
