agency,date,title,status,purpose,period_covered,link
LMB,"June 19, 2023","BLLM 1, Pagbilao Cadastre",ACCEPTED,research and development,06/01/2023 - 06/19/2023,https://www.foi.gov.ph/requests/aglzfmVmb2ktcGhyIQsSB0NvbnRlbnQiFERFTlJMTUItNDM3MTgzNjA4MzAwDA
LMB,"June 19, 2023",Pagbilao Cadastre benchmarks,ACCEPTED,Research & Dev,06/01/2023 - 06/19/2023,https://www.foi.gov.ph/requests/aglzfmVmb2ktcGhyIQsSB0NvbnRlbnQiFERFTlJMTUItNDA4NTkyMTQ1NDkwDA
PSA,"June 19, 2023","The number of household per baranggay in Trece Martires City, Cavite",PENDING,Research and Development,01/01/2022 - 06/19/2023,https://www.foi.gov.ph/requests/aglzfmVmb2ktcGhyHQsSB0NvbnRlbnQiEFBTQS0xNTgzMjAyNjExNDQM
LMB,"June 19, 2023","BBM 98, Tayabas Cadastre",ACCEPTED,Research & Dev,06/01/2023 - 06/19/2023,https://www.foi.gov.ph/requests/aglzfmVmb2ktcGhyIQsSB0NvbnRlbnQiFERFTlJMTUItODE3MTA1OTMyMjg3DA
BIR,"June 19, 2023",BIR 2316,AWAITING CLARIFICATION,Bank Loan,06/18/2016 - 06/18/2023,https://www.foi.gov.ph/requests/aglzfmVmb2ktcGhyHQsSB0NvbnRlbnQiEEJJUi01OTMwNzcwMDE2NjcM
BIR,"June 19, 2023",ITR 2019,DENIED,Skills assessment,01/01/2019 - 12/31/2019,https://www.foi.gov.ph/requests/aglzfmVmb2ktcGhyHQsSB0NvbnRlbnQiEEJJUi05NjYzNjY5Mjc1MTAM
CHED,"June 19, 2023",List of Local Colleges and Universities granted the Institutional Recognition in NCR,PENDING,Research,01/01/2023 - 06/15/2023,https://www.foi.gov.ph/requests/aglzfmVmb2ktcGhyHgsSB0NvbnRlbnQiEUNIRUQtODg2NzEwOTkxNTI1DA
BIR,"June 19, 2023",ITR 2019 from January - December 2019,DENIED,Skills assessment in Australia,01/01/2019 - 12/31/2019,https://www.foi.gov.ph/requests/aglzfmVmb2ktcGhyHQsSB0NvbnRlbnQiEEJJUi0wMzg4NTY1ODQ1MjYM
PHLPost,"June 19, 2023",Postal money order,PENDING,Maternity,05/01/2023 - 06/19/2023,https://www.foi.gov.ph/requests/aglzfmVmb2ktcGhyIQsSB0NvbnRlbnQiFFBITFBvc3QtMDE1NDg3NjAyMzgwDA
BIR,"June 19, 2023",Update TIN Number,SUCCESSFUL,Wrong TIN number 432-650-003(Wrong) 452-653-003(Correct),05/16/2022 - 06/01/2023,https://www.foi.gov.ph/requests/aglzfmVmb2ktcGhyHQsSB0NvbnRlbnQiEEJJUi00Mjg3NTkwMzcxMjQM
SBMA,"June 19, 2023",Subic Clark Railway Project Update,DENIED,Company Research,05/01/2023 - 05/31/2023,https://www.foi.gov.ph/requests/aglzfmVmb2ktcGhyHgsSB0NvbnRlbnQiEVNCTUEtMjAxMTc4MTA1MTQ3DA
NBI,"June 19, 2023",Report a scammer,DENIED,"To investigate, prosecute and retrieve the cash",05/19/2023 - 06/19/2023,https://www.foi.gov.ph/requests/aglzfmVmb2ktcGhyHQsSB0NvbnRlbnQiEE5CSS03MjYxNTg3NjE1NzMM
DOH,"June 19, 2023",vaccine certificate,SUCCESSFUL,vaccine certificate update and request,12/05/2022 - 06/19/2023,https://www.foi.gov.ph/requests/aglzfmVmb2ktcGhyHQsSB0NvbnRlbnQiEERPSC00NTQ0ODE5NzkzNTgM
NTC,"June 19, 2023",Request to disable stolen phone,PARTIALLY SUCCESSFUL,For my stolen phone to be disable.,06/19/2023 - 06/19/2023,https://www.foi.gov.ph/requests/aglzfmVmb2ktcGhyHQsSB0NvbnRlbnQiEE5UQy0zOTYyMTg1NjM5NDUM
DOE,"June 19, 2023",LPG Players with Valid SCC nationwide as of 12/31/2022,AWAITING CLARIFICATION,Research,01/01/2022 - 12/31/2022,https://www.foi.gov.ph/requests/aglzfmVmb2ktcGhyHQsSB0NvbnRlbnQiEERPRS01NjA4NzQ5MDI0OTcM
NBI,"June 19, 2023",Amazon task distribution online scan,DENIED,NA,05/19/2023 - 06/19/2023,https://www.foi.gov.ph/requests/aglzfmVmb2ktcGhyHQsSB0NvbnRlbnQiEE5CSS03MjMyOTMzMTYzOTUM
PSA,"June 19, 2023",Philippine Identification Card,PARTIALLY SUCCESSFUL,I lost the ID,06/19/2023 - 06/19/2023,https://www.foi.gov.ph/requests/aglzfmVmb2ktcGhyHQsSB0NvbnRlbnQiEFBTQS00Nzk4OTIyMTEzMTUM
HSAC,"June 19, 2023",Master Deed of Restriction of the Joya Loft and Towers project by Rockwell Corporation,PENDING,Legal purposes,06/19/2010 - 06/19/2023,https://www.foi.gov.ph/requests/aglzfmVmb2ktcGhyHgsSB0NvbnRlbnQiEUhTQUMtMzM5NjA2NjQ0NTA1DA
NTC,"June 19, 2023",Stolen Phone,PARTIALLY SUCCESSFUL,To block my phone,09/24/2020 - 06/15/2023,https://www.foi.gov.ph/requests/aglzfmVmb2ktcGhyHQsSB0NvbnRlbnQiEE5UQy05MzQ2NTI1MjgyNzAM
DOH,"June 19, 2023",RESEARCH ON MENTAL HEALTH,SUCCESSFUL,RESEARCH,01/01/2018 - 06/19/2023,https://www.foi.gov.ph/requests/aglzfmVmb2ktcGhyHQsSB0NvbnRlbnQiEERPSC00ODkyNDczMTczMzEM
BIR,"June 19, 2023",Form 2316,AWAITING CLARIFICATION,Visa Application,01/01/2022 - 04/30/2023,https://www.foi.gov.ph/requests/aglzfmVmb2ktcGhyHQsSB0NvbnRlbnQiEEJJUi04MzA0ODk5NjExMjUM
LTO,"June 19, 2023",OR/CR follow up,PENDING,Para po magamit ko na po ang aking motor sa png hanap buhay. Salamat po,04/14/2023 - 06/18/2023,https://www.foi.gov.ph/requests/aglzfmVmb2ktcGhyHQsSB0NvbnRlbnQiEExUTy00NDEwMzcxMTkyMzQM
PEZA,"June 19, 2023",DSA Circular as of May 2023,PENDING,For foreign travel of our employees.,05/01/2023 - 05/31/2023,https://www.foi.gov.ph/requests/aglzfmVmb2ktcGhyHgsSB0NvbnRlbnQiEVBFWkEtNzQwMzU1NDA4MDQ4DA
DepEd,"June 19, 2023",Master list of Private and Public School Cainta and Antipolo,AWAITING CLARIFICATION,Enrichment program/Music Lessons,06/19/2023 - 06/19/2023,https://www.foi.gov.ph/requests/aglzfmVmb2ktcGhyHwsSB0NvbnRlbnQiEkRlcEVkLTczMTc1MjEwMTgzMQw
PRC,"June 19, 2023",PRC LUPON,ACCEPTED,For Work and DOH inspection,04/04/2022 - 06/19/2023,https://www.foi.gov.ph/requests/aglzfmVmb2ktcGhyHQsSB0NvbnRlbnQiEFBSQy04ODI4MjM3MTgzMTMM
PSA,"June 19, 2023",Lost PhilSys Tracking Slip,PARTIALLY SUCCESSFUL,National ID,09/30/2021 - 06/19/2023,https://www.foi.gov.ph/requests/aglzfmVmb2ktcGhyHQsSB0NvbnRlbnQiEFBTQS0zNTIzODA5ODQ5MTgM
NTC,"June 19, 2023",REQUEST FOR IMMEDIATE BLOCKING OF PHONE AND DEACTIVATION OF SIM CARDS OF MY MOTHERS STOLEN PHONE,PARTIALLY SUCCESSFUL,REQUEST FOR IMMEDIATE BLOCKING OF PHONE AND DEACTIVATION OF SIM CARDS OF MY MOTHERS STOLEN PHONE,06/19/2022 - 06/19/2023,https://www.foi.gov.ph/requests/aglzfmVmb2ktcGhyHQsSB0NvbnRlbnQiEE5UQy04MTQxMjk3NzExMTYM
DepEd,"June 19, 2023",list of private school,AWAITING CLARIFICATION,"Enrichment program/Music Lessons (Voice, Piano, Guitar, Drum Lessons etc.)",06/19/2023 - 06/19/2023,https://www.foi.gov.ph/requests/aglzfmVmb2ktcGhyHwsSB0NvbnRlbnQiEkRlcEVkLTM3MDk2ODUwMDUzMww
BSWM,"June 19, 2023","Rizal, Palawan data",PROCESSING,Strategic planning and Forecasting,06/08/2022 - 06/08/2023,https://www.foi.gov.ph/requests/aglzfmVmb2ktcGhyHgsSB0NvbnRlbnQiEUJTV00tNjgxMDgzMjgzMzg2DA
DSWD,"June 19, 2023","List and Number of Day Care Centers, CD Teachers, and CD Workers in Cebu per LGU per Brgy",AWAITING CLARIFICATION,Research,01/01/2022 - 05/31/2023,https://www.foi.gov.ph/requests/aglzfmVmb2ktcGhyHgsSB0NvbnRlbnQiEURTV0QtMTk2Njk2NjA5ODEwDA
PaPA,"June 19, 2023",KAHILINGAN PARA SA PAGLAYA NG AMING TATAY,DENIED,PARA MAKALAYA NA ANG AMING TATAY,05/01/2018 - 06/19/2023,https://www.foi.gov.ph/requests/aglzfmVmb2ktcGhyHgsSB0NvbnRlbnQiEVBhUEEtNjkxNTkxNzkwNTg4DA
IC,"June 19, 2023",Certificate of IC Exam,SUCCESSFUL,Personal copy,07/01/2016 - 10/16/2016,https://www.foi.gov.ph/requests/aglzfmVmb2ktcGhyHAsSB0NvbnRlbnQiD0lDLTM5NjM3MjM5MDA5NQw
BIR,"June 19, 2023",BIR form 2316,AWAITING CLARIFICATION,I need it for my pre-employment requirement,01/01/2022 - 12/31/2022,https://www.foi.gov.ph/requests/aglzfmVmb2ktcGhyHQsSB0NvbnRlbnQiEEJJUi02NTY2NzE4MDg1MDcM
NTC,"June 19, 2023",Request for permit,PENDING,Release of Items (iPads) in customs,06/19/2023 - 06/19/2023,https://www.foi.gov.ph/requests/aglzfmVmb2ktcGhyHQsSB0NvbnRlbnQiEE5UQy04MDQ0NTU5NjQ4MDUM
CHED,"June 19, 2023",Requesting a Laptop for School Purposes,DENIED,I am reaching out to you in hopes that you could help me in acquiring a laptop for my school purpose,06/18/2023 - 06/19/2023,https://www.foi.gov.ph/requests/aglzfmVmb2ktcGhyHgsSB0NvbnRlbnQiEUNIRUQtODg1ODAzODgxODYyDA
BIR,"June 19, 2023",Requesting for ITR 2316,AWAITING CLARIFICATION,Proof of Employment History.,03/01/2008 - 03/30/2023,https://www.foi.gov.ph/requests/aglzfmVmb2ktcGhyHQsSB0NvbnRlbnQiEEJJUi0yMTA2NzUzMzQ1MDEM
NAMRIA,"June 19, 2023","Digital Elevation Model of San Juan River, Metro Manila",DENIED,Research,01/01/2023 - 06/19/2023,https://www.foi.gov.ph/requests/aglzfmVmb2ktcGhyJAsSB0NvbnRlbnQiF0RFTlJOQU1SSUEtODA5MzA1MzMyMDY5DA
PNP,"June 19, 2023",Criminal case verification,DENIED,Just a verification,01/01/2021 - 06/19/2023,https://www.foi.gov.ph/requests/aglzfmVmb2ktcGhyHQsSB0NvbnRlbnQiEFBOUC01MzQ5NDYyODc0NzYM
SSS,"June 19, 2023",I have SSS online account but i forgot my user id and password,DENIED,User ID and Password,10/08/2022 - 06/19/2023,https://www.foi.gov.ph/requests/aglzfmVmb2ktcGhyHQsSB0NvbnRlbnQiEFNTUy0xNzYxOTYwNTM5NDQM
DBM,"June 19, 2023",Section 8 of EO 77,SUCCESSFUL,Travel Allowance,06/19/2023 - 06/19/2023,https://www.foi.gov.ph/requests/aglzfmVmb2ktcGhyHQsSB0NvbnRlbnQiEERCTS04MzEyNTkzNjQ3NDkM
LEGAZPI,"June 19, 2023",Comprehensive Land Use Plan,PENDING,Thesis Proposal,06/19/2023 - 06/19/2023,https://www.foi.gov.ph/requests/aglzfmVmb2ktcGhyIQsSB0NvbnRlbnQiFExFR0FaUEktNzE0MDA2ODM0MDc3DA
CHED,"June 19, 2023",certification of a degree obtained in foreign school (Master in Science),ACCEPTED,Promotion,10/01/2014 - 09/30/2016,https://www.foi.gov.ph/requests/aglzfmVmb2ktcGhyHgsSB0NvbnRlbnQiEUNIRUQtMTU1MTgxOTMwOTAxDA
LTO,"June 19, 2023",traffic offense among motorcylce riders,PENDING,thesis,01/01/2022 - 06/09/2023,https://www.foi.gov.ph/requests/aglzfmVmb2ktcGhyHQsSB0NvbnRlbnQiEExUTy0zMDk1NTg3ODc0NjYM
MMDA,"June 19, 2023",motorcycle rider traffic offense,AWAITING CLARIFICATION,Thesis,01/01/2022 - 06/19/2023,https://www.foi.gov.ph/requests/aglzfmVmb2ktcGhyHgsSB0NvbnRlbnQiEU1NREEtNjA2OTc5Mjg3MjA1DA
NAMRIA,"June 19, 2023",Digital Elevation Model (DEM) of Leyte,DENIED,BSCE - 4 Research,04/01/2022 - 06/19/2023,https://www.foi.gov.ph/requests/aglzfmVmb2ktcGhyJAsSB0NvbnRlbnQiF0RFTlJOQU1SSUEtMjg2NTgzMDM4Mjk2DA
NBI,"June 19, 2023",Recruiter ng pinoy papuntang abroad,DENIED,"Complaint research , filing a complaint",04/22/2023 - 06/19/2023,https://www.foi.gov.ph/requests/aglzfmVmb2ktcGhyHQsSB0NvbnRlbnQiEE5CSS05Mjc0ODU3NTMyMDcM
DTI,"June 19, 2023",List of Service Providers for AFSS and FDAS,DENIED,For Procurement of AFSS & FDAS,01/01/2022 - 06/19/2023,https://www.foi.gov.ph/requests/aglzfmVmb2ktcGhyHQsSB0NvbnRlbnQiEERUSS03MjIyODI1NTY2NDMM
PSA,"June 19, 2023",Lost national id,PARTIALLY SUCCESSFUL,Need another national ID.,04/25/2023 - 06/19/2023,https://www.foi.gov.ph/requests/aglzfmVmb2ktcGhyHQsSB0NvbnRlbnQiEFBTQS04MTM4MzQyMTIyODMM
UsaP,"June 19, 2023",Board Resolution No. 2023-03-08 and MOA,ACCEPTED,Research and development,03/01/2023 - 06/19/2023,https://www.foi.gov.ph/requests/aglzfmVmb2ktcGhyHgsSB0NvbnRlbnQiEVVTQVAtODg2NDM5NTUwODM2DA
MGB,"June 19, 2023",Documents Relative to the MPSA of Ipilan/CNMEC in Palawan,PARTIALLY SUCCESSFUL,For transparency purposes upon the request of the indigenous communities concerned.,06/19/2019 - 06/19/2023,https://www.foi.gov.ph/requests/aglzfmVmb2ktcGhyHQsSB0NvbnRlbnQiEE1HQi01NzQ4MTAzODMxNjQM
DENR EMB,"June 19, 2023",Remediation Projects in Manila Bay,SUCCESSFUL,For undergraduate thesis purposes,01/01/2018 - 12/20/2022,https://www.foi.gov.ph/requests/aglzfmVmb2ktcGhyIQsSB0NvbnRlbnQiFERFTlJFTUItODY5MjkzODE1MzE5DA
DENR EMB,"June 19, 2023",Guidelines for Recycling Facility,SUCCESSFUL,Research,01/01/2022 - 06/18/2023,https://www.foi.gov.ph/requests/aglzfmVmb2ktcGhyIQsSB0NvbnRlbnQiFERFTlJFTUItNjM2MTc1NjU1NDI0DA
CHED,"June 19, 2023",Transcript of record,ACCEPTED,For New school,08/19/2020 - 05/19/2022,https://www.foi.gov.ph/requests/aglzfmVmb2ktcGhyHgsSB0NvbnRlbnQiEUNIRUQtNDY2ODI1ODgzODQwDA
LLDA,"June 19, 2023",Historical Water Quality of Laguna de Bay from 1990,AWAITING CLARIFICATION,Evaluating the performance of a Water Treatment Plant abstracting water from Laguna de Bay,01/01/1990 - 05/31/2023,https://www.foi.gov.ph/requests/aglzfmVmb2ktcGhyIgsSB0NvbnRlbnQiFURFTlJMTERBLTcxODEyNzAxMjgzNAw
TRB,"June 19, 2023",Latest Alignment of C6 from Rodriguez Rizal to San Jose Del Monte and percentage of completion,AWAITING CLARIFICATION,Travel - Shortcut,01/01/2023 - 06/19/2023,https://www.foi.gov.ph/requests/aglzfmVmb2ktcGhyHQsSB0NvbnRlbnQiEFRSQi00MzA2MzI2Mjc0NzcM
DOH,"June 19, 2023","Number of reported Chronic wound, operation/Incision, and burn cases in the Philippines",PROCESSING,Research/study,01/01/2022 - 12/31/2022,https://www.foi.gov.ph/requests/aglzfmVmb2ktcGhyHQsSB0NvbnRlbnQiEERPSC02NDQ5NDU3NTAwNTkM
NAMRIA,"June 19, 2023",Comprehensive Land Use Plan,REFERRED,Thesis Proposal,06/19/2023 - 06/19/2023,https://www.foi.gov.ph/requests/aglzfmVmb2ktcGhyJAsSB0NvbnRlbnQiF0RFTlJOQU1SSUEtNDc0ODkxMjc3MDA2DA
DOH,"June 19, 2023",Reported cases of child abuse in Batangas,DENIED,Thesis,01/01/2020 - 06/01/2023,https://www.foi.gov.ph/requests/aglzfmVmb2ktcGhyHQsSB0NvbnRlbnQiEERPSC00MTQ2NDIwMDUxMDgM
DOH,"June 19, 2023",Wrong Birthdate on my Vaccination Card,SUCCESSFUL,Change Birthdate on my Vaccination Card,06/19/2023 - 06/19/2023,https://www.foi.gov.ph/requests/aglzfmVmb2ktcGhyHQsSB0NvbnRlbnQiEERPSC02NzcxOTU2MTA2MTgM
DBM,"June 19, 2023",Requesting Financial Assistance,SUCCESSFUL,Infrastructure & Development of Barangay,01/01/2023 - 06/19/2023,https://www.foi.gov.ph/requests/aglzfmVmb2ktcGhyHQsSB0NvbnRlbnQiEERCTS00NTQ2NTg2NjQ4MjkM
LTO,"June 19, 2023",Motorcycle OR/CR,PENDING,Request for assistance,05/20/2023 - 06/19/2023,https://www.foi.gov.ph/requests/aglzfmVmb2ktcGhyHQsSB0NvbnRlbnQiEExUTy0xODk3OTk5NTMzNTIM
CHED,"June 19, 2023",Number of Higher Education Graduates who started their own business/enterprise.,DENIED,Academic Research,06/16/2023 - 06/16/2023,https://www.foi.gov.ph/requests/aglzfmVmb2ktcGhyHgsSB0NvbnRlbnQiEUNIRUQtMzg5ODUyNDcyNzcxDA
NBI,"June 19, 2023",Office Job Vacancies,SUCCESSFUL,Office Job Opportunity,06/19/2023 - 06/19/2023,https://www.foi.gov.ph/requests/aglzfmVmb2ktcGhyHQsSB0NvbnRlbnQiEE5CSS02MDc5MjAwNDcyMjQM
PNP,"June 19, 2023",Request for Refund (Double Payment) - Police Clearance,SUCCESSFUL,Employment,06/13/2023 - 06/14/2023,https://www.foi.gov.ph/requests/aglzfmVmb2ktcGhyHQsSB0NvbnRlbnQiEFBOUC03OTIxMTIyNTkwODUM
DENR EMB,"June 19, 2023",EIA of 4PH program in San Jose del Monte Bulacan,DENIED,Research Study and Academic Requirement,06/16/2023 - 06/16/2023,https://www.foi.gov.ph/requests/aglzfmVmb2ktcGhyIQsSB0NvbnRlbnQiFERFTlJFTUItNTcxMTE0NjExNzc5DA
PSA,"June 19, 2023",Number of Dried mango sales in the Philippines,PENDING,Undergraduate Research - University of the Philippines Visayas,06/17/2023 - 06/17/2023,https://www.foi.gov.ph/requests/aglzfmVmb2ktcGhyHQsSB0NvbnRlbnQiEFBTQS0wMjI5MzM4MzMyOTYM
DOH,"June 19, 2023",Request for Update of VaxCert,SUCCESSFUL,Travel,06/19/2023 - 06/19/2023,https://www.foi.gov.ph/requests/aglzfmVmb2ktcGhyHQsSB0NvbnRlbnQiEERPSC00Mzc0NTk3MDg1MTQM
LTO,"June 19, 2023",Total Number of Car and Motor registered in Pangasinan categorized per City/Municipality,SUCCESSFUL,"Feasibility Study of putting-up Car Wash in Dalanguiring, Urbiztondo, Pngasinan",01/01/2021 - 06/19/2023,https://www.foi.gov.ph/requests/aglzfmVmb2ktcGhyHQsSB0NvbnRlbnQiEExUTy0zOTk1OTc4MDcyNTQM
PSA,"June 19, 2023","Statistics of Socio-economic status of families in Montalban, Rizal",PENDING,Architectural Thesis,06/19/2023 - 06/19/2023,https://www.foi.gov.ph/requests/aglzfmVmb2ktcGhyHQsSB0NvbnRlbnQiEFBTQS0wNjk5ODc5NzMxNTYM
DFA,"June 19, 2023",PASSPORT,DENIED,PASSPORT APPLICATION,05/01/2023 - 06/19/2023,https://www.foi.gov.ph/requests/aglzfmVmb2ktcGhyHQsSB0NvbnRlbnQiEERGQS0xOTAyMjQ5NDYxMjAM
DPWH,"June 19, 2023",Latest Alignment of C6 from Rodriguez Rizal to San Jose Del Monte and percentage of completion,REFERRED,Travel - Shortcut,01/01/2023 - 06/19/2023,https://www.foi.gov.ph/requests/aglzfmVmb2ktcGhyHgsSB0NvbnRlbnQiEURQV0gtMTU5MDYwMzM1Nzg1DA
IC,"June 19, 2023",Insurance Commission Exam Results,SUCCESSFUL,FOR IMMEDIATE CODING,06/19/2023 - 06/19/2023,https://www.foi.gov.ph/requests/aglzfmVmb2ktcGhyHAsSB0NvbnRlbnQiD0lDLTI5MjQ0MDM4NzkxOQw
NTC,"June 19, 2023",Philippine Cable TV and Digital Terrestrial TV Providers and Subscribers for 2023,PENDING,Research,01/01/2023 - 06/19/2023,https://www.foi.gov.ph/requests/aglzfmVmb2ktcGhyHQsSB0NvbnRlbnQiEE5UQy03NjQzMzI2MDQ4NTYM
DOTr,"June 19, 2023",Locations of MRT7 Stations,PENDING,Real Estate Investment,01/01/2021 - 06/19/2023,https://www.foi.gov.ph/requests/aglzfmVmb2ktcGhyHgsSB0NvbnRlbnQiEURPVHItMDUzMjczNTAyMDY2DA
DOH,"June 19, 2023",my second dose booster,SUCCESSFUL,for my filling,06/01/2022 - 11/01/2022,https://www.foi.gov.ph/requests/aglzfmVmb2ktcGhyHQsSB0NvbnRlbnQiEERPSC03Mjk5NDAyNDgwMjQM
PSA,"June 19, 2023",Birth Certificate,PARTIALLY SUCCESSFUL,BIRTH CERT. for HEALTH INSURANCE,05/31/2023 - 06/19/2023,https://www.foi.gov.ph/requests/aglzfmVmb2ktcGhyHQsSB0NvbnRlbnQiEFBTQS01MDI5MDYzODYyNDMM
NAP,"June 19, 2023","Registros Notariales (1948-1950) Bato, Camarines Sur, Azul, Lupercio Y.",DENIED,For Research and Reference Purposes.,01/01/1948 - 12/31/1950,https://www.foi.gov.ph/requests/aglzfmVmb2ktcGhyHQsSB0NvbnRlbnQiEE5BUC0xMzgzNDA5NzA4NzEM
DOH,"June 19, 2023",Vax Cert,SUCCESSFUL,Follow-up Request to Update Vax Cert,12/17/2021 - 07/12/2022,https://www.foi.gov.ph/requests/aglzfmVmb2ktcGhyHQsSB0NvbnRlbnQiEERPSC02MzcyOTgxMjE0NzMM
PAGASA,"June 19, 2023",Climate and Climate Projections,SUCCESSFUL,Formulation and Drafting of the Land Use Plan of the Local Government of Talavera,01/01/2020 - 06/19/2023,https://www.foi.gov.ph/requests/aglzfmVmb2ktcGhyIAsSB0NvbnRlbnQiE1BBR0FTQS05ODA1NDk2MDEwNjAM
DSWD,"June 19, 2023",Number of Household Beneficiary of NHTS per Municipality/City and per Brgy level,AWAITING CLARIFICATION,Research,01/01/2022 - 05/31/2023,https://www.foi.gov.ph/requests/aglzfmVmb2ktcGhyHgsSB0NvbnRlbnQiEURTV0QtNjMzMTU4NDAxNDgxDA
NTC,"June 19, 2023",Stolen Phone (Redmi note 10,PARTIALLY SUCCESSFUL,To deactivate my phone and sim cards,06/19/2023 - 06/19/2023,https://www.foi.gov.ph/requests/aglzfmVmb2ktcGhyHQsSB0NvbnRlbnQiEE5UQy0xMTcxMTQwMjM5MTYM
DepEd,"June 19, 2023",Form 138 Request,SUCCESSFUL,for College Admission,03/25/2011 - 03/25/2011,https://www.foi.gov.ph/requests/aglzfmVmb2ktcGhyHwsSB0NvbnRlbnQiEkRlcEVkLTI4OTcyODA2MjE1NQw
PCSO,"June 19, 2023",Tulong pinansyal para sa aking pamangkin.,SUCCESSFUL,makatulong para sa mga pang medical na pangangailangan,05/19/2023 - 06/01/2023,https://www.foi.gov.ph/requests/aglzfmVmb2ktcGhyHgsSB0NvbnRlbnQiEVBDU08tNTE2Mzg3MTU1MjYxDA
DSWD,"June 19, 2023",Reported cases of child abuse in Batangas,REFERRED,Thesis,01/01/2020 - 06/01/2023,https://www.foi.gov.ph/requests/aglzfmVmb2ktcGhyHgsSB0NvbnRlbnQiEURTV0QtOTY3ODg5NzAzNDc0DA
NCIP,"June 19, 2023",History of Lands in Villa Libertad El Nido Palawan,ACCEPTED,Research Related,01/01/1980 - 06/13/2023,https://www.foi.gov.ph/requests/aglzfmVmb2ktcGhyHgsSB0NvbnRlbnQiEU5DSVAtMTc5ODgyMjAzOTUwDA
PAGASA,"June 19, 2023",ainfall Intensity -Duration- Frequency (RIDF) from the Nearest Station to Tawi-tawi Island,SUCCESSFUL,Research and Development,06/19/2023 - 06/19/2023,https://www.foi.gov.ph/requests/aglzfmVmb2ktcGhyIAsSB0NvbnRlbnQiE1BBR0FTQS0xMTIxMTY1MTU1NzEM
DOTr,"June 19, 2023",Modern Jeepney Franchise License Cost,PENDING,Feasibility Study,01/01/2020 - 06/19/2023,https://www.foi.gov.ph/requests/aglzfmVmb2ktcGhyHgsSB0NvbnRlbnQiEURPVHItODcxNjUwNTgzNzgyDA
DA,"June 19, 2023","Rizal, Palawan data",REFERRED,Strategic planning and Forecasting,06/08/2022 - 06/08/2023,https://www.foi.gov.ph/requests/aglzfmVmb2ktcGhyHAsSB0NvbnRlbnQiD0RBLTY2Nzc5NDEyMDUyNQw
CHED,"June 19, 2023",NSTP serial number,ACCEPTED,Graduation requirement,06/19/2023 - 06/19/2023,https://www.foi.gov.ph/requests/aglzfmVmb2ktcGhyHgsSB0NvbnRlbnQiEUNIRUQtMzEzNjYxNTg2Mjg3DA
LTO,"June 19, 2023",Modernized Jeep Franchise Fee,REFERRED,Feasibility Study,01/01/2020 - 12/31/2022,https://www.foi.gov.ph/requests/aglzfmVmb2ktcGhyHQsSB0NvbnRlbnQiEExUTy01MjQ3MTk3MzQ3NzIM
LTFRB,"June 19, 2023",Franchise Fee,PENDING,Feasibility Study,01/01/2020 - 12/31/2022,https://www.foi.gov.ph/requests/aglzfmVmb2ktcGhyHwsSB0NvbnRlbnQiEkxURlJCLTMzMjA0NjI3NTEzMgw
HSAC,"June 19, 2023","Taytay, Rizal Plans and Maps",PENDING,Undergraduate Thesis,01/01/2017 - 06/19/2023,https://www.foi.gov.ph/requests/aglzfmVmb2ktcGhyHgsSB0NvbnRlbnQiEUhTQUMtMTAzODE0ODk0NzExDA
MIAA,"June 19, 2023","Number of Airline passengers per nationality, point of origin, and airport entry point (2020-2023)",REFERRED,College Requirement (Tourism Profile for Pasay),01/01/2020 - 06/19/2023,https://www.foi.gov.ph/requests/aglzfmVmb2ktcGhyHgsSB0NvbnRlbnQiEU1JQUEtMzM4Mjc3ODEyMzc1DA
DFA,"June 19, 2023",Reschedule of DFA Appointment,DENIED,Reschedule of DFA Appointment,06/19/2023 - 06/19/2023,https://www.foi.gov.ph/requests/aglzfmVmb2ktcGhyHQsSB0NvbnRlbnQiEERGQS04MTIxNTE0MDAzMDkM
BIR,"June 19, 2023",Draft amendments to Revenue Regulation 2-98,SUCCESSFUL,Research,04/21/2023 - 05/02/2023,https://www.foi.gov.ph/requests/aglzfmVmb2ktcGhyHQsSB0NvbnRlbnQiEEJJUi02ODE4Mjg0MTU2OTEM
DFA,"June 19, 2023",Reschedule of DFA Appointment,DENIED,Reschedule of DFA Appointment,06/19/2023 - 06/19/2023,https://www.foi.gov.ph/requests/aglzfmVmb2ktcGhyHQsSB0NvbnRlbnQiEERGQS0yMDEyNzE4NDE5OTIM
DOT,"June 19, 2023","List of Tourism Destination Practicing Corporate Social Responsibility (CSR) in San Juan, Batangas",AWAITING CLARIFICATION,For Thesis Purposes,06/01/2020 - 06/01/2023,https://www.foi.gov.ph/requests/aglzfmVmb2ktcGhyHQsSB0NvbnRlbnQiEERPVC03NzA1MzI0MTYyODUM
BIR,"June 19, 2023",Income tax return,AWAITING CLARIFICATION,Personal,01/01/2022 - 12/31/2022,https://www.foi.gov.ph/requests/aglzfmVmb2ktcGhyHQsSB0NvbnRlbnQiEEJJUi04MzE1OTc4NDc4MTMM
DENR,"June 19, 2023",Documents Relative to the MPSA of Ipilan/CNMEC in Palawan,REFERRED,For transparency purposes upon the request of the indigenous communities concerned.,06/19/2019 - 06/19/2023,https://www.foi.gov.ph/requests/aglzfmVmb2ktcGhyHgsSB0NvbnRlbnQiEURFTlItNzIxOTc3MjExOTQxDA
NTC,"June 19, 2023",Request for blocking of stolen phone,PARTIALLY SUCCESSFUL,To block and prevent the use of stonlen phone,06/19/2023 - 06/19/2023,https://www.foi.gov.ph/requests/aglzfmVmb2ktcGhyHQsSB0NvbnRlbnQiEE5UQy0wMzc0MDk3NDI5MzYM
DOH,"June 19, 2023",Master list of children 0-23 months,DENIED,Research and Development,01/01/2023 - 06/19/2023,https://www.foi.gov.ph/requests/aglzfmVmb2ktcGhyHQsSB0NvbnRlbnQiEERPSC03MjQ3MjYxMjUzODkM
NTC,"June 19, 2023",Lost Vivo Y35 (Stolen by someone),PARTIALLY SUCCESSFUL,To report,06/19/2023 - 06/19/2023,https://www.foi.gov.ph/requests/aglzfmVmb2ktcGhyHQsSB0NvbnRlbnQiEE5UQy0xODk1NTY0NTQxNjcM
NTC,"June 19, 2023",Phone stolen Redmi 10c,PARTIALLY SUCCESSFUL,Ipa blocked uung phone ng di magamit,06/17/2023 - 06/19/2023,https://www.foi.gov.ph/requests/aglzfmVmb2ktcGhyHQsSB0NvbnRlbnQiEE5UQy05MzkyNjY2ODc1OTYM
TESDA,"June 19, 2023",TESDA Enrollment and Completion Unaggregated Numbers,ACCEPTED,Research and Development,12/31/2022 - 06/19/2023,https://www.foi.gov.ph/requests/aglzfmVmb2ktcGhyHwsSB0NvbnRlbnQiElRFU0RBLTQ1OTcyNzQxOTk2Ngw
DOLE,"June 19, 2023",List of Farmers Association Registered in DOLE,DENIED,Record of our office,01/01/2017 - 06/19/2023,https://www.foi.gov.ph/requests/aglzfmVmb2ktcGhyHgsSB0NvbnRlbnQiEURPTEUtMzc3MjIxNDk0MzczDA
DOH,"June 19, 2023",Wrong Birthday - Rodulfo Bolondro Jr. (Vaccination Card),SUCCESSFUL,Vaccination Card,06/25/2021 - 06/19/2023,https://www.foi.gov.ph/requests/aglzfmVmb2ktcGhyHQsSB0NvbnRlbnQiEERPSC02OTY1MTIxODIxMDAM
NCIP,"June 19, 2023",NCIP Documents relative to the FPIC/CP Process of Ipilan Nickel Corporation (INC),DENIED,For transparency purposes as requested by the indigenous communities concerned,03/31/2006 - 06/19/2023,https://www.foi.gov.ph/requests/aglzfmVmb2ktcGhyHgsSB0NvbnRlbnQiEU5DSVAtNzEzMDAxMTM1ODc0DA
UsaP,"June 19, 2023",Financial Statement of Pamantasan ng Lungsod ng Pasig,ACCEPTED,Policy Research,01/01/2012 - 12/31/2022,https://www.foi.gov.ph/requests/aglzfmVmb2ktcGhyHgsSB0NvbnRlbnQiEVVTQVAtMzk5NTI0MDE4MTY2DA
BIR,"June 19, 2023",TIN VERIFICATION,DENIED,Employment Purpose,06/19/2023 - 06/19/2023,https://www.foi.gov.ph/requests/aglzfmVmb2ktcGhyHQsSB0NvbnRlbnQiEEJJUi0wMTc0MjgxMDUwNDMM
DFA,"June 19, 2023",DSA as of June 2023,SUCCESSFUL,For the computation of DSA allowed during foreign travel of government employees.,06/01/2023 - 06/19/2023,https://www.foi.gov.ph/requests/aglzfmVmb2ktcGhyHQsSB0NvbnRlbnQiEERGQS03Mzg1MTQ5NTQyMTcM
BIR,"June 19, 2023",Income Tax Return,DENIED,Visa Application,11/15/2022 - 06/15/2023,https://www.foi.gov.ph/requests/aglzfmVmb2ktcGhyHQsSB0NvbnRlbnQiEEJJUi05NDA1MTg3NjcxNDIM
PUP,"June 19, 2023",Higher Education Facilities Planning Manual (CHED Building Requirements for Colleges),DENIED,Research and Development,06/19/2023 - 06/19/2023,https://www.foi.gov.ph/requests/aglzfmVmb2ktcGhyHQsSB0NvbnRlbnQiEFBVUC0wOTg1NzgxNzQ0ODUM
NTC,"June 19, 2023",Stolen iPhone X with sim,PARTIALLY SUCCESSFUL,Blocked the cellphone and deactivate the sim,06/17/2023 - 06/19/2023,https://www.foi.gov.ph/requests/aglzfmVmb2ktcGhyHQsSB0NvbnRlbnQiEE5UQy0zNjMxNTY3MzE3MTQM
BIR,"June 19, 2023",CERTIFICATE OF COMPENSATION PAYMENT/ TAX WITHHELD,AWAITING CLARIFICATION,Educational Purposes,01/01/2021 - 01/01/2022,https://www.foi.gov.ph/requests/aglzfmVmb2ktcGhyHQsSB0NvbnRlbnQiEEJJUi05MDM0ODU0MTgyMDIM
DepEd,"June 19, 2023",SHS transcript from (2016-2020),SUCCESSFUL,For job hunting and future education purposes,01/01/2016 - 06/01/2020,https://www.foi.gov.ph/requests/aglzfmVmb2ktcGhyHwsSB0NvbnRlbnQiEkRlcEVkLTk4NzQxNTQyMTY1Mgw
PSA,"June 19, 2023",Marriage Certificate (PSA COPY),PARTIALLY SUCCESSFUL,Reference,04/27/2023 - 06/19/2023,https://www.foi.gov.ph/requests/aglzfmVmb2ktcGhyHQsSB0NvbnRlbnQiEFBTQS0yMjE3MzczNzc5NjAM
BIR,"June 19, 2023",BIR Form 2316,AWAITING CLARIFICATION,I will need it as proof of employment to my visa.,01/04/2016 - 12/31/2021,https://www.foi.gov.ph/requests/aglzfmVmb2ktcGhyHQsSB0NvbnRlbnQiEEJJUi05MzM3NzQ4MDQwNDcM
NBI,"June 19, 2023",Facebook Scammer Joan Mae Cruz on Facebook and Messenger,DENIED,To investigate and retrieve funds,06/18/2023 - 06/18/2023,https://www.foi.gov.ph/requests/aglzfmVmb2ktcGhyHQsSB0NvbnRlbnQiEE5CSS01NDMyMTY3OTUxODUM
DepEd,"June 19, 2023",Request for NCAE result,SUCCESSFUL,To pursue my studies,06/19/2023 - 06/19/2023,https://www.foi.gov.ph/requests/aglzfmVmb2ktcGhyHwsSB0NvbnRlbnQiEkRlcEVkLTAyMDI4OTY1MDMxOAw
